User Name,Review Time,Rating,clean_text,Tipe,Kelas,Nama_Hotel,AI_Sentiment,AI_Aspek
laalya alya,2025,5,pengalaman menginap yang sangat berkesan buat keluarga kami di hotel terbaik barat ini area kolam renangnya bersih dan aman untuk anak anak jadi mereka betah sekali air kamarnya juga cukup luas dan sirkulasi udaranya bagus jadi tidak terasa pengap lokasinya juga strategis ya mau cari makan atau keperluan anak di luar jadi mudah sekali terima kasih buat mbak dan mas staf yang sudah sangat sabar melayani kami pasti akan menjadi langganan jika kami berkunjung ke sini lagi,BUMN,Bintang 5,BWPremiereBandung,positive,Kebersihan & Kenyamanan Kamar
Bikinonar,2025,5,menginap 3 hari di best western la grande karena ada pekerjaan di bandung awal masuk udah disambut full smile semua dari keamanan belldrive resepsionis untuk kamar bintang 4 secara keseluruhan oke sih dari ac air panas kulkas pemanas udara buat kopi teh semua oke kamarnya juga bersih wangi layanan kamar pembersihan juga memuaskan setiap hari dibersihkan dan benar-benar bersih menu sarapan banyak banget sampai bingung mau makan apa hehehe rasanya juga enak suka banget sama makanan indonesia nya kolam renang air panas gym keren lmyan ada lengkap spa juga sih ini hotel terimakasih terbaik barat la grande,BUMN,Bintang 5,BWPremiereBandung,positive,Kebersihan & Kenyamanan Kamar
galih alfarizi,2025,5,hotelnya strategis di tengah kota dan dekat mana mana staf semuanya ramah dan murah senyum kualitas dan fasilitas kamar sangat bagus mulai dari kebersihan ac minibar alat pemanas air mandi semua tidak ada kendala menu sarapan sangat bervariasi dan rasanya juga enak suka banget sama menu tradisional makanan nya kolam renang udara hangat gym jadi tempat favorit selama menginap terimakasih terbaik barat premier la grande,BUMN,Bintang 5,BWPremiereBandung,positive,Kebersihan & Kenyamanan Kamar
Irene Dema Anggraeni,2025,5,kamarnya luas banget dan bersih petugasnya semua ramah ramah makanannya enak dan banyak pilihannya saat menginap disana dapet cemilan gratis sore selama 2 hari cemilan khas bandung tempatnya juga strategis dekey buat kemana mana layaknya itu,BUMN,Bintang 5,BWPremiereBandung,positive,Kebersihan & Kenyamanan Kamar
Aditya Nurcholiscin Saputra,2025,5,Setiap ke bandung pasti tinggal di best western la grande gatau kenapa udah nyaman saja jika tinggal di sini staf ramah semua kamar juga bersih wangi rapih yang paling penting air panas ac minibar semuanya oke tanpa ada masalah sama kopi teh set lengkap menu sarapan juga lengkap dan enak staf resto juga duduk set kalau bantu antar makanan ke meja tempat favorit ya kolam renang udara hangat nya enak kalau pulang kerja santai di kolam terima kasih terbaik western,BUMN,Bintang 5,BWPremiereBandung,positive,Kebersihan & Kenyamanan Kamar
Nabilla Adzani,2025,5,lokasi strategis di tengah pusat kota jadi mudah dan dekat kemanapun kamarnya bersih nyaman fasilitas lengkap pelayanannya juga sangat ramah makanan di restoran bermacam macam dan pastinya enak semua pasti akan kembali lagi untuk menginap di best western,BUMN,Bintang 5,BWPremiereBandung,positive,Kebersihan & Kenyamanan Kamar
Nuy Nurjanah,2025,5,hotel yang sangat baik lokasi strategis dekat pusat kota kuliner dan pusat belanja kamar yang bersih fasilitas lengkap ac dingin dan pemandangan kota sarapan buffet nya lengkap nusantara sampai barat lingkungan bersih parkir lumayan nyaman,BUMN,Bintang 5,BWPremiereBandung,positive,Kebersihan & Kenyamanan Kamar
Rusmini Ratna,2025,5,pengalaman pertama menginap tidak mengecewakan saya tinggal bersama keluarga saya pelayanannya tidak mengecewakan sepertinya jika saya berlibur hanya untuk diam dikamar pun saya bisa karna senyaman itu sarapannya juga enak dan beragam pokonya yang terbaik banget deh,BUMN,Bintang 5,BWPremiereBandung,positive,Kualitas Makanan & Restoran
andini dini,2025,5,tinggal disini begitu nyaman kamarnyaa bersih rapi pokonya bikin betah deh apalagi view nya yang langsung ke kota bandung banget nginep disini dijamin sii jalan jalan terus soalnya lokasi nya deket kemana mana mana soo itu benar-benar nyaman secara keseluruhan nilai harga ini akan berulang tinggal pasti,BUMN,Bintang 5,BWPremiereBandung,positive,Kebersihan & Kenyamanan Kamar
Lesmana,2025,5,kamarnya saya suka bersih apalagi sama viewnya saya menginap selama 2 malam nyaman banget sama pelayanannya cepat kolam renangnya enak banget udara hangat,BUMN,Bintang 5,BWPremiereBandung,positive,Kebersihan & Kenyamanan Kamar
Wita Sari,2025,5,hotel dengan letak yang sangat strategis sekali tepat di depan nya bip kanan kirinya banyak tempat makan dan jajanan kamar nya nyaman sekali luas kasur nya king koil empuk sekali terdapat kursi dapet view ke jalan kamar mandi luas fasilitas lenhkap kolam renang nya indoor nya jadi nyaman sekali tidak panas sarapan nya terbaik banget lengkap sekali sampai menu barat juga ada dan enak enak sekali yang terbaik siy nginep disini ditambah dengan mendapatkan harga promo dari ota,BUMN,Bintang 5,BWPremiereBandung,positive,Lokasi & Akses Strategis
Novie Pratiwi Suparno,2025,5,Semuanya sempurna dan super nyaman dengan pemandangan terbaik ke gunung bagian terbaik adalah tentu saja layanan dari proses pemesanan ke tim restoran semua orang ramah membantu dan solusi berorientasi satu-satunya kelemahan adalah ruang parkir terbatas jika Anda datang dengan mobil tetapi mereka menawarkan layanan pelayan gratis sehingga cukup banyak memecahkan masalah,BUMN,Bintang 5,BWPremiereBandung,positive,Pelayanan Staf & Keramahan
Laurentia l,2025,5,tempatnya bersih nyaman kamarnya karyawan semua ramah dan membantu minusnya paling variasi makanannya kurang begitu banyak untuk hotel bintang 4 saat sarapan kurang ada daging sapi jg bervariasiinya atau jenis masakan ayam dan sayurnya kurang banyak rasanya sih enak cm tidak gt beda bervariasiinya selama 2 hari menginap semoga ke depan semakin baik lagi semakin sukses ya,BUMN,Bintang 5,BWPremiereBandung,positive,Pelayanan Staf & Keramahan
adri ilyas,2025,5,Salah satu pengalaman menginap terbaik paling menyenangkan dari dateng ada makanan es gratis kolam renang udara hangat jam brapa saja berenang tidak masalah karena semi indoor terima kasih atas pelayanan yang ramah sejak valet mobil cek masuk sampai cek keluarnya,BUMN,Bintang 5,BWPremiereBandung,positive,Pelayanan Staf & Keramahan
Rayhan Hasibuan,2025,4,lokasi di depan bip dan di tengah kota cukup mudah untuk mencari tempat makan dan wisata hanya parkir sangat terbatas karena bergabung dengan apartemen jadi disarankan untuk titip kunci di lobi saat sarapan kurang nyaman karena ruangan agak panas dan bau sesegera mungkin karena pintu dapur terbuka,BUMN,Bintang 5,BWPremiereBandung,positive,Lokasi & Akses Strategis
Khrisna Setiawan,2025,5,lokasi strategis kondisi hotel sangat bersih terawat seluruh staf melayani tamu dengan sangat ramah yang istimewa adalah kolam renang udara hangat,BUMN,Bintang 5,BWPremiereBandung,positive,Pelayanan Staf & Keramahan
Ken_RBLX,2025,5,letak hotel yang sangat strategis di kota bandung dekat dengan tempat belanja kuliner oleh2 sangat cocok untuk beristirahat bersama keluarga selain itu staf kamar juga ramah baik terima kasih mba naima sudah membantu saat kami menginap di best western premiere la grande,BUMN,Bintang 5,BWPremiereBandung,positive,Lokasi & Akses Strategis
Yulita Mira,2025,3,saya menginap di hari akhir pekan dan memesan eksekutif ganda dengan tarif sekitar 19 juta net untuk satu malam jujur kamarnya luas dan bersih meskipun interiornya terlihat tua dengan tingkat kesulitan parkir yang cukup wow sulit review sbb pendapat pribadi makanan standar saja untuk kelas hotel berbintang 4 penyajian makanan tidak menarik layanan staf hotel restoran standar saja saya tidak merasa mereka ramah ya standar saja seperlunya keamanan sangat membantu saya malam datang dan mereka dengan sigap mencari saya parkir sampai menunggu di parkir yang kosong secara keseluruhan hotel ini memiliki lokasi yang sangat strategis untuk berbelanja di mall dan berbelanja di bandung karena memang dekat dengan pusat perbelanjaan serta menjadi,BUMN,Bintang 5,BWPremiereBandung,negative,Kebersihan & Kenyamanan Kamar
Ainu Faisal,2025,5,memiliki tinggal yang sangat baik di terbaik premier barat la grande hotel bandung staf sangat ramah makanan itu lezat dan layanan yang sangat baik saya beruntung untuk mendapatkan upgrade kamar gratis dan mereka bahkan mengejutkan kami dengan ulang tahun salam dan kue benar-benar membuat perjalanan ekstra khusus kamar itu bersih dan nyaman lokasi yang sempurna masuk pusat kota dan sarapan memiliki banyak variasi pasti merekomendasikan hotel ini jika Anda sedang mengunjungi bandung akan senang tinggal di sini lagi jika masih tersedia haha,BUMN,Bintang 5,BWPremiereBandung,positive,Pelayanan Staf & Keramahan
Gani Kurniawan,2025,5,best western premier la grande hotel adalah salah satu hotel ramah anak bandung yang mewah hotel bintang empat ini memiliki ruang keluarga dan kolam renang anak cocok untukmu yang akan menginap bersama keluarga fasilitas dan layanan lain yang disediakan seperti restoran resepsionis 24 jam keamanan 24 jam pusat kebugaran spa layanan pijat kolam air panas dalam dan sebagainya best western premier la grande hotel terletak dekat pusat elektronik bandung bec jaraknya hanya 104 meter dari taman sejarah bandung dan 997 meter dari stasiun bandung kamu bisa mengajak anak mengunjungi taman tersebut jika si kecil mulai melihat jenuh tersebut,BUMN,Bintang 5,BWPremiereBandung,positive,Fasilitas Hotel (Kolam/Gym/Spa)
Rahmawan Irwan,2025,5,kami sekeluarga sangat senang sekali menginap di hotel terbaik barat bandung staf2 sangat ramah sekali fasilitas sudah cukup oke kebersihan kamar jg sudah terjaga dengan baik udara hangat kolam yang bikin anak betah berenang walaupun nda beberapa kekurangan pada fasilitas kolam renang kolam tidak cukup besar keramik dasar kolam sudah ada yang lepas berbahaya buat pengunjung u kamar sudah oke tapi akan lebih baik jk tvnya sudah smart tv sarapan jg sudah oke sangat bervariasi rasanya jg enak anak2 jg suka oh yah mhn dibuatkan fasilitas u anak seperti bermain tanah atau sekedar kamar ruang zona anak anak biar bisa mengeksplorasi bermain lokasi jg sangat strategis dtengah,BUMN,Bintang 5,BWPremiereBandung,positive,Kebersihan & Kenyamanan Kamar
Hery Yuwono,2025,5,Saya sangat terkesan terhadap layanan yang diberikan oleh kru petugas hotel terbaik barat premier ini petugas sangat hambel sopan ramah dan cepat respon membantu pelanggan tamu hotel semoga semakin ditingkatkan atas layanan yang sudah sangat baik ini lain kali semoga bisa tinggal di hotel terbaik barat premier ini lagi,BUMN,Bintang 5,BWPremiereBandung,positive,Pelayanan Staf & Keramahan
Roy M G,2025,5,lokasi startegis depan bip parkiriran sempit tapi disediakan lembah gratis kamar luas dan bersih internet lancar pilihan tivi sedikit staf ramah sarapan variatif mulai lokal hingga barat,BUMN,Bintang 5,BWPremiereBandung,positive,Kebersihan & Kenyamanan Kamar
Farida Rahma,2025,5,Saya memiliki pengalaman yang menyenangkan tinggal di terbaik Western Premier La Grande kamar tidak hanya bersih dan terorganisir baik tetapi juga memiliki suasana hangat dan ramah desain terasa modern namun nyaman dan semua yang saya butuhkan tersedia itu adalah tempat yang sempurna untuk bersantai setelah menjelajahi kota saya benar-benar menikmati menginap saya dan dengan senang hati akan merekomendasikan hotel ini kepada orang lain,BUMN,Bintang 5,BWPremiereBandung,positive,Kebersihan & Kenyamanan Kamar
Gilar Sundara,2025,5,Dari dalam kamar disuguhi pemandangan tengah kota bandung yang menakjubkan hijaunya pepohonan taman balaikota menenangkan mata tamunya pun dari mancanegara pelayanannya pun responsif akses ke masjid agung al ukhuwah cukup dekat ketika azan pagi terdengar jalan kaki dari hotel dan sesampainya di masjid masih ada sekitar 4 menit sebelum salat jamaah dimulai di gedungnya terdapat kfc dan ke belakangnya bisa ada akses keluar menyambung ke jl purnawarman mall bec soes merdeka,BUMN,Bintang 5,BWPremiereBandung,positive,Lokasi & Akses Strategis
desda yetti,2025,5,Dua hr yll nginap di best western premier bandung sangat puas dn berkesan hotelnya bersih nyaman bisa renang juga dn petugasnya ramah2 deket ke tmpat kulineran jka ada waktu dn kesempatan ke bandung ingin nginap lagi di best western premier la grande bandung,BUMN,Bintang 5,BWPremiereBandung,positive,Kebersihan & Kenyamanan Kamar
Indra Wardhana,2025,5,lokasi hotel strategis tengah kota bandung dkt masjid pusat berbelanja kuliner toko elektronik balai kota bandung jalan dekat ke arah braga melintas wastukencana atau olahraga pagi sepanjang trotoar yang rindang komplek perkantoran pangdan siliwangi kamar nyaman bersih dan menu2 sarapan sangat bervariasi hampir semuanya enak2,BUMN,Bintang 5,BWPremiereBandung,positive,Kebersihan & Kenyamanan Kamar
Ariani Rahmadhani,2025,5,Saya memiliki tinggal yang luar biasa di terbaik premier la grande barat kamar sangat nyaman bersih dan baik dipelihara tempat tidurnya nyaman fasilitas modern dan semuanya dengan bijaksana disiapkan untuk memastikan pengalaman yang menyenangkan saya juga menghargai suasana yang tenang dan santai yang membuatnya mudah untuk beristirahat setelah hari sibuk secara keseluruhan itu adalah tinggal yang sangat baik dan saya sangat merekomendasikan hotel ini kepada siapa pun yang mengunjungi bandung,BUMN,Bintang 5,BWPremiereBandung,positive,Kebersihan & Kenyamanan Kamar
almira puteri,2025,5,Aku suka bagaimana nyaman tempat tidur dan fasilitas yang disediakan membuat semuanya begitu nyaman rasanya seperti kombinasi sempurna kenyamanan dan keanggunan membuat waktu masuk bandung saya lebih berkesan saya pasti akan memilih untuk tinggal di sini lagi pada kunjungan saya berikutnya,BUMN,Bintang 5,BWPremiereBandung,positive,Kebersihan & Kenyamanan Kamar
Elshanezha meldira rossaputri,2025,5,menginap di Best Western Premier La Grande adalah pengalaman yang menyenangkan kamar itu dengan indah disimpan sangat nyaman dan menyediakan lingkungan yang damai untuk beristirahat saya sangat menghargai perhatian untuk detail dari kualitas tempat tidur untuk kebersihan seluruh ruang itu benar-benar terasa seperti rumah jauh dari rumah dan saya akan senang untuk kembali pada perjalanan saya berikutnya,BUMN,Bintang 5,BWPremiereBandung,positive,Kebersihan & Kenyamanan Kamar
Muhammad Harry,2025,4,lokasi cukup mudah dicari di tengah kota makanan lumayan oke banyak pilihan kamar jg nyaman iklan kolam renang gym dll tarif juga oke rekomen,BUMN,Bintang 5,BWPremiereBandung,positive,Fasilitas Hotel (Kolam/Gym/Spa)
Stephani Astrianingsih,2025,5,ini kali ke 2 saya menginap di terbaik barat bandung lokasinya sangat strategis selain itu sangat menyenangkan menbawa anak karna ada kolam renang anak yang hangat,BUMN,Bintang 5,BWPremiereBandung,positive,Lokasi & Akses Strategis
PEJUANG TOGEAN,2025,5,Lokasinya sangat oke beragam pilihan tempat belanja dan jajanan unik sarapan oke sesuai dengan standar bintang 4 5 internasional kamar tempat tidur oke kamarnya sudah ada smart tv netflix youtube disney dll lantai kamar dan karpetnya mgkn masih tergolong oldstyle dan perlu uang diperbaiki bertahap sesuai zaman saat ini layanan resepsionis dan sekuriti sangat tanggap dan membantu,BUMN,Bintang 5,BWPremiereBandung,positive,Pelayanan Staf & Keramahan
Freddy Keppy,2025,5,hotel lokasinya mantap kamarnya super bersih sarapannya kualitas dan restonya juga bagus gym alatnya lengkap mall tinggal nyebrang gramedia sebelah kiri beli gadget langsung lewat belakang saja super,BUMN,Bintang 5,BWPremiereBandung,positive,Kebersihan & Kenyamanan Kamar
Chantika Aufa Azhar,2025,5,Saya memiliki tinggal yang sangat menyenangkan di terbaik premier barat la grande kamarnya nyaman dan bersih dengan pemandangan kota yang bagus resepsi tim sangat ramah dan membantu selama check masuk dan check keluar saya juga menyukai sarapan banyak pilihan lezat terutama hidangan tradisional Indonesia pasti akan kembali,BUMN,Bintang 5,BWPremiereBandung,positive,Kebersihan & Kenyamanan Kamar
Le Na,2025,4,Saya dan keluarga senang sekali menginap di sana suka dengan suasana kamar berikut fasilitasnya yang kondisinya baik banget tambah nyaman dengan kebersamaan pelayanannya juga baik apalagi bisa upgrade kamar makanan gratis juga variatif hanya parkir dan lobi kurang luas sih masuk hotel favorit kami berikutnya jika ke bandung lagi,BUMN,Bintang 5,BWPremiereBandung,positive,Kebersihan & Kenyamanan Kamar
Fitri Olive,2025,5,pelayanannya luar biasa sangat baik kali pertama menginap di sini terima kasih sudah bersedia diarahkan untuk proses penjadwalan ulang karena perubahan jadwal dokter pihak hotel sangat membantu dalam memberikan informasi meskipun saya melakukan pemesanan melalui perjalanan dan sekarang saya kembali menginap untuk kedua kalinya dan pelayanannya tetap memuaskan staf kantor depan sangat ramah kamar luas nyaman dan bersih untuk sarapan pilihannya sangat banyak enak saya pasti akan kembali menginap di terbaik barat jika berkunjung ke bandung,BUMN,Bintang 5,BWPremiereBandung,positive,Kebersihan & Kenyamanan Kamar
Andy Aldy,2025,5,pengalaman yang sangat bagus menginap di hotel terbaik premier la grande barat bandung hotel yang bagus dan bersih dengan berbagai sarapan makanan serta staf yang sangat baik lokasi hotel adalah luar biasa masuk jantung kota,BUMN,Bintang 5,BWPremiereBandung,positive,Kebersihan & Kenyamanan Kamar
ichsan ruziek,2025,5,pengalaman pertama menginap di Best Western Premier Staff Staff yang sangat ramah dari kantor depan restoran parkir sangat membantu dan ada makan siang jam 3 jam 5 sore dengan menu yang tidak kalah banyak variasi kolam renang udara hangat ini juga oke sekali untuk anak view jalan juanda riau taman sari dari lantai 18 luar biasa kembali lagi ke sini kalau ke bandung,BUMN,Bintang 5,BWPremiereBandung,positive,Pelayanan Staf & Keramahan
Alya,2025,5,Saya sangat puas saat menginap di sini lokasinya sangat strategis mudah menjangkau destinasi wisata atau mall stafnya ramah kamarnya bersih dan sangat nyaman kamar mandinya juga luas dan bersih area hotel juga sangat terawat fasilitas lain seperti kolam renang dan gym juga tersedia,BUMN,Bintang 5,BWPremiereBandung,positive,Kebersihan & Kenyamanan Kamar
Nikes Presilia,2025,5,Layanan yang sangat baik dan memiliki pré pré pré prélige untuk memeriksa masuk awal pukul 9.30 pagi yang hampir tidak terjadi ruang luas dengan kebutuhan lengkap lokasi yang sangat baik dekat dengan pusat kota saya tidak menemukan masalah besar,BUMN,Bintang 5,BWPremiereBandung,positive,Lokasi & Akses Strategis
Scembriwan Aryo,2025,5,kamar hotelnya rapi fasilitas yang disediakan lengkap cocok untuk keluarga yang sedang berlibur di bandung kolam renang air hangatnya sangat disukai oleh keluarga,BUMN,Bintang 5,BWPremiereBandung,positive,Kebersihan & Kenyamanan Kamar
irwan lubis,2025,5,hotel berada persis di depan bip dekat gramedia bec alun alun bandung dan masjid kamar dan toilet bersih kasur bantal sprei nyaman sarapan pagi banyak dan bervariasi dan rasanya enak terutama makanan lokal seperti gorengan siomay jajanan pasar dan bubur ayam kolam renang udara hangat di lt 3a satu lantai dengan ruang fitness view kota bandung utara,BUMN,Bintang 5,BWPremiereBandung,positive,Kebersihan & Kenyamanan Kamar
Furri Ardie,2025,5,hotelnya bersih ada sore teh mau ke mall juga dekat banget tinggal nyebrang saja,BUMN,Bintang 5,BWPremiereBandung,positive,Kebersihan & Kenyamanan Kamar
meilinda dwi putri,2025,5,senang menginap di sini resepsionisnya ramah banget kamarnya juga luas datang jam setengah 1 udah boleh masuk karena ada kamar yang sudah siap lokasinya juga strategis banget tinggal nyebrang udah mall bip pokoknya dianjurkan banget,BUMN,Bintang 5,BWPremiereBandung,positive,Pelayanan Staf & Keramahan
Nur Laila,2025,5,bagus banget ini hotelnya pelayanan oke makanan sarapan juga bervariasi dan enak enak banget fasilitas kamar juga okee banget lokasi strategis banget depan banget mall jadi malem nya bisa jalan ke mall top pokonya semoga bisa kembali lagi kesini terima kasih,BUMN,Bintang 5,BWPremiereBandung,positive,Lokasi & Akses Strategis
anistia,2025,5,sering mendapat voucher menginap dari saudara disini nyaman oke alhamdulillah cuman kalau malam bandung tuh masih banyak yang memakai knalpot berisik hehe diluar kontrol hotel yah kalau ini sih tapi overall oke dong nyaman,BUMN,Bintang 5,BWPremiereBandung,positive,Kebersihan & Kenyamanan Kamar
Sekar Dwi Ambarwati,2025,5,Hotel ini benar-benar masuk di depan Mall Mall belanja dan makanan tepat di seberang jalan kamarnya nyaman staf semua sangat ramah dan semua senyum dan sarapan membuat pagi saya suka itu,BUMN,Bintang 5,BWPremiereBandung,positive,Pelayanan Staf & Keramahan
Diko Fajri,2025,5,hotel yang selalu jadi bahasa dari tahun 2015 sangat suka nginap di sini karena lokasinya strategis di tengah kota kamarnya luas dan bersih makannya enak dan pelayanannya ramah,BUMN,Bintang 5,BWPremiereBandung,positive,Kebersihan & Kenyamanan Kamar
zahra nrzm,2025,5,hotel mudah dicari karna posisi di tengah kota banyak jajanan di sekitar hotel suka banget sama kolam renangnya karna udara hangatt baru di hotel ini saya mendapatkan cemilan sakit gratis untuk menu sarapan sangat banyak pilihan dan rasanya cukup enak stafnya pun sangat murah senyum dan sangat membantu,BUMN,Bintang 5,BWPremiereBandung,positive,Fasilitas Hotel (Kolam/Gym/Spa)
Yogi Priatna,2025,5,salah satu hotel terbaik masuk bandung lokasi strategis sangat dekat jarak ke semua tempat utama untuk mengunjungi masuk bandung bagian terbaik adalah staf sangat baik dan profesional tidak ada keluhan dan tidak ada kekurangan sangat direkomendasikan,BUMN,Bintang 5,BWPremiereBandung,positive,Pelayanan Staf & Keramahan
anugerah perdana,2025,5,langganan menginap di sini untuk liburan dan yang selalu bikin bersemangat adalah menu sarapannya yang lengkap dan enaknya lagi dibawah ada laundry namanya amala express jadi ngga bingung kalau kehabisan baju karena 4 jam selesai mantap pokoknya,BUMN,Bintang 5,BWPremiereBandung,positive,Kebersihan & Kenyamanan Kamar
Sabila Nuraeni,2025,5,lokasi yang strategis staf mulai dari depan satpam staf restoran sangat ramah ramah kamar luas dan pemandangan yang cantik kebetulan saya kamar di lantai 12 saat makan pagi petugas restoran sangat membantu dan makanan bervariasi untuk saya sebagai orang jakarta sangat cocok karena udara kolam renang udara hangat terimakasih banyak hotel terbaik barat,BUMN,Bintang 5,BWPremiereBandung,positive,Kebersihan & Kenyamanan Kamar
Monce Cantik,2025,5,semua baik terbaik bnget sma kyak nama hotel ya terbaik makan oke bnget dpet gratis cemilan n itu pun buffe jg waahh kerenn sih berikutnya tdr lg dsni ah sukses trs yaa smoga slalu di pertahankan smuanya,BUMN,Bintang 5,BWPremiereBandung,positive,Kualitas Makanan & Restoran
Luthfiyyah NA,2025,5,kalau ke bandung wajib cobain nginep disini semuanya oke dari fasilitas kebersihan kamar stafnya pada ramah makanannya enak,BUMN,Bintang 5,BWPremiereBandung,positive,Kebersihan & Kenyamanan Kamar
Arnindhita Shinta,2025,5,hotel terbaik saat lg liburan ke bandung sesuai dengan keinginan rekomendasi bgtr poll akan kembali lagi ke sini kalau ke bandung terima kasih u best western premier la grande,BUMN,Bintang 5,BWPremiereBandung,positive,Harga & Value for Money
Hesikios Kevin,2025,5,Aku seneng banget nginep di sini pelayanannya ramah kolamnya renangnya enak semi indoor gitu makanan enakk cinta banget pokoknya kemana mana strategis,BUMN,Bintang 5,BWPremiereBandung,positive,Lokasi & Akses Strategis
rani apriliani,2025,5,kamar nyaman bersih rapih wangi pelayanannya baik lokasi startegis pokonya sudah paling recomend kalau menginap pasti disini dan mewah juga dengan harga yang terjangkau,BUMN,Bintang 5,BWPremiereBandung,positive,Kebersihan & Kenyamanan Kamar
Yudi Setiawan,2025,5,Alhamdulillah bisa tinggal di terbaik Western merdeka mantafs untuk melihat kamar layanan dan fasilitas nya makanan sangat bervariasi dianjurkan pisaan terima kasih semua kru terbaik barat adalah yang terbaik,BUMN,Bintang 5,BWPremiereBandung,positive,Kualitas Makanan & Restoran
saskiahsnull,2025,5,pelayanannya ramahh kamar nya juga nyamann kolam renang nya juga enak udara nya hangat untuk makanan jugaa enak bangett sukaa staf nya ramah saya dapet cemilan sakit jg dan enak enak makanannya khas bandung semua menu sarapannya bervariasi banyak dan lengkap salah satu hotel yang makanannya enak enak,BUMN,Bintang 5,BWPremiereBandung,positive,Kebersihan & Kenyamanan Kamar
Raifan Oktavian,2025,5,Aku memiliki tinggal yang sangat menyenangkan di Best Western Premier La Grande kamarnya nyaman dan bersih dengan pemandangan kota yang bagus staf resepsi sangat ramah dan membantu Aku benar-benar menikmati makan siang mereka memiliki berbagai yang baik dan semuanya rasanya hebat pasti akan tinggal di sini lagi,BUMN,Bintang 5,BWPremiereBandung,positive,Kebersihan & Kenyamanan Kamar
Novita Anjarwati,2025,5,Sebenernya overall hotelnya bersih nyaman cuma sayangnya saat di kamar yang saya tempati teko udaranya tidak bisa nyala dan kullasnya tidak dingin,BUMN,Bintang 5,BWPremiereBandung,positive,Kebersihan & Kenyamanan Kamar
Redmi C,2025,5,Semua fitur kamar bekerja sempurna AC lampu dan pemanas air itu membuat tinggal halus dan nyaman kamar berbau bersih dan segar tanpa bau tidak menyenangkan sama sekali suasana yang benar-benar santai kamar itu tidak bercacat dan berbau segar saat kita memasuki setiap permukaan bersih dan baik dipertahankan,BUMN,Bintang 5,BWPremiereBandung,positive,Kebersihan & Kenyamanan Kamar
anak baik,2025,5,pelayanan bagus banget resepsi staf keamanan ramah banget kamar nyaman dan bersih ac dingin semua berfungsi dengan baik isi kamar mandi juga lengkap banget paling suka sarapan nya lengkap terbaik nilainya 10 10 depanny bandung indah plaza lokasi sangat strategis terbaik pokoknya terimakasih kalau kebandung pasti nginap disini lagi,BUMN,Bintang 5,BWPremiereBandung,positive,Kebersihan & Kenyamanan Kamar
