User Name,Review Time,Rating,clean_text,Tipe,Kelas,Nama_Hotel,AI_Sentiment,AI_Aspek
Azkar Leys,2022,5,melayani panggilan pijat urut refleksi di daerah cilegon wa 089603655611,BUMN,Bintang 5,RoyalKrakatauCilegon,neutral,Pelayanan Staf & Keramahan
Akbar Rozak,2022,5,hotelnya bagus makanannya juga enak tetap di tingkatkan lagi kualitasnya,BUMN,Bintang 5,RoyalKrakatauCilegon,positive,Kualitas Makanan & Restoran
Ade Ajid Grab,2022,5,hotel bintang 5 di tengah kota cilegon keren sangat nyaman cocok untuk yang hobi bepergian cekidot,BUMN,Bintang 5,RoyalKrakatauCilegon,positive,Lokasi & Akses Strategis
Michael M,2019,1,1 kamar hotel bau seperti kue urin 2 kembali ke kamarku masuk malam dan pembersih meninggalkan kamarku terbuka setelah membersihkan kamarku 3 konstruksi setelah 11pm terjadi langsung di luar kamarku membuat sulit untuk tidur 4 pilihan makanan sangat terbatas dan restoran miskin sering menjual keluar dari barang yang Anda butuhkan,BUMN,Bintang 5,RoyalKrakatauCilegon,negative,Kebersihan & Kenyamanan Kamar
Nurul Fajar,2024,5,tempatnya luas tidak jauh dari transmart,BUMN,Bintang 5,RoyalKrakatauCilegon,positive,Lokasi & Akses Strategis
Angga Jack Sparrow,2025,5,Hotel yang baik dan staf yang baik terima kasih Rahel,BUMN,Bintang 5,RoyalKrakatauCilegon,positive,Pelayanan Staf & Keramahan
Lena Suryati,2024,5,dianjurkan hotel terbaik layanan terbaik makanan terbaik kamar,BUMN,Bintang 5,RoyalKrakatauCilegon,positive,Kualitas Makanan & Restoran
Aruna Haru,2024,5,bagus banget ada kolam renang atm resto dll,BUMN,Bintang 5,RoyalKrakatauCilegon,positive,Kualitas Makanan & Restoran
Hadi hendriyanto,2020,5,rekomendasi untuk menginap di hotel royal krakatau menikmati dinginnya orang-orang di kota tengah cilegon,BUMN,Bintang 5,RoyalKrakatauCilegon,positive,Lokasi & Akses Strategis
Milan Shinde,2019,4,Hotel yang sangat bagus untuk menginap staf restoran sangat bagus Pak wahyu hidayat dari restoran membantu saya untuk mencicipi makanan Indonesia yang berbeda makanan sangat baik terima kasih wahyu hidayat,BUMN,Bintang 5,RoyalKrakatauCilegon,positive,Kualitas Makanan & Restoran
Wong Cilegon,2025,5,Cukup nyaman,BUMN,Bintang 5,RoyalKrakatauCilegon,positive,Kebersihan & Kenyamanan Kamar
Ninditha Fahira,2020,4,tempat yang sangat baik kondisional untuk pergi tapi minus kurang responsif transportasi mobil golf dari hotel ke pondok di sekitar juga terima kasih,BUMN,Bintang 5,RoyalKrakatauCilegon,positive,Harga & Value for Money
Shafira Adlina,2022,5,keren hotelnya nyaman dan wangi serta pelayanannya juga oke dan ramah,BUMN,Bintang 5,RoyalKrakatauCilegon,positive,Kebersihan & Kenyamanan Kamar
chintya nuraeni,2020,4,bagus parkir luas dan bersih tapi tidak di sediakan kran buat lap mobil,BUMN,Bintang 5,RoyalKrakatauCilegon,positive,Kebersihan & Kenyamanan Kamar
Dany Hermansyah,2021,5,lapangan bersih dan pelayanan ramah hotel bersebelahan dengan lapangan golf terbaik di banten,BUMN,Bintang 5,RoyalKrakatauCilegon,positive,Pelayanan Staf & Keramahan
Raymond Sipahutar,2024,5,kamar nyaman sarapan enak layanan oke,BUMN,Bintang 5,RoyalKrakatauCilegon,positive,Kebersihan & Kenyamanan Kamar
Yadi Hermayadi,2023,5,nyaman parkir luas hijau segar fasilitas lengkap,BUMN,Bintang 5,RoyalKrakatauCilegon,positive,Infrastruktur (AC/WiFi/Parkir/Air)
Nanda Kasih,2020,4,menyenangkan fasilitas kamar hotel serta penyajian sarapan ya sangat baik,BUMN,Bintang 5,RoyalKrakatauCilegon,positive,Kualitas Makanan & Restoran
Jutono Dewa Kelana,2022,4,hotel yang rindang dan damai cocok untuk liburan keluarga dan juga cocok untuk karyawan yang bekerja di lingkungan industri cilegon,BUMN,Bintang 5,RoyalKrakatauCilegon,positive,Lokasi & Akses Strategis
Iyus Yusup,2024,5,tempat yang bagus buat liburan bersama keluarga,BUMN,Bintang 5,RoyalKrakatauCilegon,positive,Harga & Value for Money
Dedi Sutrisno,2021,5,Tempat olahraga golf yang mau bertemu orang korea banyak y disini tapi bukan anggota k pop y ini untuk ajosi,BUMN,Bintang 5,RoyalKrakatauCilegon,positive,Harga & Value for Money
Hammam Rhofi,2025,2,tidak dingin,BUMN,Bintang 5,RoyalKrakatauCilegon,negative,Harga & Value for Money
Abu Aisyah Hardiansyah,2024,5,Tempat yang bagus untuk menghabiskan malam Anda dengan keluarga dekat dari supermarket dan pusat kota,BUMN,Bintang 5,RoyalKrakatauCilegon,positive,Lokasi & Akses Strategis
yeni marzuki,2022,5,hotelnya nyaman untuk keluarga maupun bisnis bersih dan menyenangkan,BUMN,Bintang 5,RoyalKrakatauCilegon,positive,Kebersihan & Kenyamanan Kamar
Indra Effendy,2023,5,pilihan bagus untuk tinggal kami menyewa junior suite villa itu membutuhkan lebih banyak tempat sampah,BUMN,Bintang 5,RoyalKrakatauCilegon,positive,Kebersihan & Kenyamanan Kamar
Angga Mulatif,2023,5,sarapan enak lengkap menuunya kamar bersih rapi,BUMN,Bintang 5,RoyalKrakatauCilegon,positive,Kebersihan & Kenyamanan Kamar
Milana Chandyto,2023,5,pemandangan sangat bagus Anda bisa melihat lapangan golf dari ruangan,BUMN,Bintang 5,RoyalKrakatauCilegon,positive,Lokasi & Akses Strategis
Mayudha Rais Pradiptya,2024,5,gedungnya dari luar bagus mega lobbynya pun juga lumayan bagus,BUMN,Bintang 5,RoyalKrakatauCilegon,positive,Lokasi & Akses Strategis
Anggarian 'ARAS' Andisetya,2019,5,suasana nyaman dan cocok tempat menginap liburan maupun pertemuan,BUMN,Bintang 5,RoyalKrakatauCilegon,positive,Kebersihan & Kenyamanan Kamar
Didik Susanto,2021,5,tempat yang Anda asri dengan nuasanya orang dan rapih serta bersih dan dekat dengan area golf,BUMN,Bintang 5,RoyalKrakatauCilegon,positive,Pelayanan Staf & Keramahan
ali Kuswara,2022,5,Tempat ini cukup luas cocok untuk berbagai acara resmi,BUMN,Bintang 5,RoyalKrakatauCilegon,positive,Harga & Value for Money
sri harjanto,2024,4,kebersihan lingkungan hotel perlu ditingkatkan,BUMN,Bintang 5,RoyalKrakatauCilegon,positive,Kebersihan & Kenyamanan Kamar
Komarudin 55,2023,4,acara makan malam bersama kolega di Royal Krakatau hotel suasana syahdu romantis,BUMN,Bintang 5,RoyalKrakatauCilegon,positive,Kualitas Makanan & Restoran
siriwat limpaiboon,2023,4,kamar bersih layanan bagus lokasi tidak jauh dari tol,BUMN,Bintang 5,RoyalKrakatauCilegon,positive,Kebersihan & Kenyamanan Kamar
Donking Kingkong,2021,5,Tempat nyaman seperti luas cocok untuk klg istirahat,BUMN,Bintang 5,RoyalKrakatauCilegon,positive,Kebersihan & Kenyamanan Kamar
Jajang Jajuli,2023,4,Ballroomnya nyaman tempatnya strategis dan suasananya asri,BUMN,Bintang 5,RoyalKrakatauCilegon,positive,Lokasi & Akses Strategis
Riesta Sapta,2024,5,gedungnya bagus parkir luas representatif,BUMN,Bintang 5,RoyalKrakatauCilegon,positive,Lokasi & Akses Strategis
Novelda Jumia Nurjanah,2023,5,belum pernah memeriksa masuk tapi kata bokap sih oke banget,BUMN,Bintang 5,RoyalKrakatauCilegon,positive,Harga & Value for Money
bintang mahaputra angkasa muda,2020,5,sarapan yang nyaman dengan hamparan rumput hijau cuaca dingin,BUMN,Bintang 5,RoyalKrakatauCilegon,positive,Kebersihan & Kenyamanan Kamar
Cipto Cipto,2019,5,Aku sih pesan nya yang akan 201 sumpah nyaman dan enak banget cuma 9xxribu,BUMN,Bintang 5,RoyalKrakatauCilegon,positive,Harga & Value for Money
Ardi Suhardi,2021,5,dulu pernah merasakan pengalaman 6 bulan disini terima kasih atas ilmu baru,BUMN,Bintang 5,RoyalKrakatauCilegon,positive,Harga & Value for Money
Mohammad Fajar Fitriadi,2023,5,Aku sangat merekomendasikan kau mencoba Nasi Rabeg dari Royal Krakatau,BUMN,Bintang 5,RoyalKrakatauCilegon,positive,Kualitas Makanan & Restoran
Anto Bass,2019,4,Layanan pelanggan nya perlu pelatihan lagi dalam memberikan informasi slow motion banget,BUMN,Bintang 5,RoyalKrakatauCilegon,negative,Fasilitas Hotel (Kolam/Gym/Spa)
Siti Nurhalimah,2020,5,Alhamdulillah keamanan nya baik mengantar smpai tempat acaranya,BUMN,Bintang 5,RoyalKrakatauCilegon,positive,Lokasi & Akses Strategis
Muhamad Irfan,2025,5,pelayanan dan kamarnya baik,BUMN,Bintang 5,RoyalKrakatauCilegon,positive,Kebersihan & Kenyamanan Kamar
Hilal Hamzah,2020,5,nyaman banget fasilitas baru komplit terbaik deh pokoknya,BUMN,Bintang 5,RoyalKrakatauCilegon,positive,Kebersihan & Kenyamanan Kamar
T3A UC,2022,5,tempat nyaman dengan pemandangan lapangan golf nan indah dan dingin,BUMN,Bintang 5,RoyalKrakatauCilegon,positive,Kebersihan & Kenyamanan Kamar
Rio Santoz,2019,4,hotel bagus dengan banyak model paviliun dan pondok dll nyaman asri,BUMN,Bintang 5,RoyalKrakatauCilegon,positive,Fasilitas Hotel (Kolam/Gym/Spa)
Ramadhani A.S,2025,5,hotel dengan fasilitas olahraga terbaik,BUMN,Bintang 5,RoyalKrakatauCilegon,positive,Fasilitas Hotel (Kolam/Gym/Spa)
riyanto edoy,2025,4,cukup representatif,BUMN,Bintang 5,RoyalKrakatauCilegon,positive,Harga & Value for Money
regita quinza75,2021,5,Makanan yang sangat enak dan harga lumayan terjangkau untuk 4 bintang,BUMN,Bintang 5,RoyalKrakatauCilegon,positive,Harga & Value for Money
Jefry Estepanus,2020,5,Hotel yang bagus dan pemandangan yang bagus makanan yang lezat dan staf yang baik terima kasih,BUMN,Bintang 5,RoyalKrakatauCilegon,positive,Pelayanan Staf & Keramahan
Hendra Aboy,2025,5,hotel yang sangat bagus,BUMN,Bintang 5,RoyalKrakatauCilegon,positive,Lokasi & Akses Strategis
Siti Nurlaila,2023,5,kolam renang bersih makanan oke kamar oke,BUMN,Bintang 5,RoyalKrakatauCilegon,positive,Kebersihan & Kenyamanan Kamar
Rudi Purnomo,2022,5,keren lah hotelnya adeemm banyak orang tetap kualitasnya,BUMN,Bintang 5,RoyalKrakatauCilegon,positive,Lokasi & Akses Strategis
oke setio,2019,5,pemandangan di luar ruang pertemuan safir bgus hamparan hijau lapangan golf,BUMN,Bintang 5,RoyalKrakatauCilegon,neutral,Harga & Value for Money
Mutiara Hadi,2021,3,letaknya setategis bersih nyaman ramah2 pelayanan nya parkir luas dan asri,BUMN,Bintang 5,RoyalKrakatauCilegon,positive,Lokasi & Akses Strategis
feri suryaman,2023,5,Tidak perlu tinggal di sini pelayanannya bagus fauji,BUMN,Bintang 5,RoyalKrakatauCilegon,positive,Harga & Value for Money
Dwi Hendratno,2019,4,Hotel 4 bintang yang bersih memiliki pondok n kamar untuk kelompok kecil n besar,BUMN,Bintang 5,RoyalKrakatauCilegon,positive,Kebersihan & Kenyamanan Kamar
Bahaudin Arija,2020,5,Tempat ini ada hotelnya ada lapangan golf juga ada ruang pertemuan datanglah,BUMN,Bintang 5,RoyalKrakatauCilegon,positive,Fasilitas Hotel (Kolam/Gym/Spa)
Egi Kurniawan,2020,4,Saat makan siang bisa melihat pemandangan golf Lapamgan,BUMN,Bintang 5,RoyalKrakatauCilegon,positive,Lokasi & Akses Strategis
Ruhul Bayan,2025,5,hanya untuk makan siang saja,BUMN,Bintang 5,RoyalKrakatauCilegon,negative,Harga & Value for Money
Ilham Raspati,2019,5,Lingkunganya Asri nyaman dan teduh cocok untuk perjalanan bisnis makan cukup enak,BUMN,Bintang 5,RoyalKrakatauCilegon,positive,Kebersihan & Kenyamanan Kamar
TM INAYATTULLAH,2021,4,hotel yang nyaman bersih mkananan nya uenak uenak,BUMN,Bintang 5,RoyalKrakatauCilegon,positive,Kebersihan & Kenyamanan Kamar
mH2_ Adeeva21,2022,5,Pelayanannya cukup bagus dan rekomendasi tuk acara kantoran atau instansi,BUMN,Bintang 5,RoyalKrakatauCilegon,positive,Harga & Value for Money
Antonio Caro Remolano Jr.,2022,4,akomodasi yang baik kru dan steward yang baik dan makanan yang lezat,BUMN,Bintang 5,RoyalKrakatauCilegon,positive,Pelayanan Staf & Keramahan
Iman Firmansah,2022,5,tempatnya mewah asri dan dingin sih inisih rekomended banget,BUMN,Bintang 5,RoyalKrakatauCilegon,positive,Kebersihan & Kenyamanan Kamar
haris abdillah,2025,5,Asri,BUMN,Bintang 5,RoyalKrakatauCilegon,negative,Kualitas Makanan & Restoran
Rahadian SL,2019,5,pengalaman keluarga terbaik memiliki kolam renang pusat kebugaran golf park transfer dengan golfcar yang sangat baik,BUMN,Bintang 5,RoyalKrakatauCilegon,positive,Fasilitas Hotel (Kolam/Gym/Spa)
bambang wisnumurti,2021,5,Aku suka di sini selama 25 tahun untuk menyelesaikan pekerjaanku itu adalah kesenangan dan lokasi yang bagus,BUMN,Bintang 5,RoyalKrakatauCilegon,positive,Harga & Value for Money
Setio Anto,2023,5,tempat yang strategis di cilegon untuk inap setelah urusan bisnis,BUMN,Bintang 5,RoyalKrakatauCilegon,positive,Lokasi & Akses Strategis
Jimmy Dodi taurus,2024,4,kamar hotel golf view perlu diperbaiki,BUMN,Bintang 5,RoyalKrakatauCilegon,negative,Fasilitas Hotel (Kolam/Gym/Spa)
Leno_vo Sir,2019,5,Tempat acara2 knrn pernikahan bagus ruangan baru besar,BUMN,Bintang 5,RoyalKrakatauCilegon,positive,Harga & Value for Money
Devid Handal Pribadi,2020,5,suasana asri parkir area luas dan pelayanan yang ramah,BUMN,Bintang 5,RoyalKrakatauCilegon,positive,Pelayanan Staf & Keramahan
Harry Fuzaki,2021,5,tempat yang bagus dan cocok buat liburan bersama keluarga,BUMN,Bintang 5,RoyalKrakatauCilegon,positive,Harga & Value for Money
eza putra,2021,5,Lihat bagus makanan bervariatif banyak promo terbaik untuk tinggal,BUMN,Bintang 5,RoyalKrakatauCilegon,positive,Kualitas Makanan & Restoran
red wing 7042,2021,4,tempat luas dan bersih dan area parkir nya juga bersih dan tertib,BUMN,Bintang 5,RoyalKrakatauCilegon,positive,Infrastruktur (AC/WiFi/Parkir/Air)
Ubay Ahmed,2024,5,terbaik ramah nyaman,BUMN,Bintang 5,RoyalKrakatauCilegon,positive,Kebersihan & Kenyamanan Kamar
wahyu al khaddafi,2021,5,tempatnya bersih nyaman pokoknya mantul,BUMN,Bintang 5,RoyalKrakatauCilegon,positive,Kebersihan & Kenyamanan Kamar
RT N,2020,5,Tempat yang bagus untuk menginap liburan mereka menyediakan check-out terlambat sampai 14 malam,BUMN,Bintang 5,RoyalKrakatauCilegon,positive,Infrastruktur (AC/WiFi/Parkir/Air)
Budiyono BudaxBanten,2025,5,bagus,BUMN,Bintang 5,RoyalKrakatauCilegon,positive,Harga & Value for Money
Puja Kyryliuk,2022,5,Aku suka tempat ini tapi agak sulit untuk menemukan makanan jalan stafnya ramah,BUMN,Bintang 5,RoyalKrakatauCilegon,positive,Pelayanan Staf & Keramahan
Alll Baniii09,2024,5,pengiriman bisa sampai malemm,BUMN,Bintang 5,RoyalKrakatauCilegon,positive,Harga & Value for Money
Chandra bhogel,2021,5,Tempat yang baru enak buat nongkrong khusus kaum muda,BUMN,Bintang 5,RoyalKrakatauCilegon,positive,Harga & Value for Money
Bayu Aldi,2020,5,ruang dansanya mewah cocok untuk acara pernikahan atau konser,BUMN,Bintang 5,RoyalKrakatauCilegon,positive,Harga & Value for Money
okta feria mariyus,2019,4,Anda bisa menikmati bermain golf di sini mereka memiliki pemandangan yang baik,BUMN,Bintang 5,RoyalKrakatauCilegon,positive,Harga & Value for Money
Arif Sjaerozi,2020,5,tempat nyaman sebelum main golf tempatnya dekat dengan lapangan golf,BUMN,Bintang 5,RoyalKrakatauCilegon,positive,Lokasi & Akses Strategis
wildans games,2020,5,Hotel paling bagus di cilegon dan makanannya komplit banget,BUMN,Bintang 5,RoyalKrakatauCilegon,positive,Kualitas Makanan & Restoran
bundamayang cilegonss72,2024,4,holding pt pangandaran baja bajaibdonesia group,BUMN,Bintang 5,RoyalKrakatauCilegon,neutral,Kualitas Makanan & Restoran
Muhammad hanif Ramdhani,2022,5,Di dekat hotel ada golf transmart dan kolam renang,BUMN,Bintang 5,RoyalKrakatauCilegon,positive,Fasilitas Hotel (Kolam/Gym/Spa)
Novi Therapys,2024,5,cukup nyaman dan ramah pelayanannya,BUMN,Bintang 5,RoyalKrakatauCilegon,positive,Kebersihan & Kenyamanan Kamar
Khairul Azmi,2022,5,sangat memuaskan dan pelayanan bagus ramah dan kebersihan,BUMN,Bintang 5,RoyalKrakatauCilegon,positive,Pelayanan Staf & Keramahan
Indramayu Berkah,2020,5,tempat nyaman pelayanan ramah makanan terjamin,BUMN,Bintang 5,RoyalKrakatauCilegon,positive,Kualitas Makanan & Restoran
Asep Kurniawan,2024,5,enak banget nginep di sini sumpah,BUMN,Bintang 5,RoyalKrakatauCilegon,positive,Kualitas Makanan & Restoran
PPPK_Jabar117_08_Ariyanto,2025,5,Terima kasih,BUMN,Bintang 5,RoyalKrakatauCilegon,positive,Harga & Value for Money
Yesy Sinta Seftiani,2025,1,koordinasi sangat buruk,BUMN,Bintang 5,RoyalKrakatauCilegon,negative,Harga & Value for Money
ragung saptono,2025,5,nyaman,BUMN,Bintang 5,RoyalKrakatauCilegon,positive,Kebersihan & Kenyamanan Kamar
Ricky Sanif,2019,5,mantul parkir luas fan nyaman,BUMN,Bintang 5,RoyalKrakatauCilegon,positive,Kebersihan & Kenyamanan Kamar
Aliza Liza,2024,5,Hotelnya bagus nyaman dan secara keseluruhan sangat bagus hotelnya bagus,BUMN,Bintang 5,RoyalKrakatauCilegon,positive,Kebersihan & Kenyamanan Kamar
dani hamdani,2021,3,Tidak terjangkau harga nya untuk masayarakat tingkat memori ke bawah,BUMN,Bintang 5,RoyalKrakatauCilegon,negative,Harga & Value for Money
PRAMUDYANANTO,2024,5,Mantab dan harga masih bagus,BUMN,Bintang 5,RoyalKrakatauCilegon,positive,Harga & Value for Money
aulia zahra,2024,5,makanan rating nyaman tempat layanan yang baik,BUMN,Bintang 5,RoyalKrakatauCilegon,positive,Kualitas Makanan & Restoran
Irwan ASR,2023,5,makanan nya banyak macamnya nya dan enak,BUMN,Bintang 5,RoyalKrakatauCilegon,positive,Kualitas Makanan & Restoran
Ifat Syariftiyani,2022,4,luas bersih segar hijau sarapan lengkap,BUMN,Bintang 5,RoyalKrakatauCilegon,positive,Kebersihan & Kenyamanan Kamar
Sarah Rose,2022,5,nyaman bersih makanan enak,BUMN,Bintang 5,RoyalKrakatauCilegon,positive,Kebersihan & Kenyamanan Kamar
Sohib Mulyana28,2022,3,Harga mayan tapi lampunya banyak yang mati,BUMN,Bintang 5,RoyalKrakatauCilegon,negative,Harga & Value for Money
Ery Yunarta Kusdiantara,2021,4,hotel dikawasan krakatau baja ada lapangan golfnya deket transmart,BUMN,Bintang 5,RoyalKrakatauCilegon,positive,Lokasi & Akses Strategis
Subli Yanto,2021,4,Sering datang dan pernah beberapa kali mengadakan acara,BUMN,Bintang 5,RoyalKrakatauCilegon,positive,Harga & Value for Money
Ocha R Susilawati,2024,5,ingin mengecek lokasi tanah,BUMN,Bintang 5,RoyalKrakatauCilegon,neutral,Harga & Value for Money
Dudi Ardiansyah,2023,5,makanannya enak dan kamarnya bersih,BUMN,Bintang 5,RoyalKrakatauCilegon,positive,Kebersihan & Kenyamanan Kamar
Roni Faijah,2024,5,Hotel The Royal Krakatau adalah hotel terbaik di Banten,BUMN,Bintang 5,RoyalKrakatauCilegon,positive,Harga & Value for Money
Konstantinos Koskarian,2022,5,sangat baik personel bersih dan kamar pasang,BUMN,Bintang 5,RoyalKrakatauCilegon,positive,Kebersihan & Kenyamanan Kamar
Taha Muhittin Bodur,2024,3,Rumah tidak seharusnya lebih baik jika ada yang lain,BUMN,Bintang 5,RoyalKrakatauCilegon,negative,Harga & Value for Money
Fauzan Ozan,2024,5,nyaman dan asri,BUMN,Bintang 5,RoyalKrakatauCilegon,positive,Kebersihan & Kenyamanan Kamar
Arin Tjitro,2021,4,Asri bersih sejuk di tengah panasnya kota cilegon,BUMN,Bintang 5,RoyalKrakatauCilegon,positive,Kebersihan & Kenyamanan Kamar
Kent Demas Kynan,2020,5,bagus pada ukuran kamar dan melihat salah satu ukuran terbesar untuk ruang dansa,BUMN,Bintang 5,RoyalKrakatauCilegon,positive,Lokasi & Akses Strategis
Wolfgang Martens,2022,3,Hotel dan area hotel baik dan staf sangat ramah,BUMN,Bintang 5,RoyalKrakatauCilegon,positive,Pelayanan Staf & Keramahan
Veril Satria,2024,5,Piano boleh dimainkan tidak ya,BUMN,Bintang 5,RoyalKrakatauCilegon,neutral,Harga & Value for Money
ajun daruri,2023,5,Dari sekolah sampai rapat rapat saat kerja di sini,BUMN,Bintang 5,RoyalKrakatauCilegon,positive,Lokasi & Akses Strategis
Frederik Manuel,2024,5,Hotel yang bagus dengan pemandangan yang bagus layanan yang sangat baik,BUMN,Bintang 5,RoyalKrakatauCilegon,positive,Harga & Value for Money
ahmadnurul mubin,2021,5,Saya sangat puas dengan krakatau kerajaan,BUMN,Bintang 5,RoyalKrakatauCilegon,positive,Harga & Value for Money
herry purnomo,2025,4,sangat revomended,BUMN,Bintang 5,RoyalKrakatauCilegon,positive,Harga & Value for Money
BEBEN YULIUS TARIGAN,2021,3,lumayan bagus tempat dan servis baru,BUMN,Bintang 5,RoyalKrakatauCilegon,positive,Kualitas Makanan & Restoran
dali mandali,2021,5,Tempat baru oke dah mulai ramai,BUMN,Bintang 5,RoyalKrakatauCilegon,positive,Harga & Value for Money
Roel Anto,2024,4,kurang bagus skg royal,BUMN,Bintang 5,RoyalKrakatauCilegon,negative,Harga & Value for Money
NIKMAL GAMA PUTRA,2022,5,tempat youtuber milyhya manca ilyasa yahya wisuda,BUMN,Bintang 5,RoyalKrakatauCilegon,neutral,Lokasi & Akses Strategis
Mia Gunarmiasih,2021,4,salah satu hotel terbaik masuk daerah industri cilegon,BUMN,Bintang 5,RoyalKrakatauCilegon,positive,Harga & Value for Money
Yuni Agnesty,2025,5,sate maranggi nya enakk,BUMN,Bintang 5,RoyalKrakatauCilegon,positive,Kualitas Makanan & Restoran
Rusdi Suteja,2022,5,lokasi mudah dijangkau dan tempat memadai,BUMN,Bintang 5,RoyalKrakatauCilegon,positive,Lokasi & Akses Strategis
Pastev Toraya,2022,4,kualitas dan harga yang optimal,BUMN,Bintang 5,RoyalKrakatauCilegon,positive,Harga & Value for Money
Edwin Manahara,2021,1,Ada sandal bekas tamu sebelumnya,BUMN,Bintang 5,RoyalKrakatauCilegon,neutral,Harga & Value for Money
Kukuh Ari Pambudi,2025,5,begitu nyaman,BUMN,Bintang 5,RoyalKrakatauCilegon,positive,Kebersihan & Kenyamanan Kamar
Egha Mahaditama,2025,5,sekolah viola dan yang lain,BUMN,Bintang 5,RoyalKrakatauCilegon,neutral,Harga & Value for Money
Teuku Boy Irwan,2019,4,lumayan cuma jauh dari kuliner,BUMN,Bintang 5,RoyalKrakatauCilegon,negative,Harga & Value for Money
P12 Go,2025,4,lokasi luas,BUMN,Bintang 5,RoyalKrakatauCilegon,positive,Harga & Value for Money
Supian Sauri,2021,5,petugas dan pelayanannya cukup baik dan ramah ramah,BUMN,Bintang 5,RoyalKrakatauCilegon,positive,Pelayanan Staf & Keramahan
xyzlmnop qrstuv,2023,3,kenapa foto sama aslinya beda ya,BUMN,Bintang 5,RoyalKrakatauCilegon,negative,Harga & Value for Money
Triputranti Koosparyono,2020,5,enak nyaman dan menu makanannya enak enak,BUMN,Bintang 5,RoyalKrakatauCilegon,positive,Kebersihan & Kenyamanan Kamar
uki subkhi,2022,5,masakannya enak,BUMN,Bintang 5,RoyalKrakatauCilegon,positive,Kualitas Makanan & Restoran
Kuswara Harjowiyono,2024,5,tempat yang bagus untuk kota cilegon,BUMN,Bintang 5,RoyalKrakatauCilegon,positive,Harga & Value for Money
Isbanri Banten,2024,5,Suasananya tenang,BUMN,Bintang 5,RoyalKrakatauCilegon,positive,Harga & Value for Money
Nanok Kranggan,2019,4,kamarnya luas sesuai,BUMN,Bintang 5,RoyalKrakatauCilegon,positive,Harga & Value for Money
simon stevani,2022,5,rekomendasi buat rapat dan makan keluarga,BUMN,Bintang 5,RoyalKrakatauCilegon,positive,Kualitas Makanan & Restoran
Robbani Jamil,2023,4,Salah satu hotel terbagus di kota cilegon,BUMN,Bintang 5,RoyalKrakatauCilegon,positive,Harga & Value for Money
Sa Anih,2020,5,hotel nya nyaman fasilitasnya bagus,BUMN,Bintang 5,RoyalKrakatauCilegon,positive,Kebersihan & Kenyamanan Kamar
cakwit moe,2023,5,hotel yang bagus sarapan lengkap,BUMN,Bintang 5,RoyalKrakatauCilegon,positive,Kualitas Makanan & Restoran
Bebey Thio,2021,5,Tempat baru seru buat nongkrong,BUMN,Bintang 5,RoyalKrakatauCilegon,positive,Harga & Value for Money
Nassa laundry,2020,4,pondok nya bersih terawat,BUMN,Bintang 5,RoyalKrakatauCilegon,positive,Kebersihan & Kenyamanan Kamar
achmad zulfikri,2024,4,bersih dan nyaman,BUMN,Bintang 5,RoyalKrakatauCilegon,positive,Kebersihan & Kenyamanan Kamar
Dadan M Tauhid,2019,5,Hotel terbaik masuk cilegon banten royale krakatau hotel konvensi golf,BUMN,Bintang 5,RoyalKrakatauCilegon,positive,Harga & Value for Money
Hendri Budiharto,2020,5,tempat yang bagus konsep hijau fasilitas lengkap,BUMN,Bintang 5,RoyalKrakatauCilegon,positive,Lokasi & Akses Strategis
Suradi Suradi,2022,4,bersih asri nyaman,BUMN,Bintang 5,RoyalKrakatauCilegon,positive,Kebersihan & Kenyamanan Kamar
Cubadak Masam Team,2021,5,mantap makanananya dan lingkungannya bersih,BUMN,Bintang 5,RoyalKrakatauCilegon,positive,Kebersihan & Kenyamanan Kamar
ASEP IMAM,2019,5,nginep disini bisa tidur pules nyaman,BUMN,Bintang 5,RoyalKrakatauCilegon,positive,Kebersihan & Kenyamanan Kamar
Dani Daryuniman,2023,5,nyaman dan bersih,BUMN,Bintang 5,RoyalKrakatauCilegon,positive,Kebersihan & Kenyamanan Kamar
Rizki Aulia Rachman,2020,5,enak tempatnya buat outdoor wedding,BUMN,Bintang 5,RoyalKrakatauCilegon,positive,Kualitas Makanan & Restoran
Tinfa Fatimah,2019,4,baksonya biasa saja,BUMN,Bintang 5,RoyalKrakatauCilegon,negative,Kualitas Makanan & Restoran
ade saftian,2020,5,menuunya mantap,BUMN,Bintang 5,RoyalKrakatauCilegon,positive,Kualitas Makanan & Restoran
Hinsa Uli,2025,5,semuanya terbaik,BUMN,Bintang 5,RoyalKrakatauCilegon,positive,Harga & Value for Money
Nana Sutrisna,2020,5,Tempat bagus dan ramah ramah pegawainya,BUMN,Bintang 5,RoyalKrakatauCilegon,positive,Pelayanan Staf & Keramahan
MUHAMMAD HARIZAL,2021,5,Mencoba membuat tes cat cpns,BUMN,Bintang 5,RoyalKrakatauCilegon,neutral,Harga & Value for Money
Marc Veenstra,2019,2,Ruang tua interior kotor dan kecoa masuk ruang makan berjalan di antara yang baik,BUMN,Bintang 5,RoyalKrakatauCilegon,negative,Kualitas Makanan & Restoran
Noor Fadlilah,2021,5,Hotel bagus Asri samping golf,BUMN,Bintang 5,RoyalKrakatauCilegon,positive,Harga & Value for Money
Eddi Mandai,2021,5,hotelnya nyaman,BUMN,Bintang 5,RoyalKrakatauCilegon,positive,Kebersihan & Kenyamanan Kamar
arung sabrang jagad,2021,5,tempat terindah dari kami nginap,BUMN,Bintang 5,RoyalKrakatauCilegon,positive,Lokasi & Akses Strategis
Dian Polasari,2019,4,tempatny nyaman dan bersih,BUMN,Bintang 5,RoyalKrakatauCilegon,positive,Kebersihan & Kenyamanan Kamar
Bagas Eka Saputra,2021,4,hotel nyaman dan bersih mantap,BUMN,Bintang 5,RoyalKrakatauCilegon,positive,Kebersihan & Kenyamanan Kamar
Bambam Ibrahim,2020,5,hotel dengan fasilitas paling lengkap di cilegon,BUMN,Bintang 5,RoyalKrakatauCilegon,positive,Harga & Value for Money
ger29von,2022,5,salah satu hotel terbaik di cilegon,BUMN,Bintang 5,RoyalKrakatauCilegon,positive,Harga & Value for Money
Ghie,2022,5,tempatnya luas enak,BUMN,Bintang 5,RoyalKrakatauCilegon,positive,Kualitas Makanan & Restoran
Za Kun,2025,4,baik,BUMN,Bintang 5,RoyalKrakatauCilegon,positive,Harga & Value for Money
Fir Daus,2024,5,Hotel yang sangat baik di Banten,BUMN,Bintang 5,RoyalKrakatauCilegon,positive,Harga & Value for Money
Indra Wati,2021,5,Bersiih enak nyaman,BUMN,Bintang 5,RoyalKrakatauCilegon,positive,Kebersihan & Kenyamanan Kamar
Nick Name,2021,5,bagus n bersih,BUMN,Bintang 5,RoyalKrakatauCilegon,positive,Harga & Value for Money
fahrur oji,2020,5,strategis nyaman sunyi tenang dingin,BUMN,Bintang 5,RoyalKrakatauCilegon,positive,Kebersihan & Kenyamanan Kamar
Hedi Sulyantiadi,2020,5,tempat untuk hajatan dan rapat yang mumpuni,BUMN,Bintang 5,RoyalKrakatauCilegon,positive,Lokasi & Akses Strategis
Yanwadi Amaq,2020,4,Kmaar bersih rapi dan di pusat kota,BUMN,Bintang 5,RoyalKrakatauCilegon,positive,Kebersihan & Kenyamanan Kamar
