User Name,Review Time,Rating,clean_text,Tipe,Kelas,Nama_Hotel,AI_Sentiment,AI_Aspek
Dwiputrabayu,2024,4,untuk kamar sudah oke bersih dan wangi makanan baik saat sarapan maupun sore teh enak2 keluhan sebatas di parkir saja yang terlalu sempit saya bolak balik parkir kok tidak diinfo ada fasilitas gratis layanan valet ya baru tau saat mau checkout jadi saya selalu parkir sendiri di ruang bawah tanah 3 dan selalu kesulitan terakhir pada saat mau checkout mobil kami terhalang 2 mobil yang parkir paralel untung petugasnya sigap tapi harus nyamperin dulu ke resepsionis,BUMN,Bintang 5,BWPremiereBandung,positive,Kebersihan & Kenyamanan Kamar
Dedi Texcoms,2025,5,baru saja menginap di Best Western premier la grande bandung dan saya sangat puas salah satu hal yang bikin pengalaman ini istimewa adalah tim kantor depan yang super sabar dan ramah dari awal kedatangan mereka menyambut saya dengan hangat dan menjelaskan semua yang saya perlu tahu tentang hotel saya sempat memiliki beberapa pertanyaan dan permintaan dan staf kantor depan selalu siap membantu dengan sikap yang tenang mereka benar benar mendengarkan dan memberikan solusi yang saat ini jadi saya merasa sangat diperhatikan kamar yang saya juga bisa nyaman ditambah lokasi hotelnya yang strategis jadi mudah banget untuk menjelajahi bandung saya sangat merekomendasikan hotel ini terutama karena pelayanan hebat dari tim kantor depan nya,BUMN,Bintang 5,BWPremiereBandung,positive,Pelayanan Staf & Keramahan
Anditya Nola Irvianty,2024,5,pertama sampai keamanan sigap membantu kami menurunkan barang bahkan ada salah satu keamanan yang ramah banget sampek ngajak anak saya bercanda anak anak diajak naik di troli saat anter barang ke kamar resepsionis memproses cek masuk dan cek keluar dengan cepat minta kartu akses lagi juga tidak ribet langsung dikasih saja pengalaman di hotel lain rata2 susah hanya bisa 1 kartu kamar luas bersih mewah penerangan agak kurang kalau untuk aktivitas di kamar kalau untuk tidur ya cocok lah remang remang kamar mandi bersih udara hangat langsung tanpa jeda dulu menunggu jalan yang sulit untuk pindah dari mandi ke bawah agak keras di dorong,BUMN,Bintang 5,BWPremiereBandung,positive,Kebersihan & Kenyamanan Kamar
Muhamad Arsyada,2024,5,menginap di lt 18 selama 4 hari 5 malam kamar luas dan bersih akan tetapi antri cukup lama waktu bersihin kamar makanan sarapan biasa saja ngga yang spesial banget tapi ada sore teh isinya buah rebusan dan cemilan cemilan kolam renang di lt 3a deket resto semi indoor tapi cukup kecil,BUMN,Bintang 5,BWPremiereBandung,positive,Kebersihan & Kenyamanan Kamar
Githa Kurnia,2024,5,Hotel yang sangat luar biasa staf ramah dapet cemilan sakit di lt 3 kolam renang udara hangat cocok banget buat anak aku sarapan enak dan variatif lokasi strategis banget nyebrang langsung bip aku dpt kamar lt 19 view nya cantik dan luar biasa indah lain kali akan kembali lagi nginap di best western bandung terima kasih ya,BUMN,Bintang 5,BWPremiereBandung,positive,Pelayanan Staf & Keramahan
Mavelya,2024,5,lokasinya strategis didepan bandung indah plaza jadi cuma nyebrang saja kalau ke mall depan hotel ada kfc dibelakang hotel ada kaya tinggal jalan kaki keluar hotel udah banyak kafe resto distro kamarnya luas pelayanan juga oke untuk varian makanannya banyak tapi kurang begitu enak untuk kelas bintang 4 makan harus pagi karena siang sedikit nanti waiting list karena restoran nya tidak begitu luas disini dilengkapi tempat gym yang cukup lengkap dan kolam renangnya ada udara hangat tapi kolam kecilnya overall aku suka menginap di sini,BUMN,Bintang 5,BWPremiereBandung,positive,Lokasi & Akses Strategis
Nazwa N.c,2025,5,Apa yang fantastis menginap di terbaik Western premier la grande kamarnya nyaman membuat mudah untuk bersantai kolam renang adalah bonus besar dan makanan yang lezat seluruh suasana yang menyegarkan dan baik dipelihara teriakan besar untuk Fifih untuk layanan luar biasa mereka yang ramah dan benar-benar membuat pengalaman saya khusus tidak sabar untuk kembali,BUMN,Bintang 5,BWPremiereBandung,positive,Fasilitas Hotel (Kolam/Gym/Spa)
Donean Pam,2024,5,Kamarnya sangat nyaman bersih dan rapi kami tinggal di lantai 19 jadi suasana kota Bandung tampak sangat indah terima kasih mrs fifih untuk upgrade gratis kamar saya sangat menghargai itu area kolam renang tidak terlalu besar tapi sangat nyaman dengan kolam renang hangat layanan sangat memuaskan akan pasti kembali lagi untuk tinggal di hotel ini terima kasih,BUMN,Bintang 5,BWPremiereBandung,positive,Kebersihan & Kenyamanan Kamar
Diana Rahardjo,2024,4,pengalaman yang menyenangkan bisa menginap di hotel ini lokasinya sangat strategis di tengah kota akses cari makanan atau ke mall tidak jauh berhadapan langsung dengan bip kamar baru sesuai dan menu sarapan cukup bervariasi dengan staf yang ramah sopan dan berdedikasi pada pekerjaan menginap 2 mlm di hotel ini semoga bisa kembali terimakasih,BUMN,Bintang 5,BWPremiereBandung,positive,Pelayanan Staf & Keramahan
La Dy,2025,1,Saya kecewa sama manajemen nya sama sellesnya dan pihak restonya,BUMN,Bintang 5,BWPremiereBandung,negative,Kualitas Makanan & Restoran
Fakhri Rido Muhammad,2024,5,pengalaman saya menginap di sini bersama istri dan anak saya sangat baik kita mulai dari semenjak kami sampai di hotel ini kami langsung disambut dengan senyum dan perlakuan sangat ramah dari semua staf hotel meskipun lobi hotel bisa dikatakan cukup kecil namun ruang dimanfaatkan dengan optimal untuk menyediakan sofa untuk pengunjung setelah kami memeriksa masuk kami menuju ke kamar lantai 9 pemandangannya cukup menarik karena dari jendela kamar kami dapat melihat jembatan pasopati bandung yang lampunya warna warni itu ketika malam dan juga bangunan berbentuk2 yang ada di daerah dago atas kamarnya sangat nyaman beralaskan karpet dan desain interior yang lembut yang ada terdapat,BUMN,Bintang 5,BWPremiereBandung,positive,Pelayanan Staf & Keramahan
RIN,2025,4,menghabiskan 2 malam di sana untuk perjalanan bisnis secara keseluruhan tidak ada masalah yang signifikan selama tinggal saya kamarnya cukup luas dengan pemandangan pegunungan masuk utara bandung suasana meskipun sedikit tua dan pilihan menu sarapan hanya baik-baik saja,BUMN,Bintang 5,BWPremiereBandung,positive,Kebersihan & Kenyamanan Kamar
Hendra Wennady,2025,5,Hotel ini memenangkan penghargaan di Indonesia Travel Tourism Award Stelah Saya coba g Salah sih pelayanan bagus mulai dari Bell Boy Security Room Service dan housekeeping smua bagus pelayanannya sarapan banyak variasi dan enak sih lokasi sangat strategis dan dekat kemana2 nice stay dan pasti comeback,BUMN,Bintang 5,BWPremiereBandung,positive,Kebersihan & Kenyamanan Kamar
Edwin Indera,2024,5,Hotel ini benar-benar layak solid 5 bintang fasilitas layanan kamar dan lokasi semua top notch membuatnya menjadi pilihan yang sempurna untuk kedua rekreasi dan bisnis tinggal kolam renang mereka di tingkat podium adalah fitur yang menonjol menawarkan hanya jumlah yang tepat sinar matahari membuat itu super nyaman untuk santai sore mandi penyebaran sarapan adalah sorotan lain aku tinggal selama 2 hari dan mereka memiliki berbagai pilihan lezat untuk kickstart hari Anda satu-satunya kecil hiccup adalah sistem parkir satu cara pintu keluar yang bisa menggunakan lebih banyak bantuan staf masuk ruang bawah tanah untuk manajemen yang lebih lancar,BUMN,Bintang 5,BWPremiereBandung,positive,Fasilitas Hotel (Kolam/Gym/Spa)
Najhan Muzakki,2025,5,luar biasa kamar bersih fasilitas gym dan kolam renang bersih satpam resepsionis sampai pegawai restoran ramah ramah maju terus best western,BUMN,Bintang 5,BWPremiereBandung,positive,Kebersihan & Kenyamanan Kamar
Jacqueline Vienna,2025,5,Ketika saya memasuki ruangan itu terasa seperti saya memasuki gerbang ke dalam dongeng ruangan itu adalah suasana yang sempurna yang rapi tanpa cacat setelah hari petualangan kolam renang sebuah permata berkilau yang mengisyaratkan relaksasi dan makanan oh makanan setiap gigitan adalah surat cinta untuk selera saya tapi orang yang mencuri acara baik ghea dan farhan yang kebaikan dan pesona menerangi seluruh pengalaman mereka menuangkan hati mereka ke setiap detail membuat pengalaman luar biasa sementara tinggal jika Anda lagi merindukan melarikan diri romantis atau hanya sentuhan sihir ini adalah tempat Anda i,BUMN,Bintang 5,BWPremiereBandung,positive,Kebersihan & Kenyamanan Kamar
Roy Setiawan,2024,5,memesan 2 kamar yang eksekutif tetapi beda lantai saya permintaan kamar sebelahan malah di menganjurkan tukar yang keluarga suite dengan syarat menambah biaya kamar saya tanya menambah brp eh saat di tanya ke manajer ny tambah berapa malah di kasih gratis alias gratis tidak menambah kamar keluarga luas 2 kamar 2 kamar mandi 1 ada mandi ruang tamu dapur set microwave kolam renang udara nya bener2 hangat dan indoor ttp sampai jam 8 mlm kamar bersih ac dingin kasur bantal akan empuk sgt nyaman menginap se x pasti lg d sini kalau ke bandung karena anak suka berenang dan berjam2 berenang d sini anak aman tidak kedinginan,BUMN,Bintang 5,BWPremiereBandung,positive,Kebersihan & Kenyamanan Kamar
Emi Sriyanti,2025,5,sumpah kamarnya bener2 nyaman banget bangeet sampe anak gk mau plg hotel terbaik barat ini paket komplit dengan harga yang layak bayangin saja kolam renang nya anget kamar alas karpet dpt sofa fasilitas kamar mandi dpt lengkap banget jarang hotel yang nyediain alat jait disini adaa emang sedebest itu pokonya luph ma hotel ini rencana liburan bsok mau nginap disini lagi,BUMN,Bintang 5,BWPremiereBandung,positive,Kebersihan & Kenyamanan Kamar
Yohanes Adi Tedjo Kusumo,2025,4,kamar cukup oke dsb juga lokasi juga oke cuma parkir mobil kayak parkir mobil minion sempit banget,BUMN,Bintang 5,BWPremiereBandung,negative,Kebersihan & Kenyamanan Kamar
Meylan,2024,5,hotel dengan pelayanan yang bagus kebetulan kemarin pesen kamar tipe superior krna belum siap jadi diupgrade ke eksekutif jadi dapet toilet yang bak mandi letaknya jg strategis persis sebrang bip dan klo mau kemana2 tuh deket banget aksesnya pelayannya hampir seluruh staf ramah ada gratis valet gratis kopi istirahat dari jam 15 00 17 00 wib krna tidak semua hotel menyediakan kopi istirahat seperti di sini oia dan satu lg baru kali ini tinggal di hotel bandung tapi di toiletnya menyediakan jarum benang penis kecil di mana yang suka kembali itu adalah alat yang sangat dibutuhkan secara mendadak terima kasih untuk pelayanannya luar biasa akan,BUMN,Bintang 5,BWPremiereBandung,positive,Lokasi & Akses Strategis
NisaNurul Zakiah icca,2024,5,pengalaman menginap dan berlibur yang sangat menyenangkan di best western bandung mulai dari pelayanan karyawannya yang sangat ramah dan membantu kamar yang luas resik dan rapi kolam renang udara hangatnya cocok buat anak anak sarapan dan sore snacknya enak enak semua dan lokasi hotelnya sangat strategis terima kasih banyak terbaik barat bandung,BUMN,Bintang 5,BWPremiereBandung,positive,Pelayanan Staf & Keramahan
Ali Sahid Nurkholis,2025,5,Hotel terbaik barat emang rekomendasi banget kolam renangnya ada udara hangat tidak takut kedinginan kalau berenang malem view nya bgus banget lokasi nya juga strategis depan belakang ada mall pelayanan nya juga pda ramah bnget,BUMN,Bintang 5,BWPremiereBandung,positive,Lokasi & Akses Strategis
Khoerul Fahmy,2024,4,kali ke dua menginap di best western kamar cukup nyaman kolam renang favorit anak saya karena udara hangat saat akhir pekan kondisi parkir sangat padat tapi untungnya ada vallet gratis besok pagi saat sarapan resto penuh kita masuk daftar tunggu cukup lama sayang tidak ada kursi untuk menunggu tapi terobati sama makanan2 yang enak dan staf yang sangat membantu saran saja mungkin bisa ditambah meja atau kursi pada saat menunggu hotel ramai jadi saat daftar menunggu nya tidak terlalu lama,BUMN,Bintang 5,BWPremiereBandung,positive,Pelayanan Staf & Keramahan
Mochamad Dicky Septian,2025,5,kamar sangat nyaman pelayanan memuaskan,BUMN,Bintang 5,BWPremiereBandung,positive,Kebersihan & Kenyamanan Kamar
Dedi Andri,2025,5,hotelnya bersih pelayanan bagus dan dekat dengan tempat kulner dan pusat perbelanjaan,BUMN,Bintang 5,BWPremiereBandung,positive,Kebersihan & Kenyamanan Kamar
Tutwuri Anggarwani,2025,5,sangat dianjurkan hotel masuk bandung staf yang ramah bersih dan sarapan yang baik,BUMN,Bintang 5,BWPremiereBandung,positive,Pelayanan Staf & Keramahan
Fadilla Nurul,2024,5,lokasi puncak ditengah kota mudah cari jajanan kamar standarad lah ya nyaman view dari kamar atas tapi tempat parkir kecil banget untungnya ada layanan vallet gratis restoran sibuk banget akhir pekan kali yah harus daftar tunggu untuk mba mas ya gercep menu sarapan juga banyak pilihan favorit glutten gratis pasta nya tidak kalah enak menu kopi sarapannya,BUMN,Bintang 5,BWPremiereBandung,positive,Lokasi & Akses Strategis
Khairul Fikri,2025,5,memiliki waktu yang luar biasa tinggal di premier la grande terbaik barat kamarnya sangat nyaman dan sempurna kolam renang adalah ledakan dan makanan benar-benar lezat seluruh tempat merasa segar dan santai besar berteriak ke ghea dan afifah untuk menjadi total rockstar mereka menangani segalanya dengan campuran keren seperti profesionalisme dan persahabatan 10 10 akan merekomendasikan tempat ini kepada siapa pun mencari tinggal yang besar,BUMN,Bintang 5,BWPremiereBandung,positive,Fasilitas Hotel (Kolam/Gym/Spa)
edwin nugraha,2025,5,makanannya enak lokasi strategis,BUMN,Bintang 5,BWPremiereBandung,positive,Kualitas Makanan & Restoran
Bams Apt,2025,5,Selalu menyenangkan tinggal di sini anak2 suka karena kolam airnya hangat lokasi dekat mana mana lantai atas view dago atas yang terbaik,BUMN,Bintang 5,BWPremiereBandung,positive,Lokasi & Akses Strategis
Athaya Hafiz,2025,5,baru 2x sih nginep di sini karna rekomendasi dari temen suami yang pertama pelayanan nya top banget ramah cepat kebersihan dan makanan nya enak banget pilihan menu nya banyaakk rekomen banget klo liburan keluarga ke bandung nginep disini kolam renang udara hangat bersih selanjutnya insyaallah disini lagi,BUMN,Bintang 5,BWPremiereBandung,positive,Pelayanan Staf & Keramahan
pendi su,2024,5,hotel dekat mana mana mana tapi yang ganggu awalnya parkir jauh ke basmen dan jalan sempit info parkir sudah penuh juga tidak ada dari petugas setelah balik lagi info parkir penuh akhirnya kita di bantu paket gratis dan cukup membantu kamr bersih rapi sayang menanam aga bocor jadi mandi mana jika di barulain tapi untuk makanan nya oke menu bayak dan jam 3 sore kita gratis jajanan badung,BUMN,Bintang 5,BWPremiereBandung,positive,Kebersihan & Kenyamanan Kamar
Dina,2025,5,Best Western Premier La Grande Bandung adalah salah satu hotel terbaik yang pernah saya tinggal saya benar-benar menikmati berada di sana terutama karena front office tim mereka lakukan cepat cek masuk dan memberikan layanan yang sangat baik terutama ketika saya memiliki begitu banyak permintaan kamar itu benar-benar hebat dan nyaman ketika saya memiliki kesempatan saya akan pergi ke sana lagi,BUMN,Bintang 5,BWPremiereBandung,positive,Pelayanan Staf & Keramahan
ARIEF MARDIYANTO,2025,5,sangat menyenangkan kebersihan pelayanan yang ramah dan dekat akses kemana mana mana,BUMN,Bintang 5,BWPremiereBandung,positive,Pelayanan Staf & Keramahan
Mursalin A Rachman,2024,5,overall pelayanan semua staf dari security valley parking receptionist dan team restaurant crew sangat memuaskan sekali ramah ramah dan dukungan untuk fasilitas lobby kamar sangat bagus bersih dan saat ini dapat melihat yang bagus banget kamar 1807 untuk harga kamar sangat terjangkau termasuk sarapan makanan variatif dan enak terima kasih untuk sambutan dan ramah tamah teamnya,BUMN,Bintang 5,BWPremiereBandung,positive,Kebersihan & Kenyamanan Kamar
Ayu Wulandari,2024,5,letak hotelnya sangat strategis dekat dengan mall kamarnya luas dan nyaman menu sarapannya sangat bervariasi dan bermacam macam jenis makanan bisa didapatkan pelayanannya cepat ramah dan sopan hotelnya sangat rekomendasi untuk liburan dan menikmati hari bersama keluarga,BUMN,Bintang 5,BWPremiereBandung,positive,Kebersihan & Kenyamanan Kamar
Titan Rahadian,2024,5,staycation yang luar biasa bersama keluarga dari mulai masuk hotel perhotelan yang baik kamar luas dengan fasilitas yang lengkap sampai ada set jahitan kita tepat di kamar lantai 15 dengan pemandangan bagus saat sarapan di lantai 3 berbagai menu makanan lengkap ada bubur ayam roti donat mie rebus waffle bajigur gorengan buah buahan terutama nasi goreng yang enak tim resto yang cekatan sampai bantu saya untuk foto dengan keluarga selanjutnya fasilitas kolam renang semi outdoor yang hangat membuat anak-anak betah bermain udara untuk tempat kami mengunjungi mall legendaris yaitu bip karena tepat didepan bisa menyebrang lewat jpo semoga lain kali bisa menginap lagi,BUMN,Bintang 5,BWPremiereBandung,positive,Kualitas Makanan & Restoran
vini sulfiyani,2024,5,kamar deluxe luas bersih ac dingin lembaran tempat tidur bersih tidak bau udara di kamar tetap segar wlpn jendela tidak bisa dibuka tidak ada balkon ada meja kerja dan sofa meja kopi kamar kedap suara wlpn dekat jalan bahkan merasa senyap tidak ada suara dari luar minusnya belum smart tv pilihan sarapan menu banyak tempat duduk banyak bahkan ada pembuat kopi yang bisa memilih espresso kopi hitam cappuccino untuk rasanya juga lumayan enak enak lokasi indah strategis depan belakang mall banyak makanan panas makanan jalan juga ada ke daerah yang menarik juga di bawah 2 3km kolam renang wlpn tidak terlalu besar tapi udara dan dan semi indoor jadi tidak ked,BUMN,Bintang 5,BWPremiereBandung,positive,Kebersihan & Kenyamanan Kamar
Halida Budining,2025,5,terletak masuk bandung pusat kota jarak berjalan kaki ke bip bec juga banyak restoran lobi sedikit kecil ada pelayan tersedia karena tempat parkir terletak masuk b2 kamar adalah luas lengkap fasilitas membantu staf ramah desain kamar dan kain tidur sedikit membosankan dan tua tetapi masih baik dipelihara secara keseluruhan itu adalah tinggal yang baik,BUMN,Bintang 5,BWPremiereBandung,positive,Kebersihan & Kenyamanan Kamar
Muhammad Aulia Rachman,2024,5,pernah kesini beberapa waktu yang lalu karena tertarik dengan desain lobi masuk yang tidak begitu besar suasana resto parc de ville cukup nyaman jika sepi dan tidak banyak pengunjung serta variasi sarapan yang diberikan oleh bw premier la grande bandung cukup beragam lokasinya yang strategis juga menjadi nilai tambah untuk bw premier la grande sebagai salah satu hotel yang cocok untuk menginap selama beberapa hari karena letak hotel yang dihimpit oleh bip persis di depan serta bec dan soes merdeka di belakang,BUMN,Bintang 5,BWPremiereBandung,positive,Lokasi & Akses Strategis
Ang Leonard Anthony,2024,5,lokasi hotelnya sangat strategis di tengah kota berseberangan dengan plaza bip bangunan hotel juga menyatu dengan kfc sehingga mudah mencari makan lobbynya tidak terlalu besar stafnya mulai dari keamanan sampai ke kantor depan sangat ramah untuk kamar lumayan luas dan nyaman kebersihan juga masih sangat terjaga sarapan pagi menu menuunya sangat beragam lokal hingga internasional area duduk juga tersedia banyak di restoran di lantai 3 ada area dalam dan luar untuk perokok di lantai 3a ada pusat kebugaran kolam renang dan kolam spainya bisa dikatakan semi luar karena masih dinaungi oleh badan gedung gymnya cukup luas dengan alat yang cukup lengkap min,BUMN,Bintang 5,BWPremiereBandung,positive,Kebersihan & Kenyamanan Kamar
melda milduth,2025,5,secara keseluruhan best western sangat baik dan memuskan untuk saya sekeluarga dengan fasilitas lengkap lokasi di tengah kota kolam renang pun hangat dan atapnya tertutup sarapan yang didapat pun enak rasanya pokoknya pilihan tepat membawa anak2 dan keluarga menginap di best western kerenn deh,BUMN,Bintang 5,BWPremiereBandung,positive,Fasilitas Hotel (Kolam/Gym/Spa)
zaily oktosab,2025,5,nyaman pelayanan prima keren terima kasih dan sukses selalu,BUMN,Bintang 5,BWPremiereBandung,positive,Kebersihan & Kenyamanan Kamar
Iskandar Zulkarnain,2025,4,Lokasi adalah di jalan merdeka bandung sedikit di dalam dari jalan utama kali ini kami datang untuk istirahat puasa dengan keluarga kami telah memesan masuk advance masuk lobi tidak terlalu luas ada beberapa sofa kursi kami tiba sekitar jam 5 sore dan langsung ke restoran parc de ville di lantai 3 itu masih tenang tapi makanan dan minuman siap ketika panggilan maghrib untuk doa terdengar atmosfer nyaman tidak penuh sesak masih cukup luas dan semua yang Anda bisa makan beberapa warung menu yang saya ingat adalah makanan timur tengah kebab nasi mandi,BUMN,Bintang 5,BWPremiereBandung,positive,Lokasi & Akses Strategis
Eneng Fitri Juariah,2025,5,sudah dua kali menginap di hotel ini karena di rekomendasi kan teman dan memang sangat puas pemandangannya sangat saat karena menyusahkan kota bandung yang indah di antara dua mall juga jadi kalau mau belanja sangat dekat pelayanannya juga sangat bagus pegawainya sangat ramah untuk sarapan nya sangat bervariasi menu mulai dari appetizer sampai dessert nya sangat enak semua puas,BUMN,Bintang 5,BWPremiereBandung,positive,Pelayanan Staf & Keramahan
nuratiqah rosli,2025,5,Tolong pertimbangkan untuk tinggal di sini karena sepi terpusat ke mana saja dekat sebuah mall dan ada tempat cuci pakaian dekatnya fasilitas baik dan staf semua ramah,BUMN,Bintang 5,BWPremiereBandung,positive,Pelayanan Staf & Keramahan
Anindiaartika Sari,2025,5,kamarnya cukup bersih sarapan sangat enak dan bervariasi,BUMN,Bintang 5,BWPremiereBandung,positive,Kebersihan & Kenyamanan Kamar
Widya Aprilia Kurnia,2024,5,menginap di hotel ini semalam cukup menyenangkan lokasinya dengan dari mana mana dari stasiun dekat dari tempat makan dan tempat belanja juga dekat pelayanan juga ramah mulai dari pintu masuk kantor depan dan juga petugas di restoran kamarnya cukup lega dengan ukuran kasur yang cukup lebar meskipun bahkan bisa untuk 2 orang meskipun ukuran twin bed kamar mandi nyaman tetapi ruang tamu agak mampet airnya menu makanannya beragam ada menu barat dan menu lokal ada roti rotian jajanan lokal dan lain-lain menu enak enak waktu itu sempat ketinggalan dompet di kamar dan Alhamdulillah bisa diamankan petugasnya,BUMN,Bintang 5,BWPremiereBandung,positive,Pelayanan Staf & Keramahan
Ratihsari Rahmi,2025,5,fasilitas nyaman kamar bersih makanan enak enak letak depan bandung indah plaza jika laper ada buka 24 jam tinggal nyembrang karyawannya hampir semua ramah,BUMN,Bintang 5,BWPremiereBandung,positive,Kebersihan & Kenyamanan Kamar
kiswanta kiswanta,2024,5,terima kasih sarapan hotel barat terbaik nya banyak variasi menu enak dan lezat kamarnya bersih dan rapi pelayanan dari resepsionis keamanan petugas parkir dan ob ramah dan pelayanan prima alhamdulillah sudah 3 kali ini tinggal di hotel ini,BUMN,Bintang 5,BWPremiereBandung,positive,Kebersihan & Kenyamanan Kamar
Khansa Aqilah,2025,5,lokasi strategis kamarnya nyaman,BUMN,Bintang 5,BWPremiereBandung,positive,Kebersihan & Kenyamanan Kamar
M,2024,5,Salah satu hotel di kota bandung yang sangat strategis terletak di tengah kota dekat dengan mall tempat makan dan taman pengalaman menginap yang baik staf yang ramah dan sopan makanan yang disajikan sangat enak dengan pemandangan yang bagus dianjurkan buat yang mau nginap di pusat kota bandung,BUMN,Bintang 5,BWPremiereBandung,positive,Pelayanan Staf & Keramahan
Olivia Firdaus,2025,4,kamar luas dan nyaman lokasi strategis dekat dengan tempat kuliner sarapan enak dan bervariasi,BUMN,Bintang 5,BWPremiereBandung,positive,Kebersihan & Kenyamanan Kamar
Phuby Zaskia,2024,4,kamarnya cukup luas sarapannya variatif parkirannya saja yang agak ruwet tapi bisa dibantu oleh petugas valet nya dan gratis valet parkir untuk lokasinya strategis didepan mall jadi klo bosan di hotel bisa langsung jalan kaki nyebrang ke bandung indah plaza,BUMN,Bintang 5,BWPremiereBandung,positive,Lokasi & Akses Strategis
Astri Texcoms,2025,5,Hotel ini sangat ramah dan terjaga dengan baik. Terima kasih kepada Farhan Mba dhiya dan Mba FIFA atas keramahan mereka yang luar biasa. Mereka sangat profesional dan membuat saya merasa seperti di rumah.,BUMN,Bintang 5,BWPremiereBandung,positive,Pelayanan Staf & Keramahan
Galathea Galathea,2025,5,Kebahagiaan staf membuatku tak terlupakan. Aku ingin kembali ke sini dan menikmati perjalananku.,BUMN,Bintang 5,BWPremiereBandung,positive,Pelayanan Staf & Keramahan
deviana dalila,2024,5,sangat nyaman bersih pelayananya ramah2 lokasi srategis yang tidak bw kendaraan jalan kemana saja deket dpt pemandangan terbaik d lt 18 kamarnya luas sekalii dpt promo hargaa murah layaknya sii bakal balik lagi kalau ke bandung,BUMN,Bintang 5,BWPremiereBandung,positive,Kebersihan & Kenyamanan Kamar
Hapsari R,2024,5,akan pasti kembali ke staycation kami di hotel ini staffnya ramah dari mulai front office resto dll kamarnya bersih dan fasilitasnya nya dapet banyak bangett kolamnya udara anget dan indoor tapi sayang sudah ngga boleh untuk umum makanannya juga enak dan banyak pilihannya top banget pokonyaa,BUMN,Bintang 5,BWPremiereBandung,positive,Kebersihan & Kenyamanan Kamar
Ahmataljay Simanjuntak,2024,5,untuk pelayanan sngat bagus apalgi dgan smua staf nya pada ramah saya suka lokasi yang cukup strategis dkt dengan pusat kota untuk kebersihan kamar saya cukup snang karna bisa beristirahat degan nyaman kamarnya rapi bersih,BUMN,Bintang 5,BWPremiereBandung,positive,Kebersihan & Kenyamanan Kamar
Adeline Sheisariani,2024,5,hotel kawasan tengah kota bandung dengan pelayanan memuaskan dan fasilitas lengkap cocok untuk liburan bersama anak ataupun keperluan bisnis menyuguhkan menu sarapan dengan banyak varian dan rasa yang lezat terimakasih best western premier la grande hotel bandung,BUMN,Bintang 5,BWPremiereBandung,positive,Kualitas Makanan & Restoran
fey swan,2024,5,terima kasih atas pelayanannya selama saya menginap di hotel terbaik barat bandung semuanya sangat nyaman pelayanan luar biasa dan staf juga sangat ramah terutama yang di resepsi semuanya baik tidak ada yang perlu diperbaiki menurut saya semoga sukses selalu untuk hotel terbaik barat bandung,BUMN,Bintang 5,BWPremiereBandung,positive,Pelayanan Staf & Keramahan
