User Name,Review Time,Rating,Review Text
haikal fahrizza,2025-02-01,5,Hotel raffles sangat indah untuk dilihat dan fasilitas sangat lengkap dan membuat tamu merasa seperti di rumah yang utama adalah bahwa hotel ini adalah top notch dan yang lebih unik adalah bahwa hotel ini terhubung ke sebuah pusat perbelanjaan jadi akan mudah ketika Anda membutuhkan sesuatu dan berbelanja di sana
Rizki Umi Amanah,2025-01-01,5,Saya menginap di sini Rabu Kamis kemarin 22 23 Mei 2024 atas undangan pemimpin tercinta saya mam fifi proklawati jubilea karena murah hati saya bisa merasakan keramahan dari raffles hotel semua pegawainya penuh senyuman terutama pegawai di restoran sangat membantu rasa makanannya saat sarapan jadi tambah nikmat di setiap sudut ruangannya terasa wangi terutama ruang doa nya di lantai bawah senang banget saat di kamar bagian kamar mandi ada 2 keset yang cukup besar dan itu sangat berarti karena tidak semua hotel menyediakan keset seperti itu kamar mandi tetap kering jaga petugas di pintu menghubungkan hotel dan lotte mal saat hari kamis tidak sesi
Feby Budi Dayono,2025-01-01,5,Berita bagus untuk vegan masuk jakarta tempat ini sebenarnya salah satu favorit saya masuk jakarta tapi saya tidak tinggal di sini sejak covid tapi kali ini saya kembali untuk teh sore di bar penulis dan itu seperti menemukan harta karun karena mereka membuat paket teh sore vegan untuk saya ini jarang masuk jakarta tho Anda perlu memesan setidaknya satu hari masuk sebelumnya itu layak itu semua itu bagus melihat gambar diri Anda salah satu staf danielle adalah seperti cinta informatif akomodasi membuat kunjungan saya bahkan lebih menyenangkan mencintai semua pengalaman saya telah pasti
Irma M Puspitasari,2025-01-01,3,saya menginap 1 malam tgl 11 juli di kamar 2108 untuk pekerjaan proses cek masuk cepat kamarnya luas ada 2 tv kasurnya besar dan nyaman ada tambahan tempat tidur ada coklat pesan selamat datang toilet bidet yang hangat mandi mandi setrika mushola yang bersih di lobi semuanya bagus kecuali sarapan saya ditawarkan dibuatkan omelet saya mengiyakan tapi sudah 30 menit tidak datang2 pada saat 15 menit menunggu saya bertanya omelet saya mana menjawab pertanyaan dulu oke tapi sampai 30 menit tidak datang2 padahal restoran tidak terlalu banyak teman saya jg minta dibuatkan waffle demikian terpaksa sarapan yang lain jika tidak gt ditawarkan dibuatkan omele
Reflia Yusramdaleni,2025-04-01,5,Coba makan malam atau sarapan di Art's Cafe Anda akan terkejut saya menulis review penuh di Tripadvisor harus memeriksa keluar untuk informasi lebih rinci layanan butler yang sangat baik akan senang untuk kembali pasti
YULI TOPSELL,2025-01-01,5,Kali ketiga menginap di hotel mewah bisa dini cek masuk dengan ballroom yang viral dian ballroom yang luas punya akses langsung ke mall dapat kamar superior yang sangat luas
Arif Syauqi,2025-01-01,5,mushollanya bagus bersih dan menyediakan kebutuhan sholat dengan amat sangat layak kamar mandi menyediakan lotion tubuh sangat jarang ditemui di hotel hotel lain
Maria Miranda,2025-03-01,5,pergi ke bar penulis dan bersenang-senang di sana disertai dengan koktail manis jakarta s sling oleh bartender akbar enak bitterballen oleh satu dan hanya koki kani jujur berbicara itu adalah bitterballen terbaik saya pernah memiliki ringan dan sangat lezat terima kasih koki dan semua disajikan oleh terbaik fendi terima kasih untuk membuat malam Valentine saya yang tak terlupakan
Abdullah Mubarak Bin Abdul Rahman,2025-01-01,5,Pengalaman besar tinggal di dan benar-benar baik sarapan dan minuman di Writers Bar benar-benar benar-benar benar-benar hebat dan layanan yang luar biasa oleh Ms Danielle setiap kali kami datang ke sini dia benar-benar menyambut kami dan akomodasi kami benar-benar baik terima kasih Ms Danielle teruskan
heidy khadiza,2025-05-01,5,overall sangat baik kamar bersih modern luas pelayanannya sangat baik team butler sangat komunikatif dari segi rasa makanan semua enak
El-Farizha,2025-02-01,5,Saya sangat suka dengan hotel raffles jakarta karena furnitur di hotel nya sangat cantik dan hotel nya sangat artistik semua makanan di petteserie sangat lezat serta pelayanan nya sangat baik dan ramah kolam renang dan taman nya memberikan suasana yang menenangkan
Dany Khan,2025-01-01,5,Danielle adalah seorang pengawas bar yang hebat dia membuat kita tinggal begitu indah kami mencintai penulis bar dan staf di sana terima kasih untuk membuat kita tinggal di raffles hebat kita tidak bisa menunggu untuk kembali ke Jakarta
sabrina nur roihanah,2025-02-01,5,Saya sebelum saya sempat melihat di Tiktok mengenai raffle hotel dan saya sangat suka karna memiliki keseluruhan yang sangat indah ketika saya datang dan melihat lobi baru saya sangat tertarik dengan interior dan segala lukisan yang ada di setiap sudut
Dhemi Harlan,2025-01-01,4,merupakan hotel yang baik dalam rangka menghadiri acara akad nikah dari anak putri dari sepupu perempuan di hari minggu sekitar jam 11 an sampai di acara yang berkesan makan siangnya cukup enak
Bayu Saputra,2025-12-01,5,Jacarta menawarkan layanan luar biasa kenyamanan mewah dan kehangatan sejati setiap detail mencerminkan keanggunan dan perawatan membuat setiap menginap benar-benar tak terlupakan
Yue Ting Ophelia Wan,2025-12-01,5,memiliki pijat tubuh yang sangat menggemaskan dan perawatan wajah oleh Rieka
Dika,2025-01-01,5,suka banget sama pelayanan dihotel ini dari masuk sudah disambut dengan senyum staf yang berjaga di kolam bahkan petugas tamannya juga ramah dan selalu senyum saat papasan walau saya bukan penghuni residensi ataupun tamu hotel senang banget kalau ngajar disini fasilitasnya lengkap mulai dari handuk sabun sampo kondisioner sama lotsi ada pengering rambut juga hr ini saat mengajar tiba tiba hujan tidak sempet selamatin barang barang tapi tanpa diminta ternyata di selamatin stafku kolam masyaallah baik banget bapaknya keren banget sih ini hotel
Ethan,2025-12-25,5,Makanan itu luar biasa dan layanan Kevin itu hebat.
Jesslyn Halim,2025-11-01,5,pengalaman luar biasa di lotre jakarta pelayanan butler hangat dan perhatian
Luthfiana Rahma,2024-01-01,5,ruang yang luas Anda dapat menikmati bersama dengan desain mewah terasa lebih dari rumah mereka juga memiliki layanan yang bagus bagian yang paling tak terlupakan adalah hidangan masuk kafe seni daging sapi khusus hari ini adalah harus mencoba dan pencuci mulut semua enak lokasi terbaik untuk Anda yang ingin jendela belanja masuk tengah hari kerja sibuk namun ruang pertemuan cukup kecil untuk 18 orang untuk membawa selama kunjungan saya saya sarankan Anda untuk memastikan tentang ruang untuk setiap ruang pertemuan di muka
Evan,2025-12-11,5,Chef masakan Reza Dan Chef John mantap kali
Safinatun Najah,2025-01-01,5,hotelnya sangat bagus dan nyaman sekali stafnya ramah2 dan untuk tipe kamarnya juga ada banyak nyaman pelayanannya sangat baik serta lokasinya sangat strategis karena terhubung dengan banyak fasilitasnya juga ada untuk gym ada lapangan tenis sangat rekomen
Favorit Favorit,2025-01-01,1,tolong donk pihak manajemen supaya di benahi sistem parkir untuk kurir biar seperti tetangga gedung somerset menyediakan parkir kurir ascott menyediakan parkir kurir raflest residence pun menyediakan parkir kurir terkesan miskin tau hotel gk menyediakan parkir kurir gedung paling tengah suruh parkir luar gedung yang tak ada pantauan keamanan seharusnya himbauan nya kepara penghuni dan calon penghuni gedung agar tidak diperkenankan berurusan kurir pengantaran online paksain ja cari makan dan minum dari dalam hotel keamanan lobi juga tak ada ramah2nya terlihat elit tapi norak
Ernest Vanros,2025-06-01,5,Tempat masuk di jantung Jakarta dikelilingi oleh kantor pusat perbelanjaan hotel yang cukup elegan salah satu hotel terbaik dengan staf yang ramah dan courtesans
Teguh Gan,2025-01-01,5,Kami memiliki pengalaman yang hebat tinggal di sini kamar itu sangat luas dan mereka memiliki bak mandi yang sangat nyaman semua kamar di sini adalah suite seperti jadi Anda akan memiliki ruang tamu terpisah dengan kamar tidur jangan lupa untuk menikmati sarapan yang indah dan menyelesaikannya dengan dessert yang indah juga minuman sambutan sangat berharga total jumlah Anda menghabiskan untuk harga kamar catatan hotel ini terletak masuk bangunan yang sama dengan ciputra world mall jadi sangat nyaman Anda juga bisa berjalan di seberang jalan untuk mengunjungi itc kuningan mal duta atau bahkan kuningan city mall
Rudy Ikhwanto,2025-10-01,3,Air panas lama dan angkat bersuara kurang enak
Pauline Douglas,2025-01-01,5,Kami memiliki waktu yang indah dari awal sampai akhir raffles adalah permen khusus dan kesempatan untuk mengalami pujian dan keindahan tidak biasanya diberikan kepada orang biasa dan adalah sesuatu yang harus Anda alami sayangnya saya membawa penyakit Australia jadi tidak beranjak jauh dari hotel tapi kami memiliki sarapan membawa kita masuk suite dan makan masuk malam masuk ruang eksekutif di mana seorang koki menakjubkan menghasilkan 5 topi mini rasa untuk tamu pengalaman indah terima kasih
Adrian S,2025-01-01,5,Saya harus mengatakan ini adalah salah satu hotel terbaik masuk jakarta masuk syarat layanan saya mencoba setara untuk bonvoy dan layanan mereka tidak dapat memenuhi apa raffles dapat lakukan staf sangat memperhatikan mereka mengenali Anda dan melakukan setiap upaya untuk mengantisipasi kebutuhan Anda misalnya mereka pelayan tahu apa yang saya gunakan untuk memesan dan menyarankan soda mulberry setiap kali saya memeriksa masuk dianjurkan ini adalah minuman tandatangan mereka kamar-kamar mereka luas dan mereka mengenali semua anggota accor platinum seperti saya manajer mencatat cemilan gratis dan cokelat dan lainnya Anda dapat memesan lebih dari teh dan kopi tidak seperti
Kevin Pasha Putra Adra,2025-02-01,5,Saya merasa sangat homie disini saat ke penulis bar interior nya sangat bagus dan sebagai sebuah bar kasual ini adalah salah satu bar terbaik di jakarta staf nya sudah pasti sangat ramah
Mahdi Koplak,2025-08-01,5,Saya sangat senang bisa menginap di hotel raffles jakarta karena saat saya berada di hotel raffles saya seperti di rumah sendiri dan di sambut hangat oleh staf di sana ini pengalaman saya yang sangat istimewa dan sangat bahagia berada di hotel raffles jakarta
Eiffeline Sukma,2025-02-01,5,Saat saya masuk ke lobi itu bagus mewah artistik view kamar nya juga bagus padahal standar kamar tapi ttep bisa menikmati pemandangan kota
callysta Putri,2025-08-01,5,kamarnya luas dan bersih pelayan nya ramah
Max Gomaa,2025-12-11,5,Selalu di atas level di sini Chelsea servernya luar biasa
Dilys Chia,2025-01-01,5,Lotre Jakarta benar-benar salah satu hotel terbaik saya tinggal masuk dengan layanan makanan yang sempurna dan kamar tingkat atas yang selalu bersih tanpa cacat memiliki tempat tidur yang paling nyaman dan sangat baik dipertahankan terima kasih untuk tinggal yang indah dan nyaman dan membuat tamu merasa seperti di rumah jauh dari rumah saya pasti akan memilih lotre lagi kapan saya kembali masuk jakarta
Kim,2025-07-01,4,staf yang baik dan ramah sangat responsif dan memberikan layanan yang dipersonalisasi terutama untuk masuk suite tinggal dan makan
marjorie winata,2025-01-01,5,hotel mewah dengan desain interior wah setiap sudut sangat menarik kamar hotel sangat bersih seperti di rumah sendiri karena dibersihkan 2x karpetnya pun bersih saat diinjak ranjangnya besar sekali lega ada pintu pembatas tempat tidur pelayanan dari para staf hotel pun sangat ramah sigap puas sekali lokasi hotel strategis
raadws,2025-02-01,5,lobi nya terlihat mewah sangat indah sekali bisa langsung melihat lampu kota
Nisa Ibis Saraswati,2025-03-01,5,Aku sudah tinggal di sini tiga atau empat kali dan selalu memiliki pengalaman yang hebat layanan makanan dan toko dekat pelayan bernama Leiry sangat baik untuk keluarga saya terutama putriku layanan nya sangat cepat dan waktu baik untuk melihat Anda paman Leiry berharap untuk melihat Anda lagi segera
Gentle Man,2025-03-01,4,membutuhkan layanan yang lebih baik terutama masuk ruang penulis dan ruang kebugaran memiliki beberapa pengalaman buruk secara keseluruhan semua baik terima kasih undian jakarta cheers
apipp,2025-02-01,5,lobby nya luas lukisan nya bagus dan ada kafe juga dsana kamar nya bersih nyaman pemandangan nya bagus dan interior dari lobby dan kamar nya indah
AjEu MiCkEy,2025-11-01,5,hotel nya bagus pelayanannya ramah
Aris Pradinata,2025-08-01,5,raffles hotel jakarta adalah hotel mewah dan memiliki fasilitas yang baik seperti kualitas tinggi keamanan dan kamar keamanan spa ruang pertemuan dan kemudian memiliki karyawan dari jantung mewah untuk melayani tamu dan lokasi strategis
Amanda Pahlawan,2024-01-01,5,Layanan yang luar biasa kamar yang sangat bersih dan fasilitasnya sarapan yang luar biasa juga banyak kegiatan untuk dilakukan karena hotel ini terpasang dengan pusat perbelanjaan besar masuk jakarta dianjurkan untuk pasangan dan keluarga dengan anak-anak pasti akan kembali masuk di masa depan
Rudi Manto,2025-06-01,5,kebetulan ada masalah di di dian hall nya ruangannya bagus makanannya enak aksesnya mudah mewah layananenya oke
Resti Constantia,2025-02-01,5,Sementara saya awalnya ragu untuk memesan liburan masuk begitu dekat dengan kantor klien saya lotre Jakarta terbukti menjadi oasis yang tak terduga dari ketenangan dan kemewahan dari saat saya memesan suite seniman raja non merokok layanan yang sempurna dimulai mr fachrul kepala pelayan layanan menghubungi saya secara pribadi untuk memastikan kedatangan lancar dan menghadiri setiap permintaan preval sebagai anggota platinum saya senang untuk mengalami cek pribadi masuk di eksklusif lotre klub lounge di lantai 12 lounge itu sendiri
Ruediger S.,2025-01-01,5,sejak bertahun-tahun kualitas luar biasa masuk setiap bagian hotel lebih dari itu kita selalu merasa seperti tinggal masuk keluarga kami mencoba begitu banyak hotel masuk jakarta dan di seluruh dunia tapi undian jakarta adalah yang terbaik
Ottis Shelton,2025-01-01,5,proses masuk dan keluar cek cepat dan lancar dan pelayan yang ditugaskan kepada saya sangat baik saya memberikan 5 bintang kepada pelayan saya rizky di raffles sarapan buffet sangat baik dan kamar saya tinggal masuk juga sangat baik jika hanya ada satu hal yang bisa ditingkatkan adalah suhu air untuk mandi dan mandi hangat tapi tidak cukup panas saya selalu panas masuk indonesia tapi kamar saya di raffles adalah bagus dan keren
Leo Hendrik Ranti,2025-02-01,5,Semua baik mudah2an bisa di pertahankan ruang tamu oke bersih kamar mandi oke bersih kamar tidur oke dan bersih hanya kurang terang saja di dalam kamar
Yaser Almarzooqi,2025-01-01,5,Perjalanan luar biasa di lotre Jakarta dari akomodasi mewah hingga layanan yang sempurna setiap saat sangat menyenangkan perhatian terhadap detail dan kehangatan staf membuat saya merasa benar-benar dimanjakan desain hotel yang elegan dan fasilitas kelas atas melebihi harapan saya saya sangat merekomendasikan lotre Jakarta untuk pengalaman yang tak terlupakan
N K,2023-01-01,5,Hotel terbaik yang saya kunjungi sejauh ini mencintai segalanya di sini makanan rasanya luar biasa seperti setiap menu layak mencoba saya benar-benar menghargai koki terlihat seperti mereka sangat baik masuk apa yang mereka lakukan saya akan memberikan layanan enam dari lima bintang karena lima tidak cukup staf harus telah dilatih sangat sangat baik kamar yang sempurna dan menghabiskan pagi masuk atap taman kolam renang yang hebat
Salman Fariz,2025-09-01,5,stafnya ramah ramah kamarnya rapih dan bagus fasilitasnya bagus
Gerd R,2024-01-01,4,Kami tiba di awal pukul 10 pagi setelah penerbangan panjang dan kamar kami siap yang sangat dihargai kamar sangat luas dan nyaman bahkan suite tingkat masuk sangat murah hati masuk ukuran hanya pastikan Anda telah ditugaskan kamar jauh dari jalan utama kami menghadapi jalan raya utama dan bahkan di lantai 21 kebisingan lalu lintas sangat keras tapi terutama di malam hari itu tidak tertahankan karena kadang-kadang terdengar seperti pesawat mendarat di sana
Ryan Prasetya,2024-01-01,5,Hotel yang sangat bagus tinggal di sini untuk ulang tahun dan mereka memberikan dekorasi dan kue ditingkatkan ke suite seniman yang benar-benar luas dan indah layanan adalah tidak diragukan lagi top notch sarapan masuk tempat lain di lantai 12 karena kafe seni itu penuh itu sedikit kecil tapi sill oke satu hal yang perlu diperbaiki adalah soundproofing dari jalan saya bisa mendengar suara kendaraan dari kamar tidur saya secara keseluruhan pengalaman itu luar biasa terima kasih untuk butlers dan staf
welly gunawan,2025-10-01,5,Ini adalah salah satu tempat terbaik tinggal dengan Accor Group layanan mereka adalah di atas rata-rata pasti akan kembali ke hotel ini ketika saya mengunjungi Jakarta lagi
Lorraine Tolentino,2025-01-01,3,Staff ramah tapi kami kehilangan sejumlah kecil uang di dalam ruangan mereka menyelidiki dan menemukan tidak ada yang bersalah itu sangat buruk karena kami menghitung uang sebelum kami meninggalkan ruangan itu hanya bahwa kami tidak berharap seseorang akan membersihkan ruangan begitu awal sementara kami sedang sarapan masuk seni kafe secara keseluruhan itu masih baik hanya jangan meninggalkan uang Anda di dalam ruangan
Don Reviewleone “The Critic with No Filter”,2025-01-01,5,Dari saat kami tiba sampai keberangkatan kami hotel ini membuat kita menginap masuk jakarta benar-benar berkesan ms hubertha affendi secara pribadi menemani kami ke kamar kami dan menjawab semua pertanyaan kami dengan sangat sabar dia bahkan menyiapkan kartu sambutan tertulis tangan untuk kami pelayan kami dwiki tiano juga membuat kesan yang abadi dengan layanan profesional dan perhatian makanan yang kami telah dikirimkan ke kamar kami adalah kelas atas staf masuk umum sangat terlatih sangat ramah dan sangat kompeten kami ingin mengucapkan terima kasih kepada semua karyawan untuk layanan luar biasa kami menikmati selama kami
Norhisham Isnin,2025-03-01,5,Hotel lokasi di sebelah pusat perbelanjaan adalah besar tambah mudah untuk mendapatkan makanan cemilan hotel juga dekat dengan kantor saya dan layanan drop off gratis sangat dihargai
BOCAH BANGOR,2025-11-01,1,Tidak ada parkir buat antar paket dan ojol
Bobby KT,2024-01-01,5,masuk yang terletak dengan baik masuk bangunan yang sama dengan lotte mall yang membuat segalanya menjadi jauh lebih nyaman mengingat bahwa kemacetan masuk jakarta tidak bercanda staf memberi saya sambutan yang sangat hangat dan memastikan semua yang nyaman untuk saya layanan kamar adalah fasilitas yang besar adalah tempat tidur top notch nyaman dan saya memiliki tidur yang sangat baik itu sayang saya tidak bisa mencoba gym
Gabrielle,2024-01-01,5,Tempat yang bagus untuk menginap kamar besar dengan fasilitas yang bagus kolam renang bagus namun kolam renang untuk anak-anak begitu jadi tidak terlalu bersemangat gym besar makanan juga bagus dengan banyak pilihan tapi mereka tidak melayani es krim es krim terlalu buruk dan untuk bf mereka hanya memberikan 2 orang dewasa
James Pee,2024-01-01,5,layanan sempurna cepat cek masuk dan check keluar kamar mandi luas dan bersih kamar mandi adalah tempat tidur panas dan bantal nyaman bisa sedikit mantan preferensi pribadi koneksi langsung ke lotte mall dengan banyak makanan dan pilihan belanja kontrol keamanan masuk dan keluar dari hotel untuk memastikan keamanan lokasi yang baik
Indah Adrianus,2025-10-01,5,terima kasih atas pelayanan yang ramah dari selly ginting
Andrian Hengky,2025-03-01,5,Layanan benar-benar bintang 5 resepsionis Ms Madina yang sangat ramah dan membantu kamar pelayanan tukang sapu dan staf bertugas di ruang tamu pada tanggal 31 Januari 2 Februari yang nama saya tidak ingat kalian guys luar biasa
Rizka Priandini,2025-03-01,5,Tempat yang bagus untuk menginap bahkan kamarnya sangat luas dan bfast juga sangat istimewa tidak tempat besar untuk bfast restoran tapi semua yang Anda miliki adalah hebat
Alya Aprilani,2025-12-18,5,menyenangkan dan merupakan pengalaman yang tidak bisa dilupakan
Joni Lim,2025-01-01,5,Kami mencoba kolam renang besar dengan staf yang hebat dan bar dilayani makanan yang hebat harga yang wajar juga lotre lounge selama malam dilayani anggur dan canapes mencintai itu banyak variasi anggur besar dan makanan baik-baik saja satu-satunya hal yang saya n keluarga tidak menikmati adalah breakie sibuk selama liburan kopi melayani makanan yang sangat lambat melayani sangat lambat dan tidak rasa besar kami mencoba bar untuk minuman kami selamat datang adalah sempurna saya pasti akan kembali untuk liburan lain mungkin kali ini tanpa anak-anak tinggal
Ana Jure,2025-01-01,5,Aku mengunjungi writer's bar dan itu sangat baik dan nyaman danielle luar biasa aku menikmati kacang rempah yang menemani bir saya sarapan luar biasa aku akan kembali cepat terima kasih
Arditiya Putra,2025-12-01,5,Tempat yang bagus untuk acara besar apa malam yang tak terlupakan
Ganang Adrian,2026-01-07,1,Awal Desember 2025 saya ada acara kantor disini cukup besar sekelas wapres dan menteri datang sayangnya saat kawan saya menjamu ajudan untuk pejabat peering habis bayangkan sekelas hotel raffles kehabisan peering dan butuh waktu lebih dari 20 menit untuk mengisi lagi luar biasa betapa malu baru kami dihadapan untuk ajudan2 pejabat baru ajudan pelayanannya kurang untung pejabatnya mendapat pelayanan yang oke
Pili Arta,2025-07-21,1,Karena saya seminar disini hotel boleh mewah terlihat diluar kursi untuk duduk menunggu terbatas duduk lesehan dilantai dilarang ya solusinya menyediakan banyak kursi sofa tempat duduk charger di larang pelayanan tampak bagus padahal semua busuk
rut tiodora,2025-05-21,1,kartu saya ketinggalan di kamar dan saya minta dibuka kan kamar dan naik lift tapi prosedur super rumit dengan begitu banyak pertanyaan seperti teroris sampai saya ke lobi ditanya lagi 3 pertanyaan setiap 2 hari kartu kamar di ganti sop nya sangat rumit
Oki Kecil,2025-08-21,1,Saran saja untuk karyawan rafles jika saya makan online temui driver saja jangan di titip karena akses kelaman nya susah jika antar untuk karyawan jika antar untuk tamu itu akses nya tidak susah
Favorit Favorit,2025-01-21,1,tolong donk pihak manajemen supaya di benahi sistem parkir untuk kurir biar seperti tetangga gedung somerset menyediakan parkir kurir ascott menyediakan parkir kurir raflest residence pun menyediakan parkir kurir terkesan miskin tau hotel gk menyediakan parkir kurir gedung paling tengah suruh parkir luar gedung yang tak ada pantauan keamanan seharusnya himbauan nya kepara penghuni dan calon penghuni gedung agar tidak diperkenankan berurusan kurir pengantaran online paksain ja cari makan dan minum dari dalam hotel keamanan lobi juga tak ada ramah2nya terlihat elit tapi norak
BOCAH BANGOR,2025-10-21,1,Tidak ada parkir buat antar paket dan ojol
selvi Yuliana,2024-01-21,1,resepsionis nya tidak ramah maling barang dari teman saya di sana dan ketika saya ingin mengambil banyak keputusannya mentang foto sama tag nya ilang tetap gabisa di ambil padahal sudah ada nomor kamar nama teman saya yang titip masih di persulit dengan alasan tidak ada barang yang dititip hotel bagus tapi karyawannya pada maling
Seja Bakara,2025-01-21,1,kamar buat sopir sopir kaya sekolahan tk tidak teratur serem tidak sesuai dengan jotel ug sudah berbintang jorok banget
Awan de Wanzö,2025-01-21,1,sekelas hotel bintang 5 lahan parkir buat ojol antar paket makanan tidak ada malah disuruh parkir pinggir jalan yang bukan lahan miliknya
Harsya Farisi Amarza,2024-01-21,1,peraturan aneh macam apa mau sarapan gaboleh pakai sepatu dari hotel tapi pakai sepatu dari hotel lain boleh ya kali orang mau sarapan pakai celana pendek baju santai tapi wajib pakai sepatu ditanya aturan dari mana jawabnya gaada aturan tertulisnya
APOTEKER BANDUNG (Timoty Kristofani),2025-07-21,1,makanan tidak cocok makanan selalu habis terlambat di isi ulang
Mbah Djoko,2024-01-21,1,1 gua ojol gua gk ngerasakan kenyaman saat drop disini sudah di info ke keamanan cs sedang turun karena ingin bertemu drivernya namun kepastian kekeh minta meninggallkan pesanannya 2 terima amplop pembayaran cod namun jumlah tak sesuai yang di info cs
Dodyk Setyawan,2025-01-21,1,diskriminasi sama tamu pakai motor tidak boleh turun di depan lobi dipaksa jalan dari luar pager pinggir jalan
Hendrik Doye,2025-01-21,1,securit lodging dok tidak benar pelayanan yah tergantung uang kurang paham harus yah orang gatau harus di arahin ini lodging dok yang bawah tidak benar tuh kerja yah
maulana malik,2020-01-21,1,sewa di ballroom tapi angkat nya di matiin keamanan nya juga tidak ramah disuruh loading malem udah di ikutin tapi malahan di sepelein kecewa sama manajemen hotel kita sewa tapi pelayanan bener2 kurang banget acara itu barang nya banyak
linda krones,2020-01-21,1,saya pertama senang karena hotel bersih banget dengan harum yang khas kamar besar dan mewah handuk merah dengan toilet yang bagus sangat tidak menyayangkan dengan harga sarapan yang mahal makanan enggak enak dan tidak merasa bumbu indonesia di tambah lagi pelayan yang sangat tidak ramah dan tidak menyambut ada supervisor wanita bule tapi melayani orang asing atau orang kulit putih sedang orang lokal sebelah mata saja minta secangkir kopi saja kaya kesel dan dicuekin dengan banting mengirim dan menyuruh pelayan untuk mengambil di bar tempat barista oh tapi sangat tidak menyayangkan menghabiskan uang dengan kamar standar harga sama hotel kelas bintang pelayanan apa dan makanan kaki lima buat org asing pakai
Yas'a,2024-01-21,1,membiarkan halaman orang dijadikan tempat parkir padahal penghuni dia yang memesan makanan online rip moral ternyata kekayaan tidak menjamin otak bisa dipakai
