User Name,Review Time,Rating,Review Text
novan arieanto,2024-01-05,4,pelayanan bagus staf housekeeping ramah tempat bersih cuma ac di lobi kurang dingin untuk makanan rasa baru b saja meskipun variasi makanan baru banyak
Nazrul Pradana,2025-02-05,5,Untuk sarapan hari ini menu sesuai selera saya dan pelayanannya cukup baik
sinaga jan,2025-03-05,5,Setiap datang ke hotel ini makanannya membuat enak rasanya
Diky Abrial,2025-03-05,5,nyaman bagus bersih sarapan pagi nya oke udah dari tahun 2017 selalu langganan dengan hotel ini
Siska Kurniasari,2025-05-05,5,sarapan enak bersih beragam lokasi strategis kamar nyaman
Elde Firda,2019-01-05,4,Lokasinya kurang tampak kalau dari jarak jauh meskipun bagian atas gedung terlihat mungkin papan nama perlu lebih menonjol ke jalan raya parkir cukup luas ruang pertemuannya terlalu sempit untuk kapasitas yang ada agak sulit keluar masuk dari tempat duduk sound system orang perlu standby suara mic sering timbul tenggelam menu makanan dan minuman pilihan variatif sambalnya banyak saya suka tapi tingkat kepedasan kurang hehe rasa mantab 4 5 5 kurang kuat rasanya disediakan infus air siplah
Bang Faris,2024-01-05,5,untuk kali ini menginap ke 2 kali dan dan kali ini menginap 3 malam hotel lumayan bersih makanan lumayan cuma seperti perlengkapan kamar mandi kurang lengkap seperti topi mandi tidak ada untuk lainnya secara keseluruhan oke
Balqis Karlisa,2025-06-05,5,Makannya enak sekali mas ardan juga ramah sekali
Rachmat 78,2025-01-05,4,tolong di tingkatkan lelet menu sarapan ditambah rasanya kamar oke lah kebersihan oke lah
Miss Nurul,2025-03-05,4,Aku selalu tinggal disini tempat baru strategis pelayanan baru jgk bagus
Uba Rahmat Setiawan,2021-01-05,5,hotel yang bagus kamar luas dan bersih pilihan menu sarapan juga banyak dan berbagai akses mudah dan tidak terlalu jauh dari pusat perbelanjaan utama seperti tunjungan plaza dll saya juga suka cara staf nya melayani dengan ramah dan profesional kalaupun ada kekurangan hanya dari segi area parkir yang sedikit terbatas tapi titik yang paling saya suka di sekitar hotel tersedia tempat makan dengan banyak pilihan di malam hari
Irma Kurniawati,2025-01-05,3,Wastafel nya buntu mampet mandinya semprotan udaranya terlalu kecil2
Citra Putri pamungkas,2025-05-05,5,Pelayanannya bagus kamarnya bersih sarapannya lengkap
Agiel Prastika,2025-06-05,5,makanan enak yang namanya desy sangat ramah
Ric Chouw,2025-03-05,5,terima kasih staf yang ramah dengan pak gus dan tanggap membantu kebutuhan selama sarapan semangat pak
Enggal Aditya,2025-01-05,5,Nia resepsionis sangat menyambut dan memberikan layanan terbaiknya checkin awal dan check out akhir diberikan layanan luar biasa kamar cukup luas dan nyaman lokasi juga bagus
Erick Prasetyo,2019-01-05,5,lokasi pusat kota jadi lebih mudah untuk mencari parkir roda 4 roda 2cukup mudah harga bersahabat sesuai saya mendapat kan harga dari salah satu agen perjalanan offline jauh lebih murah dari ota fasilitas lebih cocok untuk keperluan bisnis karena terletak di pusat kota yang paling menyenangkan adalah saat malam hari karena banyak pedagang kuliner saya sempat mencoba nasi goreng keroyok wow porsinya 3 4 pax di sekitar merekomendasikan
suhandi amin,2025-01-05,5,puas terhadap pasilitas kamar pelayanan lokasinya strategis mqntap
Rosalia Collection,2024-01-05,5,hotel berada di tengah kota mudah dicari kamar bersih lengkap dan nyaman pelayanan dari depan keamanan resepsionis rumah menjaga sampai restoran semuanya ramah dan bagus pelayanannya murah senyum dan membantu rekomendasi banget kalau ke surabaya bisa tinggal di liburan hotel express jl kedung diri surabaya mau jalan jalan ke tengah kota dekat
Alan Saputra,2025-09-05,5,pelayanan dari mba desi bagus
nafisya_ officialytb,2025-08-05,5,enak makanan sarapannya
Arief Reza Ardhiyan,2021-01-05,4,Kali kedua menginap di tempat ini lokasi mudah dijangkau dekat ke Tunjungan Plaza fasilitas hotel bintang 3 kamar nyaman dengan berbaring keluar cukup menarik menu sarapan variatif dan pilihan cukup memuaskan parkir kendaraan di ruang bawah tanah terbatas pelayanan keamanan kantor depan dan lainnya ramah akses koneksi wifi tidak terlalu banyak
Agus Subiyantoro,2025-06-05,5,pelayanan baik di tawarkan menu yang tersedia diluar
Robin Doloksaribu,2025-11-05,5,tingkatkan pelayanan yang baik
atiknur sh,2020-01-05,5,hotelnya bagus nyaman sekali lokasi strategis di tengah kota kamar mandi bersih semuanya berfungsi dengan baik pelayanannya ramah makanan juga lumayan enak saya suka menginap di hotel ini dianjurkan
Rizkyatus -Kiky-,2025-01-05,5,Suka sekali dengan pelayanannyaa sudah langganan klu ke surabaya nginapnya di hotel liburan iin
Roy Ario,2023-01-05,5,kamarnya nyaman dengan ac yang sejuk layanan layanan kamar ramah dan sarapannya juga enak banget rasanya ingin berlama2 nginapnya hehehe apa daya kantong cekak hahaha
Derin Herdiani,2023-01-05,1,pesen triple sarapan 800rb tahu d suruh bayar lg untuk sarapan 300rb lebih baik ekstrabed sudah tidak ada jet waser nyesel tidak kepalang deh ckp sekali yang lain hrs hati2 pesan d sini
Supriyono Onox,2025-10-05,5,hotel yang bersih dan mantapp
Hany Hany,2020-01-05,5,tempatnya deket pasar kembang sempet nyasar soalnya letaknya agak menjorok ke dalam lobinya langsung terlihat saat masuk lewat pintu masuk utama sebelah kanan adalah lift dan restoran tempat makan malam n sarapan makanan lumayan yang saya perhatikn pasti ada sentuhan makanan lokal saya sudah nemu rujak gado gado disini tastenya lumayan banyak pilihan kerupuknya lho
Nazwa official,2025-01-05,5,nasi goreng dan ayam lada hitamnya enak reccomend untuk yang mau liburan bersama keluarga
Artania Yuni,2025-01-05,5,Pelayanan sangat ramah bisa mengambil sarapan terima kasihh
Yudi Pramono,2024-01-05,1,kemarin tanggal 13 April 2023 ada acara bukber ikut acara kantor untuk menu makanan kurang memuaskan pertama tahu isi bihun yang basi gorengan ote ote sayur yang rasanya asin sekali ku konfirmasi ke beberapa teman saya dan mengiyakan memang asin banget lalu menu semacam gorengan seafood jika tidak salah adalah cumi gurita goreng tepung itu aromanya sudah agak bau basi tidak seger dan yang terahir saya tanyakan ke staf tentang lokasi mushola dalam memberikan jawaban kurang enak itu tidak kayak staf hotel hotel dan yang terahir karpet lain musholanya bau bau
Difa Difa,2023-01-05,5,hotel di tengah kota yang cukup rekomendasi untuk menginap selama di surabaya ac nya dingin joss makanan nya enak strategis dekat dengan pusat perbelanjaan dan pusat kuliner toilettris bagus dan cukup premium dari awal pembukaan dulu sampai sekarang tidak berubah kualitas nya malah semakin bagus
Dimas Reggy,2025-03-05,5,makanannya enak enak stafnya ramah terima kasih kak deisy
Sisdalena binti Danial,2022-01-05,2,kapok sekapok2nya buat teman2 yang punya anak khususnya punya anak usia 2thun keatas jangan menginap di hotel ini kamar kecil pengap ranjang kecil sprei sarung bantal dekil sikat gigi 1doang sarapan anak bayar diatas 2thn dan tidak sepadan bngt menu sama harga pelayan jutek heran dari sekian banyak org komplain tentng karyawannya yang super jutek kok manajer diam saja ya pinjem piring 50k nginep di kamar non merokok dan kalau di langgar denda 1jt di dalam byr angkat tidak ada hand sanitizer kamar sempit bangt mandi
Tri Joko Susanto,2023-01-05,4,lumayan nyaman dan strategis orangnya juga ramah ramah bintangnya saya ilangin 1 karena saat sarapan saya menemukan lontong sayur yang tidak ada lontongnya diganti nasi he he
Rio Silitonga,2024-01-05,1,kacau jam 1 30 dini jam pindah kamar gara2 ac mati sudah dibenerin teknisi tapi ttp tidak ngaruh kamar bermasalah tetap dijual juga juancox
nurzahara,2025-01-05,5,kamar baik dan bersih pelayanan baik pihak resto ramah terutama mba rena
Roy Alwy,2025-01-05,5,malam ini pesan kopi ke mas lut dan mbak rena kopinya sangat enak mbak dan mas nya juga baik melayani saya
Ama Darmawikarta,2024-01-05,4,Hotel ini punte layanan yang cukup cepat dengan parkir dan lobi yang perwakilan dan kemudian lokasi saya kurang memahami berapa lama hotel ini dibangun tetapi saya pikir hotel ini membutuhkan lebih banyak pembersihan ekstra dengan lantai dan mengubah karpet dengan gaya modern mungkin itu kembali dengan gaya hotel tamu mungkin akan sering menunggu sesuatu untuk beraktifitas dan bahwa kesan pertama dengan karpet tamu di lobi seperti karpet saya masuk 2018 masuk bahwa syle itu oke tapi saya pikir mungkin membersihkan lantai itu adalah suatu keharusan
Nadine Fila Indira,2025-09-05,5,nice vibes hotelnya
Probo Darono Yakti,2022-01-05,4,opsi hotel bintang empat di tengah surabaya yang cukup dikenal orang tersedia fasilitas mulai restoran kamar yang representatif dan parkir yang cukup di basement lokasi strategis di pusat kota surabaya dan terjangkau dari pusat perbelanjaan seperti alun-alun
Elsa Nurul,2018-01-05,5,kamarnya oke banget nyaman skala harga ssuai dengan fasilitas kamar menu sarapan enak fasilitas gym lengkap ac dalam gym dingin ada timbangan brt bdn jg
Maria Timur,2020-01-05,4,bagus nyaman rapi deket tunjungan plaza hanya saja makan paginya kurang variasi baru nyadar kalau kmrn pesen kamar tmpt tdrnya ukuran ratu buat yang g tau ukuran ratu itu lebih kecil drpd raja gampangnya kalau ukuran ratu dipakai tidur bertiga pasti kesempitan
Dedy Ayub Wicaksono,2025-01-05,5,ruangan nyaman makanan enak banyak pilihan menu fasilitas banyakk dianjurkan
Fidly Noor,2025-05-05,5,semua makanan enak dan variatif pelayanan baik ramah
Andrean saputra,2025-06-05,5,makanannya menu nya enak enak pelayanan nya ramah
Januar Murdani,2019-01-05,4,lokasi hotel dekat dengan tunjungan plaza restoran hanya buka sampai dengan pukul 22:30 tapi jangan khawatir untuk makan malam tersedia banyal sekali makanan jalan khas surabaya disepanjang jalan kedungdoro kamar hotel cukup bersih dan nyaman menjual jg oleh2 khas surabaya di lobi hotel
Eni Eni,2020-01-05,4,tempatnya bersih stafnya rama dan profesional walapun sarapannya biasa saja terlebih saat malam didepan hotel sangat banyak penju kali 5 yang sangat2 enak
Monica Mega Pertiwi,2025-10-05,5,setiap ke surabaya nginepnya disini
Vhey Dyv,2021-01-05,5,Salah satu hotel favorit saya karna kamar nya oke kasur empuk ac dingin menu sarapan jg oke rasanya lumayan cuma kurang kolam renang saja sih
sri kumala dewi,2025-03-05,5,Pelayanannya bagus atas nama dessy di resto melayani baik banget
Febri Ayudea,2019-01-05,5,lokasi mudah ditemukan dari arah kedungsari pertigaan belok kanan parkir basement mobil bisa di depan lobi aman parkir tidak tersedia motor keluar menunjukkan stnk pelayanan front desk cepat dan informatif ada diskon khusus bila anggota ihg manajemen liburan inn di seluruh dunia lobi luas satu lantai dengan resto untuk sarapan restoran indoor dan outdoor maret april 2018 ada promo nasi goreng ginyong dan mie goreng ombyokan 75k 4 5 pax sarapan variatif dan saya lebih suka cemilan daerah telur sudut bagian luar lift perlu kunci kartu ke setiap lantai kamar ada cemilan gratis dari liburan oleh terselip di tempat kunci
Muhammad Ilham,2025-01-05,5,sangat bagus kamarnya nyaman dan aman untuk makanannya enak enak
Ach Bai haqi,2025-12-05,5,pelayananya baik ramah makanan enak
Indaa Puspita,2025-04-05,5,pelayanan ramah kamar bersih dan makanan enak
bambang dahono,2025-01-05,5,Pelayanannya bagus makanannya bagus enak banget di pertahankan
achmad dainuri,2019-01-05,5,nyaman dan yang paling penting di depan hotel banyak warung makan untuk wisata kuliner surabaya jika ingin belanja juga dekat dengan pusat pertokoan misalnya tunjugan plaza jalan kaki agak lumayan sih pakai gojek sekitar 60
Poppy Kusuma,2024-01-05,5,murah dan nyaman bisa 4 bantal ac adem kamar berkarpet ada kulkas kecil sip lah untuk istirahat yang aq heran kenapa semprotan di WC bisa marah malah kadang panas
Yoyo Subagio,2019-01-05,4,lokasi strategis dekat tempat makanan enak sekitar kedungdoro kamar bagus dan bersih sarapan cukup enak pelayanan ramah internet 2 mbps lumayan kencang
indah laelatul badriah,2019-01-05,4,buat nyari makan malam yang tenda ataupun resto banyak banget pilihanny keluar hotel juga sudah banyak tenda tenda tapi agak sedikit bingung saat nyari hotel ini soalnya depannya tempat karoke buat masuk harus masuk ke dala dulu sedikit dibelakang karokenya
Ridwan AR,2025-01-05,5,menu layanan kamar sarapan semua sangat maksimal di dukungan oleh tim liburan Endini sangat antusias dalam bekerja
Nafa Fitria,2025-06-05,5,makanannya enak pelayanannya bagus
Wiwin Uj,2023-01-05,3,pemandangan dari jendela oke selimut dan spray agak kotor kuning di bawah ranjang ada sampah yang tertinggal untuk sarapan biasa saja rasanya
gatot dwi,2025-12-15,4,lokasi bagus kebersihan bagus
Harno Nohar,2020-01-05,5,hotel liburan masuk jl kedung diri adalah hotel yang nyaman dan ramah semua pegawainya oke utamanya pemasarannya cepat tanggap p gm bapak dony juga ramah fo nya ramah yang aku lihat walau kadang di marahi tamu tetap sabar mlh kasihan aku melihatnya
Kang Ajat Channel,2021-01-05,4,hotel yang letaknya strategis dijantung kota surabaya kalau malam hari tinggal jalan kedepan ada begitu banyak kuliner di pinggir jalan raya nya kekurangannya di akses masuk hotel yang sempit juga parkir yang terbatas
Bayu surya arga Sasmita,2020-01-05,1,Saat antar bos buat sarapan yang kebetulan nginep dsitu bisa kesan yang tidak baik pelayan nya cowok umur nya kira2 sudah diatas 40 tahun kayaknya pemimpin nya di restoran kita kuat bayar kok bos tidak usah menatap kita seperti orang miskin dan penuh kecurigaan
Raditya Tirta,2025-12-22,5,parkirannya kurang banyak
29_Galuh Kartikasari,2025-09-05,5,seru banget hotelnya nyaman
Ahmad Faisal,2025-03-05,5,untuk menu agar bisa menambahkan makanan khas daerah seperti semanggi surabaya
BUYUNG F. SETIAWAN,2019-01-05,4,hotel kecil tapi cukup nyaman dengan fasilitas yang cukup lengkap tempat parkir cukup luas lokasi strategis di tengah kota surabaya makanan nya cukup enak pelayanan nya ramah bagus untuk menginap dan mengadakan acara di hotel Holiday Inn Express surabaya
Ragane Aryakusuma,2025-01-05,5,pertama kali ke surabaya nginep disini pelayanan ramah makanannya enak enak top
ahmad muhyidin,2025-06-05,5,sarapan enak layanan ramahh topp
Dwi Ayu,2020-01-05,5,Sangat nyaman lobi nya bagus kamarnya mewah suka karena pakai karpet bukan langsung lantai view sekitar kamarnya bagus
dinda azolla,2025-07-05,5,Enakk banget pelayanan tiara memuaskan
Reksa Manggala,2024-01-05,5,sering menginap di sini karena dekat dengan lokasi kantor dan dekat dengan jajanan kaki lima saat malam hari kamar cukup nyaman cukup layak sesuai dengan harga
Raden R,2020-01-05,2,Banyak kuliner di jalan depan hotel sedangkan minuman kemasan yang disediakan secara gratis di kamar bukan air sebagai air minum dalam kemasan amdk yang bermutu tinggi dengan reputasi sudah lebih dari 40 tahun
Zulkarnain Wahyu,2023-01-05,5,hotel yang nyaman tidak berisik dan dekat dengan pusat keramaian ingin makan malang tidak perlu repot di sepanjang jalan depan hotel banyak warung makan tenda yang bisa dipilih
Naftalia Nanda,2025-01-05,5,fasilitas sudah cukup baik pelayanan nya memuaskan dan masakan enak
Fatur Rohman menghitam,2024-01-05,4,hotel nyaman pelayanan ramah makanan biasa sekelas hotel
Taufiq Hidayatulloh,2019-01-05,5,Saya kira saya salah pilih lokasi hotel ternyata hotelnya strategis mencari makan tengah malam sangat mudah banyak tempat makan murah meriah berjajar sepanjang jalan di depan hotel perut kenyang tidur tenang
Rhobert Mahadi,2020-01-05,4,standar di kelas baru makanan kurang variatif sya merasa kurang lengkap dibandingkan hotel sekelasnya lokasi strategis fasilitas standar kartu hotel mudah ke reset entah bagaimana punya saya atau gmna
irwan saputro,2024-01-05,5,kamar cukup nyaman pelayanan bagus ramah kalau malem di depan hotel banyak warung tenda
Chalista Saputra,2025-12-05,5,Sangat nyaman tenang
rizky k,2019-01-05,5,bagus sih kamarnya bersih ada pengering rambut nya juga kamar mandinya juga bersih dan tidak bau bagi yang bermalam dengan anak2 ada channel disney kartun jaringan kartun dan animax juga
RATNO SOEMARYANTO,2022-01-05,5,Hotel yang terletak di pinggir jalan raya kedungdoro mudah dicari dan mudah dilihat dari jauh bersebelahan dengan swalayan bahan bangunan mitra 10 semakin mempermudah buat menuju
Arina Saraswati Hardy,2023-01-05,5,Kami tinggal 4 malam dari keamanan bel pembantu resepsi resto sd pembantu kamar sangat ramah dan membantu di malam terakhir kami ada kejutan kami di tempat tidur ada handuk diatur lucu
Agus Triyanto,2018-01-05,5,pelayanannya memuaskan kamarnya bersih dan nyaman menu sarapan banyak dan enak parkir mobil aman dan terlindung harga kamar murah saat di tengah kota deket ke pusat perbelanjaan mall
Rexi Ktng,2025-01-05,5,pelayanan kak rena bagus makanan enak variasi beragam
Lalu Rahmat,2025-01-05,5,layanan memuaskan kamar mandi perlu ada kran untuk wudhu dll
astuti tri,2025-06-05,5,makanan enak pelayanan bagus dan ramah
Nurkhasanah Widiyanti,2025-01-05,5,kamar nya bersih makanan nya enak pelayanan nya oke
Bernard Siagian,2020-01-05,4,Holiday Inn Express Berlamat di Kedungdoro No 58 Kota Surabaya Lokasi cukup strategis di Kota Tengah Pelayanan karyawan baik itu cust layanan resepsi cukup baik dmk jg
Marquez Samuel,2025-08-05,5,makanan enakk staf nya ramah banget gustanul
Agung Bagus Armianto,2021-01-05,5,standar hotel bagus lah kalau bosen makan di resto nya keluar banyak warung kaisar deket kemana juga relatif banyak taksi online dan perkiraan saja jarak tempuh ke tujuan
Henry asmoro,2019-01-05,5,Hotel budget lumayan di tengah kota surabaya terletak di jl kedungdoro mudah diakses dan juga mudah dalam hal transportasi ada banyak tempat di dalam hotel menawarkan hunian sementara yang cukup untuk diri maupun keluarga harga bersaing tentunya
Harsah Bahtiar,2025-12-31,5,makanannya enak enak
Dennis Depriadie,2025-06-05,4,sarapan banyak staf di resto namun kurang inisiatif dan responsif
Wahyudi zhylands,2021-01-05,3,tempat lain favorit kalau ke surabaya karena dekat dengan kantor tapi menginap terakhir agak kecewa dengan hotel ini dapet kamar menghubungkan ada orang ribut pula semaleman berisik banget telepon ke resepsionis tapi tidak ada tindak lanjut udara panas juga tidak panas banget dan kemana kulkasnya
Hadi Supranoto,2025-11-05,5,kika adalah enak makanya terbaik
Adrian Andro,2020-01-05,5,tempatnya aman kamarnya luas petugasnya ramah dan selalu tersenyum harga masih terjangkau lokasi strategis di tengah kota ketempat berbelanja dekat dan banyak kuliner nikmat sekitar hotel kalao malam hari dianjurkan
Nana Hadiana,2025-01-05,5,lokasi dekat dengan stasiun pasar turi dan jembatan suramadu jadi kalau mau ke madura bisa banget
muhammad miftah,2020-01-05,5,hotelnya nyaman sangat dekat dengan tempat perbelanjaan toko under dil mobil n klo malam hari berbagai macam macam aneka masakan kuliner sari laut martabak n terang bulan di daerah sekitar
Welly Huwa,2025-12-05,5,tempat strategis dan nyaman
Helmy Prayoga,2024-01-05,4,kekurangannya adalah tidak ada satpam baru ketika mobil keluar dari hotel yang membantu tamu menyebrang jalan jika tamu menggunakan mobil
yulita anggrainy,2019-01-05,4,bersih hotelnya saya wkt itu hanya berkunjung saja karena ada saudara yang datang dari jakarta dan pku jadi saya kurang tahu bagaimana dengan pelayanan hotelnya tapi sejauh saya di sana hotel bersih harum udara panas dingin siap dan lancar ada lift dan wifi bagus jg
Lupa Dimana,2025-12-22,3,bagus n nyaman
Tatik Wijaya,2025-11-05,5,pelayanan baik dan ramah
Ricky Pramuka,2020-01-05,5,menginap disini benar benar pelayanan nya bagus semua berfungi dengan benar dan tentu saja ranjang nya nya empuk sekali apalagi fasilitas nya juga bagus sayang nya untuk menu makan pagi nya tidak begitu enak semoga ke depan menu makan pagi nya leboh bervariasi yaw
LISA _AHT,2022-01-05,1,Awal mulanya bahagia saat nginap karena hobi bepergian jadi keluar masuk hotel saat sarapan dihotel ini anak saya yang yang 11 tahun dikenakan biaya ya tidak masalah sih karena ada hotel yang ditunggang ada yang tidak tapi sayangnya makanan sudah kosong
Aditya Himawan,2023-01-05,5,bagus kamar bersih dan luas cuma klo disini bukan sama pasangan dipikir2 dulu karena kaca kamar mandi nya agak tembus pandang hehe
Wibowo Suharyanto,2019-01-05,3,nyaman bagi smooker lembur kerja makan resto lumayan mau kuliner merakyat khas surabaya banyak disekitarnya jalan kaki beberapa langkah saja
Tia Octavia,2020-01-05,5,ahh lupa menginap disni tak sempat saya foto beberapa nyanyi nyaman dan pelayanan pun memuasakan hotel yang tak terlalu besar berada di tengah kota surabaya ini bisa kalian jadikan salah satu rekomendasi hotel untuk menginap karena tidak terlalu jauh dari perkotaan
Denny Martinius,2025-01-05,5,pelayanan memuaskan restoran nyaman dan buffetnya enak terimakasih
prima yendiko,2025-01-05,5,sabun untuk mandi kurang berbusa dan pisahkan antara sampo dan sabun potong bud dan sisir minta disediakan
Ahmad Junaidi,2025-01-05,5,sarapan sudah sangat bagus di pertahankan lagi ya pelayanan nya jiga sangat bagus baik semua
nindi prihastini,2018-01-05,3,bintang 4 tapi masih kurang memuaskan mulai dari terbatasnya tempat parkir mobil jadi harus ke gedung sebelah kemudian bantalnya juga kurang nyaman dikepala kamar mandi kurang lengkap untuk toilet
nurman syah,2025-12-22,5,Alhamdulillah baik dan lancar
Gustanul Riski,2025-01-05,5,sarapan nya mantull staf ramah poll tidak nyesel deh nginep sini
Mimin Minus,2022-01-05,1,satpamnya yang lebih pantas jadi fo karena fo nya sangat amat tidak ramah tidak terkecuali yang laki dan perempuan pelayanan cek masuk dan cek keluar sanggat buruk ditambah dengan kebersihan kamar hotel yang katanya bintang 4 selimut yang
Bayu Apri,2019-01-05,5,hotel dengan lokasi yang strategis banyak alternatif kuliner di malam hari kamar terdapat karpet yang membuat suasana nyaman luas memiliki ruang pertemuan banyak jadi cocok untuk berbagai kegiatan pertemuan dan tentu saja penjualan pemasarannya yang ramah dan layanan cepat untuk acara
Christina Yoshida,2025-12-30,1,saya menginap di kamar mandi karena kami tidak ingin mengganggu malam2 kami minta ganti kamar keesokan harinya hari kedua kami pindah ke kamar ke 1807 tidak ada masalah hari ketiga tgl 28 malam kami pergi ke hotel kunci kamar tidak pulang kami yang sudah lelah harus turun ke resepsionis jawaban hanya bilang jika kami terima kunci di refresh oke kami terima kembali ke kamar kami masuk dan melihat tidak ada ada air minum keset dan sampah di kamar
yantie alexandri,2025-12-30,1,Paraahh blom jam 9 makanan dah pada habis tidak buru2 direfill rame tapi pramusaji cm 2 ditanyain pun jg tidak nyenengin sekali pun tidak merekomendasikaninpokoknya
ali olyvia,2025-07-20,1,hotel yang sangat bagus dan baik untuk orang yang sedang mencari tempat penginapan namun ada hal yang sangat disayangkan bahwa ada salah satu keamanan yang bernama aris sikapnya tidak sebaik dan sebagus hotelnya kita kurir kirim paket orang yang sedang berada atau bersinggah dihotel tsb dan dihotel manapun yang saya jumpai bila ada barang ataupun makanan dll itu pasti lewat keamanan dulu memang sudah dari jobdesknya keamanan untuk mengamankan namun pada saat ini saya kasih paket ke keamanan dan saya baik baik bahwa paket diterima oleh siapa pak namun dia marah dan mencaci maki saya tanya lah apa saya salah dengan nama menyakan
Triboy Johan Rajagukguk,2025-01-20,1,sayang sekali pelayanan yang katanya hotel bintang 4 tapi sama sekali tidak mencerminkan bintangnya hari pertama masuk hotel tanggal 24 Februari 2024 sekitar pukul 18 00 kamar sangat tidak siap toilet tidak di flush masuk kamar mandi melihat bekas orang lain dipindah kamar ke lantai 18 tempat tidur banyak noda sehingga menunggu proses pembersihan yang cukup memakan waktu malam ketiga dipindahkan ke lantai 1225 dengan alasan akan ada perawatan pengendalian hama di lantai 18 masuk kamar 1225 pukul 19:30 dan kamar sangat tidak siap kondisi ac rusak sehingga berisik dipindah ke kamar 1220 dan tempat tidur ada beberapa spot noda parah bekas potongan kuku di atas karpet ditemukan
yos Yang,2025-01-20,1,hotel ini menerapkan kalau minjam mangkok atau perlengkapan makan dengan berbayar ya tidak di tulis syarat syarat di pemesanan hotel
Ida Ayu Diah Anggraeni,2023-01-20,1,review saya jujur kamar sempit dan tata letak kamar tidak simetris ruangan menyempit ke arah dalam tv kecil macam tv hotel oyo tidak ada kulkas karpet kotor tidak terawat fasilitas kamar mandi tidak ada brosur kamar layanan cuma kertas hitam putih kaya di fotocopy print biasa emang sih tidak ada pengaruh apa2 tapi serius 4 bintang hotel tidak mampu kualitas brosur parkir sedikit meskipun dapat parkir di depan kita tetap hrs meninggalkan kunci mobil pintu masuk hotel nyempil di antara ruko2 jadul tapi di antara sekian tambah ada baru baru tangan bersih meskipun tidak wangi tapi tercium baycline di
Carly Rae,2024-01-20,1,13 juli jam 00 12 saya memang hanya numpang ke toilet beberapa menit resepsionis juga melihat dan malah tersenyum ramah tapi ketika mobil saya bergerak meninggalkan lobi satpam sekitar usia 20 tahun seorang menegur kami dengan kasar dan menginterogasi kamar nomor brp hanya ke toilet ini bukan toilet umum di luar saja sana rantai hotel internasional sekelas ihg liburan inn bagaimana hr anda mendidik karyawan saya numpang ke toilet di hotel 5 di dalam luar negeri tidak pernah diperlakukan oleh keamanan seperti maling hanya karena numpang ke toilet beberapa menit ketika melihat saya itu satpam melotot dan gayanya pria menantang saya wanita
