User Name,Review Time,Rating,Review Text
Natasya Putri -0007,2025-06-05,5,sarapan lengkap sarapan enak makanan enak makanan lengkap layanan bagus layanan besar keseluruhan layanan baik pelayanan bagus
Budi Sumitro,2025-10-05,5,Pelayanannya baik terutama kakak kika
Herman Rosyadi,2025-01-05,5,hotel holiday inn terletak di jantung kota surabaya mau wisata kuliner tinggal jalan kaki wisata belanja dekat mau wisata kemanapun enak karena transportasi tersedia 24 jam bangunan baru hotel begitu megah berlantai 18 tingkat dilayani karyawan yang profesional dan ramah serta murah senyum kamar yang nyaman n bersih shg malas untuk keluar kamar harga cukup standar bahkan bisa diskon sampai 50 kali coba pasti jatuh cinta
Joshua A.M.K. Nainggolan,2024-01-05,5,menginap semalam di kamar tipe deluks double 1 kamarnya nyaman dan luas untuk menginap sendiri beralaskan karpet dengan fasilitas lengkap dan berfungsi seperti ac gantungan lemari meja dan kursi untuk kerja udara panas untuk mandi udara mineral gratis tambah jendela kaca besar yang berhadapan ke pusat kota 2 area drop off cukup lega untuk naik turun orang dan ada parkir di depan lobi dan di basemen 3 lokasinya sangat strategis terletak di jalan kedungdoro yang penuh dengan jajanan kuliner khas surabaya utamanya saat malam hari
Nida Sna,2025-11-05,5,makanannya disetujui banget aku suka
Tika Andriani,2025-05-05,5,begitu sederhana lengkap breakfestnya dari makanan pembuka smp desertnya infus air dianjurkan
Dinda sukma,2025-06-05,5,pelayanan ramah semua makanannya disetujui baik
lita lestari PTSTA,2025-01-05,5,view kamar bagus kamarnya bersih dan wangi sarapan variasinya banyak banget mb dwipa dan mas taufiq sangat ramah terimakasih yaa
Nugroho Aji,2025-01-05,5,bagus semua baik untuk sarapan nya oke dan lengkap untuk pelayanannya bagus untuk kamarnya bagus saya tinggal 8 hari 3 kamar
Reni Lin,2025-12-05,5,pelayanan baik dan makanan enak
yayuk arifiani,2025-11-05,5,sarapan mantap enak bingit
Arpan Lix,2025-03-05,5,nasi goreng nanas n ayam kecap nya joss top markotop pelayanan ibu endini cepat dan ramah
MAYSA,2025-01-05,5,Hari ini saat pulang kerja ada telepon dari restoran menawarkan makanan kebetulan lagi laper mereka juga menjelaskan menu menu yang favorit jadi saya terbantu terima kasih pegawai resto hari ini anda baik sekali
28. Nur Rahmah Agista Azzahra,2025-06-05,5,pelayanan resto baik makanan banyak varian keseluruhan baik
Heti 22 Kania,2025-01-05,5,untuk kamar oke pelayanan staf ramah lokasi strategis menu sarapan bervariasi rasa juga enak
Disem Fauzan,2025-08-05,5,Brekfest enak dan komplit langganan setiap ke surabaya ini Anda
yos Yang,2025-02-05,1,hotel ini menerapkan kalau minjam mangkok atau perlengkapan makan dengan berbayar ya tidak di tulis syarat syarat di pemesanan hotel
Miutya Arifa,2025-01-05,3,sinyal jelek bahkan pakai penyedia atau wifi minta housekeeping bersiin kamar dari siang tapi tidak dibersihin juga ampe malemnya harus manggil lagi bersiin juga tidak niat ada bekas jaringan di dalam kloset n kasur cuma di rapihin tidak di bersihin debu atau kotorannya parkir sempit saluran tv terbatas dan tidak ada youtube n netflix tapi lokasi strategis banget mau kulineran atau ke tapi deket
Agnes Warsiati,2025-04-05,5,buka puasa di holidy masuk express mantab nyaman makananya semua enak pelayananya muantab mbak desy oke luar biasa
Nisfi Nur Syahrani,2025-01-05,5,layanan yang sangat baik makanannya bervariasi kebersihan oke lokasinya strategis dan kamar nya luas
ywn 99,2024-01-05,4,hotel nya lumayan menu makannya banyak dari makan nasi biasa buah sereal susu toast roti ada juga sayur gudangan di kamarmandi amenity hanya sikat gigi dan topi sabun pakai sabun shampo cair toilet sistem belakang mesin cuci bidet yang nyemprot dari bawah dudukan bukan pakai jet spray dapat 2 botol udara mineral ada teko udara kopi dan teh
frans herlambang,2025-10-05,5,layanan sangat bagus dengan kakak kika
Mr icank,2024-01-05,5,oke itu review saya kamar memang agak kecil tapi layak dengan harga yang dibayar kondisi kamar bersih sih amenitis lengkap minibar oke lah meskipun tidak ada lemari es angkat normal tidak njut2an ac keren tv burek dikit tapi siapa yang membutuhkan tv yang penting wifi oke lah makanan sip pelayanan sopan banget keamanan ramah akses masuk sempit tapi gpp lah ci tidak ribet pemandangan kamar eh kantor sebelah hahaha overall oke lah
Sigit Firmansyah,2023-01-05,5,kamar cukup kecil tapi nyaman sayangnya karena pandemi kamar di hotel ini terlihat kurang terawat walaupun masih cukup nyaman untuk ditempati bangunannya yang besar tapi sepi pengunjung membuat vibes di lorong agak menakutkan makanan standar saja masih masuk kategori bisa dimakan krim sup nya yang terasa enak
uswatun khasanah,2025-01-05,4,stay di sini saat liburan jauh nyaman kamar bersih sarapan enak dan beragam staf membantu lokasi trategis
Beningg Banget,2025-06-05,5,Pelayanannya menyenangkan ramah baik tempatnya sangat nyaman serta lokasinyg strategis
anggoro santoso,2025-10-05,5,pelayanan baik cepat dan bersih
Nurul Madiun,2025-01-05,5,pekerja yang bernama endini servisnya tip top bget terasa nyaman sarapan di kafe nya tkasih embak endini
Aura dwi Aulia,2025-03-05,5,hotel bagus pelayanan terbaik kebetulan saya dilayani dengan mbak rena soto nya muantapp
Reza Anandiraka,2024-01-05,4,hotel yang berada di tengah kota surabaya disekitar hotel banyak jajanan sehingga tidak sulit mencari makan malam kamar hotel bersih dan besar makanan di resto masih standar ada tempat gym cuman tidak ada kolam renang parkir mobil di depan hotel
Eman Hanawi,2025-02-05,5,Pelayanannya baik hotelnya bersih suasana resto nyaman dan tenang
Errik Kurniawan Djuf,2025-02-05,5,Baru pertama menginap nyaman banget pokoknya bagus semuanya insya allah klo pulkam blk lg ke hotel ini
hamzah perwiranegara,2025-01-05,3,kamar cukup oke pelayanan juga gercep lokasi enak banget klo malem bnyk jajanan dan dekat dengan bengkel onderdil kebeneran perjalanan bali surabaya kesenggol mata-mata dan butuh penutup mata-mata beli tinggal di hotel nyebrang saja
Ida Ayu Diah Anggraeni,2023-01-05,1,review saya jujur kamar sempit dan tata letak kamar tidak simetris ruangan menyempit ke arah dalam tv kecil macam tv hotel oyo tidak ada kulkas karpet kotor tidak terawat fasilitas kamar mandi tidak ada brosur kamar layanan cuma kertas hitam putih kaya di fotocopy print biasa emang sih tidak ada pengaruh apa2 tapi serius 4 bintang hotel tidak mampu kualitas brosur parkir sedikit meskipun dapat parkir di depan kita tetap hrs meninggalkan kunci mobil pintu masuk hotel nyempil di antara ruko2 jadul tapi di antara sekian tambah ada baru baru tangan bersih meskipun tidak wangi tapi tercium baycline di
Pendi Iwan ses kediri,2025-07-05,5,sarapannya selalu enak pelayanan bagus
Lhena Pri,2025-07-05,5,suasana hotelnya nyaman dan layanan terbaik
Mardiah Noto prawiro,2025-12-05,5,Alhamdulillah sangat memuaskan
Kanda Ryou,2025-08-05,5,sarapan enak pelayanan ramah
syef husnanthoha79,2025-05-05,5,layanan semakin baik dari sebelumnya ramah sekali pegawainya terimakasih kami senang di sini keluarga besar dprd bondowoso
Echa Ayesha,2024-01-05,3,menginap di sini karena dipesankan oleh rekan kerja suami dan pertama kali masuk agak terkejut juga dengan penampakan karpet sebelah kiri di lobi sudah digunakan dan kotor ternyata karpet di kamar pun sama banyak noda dan kotor diinjak pun terasa ngeres berpasir seperti foto mungkin karena ini hotel sudah tua tapi jika dilakukan pembersihan karpet itu bisa bersih atau memang sudah waktunya mengganti karpet staf perempuan di lobi yang memakai baju abu2 pun tidak ramah ada yang memakai kaos biru juga tidak tersenyum dan tidak menyapa tamu tapi staf yang laki2 semua ramah untuk menyantap hotel dan rasa lumayan lah lokasi tidak dari jauh
andry nugroho,2025-01-05,5,Jam 12:20 malam sampai dari perjalanan jauh setelah cek masuk tidak bisa naik lift karena alarm bunyi sudah letih berharap bisa lsg menyelidiki apa tapi tidak bisa masuk kamar
Erlin Novi,2025-01-05,4,hotelnya bintang 4 tapi pelayanannya seperti bintang 2 kurang ramah kurang tanggap dan harus disuruh terlebih dahulu untuk dibersihkan
Hendro Purwoko,2025-01-05,3,muka dari layanan pelanggan asem dan pelayanan lambat ditanya tidak dijawab dan setelah 3 kali tanya baru dijawab pelayanan valley mobil juga sangat lambat butuh 20 menit lebih baru datang mobilnya
Rinas Collections2,2025-01-05,5,Pelayanan sangat ramah makanannya enak tapi untuk rotiinya sedikit hambar mungkin bisa diperbaikin untuk roti nya
Laurensius 03,2025-08-05,5,pelayanan baik pegawai ramah melayani dengan baik terima kasih gustanul
Agus Soesetyo,2025-06-05,5,Pelayanan bagus selamat datang sekali sngat membantu saya dan istri
Indra Bangsawan,2025-12-05,5,temptnya nyaman makananya enak
Zawa Zahim,2025-10-05,5,nyaman mbak kika ramah
Dimyati Sukses,2025-09-05,5,lokasi strategis cek google map
Freddy Aldo,2024-01-05,5,Salah satu hotel dikawasan kedung doro surabaya dekat dengan kawasan tunjungan dan dengan stasiun kereta surabaya pasarturi proses cek masuk cepat dan mudah kamar bersih amenitas lengkap namun tidak tersedia lemari es dalam kamar fasilitas umum yang disediakan juga cukup lengkap pelayanan ramah untuk sarapan rasa dan kualitas makanan juga baik
Dian Dian,2023-01-05,2,kamar tidak terlalu luas cukup bersih dapat kamar merokok karena tidak ada pilihan lain baru keluar lift di lantai kamar sudah kecium banget bau asap rokok kamar apalagi terasa banget bau rokok untung acnya pagi dingin tidak banyak tidak ada sereal hanya ada roti tawar kue manis 2 macam tidak ada roti lain rasanya secara keseluruhan juga standar biasa saja tambahan sarapan bayar 120rb pax rasanya tidak layak harganya pinjam mangkok dan kirim ke kamar kena muatan 50ribu hahaha lokasi dekat mall tapi dan penjaja makanan lain di sekitarnya lebih baik ambil kamar tanpa sarapan
Jennah RA,2025-10-05,5,Sangat bagus untuk santai
Gita Swasti,2025-01-05,5,petugasnya ramah sekali fasilitas lengkap lokasinya di pusat kota petugasnya sangat kooperatif untuk membersihkan kamar tepat waktu untuk berlibur oke untuk liburan bersama keluarga juga oke
Darmono Soepangat,2025-06-05,5,petugasnya sangat ramah contohnya yang bernama melani yang bertugas di restoran sungguh sopan dan ramah
lina yusrinaa,2025-06-05,5,sarapanya enak lengkap staf di resto ramah ramah smuanya oke
Angela C.,2025-01-05,5,pintu lokasi agak kurang terlihat karena tertutup ruko keseluruhan pelayanan oke makanan kurang variatif saja jdi agak bosan sarapannya
Laila Astyningtyas,2025-01-05,5,fasilitasnya oke banget kebersihannya terjaga makanannya enak pelayanannya ramah saya dan tim puas untuk pelayanannya terus mempertahankan
Noenik Kasriyatmi,2025-02-05,5,semuanya bagus memuaskan tolong untuk menu baru bubur sumsum disediakan terimakasih
Margianti Puji Lestary,2025-01-05,5,menyenangkan puas pelayanannya ramah mungkin untuk menu sarapan ditambah lagi agar bervariatif trimakasih
novita ph,2025-12-05,4,Sekali lagi untuk tinggal di Dissaurabaya
resy ovita,2025-12-08,5,wah makanan nyaa enak
Akun Mobile,2025-01-05,5,Brekfast sangat enak suasananya sangat nyaman mantap sekali pelayanan juga baik dan sangat peduli ke tamu yang sedang kebingungan karna makanan nya sangat enak dan banyak terima kasih mas lutfi dan mas adji atas pelayanan nya
rio ramadhan,2024-01-05,5,overall bagus mulai mengendarai kebersihan kenyamanan suasana kamar akses mudah makanan uwenak banget mandi berfungsi baik cuman mungkin volume air mandi agak ditambah lagi berbaloi banget buat kalian yang tinggal di sbya
Liani Debora,2025-08-05,5,menu sarapan paginya enakk
Kukuh Abadi,2025-03-05,5,makanannya enak pelayanan bagus suasana oke overall mantapp
Archanudin Solechan,2025-07-05,5,terjangkau dan strategis nyaman pada pokoknya
nyoman suartha,2025-01-05,3,Pelayanan ramah kamar bagus sarapan kurang ada jajanan pasar eeh untuk bantu umkm ya
Ratna Dewi Tisnasari,2025-01-05,4,nyaman dekat tempat kuliner parkir diarahkan makanan banyak variannya mungkin lebih ditambah makanan khas daerah baru
Nyonya Suka Dolan,2021-01-05,4,1 lokasi mudah diakses dekat stasiun pasar turi dan gubeng dekat mall tapi bg simpang grand city plaza surabaya dan juga wtc banyak minimarket dan kuliner kaki lima saat malam hari dijamin tidak akan kelaparan 2 pelayanan cek masuk keluar cepat semua kru ramah murah senyum membantu dan cepat respon terutama kru restoran saat sarapan 3 k a m a r untuk tipe superior tidak sempit masih leluasa untuk bergerak suka sama bantalnya 2 jenis fasilitas lembut dan tegas di dalam kamar berfungsi normal udara mandat bank luar biasa itu yang kami suka 4 ruangan restoran bersih dan terkesan mewah pada bagian stall makanan yang yang
Sonhaji,2025-05-05,5,Pelayanan ramah dan sarapannya enak semua mantap adalah yang terbaik
Mei & Ar,2023-01-05,4,kamar standar cuma karpetnya kurang bersih ada sisa2 rambut bekas org mana banyak terus dikirim dan sikat gigi hanya disediakan 1 padahal saya menginap berdua tidak ada kolam renang jg padahal hotel bintang 4 plusnya makanannya enak dan variatif pelayanan oke terima kasih
Joe Aditia,2025-01-05,4,lokasi tidak di pusat kota kamar bersih dan luas makanan oke rasa sudah saat pelayanan jg ramah
Arief Ais,2025-04-05,5,untuk buka puasa fasilitas dan makanan enak banyak pilihannya semoga makin sukses
Gio Villanova (Gio),2025-01-05,5,sangat higienis bersih ramah pegawai nya bekerja dengan sepenuh hati penuh senyum baik sopan santun lembut super istimewa terbaik paket lengkap
Rusdiantono Rusdiantono,2025-01-05,5,Terima kasih buat pelayanan yang baru yang sopan dan energik buat staf yang baru semakin baik lagi ke depan nya dan terima kasih buat mbak endini yang dengan ramah tama melayani saya
Parini GG,2025-01-05,5,sarapan nya enak saya paling suka nasi goreng arrabiata pasta nya pizza yang ditawarin juga yummy
Nadia belva,2025-06-05,5,Suasananya tenang dan nyaman apalagi pelayanannya super ramah
Umi Kulsum,2025-01-05,5,tempat nya luas kamar bersih dan nyaman makanan nya enak enak terbaik moga sukses slalu
Yuniar uni,2021-01-05,4,lumayan lah ya buat hotel budget tapi parkirannya kecil agak repot kalau bawa mobil lokasi di daerah yang cukup ramai lalu lintasnya padat tapi cari makan mudah sarapannya standar cuma enaknya dia punya fasilitas grab n go jadi sarapannya di siapin dalam paket gitu kalau kita cek keluar pagi2 sangat isinya sih telur revus air mineral 330ml dan 2 macam muffin kue
Huzain Ali Muhammad,2020-01-05,4,kamarnya bagus dan gedungnya juga bagus sayangnya makanannya kurang terasa bumbunya menurut saya terlalu standar untuk ukuran hotel bintang 4 dari beberapa hotel bintang 4 yang pernah saya kunjungi mungkin sarapan di sini yang paling standar rasanya untuk manajemen parkirnya sendiri terburuk menurut saya manajemen parkirnya sangat tidak cocok untuk hotel sekelas bintang 4 apalagi saat akhir pekan dan tamunya sedang lumayan banyak oh ya ada satu hal positif lagi untuk hotel ini karena kamar tamu berada di lantai yang tinggi jadi pemandangan dari kamar lumayan bagus
mania ingka,2025-01-05,5,Layanan bagus rasanya lumayan yang saya suka toilet nya bersih lokasi dekat kita juga
Deb's,2025-01-05,3,Air untuk mandi kurang sesuai karena membuat rambut jadi kaku tidak bisa pinjam setrika ke kamar dan tidak ada kulkas di kamar
Carly Rae,2024-01-05,1,13 juli jam 00 12 saya memang hanya numpang ke toilet beberapa menit resepsionis juga melihat dan malah tersenyum ramah tapi ketika mobil saya bergerak meninggalkan lobi satpam sekitar usia 20 tahun seorang menegur kami dengan kasar dan menginterogasi kamar nomor brp hanya ke toilet ini bukan toilet umum di luar saja sana rantai hotel internasional sekelas ihg liburan inn bagaimana hr anda mendidik karyawan saya numpang ke toilet di hotel 5 di dalam luar negeri tidak pernah diperlakukan oleh keamanan seperti maling hanya karena numpang ke toilet beberapa menit ketika melihat saya itu satpam melotot dan gayanya pria menantang saya wanita
ichtiyanto ryan,2025-03-05,5,Semua makanan enak kamarnya bersih seluruh karyawannya ramah
anton rukiyan amitono,2025-07-05,4,menu makanan standar saja tidak ada yang istimewa
Sianawati Purwadi,2025-01-05,5,pelayanan bagus ramah ramah makanan enak terima kasih kepada seluruh karyawan liburan inn maju dan berkembang terus
Donna Rose,2023-01-05,2,baru kali ini nginap di kamar yang bau asap rokok jujur saya sampai tidak bisa tidur karena bau bekas asap rokok seharusnya pihak hotel menyediakan pengharum kamar untuk kamar yang bebas merokok agar konsumen yang menginap bisa nyaman tidur di sana dan harus lebih berhati-hati untuk fasilitas kamar yang digunakan dari peralatan mandi dan sandal kamar pelayanan baik dan ramah menu sarapan pagi cukup
Gabriel S,2025-03-05,5,makanan nya enak pelayanan baik mungkin lain waktu bisa kesini lagi
Afan Junior,2025-07-05,5,Pelayanannya bagus dan mas suka ramah dan baik
Yudisthira Dharma,2025-05-05,5,kamar oke untuk menu sarapan bervarian dan rasanya enak
Nursal SH,2025-08-05,5,kamar layanan lokasi sangat baik
Sandy Untung,2025-02-05,5,pelayanan hotel oke banget dan pelayanan terhadap pelanggan mbak endini nilai 9
Tri.jokoasmoro@gmail.com 17081945,2025-12-05,5,pelayanan baik dan akses mudah
Krisyanto Ekokurniawan,2025-01-05,5,hotel dengan kamar yang nyaman dan bersih sayang dengan harga kamar yang lumayan kelengkapan kamarmandi hanya sabun dan sikat gigi
Ryan Partigor,2025-03-05,5,Pelayanannya ramah dan ngopi di sini nyaman angin nya sepoi2 selama 2 hari saya dilayani dengan baik oleh desiy
Faliqul Mustafid,2025-01-05,5,sarapan nya sangat enak makanannya bervariasi dan lezat pelayanannya sangat ramah saya dilayani oleh mbak rena
supriyadi Eko Praptomo,2025-12-05,5,kamar nyaman makanan enak mbak kika ramah
gtt sengseng,2025-03-05,5,layanan hotel snagat baik dan nyaman dan pelayanan dari pak fawwas sangat ramah dan baik
Tritya Mudita,2024-01-05,5,Tempat strategis parkir nyaman kamar lumayan oke harga oke sarapan jg oke syg malam hr saya di lobi smpai jam 12 cukup banyak nyamuk
Anastasia Gita,2025-01-05,5,Tinggal 5 malam disini kamar bersih dan wangi kebersihan rumah tangga membersihkan setiap hari makanan enak dan segar
Rriswardhana hbi,2025-01-05,5,meja kamar 616 sudah mau roboh karena patah klo siang susah kuliner dan jauh dari alfamart indomaret
Dina Alizatul,2025-01-05,5,Pelayanan nya ramah dan fasilitas nya memuaskan berikutnya bakal berkunjung ke hotel ini lagii
Panji Madiun,2025-01-05,5,Pelayanan baik makanan enak tapi wastafel di toilet airnya gk bisa jalan
syahmudi mudi,2025-01-05,5,hotel yang berada di pusat kota banyak penjual makanan berjejer di seberang jalan pokoknya buat pengen kulineran di sini tempatnya
Robby Liemhoo,2022-01-05,1,1 kami menginap 3 malam dengan 3 kamar yang awal mula rencananya 5 hari namun baru kali ini ketika menginap di hotel pinjam piring diminta membayar Rp 50 rb 2 keponakan saya yang hanya akan menemani kakeknya untuk sarapan pagi di resto di minta membayar Rp 78 rb jika tidak diminta menunggu di luar padahal ponakan saya jg tidak makan berhasil saat saya duduk di lobi saja 3 kami mencoba memahami apa yang terjadi dengan aturan dalih aturan manajemen pihak oke aturan tentang aturan tapi lucu mungkin saya yang kurang update jika ada hotel yang mengenakan biaya untuk pinjam piring dan menemani sesorang
OLDY POLREND,2022-01-05,1,hotel ini digunakan kegiatan rapat salah satu lembaga pemerintahan di tingkat provinsi namun dalam pelayanannya sangat tidak baik menurut saya apakah yang disajikan cemilan dan kopi teh di meja hanya yang duduk di area meja bulat saja sementara yang duduk di belakang meja bulat barisan tidak dilayani diikah manajemen hotel yang saya kunjungi hari ini pelayanannya memilih maaf2 jika kata2 saya kasar saya hanya tidak ingin lebih banyak pengunjung atau peserta rapat yang ikut kecewa seperti saya
wid wid,2020-01-05,4,selama 4 hari menginap di sini sih tidak ada yang istimewa semua biasa saja karyawannya juga biasa saja alias tidak terlalu ramah ada kesan datar banget menu sarapan juga untuk hotel bintang 4 sepertinya menuunya tidak banyak variasi dan rasanya standar tapi untuk melihat oke lah karena kemarin saya minta kamar lantai tinggi
Putri Rinjani,2023-01-05,5,kamarnya luas dan bersih pegawainya ramah makanan saat sarapan enak banget terutama sambal nya jika malam didepan hotel banyak penjual makanan bahagia deh nginep disini dianjurkan
Dina Rizki,2025-07-05,5,makanannya enak pelayanan bagus
inge loerensiawati,2025-05-05,5,SDM layanan nya sangat baik terutama mb endini tas resto saya terkesan
Retno larasati,2025-06-05,5,baik banget suka sama pelayanannya baik ramah poll terbaik
Dani Smaning,2025-05-05,5,Pelayanan di resto memuaskan dan sarapannya enak semuaa
Riski Septiando,2025-08-05,5,Pelayanan nya bagus ramah oleh rizky
vika windyasih,2025-03-05,5,makanannya enak sangat puas tempat bersih pelayanan juga ramah
Arnetta Dewi,2019-01-05,5,hotelnya bagus dan bersih stafnya ramah banget kamarnya kedap dan tidak bau rokok sarapannya cukup bervariasi di hari pertama ada masalah ac tidak dingin tapi segera segera ditangani oleh staf hotel lokasi bagus di tengah kota jadi kemana mana dekat banyak kuliner kaki lima yang enak di dekat hotel juga
Izzata Laxamana,2025-01-05,5,namun membekas sarapan di sini membawa saya ke suasana tradisional namun juga tidak meninggalkan konsep modern dari restorannya kereen
Fatin Yuliyana,2025-01-05,5,penginapan yang sangat nyaman sekali pelayanan nyaa juga bagus fasilitas juga lengkap
STIKES Hang Tuah Surabaya,2025-01-05,5,tempat hotelnya terbaik suka deket tapi sama sama bgj pelyanan staf ramah
hadi gunawan,2025-01-05,5,pelayanan mbak endini baik makanan enak kamar nya nyaman
Rama Kurniawan,2024-01-05,5,hotel nyaman dan sesuai dengan harga menginap di sini waktu liburan sekolah staf ramah resepsionis nya juga oke makanan nya enak semuanya sesuai lah sama tingkat gelar hotel hotel baru paling dianjurkan
Hendra Kurniawan,2025-03-05,5,sarapan nya komplet lebih baik dari semarang ac tidak berisik oke
ZIDANE DAFFA,2025-03-05,5,keseluruhan baik staf resto ramah makanan minuman enak dan lumayan bervariasi
Ina Maulina,2025-01-05,4,Pelayanan semuanya bgus cm kamar nya saja area merokok yang kurang sarapan nya enak2
achmad windianto,2025-01-05,4,tempat dekat tunjungan plaza makanan rasa oke hanya tidak ada bubur manis kamar oke
annisa nur auliyadewi,2025-01-05,4,sarapannya banyak variasi makanan bahkan ada menu tetap baru pizza enak makanannya
Andy Setiawan,2024-01-05,1,menginap 4 malam pemesanan atas nama istri masuk 19 09 dan cek keluar termasuk extend 23 09 mendapatkan pengalaman pelanggan yang membagongkan tgl 21 kembali ke kamar sekitar 10 30 malam dan mendapatkan gelas bekas kopi dan teh saat pagi tidak dicuci tidak diganti tambah tangan mandi tidak ada laporan ke housekeeping diantarkan tangan dan maaf pernyataan dasar dan pada tanggal 22 kejadian berulang dimana saat kembali ke kamar gelas bekas teh dan kopi juga tidak dicuci tidak diganti benar2 pengalaman yang membagongkan di hotel jaringan yang bawa nama liburan inn
Caesar,2025-01-05,5,Pengalaman sarapan yang bagus dengan cukup variasi harus coba rolade tahu dan lontong sayurnya mereka benar-benar bagus
Yunita Caroline,2024-01-05,3,kamar non merokok tapi bau asap rokok sudah beri tahu resepsiis dan sudah dbantu semprot pewangi tapi masih tetap terasa asap rokoknya
Yohan Adi Setiawan,2020-01-05,4,Proses cek masuk dan cek keluar baik sekali varian makanan pagi banyak tapi citra rasa bumbu indonesia hilang lokasi masuk hotel agak susah jika dari tunjungan tidak ada pengatur kekuar mobil untuk masuk hoyelnya tidak ada kolam renangnya
charis olied,2018-01-05,1,manajemen yang lepas tangan ceritanya saya menginap tgl 17 mei berikutnya tgl 18 saya pindah ke hotel karena penuh dipesan dan kembali lg pada tgl 19 mei dengan membawa mobil teman dikarenakan parkiriran yang tbatas disarankan pihak keamanan untuk membantu valet keesokan hari ktk cek keluar saya menemukan ban mobil tertancap paku beserta sepotong kayu saya meminta penjelasan ke pihak hotel dan dikarenakan waktu jadwal penerbangan mendesak dan tidak ada pihak manajemen memaksa saya harus brkt dengan janji akan dihubungi secepatnya catat ya secepatnya 1 hari 2 tak satupun telepon klarifikasi ke saya akhirnya di
muhammad Jbl2016,2025-10-05,5,Pelayaman dari staf resto istimewa
Wahyu Decisa,2024-01-05,5,ruangan sangat nyaman dan bagus lantainya karpet ac dan kamar mandi oke banget ada pengering rambut nya juga variatif sarapan bisa lah nginap di sini lagi
AGUS INDARTO,2025-02-05,5,Kepada anak-anak asik semangat dan sehat selalu sarapan lezatto pelayanan personel mb endini ramah saset dan asik
Reyna Vidyantari,2022-01-05,4,seperti semua Holiday Inn Express saya puas dengan pelayanannya hanya saja rasa makanan sarapan agak kurang apa karena waktu saya menginap sedang bulan puasa kamar standar sudah tidak disediakan kulkas
Yonathan Pohanda,2019-01-05,5,Saya datang makan di buffet nya untuk ragam jenis makanan utama cukup banyak berkisar 7 8 masakan ada kue camilan bubur madura pelayanan juga cepat ketika ada masakan yang sudah tidak lama kemudian sudah di isi kembali untuk minuman standar saja teh kopi infused air dan sirup tidak ada minuman ringan
Dewi Putri,2025-01-05,5,untuk pelayanannya sangat ramah dan sarapannya enak di pertahankan lagi sukses selalu
Alexander Georico,2024-01-05,5,pengalaman saya menginap di sini sangat nyaman kamar luas bersih rapi wangi pelayanan juga bagus petugas semua ramah tamah
Yuliana Bessie,2025-01-05,5,tempat yang strategis ditengah pusat kota surabaya pelayanannya ramah rekomendasi untuk menginap di sini
TjokroHoetomo Batiktulis,2024-01-05,5,fasilitas bagus kamar nyaman mohon dapatnya mushola di lantai m bisa diperbesar dan jika memungkinkan dibedakan antara mushola laki laki dan perempuan terimakasih
christine Djoe,2021-01-05,5,kamarnya bersih dan sangat nyaman dengan pemandangan yang bagus makanannya yang disediakan hotel juga enak kekurangannya hanya di taman yang kecil sehingga cukup menyulitkan ketika hotel sedang ramai
