User Name,Review Time,Rating,Review Text
Muzaffak muzaffak,2022-12-30,5,hotel yang saat buat istrhat di pusat kota surabaya parkir luas kamar bersih dan nyaman
cholid huda almahdi,2021-12-30,4,hotel yang nyaman jalan menuju ke situ agak ribet ku tidak jeli lihat google map pasti sudah nyasar
Bidan Mustika Timika Chanel,2021-12-30,5,hanya bila pesan harus sekalian makan pagi semoga kedepan nenek ina tidak membatasi makan pagi nya kasian kan kalau tidak tahu
Achmad Efendi,2021-12-30,4,Proses ini cepat amnesti standar fasum sepi seperti punya sendiri tapinperlu ada perbaikan sedikit2 bf baru perlu ditingkatkan
Yayuk Hariani,2019-12-30,4,hotel yang bagus strategis dengan kolam renang dn makanan yang bervariasi berhadapan dengan mall tapi surabaya
WACHIDHABIBI,2020-12-30,5,Salah satu hotel bintang 4 yang strategis dipusat kota kamar luas bersih pelayanan prima
Yhan alfis,2019-12-30,5,tempatnya sangat bagus dianjurkan hotel saat anda berada di surabaya kamar hotel sangat bersih pelayanan sangat baik
Juniores Pasaribu,2020-12-30,5,mantap hotelnya dianjurkan untuk menginap di sini kemana mana mana dekat pelayanan ramah hotelnya bersih dan makanannya mantapp
Bagus D Anugrah,2019-12-30,4,bangunannya agak lama saluran tv tidak terlalu banyak tapi lokasi hotel sangat strategis staf nya ramah dan kooperatif
Ahmad Nawawi,2016-12-30,5,lokasi tenang meski tengah kota dekat tunjungan plaza kamar cukup luas dan fasilitas komplit sarapan nya enak layanan nya juga bagus
M Subhan Fauzi,2024-12-30,3,Parkir penuh orang 03 Agustus 2024 Jaminan malam tidak begitu profesional mereka hanya meminta untuk pergi keluar dengan mobil saya
laila shasha,2018-12-30,4,dekat banget kalau mau ke tunjungan plaza tinggal di hotel nyebrang di tengah kota surabaya mudah aksesnya kamar bersih dan udara panas oke
Padmo Susastro,2018-12-30,5,hotel di pusat kota surabaya yang sangat nyaman manajer pelayanannya bagus dan ramah dari sdm muda yang cekatan
ferdiariyans,2018-12-30,5,tempat yang nyaman untuk menginap dengan lokasi strategis pelayanan yang cepat ramah
Rahadatul 'Aisy,2019-12-30,5,Kami 1 rombongan nyampeke hotel jam 1 malm tapi tetap dilayani dengan makan walaupun baru tiba mantap benar
Budi Setiawan,2018-12-30,4,Tempatnya asyik dekey banget dengan tunjungam plaza walaupun sudah berusia 30 tahun tapi masih sangat nyaman buat menginap
virman persada,2018-12-30,5,hotel yang nyaman dan pelayan ramah ada masjid di bagian belakang tuk tetap menjaga sholat berjamaah
Mori,2022-12-30,5,fasilitasnya cukup lengkap cuman tempat untuk basuh badan di kolam renangnya yang terbengkalai
Hengky k. Linggadjaja,2022-12-30,5,bagus hotel lama tapi banyak tempat sekitar yang dapat dikunjungin
LED Tour Travel,2020-12-30,5,Salah satu hotel yang berada di tengah kota surabaya tapi sayangnya fasilitas kurang dirawat dan pelayanannya kurang
bimais mojokerto,2024-12-30,5,lokasi sangat strategis di tengah kota dekat dengan pusat perbelanjaan
Arrifah Itdaprov,2019-12-30,5,lokasi strategis pelayanan mantul ramah dan care banget menu sarapan enak dan bervariatif
Argya P. Budihandojo,2017-12-30,3,Hotel ikonik yang terletak masuk pusat kota dekat dengan banyak lokasi ikonik seperti Grahadi dan monumen kapal selam juga dekat dengan pusat perbelanjaan seperti Tunjungan Plaza atau Surabaya Plaza terlihat sedikit usang dari luar
Ima Aga,2019-12-30,5,lokasi strategis kamar bersih hampir setiap liburan bersama keluarga kami selalu bermlm di grand inna tunjungan
Panca Adi,2023-12-30,5,lokasi strategis dekat tapi tapi kalau untuk jalan jalan ke sekitaran balai kota sangat dekat dan oke
Heldhi Yonathan,2018-12-30,5,Hotel legendaris di Surabaya sejak zaman 80an yang msh terawat baik dengan mudah dan lokasi yang top d pusat bisnis dan kesenangan surabaya
Zeref闇,2022-12-30,2,Air keruh kolam renang kotor ada kecebong wifi lemot setiap menit suruh login ulang gajelas
ria ria,2021-12-30,3,Tidak ada skrining peduli lindungi atau antigen tidak ada sandal kamar makanan prasmanan ambil sendiri
--,2018-12-30,3,bak mandi tidak ada sumatnya jadi tidak bisa di pakai wastafel tidak bisa dibuka sumatnya tapi lokasi di tengah kota jadi dekat ke mana2
Habibi Junior,2019-12-30,5,hotel bersejarah bintang 4 terletak di tengah kota surabaya yang sungguh nyaman bersih dan karyawan sangat ramah sekali
Andy Andy,2020-12-30,4,hotel tua kamar nyaman kolam renang waktunya renovasi karyawan ramah lokasi bagus di seberang tunjungan plaza
Mataul Harsani,2022-12-30,5,bagus untuk sekelas hotel berumur cocok bagi yang mau jalan2 ke tapi
Tjahjo Nugroho,2023-12-30,5,sudah semakin baik untuk menarik konsumen parkir sampai di luar area hotel
Nisga Lopulalan,2024-12-30,5,hotel lama tapi pelayanan bagus dan tempatnya nyaman
ani mudi,2017-12-30,4,hotel dkat plaza tunjungan yang strategis untuk bisnis ataupun berlibur bersama keluarga bagus tpi ac dingin banget
Ichad Hukom,2021-12-30,5,Hotel yang nyaman di sudut jalan kenyamanan dengan harga yang wajar kamar bersih dan tempat besar masuk tengah kota dan dekat Tunjungan Plaza Mall dianjurkan
Bocah petualang,2020-12-30,5,tempat strategis ditengah kota parkir lumayan luas ada cafe gengan live music didepan tempat nyaman
Nuniek kusuma,2018-12-30,3,lumayan bersih dan rapi tapi banyak nyamuk berisik karena suara bising dari jalan raya jadi tidak bisa tidur
Julia Arsita,2018-12-30,5,hotelnya bagus meskipun bangunanya tidak baru pelayannya super ramah banget sarapannya lengkap juga
Mustakim temah,2019-12-30,3,hotel yang bagus jg disby parkir luas jg ada masjidnya dekat mall tunjungan dekat rmh dinas gubernur jatim
Teguh Prakoso,2018-12-30,5,sudah lebih segar rasa makanan enak letak strategis kolam renang oke kamar bersih
Melissa Septania,2018-12-30,4,kamar fasilitas memuaskan namun membutuhkan banyak kru untuk kolam renang agar dapat melayani pelanggan lebih maksimal
Koesnanto Entoeng,2024-12-30,4,Hotel lama yang masih bertahan dengan layanan yang lumayan
Anwar sila Bima,2020-12-30,5,Layanan mu memuaskan SMG terus mengikuti Irama tidak tertinggal dan tergilas oleh kemajuan teknologi kita akan bertemu lagi dilain waktu terima kasih
adnans,2019-12-30,3,Hotel lama yang direnovasi terletak di tengah kota dekat kemana2 tapi antara harga dan fasilitas kurang berharga
Norma Santi,2022-12-30,5,tempat bagus kamarnya luas dan besar pelayanannya juga bagus makanannya juga enak2
Denias Susanto,2019-12-30,5,Hotel lama yang memberikan layanan yang sangat baik staf sangat ramah untuk saya makanan adalah sarapan terbaik dengan banyak pilihan
Savana go,2022-12-30,4,nyaman deket mall tunjungan juga cuman tv sering hilang sinyal tapi semuanya sip deh
Ria Saktia,2017-12-30,5,Kamar yang bagus cukup luas buat anak2 lari sana sini karpet di kamar utama juga anak aman
ARISMAYA PARAHITA,2024-12-30,5,favorit klg di pusat kota dekat mall tunjungan plaza kamar luas pemandangan kota
Redy Wibisono,2024-12-30,4,Bukber Ramadhan April 2024 lokasi strategis paket bukbernya kinerja harga
Yoseph Saputra,2019-12-30,5,kamarnya luas letaknya tengah kota jadi sgt strategis unt kemana2 jadi oke banget
Johana Widyati,2018-12-30,5,hotel yang nyaman ditengah kota sarapan enak anak2 seneng nginep disini kalau ke surabaya
Dorin Dorin,2024-12-30,4,Aku mampir ke sini untuk mengunjungi teman-temanku hotelnya bersih dan stafnya ramah
agung wijaya THR,2019-12-30,5,Hotel nya besar bagus tengah kota dekat mall mall terbesar di sby tinggal jalan saja klao mau kemana saya
Watimbo TV,2019-12-30,4,Hotel ya dekat dengan mall kamarnya memang agak lama sih tapi malam cocok buat santai ngopi dan sarapan ya lumayan
Nety Hidayati,2021-12-30,5,karyawan ramah tempat bersih pemandangan dari kamar keluar bagus ada jendela kaca dan kolam renang terima kasih
Nur Setyanto,2019-12-30,5,Harga saat dekat mall tunjungan ada masjid di belakang hotel jadi kalau kita mau sholat jamaah ada orang
Mardiansyah Hidayat,2023-12-30,5,cukup bagus dan nyaman walaupun di tengah kota surabaya dekat dengan mall dan kuliner
Tabitha Sulistya,2022-12-30,4,menginap semalam saja karena transit kamar layanan sarapan pagi semuanya oke
It's Devi,2022-12-30,5,untuk cari hotel anggaran di sekitar jalan tunjungan ini salah satu yang saat ini bisa jalan kaki ke alun-alun tunjungan atau menjelajahi kuliner di sekitar
Steffi “Steffi Phang” Pangkawira,2018-12-30,4,lobi bagus layanan bagus juga tapi kita punya masalah masuk kamar kita seperti ac leaking dan tidak sehat bukti dengan pintu sebelah
"Ir. Kadek Amerta Yasa, ST.,MT",2020-12-30,5,tempat menginap di jantung kota surabaya yang nyaman dengan harga terjangkau cocok untuk liburan bersama keluarga
Septian Asigit,2021-12-30,5,klo hr minggu hotel grand inna tunjungan buka angkringan bubur ayam yang joss pokoknya
lintang novela,2022-12-30,4,buffetnya diambilkan sering tidak di isi ulang isi ulang lama baik makanan minumannya
Totok Sugianto,2024-12-30,5,Hotelnya bersih dan nyaman buat acara pertemuan
Laksmi Susilowati,2021-12-30,5,hotelnya di dekat pusat perbelanjaan tempat parkirnya luas pelayannya ramah
Djuniartha Aswinabawa,2019-12-30,5,walaupun hotel lama tapi tetap tertata dengan baik lobi bersih pelayanan hotel baik semoga tetap dijaga pelayanan nya
Outboundjakarta .com,2015-12-30,4,Rekomendasi letaknya strategis untuk kantornya luas nyaman kolam renang dan interior kamarnya juga bagus
Erik Susanti,2019-12-30,5,hotel nya bersih nyaman pelayanan bagus sekali dan ramah tamah semuanya
Reyza,2021-12-30,3,udara hangatnya tidak terlalu hangat lantainya sering mencicit ac nya tidak terlalu dingin
Jason Che,2024-12-30,1,Sangat sangat bising masuk kamar bahkan setelah tengah malam karena jalan utama tidak mungkin untuk tidur
Muib Kasipenkumntt,2018-12-30,4,pintu masuknya susah dicari bagi yang belum pernah ke grand inna sampai muter 2 kali ternyata persis dipojokan seharusnya ada rambu penanda masuk ke situ mksh
Ervien Dyah Soebekti,2018-12-30,4,ruang pertemuan yang oke audio baik makanan dan minuman variatif lokasi strategis tempat menginap dianjurkan
agung yudhanto,2022-12-30,4,pesan makan lama teras saat hujan untuk makan malam tidak tertutup jadi kita kehujanan tidak nyaman
Wina Farafinsah,2019-12-30,4,3 kali kesini 2 kali acara disini buffet makanan kopi istirahatnya enak ramah ramah juga mba mba mas masnya hehe
benny hatiuron,2017-12-30,5,Inna Simpang adalah hotel warisan dekat Tunjungan Plaza Surabaya hotel murah tapi non-budget hotel tempat masuk pusat kota Surabaya kota Anda harus mencoba ketika Anda pergi ke Surabaya terima kasih
Ode Ladamay (Oudhey),2023-12-30,5,Tempat yang bagus pendingin udara kamar mandi kecil sarapan lezat dekat pusat perbelanjaan Tunjungan Plaza
ivar burlage,2023-12-30,4,Hotel bagus tapi staf tidak berbicara bahasa Inggris juga airco tua masih bekerja tho
Arijo Damar,2023-12-30,5,bersih ditengah kota sederhana cek masuk keluar ramah staf parkir oke
Septiana Nuritasari,2022-12-30,5,pelayanan ramah makanan lumayan enak cuma kurang beragam jenisnya
Garry Martien,2017-12-30,4,masuk tengah kota dekat Surabaya Tunjungan Plaza ikonik harga terjangkau sedikit kuno tapi itu oke bersih dan rapi kamar ramah staf
Sultan Maulana,2022-12-30,5,lokasi sesuai dengan peta konfirmasi pesanan cepat pelayanan ramah suasananya nyaman dan aman
Didik Sampurno,2020-12-30,5,hotel inna yang halaman depannya disulap jadi angkringan untuk bertahan dikala pandemi karna industri hotel sangat terdampak
Egha Larasati,2021-12-30,5,Suka banget sama hotelnya kamarnya saat buat yang mau staycation
alfin daely,2023-12-30,5,dianjurkan kamar luas parkir luas bersih nyaman sarapan enak variatif
arinto wibowo,2019-12-30,4,Hotel lama milik bumn jadi ingat jaman pak harto nyaman oke lah
Jhe Setiyadi,2022-12-30,5,Lokasi strategis dekat dengan banyak tempat wisata Surabaya makanan juga lezat
Rendy Zesario,2024-12-30,5,lokasi strategis bagusbjuga dekat tapi bisa jalan kaki
Aarun Shah,2021-12-30,5,hotelnya bersih parkir luas standar protokol kesehatan diberlakukan
ocal Sophan,2022-12-30,5,staf ramah kamar luas bersih enak untuk istirahat dan merenung
obenz “Parabellum” CTU,2023-12-30,4,kamar sisi jalan raya masih bisa mendengar kendaraan lewat hehehe
Chrishnawati,2023-12-30,3,Lebih detail untuk cleanlines mungkin hotel tidak siap untuk musim tinggi waktu beberapa bagian hotel perlu untuk mempertahankan
Rachmad Hidayat,2020-12-30,4,Ada tempat bercinta modern niee cocok lhaa buat tempat bersantai breng keluarga teman2 ato sama sii doi
brianika irawati,2018-12-30,3,hotel yang nyaman pelayanan ramah dekat dengan pusat perbelanjaan tempat parkir juga oke
Stefanus Wihardja,2019-12-30,4,Baru direnovasi membuat tempat ini tempat yang nyaman untuk bertemu kopi yang baik tidak terlalu mahal belum sempat mencoba makanan belum
Eko Hendra Wijaya (EHW),2016-12-30,3,lumayan untuk hotel yang dkt pusat kota hotel gaya klasik atau emg sudah hotel lawas ya
yudistiro gandhi,2021-12-30,5,nyaman untuk kamarnya dan lobi juga luas dengan penataan kursi tunggu yang baik
bang tito,2022-12-30,4,Hotel enak dan luas sayang masih bising sama bunyi kendaraan
Asnan Wijaya,2020-12-30,4,Lokasinya sangat strategis berada di tengah kota parkir luas layanan ramah
Roesdi Ghani,2024-12-30,5,staycation yang nyaman di grand inna hotel nyaris tidak ada kekurangannya
Rj Sadmoko,2018-12-30,4,letak di tengah kota sangat strategis pelayanan ramah kamar cukup rapi
Siti Hajar Aisyah,2021-12-30,3,kurang puas karena di kamar tidak ada disediakan tisu hanya di toilet saja yang ada tisunya
Nabila Hasna Putri,2023-12-30,5,makanan untuk sarapannya enak kamarnya juga luas dan bersih trims
Alif Ghazali,2020-12-30,5,sedang dalam proses pembangunan grand ballroom di sisi belakang hotel ini nyaman untuk ditempati terletak di lokasi strategis dekat plaza tunjungan
Eva Kencanawati,2019-12-30,4,lokasi strategis dekat alun-alun Tunjungan sarapan cukup bervariasi kamar luas dan bersih secara keseluruhan oke
Irma hayati,2020-12-30,5,kamar bersih kamar mandinya juga bersih stafnya juga ramah banget aduuh top banget lah
Margaretta Wongkar,2018-12-30,5,Grand inna tunjungan atau inna simpang adalah salah satu hotel yang sangat strategis terletak di pusat kota surabaya dan sangat dekat dengan plaza tunjungan
Wahyudi,2018-12-30,4,bagus hanya saja untuk toilet yang samping kolam renang kecil dan kurang memadai
ICUK SASMITA TV,2019-12-30,5,Hotel ini strategis ya terletak di lokasi tengah kota dan Alhamdulillah ternyata ada masjidnya
Sahruddin Sahar,2019-12-30,4,bersih tempat parkir luas dan letaknya strategis berada di kota surabaya
MUMTAZ GAMING,2022-12-30,4,Saat ini kamar mandi utama sedang diperbaiki dan harus antri untuk sisa 1 kamar mandi
HARIYANTO JOYO LELONO,2023-12-30,5,resepsionis sangat ramah bersahabat menu sarapan kumplit
Widya Lesmanawati,2021-12-30,5,Dari cek masuk sampai cek keluar aman nyaman senang berikutnya kesini lagi janji terima kasih
Virgo Virdiansyah,2023-12-30,5,lokasi hotel berada di tengah kota surabaya dekat dengan jalan tunjungan
mutiara indah,2019-12-30,4,kamar bersih stafny ramah ada kendala pada air kran kamar mandi yang keruh
Gagas Satrio Wibowo,2022-12-30,5,mantap hotel nyaman dekat dengan kantor gubernur dan taman apsari
muhammad redo,2024-12-30,5,lokasi hotel nya sangat strategis
Fairuzul Mumtaz,2022-12-30,5,terima kasih sudah melayani para tamu dengan baik dalam pernikahan saudara kami sukses selu
Febri Putra,2020-12-30,5,resepsionisnya kuep ramah yaiyalah toiletnya bersih makanannya enak
siti chandra widjanantie,2019-12-30,5,Inna Simpang adalah hotel pertama masuk surabaya yang selalu meletakkan bendera merah putih Indonesia masuk halaman depan mereka
Phillip Phillip,2021-12-30,5,hotel dengan furnitur klasik tapi tetap menjaga kebersihan dan pelayanannya bagus
Atiek Rachmawati,2017-12-30,5,suka nginep disini pelayannya ramah sarapan pagi bervariasi
Nanang Yulianto,2021-12-30,4,tempatnya nyaman halaman parkir cukup luas juga ada tempat untuk mengopii musik semoga sukses
Mega Puspitasari,2018-12-30,5,Tempatnya tua tapi baik dipertahankan tapi saya perhatikan di bagian bahwa orang tidak benar-benar memperhatikan sedikit kotor jendela minum tempat tidur di bawah tempat tidur dll
Iskandar “Iskandar” Z,2023-12-30,5,keren sekarang ada tempat nongkrong ngopi klo malam ada elektronik juga
Farez,2021-12-30,5,kamarnya luas pelayanannya memuaaskan recomended banget
Yudi Purnomo,2022-12-30,4,Hotel yang masih bertahan dengan situasi dan kondisi yang serba sulit seperti sekarang ini
eka silvia,2021-12-30,5,Siap obat kuat siap tegak sampai pagi admin 082338899695
Wiwik Wahyuningsih,2024-12-30,5,tempat bersih adem parkir mobil didepan gratis
Paulus Budiyanto,2019-12-30,4,kamarnya bersih dan nyaman tempat parkir luas petugas hotel ramah
Hadi Utomo,2024-12-30,5,lokasi sangat strategis berada di tengah kota surabaya
Asep Abdul Rahman,2018-12-30,4,meskipun gedung bagian luar terlihat tidak terawat tetapi didalamnya cantik terawat dan fasilitasnya lumayan lengkap
satria yudha,2021-12-30,5,fasilitas oke kamar oke ac dingin pemanas air 24jam serta kasur empuk
Darius Alexander Go Reinnamah,2019-12-30,3,Hotel lama tapi barang-barang bagus tapi aku pikir lift terlalu kecil tentang kamar itu xoxo
Akhsan (inside),2022-12-30,2,bayar parkir 5rb parkir terburuk yang pernah saya kunjungi di hotel manapun
abdul halim,2018-12-30,5,hotel yang memiliki pusat dekat dengan mall dekat dengan pusat oleh bertempat di kota tengah dan karyawan yang sangat ramah
K Gati,2019-12-30,4,Hotel lama yang terletak masuk jantung kota surabaya tapi masih cukup bagus dan bersih dengan harga yang menarik
Johanes Budi,2024-12-30,5,Sejak rebranding jadi grand ina suasana makin nyamañ dan keramahan karyawan makin brasa
M Albilaluddin,2018-12-30,5,menyenangkan dan semoga semua hotel inna semakin keren ke depan nya amin
dadang hanafi,2019-12-30,5,sangat baik dan tmp nya strategis mhn tetap ditingkatkan layanan pelayanan nya ide bagus terima kasih
Wonder woman,2024-12-30,5,Lebih fleksibel hotelnya tengah kota lebih bagus
andy herawan,2017-12-30,4,"Bangunan terlihat tua, usang dan sedikit menakutkan dari luar tapi interiornya sebenarnya bagus."
Aryantiko Aje,2023-12-30,5,Hotel nyaman dengan harga terbaik lokasi terbaik juga masuk panas Surabaya
Bilel BBR,2019-12-30,5,Hotel luar biasa semua adalah kamar tidur sempurna meja kerja mandi lokasi sarapan sangat direkomendasikan
Pipip Doank,2019-12-30,4,Parkiran oke sip satu2 hotel ada masjid oke banget tokcer ke inna tunjungan
Ria Meka,2019-12-30,4,nyaman makan nya enak dan pilihan menu sarapan pagi nya banyak
tri jatmiko,2022-12-30,5,Tempatnya enak bersih cocok untuk santai bersama keluarga
Dona Evlin,2022-12-30,5,walau hotel lama tapi bersih kamarnya oke lah
hery Aza,2018-12-30,4,Saya suka hotelnya bersih dan saat berada di jantung kota surabaya
Yudhi Ardiyanto,2018-12-30,4,pelayanan baik tempat nyaman dan letaknya di pusat kota surabaya dekat dengan mall pusat bisnis bank dan perkantoran
DEDY SETYO OETOMO,2018-12-30,4,hotel nya bersih nyaman cuma air mandi nya kecil
Rahmawati Hamdani,2019-12-30,5,nyaman bersih menuunya banyak pilihan deket dengan tapi tidak macet disekitarnya
Ozie (ZAI),2022-12-30,4,Hotel lama tepat di seberang jalan dari Tunjungan Plaza 1 Vibe bagus meskipun fasilitas menunjukkan usianya
Siswatieka Rahayu,2019-12-30,5,kamarnya keren bersih nyaman lengkap luarnya saat menu makanan enak
abdul muis,2024-12-30,4,tempat ditengah kota dekat dengan mall tunjungan plaza tapi
Chandra Yusab,2017-12-30,3,sarapan bervariasi pagi dan enak stafnya ramah pelayanan baik tapi hotel sudah kuno
amilu ira,2022-12-30,5,makanan enak cuma kmren daging lada hitamnya keasinan
Irfan F,2018-12-30,4,Hotel lama di surabaya tapi sekarang sudah di upgrade lobi besar enak buat ngobrol dan bertemu dengan teman lama
Moch Luthfie,2020-12-30,4,Angkringan yang buka malam saptu dan malam minggu sangat cocok buat cangrukan sama temen atau keluarga
Ristomo AR,2023-12-30,5,legend hotel yang penuh kenangan meskipun ganti nama belakang dari grand inna simpang menjadi grand inna tunjungan
Mitha Blora,2019-12-30,4,letaknya strategis pelayanannya memuaskan kamar bersih dan sesuai harapan
Elia Yohan Yosefa,2025-03-30,5,salah satu hotel terbaik masuk surabaya
Naon sih,2024-12-30,5,Bermalam disini karyawannya ramah ramah nyaman
Kansha billa,2022-12-30,4,bagus sih cm sekedar tissue slip sama keset saja gaada
yusrizal yafie,2023-12-30,4,sangat puas dengan layanan lokasi strategis dekat mall tapi dan alun2 surabaya
Hadziq RM Hadi,2019-12-30,4,Hotel ini cukup bagus dekat tapi bisa menggunakannya sebagai tempat alternatif untuk menginap dengan harga lebih murah
Ivandervaliant,2021-12-30,4,Staff sangat ramah dan membantu kamar cukup nyaman dan harga sangat terjangkau
A Abdurahman Somadinata,2022-12-30,5,hotel lama tapi sudah direnovasi lokasi pusat kota
Dewi Iwiks,2021-12-30,5,dekat tunjungan plaza hotel nyaman luas bersih staf ramah
Rock Star_2,2018-12-30,5,kamar bersih luas deket pusat perbelanjaan tapi sarapan enak harga terjangkau
Taufik Hudaya,2023-12-30,4,Hotel lama bersih dan staf sangat membantu hanya berjalan ke alun-alun Tunjungan
fatchur rahman,2025-03-30,5,mantap pegawainya ramah dan amanah
agus sugito,2024-12-30,5,rekomendasi hotel terbaik surabaya
JOCKO '90,2019-12-30,5,hotel yang nyaman dengan fasilitas yang lengkap dan tarif yang terjangkau di pusat kota surabaya
yudi firmansyah,2023-12-30,5,Hotel yang nyaman sangat bersih dan semua staf ramah baik
Andikbagus Fauzi,2018-12-30,5,hotel bagus lokasi tengah kota dengan bangunan penuh sejarah dari kota surabaya
Tsurayya Maknun,2017-12-30,4,Suasananya bali banget tapi tetap ada masjid di sana nyaman dan terjangkau dekat dengan pusat kota
Jon M,2025-11-30,5,ingin balik lagi ke sini
Arif,2024-12-30,5,lokasi strategis dan pelayanan nya nyaman
Ilya Mufidah,2023-12-30,5,Massage di hotel Grand Inna hotel di tengah kota Sby hotelnya bersih indah
sunarto lanang,2019-12-30,5,makanannya enak namun penyajian makanan fan minumanannya lama sekali
Rachmat Sutandar,2021-12-30,4,Lokasinya strategis tepat di jantung kota surabaya memudahkan untuk berkelana kota
Abdul Halim,2023-12-30,5,sangat strategis ke mall sgt dekat saat di kota tengah
Annas abdillah,2022-12-30,5,hotel yang sudah tua beberapa hal perlu pembaruan salah satunya linen
Suhariyadi Adi,2021-12-30,5,tempat bersih nyaman pelayanannya bagus dan dekat dengan tempat perbelanjaan
Wahidah Ita,2024-12-30,5,kami sangat puas dengan pelayanan yang di berikan
Amalia Handayani,2023-12-30,5,lokasi strategis layanan juara kamar luas dan bersih
singgih andi,2022-12-30,4,hotel bagus kamar bersih pelayanan ramah
Alzidan Ambadar,2025-09-30,5,nyaman
Moch Hafifi Hafifi,2025-12-23,5,pelayanan baik
Ucik Eunchie,2020-12-30,4,makanan dan minuman di restoran non buffet enak sering beli di restoran
Rendy D Sugiharto,2020-12-30,3,Tidak buruk tapi masih masuk perbaikan sarapan kurang variasi air panas kurang panas
Syahrul Junaedi,2023-12-30,5,Salah satu hotel lama di Surabaya yang tetap bagus
iwan beckar,2019-12-30,5,Tempat strategis dekat mal pelayanan bagus menuunya juga oke
Kamu Souvernir,2022-12-30,4,pulang ban mobil bocor 2 roda entah kenapa
Handoyo Soehandaja,2022-12-30,5,Saya ada pertemuan 9j smpn 4 surabaya jadi lewati saja
qienzu cilegon,2021-12-30,5,berada di pusat kota surabaya kamar luas pelayanannya raman2
firvifly sa,2018-12-30,4,tempatnya strategis makanan enak kamar mandinya sayang kurang bersih
Nyoman Suliana,2019-12-30,4,lokasi strategis deket tunjungan plaza harga bersahabat sarapan enak
David Akbar,2020-12-30,5,tempatnya strategis banget bagus bersih tengah kota pula
stefani soraya,2019-12-30,5,Ruang luas kamar nyaman dan bersih staf hotel yang baik sarapan lezat
Roro Wulandari,2022-12-30,4,walaupun hotel lama tapi masih terawat dan masih lumayan banyak tamunya
Wisnu Wardana,2024-12-30,5,Pelayanannya bagus tempatnya bersih dan rapi dan pelayanannya ramah ramah
Mariya Nov,2019-12-30,5,Waktu kesini saat ada acara workshop tempat pertemuannya luas bersih nyaman
Hadi Pangestu,2022-12-30,4,rasanya agak aneh soalnya ditarik ongkos parkir padahal antar tamu
FAIZ FARIKI,2024-12-30,5,100 layanan penuh tempat terbaik nyaman bersih
Dave H,2023-12-30,5,staf ramah kamar bersih kamar besar lega cepat cek masuk dekat plaza tunjungan
Achmad Farid Fanani,2023-12-30,5,enak tidak terlalu mahal nyaman tengah kota ramah
Elsa Nurul,2017-12-30,4,kamar ckp baik ac dingin sekali hotel agk kecil disini tapi oke
renggo wigati,2019-12-30,3,tempat bagus bersih nyaman syang petugas kurang ramah mecucu ae kurang senyum
Eva Soentoro,2022-12-30,3,bangunan lama ruang makan sesak rame pelayanan jadi tidak maksimal
Billy vj,2021-12-30,2,Hotel bagus tapi AC sangat buruk tidak dingin sama sekali bahkan setelah mekanik melakukan layanan tidak akan tinggal masuk hotel ini lagi
Leonardo Dimas Cikarang,2025-04-30,5,Oke semua
Ibnu Alam,2021-12-30,4,Hotel yang cukup indah namun dengan fasilitas lengkap dan harga yang wajar 5 10 menit berjalan kaki ke alun-alun Tunjungan
N. Eko Satriawan,2021-12-30,5,pelayanan memuaskan kamar nyaman dianjurkan
Agus Hartoyo,2024-12-30,5,tempat sangat strategis ditengah kota pahlawan
Nikma Rosyidi,2020-12-30,5,Suka ada tempat untk berfoto mengabadikan saat terutama nuansa alami
Sunarto Miharjo,2023-12-30,5,nyaman dekat dengan mall perkantoran pemerintah
rangga adrian,2014-12-30,5,pengalaman yang menyenangkan di hotel pusat kota surabaya kopinya super
Bisyamsi Moediarso,2017-12-30,4,Hotel yang nyediain spot sholat jumat nih soalnya punya mushola sendiri
Rafqi Nandi,2016-12-30,5,Sangat nyaman pelayanan bagus dan istri super cepat
The Jaifoo,2018-12-30,3,Lokasi bagus hotelnya tidak mahal hanya karena agak tua
Pandu Kusumah,2019-12-30,4,Layanan yang bagus bersih kamar dan kamar mandi nya tolong disediakan sajadah di kamar
Renegade Laredo,2021-12-30,4,Hotel lawas ac di lantai 4 kurang dingin tapi pelayanan untuk stafnya no 1
Harun Dzulqar,2019-12-30,5,pengalaman yang sangat mantap dengan berenang di hotel ina dan menginap di kamar
emi kurniati,2021-12-30,5,hotel ditengah pusat kota surabaya yang banyak menyimpan nilai sejarah
Jemielka RoSa Channel,2019-12-30,4,cukup nyaman saat yang cari2 masakan nuansa lokal
