User Name,Review Time,Rating,clean_text,Tipe,Kelas,Nama_Hotel,AI_Sentiment,AI_Aspek
mase bangun,2021,5,Di atas ekspektasi penerapan protokol pencegahan COVID 19 dilakukan dengan sangat baik memberikan kenyamanan dan keamanan selama menginap harga yang ditawarkan dengan fasilitas yang didapatkan sepadan atau boleh dikatakan di atas harapan lokasi strategis dekat dengan tempat makan atau supermarket,KOMPETITOR,Bintang 3,HotelDafamFortunaSeturan-Yogyakarta,positive,Harga & Value for Money
neyla sasmitha,2018,4,Yang kurang dari kamar hanya colokan untuk panas kurang deket colokam terdekat ada di dekat kasur agak kurang keamanan lalu tidak ada tempat untuk naruh sabun di area mandi jadi mondar mandir ke wastafel bikin kamar mandi basah,KOMPETITOR,Bintang 3,HotelDafamFortunaSeturan-Yogyakarta,negative,Lokasi & Akses Strategis
Alam Hoka,2025,5,hotel yang memiliki wahana bermain untuk anak anak lokasinya terjangkau pelayanannya juga bagus,KOMPETITOR,Bintang 3,HotelDafamFortunaSeturan-Yogyakarta,positive,Lokasi & Akses Strategis
Nanokha,2017,3,terlalu gelap kamarnya baru saja cek masuk tapi lembaran tidur bernoda ac kurang dingin meski sudah diset kuat dan menunggu hampir satu jam kelengkapan kamar lumayan lengkap tnpa kulkas kamar mandinya juga terlalu gelap,KOMPETITOR,Bintang 3,HotelDafamFortunaSeturan-Yogyakarta,negative,Kebersihan & Kenyamanan Kamar
Widyastuti Umar,2018,5,menginap selama 7 hari bersama keluarga sangat memberi kesan tersendiri ambil kamar standar kembar dengan sarapan lokasi sangat strategis banyak penjual makanan indomaret dan kafe jalur transjogja transportasi online mudah setiap hari kamar dibersihkan sarapan bervariasi mulai dari makanan berat sereal bubur ayam soto ayam makanan ringan penutup buah dan lain2 pelayanan cepat dan ramah satpam sangat cepat tanggap di lobi selalu tersedia 3 jenis minuman yang gratis dan bisa diminum kapan saja kamar sangat nyaman secara keseluruhan hotel ini sangat dianjurkan dngan harga yang sangat terjangkau widya_makassar,KOMPETITOR,Bintang 3,HotelDafamFortunaSeturan-Yogyakarta,positive,Lokasi & Akses Strategis
Irvien I. Anzas,2021,5,tempatnya cukup tenang kamarnya bersih ada kafe resto dengan area merokok pelayanan ramah jika dibandingkan dengan layanan maka harga jadi relatif murah kekurangannya cuma satu tidak dekat stasiun tapi tetap dianjurkan,KOMPETITOR,Bintang 3,HotelDafamFortunaSeturan-Yogyakarta,positive,Kebersihan & Kenyamanan Kamar
Rifa Fitri Dianty,2021,4,sudah oke dan baik pelayanan hotelnya cb nya nya jg banyak variasi kamar oke cpt kalau mau minta apa2 cuma kamar bank ketemu nya aga lama mungkin butuh uang karena permintaan nya berbeda dari pertemuan biasanya,KOMPETITOR,Bintang 3,HotelDafamFortunaSeturan-Yogyakarta,positive,Harga & Value for Money
Nanang Tri sulistyo,2024,5,di atas semua 4 5 dari 5 taman bermain tambah biaya 50 K dapat wahana bermain kereta formula 1 naik kuda kamar anak,KOMPETITOR,Bintang 3,HotelDafamFortunaSeturan-Yogyakarta,neutral,Harga & Value for Money
annisaalwiii,2020,5,Saya baru pertama kali menginap di hotel dafam tapi saya senang karena kamar nya nyaman bersih area umum nya juga bersih masakannya juga enak hotelnya sangat tidak terintegrasi sekali karena banyak spot foto menarik stafnya sangat ramah sekali dan daerahnya juga sangat strategis pokoknya layaknya lah mungkin jika saya ke jogja lagi saya pasti akan menginap di hotel dafam karena saya sudah merasa nyaman dengan hotel dafam,KOMPETITOR,Bintang 3,HotelDafamFortunaSeturan-Yogyakarta,positive,Kebersihan & Kenyamanan Kamar
eko mulyanto,2024,5,Hotel yang bersih asri nyaman ada kolam renang taman bermain dan mini zoo nya jadi sangat ramah anak bisa main sepuaasnya buat nongki2 juga juos,KOMPETITOR,Bintang 3,HotelDafamFortunaSeturan-Yogyakarta,positive,Fasilitas Hotel (Kolam/Gym/Spa)
Eko Video,2020,5,Lokasinya strategis sesuai dengan peta selain kamar tidur juga tersedia ruangan rapat pertemuan internetnya lumayan stabil cocok buat yang lagi bekerjain tugas menu masakan cukup enak sesuai lah buat lidah jawa pelayanan ramah tersedia menu semua yang bisa kamu makan toilet sangat bersih juga ada mushola di lantai 1,KOMPETITOR,Bintang 3,HotelDafamFortunaSeturan-Yogyakarta,positive,Lokasi & Akses Strategis
aries tresnanto,2024,5,Hotel yang komplit dan bersih layanan yang sangat ramah rekomen buat yang bawa anak anak ada mini zoo kolam renang yang bersih ada bermain lapangan kaya di mall rekomen banget,KOMPETITOR,Bintang 3,HotelDafamFortunaSeturan-Yogyakarta,positive,Kebersihan & Kenyamanan Kamar
Titus Adi Kristianto,2019,4,tadi malam memang saya tidak menginap di sini hanya pinjam parkir di sini karena teman teman dari gki mau pergi tur natal ke banjar jawa barat saya mengapresiasi satpamnya yang ramah dalam melayani kami hanya saja jalan di sini terlalu sempit jadi tadi malam macet semacet macetnya sampai bus warisan karyajasa hanya bisa merayap tapi keunggulannya parkir di sini luas sekali dan bisa dipakai untuk bermain sepak bola hehehehhe,KOMPETITOR,Bintang 3,HotelDafamFortunaSeturan-Yogyakarta,positive,Pelayanan Staf & Keramahan
Arum Puspita Sari (Arum),2020,4,Hotel dafam fortuna seturan kebetulan barang tim ngadain seminar disana 1 hari menginap stafnya ramah hotelnya cukup bersih lalu kamarnya juga tidak badlah untuk menu sarapannya juga pilihan makannya banyak,KOMPETITOR,Bintang 3,HotelDafamFortunaSeturan-Yogyakarta,positive,Kebersihan & Kenyamanan Kamar
istajib rojali,2022,4,Kamar bersih bagus cuma ada beberapa fasilitas di kamar mandi yang sepertinya tidak jalan knalpot kipas tidak nyala jadi kamar mandi agak bau udara di luar wastafel yang tidak bisa galir hilang tempat parkir rapi tapi bau kurang enak,KOMPETITOR,Bintang 3,HotelDafamFortunaSeturan-Yogyakarta,negative,Kebersihan & Kenyamanan Kamar
Mega cahyawati,2021,5,Hotel dafam memang paling cocok untuk menginap di masa pandemi saat ini setelah 2 bulan lebih cukup bosan di rumah akhirnya mencoba sedikit melarikan diri kesini fasilitas saat ini sudah banyak berubah dari masuk hotel sudah ada petugas yang mengecek suhu tubuh ada beberapa tanda jaga jarak aman hand sanitizer di mana mana mana para staf juga sudah menggunakan alat pelindung seperti masker sarung tangan dan tameng wajah semangat terus hotel dafam untuk tidak menyerah di masa ini,KOMPETITOR,Bintang 3,HotelDafamFortunaSeturan-Yogyakarta,positive,Kebersihan & Kenyamanan Kamar
Rony Hidayat Rasyidin,2024,4,Hotel yang anak-anak ramah cocok untuk menginap bersama anak istri bikin betah karena semuanya ada di sini sebagai bagian dari fasilitas hotel mini zoo kolam renang anak-anak taman bermain,KOMPETITOR,Bintang 3,HotelDafamFortunaSeturan-Yogyakarta,positive,Fasilitas Hotel (Kolam/Gym/Spa)
Ilfi Rokhmani,2018,5,Ke jogja dan 2 malam tidur disini puas layanan bagus wi finya juga lancar semua rapi bersih harga terjangkau lokasi nya juga strategis kalau malam malam pengin nyemil depan hotel ada orang jualan burger dekat warunk upnormal juga,KOMPETITOR,Bintang 3,HotelDafamFortunaSeturan-Yogyakarta,positive,Lokasi & Akses Strategis
Anditya Candra,2023,3,ruang rapat berbaring keluar surat u sehingga peserta sulit untuk duduk jika tempat yang di ujung sudah ditempati makanan lauk utama hanya ada 1 jenis sayur berupa kacang panjang yang tidak dipotong jadi kepanjangan dan susah diambil tanpa menu sampel berupa buah penutup,KOMPETITOR,Bintang 3,HotelDafamFortunaSeturan-Yogyakarta,negative,Infrastruktur (AC/WiFi/Parkir/Air)
Dafa Saputra,2024,5,Tidak perlu buat menginap di dafam seturan pelayanan yang sangat ramah di sertai fasilitas taman bermain dan minizoo yang bikin anak betah tidak mau di ajak pulang kamar dan area hotel yang sangat nyaman dan bersih,KOMPETITOR,Bintang 3,HotelDafamFortunaSeturan-Yogyakarta,positive,Pelayanan Staf & Keramahan
Radhyya,2020,5,hotel yang bagus dan menyajikan beberapa pemandangan indah untuk kamarnya sendiri terbilang bagus dan lengkap tersedia fasilitas udara panas dll untuk makanannya sendiri lumayan enak dan harga permanen lumayan terjangkau,KOMPETITOR,Bintang 3,HotelDafamFortunaSeturan-Yogyakarta,positive,Harga & Value for Money
Nurul Arvianti,2024,2,baru cek masuk masuk kamar lihat bantal kempes kotor banyak bercak dan sarung bantal sudah kusam seperti tidak layak dipakai oleh hotel standar bintang 3 springbed juga sudah kusam sprei kotor ada bercaknya ketika di keluhan baru diganti bantal sarung bantal dan springbednya maupun spreinya tapi kwalitas masih dibawah standar hotel kecewa saya pilih hotel ini,KOMPETITOR,Bintang 3,HotelDafamFortunaSeturan-Yogyakarta,negative,Harga & Value for Money
sisilia estu,2023,5,Secara keseluruhan nyaman dan dianjurkan sih buat yang bawa anak2 cuma ada bbrpa poin yang bikin agak kecewa 1 kolam buat anak trlalu sempit 2 taman bermain panas dan tidak berac 3 servis saat sarapan ada 2 karyawan bagian depan sbelum msuk yang wajah dan tidak terlihat jutek waktu saya tanya tapi trimakasih ya dafam sudah membuat liburan rasanya menyenangkan,KOMPETITOR,Bintang 3,HotelDafamFortunaSeturan-Yogyakarta,positive,Fasilitas Hotel (Kolam/Gym/Spa)
Daniel S. Rahardjo,2023,5,ruangan nyaman terdapat mini zoo juga taman bermain yang cukup luas kolam renang anak kecil dan orang dewasa juga ada sarapan biasa saja,KOMPETITOR,Bintang 3,HotelDafamFortunaSeturan-Yogyakarta,positive,Fasilitas Hotel (Kolam/Gym/Spa)
Hanya Ka-ta,2020,5,nih hotel oke banget pertama masuk disambut staf yang ramah dan langsung minum minum selamat minum enak ada 3 varian disana kemudian masuk kaget ada kafe yang keren nyaman dan menikmati buat nongkrong sama temen nih kamarnya oke bersih dan tidak bising semua oke apalagi sarapan paginya mantap ditambah ada makanan desanya serasa jogja banget terimakasih dafam jos,KOMPETITOR,Bintang 3,HotelDafamFortunaSeturan-Yogyakarta,positive,Kebersihan & Kenyamanan Kamar
Novia Rochmawati,2019,5,pelayanan responsif sekali bisa juga chat dengan mudah melaui fb ataupun whatsapp jika belum jam cek masuk kita bisa lebih dulu menitipkan barang barang kita sembari bereksplor tidak kena kasus begitu pula saat kita sudah melewati jam cek keluar kita masih boleh nitip barang kita di sini makanannya enak jam sarapan mulai jam6 10 pagi view di sini lumayan nyegerin mata konsep kolam renangnya juga lucu,KOMPETITOR,Bintang 3,HotelDafamFortunaSeturan-Yogyakarta,positive,Kualitas Makanan & Restoran
R. Hendro,2025,5,bagus untuk penginapan dan pelatihan,KOMPETITOR,Bintang 3,HotelDafamFortunaSeturan-Yogyakarta,positive,Fasilitas Hotel (Kolam/Gym/Spa)
INDRA PRADANA YUWONO,2021,5,sudah sering menginap di hotel dafam fortuna seturan stafnya ramah jika minta sesuatu langsung di follow up makanannya setiap hari bervariasi enak enak kamar cukup luas kebersihan oke proses cek masuk juga cepat tidak mengecewakan pokoknya jika menginap di sini saat liburan bersama teman dan keluarga oke pokoknya,KOMPETITOR,Bintang 3,HotelDafamFortunaSeturan-Yogyakarta,positive,Kebersihan & Kenyamanan Kamar
Salma Putri,2025,5,Hotel dan kamar nya bersih staf ramah ramah semua ada taman bermain minizo cocok untuk anak bermain,KOMPETITOR,Bintang 3,HotelDafamFortunaSeturan-Yogyakarta,positive,Kebersihan & Kenyamanan Kamar
Arfian Hidayat,2021,5,pengalaman yang sangat menyenangkan karena bisa gratis upgrade kamar dengan fasilitas yang bagus kamar sangat luas dengan teras di depan kamar yang bisa dijadikan area bersantai sambil melihat pemandangan luar,KOMPETITOR,Bintang 3,HotelDafamFortunaSeturan-Yogyakarta,positive,Lokasi & Akses Strategis
Tegar Narajati,2024,3,sarapan disini punya pengalaman buruk banget nasi kering puding banyak semutnya buah tidak minuman segar sudah tidak dingin dan yaa selera makan langsung hilang seketika,KOMPETITOR,Bintang 3,HotelDafamFortunaSeturan-Yogyakarta,negative,Kualitas Makanan & Restoran
Mekar Sari Dyah Ayu PW,2021,5,Pelayanan ramah kamar nyaman bersih lokasinya deket sama kafe kafe gitu jadi kalau mau nongkrong2 enak tinggal jalan kaki saja bisa perjalanan berikutnya akan kembali lagi ke sini,KOMPETITOR,Bintang 3,HotelDafamFortunaSeturan-Yogyakarta,positive,Kebersihan & Kenyamanan Kamar
arya Praditya,2021,5,hotel yang direkomendasikan untuk menginap untuk keluarga banyak fasilitas yang di berikan termasuk taman bermain untuk anak anak kolam renang yang cocok untuk mengisi waktu luang serta ada ukafe yang bernuasa vintage saya suka itu ditambah seluruh staf yang ramah pokoknya joss hotel dafam fortuna seturan,KOMPETITOR,Bintang 3,HotelDafamFortunaSeturan-Yogyakarta,positive,Pelayanan Staf & Keramahan
Paulus Nugroho Putro Kasih,2023,4,lokasi strategis harga tidak terlalu mahal pelayanan sangat bagus ramah dan jelas saat menerangkan pada tamu sarapan pagi banyak variasiinya dan rasanya sni sudah pesan kamar 2 dewasa 2 anak sarapan masih di mintai tambaha biaya untuk anak 6 th keatas kolam renang bersih ada mini zoo dan juga playground buat anak bermain gratis bagi tamu yang menginap kekurangnya kamar kecil sama kasurnya keras seperti tidur di atas triplek tidak nyaman bantal juga tipis tidak empuk,KOMPETITOR,Bintang 3,HotelDafamFortunaSeturan-Yogyakarta,negative,Pelayanan Staf & Keramahan
Rachmad Suhanda,2019,5,hotel yang bagus stafnya ramah dan sangat kooperatif ketika kebingungan mencari masjid untuk shalat jumat malah diantar staf hotel ke masjid terdekat pelayanan sepenuh hati dengan harga kamar yang terjangkau meskipun membutuhkan perjuangan ke nol kilometer kota yogyakarta tapi terbayar tuntas dengan pelayanan kualitas super disini,KOMPETITOR,Bintang 3,HotelDafamFortunaSeturan-Yogyakarta,positive,Pelayanan Staf & Keramahan
Arekz Ngeleh,2019,5,bagus banget bersih cek masuk cepat ramah tapi sygnya saya dapet kamar yang jauh dari lift jadi mnuju kamar jalannya lumayan melewati kolam renang pdhal sama orang tua alangkah baeknya dpet kamar yang jalannya tidak jauh dari lift semuanya bagus,KOMPETITOR,Bintang 3,HotelDafamFortunaSeturan-Yogyakarta,positive,Kebersihan & Kenyamanan Kamar
Intan Octaviani,2020,5,nyamaann hanya saja kamar memang tak terlalu luas kamar mandi seperti di campervan tapi sarapannya sangat bervariasi dan enak enak ada jusnya pula,KOMPETITOR,Bintang 3,HotelDafamFortunaSeturan-Yogyakarta,positive,Kebersihan & Kenyamanan Kamar
Ikhlas Purwanto,2024,5,Tempatnya bagus ramah anak sekali kebetulan mengambil kamar yang ada bak mandi baru dan sangat menyenangkan,KOMPETITOR,Bintang 3,HotelDafamFortunaSeturan-Yogyakarta,positive,Kebersihan & Kenyamanan Kamar
Yuyus Kurniado,2020,5,nyaman bersih keamanan ramah komunikatif menu makanan variatif dan enak 1 lagi kolam renang airnya bersih dan ada kolam khusus untuk anak2nya mantabs dafam,KOMPETITOR,Bintang 3,HotelDafamFortunaSeturan-Yogyakarta,positive,Fasilitas Hotel (Kolam/Gym/Spa)
Ahmad Gusna,2020,5,hotel ini sangat memuaskan dari segi layanan makanan maupun kamar dan fasilitas lain letaknya yang sangat strategis dekat dengan bandara sangat membantu dan pelayanan serta para staf memberikan layanan terbaik,KOMPETITOR,Bintang 3,HotelDafamFortunaSeturan-Yogyakarta,positive,Lokasi & Akses Strategis
Sri Lutfiwati,2021,4,parkirannya kurang memadai terlalu dekat dengan badan jalan lobinya kecil restonya tidak begitu luas kalau saat rame terasa sempitnya masakannya enak karyawannya ramah promosi banyak dan menarik,KOMPETITOR,Bintang 3,HotelDafamFortunaSeturan-Yogyakarta,positive,Pelayanan Staf & Keramahan
Trides Aritonang,2019,5,Tempatnya bagus dan untuk sarapannya enak banget banyak macamnya mulai dari nasi gudek bubur ayam macam2 jus buah bahkan ada jamu juga disediakan juga ada variasi macam sambal dan kerupuk wah enak bangett jadi ingin kembali ke sana,KOMPETITOR,Bintang 3,HotelDafamFortunaSeturan-Yogyakarta,positive,Kualitas Makanan & Restoran
Saskia Zakaria,2023,5,hotel dafam emg pilihan tepat untuk beristirahat bersama keluarga 2 hari tinggal di dafam pilih kamar deuxe kamarnya oke banget luas ada balkon bersih dan bantalnya banyak kamar mandi juga bersih peralatan mandi dpt sesuai standar hotel dapat dikirim juga pelayanan oke dari cek masuk proses baru cpt banget harga bersahabat fasilitas baru juga tidak kaleng ada kolam renang mini zoo dan taman bermain untuk anak2 jdi tidak bosen juga anak di hotel yang biasanya cuman dikamar saja tempat makan banyak di daerah sekitar hotel besok akan kembali ke hotel dafam pastinya,KOMPETITOR,Bintang 3,HotelDafamFortunaSeturan-Yogyakarta,positive,Kebersihan & Kenyamanan Kamar
"Andi Ferdiansyah Hendi Permana Sakti S.E., CCMA",2023,5,kemarin kami kesini karena ada pertemuan tahunan dari kantor dari sekian banyak tempat rekomendasi trnyata harga paket nya yang paling layak dari mulai sarana layanan istirahat kopi lunc menu2 nya masya allah enak2 komplit njerit tambah disediakan 1 petugas khusus untuk melayani segala keperluan kami musholla nya pun bersih view nya ke langit ruang pertemuan pun masya allah kerenn petugas keamanan nya juga tempat yang sangat disarankan untuk bussiness,KOMPETITOR,Bintang 3,HotelDafamFortunaSeturan-Yogyakarta,positive,Kebersihan & Kenyamanan Kamar
Nafta Cute,2020,4,tempat oke cm wktu itu saya agak kecewa karena saya cek masuk jam 3 sore tapi kamar lom siap sama sekali msh harus menunggu lg padahal saya bw anak2 dan dpt kamar pojokan yang tidak ada view nya lalu saya minta gnti kamar eh mlh srh upgrade tapi untuk pelayanan dll itu oke jadi pada intinya itu oke mungkin lain kali kesana lg,KOMPETITOR,Bintang 3,HotelDafamFortunaSeturan-Yogyakarta,negative,Pelayanan Staf & Keramahan
I***ng Bu******jo,2023,5,menginap di sini tidak mengecewakan sama sekali cocok untuk keluarga karena anak2 pasti seneng dan krasan dalam hotel ada fasilitas minizoo taman bermain yang lumayan luas jadi tidak salah memilih menginap disni dan tentu lokasi baru dekat dari mana mana mana cuci tangan pun ada 2 di depan hotel tempat makan ada apotik ada komplit sih menurutku mohon di pertahankan untuk kebersihan dan pelayanannya terima kasih dafam fortuna seturan,KOMPETITOR,Bintang 3,HotelDafamFortunaSeturan-Yogyakarta,positive,Kebersihan & Kenyamanan Kamar
WOLFRAM.M,2021,5,hotel yang menerapkan prosedur kesehatan yang sangat baik kamar nyaman dapat melihat gunung merapi kopinya juga enak bisa untuk pergi kerja parkir cukup luas memiliki tempat foto yang bagus,KOMPETITOR,Bintang 3,HotelDafamFortunaSeturan-Yogyakarta,positive,Kebersihan & Kenyamanan Kamar
Nita Dara wati,2025,5,Wah hotelnya sangat nyaman apalagi ada minizoo yang membuat seru di sana juga ada kuda gocar kereta dino,KOMPETITOR,Bintang 3,HotelDafamFortunaSeturan-Yogyakarta,positive,Fasilitas Hotel (Kolam/Gym/Spa)
Christian Vengeance,2020,5,kamar nyaman bersih makanan enak bervariasi staf ramah ramah hotel ada cafe nya saya sangat suka dengan kopi nya yang setiap pagi harganya hanya 15 ribu saja,KOMPETITOR,Bintang 3,HotelDafamFortunaSeturan-Yogyakarta,positive,Kebersihan & Kenyamanan Kamar
windy widia,2021,5,Sudah kesekian kali menginap di sini dan sangat senang sekali karena pelayanan nya sangat memuaskan dan karyawan hotel yang sangat ramah untuk sarapan oke semua banyak pilihannya pokok nya tidak perlu menginap di sini berikutnya akan menginap lagi di hotel dafam fortuna seturan,KOMPETITOR,Bintang 3,HotelDafamFortunaSeturan-Yogyakarta,positive,Pelayanan Staf & Keramahan
Wahyu Purwadi,2022,5,Tempat nyaman untuk istirahat di jogja jika anda berlibur di sini pelayanan ramah jika anda akan melakukan pertemuan berupa rapat dan sejenisnya juga bisa tinggal pilih ruangan saja mau pertemuan kecil atau besar oke jangan ragu masakan di sini juga enak,KOMPETITOR,Bintang 3,HotelDafamFortunaSeturan-Yogyakarta,positive,Pelayanan Staf & Keramahan
meliani natalia,2024,5,untuk kolam renang anak kurang besar mainan anak sebaiknya diperbaiki selebihnya bagus anak bahagia nyaman pelayanan ramah bersih,KOMPETITOR,Bintang 3,HotelDafamFortunaSeturan-Yogyakarta,positive,Pelayanan Staf & Keramahan
Bayu Saputro,2020,5,Pelayanannya sgt memuaskan terutama resepsionis mb lisna sangat ramah saya n kluarga nymn tinggal d dafam fortuna seturan makanan d kafe menurut saya lumyan enk sesuai dngn hrga terima kasih dafam,KOMPETITOR,Bintang 3,HotelDafamFortunaSeturan-Yogyakarta,positive,Pelayanan Staf & Keramahan
Bon,2019,4,hotel budget yang cukup baik di yogyakarta lokasi memang agak ke utara tidak di pusat kota terletak di seturan yang juga pusat perkuliahan dan banyak tempat makan tersedia di sekitar parkir cukup sempit tapi anda akan dibantu oleh petugas yang selalu siap valet juga tersedia,KOMPETITOR,Bintang 3,HotelDafamFortunaSeturan-Yogyakarta,positive,Lokasi & Akses Strategis
Randika Sty,2025,5,hotelnya bagus banyak fasilitas untuk anak anak kamar juga sangat bersih pelayanan dari karyawan sangat ramah,KOMPETITOR,Bintang 3,HotelDafamFortunaSeturan-Yogyakarta,positive,Kebersihan & Kenyamanan Kamar
Andika Sulthon,2025,5,kamar bagus cocok buat liburan bersama keluarga ada prosotannya juga ada minizoo nya juga dan stafnya ramah2 dekat dengan kuliner pokonya mantapp,KOMPETITOR,Bintang 3,HotelDafamFortunaSeturan-Yogyakarta,positive,Pelayanan Staf & Keramahan
Iqbal Nazula Aulia Fajri,2025,5,hotel yang bagus pelayanan ramah makanan enak terutama sangat ramah anak,KOMPETITOR,Bintang 3,HotelDafamFortunaSeturan-Yogyakarta,positive,Kualitas Makanan & Restoran
Muhamad Sidiq,2024,5,staycation disini nyaman menu waktu sarapan banyak pilihan dan rasanya enak banget pelayanan karyawannya baik ramah ramah dan gercep,KOMPETITOR,Bintang 3,HotelDafamFortunaSeturan-Yogyakarta,positive,Pelayanan Staf & Keramahan
Didik Prasetyo Nugroho,2019,4,pelayanan bagus tempat nyaman kolam renang bagus dan dengan pengawasan yang bagus pula terdapat kafe 24 jam dan banyak tempat kuliner di sekitar hotel jadi tidak sudah kwatir kelaperan pertahankan pelayanannya tapi sayang waktu pesan makan sniper file rasa sangat sangat bisa diperbaiki untuk menu tersebut,KOMPETITOR,Bintang 3,HotelDafamFortunaSeturan-Yogyakarta,positive,Fasilitas Hotel (Kolam/Gym/Spa)
Shinta Yuliasari,2019,4,disini saat ada bertemu n salam artis tempatnya luas ya walaupun sempet nyasar saat mau masuk ke aula buat bertemu n salam namanya juga kali pertama waktu itu menunggu di resto apa ya sebelahnya ada kaca trus melihatnya langsung kolam renang karyawan ramah standar hotel lah tempat parkir motor itu di ruang bawah tanah,KOMPETITOR,Bintang 3,HotelDafamFortunaSeturan-Yogyakarta,positive,Pelayanan Staf & Keramahan
Dadang Surahman,2023,5,hotel bintang 3 dengan harga anggaran mau piknik ke jogja dan menginap di hotel dafam fortuna seturan hubungi langgeng lancar barokah llb 081328282244 melayani pengiriman barang dalam kota luar kargo pindahan tiket multibayar tur perjalanan jastip oleh2 jogja sewa mobil,KOMPETITOR,Bintang 3,HotelDafamFortunaSeturan-Yogyakarta,positive,Harga & Value for Money
Andika Kurnia,2024,5,kamar memang kurang luas dengan harga yang cukup tinggi untuk makanan oke jika ada beragam dan bisa ada pilihan untuk si kecil,KOMPETITOR,Bintang 3,HotelDafamFortunaSeturan-Yogyakarta,positive,Harga & Value for Money
Zain Ramdhani,2023,5,puas banget menginap di sini pelayanan ramah hotel bersih fasilitas cukup lengkap ada kolam renang bersih dan taman bermain anak2 dekat resto,KOMPETITOR,Bintang 3,HotelDafamFortunaSeturan-Yogyakarta,positive,Kebersihan & Kenyamanan Kamar
Aditya Mirza,2025,5,kamar standar saja sudah bagus,KOMPETITOR,Bintang 3,HotelDafamFortunaSeturan-Yogyakarta,positive,Kebersihan & Kenyamanan Kamar
Dina Depi,2020,5,suka banget nginep dihotel dafam seturan kamarnya bersih nyaman sarapan dan makanan enak dan berfariasi kolam renangnya ramah anak karyawanya ramah dan cekatan kalauu ada kesempatan mau menginap di sini lagi,KOMPETITOR,Bintang 3,HotelDafamFortunaSeturan-Yogyakarta,positive,Kebersihan & Kenyamanan Kamar
samm midi,2021,5,Hotel bagus dengan banyak pilihan spot foto keren dan vintage sarapan enak dan banyak pilihannya apalagi ada pojok ndeso dan ada kafe baru wih mantep ada kopi yang enak dan pengalaman segar saya dengan harga murah dan fasilitas oke layak banget terima kasih dafam,KOMPETITOR,Bintang 3,HotelDafamFortunaSeturan-Yogyakarta,positive,Kualitas Makanan & Restoran
Riski Mugilestari,2020,5,Ke sini sebbenernya cuma buat bukuber saja sih tapi makanannya enak layaknya untuk harga 65 0 sebelum buka sempet keliling keliling dulu dan keliatannya cukup nyaman jika buat nginep ada kolam renang juga toiletnya juga bersih jadi nyaman dipakai,KOMPETITOR,Bintang 3,HotelDafamFortunaSeturan-Yogyakarta,positive,Kebersihan & Kenyamanan Kamar
Eva Laksmi,2022,4,Suka karena koridornya terbuka jadi g kuatir tinggal di masa pandemi mbak resepsi ramah tapi sayang pintu lobi sensornya tidak terlalu bekerja sptnya nyaris kejepit huhuhu keamanan baik hati selalu bantuin ngarahin parkir juga terima kasih sudut2 instagramablenya oke,KOMPETITOR,Bintang 3,HotelDafamFortunaSeturan-Yogyakarta,positive,Pelayanan Staf & Keramahan
annadhita sricahya safitri,2023,5,buat yang bawa keluarga dan anak2 hotel ini cocok banget karena fasilitas dan harga yang baru tergolong serba ada tapi murah meriah,KOMPETITOR,Bintang 3,HotelDafamFortunaSeturan-Yogyakarta,positive,Harga & Value for Money
Utami Ratri (For U),2023,4,Ke sini karena ada undangan nikah untuk lokasinya kurang suka sih karena d pinggir jalan daerah seturan yang sempit parkirannya juga kurang luas jika datang dari arah selatan itu yang paling susahnya adalah saat ini nyebrang dan kondisi keadaan rame macet susah benar untuk kamarnya kurang tau untuk pelayanan nya baik untuk makanannya agak kurang suka karena rasa nya hambar gitu,KOMPETITOR,Bintang 3,HotelDafamFortunaSeturan-Yogyakarta,negative,Lokasi & Akses Strategis
EFAN FDW,2022,5,Terimakasih kamar bersih dan pelayanan ramah parkir juga akan membantu semua resepsi keamanan dan semua ramah kecuali yang di restonya tolong lebih ramah jadi lebih nyaman jika mau pesan makanan jika tamu belum memeriksa keluar tolong kamar jangan dibersihkan dulu agar tamu lebih nyaman selebihnya semua pelayanan sangat baik dan ramah,KOMPETITOR,Bintang 3,HotelDafamFortunaSeturan-Yogyakarta,positive,Kebersihan & Kenyamanan Kamar
