User Name,Review Time,Rating,clean_text,Tipe,Kelas,Nama_Hotel,AI_Sentiment,AI_Aspek
Desi Ariyani wahyuningsih,2025,5,Hotel super anak-anak ramah anak2 pasti senang dan betah menginap di sini sudah ke 4x menginap di sini selalu balik lagi semua staf juga ramah dan baik sarapannya enak2 dan banyak makanan kesukaan anak2 ada taman bermain mini zoo dan permainan2 lainnya mba Amanda jugaa ramah sekali enak diajak ngobrol semoga rejeki besar seturan semakin maju dan sukses terus,KOMPETITOR,Bintang 3,HotelDafamFortunaSeturan-Yogyakarta,positive,Pelayanan Staf & Keramahan
jenny puspita,2025,5,ini hotel sangat direkomendasikan buat liburan keluarga baru kali ini menginap di kamar hotel yang ada prosotannya anakku bahagia banget kita tinggal di kamar super petualangan kamarnya luas super nyaman ada bunkbed prosotan mandi bola dinding memanjat pojok bermain sampai mini ruang tamu buat main game console gratis sambutan cemilan juga di kamar anak ameniti lengkap banget setiap detail benar2 diperhatikan ada handuk anak slipper anak pasta gigi sikat gigi anak anak tangga di kamar mandi dll tidak cuma kamarnya yang kita bisa vvip akses untuk seru main sepuasnya gokart dino naik kereta thomas berkuda semuanya gratis ada mini fe zoo,KOMPETITOR,Bintang 3,HotelDafamFortunaSeturan-Yogyakarta,positive,Kebersihan & Kenyamanan Kamar
Fara Raissa,2025,5,kali kedua menginap di sini tidak pernah bosan karena banyak fasilitas untuk ank2 yang jarang ada di hotel2 lain untuk makanan banyak disukai ank2 sehingga org tua tidak perlu bingung mencari makanan favorit ank2 untuk pelayanan mbak Amanda sangat ramah dan membantu tamu terima kasih,KOMPETITOR,Bintang 3,HotelDafamFortunaSeturan-Yogyakarta,positive,Pelayanan Staf & Keramahan
Fikri Hakim,2025,3,Hotel overprice tidak direkomendasikan apalagi di musim tinggi harga 1 jt cuma bisa kamar 16m2 kamar mandi kecil dan semua fasilitas2 tambahan di taman bermain selain kolam belum termasuk harga kamar alias bayar lagi sarapan untuk harga segitu juga kurang lengkap seperti yang sederhana mentega dan pemanggang roti tidak bisa,KOMPETITOR,Bintang 3,HotelDafamFortunaSeturan-Yogyakarta,negative,Fasilitas Hotel (Kolam/Gym/Spa)
SHANDHRA OKA,2025,3,pengalaman untuk anakku sangatlah memuaskan bayangkan saja anak umur 4 tahun dipuaskan dengan taman bermain di kamar fasilitas taman bermain hotel kolam renang dan kebun binatang sangat senang pasti pengalaman untuk orang tua kamar mandi terlalu kecil dan kurang bersih ac kamar kurang dingin untuk sambutan cemilan dan cemilan gratis n minum yang dibawakan ke kamar rasanya sangat b saja tapi buah potongnya sangat segar dan manis ah penyelamat rasa dari berbagai macam menu sarapan sangat kurang hambar dan dingin untuk beberapa sangat sayang banget mungkin karena saya mengambil tarif kamar yang permanen sekitar 1 5 jadi aga kuranh layak untuk saya buat tapi ada kamar yang 400 500k juga,KOMPETITOR,Bintang 3,HotelDafamFortunaSeturan-Yogyakarta,positive,Fasilitas Hotel (Kolam/Gym/Spa)
Fredo Yolendra,2025,4,Hotel anak-anak ramah banyak banget tempat untuk bermain anak lokasi juga banyak makanan disekitar pelayanan sangat ramah kamarnya seperti harapan di kelasnya tidak terlalu besar dan juga tidak kecil tidak ada meja kerjanya,KOMPETITOR,Bintang 3,HotelDafamFortunaSeturan-Yogyakarta,positive,Kebersihan & Kenyamanan Kamar
Dian Sulistyo Widodo,2025,5,berkesempatan untuk menginap di hotel ini bersama keluarga kesan pertama hotelnya bersih lobi nya wangi selamat datang minuman disetujui pelayanan bagus kamar relatif bersih baik kamar maupun untuk toilet menu di resto disetujui banyak pilihan menu untuk orang dewasa dan anak untuk wahana anak taman bermain mini zoo kolam renang menyenangkan sekali untuk anak,KOMPETITOR,Bintang 3,HotelDafamFortunaSeturan-Yogyakarta,positive,Kebersihan & Kenyamanan Kamar
dhani ulan,2025,5,Saya ibu dengan anak 3 menginap di sini bersama ayah juga di kamar kamar kamar super petualangan kamar merupakan pengalaman yang tak terlupakan dan pertama kali menginap ddidalam kamar yang penuh dengan permainan dari bunk bed khusus anak prosotan kolam bola bahkan sampai dinding memanjat oia ada mobil mobil juga di kamar belum lagi saat malam karena di dalam ada konsol game kita main dan makan malam masuk ke kamar pelayanannya super ramah makanannya enak enak sarapan anak2 bisa mendapatkan permen kapas yaitu es krim paling menakjubkan karena kamar yang kami pemesanan adalah tematik super petualangan sehingga kita bisa mendapatkan akses gratis ke minizoo gokart kereta,KOMPETITOR,Bintang 3,HotelDafamFortunaSeturan-Yogyakarta,positive,Pelayanan Staf & Keramahan
Lana RG,2025,5,Hotel yang sangat ramah anak banget semuanya menyenangkan dan pelayanannya bagus banget sarapannya juga ada anak sudut pokoknya anak2 bahagia disini terima kasih mba Amanda,KOMPETITOR,Bintang 3,HotelDafamFortunaSeturan-Yogyakarta,positive,Kualitas Makanan & Restoran
Taro Fuad,2025,5,kamar terbaik untuk bawa keluarga dan anak2 sebelum nya saya ke hotel lain karena saya membawa orang tua saya 2 orang dewasa total 4 orang dewasa sama anak saya 2 1 anak tk 1 anak bayi harus sewa 2 kamar bukan karena urusan keuangan tapi saya tidak ingin kamar terpisah dengan ortu saya saya ingin 1 kamar biar suasana keluarga menyenangkan bahagia dan tidak repot akhirnya saya ke sini lewat referensi tiktok di kasih beberapa kamar pilihan akhirnya saya memilih kamar yang ada tempat bermain nya yang luas dan bisa menambah kasur buat ortu saya kesampean akhirnya saya mendapat bikin anak baik dan hotel bisa bersama keluarga besar hotel terima fotounagrande,KOMPETITOR,Bintang 3,HotelDafamFortunaSeturan-Yogyakarta,positive,Harga & Value for Money
Marizka Puspita Sari,2025,5,kamarnya nyaman dan hotelnya sangat anak-anak ramah anak senang banget penuh main di hotel banyak wahananya taman bermainnya bersih dan nyaman stafnya juga ramah semua sangat menyenangkan anak juga senang bermain dan sempat ditemani bermain dengan staf mba Amanda,KOMPETITOR,Bintang 3,HotelDafamFortunaSeturan-Yogyakarta,positive,Kebersihan & Kenyamanan Kamar
Vianty Roose,2025,5,menyenangkan sekali menginap di sini karena kamarnya yang super menyenangkan selain itu fasilitas bermainnya sangat lengkap mulai dari naik kuda naik dino naik kereta mobil memberi makan hewan taman bermain kolam renang ada siang makanan ringan yang dianter ke kamar stafnya ramah semua makanan juga oke,KOMPETITOR,Bintang 3,HotelDafamFortunaSeturan-Yogyakarta,positive,Fasilitas Hotel (Kolam/Gym/Spa)
Lutfhi Auliya,2025,5,Sangat nyaman sekali menginap di sini apalagi anak2 sangat suka ada banyak permainan dan makanannya juga banyak variasiinya terutama di pelayanannya kak Amanda sangat membantu selama kami menginap di hotel,KOMPETITOR,Bintang 3,HotelDafamFortunaSeturan-Yogyakarta,positive,Kualitas Makanan & Restoran
Ulan Tari,2025,4,Cukup memuaskan untuk anak-anak ada taman bermain mini zoo dan kolam renang sarapan nya jg anak-anak ramah ya cuman klau untuk orang dewasa dari rasa kurang dan pelayanan nya juga cukup baik semua nya ramah,KOMPETITOR,Bintang 3,HotelDafamFortunaSeturan-Yogyakarta,positive,Pelayanan Staf & Keramahan
Afiiafiifah,2025,5,Hotel anak-anak ramah di jogja dianjurkan banget buat ke sini anak2 puas pelayanan nya juga ramah taman bermain nya ada yang jaga juga terima kasih mba Amanda udah jagain anak2 selama main di taman bermain,KOMPETITOR,Bintang 3,HotelDafamFortunaSeturan-Yogyakarta,positive,Pelayanan Staf & Keramahan
Anis Khilya,2025,5,selama menginap di hotel ini pelayanannya memuaskan fasilitas kamar nyaman bersih dan resepsionisny ramah terutama mbak Amanda dan mbak nisa maknnany juga enak patut dicoba dan dianjurkan selama di jogja,KOMPETITOR,Bintang 3,HotelDafamFortunaSeturan-Yogyakarta,positive,Kebersihan & Kenyamanan Kamar
Hardian Oktavia,2025,5,hotel bersih anak-anak ramah banyak spot permainan pelayanan semua ramah mulai dari satpam resepsionis sampai housekeeper sama kak Amanda terima kasih keramah tamahannya menerima kritik dan saran dari tamu,KOMPETITOR,Bintang 3,HotelDafamFortunaSeturan-Yogyakarta,positive,Pelayanan Staf & Keramahan
tata arinda,2025,5,Saat libur sekolah anak anak meminta mau menginap di hotel lalu saya memesan hotel fortuna grande seturan yang memiliki fasilitas anak-anak ramah saya memesan untuk 3 hari 2 malam karena saya memeriksa masuk jam 19 jam jadi kamar sudah siap dan kata petugas kantor depan dpt upgrade gratis di kamar tempat tidur ganda sebelumnya saya memesan kamar kamar kamar kamar nya bersih walau tidak begitu luas fasilitas berfungsi dengan baik ac lampu teko pemanas toilet bersih tempat tidur nyaman namun menurut kami bantal terlalu keras dan tinggi tapi gapapa masih bisa tidur nyenyak bagi saya paling saat favorit sarapan masakan menu nya hampir semua staff dapur jg sigap untuk mengisi ulang yang hampir,KOMPETITOR,Bintang 3,HotelDafamFortunaSeturan-Yogyakarta,positive,Kebersihan & Kenyamanan Kamar
Winda Octavia,2025,5,hotel yang sangat layak kamar petualanganenya bagus banget semua fasilitas anak2 uda termasuk cant mengeluh tentang ukuran kamarnya bagus dan nyaman banget semua stafnya sangat ramah dan penuh senyum dari saya cek masuk sampai pulang selalu dilayani dengan senyum walaupun sibuk jika lewat pasti disapa dengan senyum benar2 besar perhotelan menu sarapan jg cocok ada rasanya dan tidak bland saya pasti akan kembali lagi ke fortuna jika kembali ke jogja untuk liburan secara keseluruhan sangat baik pengalaman jika saya bisa memberikan lebih banyak bintang saya akan berterima kasih kepada fortuna karena meninggalkan pengalaman jogja yang hebat untuk seumur hidup,KOMPETITOR,Bintang 3,HotelDafamFortunaSeturan-Yogyakarta,positive,Pelayanan Staf & Keramahan
Cientya Velayati,2025,5,pengalaman yang sangat menyenangkan bisa menginap di hotel ini kamarnya tidak terlalu luas karena kami pesan yang anggaran kembar tapi sepertinya setiap kamar ada balkonnya suka banget deh jarang sekali dapat hotel dengan harga segitu tapi ada balkonnya kebetulan kami dapat kamar paling ujung belakang dari balkon kami bisa langsung melihat area kuda dan sirkuit untuk sekelas hotel bintang 3 juga keren sih ada gym centernya meskipun tidak terlalu luas tapi lumayan lah buat yang ingin bakar kalori di sekitaran hotel juga banyak pedagang kaki lima mau malam mau rame pokoknya sangat siang jadi tidak bingung mau jajan apa ada hotel walik enak mana juga di deket harganya 500,KOMPETITOR,Bintang 3,HotelDafamFortunaSeturan-Yogyakarta,positive,Fasilitas Hotel (Kolam/Gym/Spa)
Nourma Fahma,2025,5,2x menginap di sini dan puas dengan pola dengan pelayanannya menu sarapannya beragam dan enak serta taman bermain yang luas ada mini zoonya juga,KOMPETITOR,Bintang 3,HotelDafamFortunaSeturan-Yogyakarta,positive,Kualitas Makanan & Restoran
Novie,2025,5,lobby nya wangi hotelnya anak-anak ramah puas menginap dihotel ini terimakasih mba nadela di resepsionis dan mas roomboy yang sudah membantu membawakan barang,KOMPETITOR,Bintang 3,HotelDafamFortunaSeturan-Yogyakarta,positive,Kebersihan & Kenyamanan Kamar
Stella Chrisma,2025,5,buat pertama kali menginap di hotel yang super anak-anak ramah dan jujur sudah pengen banget ajak anak2 ke sini dari lama ekspektasi bener bener terbayarkan dengan puas dari masuk hotel sampai keluar hotel di sambut dengan staf2nya yang super ramah pol murah senyum pokoknya bikin hati nyaman banget selama ini belum lagi fasilitasnya banyak yang gratis selama menginap di tipe kamar kamar tema kamar bermain super petualangan yang luas dan banyak bkin orang tua bisa bernafas sejenak sambil anak2 utama hehe pengalaman yang benar benar rasanya sangat menghibur anak sekali makanan juga enak2 ada warung mie sedap yang tidak boleh,KOMPETITOR,Bintang 3,HotelDafamFortunaSeturan-Yogyakarta,positive,Pelayanan Staf & Keramahan
Surtika Tika,2025,5,teh amanda pelayanannya ramah dan baik makanan enak kamarnya sudah bagus bisa di tambah meja belajar,KOMPETITOR,Bintang 3,HotelDafamFortunaSeturan-Yogyakarta,positive,Kebersihan & Kenyamanan Kamar
den yoga,2025,5,Best staycation untuk bocil dah minizoon kuda poni kreta indoor playground mandi bola seragam profesi dan mini gokart lengkap dengan podiumnya lokasi seturan pula,KOMPETITOR,Bintang 3,HotelDafamFortunaSeturan-Yogyakarta,positive,Fasilitas Hotel (Kolam/Gym/Spa)
erny ayu febrianti,2025,3,Sangat menyayangkan ketika sarapan laukpauk selalu habis yang tersedia hanya karbo tidak ada menu daging hanya ayam ikan itupun disediakan sangat sedikit dan mengisi lama sekali 2 hari berturut2 mengeluh hal yang sama tidak ada perbaikan semoga kedepannya diperbaiki lagi,KOMPETITOR,Bintang 3,HotelDafamFortunaSeturan-Yogyakarta,negative,Kualitas Makanan & Restoran
Devi Lia,2025,5,rekomen banget nginep disini terutama yang membawa anak hotelnya anak-anak ramah tidak nyangka dari depan terlihat kecil tapi saat masuk banyak fasilitasnya staf juga ramah dan sangat membantu sarapan rasa enak dan termasuk banyak variasinya terima kasih fortuna grande,KOMPETITOR,Bintang 3,HotelDafamFortunaSeturan-Yogyakarta,positive,Pelayanan Staf & Keramahan
Runtika Dewi,2025,5,senang sekali menginap di hotel ini pelayanannya baik stafnya mba Amanda juga sangat membantu kami anak anak sangat senang bermain di kamar,KOMPETITOR,Bintang 3,HotelDafamFortunaSeturan-Yogyakarta,positive,Pelayanan Staf & Keramahan
Annisa Fauzia,2025,5,saya menginap di hotel ini saat menjelang akhir pekan panjang secara keseluruhan pengalaman menginap cukup menyenangkan meskipun ada beberapa catatan yang perlu jadi perhatian beberapa kali saya melakukan permintaan namun pelayanannya agak lambat termasuk saat sarapan sekitar pukul 9 pagi banyak makanan yang sudah habis saya sempat bertanya beberapa kali soal mengisi makanan namun belum ada kejelasan untungnya saya bertemu dengan mbak ifa yang sangat cepat tanggap dan sigap membantu beliau menindaklanjuti permintaan saya termasuk memastikan makanan segera memenuhi terima kasih banyak mbak ifa pelayananmu luar biasa dan sangat membantu sukses selalu mba ifa,KOMPETITOR,Bintang 3,HotelDafamFortunaSeturan-Yogyakarta,positive,Pelayanan Staf & Keramahan
Diary Akira Official,2025,5,hotel dengan berbagai fasilitas banyak wahana anak yang termasuk bisa dinikmati seperti melukis minimmarket permen dan minizoo jg ada bahkan taman bermain pun ada lengkap tapi untuk makanannya rasanya agak kurang untuk makanan kembali ke selera masing masing ya,KOMPETITOR,Bintang 3,HotelDafamFortunaSeturan-Yogyakarta,positive,Fasilitas Hotel (Kolam/Gym/Spa)
Chichilia Mailania,2025,4,Saya menginap 2 malam di ruang petualangan super memang ruang sangat2 anak bersahabat anak2 senang sekali dan cm itu saja kelebihanya tapi dengan hrg 1 6jtaan malam fasilitas yang ad dikamar tidak bisa dbilg kelebihan yaa karena untuk hotel bintang 3 mnurut saya sdikit mahal malam pertama bangun tidur badan sakit semua karena tempat tidur keras tidak ada di matras lalu komplain barulah dikash matras untuk malam kedua seharusnya bisa dipersiapkan lebh baiknya kamarnya baru sarapan engga banget deh tidak ramah anak ankny cm karena ad es krim gulali dan maramellow macemnya sangat sedikit dan tidak,KOMPETITOR,Bintang 3,HotelDafamFortunaSeturan-Yogyakarta,negative,Harga & Value for Money
Isnatul Arifah,2025,5,bukan musim liburan jadi tidak ramai fasilitas oke buat anak anak cek masuk jam 15 ya karena sepi jadi tadi jam 14 sudah siap cuma agak lama menurut standar hotel indonesia yang mayoritas jam 14,KOMPETITOR,Bintang 3,HotelDafamFortunaSeturan-Yogyakarta,positive,Harga & Value for Money
Elinda Fariz,2025,5,kamar dan fasilitas nya bikin anak anak saya happy varian sarapan resto juga banyak ada mini zoo taman bermain toko permen bermain untuk anak anak juga ada fasilitas ulang tahun scooter dan mobil remote control,KOMPETITOR,Bintang 3,HotelDafamFortunaSeturan-Yogyakarta,positive,Kualitas Makanan & Restoran
Rizky Cavera,2025,5,puas bnget nginep disini bener2 lengkap tidak perlu kemana2 lagi kalau ngajakin anak menginap disini mulai dari playroom mini zoo playground dll selamat datang menu cemilan sarapan nya banyak ohiya ada barang yang ketinggalan eh gercep dikirimin huhu baik bnget next staycation lagi sini terima kasih fortuna grande,KOMPETITOR,Bintang 3,HotelDafamFortunaSeturan-Yogyakarta,positive,Kualitas Makanan & Restoran
Desta Chasani,2025,5,layaknya dengan harga 5k mlm tipe superior tidak trlalu sempit anak-anak ramah banget ada ruangan laktasi lumayan beragam sarapannya banyak penutup buat ank2 juga dan yang terpenting semua staf sangat membantu mulai dari satpam fo fnb crew terima kasih untuk mengundang kami menginap berikutnya di sini lg,KOMPETITOR,Bintang 3,HotelDafamFortunaSeturan-Yogyakarta,positive,Kebersihan & Kenyamanan Kamar
Tet Angga,2025,3,hotel yang terkenal dengan fasilitas untuk anak ada taman bermain anak kolam aktivitas anak dianjurkan apabila bawa anak 7 tahun kamar standar deluxe ukuran kecil ac 1 unit tampaknya kurang dingin meskipun dibuat 18 mode keren dengan penuh kipas kamar 310 kamar mandi hati hati lantainya licin apabila basah ranjang tergolong cukup keras tv digital dengan gambar tidak jernih,KOMPETITOR,Bintang 3,HotelDafamFortunaSeturan-Yogyakarta,negative,Fasilitas Hotel (Kolam/Gym/Spa)
didit setiadi,2025,3,Kalau untuk bawa anak memang nyaman banget karena ada lapangan bermain ada taman binatang mini tapi kamar yang ada temaanya cukup berisik buat kamar di bawahnya dan kami pesan 2 kamar bau cukup mengganggu baunya dari kamar mandi,KOMPETITOR,Bintang 3,HotelDafamFortunaSeturan-Yogyakarta,positive,Fasilitas Hotel (Kolam/Gym/Spa)
Nurdina Wachidatun,2025,5,menurutku nyaman banget sih ini untuk anak2 akan betah ada mini taman taman binatang cukup luas juga yang mana jika kita capek taman bermain utama tinggal masuk kamar istirahat gk perlu keluar hotel untuk cari taman bermain lg,KOMPETITOR,Bintang 3,HotelDafamFortunaSeturan-Yogyakarta,positive,Kebersihan & Kenyamanan Kamar
Diva Madya Resdwivani,2025,4,saya dan keluarga sengaja menginap di sini karena anak meminta ulang tahun mau main di jogja suami mencari referensi dan akhirnya pilihannya jatuh cinta ke hotel ini pesan kanar super adventure room dapat kamar 214 letaknya paling pojok pertama masuk lobi cukup dingin dan wangi tapi terlihat agak kotor staf ramah dan membantu meskipun proses pemeriksaan masuk agak lama saya datang 15 30an dan diminta untuk menunggu dari informasi yang tersedia dapat memeriksa masuk jam 15 00 menunggu sekitar 15 menit akhirnya dapat kamar dapat kamar di lantai 2 area kamar terbuka tapi terasa panas keluar lift langsung area resto untuk sarapan informasi kamar cukup membingungkan karena kamar tidak pernah berangkat sempat bolak,KOMPETITOR,Bintang 3,HotelDafamFortunaSeturan-Yogyakarta,positive,Kebersihan & Kenyamanan Kamar
Nadya Yasmin,2025,2,pertama kali saya berkunjung ke hotel dan ini pengalaman saya 1 pesanan antara traveloka dan data hotel tidak sama id pemesanan bisa tidak sama dan permintaan yang masuk pun tidak sama 2 masuk kamar kondisi tempat tidur sangat kotor saya menemukan bercak noda putih noda darah dan rambut foto tertera 3 saya meminta untuk mengganti dan mereka mengganti dengan cepat 4 kebersihan sangat kurang saya kecewa dan tidak akan kembali lagi ke hotel ini 5 saya kesini karena banyak fasilitas untuk anak-anak yang menarik namun saya kecewa hotel ini tidak bersih,KOMPETITOR,Bintang 3,HotelDafamFortunaSeturan-Yogyakarta,negative,Kebersihan & Kenyamanan Kamar
Ratih Pertiwi,2025,2,untuk fasilitas saya akui termasuk hotel yang berkonsep bagus terutama buat yang bawa anak banyak fasilitas yang berbeda dari hotel yang lain dan dengan harga yang masih terjangkau jadi sangat baik tapi jujur saya sangat kecewa dengan pelayanan untuk ketersediaan kamar saya datang sudah sekitar jam set4 dan saat ini sdg tidak musim liburan namun pada hari sabtu sudah checkin jam set4 tapi masih menunggu kamar sekitar 30 menit yang seharusnya sudah bisa istirahat karena hotel itu tempat istirahat bisa tetapi saya harus di suruh menunggu lagi dengan alasan kamar belum siap padahal sudah jam set4 sore loh kecuali saya datang jam set2 atau jam 2 teng saya masih maklumin untung di,KOMPETITOR,Bintang 3,HotelDafamFortunaSeturan-Yogyakarta,negative,Harga & Value for Money
aisyah tiffany,2025,1,kecewa dpt kamar yang sempit sumpek tidak ada indah2nya ktnya ramah anak tetap saja tambahkan2 byr ini adalah kolam renang jg sumpek kapok bnr an disini klo mau liburan yang ramah anak ke timurparc saja sekalian yang bnr 2ramah anak tidak ada tmbh ini ituu sangat berbeda si pelayanannya,KOMPETITOR,Bintang 3,HotelDafamFortunaSeturan-Yogyakarta,negative,Fasilitas Hotel (Kolam/Gym/Spa)
dr.Yustina Sulistyaningrum -Klinik Pratama Tina,2025,5,Pelayanan bagus cocok buat anak2 banyak wahana untuk pelayanan mba Amanda mba dewi baik terima kasih,KOMPETITOR,Bintang 3,HotelDafamFortunaSeturan-Yogyakarta,positive,Pelayanan Staf & Keramahan
ST Nurmasita Adrianti,2025,5,Seruu menyenangkan asik pokoknya banyak jajanan dan paling penting pelayanan nya sangat ramah suka banget dengan cara pelayanannya salah satu nya itu ada mba Amanda yang begitu amat ramah menyambut kita,KOMPETITOR,Bintang 3,HotelDafamFortunaSeturan-Yogyakarta,positive,Kualitas Makanan & Restoran
Andrian Ramadhani,2025,5,Hotel yang bagus banget nginap di super petualangan anak2 suka sarapan enak taman main sepuasnya next klo ke jogja bakal balik kesini lagi,KOMPETITOR,Bintang 3,HotelDafamFortunaSeturan-Yogyakarta,positive,Kualitas Makanan & Restoran
satrio rachmad,2025,2,sebenarnya fasilitas hotelnya bagus petugas keamanan ramah dan responsif ada selamat minum taman bermain anak dlsb tapi buat kami yang sudah nyetir mobil dari surabaya sejak pagi ingin segera beristirahat tapi tidak bisa karena sudah jam 15 waktunya cek masuk masih belum juga dapat kamar kami datang serombongan pemesanan 3 kamar menunggu 35 menit baru siap 1 sampai dengan 20 menit kemudian baru siap 1 lagi ini sudah jam ini sudah sudah sejak jam cek masuk masih belum dapat 1 kamar terakhir sangat mengecewakan seharusnya saat musim liburan ini ini manajemen bisa menambah kebersihan agar kamar lebih cepat siap untuk kamar berikutnya sih fasilitasnya nyaman tapi jika memang bisa segera,KOMPETITOR,Bintang 3,HotelDafamFortunaSeturan-Yogyakarta,negative,Pelayanan Staf & Keramahan
Hermawan Nugraha,2025,3,Tlg perbaikan ac rembes kamar mandi bau sumberny dari air pembuangan air panas lama terima kasih,KOMPETITOR,Bintang 3,HotelDafamFortunaSeturan-Yogyakarta,negative,Infrastruktur (AC/WiFi/Parkir/Air)
Arini Ayu Rahmawati,2025,3,desain bagus untuk anak2 hanya saja waktu kesitu agak jorok kasurnya berpasir dan banyak rambutnya kamar mandinya bau tidak sedap,KOMPETITOR,Bintang 3,HotelDafamFortunaSeturan-Yogyakarta,negative,Fasilitas Hotel (Kolam/Gym/Spa)
Astriani Yusuf,2025,5,Suka banyak jajan pelayanan nya juga bagus banget klo stok makanan abis past lansung dilayanin terutama mba Amanda ramahh dan cantik ih masyaallah,KOMPETITOR,Bintang 3,HotelDafamFortunaSeturan-Yogyakarta,positive,Pelayanan Staf & Keramahan
Tetty nur indah sari,2025,5,pengalaman yang sangat menyenangkan anakku tidak berenti bilang seru banget kebetulan lagi ultah anakku dpt kue ulang tahun khusus dan bisa upgrade ke deluxe gratis semuanya oke dan menyenangkan banget sangat dianjurkan untuk keluarga menginap yang anaknnya balita btw saat malemnya ada acara badut show seru banget,KOMPETITOR,Bintang 3,HotelDafamFortunaSeturan-Yogyakarta,positive,Harga & Value for Money
Avante H8 Karoseri Tentrem,2025,4,hotel nya bagus saya gunakan hotel ini saat perpisahan sekolah saya menginap di hotel ini 2 malam saat saya tiba disambut minuman yang rasanya enak kasur nyaman selimut tebal sebenarnya kamar sudah bagus hanya konsep kamar mandi yang tak ada kunci sebenarnya kurang nyaman jika digunakan untuk menginap bersama teman katsunya enak hanya saja tepung sudah tidak lengket makanan lain lumayan sudah enak anak makanan yang cocok untuk anak anak pelayanan hotel ini bagus saya saat pergi di hari sangat sangat kedua menginap kamar saya dibersihkan dan saat saya kembali kamar saya sudah kembali bersih umum 4 5 sangat suka dengan hotel ini,KOMPETITOR,Bintang 3,HotelDafamFortunaSeturan-Yogyakarta,positive,Kebersihan & Kenyamanan Kamar
amirul adi,2025,5,hotel yang paling disukai anak anak anak anak anak ramah banget banyak fasilitas permainan anak menu restonya lumayan lengkap ada masakan lokal jogja kamar dan toilet bersih staf nya juga ramah,KOMPETITOR,Bintang 3,HotelDafamFortunaSeturan-Yogyakarta,positive,Kebersihan & Kenyamanan Kamar
Bondan Wijaya,2025,3,Sebagai salah satu resensi hotel izinkanlah saya mengulas hotel ini sangat tidak menyayangkan ke hotel estetis ini tercoreng dengan pelayanan dan rasa bermalam di hotel ini btw saya cek masuk tgl 10 juli 2025 berharap dengan harga 700rb mendapatkan pelayanan suasana makanan yang sesuai dengan kelasnya oke berawal diri masuk cek masuk jam 15 00 tertulis disitu saya sampai jam 15 00 menncoba ke anak zona disitu memang sangat tiket bersih berbayar 65rb untuk 4 wahanan staf ramah dan bersih yang bikin semuanya hancur ketika saya cek di kamar seharusnya jam 15 00 sudah siap ternyata kami disuruh menunggu sampai,KOMPETITOR,Bintang 3,HotelDafamFortunaSeturan-Yogyakarta,positive,Pelayanan Staf & Keramahan
Rafi Maharani,2025,5,pengalaman yang baik tinggal di sini bener bener ramah anak staf ramah sarapan jg enak tempat hotel jg gabegitu jauh mau kemana mana mana mana kalau liburan ke jogja bawa bocil sangat disarankan kesini,KOMPETITOR,Bintang 3,HotelDafamFortunaSeturan-Yogyakarta,positive,Pelayanan Staf & Keramahan
Niha Yahya,2025,5,menarik nyaman bersih menyenangkan pelayanan sangat ramah oke semua pokoknya,KOMPETITOR,Bintang 3,HotelDafamFortunaSeturan-Yogyakarta,positive,Kebersihan & Kenyamanan Kamar
Retno Pratiwi,2025,5,seru nginep di sini apalagi kalau bawa anak2 ada mini taman taman binatang dan beberapa tempat untuk bersantai serta berkreasi anak2 pasti suka,KOMPETITOR,Bintang 3,HotelDafamFortunaSeturan-Yogyakarta,positive,Lokasi & Akses Strategis
