User Name,Review Time,Rating,clean_text,Tipe,Kelas,Nama_Hotel,AI_Sentiment,AI_Aspek
tifa hkm,2024,5,terbaik untuk yang bawa anak ini hotel wajib kalian datangi cocok untuk menginap lokasi strategis sepanjang jalan banyak kuliner ada taman bermain dan mini zoo sarapan juga lumayan gratis es krim cotton candy dan popcorn,KOMPETITOR,Bintang 3,HotelDafamFortunaSeturan-Yogyakarta,positive,Lokasi & Akses Strategis
Agus Supriadi,2025,5,"Untungnya, saya tidak pernah tinggal di ruang petualangan staf ramah kebersihan oke pasti kembali lagi ke sini",KOMPETITOR,Bintang 3,HotelDafamFortunaSeturan-Yogyakarta,positive,Kebersihan & Kenyamanan Kamar
P P,2025,3,staf ramah makanan lumayan lengkap taman bermain dan daerah anak cocok tapi sangat tidak menyenangkan acara di TV untuk anak hanya 1 saluran saja cek masuk jam 3 lobi kecil sehingga banyak penumpukan orang dijam 2 sampai jam 3 lebih berpengalaman antri sembako dan paling sangat menyebalkan di sana ketika ada konten pencipta kami lagi nyaman disuatu tempat untuk membuat edukasi anak langsung diganggu serasa mereka dan video di kami yang jelas memiliki sangat menganggu sekali,KOMPETITOR,Bintang 3,HotelDafamFortunaSeturan-Yogyakarta,negative,Pelayanan Staf & Keramahan
Warto Jogja,2025,5,hotel berbintang yang ada pusatnya kota jogja sangat cocok untuk menginap saat liburan bersama keluarginya hotel ramah anak dilengkapi dengan mini playground sangat dekat dengan malioboro,KOMPETITOR,Bintang 3,HotelDafamFortunaSeturan-Yogyakarta,positive,Lokasi & Akses Strategis
tata wira,2024,5,pengalaman yang sangat berkesan apa lagi bawa keluarga dan anak krna ada mini zoo dan bermain tanahnya untuk anak makin betah sarapannya yang bnyk pilihannya besok klo balik jogja kembali dafam seturan lagi,KOMPETITOR,Bintang 3,HotelDafamFortunaSeturan-Yogyakarta,positive,Lokasi & Akses Strategis
Lailia Saras,2024,5,permintaan kue ulang tahun gercep langsung diantar ke kamar tanpa tambahan biaya aka gratis yeayy ini hotel anak-anak ramah dan sangat terjangkau mengingat di jogja sedikit banget hotel yang anak-anak ramah menu sarapan juga beragam ada anak-anak sudut cotton candy creepes popcorn es krim cokelat menara terima kasih dafam seturan,KOMPETITOR,Bintang 3,HotelDafamFortunaSeturan-Yogyakarta,positive,Harga & Value for Money
Laila Rahma Nurkhasanah,2024,5,Area mantapp nya bersih makanannya lengkapp dan enak enakk pelayanannya bagus pelayan nya ramah hotel yang dianjurkan buat staycation kalau lagi ke jogjaa apalagi ada taman minizoo yang bikin tambah betah,KOMPETITOR,Bintang 3,HotelDafamFortunaSeturan-Yogyakarta,positive,Kualitas Makanan & Restoran
id dayucip,2025,5,asli suka disini tapi sering penuh bngt jangan salah ma yang di malioboro ya beda jauh sini yang nyebelin ke napa ada konter permen deket angkat bagi mak mak itu ancaman bnyk makanan yang di suka anak fasilitas baru surga untuk anak2 semua,KOMPETITOR,Bintang 3,HotelDafamFortunaSeturan-Yogyakarta,positive,Lokasi & Akses Strategis
Bondan Wicaksono,2023,4,pertama kalinya menginap di hotel dafam fortuna seturan begitu masuk lobi di sambut dengan resepsionis yang ramah membantu disediakan minuman selamat datang berupa jus jambu jeruk 13 30 sudah boleh memeriksa masuk ukuran kamar lumayan luas hanya saja bantalnya terlalu tipis yang paling penting lokasi hotel ini strategis di kawasan seturan di sekitar hotel banyak tempat makanan tidak khawatir jika tau2 laper ada kolam renangnya juga parkirannya juga luas sejauh ini baik mungkin lain kali akan menginap di sini lagi,KOMPETITOR,Bintang 3,HotelDafamFortunaSeturan-Yogyakarta,positive,Pelayanan Staf & Keramahan
Ican Cain,2025,5,Ditingkatkan lagi rasa makanannya biar tidak hambar,KOMPETITOR,Bintang 3,HotelDafamFortunaSeturan-Yogyakarta,positive,Kualitas Makanan & Restoran
Udin Anas,2023,5,hotel dafam awal tau dari seorang pelancong yang menyarankan untuk datang karena cari yang ramah anak coz di hotel ada mini zoo playground luas dan anak langsung keluar bngt aku suka bi mi terima kasih ya kamar bagus si bersih tapi ksh bintang 4 karena tombol lampu dan lampu tidur agar sedikit rusak tapi secara keseluruhan nyaman bngt si untuk lokasi jg mudah bngt di temukan karena tepat di belakang kampus naik dari situ terlihat bngt tulisan hotel dafam terima kasih dafam hotel pelayannya semua ramah selalu menyapa jika bertemu orang,KOMPETITOR,Bintang 3,HotelDafamFortunaSeturan-Yogyakarta,positive,Kebersihan & Kenyamanan Kamar
Aprina Rusdian,2024,3,Rumah sakitnya bagus fasilitasnya banyak tapi tidak semua fasilitas yang belum termasuk anak berenang dilarang nya harus bayar sarapan anak saya ke-6 kena biaya aga kecewa sih 3 hari menginap di jogja pindah2 hotel hanya hotel ini yang aga pelit kasih sarapan,KOMPETITOR,Bintang 3,HotelDafamFortunaSeturan-Yogyakarta,negative,Fasilitas Hotel (Kolam/Gym/Spa)
Yohanes Andria Kurniawan,2024,5,keren pelayanannya saya waktu ada barang ketinggalan d kamar lngsng diberitahukan oleh adminnya keren servicenya serta ramah anak kecil jga jadi bsa staycation sekalian ada mini zoo nya jga serta taman bermain untuk anak2 semoga dafam selalu menberikan pelayanan yang konstan terimakasih,KOMPETITOR,Bintang 3,HotelDafamFortunaSeturan-Yogyakarta,positive,Pelayanan Staf & Keramahan
Ragil Utomo,2025,3,positifnya masakan enak ramah anak wahana anak lengkap namun ada beberapa yang berbayar pelayan ramah 7 10 negatifnya kamar standar banget sabun hemat banget tidak lengkap standar kamar biasa sempit ac berisik dan kadang kalau panas sangat panas kalau dingin sangat tempat tidur kurang nyaman kesimpulan jika tujuan anda untuk apa yang ingin anak boleh dicoba dengan harga standar jika tujuan anda untuk tidur kurang nyaman dianjurkan,KOMPETITOR,Bintang 3,HotelDafamFortunaSeturan-Yogyakarta,negative,Kebersihan & Kenyamanan Kamar
J M,2019,4,kamar sedikit kecewa karena kamar superior yang saya pesan tidak seperti foto2 yang terpampang di situs2 pemesanan online tapi kamar bersih kelengkapan cukup minus bud kapas kulkas juga tidak tersedia pdhl di tempat lain dengan harga yang sama biasa ada kulkas ac dingin tv kabel menyedihkan hanya 28 saluran sudah termasuk saluran lokal dan beberapa tidak sinyal kualitas gambar juga kurang bagus kamar tidak terlalu kedap suara kamar mandi bersih sarapan buffet nasi dan kawan2nya cukup lengkap tapi rasa biasa saja tradisional sudut gudeg rasa biasa krecek masih banyak bubur ayam tidak coba salad buahnya apalagi enak salaknya istimewa apalagi manisan,KOMPETITOR,Bintang 3,HotelDafamFortunaSeturan-Yogyakarta,negative,Kebersihan & Kenyamanan Kamar
Ima,2021,5,memesan dadakan langsung telepon ke resepsiis siang minta kamar deluxe oke dateng malem jam10 sudah disediakan tempat tidur ekstra atas permintaan sarapan pagi dianter menu indonesia minta nasi goreng jus jeruk tambah salad buah rasa oke ludes semua setelah itu anak2 minta berenang dilantai 2 ada kolam khusus anak tapi bayarnya pada kemana yak harga keseluruhan semalem standar kamar oke ada mandi ub tambah kolam anak jadi anak2 seneng buat keluarga boleh dicoba,KOMPETITOR,Bintang 3,HotelDafamFortunaSeturan-Yogyakarta,positive,Fasilitas Hotel (Kolam/Gym/Spa)
Abu Said,2023,5,kamar bersih mudahtas memuaskan pelayanan bagus makanan enak sekali ini saat hari minggu dapat potongan harga kalau ke jogja masuk syaa allah mampir lagi karena lingkungan sekitar jajannya enak enak juga meskipun jalan kaki apalagi ada mini zoo nya,KOMPETITOR,Bintang 3,HotelDafamFortunaSeturan-Yogyakarta,positive,Kebersihan & Kenyamanan Kamar
Theewiq,2025,4,kamar deluxe tampilan standar hrg 750an ngk ada kulkas minim perabot seperti meja kursi kerja klo akhir pekan 1 1jt makanan tidak bervariasi nasi goreng mie goreng dll sebaiknya variasi menu2 tradisional ttg ciri khas makanan jogja jg ada pertanyaan kebanyakan pelancong permainan anak2 banyak yang sudah rusak pelayanan ramah,KOMPETITOR,Bintang 3,HotelDafamFortunaSeturan-Yogyakarta,negative,Pelayanan Staf & Keramahan
Pandega Comunity,2024,5,Hotel keluarga banget nih ada mini zoo bermain ground dan untuk sarapan pagi sangat lengkap paling fav es krimnya sih pokoknya rekomendasi banget kamar bersih staf ramah2 anak senang ayah pun tenang hehehe hehehe,KOMPETITOR,Bintang 3,HotelDafamFortunaSeturan-Yogyakarta,positive,Kebersihan & Kenyamanan Kamar
Han Hanafi,2020,5,hotelnya nyaman tempatnya strategis stafnya ramah cekatan kamarnya juga bersih wangi ada ukafenya juga yang bisa digunakan untuk nongkrong kolam renang nya juga bagus dan keren resto nya juga banyak menu makanan nya tempat parkirnya juga cukup luas dan berada persis di samping hotel enak kalau bawa rombongan di sekitar hotel juga banyak yang menjual kuliner mantul pokoknya dafam seturan,KOMPETITOR,Bintang 3,HotelDafamFortunaSeturan-Yogyakarta,positive,Kebersihan & Kenyamanan Kamar
Herdy Soepono,2024,5,karyawan ramah lokasi strategis tersedia lift ada ruang untuk rapat seminar pelatihan tersedia fasilitas mushola kamar mandi bagi yang kesulitan naik tangga bisa masuk lewat basemen dan naik menggunakan lift,KOMPETITOR,Bintang 3,HotelDafamFortunaSeturan-Yogyakarta,positive,Pelayanan Staf & Keramahan
Eri Alfian,2025,5,hotelnya bersih staf ramah kulkasnya dingin makanan nya enak enak banyak wahana utama untuk anak anak kalau ke jogja lagi akan nginap disini lagi,KOMPETITOR,Bintang 3,HotelDafamFortunaSeturan-Yogyakarta,positive,Kebersihan & Kenyamanan Kamar
Indra Alvianto,2025,1,ketentuan yang tidak masuk akal saya kalau 1 kamar diberikan voucher 2 anak kenapa 2 kamar tetap diberikan 2 voucher anak,KOMPETITOR,Bintang 3,HotelDafamFortunaSeturan-Yogyakarta,negative,Harga & Value for Money
Nabilla Nur Selina,2019,4,untuk kamar deluxe di hotel ini lumayan fasilitasnya cukup lengkap mulai dari brankas lemari gantung yang cukup luas kit mandi handuk tv ac pemanas air ada balkonnya juga sayangnya menurut saya ruangan ini kurang sofa padahal kamar masih cukup luas tapi hanya disediakan satu kursi kecil akan lebih baik lagi jika di balkonnya juga diberi kursi dan meja harga bisa dikatakan murah jika di booking lewat perjalanan untuk sarapan tersedia menu bermacam seperti nasi goreng atau nasi putih berserta lauk pauknya bubur dan soto ayam sereal roti tawar dengan bermacam isiannya dessert pudding dan minunan,KOMPETITOR,Bintang 3,HotelDafamFortunaSeturan-Yogyakarta,positive,Harga & Value for Money
Amas SDA,2024,3,Pelayanan sangat baik lokasi juga mudah di akses cuma kamarnya agak kecil untuk harga tsb pintu kamar yang saya gunakan agak sulit dibuka harus sambil ditarik baru bisa dibuka secara keseluruhan cukup nyaman terima kasih,KOMPETITOR,Bintang 3,HotelDafamFortunaSeturan-Yogyakarta,positive,Kebersihan & Kenyamanan Kamar
Harry,2024,5,hotelnya tampak kecil dari depan tapi ternyata memanjang ke belakang parkir mobil juga lumayan di ruang bawah tanah interiornya sih unik sangat cocok buat keluarga ada mini zoo dan kolam renang anak sayangnya tidak ada pusat kebugaran,KOMPETITOR,Bintang 3,HotelDafamFortunaSeturan-Yogyakarta,positive,Fasilitas Hotel (Kolam/Gym/Spa)
Vivid Wicaksono,2023,5,kamarnya luas lokasinya itu loh enak banget kalau mau nongkrong atau makan sekitaran hotel tinggal roll depan sekali juga udah nyampe wkwk pelayanan dari mba mba dan mas depan kantornya ramah saat cek keluar ditanyain apakah ada masukan untuk perbaikan kami pak mantap dah teruskan pekerjaan baik,KOMPETITOR,Bintang 3,HotelDafamFortunaSeturan-Yogyakarta,positive,Pelayanan Staf & Keramahan
Titan Titanix,2017,1,kamar tidak bersih untuk sebuah hotel di kelasnya dinding banyak blepotan noda di depan kamar banyak kasur2 tak terapiakai bergeletakan sprei dan sarung bantal masih ada yang bau apek akses wifi miskin parah abis susah konek sekalinya konek cmn 10kb s parkir mobil sangat sempit tidak direkomendasikan bawa mobil menu sarapan kurang oke tidak direkomendasikan menambahkan tambahan tempat tidur muahal pol resepsi ini lemot saya antri duluan waktu cek masuk malah petugas nglayani yang lain duluan saat buruk malam ada pool party suaranya berisik sekali nembus ke kamar kelebihannya cmn,KOMPETITOR,Bintang 3,HotelDafamFortunaSeturan-Yogyakarta,negative,Infrastruktur (AC/WiFi/Parkir/Air)
Dedek Susanto,2025,5,kayak nya kalau sudah beristirahat disini tidak perlu wisata keluar hotel lagi 20 jam di dalam hotel saja rasanya waktunya masih kurang sudah seperti itu staf nya tidak cuma ramah tapi peka banget kita belum berbicara mereka sudah ngeh dengan gerak gerik kita yang membutuhkan bantuan terbaik fasilitas pelayanan baru lokasi juga di tengah kota,KOMPETITOR,Bintang 3,HotelDafamFortunaSeturan-Yogyakarta,positive,Pelayanan Staf & Keramahan
Anindya Dewi,2023,5,kamar oke pelayanan juga oke mas mbaknya ramah dan selalu menyapa tamu lokasinya dekat kemana mana akses drop off cukup untuk mobil kecil sampai mobil perjalanan ada mini zoo dan kolam renang ada restonya juga makanannya tidak buruk cuma agak lama penyajiannya mungkin saat lagi banyak pesanan secara keseluruhan baik,KOMPETITOR,Bintang 3,HotelDafamFortunaSeturan-Yogyakarta,positive,Kebersihan & Kenyamanan Kamar
nicke rizki,2025,5,Senang mengunjungi cocok untuk anak2 ada minizoo dan bermain lapangan ada pertunjukan badut juga di akhir pekan hotel dekat banyak tempat makanan di jl seturan,KOMPETITOR,Bintang 3,HotelDafamFortunaSeturan-Yogyakarta,positive,Lokasi & Akses Strategis
Alya Riandani,2024,5,Tempat istirahat waktu studi tur dari sekolah kamarnya aga sempit tapi tiap pergi selalu dibersihkan terbaik pokonya banyak tempat fto bagus dan tempat nongki baguss makasi yak uda bikin se estetik itu jadi bisa nongki sama dia disitu haha,KOMPETITOR,Bintang 3,HotelDafamFortunaSeturan-Yogyakarta,positive,Kebersihan & Kenyamanan Kamar
kristanto suListiyo,2025,4,kamarnya biasa saja pelayanan cukup memuaskan lokasinya kurang enak tempat parkir sempit di basement bau sampah yang kurang enak,KOMPETITOR,Bintang 3,HotelDafamFortunaSeturan-Yogyakarta,negative,Kebersihan & Kenyamanan Kamar
Rahmat Riyadi,2025,5,hotel nyaman cocok untuk liburan anak anak karena adanya tempat rekreasi khusus anak seperti kereta thomas kuda poni kandang kelinci tempat bermain anak dan lainnya,KOMPETITOR,Bintang 3,HotelDafamFortunaSeturan-Yogyakarta,positive,Fasilitas Hotel (Kolam/Gym/Spa)
Fahri Ridho Budisusanto,2024,5,hotel dengan fasilitas terbaik di kelasnya terdapat fasilitas kolam renang minizoo taman bermain yang luas sehingga bisa memanjakan keluarga saat menginap di hotel ini selain itu terdapat juga fasilitas ruang pertemuan kafe dengan tanaman yang cantik di setiap sudutnya,KOMPETITOR,Bintang 3,HotelDafamFortunaSeturan-Yogyakarta,positive,Fasilitas Hotel (Kolam/Gym/Spa)
Farhan Nurrahman,2023,4,hotel dengan kebun binatang didalamnya bisa dibilang menjadi hal tersendiri fasilitas kolam renang dibawah dan aula yang memanjang membuat orang orang khusunya yang baru pertama kali datang ke hotel tersebut tidak tersesat makanan yang disajikan sudah beragam namun bisa disayangkan kurang menggugah selera,KOMPETITOR,Bintang 3,HotelDafamFortunaSeturan-Yogyakarta,positive,Fasilitas Hotel (Kolam/Gym/Spa)
Ignatius Handoko,2023,4,lokasi mudah diakses banyak outlet makanan didekat hotel semua staf membantu friendly hotel ini sangat ramah anak ada taman bermain mini zoo satu2nya masalah buat saya desain pintu kamar mandi dari kaca tidak bisa dikunci tidak rapat menutup,KOMPETITOR,Bintang 3,HotelDafamFortunaSeturan-Yogyakarta,positive,Pelayanan Staf & Keramahan
Sandra Widjajahakim,2020,5,Baru masuk diberikan minuman selamat datang wedang uwuh dari upcafe petugas resepsionisnya sangat ramah dapat kamar di bagian merokok awalnya tidak mau tapi kamar ditreatment dulu sebelum masuk ternyata kamar nya tidak ada bau asap rokok rupanya orang merokok di teras balkon malah kamar ini yang nyaman karena ada balkon tersebut kamar cukup kecil tapi lumayan desain kamarnya cukup bagus sayang colokan ketel air panasnya tidak ditemukan mungkin kelupaan dipasang rak dibawah TV ukurannya kurang lebar sehingga mau tarok laptop dll sulit lokasi sekitar hotel sangat banyak kulinernya ada warung upnormal kebab sate seturan dan sangat banyak yang lainnya berselancar,KOMPETITOR,Bintang 3,HotelDafamFortunaSeturan-Yogyakarta,positive,Pelayanan Staf & Keramahan
Lintang Lintang,2025,3,tempat parkir sempit makanan sarapan lumayan tapi rasanya kurang enak kamarnya sempit banget bahkan untuk sholatpun susah,KOMPETITOR,Bintang 3,HotelDafamFortunaSeturan-Yogyakarta,negative,Kualitas Makanan & Restoran
Akmarifa ulfafiany,2023,5,Beberapa hari yang lalu menginap di hotel dafam seturan karena setiap sakit jogja hujan jadilah kami sekeluarga berbuka di restorannya kebetulan mereka ada makan untuk berbuka dan ternyata di luar ekspetasi saya menu punya berbagai dan cukup enak layaknya untuk harganya kami sekeluarga senang sekali di dafam akan mencoba lagi waktu lain,KOMPETITOR,Bintang 3,HotelDafamFortunaSeturan-Yogyakarta,positive,Kualitas Makanan & Restoran
Sandra Nugroho,2024,5,Saya suka nih rekomen buat keluarga yang bawa anak kecil tempatnya banyak mainan anak2 bikin anak2 betah harga juga saat yang tidakayangkan hanya kolam renang yang dangkal cuman kecil tolong bikin kolam renang anak2 yang lebih lebar lagi,KOMPETITOR,Bintang 3,HotelDafamFortunaSeturan-Yogyakarta,positive,Harga & Value for Money
santoz Joz,2023,4,kesini tidak menginap hanya pertemuan 2 hari parkir minimalis di musim hujan ini repot untuk perjalanan dari dan ke mobil area parkir hanya di halaman sebelah hotel yang akan berbek saat menu hujan makanan seperti di warung cocok untuk lidah jawa musola di bawah minimalis sekali tidak siap untuk bertemu banyak orang tapi hari berikutnya disediakan musola lain walopun wudhu agak jauh,KOMPETITOR,Bintang 3,HotelDafamFortunaSeturan-Yogyakarta,positive,Kualitas Makanan & Restoran
Isrima,2024,2,Sebenernya saya kesini karena mau mengajak anak main di taman bermainnya eh taman bermainnya di pemesanan sama org yang ultah jika memang di pemesanan seharusnya kasih kompensasi ke tamu misal taman bermain di buka s d jam 20 jika gni nyesel memilih dafam seturan memperbaiki hotel biasa saja skalian yang lebih murah ha ha ha ha,KOMPETITOR,Bintang 3,HotelDafamFortunaSeturan-Yogyakarta,negative,Harga & Value for Money
Tika Adilistya,2023,5,lokasi strategis banyak tempat makanan di sekitarnya cocok untuk wisatawan dengan anak kecil sangat anak-anak ramah parkiriran cukup terbantu dengan staf yang sigap salah satu hotel bintang 4 yang terjangkau di jogja,KOMPETITOR,Bintang 3,HotelDafamFortunaSeturan-Yogyakarta,positive,Lokasi & Akses Strategis
Chandra Sheptian,2024,4,bagus buat anak2 senang banyak mainan kolam renang bagus parkiriran sempit bau enak parkir diluar kamar jg sempit tapi kasur nyaman udara panas oke ac agak panas mati2 sarapan banyak enak,KOMPETITOR,Bintang 3,HotelDafamFortunaSeturan-Yogyakarta,positive,Kebersihan & Kenyamanan Kamar
Coki Pardede666,2024,5,lumayan lah langganan manager gua kalau nginep di jogja hanya saja menu makannya kurang lengkap ya kalau konsep e agak diubah mungkin akan laris sih saran buat resepsionis kalau bsa standby yakk biar klo ad yang butuh informasi bsa langsung garcep gtu,KOMPETITOR,Bintang 3,HotelDafamFortunaSeturan-Yogyakarta,positive,Kualitas Makanan & Restoran
Tuanku Ilham Amir,2020,1,bagi para pencari kenyamanan jangan nginap di sini ini ngak cocok buat yang mau buat istirahat tenang jam stgh 12 masih saja ada yang yang main musik keras mengganggu orang istirahat padahal saya sendiri sudah pesan kamar yang deluxe biar bisa kenyamanannya tapi malah susah tidur karena musiknya keras di kafe untuk kebersiaan lumayan bersih dan kepada pengguna kartu tribun kartu keluarga premium hati2 karena harga kamar dinaikan dlu sebelum klaim diskon kedepannya lebih jujur saja sama pelanggan intinya hotel ini tidak dianjurkan,KOMPETITOR,Bintang 3,HotelDafamFortunaSeturan-Yogyakarta,negative,Kebersihan & Kenyamanan Kamar
Fieda Adirahardja,2024,5,begitu masuk langsung disambut baik kita tidak tinggal di sini karena semua kamar penuh tapi kita tetap dilayanin dengan baik koper2 kita dibawa ke recepaionis n pulangnya dibawa ke mobil kesini menghadiri pernikahan sepupu sajian makanannya enak2 gerai selalu mengisi kebersihan juga oke,KOMPETITOR,Bintang 3,HotelDafamFortunaSeturan-Yogyakarta,positive,Kebersihan & Kenyamanan Kamar
riris arismia,2025,5,secara keseluruhan sangat menyenangkan hotel ini cocok banget kalau liburan bawa anak ada kolam renang kolam ikan minizoo dan taman bermain disediakan juga skuter dan stroler di restoran juga banyak disediakan babychair benar2 ramah anak makanannya enak semua untuk masukan saja lantai di kamar mandi dibuat atau ditambahi agar tidak lisin karena anak saya terpeleset di kamar mandi,KOMPETITOR,Bintang 3,HotelDafamFortunaSeturan-Yogyakarta,positive,Fasilitas Hotel (Kolam/Gym/Spa)
Farhan Ekss,2025,5,lebih dari semua aman fasilitas untuk anak banyak untuk makanannya oke dan stafnya juga ramah,KOMPETITOR,Bintang 3,HotelDafamFortunaSeturan-Yogyakarta,positive,Pelayanan Staf & Keramahan
esthi prita,2023,5,Hotel ternyaman lokasi dekat dengan tempat makan hits jogja dan cocok banget buat bawa keluarga dan anak2 ada fasilitas minizoo dan taman bermain ditambah dengan staf yang sangat ramah dan membantu,KOMPETITOR,Bintang 3,HotelDafamFortunaSeturan-Yogyakarta,positive,Pelayanan Staf & Keramahan
sishe elyawati,2024,3,Keponakan saya menikah seminggu lalu di sini saya datang lebih awal dan ternyata pita2 di kursi semuanya kusut saya mencoba mekarkan pitanya tidak bisa jadi saya minta setrika untuk memuluskan pita2nya stafnya gercep minta maaf dan mengambil setrikaan lega semuanya selesai tepat pada waktunya dan kursi2nya jadi kuep dengan pita yang mulus tolong lebih diperhatikan lagi ya supaya tidak terjadi seperti ini jika untuk makanan kemaren enak2 semua masakannya sayang tidak bagian puding yang lezat kata saudara saya yang kebetulan dia sudah makan,KOMPETITOR,Bintang 3,HotelDafamFortunaSeturan-Yogyakarta,positive,Pelayanan Staf & Keramahan
Nurlely Nita,2019,5,hotelnya murah tapi tidak murah buat yang lagi kejogja mau menginap dengan harga saat dikantong tapi fasilitasnya lengkap bisa kesimi nyaman strategis ada dipinggir tempatnya banyak banget spot2 untuk foto kolam renangnya enak banget udaranya bersih tempat mandinya bersih pelayananya ramah2 baik2 banget tidak nyesel pokoknya atau juga yang lagi di jogja cuman mau berenang2 bisa kesini juga biayanya kalau tidak salah 15rb dengan syarat mesen makan minum disana oke banget pokoknya,KOMPETITOR,Bintang 3,HotelDafamFortunaSeturan-Yogyakarta,positive,Kebersihan & Kenyamanan Kamar
Deva Arrum,2024,5,Tidak hanya untuk beristirahat hotel dafam seturan yogyakarta juga sangat rekomendasi untuk menyegarkan tempat strategis fasilitas oke serta semua staf yang ramah selain itu juga cocok untuk berlibur bersama keluarga khususnya yang membawa anak anak karena adanya minizoo dan taman bermain yang sangat bagus berikutnya kesini lagii,KOMPETITOR,Bintang 3,HotelDafamFortunaSeturan-Yogyakarta,positive,Pelayanan Staf & Keramahan
vuni etavv,2024,2,Overpriced untuk hotel hrg 900rb fasilitas dan kamar sprt 500rb kecil sekali ternyata bfast standard dan kurang bisa d makan sama anak balita waktu musim tinggi berdumpel banget kyk pasar skuter pinjem doang dari lobi ke kamar cmn gratis 1x padahal menginap 2 malam disini wahana lain sprt kereta kuda kasih makan bintang berbayar tidak ada yang gratis sampai pinjam pelampung juga bayar ya,KOMPETITOR,Bintang 3,HotelDafamFortunaSeturan-Yogyakarta,negative,Harga & Value for Money
Anitaa Mahajaya,2019,2,kami sekeluarga menginap di kamar suite pada mlm natal kamarnya sangat besar dan bersih tapi tidak lengkap seperti 1 tidak ada pengering rambut 2 plastik cuci pakaian tidak ada 3 tisu roll diwc tidak ada 4 petunjuk saluran tv 5 kran pada mandi rusak tidak sebanding hrga yang jam kami byr mahal untuk tipe kamar suite sangat menyayangkan kami kecewa,KOMPETITOR,Bintang 3,HotelDafamFortunaSeturan-Yogyakarta,negative,Kebersihan & Kenyamanan Kamar
ayuningtyas kusumastuti,2020,4,kolam renangnya nyaman cukup luas mungkin kedalaman maks sekitar 18 tidak terlalu ramai di pagi dan siang hari tapi mungkin ramai saat liburan karena banyak tamu hotel ada bar di bagian pojok bisa ada diskon dengan keanggotaan jtc,KOMPETITOR,Bintang 3,HotelDafamFortunaSeturan-Yogyakarta,positive,Fasilitas Hotel (Kolam/Gym/Spa)
Muhammad Targiono,2018,5,hotel dafam seturan parkir motornya muat banyak mobil juga ada halaman luas di bagian utara untuk parkir bis besar kebersihan hotel bagus dan pelayanan staf juga ramah informasi yang diberikan juga sangat membantu terbaik lah untuk kamar juga perabot nya masih bagus bersih juga koneksi wifi ada di mana mana mana sangat membantu jika sinyal operator sedang tidak bisa diharapkan ada sarapan juga dengan menu yang cukup bervariasi ada soto bubur dan ada makanan berat seperti nasi goreng dan lauk pauknya ada buah dan roti juga yang paling banyak ada kolamnya dan ada spot enak yang bagus instagram dapat membuat foto di bawah air serasa di air terbaik ornamen hotel juga kekinian,KOMPETITOR,Bintang 3,HotelDafamFortunaSeturan-Yogyakarta,positive,Kebersihan & Kenyamanan Kamar
tri dwi astuti,2022,4,kamar bersih pintu balkon tidak bisa dibuka fasilitas baik tapi tapi tapi tapi tapi tapi tapi tapi jika uangnya mendadak dan menginapnya malam minggu siap2 harganya berlipat tiga kali hehehehehe harga normal 500rb ini tadi hampir 15 besok2 berlipatnya jangan banyak2 ya,KOMPETITOR,Bintang 3,HotelDafamFortunaSeturan-Yogyakarta,negative,Kebersihan & Kenyamanan Kamar
Syukron Wahyudi,2021,4,hotel yang bagus bersih nyaman yang berada di utara jogja kamar tidak begitu besar tapi nyaman dan bersih ada balkoninya cocok bagi perokok serasa area merokok parkiriran cukup baik untuk mobil ataupun motor mau ke bandara adi sucipto hartono mall atau ambarukmo plaza tidak begitu jauh,KOMPETITOR,Bintang 3,HotelDafamFortunaSeturan-Yogyakarta,positive,Kebersihan & Kenyamanan Kamar
