User Name,Review Time,Rating,clean_text,Tipe,Kelas,Nama_Hotel,AI_Sentiment,AI_Aspek
Choirunnisa Ihsan,2023,4,resto canting emg enak banget 3 buka puasa disini selama ramadhan 2022,KOMPETITOR,Bintang 3,HoteldafamPekalongan,positive,Kualitas Makanan & Restoran
Heri Girsang,2017,4,penyambutan yang ramah tempat nya nyaman kolam renang nya bersih makanan nya enak agak berisik d malam hari,KOMPETITOR,Bintang 3,HoteldafamPekalongan,positive,Kebersihan & Kenyamanan Kamar
rizki wijayanti,2020,5,Hotel nyaman ad kolam renang wifi lancar tempat strategis depan transmart,KOMPETITOR,Bintang 3,HoteldafamPekalongan,positive,Lokasi & Akses Strategis
Gina Airinda,2020,5,fasilitas lengkap mudah cek masuk dan keluar banyak yang jual makan di sekitar hotel,KOMPETITOR,Bintang 3,HoteldafamPekalongan,positive,Lokasi & Akses Strategis
Warsuwan Warsuwan,2024,3,lokasi tengah kota deket transmart kamar bagus makanan juga enak,KOMPETITOR,Bintang 3,HoteldafamPekalongan,positive,Kualitas Makanan & Restoran
Abdur Rozaq,2020,5,angkat nya enak hotelnya bersih nyaman cman bau toiletnya menyengat,KOMPETITOR,Bintang 3,HoteldafamPekalongan,positive,Kebersihan & Kenyamanan Kamar
Arief Prasetiyo,2024,4,tembok kamar kucing nya rusak pegangan keran mandi lepas,KOMPETITOR,Bintang 3,HoteldafamPekalongan,negative,Kebersihan & Kenyamanan Kamar
Patricia Diah,2019,5,bersih kolam renag bersih makanan enak cr makan mudah saya rekomendasikan untuk keluarga,KOMPETITOR,Bintang 3,HoteldafamPekalongan,positive,Kualitas Makanan & Restoran
Heru Djatmika,2023,4,Tempat strategis dpn transmart tempat nyaman pelayanan oke,KOMPETITOR,Bintang 3,HoteldafamPekalongan,positive,Lokasi & Akses Strategis
Naisah Pkl,2020,5,Pelayanan ramah dan ada wifi gratisnya terima kasih hotel dafam,KOMPETITOR,Bintang 3,HoteldafamPekalongan,positive,Pelayanan Staf & Keramahan
Rafa Ardi Kids,2021,4,bagus letak strategis keamanan ditanya ruangan kurang respon,KOMPETITOR,Bintang 3,HoteldafamPekalongan,positive,Lokasi & Akses Strategis
King Andy,2019,5,kamar nya bagus fasilitasnya lumayan lengkap dan pelayanannya juga memuaskan,KOMPETITOR,Bintang 3,HoteldafamPekalongan,positive,Kebersihan & Kenyamanan Kamar
Fathoni Abdul Rozak,2019,5,pengalaman menginap pertama di sini pelayanan sangat baik dan ramah terima kasih dafam,KOMPETITOR,Bintang 3,HoteldafamPekalongan,positive,Pelayanan Staf & Keramahan
Teguh HS,2022,3,Pelayanan kurang ramah sarapan terlambat sampai jam 8,KOMPETITOR,Bintang 3,HoteldafamPekalongan,negative,Kualitas Makanan & Restoran
buded212,2023,4,lokasi strategis berhadapan dengan pusat perbelanjaan,KOMPETITOR,Bintang 3,HoteldafamPekalongan,positive,Lokasi & Akses Strategis
Tukang Kesle,2020,5,letak strategis pelayanan ramah fasilitas komplit parkir luas bersih,KOMPETITOR,Bintang 3,HoteldafamPekalongan,positive,Lokasi & Akses Strategis
Bidan Ernawati Budi Rahardjo,2022,5,seminar bidan delima sekalian mo indent kamar yang promo buat medis tolong dipermudah,KOMPETITOR,Bintang 3,HoteldafamPekalongan,neutral,Pelayanan Staf & Keramahan
Lentera Abadi,2022,4,bagus banget tapi sayangnya tidak ada musholla yang nyaman,KOMPETITOR,Bintang 3,HoteldafamPekalongan,positive,Harga & Value for Money
johan to,2020,5,Setelah transmart resmi beroprasi mungkin hotel dafam bakal ramai pelanggan,KOMPETITOR,Bintang 3,HoteldafamPekalongan,neutral,Harga & Value for Money
Salman Alfaris,2020,5,nyaman sangat nyaman dekat dengan kota jadi lebih mudah diaksesnya,KOMPETITOR,Bintang 3,HoteldafamPekalongan,positive,Lokasi & Akses Strategis
Nur Agni Rulliyatna,2023,3,rata-rata tidak sangat istimewa tapi itu oke untung lokasi depan mall transmart pekalongan,KOMPETITOR,Bintang 3,HoteldafamPekalongan,positive,Lokasi & Akses Strategis
Irun Addakhil,2025,4,Pelayanan bagus ada aula untuk pertemuan,KOMPETITOR,Bintang 3,HoteldafamPekalongan,positive,Harga & Value for Money
Sugeng Item,2023,5,nyaman bersih akses ke mall juga tinggal jalan kaki,KOMPETITOR,Bintang 3,HoteldafamPekalongan,positive,Lokasi & Akses Strategis
agung tri basuki,2018,5,Harga kamar lumayan terjangkau untuk hotel sekelas dafam,KOMPETITOR,Bintang 3,HoteldafamPekalongan,positive,Harga & Value for Money
Abdul Aziz Ahwan,2018,5,Pertama masuk ke hotel ini saat acara seminar tak disangka fasilitasnya begitu berkelas,KOMPETITOR,Bintang 3,HoteldafamPekalongan,positive,Harga & Value for Money
Firmanbakale Utina,2024,5,keren hotelnya tampak dari luar dalemnya jg keren,KOMPETITOR,Bintang 3,HoteldafamPekalongan,positive,Lokasi & Akses Strategis
Indonesian Felix,2023,5,Pelayanan bagus makanan lumayan dan stafnya ramah ramah,KOMPETITOR,Bintang 3,HoteldafamPekalongan,positive,Pelayanan Staf & Keramahan
Teguh Iman Santoso,2019,4,lokasi strategis dekat pusat kota ballroom cocok untuk acara pertemuan pertemuan,KOMPETITOR,Bintang 3,HoteldafamPekalongan,positive,Lokasi & Akses Strategis
Islamawan,2021,4,harga 420 standar lokasi dkt kota kamar nyaman masakan standar,KOMPETITOR,Bintang 3,HoteldafamPekalongan,positive,Kebersihan & Kenyamanan Kamar
andi triyanto,2024,5,suasana hotel yang nyaman banget,KOMPETITOR,Bintang 3,HoteldafamPekalongan,positive,Kebersihan & Kenyamanan Kamar
Kamaliyatul Badar,2023,5,nyaman kpn2 nich dpt endorsnya biar bisa ngerasain tidur didafam,KOMPETITOR,Bintang 3,HoteldafamPekalongan,positive,Kebersihan & Kenyamanan Kamar
Muhammad Iqbal,2019,5,Hotel nya nyaman deket sama tempat jogging pokoke mantablahh,KOMPETITOR,Bintang 3,HoteldafamPekalongan,positive,Lokasi & Akses Strategis
Sizuka 27,2019,5,bersih ramah elegan sayang masakan kurang saat untuk lidah saya,KOMPETITOR,Bintang 3,HoteldafamPekalongan,positive,Kebersihan & Kenyamanan Kamar
Ika Yunita,2022,5,ruang rapat luas dan nyaman merapkan kondisi pada saat ini sesuai prokes,KOMPETITOR,Bintang 3,HoteldafamPekalongan,positive,Kebersihan & Kenyamanan Kamar
Nijam 21,2024,4,Tapi wifi ya tolong didekati atau di tambah di lantai 8 yang depan ngak dapet,KOMPETITOR,Bintang 3,HoteldafamPekalongan,negative,Infrastruktur (AC/WiFi/Parkir/Air)
UTA mi,2022,4,hotel nyaman pelayanan baik sarapan standar bakal jadi hotel langganan kalau ke pekalongan,KOMPETITOR,Bintang 3,HoteldafamPekalongan,positive,Kualitas Makanan & Restoran
Raka Kara,2019,5,kamar bagus pelayanan terbaik dan makanan nya enak enak memuaskan deh,KOMPETITOR,Bintang 3,HoteldafamPekalongan,positive,Kebersihan & Kenyamanan Kamar
Imam Hendra,2023,4,Sudah beberapa kali menginap di sini dan cocok untuk kembali sangat,KOMPETITOR,Bintang 3,HoteldafamPekalongan,positive,Harga & Value for Money
Teuku miko,2025,4,depan transmart lokasi strategis cocok buat tempat singgah,KOMPETITOR,Bintang 3,HoteldafamPekalongan,positive,Lokasi & Akses Strategis
Aqila Khanza,2022,3,Istri di lantai 8 parah kalau kamarnya sih bersih,KOMPETITOR,Bintang 3,HoteldafamPekalongan,negative,Kebersihan & Kenyamanan Kamar
Muhammad Nasta'in,2022,5,petugas menerapkan prokes makanannya enak pelayanannya prima,KOMPETITOR,Bintang 3,HoteldafamPekalongan,positive,Kualitas Makanan & Restoran
Vijay Suropati,2022,4,bagus staf nya ramah makanan enak kalau ke pekalongan lagi pasti kesana lagi,KOMPETITOR,Bintang 3,HoteldafamPekalongan,positive,Pelayanan Staf & Keramahan
Afri jenner,2021,5,cocok untuk acara pertemuan atau untuk acara indoor tempatnya nyaman pelayanan baik,KOMPETITOR,Bintang 3,HoteldafamPekalongan,positive,Harga & Value for Money
hendri yanto,2020,5,tempat nyaman harga paket sewa buat acara paling murah,KOMPETITOR,Bintang 3,HoteldafamPekalongan,positive,Harga & Value for Money
doel Fattah,2019,5,Lokasinya masih di dalam kota tapi agak pinggir jadi lumayan nyaman untuk beristirahat,KOMPETITOR,Bintang 3,HoteldafamPekalongan,positive,Lokasi & Akses Strategis
Guntur Budi Utomo,2023,3,Tempat dan pelayanam bagus tempat buat meeting room juga nyamam,KOMPETITOR,Bintang 3,HoteldafamPekalongan,positive,Kebersihan & Kenyamanan Kamar
Cokomama,2020,1,Ngisep koneksi internet di sebelah gw mending tidak usah ada ni hotel ganggu banget,KOMPETITOR,Bintang 3,HoteldafamPekalongan,negative,Lokasi & Akses Strategis
heri iswanto,2023,5,kamar bersih layanan baik sekali menyenangkan,KOMPETITOR,Bintang 3,HoteldafamPekalongan,positive,Kebersihan & Kenyamanan Kamar
Fariz _ATD,2021,5,nyaman banget bersih dianjurkan buat kegiatan ulang tahun,KOMPETITOR,Bintang 3,HoteldafamPekalongan,positive,Kebersihan & Kenyamanan Kamar
Siti Isti,2024,5,View pagi hari dari kamar sebrangnya saat transmart,KOMPETITOR,Bintang 3,HoteldafamPekalongan,neutral,Lokasi & Akses Strategis
Alimuddin Hasansyah,2022,4,Meskipun hotel ini bukan kota besar tapi tempat bagus dan untuk pekerjanya sopan dan ramah,KOMPETITOR,Bintang 3,HoteldafamPekalongan,positive,Pelayanan Staf & Keramahan
adhi nc,2021,5,bagus dan lumayan strategis di depan mall baru transmart harga juga layak,KOMPETITOR,Bintang 3,HoteldafamPekalongan,positive,Lokasi & Akses Strategis
Fisika dan Kehidupan,2020,4,bagus nginap 1 malam kehabisan kamar diberi kamar merokok yang sebelumnya pencucian tidak merokok,KOMPETITOR,Bintang 3,HoteldafamPekalongan,positive,Kebersihan & Kenyamanan Kamar
Hilda Dafa,2020,5,tempat yang nyaman semuanya ada disini makanannya pun enak nan sedap,KOMPETITOR,Bintang 3,HoteldafamPekalongan,positive,Kualitas Makanan & Restoran
iriyanto,2022,4,hotel yang sudah menerapkan standar protokoler kesehatan di masa pandemi,KOMPETITOR,Bintang 3,HoteldafamPekalongan,neutral,Kebersihan & Kenyamanan Kamar
Dedi Setiyanto,2022,5,ramah pelayanannya kamar luas bagus dan bersih,KOMPETITOR,Bintang 3,HoteldafamPekalongan,positive,Kebersihan & Kenyamanan Kamar
ZraIlyas,2020,5,pelayanannya ramah dan sangat memuaskan fasilitas yang lengkap dekat dengan transmart,KOMPETITOR,Bintang 3,HoteldafamPekalongan,positive,Pelayanan Staf & Keramahan
mario anggito,2018,5,hotel bagus nyaman untuk harga murah sesuai dengan fasilitas yang dapat,KOMPETITOR,Bintang 3,HoteldafamPekalongan,positive,Harga & Value for Money
solidchip,2019,4,makanannya enak ada kolam renangnya kamarnya terlalu kecil untuk bertiga,KOMPETITOR,Bintang 3,HoteldafamPekalongan,positive,Kualitas Makanan & Restoran
Mochhisyam Habybi,2020,5,Untuk kunjungan jenderal kemarin sangat memuaskan dan megah makananannya enak2 good job,KOMPETITOR,Bintang 3,HoteldafamPekalongan,positive,Kualitas Makanan & Restoran
Muhammad Khairil Anam,2022,5,Sangat dianjurkan buat orang yang mau menginap di hotel ini,KOMPETITOR,Bintang 3,HoteldafamPekalongan,positive,Harga & Value for Money
fks bianca (friz),2020,4,tempat strategis dipinggir jalan raya tarif terjangkau pelayanan baik,KOMPETITOR,Bintang 3,HoteldafamPekalongan,positive,Lokasi & Akses Strategis
SUNARTO,2022,3,Ruang pertemuannya cukup untuk kegiatan skala 100 orang,KOMPETITOR,Bintang 3,HoteldafamPekalongan,positive,Harga & Value for Money
Tantri Anggraeni,2019,5,Hotel nya bersih poolnya bersih stafnya ramah kamarnya nyaman aku akan kembali pasti,KOMPETITOR,Bintang 3,HoteldafamPekalongan,positive,Kebersihan & Kenyamanan Kamar
NOOB PLAYER,2019,5,bangunan baru sudah terliat pada mleker hati2 kalau ada gunangan,KOMPETITOR,Bintang 3,HoteldafamPekalongan,negative,Harga & Value for Money
Disma Purnama,2019,4,hotel cukup representatif untuk kegiatan skala kecil parkir kurang luas,KOMPETITOR,Bintang 3,HoteldafamPekalongan,positive,Infrastruktur (AC/WiFi/Parkir/Air)
hendr aa,2024,5,Kalau mau ke Transmart bisa jalan kaki saja strategis,KOMPETITOR,Bintang 3,HoteldafamPekalongan,positive,Lokasi & Akses Strategis
Raditya Rangga B.P.,2018,5,tempat sangat bersih pegawai hotelnya sangat ramah pelayanan istimewa,KOMPETITOR,Bintang 3,HoteldafamPekalongan,positive,Pelayanan Staf & Keramahan
Budi Santoso,2023,5,nyaman hotelnya lokasi dekat mall,KOMPETITOR,Bintang 3,HoteldafamPekalongan,positive,Lokasi & Akses Strategis
Afibal Family,2025,4,tempatnya strategis dalam kota,KOMPETITOR,Bintang 3,HoteldafamPekalongan,positive,Lokasi & Akses Strategis
Arif syuhron syafi,2019,4,Tempatnya strategis dan tepat di depannya sedang di bangun sebuah mall ternama,KOMPETITOR,Bintang 3,HoteldafamPekalongan,positive,Lokasi & Akses Strategis
M Ainurrifqi Zidan,2020,5,Sangat nyaman tempatnya sangat bersih dan pegawainya sangaat bersahabat,KOMPETITOR,Bintang 3,HoteldafamPekalongan,positive,Kebersihan & Kenyamanan Kamar
Johan Gunawan,2019,5,hotelnya bersih kamar nya nyaman ruang pertemuan yang nyaman,KOMPETITOR,Bintang 3,HoteldafamPekalongan,positive,Kebersihan & Kenyamanan Kamar
Muhamad Akbar,2024,5,Baguss nyaman senang dah pokoknya,KOMPETITOR,Bintang 3,HoteldafamPekalongan,positive,Kebersihan & Kenyamanan Kamar
Devita Iskandar,2020,5,Bagus berikutnya klo ke pekalongan akan tinggal di sini hotel bersih staf ramah semua oke deh,KOMPETITOR,Bintang 3,HoteldafamPekalongan,positive,Pelayanan Staf & Keramahan
Hendry Petro,2020,5,nyaman dan sangat sangat dkt dengan trans mart pekalongan hadap2an,KOMPETITOR,Bintang 3,HoteldafamPekalongan,positive,Lokasi & Akses Strategis
Mahfud Jumawan,2019,4,fasilitas oke pelayanan oke cuma parkir kurang luas untuk penyelenggaraan acara,KOMPETITOR,Bintang 3,HoteldafamPekalongan,positive,Infrastruktur (AC/WiFi/Parkir/Air)
Javanese Vacation Yogyakarta,2025,1,Aku tidak dingin,KOMPETITOR,Bintang 3,HoteldafamPekalongan,negative,Harga & Value for Money
Sofia Nabila,2019,5,buka puasa di sini masakan enak dengan bbrp menu varian harga bersahabat,KOMPETITOR,Bintang 3,HoteldafamPekalongan,positive,Kualitas Makanan & Restoran
M FAQIH NADHIM,2023,4,Nyenyak itu kata pertama yang saya bagikan untuk pengalaman semalam di hotel ini,KOMPETITOR,Bintang 3,HoteldafamPekalongan,positive,Harga & Value for Money
"Andi SH,MH, Mediator",2024,5,kamar oke pelayan bagus lokasi strategis,KOMPETITOR,Bintang 3,HoteldafamPekalongan,positive,Lokasi & Akses Strategis
ramadhian adam,2018,5,Hotel ini luar biasa nyaman untuk anda yang berpergian untuk bisnis,KOMPETITOR,Bintang 3,HoteldafamPekalongan,positive,Harga & Value for Money
iva Sari,2019,4,bagus merekomendasikan dech sayang musholla deket parkiran jasi panas,KOMPETITOR,Bintang 3,HoteldafamPekalongan,positive,Lokasi & Akses Strategis
Annys Nisa,2018,3,tempat tidur tambahan nya tidak nyaman sejauh ini yang lain lumayan,KOMPETITOR,Bintang 3,HoteldafamPekalongan,negative,Harga & Value for Money
antono pasti,2018,4,pelayanannya ramah sarana prasarananya memadai tempatnya bersih oke,KOMPETITOR,Bintang 3,HoteldafamPekalongan,positive,Pelayanan Staf & Keramahan
Iqbal Prasetiawan,2022,5,tempatnya oke kamar bersih pelayanan ramah,KOMPETITOR,Bintang 3,HoteldafamPekalongan,positive,Kebersihan & Kenyamanan Kamar
WAHYU TOTO,2020,5,Pelayanan nya bagus ramah n nyaman malam nya jalan2 ke transmart,KOMPETITOR,Bintang 3,HoteldafamPekalongan,positive,Kebersihan & Kenyamanan Kamar
Ikhwan Kurnia,2018,5,bersih sarapannya mantaap pegawai hoellnya ramah2,KOMPETITOR,Bintang 3,HoteldafamPekalongan,positive,Pelayanan Staf & Keramahan
Halim Budianto,2018,4,Cukup bagus dengan kolam renang ruang pertemuan dan lobi yang baik,KOMPETITOR,Bintang 3,HoteldafamPekalongan,positive,Fasilitas Hotel (Kolam/Gym/Spa)
Fotopoto ayik,2023,5,Selalu ada pengalaman menarik ketika berkunjung ke hotel oleh Dafam,KOMPETITOR,Bintang 3,HoteldafamPekalongan,positive,Harga & Value for Money
Agus Eko Saptono,2022,5,keren n mantap hotel kayak gini ada di pekalongan dpnnya transmart lg,KOMPETITOR,Bintang 3,HoteldafamPekalongan,positive,Lokasi & Akses Strategis
opicx mgc,2020,5,hotel nyaman bersih petugasnya ramah dekat lokasi belanja,KOMPETITOR,Bintang 3,HoteldafamPekalongan,positive,Kebersihan & Kenyamanan Kamar
Rifki Danu,2019,5,nyaman makanannya enak harga relatif terjangkau,KOMPETITOR,Bintang 3,HoteldafamPekalongan,positive,Kebersihan & Kenyamanan Kamar
Anis Rosa,2020,5,fasilitas bagus tapi sayangnya kolam renangnya terlalu banyak kaporit,KOMPETITOR,Bintang 3,HoteldafamPekalongan,positive,Infrastruktur (AC/WiFi/Parkir/Air)
Herizal Herizal,2023,5,hotel yang dekat dengan transmart tinggal di nyebrang jalan sudah bisa ke mall,KOMPETITOR,Bintang 3,HoteldafamPekalongan,positive,Lokasi & Akses Strategis
Siti Rh,2021,3,Diundang makan di restorannya sepi sekali dan kurang enak makanannya siih,KOMPETITOR,Bintang 3,HoteldafamPekalongan,negative,Kualitas Makanan & Restoran
muhammad rifqiyani,2018,3,Tempat parkirnya kecil kalau ada acara parkirnya di carrefour depannya hotel dafam,KOMPETITOR,Bintang 3,HoteldafamPekalongan,positive,Infrastruktur (AC/WiFi/Parkir/Air)
Noorma Yulia,2022,5,kamarnya bersih dan nyaman pelayanan ramah,KOMPETITOR,Bintang 3,HoteldafamPekalongan,positive,Kebersihan & Kenyamanan Kamar
edwin keano,2023,5,untuk sarapan kurang mantaapp kurang variasi standar saja,KOMPETITOR,Bintang 3,HoteldafamPekalongan,negative,Kualitas Makanan & Restoran
Budi Lestariyo,2021,4,cukup enak lokasinya dekat dengan berbagai kebutuhan di kota pekalongan,KOMPETITOR,Bintang 3,HoteldafamPekalongan,positive,Lokasi & Akses Strategis
Herawati Wicaksono,2020,5,Pelayanan oke semua ramah ruang layanan siip apik wes,KOMPETITOR,Bintang 3,HoteldafamPekalongan,positive,Kebersihan & Kenyamanan Kamar
Didit Eko Yulianto,2021,3,musim pandemi banyak hotel yang berantakan lesu semoga cepat berakhir,KOMPETITOR,Bintang 3,HoteldafamPekalongan,negative,Harga & Value for Money
second thriftsurakarta,2024,1,pesanan lain ke kamar itu bagian dari layanan hotel ya tolong ingat,KOMPETITOR,Bintang 3,HoteldafamPekalongan,neutral,Harga & Value for Money
Muchammad Lukman,2024,5,lokasi strategis nyaman dan ramah pelayanan,KOMPETITOR,Bintang 3,HoteldafamPekalongan,positive,Lokasi & Akses Strategis
Agus Purnomo,2019,3,lumayan seperti anggaran hotel pada umumnya,KOMPETITOR,Bintang 3,HoteldafamPekalongan,positive,Harga & Value for Money
Budi Hartoko,2018,3,Hotel bagus di kota tengah salam buat pak dahlan sukses,KOMPETITOR,Bintang 3,HoteldafamPekalongan,positive,Lokasi & Akses Strategis
Muhammad Hanafi,2022,4,menginap semalam di hotel ini untuk perjalanan dinas cukup baik,KOMPETITOR,Bintang 3,HoteldafamPekalongan,positive,Harga & Value for Money
Heny Ayuning Tyas,2019,5,Tidak sia2 perjalanan jauh ternyata hotelnya memuaskan,KOMPETITOR,Bintang 3,HoteldafamPekalongan,positive,Harga & Value for Money
Ida Murniati,2018,3,Secara keseluruhan oke cuma ac nya yang agak berisik,KOMPETITOR,Bintang 3,HoteldafamPekalongan,negative,Harga & Value for Money
budi wasono,2020,5,hotelnya nyaman pelayanan ramah tempatnya strategis,KOMPETITOR,Bintang 3,HoteldafamPekalongan,positive,Lokasi & Akses Strategis
kuli Jongoss,2020,5,lokasi strategis pelayanan ramah kamar bersih nyaman,KOMPETITOR,Bintang 3,HoteldafamPekalongan,positive,Kebersihan & Kenyamanan Kamar
TARMA ABDULMANAN,2018,4,nyaman dan bersih kolam renangnya jangan banyak kaporit,KOMPETITOR,Bintang 3,HoteldafamPekalongan,positive,Fasilitas Hotel (Kolam/Gym/Spa)
Nokrin Bigri,2020,5,hotel dafam salah satu hotel di kota pekalongan terletak didepan transmart pekalongan hotelnya sangat nyaman dan harga terjangkau,KOMPETITOR,Bintang 3,HoteldafamPekalongan,positive,Harga & Value for Money
Vitha Kitty,2020,3,resepsionis nya lemot dan kog ad tikus nya lari di atap kamar,KOMPETITOR,Bintang 3,HoteldafamPekalongan,negative,Harga & Value for Money
Heri M,2022,5,hotel bagus untuk beristirahat makan pagi enak dan nyaman,KOMPETITOR,Bintang 3,HoteldafamPekalongan,positive,Kualitas Makanan & Restoran
Sovia Mpii,2022,5,hotel nya nyaman ramah ramah sarapan nya juga enak enak,KOMPETITOR,Bintang 3,HoteldafamPekalongan,positive,Kebersihan & Kenyamanan Kamar
Achmad Zaenudin,2018,4,Hotel bintang 3 pertama di kota pekalongan bapak presiden sby sudah pernah menginap di sini,KOMPETITOR,Bintang 3,HoteldafamPekalongan,positive,Harga & Value for Money
りゅう,2019,5,nyaman bersih layaknya hotel bintang 5 lainnya,KOMPETITOR,Bintang 3,HoteldafamPekalongan,positive,Kebersihan & Kenyamanan Kamar
Desiana Setyawati,2017,5,kamarnya nyaman cuma sayang tidak ada kulkasnya,KOMPETITOR,Bintang 3,HoteldafamPekalongan,negative,Kebersihan & Kenyamanan Kamar
AB _Che,2020,4,oke tapi kurang nyaman dengan pedagang2 dindepan nya nuansa luxnya jadi hilang,KOMPETITOR,Bintang 3,HoteldafamPekalongan,negative,Harga & Value for Money
Sri Bintoro,2018,3,sarapan cukup enak dan beragam sprei sudah saatnya diganti,KOMPETITOR,Bintang 3,HoteldafamPekalongan,positive,Kebersihan & Kenyamanan Kamar
bee la,2018,4,bersih makanan lumayan enak wifi oke pelayanan ramah,KOMPETITOR,Bintang 3,HoteldafamPekalongan,positive,Kebersihan & Kenyamanan Kamar
PEJUANG ANTI WARISAN,2018,5,tempatnya bagus dan nyaman cocok juga buat pesta pernikahan,KOMPETITOR,Bintang 3,HoteldafamPekalongan,positive,Kebersihan & Kenyamanan Kamar
Tunjung Nugroho,2020,5,hotelnya cukup nyaman dan berada di dekat kota,KOMPETITOR,Bintang 3,HoteldafamPekalongan,positive,Lokasi & Akses Strategis
budi setiawan,2020,4,anggaran hotel yang cukup bagus namun parkir mobil terbatas,KOMPETITOR,Bintang 3,HoteldafamPekalongan,positive,Harga & Value for Money
Eza Maulana,2020,5,bersih ac dingin view nya oke layaknya itu lah,KOMPETITOR,Bintang 3,HoteldafamPekalongan,positive,Kebersihan & Kenyamanan Kamar
Alan Reynaldi Husain,2022,5,tempatnya bagus bersih pelayanannya ramah mantap pokoknya,KOMPETITOR,Bintang 3,HoteldafamPekalongan,positive,Kebersihan & Kenyamanan Kamar
maulana abul mikhnaf,2020,5,Menurut saya tidak ada hotel yang enak pelayanannya di kota pekalongan selain dafam pekalongan,KOMPETITOR,Bintang 3,HoteldafamPekalongan,negative,Lokasi & Akses Strategis
Dadang Wibowo,2023,5,nyaman pelayanan ramah kamar bagus,KOMPETITOR,Bintang 3,HoteldafamPekalongan,positive,Kebersihan & Kenyamanan Kamar
Tarjo Tarjo,2021,5,sederhana tempatnya enak suasana dan ruangannya nyaman,KOMPETITOR,Bintang 3,HoteldafamPekalongan,positive,Kebersihan & Kenyamanan Kamar
Zulhelmi,2019,5,tempat pertemuan dan pertemuan yang dapat diandalkan di kota pekalongan dengan menu dan pelayanan yang memuaskan,KOMPETITOR,Bintang 3,HoteldafamPekalongan,positive,Kualitas Makanan & Restoran
Shalahudin,2019,5,layanan untuk ruang pertemuan dan fasilitas yang bagus,KOMPETITOR,Bintang 3,HoteldafamPekalongan,positive,Harga & Value for Money
Dyas Widyasmoro,2023,4,Ruang pertemuannya cukup luas untuk kegiatan bintek,KOMPETITOR,Bintang 3,HoteldafamPekalongan,positive,Harga & Value for Money
Rocky Yoe Kamaludin,2019,5,mantap pelayanannya cuma menu makanannya itu itu saja,KOMPETITOR,Bintang 3,HoteldafamPekalongan,positive,Kualitas Makanan & Restoran
Arie Gonda,2019,5,Sangat merekomendasikan buat dijadikan tempat menginap di kota pekalongan,KOMPETITOR,Bintang 3,HoteldafamPekalongan,positive,Harga & Value for Money
Bayu Firdausi,2018,2,tempat kurang bersih pemeliharaan kurang suara ac keras handle kran lepas,KOMPETITOR,Bintang 3,HoteldafamPekalongan,negative,Infrastruktur (AC/WiFi/Parkir/Air)
Hengky k. Linggadjaja,2023,5,bagus cuma parkir mungkin agak ribet harus ke ruang bawah tanah,KOMPETITOR,Bintang 3,HoteldafamPekalongan,negative,Infrastruktur (AC/WiFi/Parkir/Air)
nokura ayin,2019,4,pesan kamar lewat aplikasi agoda booking com dll lebih murah daripada di tempat,KOMPETITOR,Bintang 3,HoteldafamPekalongan,positive,Harga & Value for Money
iin saniah,2020,3,tempat tidurnya sdah tdak bagus lagi sakit buat tidur sdah harus peremajaan,KOMPETITOR,Bintang 3,HoteldafamPekalongan,negative,Harga & Value for Money
Andie Herawandi (ATH),2018,5,tempat nya nyaman kopi nya nikmat tambah kolam renang nya juga nyaman,KOMPETITOR,Bintang 3,HoteldafamPekalongan,positive,Fasilitas Hotel (Kolam/Gym/Spa)
Faizal Faiz,2023,4,Hotelnya lumayan modern di Pekalongan depan hotel ada transmart,KOMPETITOR,Bintang 3,HoteldafamPekalongan,positive,Lokasi & Akses Strategis
Hana Fadilah,2019,5,buat bukber acara resmi ky seminar dll enk tempat ny,KOMPETITOR,Bintang 3,HoteldafamPekalongan,neutral,Lokasi & Akses Strategis
Lilis Andriana,2019,5,keamanan baik apa lagi yang namanya eko sudah ganteng baik ramah top lah,KOMPETITOR,Bintang 3,HoteldafamPekalongan,positive,Pelayanan Staf & Keramahan
manto priyatno,2020,5,sangat nyaman lokasinya berhadapan dengan pusat perbelanjaan,KOMPETITOR,Bintang 3,HoteldafamPekalongan,positive,Lokasi & Akses Strategis
Dennis Tri Hassapta,2019,1,menunggu check masuk dari jam 1 siang sampai jam setengah 3 sore,KOMPETITOR,Bintang 3,HoteldafamPekalongan,neutral,Lokasi & Akses Strategis
Hendhy Dwi,2021,5,hotel mantap bersih pelayanan oke banget,KOMPETITOR,Bintang 3,HoteldafamPekalongan,positive,Kebersihan & Kenyamanan Kamar
Mashadi Ghufron,2018,3,hotel yang nyaman tapi untuk stafnya kurang menjelaskan fasilitas yang ada dan bisa dinikmati mana yang gratis mana yang harus bayar,KOMPETITOR,Bintang 3,HoteldafamPekalongan,positive,Harga & Value for Money
Retno Joely,2025,3,kebersihan kurang maksimal fasilitas jg masih kurang,KOMPETITOR,Bintang 3,HoteldafamPekalongan,negative,Harga & Value for Money
davit swijety,2019,4,tempat istirahat bersama keluarga yang cukup nyaman dikota pekalongan,KOMPETITOR,Bintang 3,HoteldafamPekalongan,positive,Harga & Value for Money
Asyifa Taru,2025,5,kesini di ballroom hotel acara wisuda sma anak,KOMPETITOR,Bintang 3,HoteldafamPekalongan,neutral,Lokasi & Akses Strategis
Iin winardi,2019,5,makanan sarapannya enak sama kokam renang deket sama,KOMPETITOR,Bintang 3,HoteldafamPekalongan,positive,Fasilitas Hotel (Kolam/Gym/Spa)
Arif Maftuhin,2019,4,kamarnya lumayan bersih sarapan dengan menu yang cukup beragam,KOMPETITOR,Bintang 3,HoteldafamPekalongan,positive,Kebersihan & Kenyamanan Kamar
Soleh Rubiyanto,2023,3,Kamar perlu di perhatikan terutama ac nya,KOMPETITOR,Bintang 3,HoteldafamPekalongan,neutral,Kebersihan & Kenyamanan Kamar
sis wantoro,2019,5,hotel yang menyenangkan nyaman untuk anak maupun orang tua,KOMPETITOR,Bintang 3,HoteldafamPekalongan,positive,Harga & Value for Money
Dolly Nofer,2025,2,kurang baik,KOMPETITOR,Bintang 3,HoteldafamPekalongan,negative,Harga & Value for Money
Tri Wahyu,2022,3,strategis di kota dekat jalur pantura dan 4 km dari gt batang pekalongan,KOMPETITOR,Bintang 3,HoteldafamPekalongan,positive,Lokasi & Akses Strategis
Hisyam Emilio,2020,4,Pelayanan pelayan topp resepsionis kurang ramah nyaman,KOMPETITOR,Bintang 3,HoteldafamPekalongan,negative,Pelayanan Staf & Keramahan
