User Name,Review Time,Rating,clean_text,Tipe,Kelas,Nama_Hotel,AI_Sentiment,AI_Aspek
R. Kusumaningrum,2025,4,menyenangkan karena anak-anak bersahabat ada mini taman bermain yang luas daan lengkap scooter untuk anak2 buffet sarapan jika anak suka cokelat pancake marshmallow bisa sangat menarik kamar masih ada aroma kucing ada nyamuk dan tidak ada hiasan dinding jadi sepii mini bara jadi satu dengan kaca untuk berhias dan meja kerja jadi lebih baik dipisahkan staf ramah sayang tidak bisa dini cek masuk pdhl sudah info via wa dan cek masuk hotel jam 15.00 ini sangat sakit yaa karena cek keluar jam 12.00,KOMPETITOR,Bintang 3,HotelDafamFortunaSeturan-Yogyakarta,positive,Pelayanan Staf & Keramahan
Tyara Magda Amelia,2025,5,hotel sangat bersih pelayanan sangat baik,KOMPETITOR,Bintang 3,HotelDafamFortunaSeturan-Yogyakarta,positive,Kebersihan & Kenyamanan Kamar
Ivan Althirafi,2025,5,fortuna garden hotel tempat menginap yang nyaman dan anak-anak ramah banyak wahana bermain anak anak betah bermain di kolam renang dan area bermain yang luas fasilitasnya lengkap dan aman ada taman bermain dll,KOMPETITOR,Bintang 3,HotelDafamFortunaSeturan-Yogyakarta,positive,Fasilitas Hotel (Kolam/Gym/Spa)
Petualangan Mas Andri Andesgon,2025,5,pelayanan ramah bagian resepsionis sopan dan supel lobby bersih ada selamat minum 3 rasa yang baru desain lobby dan conter resepsionis sangat bagus tapi kursi tunggunya kurang banyak tapi tidak masalah ada kolam renang dan tempat bermain anak kamar tipe kamar anggaran bersih dan rapi televisi berfungsi kamar mandi dan wastafel bersih udara hangat bisa sabun odol pembersih telinga disediakan cabang disediakan hanger baju ada kopi dan teh tersedia tambah udara hangat sandal oke parkir tersedia lumayan luas angkat berfungsi dengan baik,KOMPETITOR,Bintang 3,HotelDafamFortunaSeturan-Yogyakarta,positive,Kebersihan & Kenyamanan Kamar
LNA,2025,4,Baru dpt hotel yang cek masuk baru d jam 15 00 rata2 jam 14 00 ya tapi c o nya ttp jam 12 00 tidak bisa telat cek keluar mana zoo sama taman bermain nya tutup jam 17 00 jadi bener2 mepet sama jam c i nya kolam renang udara dingin cukup besar staf baru ramah2 sepanjang jalan penuh sama kuliner dari kaki lima smp cafe2,KOMPETITOR,Bintang 3,HotelDafamFortunaSeturan-Yogyakarta,positive,Fasilitas Hotel (Kolam/Gym/Spa)
willyam chandra,2025,5,asli paling berharga untuk membuat anak2 yang paling saya suka adalah indoor kids playgroundnya bisa d mainkan sepuasnya sama anak2 di jamin anak2 tidak akan bosan imho hotel ini di rekomendasikan buat anak2 dengan umur 8 tahun kebawah jika kembali ke jogja saya akan kembali lagi dengan anak2 ke hotel ini,KOMPETITOR,Bintang 3,HotelDafamFortunaSeturan-Yogyakarta,positive,Lokasi & Akses Strategis
rini rusmalasari,2025,5,Hotel yang sangat ramah anak alhamdulillah bisa menginap di fortunagrande satpam sangat membantu resepsionis ramah dan sopan petugas kebersihan semua ramah hotelnya bersih dan lobbynya wangi enak pula dengan pesan kamar di sini sudah bisa akses gratis mini zoo kolam renang dan taman bermain jika anak mau naik kuda kena bayar lagi 20 ribu anak dijamin betah kemarin lumayan bagus twin room dengan harga 420 ribu,KOMPETITOR,Bintang 3,HotelDafamFortunaSeturan-Yogyakarta,positive,Kebersihan & Kenyamanan Kamar
Wahyu Suryaningsih,2025,3,makanan tidak ada rasa pilihan makanan sedikit dengan harga yang luamyana mahal,KOMPETITOR,Bintang 3,HotelDafamFortunaSeturan-Yogyakarta,negative,Harga & Value for Money
Lidya Yesi,2025,5,Pelayanan karyawan staf baik ramah cuma kurangnya di menu sarapan bubur ayamnya keasinan dan menuunya kurang variatif mungkin saat bulan puasa ini,KOMPETITOR,Bintang 3,HotelDafamFortunaSeturan-Yogyakarta,negative,Pelayanan Staf & Keramahan
Ummik Channel,2024,5,Saat datang saya bisa checkin awal karena kebetulan ada kamar yang sudah siap lebih awal kamar standar tapi cukup luas untuk keluarga ada udara panas fasilitas lengkap fasilitas hotel untuk anak2 sangat lengkap mulai dari kolam renang mini zoo bermain dalam ruangan yang luas dan nyaman ada juga kalau mau tambahan 3 wahana berbayar total 50rb berkuda gocart mini kereta api mini menu sarapan super lengkap buat anak2 mulai dari es krim katun manis popcorn marshmellow aneka jus aneka kue bubur manis tradisional mie rebus mie goreng omelet sushi ayam nasi segala rupa rupa lauk oiya kalau tidak bawa,KOMPETITOR,Bintang 3,HotelDafamFortunaSeturan-Yogyakarta,positive,Fasilitas Hotel (Kolam/Gym/Spa)
Adiansyah Awi,2025,5,hotel yang sangat dianjurkan buat keluarga ada taman bermain minizoo masih banyak permainan lainnya anak2 akan betah menginap di hotel ini kamar bersih staf staf ramah membantu pokoknya sangat cocok buat liburan keluarga,KOMPETITOR,Bintang 3,HotelDafamFortunaSeturan-Yogyakarta,positive,Kebersihan & Kenyamanan Kamar
Dewy Intan Wulandari,2025,5,tempatnya nyaman kamar walaupun agak sempit tapi masih nyaman sayangnya balkon nya pemandangannya tembok jadi kurang berfungsj banyak permainan anak2 yang seru2,KOMPETITOR,Bintang 3,HotelDafamFortunaSeturan-Yogyakarta,positive,Kebersihan & Kenyamanan Kamar
Isabella Sonya,2025,2,Staff nya semua sangat ramah kamarnya tidak kedap suara di lorong suara di kamar sebelah suara dari atas kamar semua terdengar sprei sarung bantal dan selimut warnanya sudah sangat kucel banyak gumpalan2 benang di kasurnya jadi di kulit terasa kasar dan gatal rasanya seperti menginap di hotel anggaran,KOMPETITOR,Bintang 3,HotelDafamFortunaSeturan-Yogyakarta,negative,Pelayanan Staf & Keramahan
Elsoraya Jauhara,2025,5,klo saya bilang hotel ini cocok banget tuk anak2 klo menginap d sini jangan usah ngajak anak2 jalan2 keluar lagi taman bermain anak2 ada semua permainan anak ada benar deh layanan nya bagus ramah anak2 ku pada betah klo nginep d sini,KOMPETITOR,Bintang 3,HotelDafamFortunaSeturan-Yogyakarta,positive,Lokasi & Akses Strategis
Adhitya Bela,2025,5,begitu masuk lobi harum lemongrass sangat terasa dan nyes banyak fasilitas untuk anak ada minizoo taman bermain kandyshop dan remote control apalagi kalau akhir pekan ada badut show wah luar biasa biasa karyawan ramah dan kamar bersih makanan uenak tidak nyesel nginep disini sukses fortuna grande seturan benar2 hotel sangat2 ramah anak,KOMPETITOR,Bintang 3,HotelDafamFortunaSeturan-Yogyakarta,positive,Kebersihan & Kenyamanan Kamar
della tiara,2025,5,bagus fasilitas untuk anak lengkap tapi sayangnya masih membayar lagi tidak termasuk harga cek masuk ban renang kaca mata renang jg sewa hanya kolam biasa tidak ada prosotan pegawainya ramah2 sopan kamar kamar anggaran kamar terlalu sempit lokasi kemana2 dekat warung resto toko baju dll tinggal jalan kaki,KOMPETITOR,Bintang 3,HotelDafamFortunaSeturan-Yogyakarta,positive,Kebersihan & Kenyamanan Kamar
Febri Danik,2025,5,hotel yang ramah anak kalau ke jogja wajib kesini bisa menghabiskan waktu bersama anak disini gk perlu susah ke tempat lain sudah semua masuk satu sini dari taman bermainnya hewannya lumayan lengkap permainan kereta gokart mini mainan pasir dan yang penting staf nya ruamahnya poll anaknya saja malah ngobrol sama petugas kebun binatang mengatakan hewannya ada candyshopnya kolam renang juga anak gk mau pulang,KOMPETITOR,Bintang 3,HotelDafamFortunaSeturan-Yogyakarta,positive,Pelayanan Staf & Keramahan
Suci Lintiasri,2025,5,Tempatnya menarik ada taman bermain anak2 sedikit kritik cek masuk jam 3 tapi baru dapet kamar jam 4 sarannya mohon dievaluasi kembali agar jam 3 semua kamar sudah siap karena rata2 hotel jam 2 sudah bisa cek masuk jam 3 seharusnya lebih siap,KOMPETITOR,Bintang 3,HotelDafamFortunaSeturan-Yogyakarta,positive,Fasilitas Hotel (Kolam/Gym/Spa)
Ahmad Izzuddin abduh,2024,3,anak-anak hotel ramah tapi jangan terlalu berharap tentang hotel ini pro 1 ada taman bermain anak yang cukup besar 2 mini zoo nya termasuk yang lengkap dan terawat kons 1 kolamnya cukup dalam dan sangat terbatas buat anak2 di bawah 5 thn 2 kamar cenderung kyk hotel anggaran 3 parkir terbatas di luar samping hotel 4 menu sarapan buffet cenderung pedas tidak cocok untuk anak kesimpulan saya hotel ini anak-anak ramah tapi yang tidak terlalu ramah anak konsepnya kurang total karena sepertinya ini hotel lama yang dirubah desain agar anak-anak ramah jadi beberapa fasilitas kurang anak-anak mesukan menu sarapan buffet untuk dasar nasi goreng dan protein hal yang sebaiknya,KOMPETITOR,Bintang 3,HotelDafamFortunaSeturan-Yogyakarta,positive,Fasilitas Hotel (Kolam/Gym/Spa)
yohana indri kusumaningrum,2025,5,hotel fortunagrande seturan pelayanan fasilitas super juos kamarnya super nyaman bersih para staf jg super ramaah dan sangat cocok bwt staycation sama anak2 karena taman bermain n mini zoo yang bikin anak2 tmbah bahagia akan berikutnya cb tipe super petualangan sukses selalu dab trimakasih fortunagrande seturan,KOMPETITOR,Bintang 3,HotelDafamFortunaSeturan-Yogyakarta,positive,Kebersihan & Kenyamanan Kamar
rini h,2025,5,begitu masuk lobi wangi lemongrass yang segar semua layanan ramah dari resepsionis smp mas2 di mini zoo kolam renang taman bermain pak satpam banyak fasilitas yang nyaman dan semuanya berfungsi dengan baik ada skoter juga dari lobi ke kamar jangan lupa bawa baju renang di kolam renang disewakan juga pelampung dan kacamata makanan lengkapnya dan enak enak anak cornernya lengkap malam di hotel atau hotel juga makan enak dan terjangkau,KOMPETITOR,Bintang 3,HotelDafamFortunaSeturan-Yogyakarta,positive,Pelayanan Staf & Keramahan
Habib burrahman,2025,5,untuk ke 2x nya liburan diyogyakarta dan nginap di hotel fortuna grande yogyakarta ini staf melayani dengan sangat baik dan ramah sarapan rasanya enak enak semua dan banyak sekali fasilitas untuk anak seperti welcome playground mini zoo playground permen toko remote control dan ditambah lagi ada acara badut bikin anak2 betah nginap di hotel ini hotel fortunagrande adalah pokoknya,KOMPETITOR,Bintang 3,HotelDafamFortunaSeturan-Yogyakarta,positive,Pelayanan Staf & Keramahan
Yulianto Tri Nugroho,2025,5,pertama kali menginap di fortunagrande disambut dengan senyum sikap ramah penangkap keamanan housekeeping para staf hotel dibalut aroma lemon tambah suasana hangat menyegarkan hal ini ditambah lagi dekorasi lobi yang cantik ergonomis menuju kamar melewati area kafe bermain remote control serta toko permen yang lucu menarik sebagai orang dewasa saja saya merasa suka apalagi anak2 d dan juga melewati kolam renang yang didesain kayak akuarium instagramable banget ditambah kolam ikan juga cek wahana ternyata sangat seru ada berkuda naik kereta naik Thomas naik naik naik kartu utama serta kura2 di minizoo,KOMPETITOR,Bintang 3,HotelDafamFortunaSeturan-Yogyakarta,positive,Pelayanan Staf & Keramahan
Rina Nadifa,2024,5,Saya sekeluarga menginap di kamar suite kamar luas ada balkon dengan pintu yang bisa dibuka jika ingin udara dari luar cocok untuk menginap bersama keluarga tinggal pesan tambahan tempat tidur kebersihan kamar bisa ditingkatkan kamar mandi cukup luas dengan bak mandi yang fasilitas estetik lengkap pengering rambut juga ada sarapan ada di resto lantai 2 makanan cukup bervariasi jika tinggal 2 3 hari ada kafe juga di lantai 1 dengan menu yang bervariasi dan harga relatif terjangkau layak mencoba mengangkat ada 2 dan cukup cepat parkir basement kurang memadai luasnya tapi parkir di luar ada kolam renang boleh dicoba bagian anak agak terlalu 80cm jadi kurang cocok untuk dalam,KOMPETITOR,Bintang 3,HotelDafamFortunaSeturan-Yogyakarta,positive,Kebersihan & Kenyamanan Kamar
Andy Forta,2025,5,hotel dengan konsep ramah anak ulasan menurut pribadi aku 1 hotelnya baik bersih 2 pelayanan juga baik semua dari staf sampai fasilitas 3 makanan sarapan juga enak 4 terdapat kafe bengkel untuk anak bermain ini yang disuka anak saya membekas di ingatannya ingin pergi lagi ke mini zoo kolam renang 5 dekat dari area jajanan kaki lima minusnya ac di kamar sempat bocor jam 10 malam tiba2 jaringan udara mereka tak coba matikan sampai pagi untungnya membantu sudah tidak jaringan mungkin bagian berikutnya tim pembersihan ac lebih fokus membersihkan terima kasih,KOMPETITOR,Bintang 3,HotelDafamFortunaSeturan-Yogyakarta,positive,Kebersihan & Kenyamanan Kamar
Weka Mas Gilang,2025,5,Halo kak pengalaman pertama menginap di hotel ini untuk layanan ramah2 setiap ruangan harum dan wangi untuk lokasi juga oke daerah seturan banyak makanan2 resto2 jadi tidak perlu bingung klo malam cari makan keluar klo pesen online juga aman byk pilihan yang deket2 ini hotel memang anak-anak sangat ramah anak tidak mau pulang betah semua wahana dicobain dan semua sarapan kesukaan anak dicobain taman bermain juga lengkap saran mini zoo tutup jam 17 00 tapi taman bermain fortuna sampai jam 20 00 kak cuman sygnya saya di kamar favorit anak-anak tinggal yang difoto itu saya lihat ada king bed dan ada bed kecil serta juga disamping dan ada,KOMPETITOR,Bintang 3,HotelDafamFortunaSeturan-Yogyakarta,positive,Kebersihan & Kenyamanan Kamar
Candra W,2025,5,Ada tambah minus di hotel ini tambah servisnya sangat bagus karena karyawannya sangat ramah2 di taman bermain anak2 di temani bermain untuk sarapannya sangat ramah anak-anak minususnya cek masuk harus jam 3 dan tidak ada telat cek keluar dan harga saat lebaran agak terlalu tinggi dibandingkan dengan fasilitasnya minus jam lain fasilitas tutupnya terlalu cepat jam 5 setelah jam 5 bingung mau ngapain,KOMPETITOR,Bintang 3,HotelDafamFortunaSeturan-Yogyakarta,positive,Pelayanan Staf & Keramahan
Achmad Syaroni Firmandani,2025,3,lokasi strategis banyak tempat makan di sekitar hotel terdapat taman bermain dan mini zoo untuk anak-anak restoran menyediakan cotton candy popcorn dan es krim yang menarik anak-anak minususnya fasilitas kamarnya terasa sangat dasar sekali dan tidak kedap suara menu sarapan tidak banyak pilihan dan parkir basement sangat sempit meskipun ada area parkir terbuka di sebelah hotel,KOMPETITOR,Bintang 3,HotelDafamFortunaSeturan-Yogyakarta,positive,Lokasi & Akses Strategis
Dwi Irawati,2025,5,hotel ramah anak dengan berbagai macam fasilitas yang memanjakan anak dimulai dari toko permen aktivitas mewarnai celengan ada koleksi hewan dan aktivitas naik kereta serta naik kuda selain itu juga ada taman bermain dan main pasir staf ramah dan sangat membantu hotelnya juga estetika,KOMPETITOR,Bintang 3,HotelDafamFortunaSeturan-Yogyakarta,positive,Pelayanan Staf & Keramahan
Dewi Anggraini,2025,5,kesekian kali setiap ke jogja menginap di sini pelayanan tetap seperti biasanya yang sangat ramah dan membantu fasilitas yang ternyata bertambah yaitu taman bermain selamat datang biar tidak bosan menunggu nya ada toko permen mini taman bermain nya juga gocart dimana lagi coba hotel dengan fasilitas lengkap dan anak-anak ramah selain disini tidak perlu menginap pasti disini harga segitu dengan fasilitas yang sangat lengkap sangat layaknya sangat lah pokoknya kamar yang sangat bersih dan berbagai macam tipe kamar yang banyak pilihan nya,KOMPETITOR,Bintang 3,HotelDafamFortunaSeturan-Yogyakarta,positive,Kebersihan & Kenyamanan Kamar
Fitria Agnes,2025,5,pengalaman buku disni hrg masih terjangkau varian makanannya banyak dan lumayan enak hanya saja tempat makanannya sangat sempit sekali aga ramai saat mendekati buka lalu lalang org bw makanan jam desak2an tapi secara keseluruhan fas hotelnya oke banget ada taman bermain anak dan mini zoo di resto ada menu anak dibwh ada toko permen dijamin anak2 betah deh,KOMPETITOR,Bintang 3,HotelDafamFortunaSeturan-Yogyakarta,positive,Kualitas Makanan & Restoran
AyuRizhani S,2025,3,hotel dengan konsep anak-anak bersahabat staf dan pelayanan bagus tapi lantai kamar mandinya licin banget tidak cocok buat anak kecil kemarin keluarga kami menginap disana sempat terjadi insiden adik saya terpeset dikamar mandi sma harus ke rumah sakit untung staf nya responsif terutama bpk keamanannya sangat membantu saat evakuasi dan bisa menyewa mimi n pipi saya agar tidak panik seperti buat bpknya,KOMPETITOR,Bintang 3,HotelDafamFortunaSeturan-Yogyakarta,positive,Pelayanan Staf & Keramahan
Doremi 08,2025,5,dianjurkan kalau ada bintang 6 saya kasih bintang 6 hotel dengan tingkat keramahan tertinggi dari resepsionis layanan pembersihan keamanan penjaga resto penjaga wahana anak dll kamar bersih makanan enak,KOMPETITOR,Bintang 3,HotelDafamFortunaSeturan-Yogyakarta,positive,Pelayanan Staf & Keramahan
Auliarahman Galang Feroma,2025,5,Hotel nyaman anak-anak ramah parkir tidak terlalu luas tapi cukup bersih banyak perjalanan untuk anak anak pengalaman menginap yang menyenangkan,KOMPETITOR,Bintang 3,HotelDafamFortunaSeturan-Yogyakarta,positive,Kebersihan & Kenyamanan Kamar
Ayu Hapsari,2025,5,Hotel anak-anak ramah dengan tarif kamar 500an ribu super duper layaknya sangat ya dengan fasilitas yang di dapat walopun berbayar untuk wahananya tapi itu baik-baik saja gk mahal kok suka banget semuanya kecuali kamar kamarnya superior tapi sempit banget kamar mandi gk ada kuncinya mandi ada hujan mandi jadi sulit buat wudhu sejauh puas banget sih bakal kembali menginap di sini lagi,KOMPETITOR,Bintang 3,HotelDafamFortunaSeturan-Yogyakarta,positive,Kebersihan & Kenyamanan Kamar
han gur,2024,2,hotel mengusung ramah anak ada taman bermain kolam renang dan mini zoo bisa beli makanan untuk kasih binatang dan sewa pelampung balon di kolam renang dengan harga 15rb sayangnya taman bermain hanya sampai jam 17 jam kolam renang sampai jam 18 jam dan kolam renang anaknya kecil bangett 3 anak berenang sudah sempitt yang aneh udara dingin banget hotelnya curang pesan kamar dengan ranjang double bed dikasihnya yang kembar disatukan jadi di tengah2nya ada jarak yang lumayan tinggal 4hari 3malam sarapan yang berubah dari mie jadi dua tahun lalu goreng sayur kacang jadi cap,KOMPETITOR,Bintang 3,HotelDafamFortunaSeturan-Yogyakarta,positive,Fasilitas Hotel (Kolam/Gym/Spa)
Wibi Suryaa,2025,5,jika anda sedang mencari hotel yang bagus dan anak-anak ramah untuk menginap maka hotel fortunagrande seturan adalah tempat yang tepat selain pelayanan yang diberikan oleh staf hotel sangat ramah dan profesional kamar juga sangat nyaman dan bersih fasilitasnya hotel juga sangat baik mulai dari kolam renang restoran minizoo hingga taman bermain yang sangat ramah bagi anak-anak,KOMPETITOR,Bintang 3,HotelDafamFortunaSeturan-Yogyakarta,positive,Kebersihan & Kenyamanan Kamar
puput fitriana dewi,2024,4,tambah hotel yang sangat ramah anak ada fasilitas kolam renang mini mini zoo playground mini park yang baru saja dibuka sarapan enak bermacam variasi ada anak sudut khusus cemilan anak termasuk arum manis letak di kota ac dingin udara lancar di musim kemarau ini ada alat elektronik ntah apa namanya buat menandai kamar biasanya di hotel lain pakai kartu tergantung di pintu ya ini lebih keren walopun fungsinya sama wkwk wifi berfungsi baik tv berfungsi minus parkir basement sempit adanya parkir samping gersang berdebu harga terlalu mahal apalagi akhir pekan ukuran kamar kecil sekali dibandingkan hotel dengan tarif lebih bersahabat kamar mandi tidak ada kunci lorong,KOMPETITOR,Bintang 3,HotelDafamFortunaSeturan-Yogyakarta,positive,Fasilitas Hotel (Kolam/Gym/Spa)
andriasbudi santoso,2025,4,pengalaman saya menginap di sini 1 hal positif staf ramah semua untuk anak kecil bisa dikatakan bagus karena ada taman taman binatang mini sedangkan untuk kolam renang kurang layaknya untuk anak kecil dibawah 7 kolamnya terlalu kecil makanan enak standar hotel cuman untuk sarapan kurang ada daging ikan secara keseluruhan oke 2 hal negatif kamar tidak kedap suara jadi berisik misalkan ada suara dari luar kamar seperti orang jalan bicara terdengar jelas kamar kurang bersih masih sedikit bau seperti pengab parkir terlalu kecil untuk yang bagian bawah tanah bau sampah serta terasa pengab tidak ada pusat kebugaran gym nb untuk harga hotel segitu menurut saya agak mahal,KOMPETITOR,Bintang 3,HotelDafamFortunaSeturan-Yogyakarta,negative,Kebersihan & Kenyamanan Kamar
aiuvi ___s,2025,4,lokasi 30 menit dari malioboro klo macet bisa 1 jam satu dpt kamar hari pertama bau kamar mandi seperti blowernya tidak berfungsi hari ke 2 sudah normal kolam renang di tengah gedung dalam dingin fasilitas lengkap banget taman bermain cafe anak mini zoo menu sarapan kesukaan bocil enak semua sempat antri karna akhir pekan meja full parkir di sebelah gedung minizoo keren banget tp harus beli voucher mlm hari ada acara badut lucu ada hadiah pintu keamanan staf gercep dan ramah,KOMPETITOR,Bintang 3,HotelDafamFortunaSeturan-Yogyakarta,positive,Pelayanan Staf & Keramahan
BY TRT,2025,5,Tempatnya sangat bagus dan cukup dekat untuk ke kota pelayanan sangat bagus untuk tipe kamar kamar petualangan sangat bagus ada wahana permainan dan untuk masukan tipe kamar tersebut agar bisa di peluncuran ke aplikasi online agar pembelian bisa secara langsung dan untuk kamarnya agar bisa di buat kedap suara soalnya banyak anak kecil yang bermain dan untuk makanan sangat banyak variasi nya dan anak-anak ramah cocok untuk anak kecil dan untuk wahana bermain sudah bagus dan kru wahana sangat membantu sekali sangat bagus sekali dan jika bisa untuk wahana bisa di tambahkan agar lebih bervariasi lagi terimakasih untuk kenyamanannya menginap di jogja dan sangat antusias sekali buat,KOMPETITOR,Bintang 3,HotelDafamFortunaSeturan-Yogyakarta,positive,Lokasi & Akses Strategis
Novika Nh,2024,5,kolam bersih dan penjaganya ramah kolam renang terbuka untuk umum biaya masuk 25k orang gratis bagi tamu yang menginap di hotel anak saya swasta les renang seminggu 1x disini ada juga paket 60k sudah bisa minum dan minum,KOMPETITOR,Bintang 3,HotelDafamFortunaSeturan-Yogyakarta,positive,Pelayanan Staf & Keramahan
agus nur rasid,2025,5,paket lengkap staycation bersama keluarga fasilitas yang memanjakan anak mulai dari fortunapark minizoo taman bermain hingga toko permen oiya setiap akhir pekan ada badut show yang seru,KOMPETITOR,Bintang 3,HotelDafamFortunaSeturan-Yogyakarta,positive,Fasilitas Hotel (Kolam/Gym/Spa)
Sandy Purwa,2025,5,menu sarapanya banyak pilihan apalagi bwt anak2 ada acara burukutnya juga dan anak2 senang sekali menginap disini,KOMPETITOR,Bintang 3,HotelDafamFortunaSeturan-Yogyakarta,positive,Kualitas Makanan & Restoran
Tetty Tresnawati,2025,5,tempatnya sangat strategis banyak pusat kuliner juga di sekitarnya hotel ini sangat nyaman dan ramah sekali untuk anak2 stafnya sangat ramah sekali tersenyum salam sapa anak2 sangat bahagia bisa main di taman bermain mini zoo dan wahana permainan lainnya terimakasih kepada mas dafa dan mas yang satu lagi saya lupa namanya sudah sangat ramah menemani anak2 bermain,KOMPETITOR,Bintang 3,HotelDafamFortunaSeturan-Yogyakarta,positive,Lokasi & Akses Strategis
Prasetyowati Zaskia,2025,5,hotel nya keren banget udah 2 kali kesini selalu puas anak anak betah banget makanan nya enak setiap kumpul keluarga di jogja selalu pilih hotel fortunagrande seturan yogyakarta semua staf nya ramah terutama mas kaya yang duduk set banget nyariin meja sarapan saat lagi padet padetnya,KOMPETITOR,Bintang 3,HotelDafamFortunaSeturan-Yogyakarta,positive,Pelayanan Staf & Keramahan
Cy Indrawati,2024,5,lokasinya strategis banyak jajanan di dekat lokasi hotel untuk kamar kecil ya aku bisa kamar 202 karena konsepnya minimalis kebutuhan esensial saja untuk menginap tapi tidak mengecewakan kolam renangnya nyaman nyaman bersih ada kafe untuk nongkrong nyaman juga dan yang aku paling suka mereka punya mini zoo di sini ada hewan2 permata yang bisa kita lihat ada yang bisa kita kasih makan juga dengan makanan yang sudah disediakan dari pihak hotel seru deh kalau bawa anak kecil atau orang yang suka lihat hewan kaya aku untuk menginap di sini,KOMPETITOR,Bintang 3,HotelDafamFortunaSeturan-Yogyakarta,positive,Kebersihan & Kenyamanan Kamar
Atika Dwi Astuti,2025,5,kesini karena tergiur taman bermain nya akhirnya memesan lah untuk buka bersama keluarga ternyataa sampai sini alhamdulillah puas taman bermain nya bersih mini zoo nya jg lumayan untuk menu bukberan semua okee pelayanan okee banget yang masih khawatir tidak kebagian menu sekarang sering di isi ulang sama resto nya tenang semua masih komplit kok abis maghrib kurangnya satu nih kursi bayi nya dong ditambahin kasian bunda kursi bundi yang bawa bayii ini repot kalau tidak ada bayi huhu,KOMPETITOR,Bintang 3,HotelDafamFortunaSeturan-Yogyakarta,positive,Pelayanan Staf & Keramahan
Vita Gloria,2025,5,untuk fasilitas yang lain bagus untuk makanan di resto lumayan berhubung saya tidak menginap hanya makan saja di restorannya saja saja mohon dengan sangat di perhatikan untuk ruangan menyusuinya pertama sirkulasi udara di ruangan itu bagaimana anak mau menyusuui jika sirkulasi udara tidak ada minimum kipas kek coba stafnya diem di disitu nyusui anak trs tidak ada kipas pintu harus ditutup tidak ada ventilasi itu itu adalah menyusuui apa gudang memperbaiki ruang dikasih nama ganti kamar kedua tidak ada tempat sampah di ruang tersebut apalagi sekitar lobi sampai angkat atau mungkin saya tidak melihat jadi banyak bekas tisu di ruangan itu terimakasih,KOMPETITOR,Bintang 3,HotelDafamFortunaSeturan-Yogyakarta,negative,Kualitas Makanan & Restoran
Gemalam Farah,2025,5,masyaallah senang sekali hari pertama tinggal disini langsung baik mood pelayanan baik banget proses cek masuk cepat anak2 dpt skuter dari lobi ke kamar kamar rapih di dekor sesuai permintaan dpt komplimen slice birthday cake buat putriku fasilitas juga mantap buat anak2 loh,KOMPETITOR,Bintang 3,HotelDafamFortunaSeturan-Yogyakarta,positive,Kebersihan & Kenyamanan Kamar
Rizka Budiyana,2025,5,hotel yang rekomendasi sangat bagus buat yang pny balita ada minizoo ada taman bermain yang luas harga nya jg sesuai dengan fasilitasnya nya sampai bocil g mau pulang tempat nya jg bersih dan nyaman cocok banget buat menginap g prlu kmna2 main d hotel saja sdah kyk keliling kota sdah capek o y sarapan nya jg enak2 mantabb pokok nya kalo ada rejeki pgn ajak anak ksini lg,KOMPETITOR,Bintang 3,HotelDafamFortunaSeturan-Yogyakarta,positive,Kebersihan & Kenyamanan Kamar
