User Name,Review Time,Rating,clean_text,Tipe,Kelas,Nama_Hotel,AI_Sentiment,AI_Aspek
Erni Wijayanti429,2025,5,pelayanan yang bagus dan ramah letak di kota dan strategis makanan dan minuman yang segar dan enak banyak variasi bersih rekomendasi untuk kesini lagi,KOMPETITOR,Bintang 3,HoteldafamPekalongan,positive,Lokasi & Akses Strategis
Fariza Haqie,2023,4,check masuk pk 19 00 satpam ob tidak sigap menawarkan bantuan pada tamu yang datang pdhl saya kerepotan sampai resepsionis yang jaga mas2 sama sekali sekali tidak ada senyum tidak ramah untuk kamar okelah ya tapi kamar mandinya terlihat usang karena kurangnya uang tunai setiap jalan di lorong selalu kedengeran suara tamu2 yang ada d dalam kamar kolam renang oke petugasnya jg ramah untuk sarapanya jadi jadi sekelas bintang 4 kurang variasi truk menarik tolong diperbaiki apalagi sekelas hotel dafam terima kasih,KOMPETITOR,Bintang 3,HoteldafamPekalongan,negative,Pelayanan Staf & Keramahan
Cak Nu,2020,5,Dafam menjadi pilihan utamaku setiap ke kota pekalongan ini lokasinya relatif dekat dengan stasiun sekitar 5 menit perjalanan dengan motor hotel ini juga berseberangan dengan transmart mini membuat kita memiliki banyak opsi untuk menghabiskan waktu layanan makanan dan makanan grab di sekitar hotel pun lengkap soal kamar cukup memuaskan peralatan di kamar mandi lengkap kasur yang nyaman dilengkapi dengan ac yang berfungsi baik di lantai dasar juga terdapat resto dan kolam renang,KOMPETITOR,Bintang 3,HoteldafamPekalongan,positive,Kebersihan & Kenyamanan Kamar
Fikrul Musa,2025,4,sangat rekomended nginap disini ada fasilitas tempat cuci mobil,KOMPETITOR,Bintang 3,HoteldafamPekalongan,positive,Kebersihan & Kenyamanan Kamar
Pacar Sewaan,2024,4,nyaman kamarnya kamar mandi lengkap fasilitas nya cuma saat sarapan nya yang kurang sosisnya ketahuan murahan banget padahal seharusnya pakai sosis yang berkualitas,KOMPETITOR,Bintang 3,HoteldafamPekalongan,negative,Kebersihan & Kenyamanan Kamar
Nurul Mutiara RA,2021,4,hotel ini memiliki fasilitas yang cukup baik aroma ketika memasuki ruangan juga memiliki relaksasi luar biasa kamarnya bersih dengan sajian makanan yang lezat ruang seminar juga mematuhi protokol kesehatan karena diberi sekat2 pembatas cuma agak tidakayangkan toilet dilantai 2 cuma ada 1 yang dekat kolam renang waktu saya menggunakan udara semprotnya juga macet tak keluar udara jadi sempat panik untuk membersihkan diri masih ada tisu saat itu,KOMPETITOR,Bintang 3,HoteldafamPekalongan,positive,Kebersihan & Kenyamanan Kamar
septian diastama,2020,5,hotel dekat dengan pusat perbelanjaan hotel dafam menurut saya cukup nyaman dengan fasilitas beserta keramahan pelayanan yang diberikan depan hotel dafam terdapat carrefour yang sekarang di rubah menjadi transmart lapar saat malam mudah sekali di depan hotel dafam cukup banyak yang berjualan pecel ayam dan pecel lele dan disebelah hotel juga ada rumah makan masakan padang dan jika ingin opsi makanan lain juga bisa untuk masakan terutama sarapan 8 10 saya berikan karena menurut saya masakan standar hotel seperti biasa akan tetapi masakan saya rasa lengkap mulai hidangan pembuka sampai penutup jadi jika mungkin kalian berkunjung ke pekalongan hotel da,KOMPETITOR,Bintang 3,HoteldafamPekalongan,positive,Pelayanan Staf & Keramahan
John rocker,2025,5,kamar bersih dan nyaman pelayanan ramah makanan enak parkir luas lokasi strategis deket transmart,KOMPETITOR,Bintang 3,HoteldafamPekalongan,positive,Kebersihan & Kenyamanan Kamar
Imam Baihaqi,2025,5,kamarnya nyaman view transmart bisa lihat lalulintas dari atas antar jemput stasiun sangat membantu petugas ramah full senyum,KOMPETITOR,Bintang 3,HoteldafamPekalongan,positive,Kebersihan & Kenyamanan Kamar
ulil ulila,2019,4,lumayan nyaman kamar eksekutifya ada kolam renang kecil lumayan untuk anak2 ada kamar dengan menghubungkan pintu enak bisa pantau anak2 saran bagian depan mesti lebih tanggap membantu tamu membawa tas dan barang lainnya,KOMPETITOR,Bintang 3,HoteldafamPekalongan,positive,Fasilitas Hotel (Kolam/Gym/Spa)
SiCiLiA NaPiTuPuLu,2018,1,hotel yang buruk menurut saya sebenarnya dua kali saya menginap di sana pertama kali dua tahun lalu 2014 kami masuk kamarnya yang bau rokok padahal kami minta kamar yang tidak merokok dan untungnya langsung diberikan gantinya tahun berikutnya 28 Desember 2016 kami mencoba menginap lagi di sana jam 10 malam kami sampai dari Surabaya ternyata hal yang sama terulang lagi yaitu kamar bau rokok padahal ada peraturan tertulis di kamar itu jika ada yang merokok akan kena denda 1 jt rupiah tapi di kamar itu bisa terjadi ada bau rokok baru dan kami untuk memeriksa dan minta ganti kamar tetapi kamarnya sudah penuh semua akhirnya setelah 1 jam datang petugas untuk membawa saya sem,KOMPETITOR,Bintang 3,HoteldafamPekalongan,negative,Harga & Value for Money
Hafidz Aditya,2025,5,kamar terbilang agak tua mungkin karena termasuk bangunan tua di pekalongan tapi untuk lokasinya bisa dikatakan terbaik karena berhadapan langsung dengan transmart dan sebelahan dengan mcd,KOMPETITOR,Bintang 3,HoteldafamPekalongan,positive,Lokasi & Akses Strategis
Sugiharto Sugi,2023,1,di hotel kamar 715 1 bawah kolong kasur sangat kotor bahkan ada debu 2 telepon bermasalah 3 kucing di tembok mengelupas 4 tidak ada sampo cuman ada kondisioner 5 kolam renang kotor ada putih2 di udara kolam seperti upil atau ingus orang kaporitnya terlalu tinggi kadar nya dan sangat sangat bermasalah di mata,KOMPETITOR,Bintang 3,HoteldafamPekalongan,negative,Fasilitas Hotel (Kolam/Gym/Spa)
irene widya,2019,5,pelayanan memuaskan pilihan sarapan banyak dan cukup enak kamar agak kecil dan jadi sempit karena ada tambahan tambahan tempat tidur kamar mandi bersih sayang sekatnya cm kain plastik sehingga shbs mandi udara terciprat kemana2 kolam renang bagus anak2 suka,KOMPETITOR,Bintang 3,HoteldafamPekalongan,positive,Kebersihan & Kenyamanan Kamar
Arif M,2025,1,pelayanan kurang minum,KOMPETITOR,Bintang 3,HoteldafamPekalongan,negative,Kualitas Makanan & Restoran
CRUIZEE,2025,5,pelayanan mantap kamar bersih menu makanan bervariasi pokoknya tetap hotel terbaik dafam pekalonagn,KOMPETITOR,Bintang 3,HoteldafamPekalongan,positive,Kebersihan & Kenyamanan Kamar
Ilham Hidayat,2021,4,mampir kesini buat nginep karena kemalaman di jalan lokasinya cukup strategis di depan hotel ada transmart pelayanannya juga ramah hotelnya bersih dan rapi saat kesini kebetulan ada gerung berbatu juga lagi nginap disini menu sarapannya enak dan cukup komplit,KOMPETITOR,Bintang 3,HoteldafamPekalongan,positive,Lokasi & Akses Strategis
ardanu karandie,2019,4,Dafam salah satu hotel berbintang yang berada di pekalongan ini menjadi lebih akrab bagi masyarakat karena memiliki ruang dansa sebagai tempat hajatan untuk orang orang pekalongan ini salah satu hotel favorit lounge ada di dekat lobi jadi kita bisa langsung bersantai santai tanpa mencari ruang lain yang sering membing resto juga terpisah dari lobi n lounge sehingga terhindar dari rasa rish dengan para tamu lain ingin memeriksa masuk dan memeriksa keluar dari resto yang tersedia teras yang menghadap ke belakang merasa santai dan nyaman saya lebih sering bernyaman2 diri di kolam sambil menikmati minuman dan ngobrol2 rekan karena suasananya bikin,KOMPETITOR,Bintang 3,HoteldafamPekalongan,positive,Lokasi & Akses Strategis
Agus Mujo nugroho,2023,4,atas semua bagus pelayanan ramah ada pengiring musik gamelan setiap sore dan saya sangat suka dan saya diijinkan untuk merekam musik gamelan saat pertunjukan karena kebetulan saya pemerhati kesenian tradisional jawa tengah semoga manajemen hotel dafam juga men suport channel youtube saya tentang kesenian jawa tengah memberikan channel terimakasih untuk pengalaman yang luar biasa,KOMPETITOR,Bintang 3,HoteldafamPekalongan,positive,Pelayanan Staf & Keramahan
Egy Dwi Suryani,2025,4,pelayanan nya ramah banget tempat bersih cuma kacanya yang deket blakon kurang bersih dri luarnya,KOMPETITOR,Bintang 3,HoteldafamPekalongan,positive,Kebersihan & Kenyamanan Kamar
Indra Rahman MBA. CFP.,2018,4,bagus cek masuk cepat kamar bagus tempat tidur nya enak hanya agak sempit ada bak mandi nya bagus makanan yang paling top croissant nya lumayan enak ada jus dafam ada sekat kaca depan angkat kamar jadi sempit banget n ribet depan hotel ada carrefour joss tenan,KOMPETITOR,Bintang 3,HoteldafamPekalongan,positive,Kebersihan & Kenyamanan Kamar
Amalia Rizkyarini,2023,3,kamar rentan banjir karena mandi di atas mandi sarapannya hambar kayak kurang bumbu hotelnya berkarpet tapi pengap banget terasa banyak debu gtu di karpetnya tapi enaknya depan transmart,KOMPETITOR,Bintang 3,HoteldafamPekalongan,positive,Fasilitas Hotel (Kolam/Gym/Spa)
Jacky Arien,2023,5,dapat kamar tidak merokok dengan bau rokok mengeluh lsg ditanggapi dengan cepat diganti kamar lain kasur oke ac dingin ada bthub ada teko pemanas kulkas internet lumayan lokasi strategis depan transmart cari makan jajanan tidak sulit disebelah ada mie gacoan hahahaha,KOMPETITOR,Bintang 3,HoteldafamPekalongan,positive,Kebersihan & Kenyamanan Kamar
Lalas Journey,2020,5,Pelayanan di Dafam bagus banget aku pernah menginap di sini saat mendapatkan voucher sayang banget tidak ada foto kemaren acara seminar di dafam menuunya enak enak kalau menurutku selama menjadi wartawan bisnis cuma hotel dafam yang kreatif ngadain acara acara contohnya saat hari bumi kemaren lampu hotel dimatikan kadang meluncurkan menu baru juga,KOMPETITOR,Bintang 3,HoteldafamPekalongan,positive,Kualitas Makanan & Restoran
Pedró “McBryan” Rodrigüez,2024,4,Lokasi strategis yang bagus di pusat kota di depan transmart mcd mi gacoan dan starbucks sangat mudah diakses dari terminal stasiun kota,KOMPETITOR,Bintang 3,HoteldafamPekalongan,positive,Lokasi & Akses Strategis
Khoirul Imam,2024,3,makanan lumayan enak minesnya salah satunya tidak ada nama makanan tersebut detail wifi tidak ditulis di dinding ruangan kyk ruang pertemuan sinyal wifi kecil seharusnya untuk ruang pertemuan penuh jaringan,KOMPETITOR,Bintang 3,HoteldafamPekalongan,positive,Infrastruktur (AC/WiFi/Parkir/Air)
bob saliyo,2023,4,hotel lokasinya strategis di tengah kota pekalongan depan hotel ada transmart jadi kalau mau jalan jalan atau pengen hiburan tinggal jalan kaki saja atopun membutuhkan keperluan sehari-hari bisa jalan ke transmart untuk pelayanan petugas hotel ramah n sangat membantu sekali untuk kamarnya lumayan bagus kamar bersih n wangi kamar mandi standar dengan tingkat kebersihan yang bagus cuma model mandi nya mungkin yang perlu diupgrade untuk ac juga perlu diupgrade karena dirasa kurang dingin n agak berisik untuk saluran tv nya agak pilihan lengkapnya yang terpenting ada hbo untuk menonton film sejauh ini untuk kamarnya lumayan bagus di restorannya menu lengkap n rasanya enak enak sert,KOMPETITOR,Bintang 3,HoteldafamPekalongan,positive,Kebersihan & Kenyamanan Kamar
Herry Sambo,2025,5,hotel yang bagus dengan harga yang terjangkau pelayanan staf yang memuaskan makanannya juga enak joss pokokee,KOMPETITOR,Bintang 3,HoteldafamPekalongan,positive,Kualitas Makanan & Restoran
Nongcu,2023,5,Saat check masuk sudah datang jam 13.30 suruh tunggu katanya kamar belum siap oke kami menunggu ehh tau nya sampai jam 3 belum beres ada trable apa gitu akhirnya dikasih kamar yang lebih upgrade seneng dong walopun jam menunggu lama sampai ngantuk2 dapet kamar di 918 uh view nya bagus banget dibuat ke depan hotel ini ada kolam renang nya juga yah banyak yang menjual makanan juga dindrpan akan jadi lang dehganan karena sebulan 2x pasti ke pekalongan sudah pernah singgah di dafam cilacap dafam semarang juga,KOMPETITOR,Bintang 3,HoteldafamPekalongan,positive,Fasilitas Hotel (Kolam/Gym/Spa)
Agustiarman _86,2021,1,sangat kecewa saya pesan kamar 2 mlm karena ada pekerjaan dipekalongan kamar lantai 9 eksekutif double room di pojok disamping kamar ada pintu untuk perbaikan ac berhadapan dengan pintu darurat yang bisa tepat kejendela kamar dan waktu di mlm kedua ada bayangan org dari luar melihat ke kamar ketika minta cek ke ruang cctv penjaga kurang kooperatif lalu saya ceritakan ke keamanan malah jawaban klw di lantai tersebut malah emang sering terjadi hal aneh kadang ada suara anak kecil saja menangis hadeeh ada ada ada dan saya malah di kira indigo makanannya tidak enak variasi sarapan sedikit tidak seperti hotel bintang 3 lainya,KOMPETITOR,Bintang 3,HoteldafamPekalongan,negative,Infrastruktur (AC/WiFi/Parkir/Air)
Hani Mauliza,2022,5,Sudah kesekian kali kesitu buat acara workshop makanannya enak tapi syaang mushollanya ada di bawah dan kurang luas memadai saja menurutku jika bisa sih tmpt wudhu laki dan perempuan itu pisah,KOMPETITOR,Bintang 3,HoteldafamPekalongan,positive,Kualitas Makanan & Restoran
dea emilsyah,2022,5,Pelayan semua karyawan rendah hati dan baik kebersihan semua ruangan terjaga menu makanan cukup enak cukup puas bisa bermalam di hotel dafam pekalongan lokasi strategis dan bebas banjir di atas semua oke,KOMPETITOR,Bintang 3,HoteldafamPekalongan,positive,Kebersihan & Kenyamanan Kamar
Ryz hope,2022,2,cuma sedikit kecewa ma manajemen bagian acara buka puasa ada menu yang di tawarkan berbeda dengan yang di sajikan gimana ceritanya spaghetti fetucini dan bbrp saus yang menarik eh jadi mie ayam yang mohon maaf rasanya saja di bawah standar mie ayam keliling dan alasannya menel rolling tapi yang di rolling yang menurut saya menu andalan yang paling menarik yang lain mah tetap kalau emang benar menel rolling menu seharusnya semua dong bukan cuma spaghetti jadi mie ayam cari untung boleh tapi jangan gitu2 amat lah ini dafam lho bukan hotel bintang kecil,KOMPETITOR,Bintang 3,HoteldafamPekalongan,negative,Kualitas Makanan & Restoran
Kicky N,2018,4,nice hotel bersih kamar mandi amenitiesnya unik banget sarapan mantab dari rasa dan pilihan ada jus kesehatan juga keren deh lokasi agak pinggir kota di seberang ada perawatan empat walau sepi sayang ac nya kurang dingin walau sudah disetel suhu minimum dan angin maksimum,KOMPETITOR,Bintang 3,HoteldafamPekalongan,positive,Kebersihan & Kenyamanan Kamar
Gabriella Indah,2023,2,Saat check masuk lama kamar kayak belum siap gitu pdhl resevasi jg oleh online tidak ots huhu banyak petugas hotel yang tidak pke masker apalagi saat bf kamar mandi ngecembeng udara kalau mau mandi harus menunggu 15 menit lebih biar surut vibesnya tuh kayak hotel jadul kamar penuh debu ketel jg sudah rusak kabel ngelupas pula buat sarapannya ukuran bintang 4 sih kurang ya ketolong sama omelettes,KOMPETITOR,Bintang 3,HoteldafamPekalongan,negative,Infrastruktur (AC/WiFi/Parkir/Air)
Gilga,2024,3,1 menu makanan sarapan kurang bervariasi 2 saya mendapatkan kamar yang banyak lalat limbahnya 3 pelayanan pegawai cukup ramah,KOMPETITOR,Bintang 3,HoteldafamPekalongan,negative,Pelayanan Staf & Keramahan
Madu Kelulut Arrafi,2024,5,Lokasi bagus cocok bagi yang transit tinggal nyebrang bisa jalan2 di transmart mau jajanan murah sepanjang jalan depan hotel banyak pedagang kaki lima yang makanan nya enak dan murah,KOMPETITOR,Bintang 3,HoteldafamPekalongan,positive,Lokasi & Akses Strategis
Munah Sari,2022,5,hotel bintang 3 yang sangat nyaman sekali bisa melihat keindahan kota pekalongan di pagi hari di dalam juga disediakan fasilitas mendukung seperti kolam renang tempat kebugaran dideket lobi juga disediakan minuman wedang uwuh yang khas sangat rasanya berbeda dengan di tempat lain pelayanannya juga sangat memuaskan tidak salah deh kalau kita pilih hotel dafam pekalongan,KOMPETITOR,Bintang 3,HoteldafamPekalongan,positive,Fasilitas Hotel (Kolam/Gym/Spa)
Anjar Wijayadi,2020,4,lumayan pernah transit di hotel ini parkir luas kamar bersih dekat dengan banyak tempat makan bervariasi dan banyak pilihan harga kamar terjangkau mgkin kali lain transit lagi kalau libur lebaran atau libur panjang lainnya,KOMPETITOR,Bintang 3,HoteldafamPekalongan,positive,Kebersihan & Kenyamanan Kamar
HAGIA Channel,2019,4,datang jam 13.00 pesen 2 kamar dapatnya kamar beda lantai 1 kamar dikasih kunci jam 14.00 tapi 1 kamar lagi dikasih kunci 14 45 pakai tegang dulu nunggu lumayan lama mestinya jam 14.00 tapi nyaman bangets fasilitas oke anak anak bisa renang,KOMPETITOR,Bintang 3,HoteldafamPekalongan,positive,Fasilitas Hotel (Kolam/Gym/Spa)
Helmy Hadi Hidayat,2019,3,hotel yang cukup besar dan bersih letaknya cukup strategis dekat dengan jalur pantura sangat mudah diakses karena letaknya di pinggir jalan utama pelayanan cukup memuaskan hanya saja bagian resto perlu ada peningkatan kualitas pelayanan kamarnya cukup besar dan bersih,KOMPETITOR,Bintang 3,HoteldafamPekalongan,positive,Lokasi & Akses Strategis
dwita intani,2024,5,hotelnya lmyan bagus kamar bersih trs untuk sarapan jg enak2 kolamrenang nya jg lmyan lah saran tambahin arena bermain deket kolamrenang jadi biar anak2 seneng,KOMPETITOR,Bintang 3,HoteldafamPekalongan,positive,Kebersihan & Kenyamanan Kamar
Ariesqi Dwi,2025,5,Hotel yang nyaman lokasi tengah kota deket dengan transmart mcd gacoan staf ramah2 dan sarapan yang bervariasi,KOMPETITOR,Bintang 3,HoteldafamPekalongan,positive,Pelayanan Staf & Keramahan
q_roon wana,2024,3,Baru di sini saat cek keluar suruh tunggu kamar di cek dulu baru boleh pergi padahal waktu sudah saya kembali acara mungkin karena penampilan kami kaya orang kampung,KOMPETITOR,Bintang 3,HoteldafamPekalongan,positive,Harga & Value for Money
Pradita Andriani,2024,4,pekerja sangat ramah sangat membantu dalam segala hal bersih nyaman patut untuk d kunjungi lagi makanan enak kolam renang bersih terimakasih,KOMPETITOR,Bintang 3,HoteldafamPekalongan,positive,Pelayanan Staf & Keramahan
em rokib,2025,5,hotel yang mudah dijangkau terletak di jalan yang berkeliaran di depan ada transmart kd memudahkan untuk berbelanja,KOMPETITOR,Bintang 3,HoteldafamPekalongan,positive,Lokasi & Akses Strategis
Puspita dewi,2024,4,ruangannya tidak terlalu luas tidak ada kulkas menu sarapan cukup lengkap,KOMPETITOR,Bintang 3,HoteldafamPekalongan,positive,Kebersihan & Kenyamanan Kamar
Rissalwan Habdy Lubis,2023,5,hotel yang sangat baik untuk urusan bisnis dan juga liburan keluarga petugas hotel sangat kooperatif saat mengatur ruang untuk rapat sesuai keinginan tamu posisi hotel juga strategis karena berhadapan langsung dengan transmart,KOMPETITOR,Bintang 3,HoteldafamPekalongan,positive,Lokasi & Akses Strategis
Danang Setiawan,2019,4,kamar oke bersih suasana nyaman dan aman secara keseluruhan tidak ada masalah untuk jenis makanan pagi sarapan nya banyak dan bervariasi tapi dengan rasa standar dan biasa saja parkirannya juga cukup kondisi kamar mandi lumayan saja,KOMPETITOR,Bintang 3,HoteldafamPekalongan,positive,Kebersihan & Kenyamanan Kamar
Musroni,2025,5,masya allah sangat2 memuaskan pokoknya dari kamar layanan kebersihan dan makanannya,KOMPETITOR,Bintang 3,HoteldafamPekalongan,positive,Kebersihan & Kenyamanan Kamar
SISKA,2023,3,pemesanan melalui tr ka non-makan kamar tapi ternyata dapetnya kamar merokok ac tidak dingin jadi minta pindah kamar puji syukur masih bisa ruang pertemuan ac kurang dingin selain itu semua baik semoga hotel dafam dapat meningkatkan pelayanannya semakin dicari oleh para pemudik wisatawan domestik internasional ekspatriat maju teerus,KOMPETITOR,Bintang 3,HoteldafamPekalongan,positive,Kebersihan & Kenyamanan Kamar
Kariska Wijayanti,2019,4,nyaman buat istirahat wifi kenceng makanan lengkap dan enak cuma sayang loby nya kurang luas jadi kalau perlu meeting point kecil2an harus di cafe hotel dan pesan menu yang ada disana,KOMPETITOR,Bintang 3,HoteldafamPekalongan,positive,Kualitas Makanan & Restoran
Amelia Zahra,2022,2,hrga 550 belum mendapatkan sarapan layanan pesanan resto tutup alasan ppkm kan itu resto bukan warung kaki lima baru x ini saya ingin masuk dihotel tapi kelaparan hrs order dari luar hotel saat pagi minta kopi capucino tidak ada dengan alasan mesin rusak profesional lg tolong dibenahi,KOMPETITOR,Bintang 3,HoteldafamPekalongan,negative,Kualitas Makanan & Restoran
Heri Sutrisno,2025,2,AC di lantai m kurang dingin padhal AC ad 6 unit wifi untuk streaming kadang putus mic nirkabel kadang putus,KOMPETITOR,Bintang 3,HoteldafamPekalongan,negative,Infrastruktur (AC/WiFi/Parkir/Air)
Ryeo Nias,2025,4,hotel yang memberikan layanan yang memuaskan dan berusaha memberikan kenyamanan untuk pelanggannya,KOMPETITOR,Bintang 3,HoteldafamPekalongan,positive,Pelayanan Staf & Keramahan
Syah Maulana Ikhsan,2023,5,Sangat merekomendasikan menginap di hotel dafam depanya ada transmart lengkap semuanya ada dekat dengan jalan raya banyak akses makanan sangat mudah karena pinggir jalan raya,KOMPETITOR,Bintang 3,HoteldafamPekalongan,positive,Lokasi & Akses Strategis
Hambali Ahmad,2025,5,Saat banget buat istrht tidak berisik dari suara kendraan cocok tuk keluarga ada fasilitas kolam renangnya jg dkt dengan mall jadi mo belanja2 mudah,KOMPETITOR,Bintang 3,HoteldafamPekalongan,positive,Lokasi & Akses Strategis
Agrita Saraswati,2022,2,tempatnya memang strategis tapi pelayanannya tidak baik kasur kamar seperti jungkat jungkit keran mandi patah resto jg makananya sangat minim dan tidak memuaskan rasanya pelayan resto juga lambat mau bayar tambahan orang dngn debit juga mas nya malah bertanya gmna caranya tidak puas disini,KOMPETITOR,Bintang 3,HoteldafamPekalongan,negative,Lokasi & Akses Strategis
Anak Pantai,2022,4,untuk sarapannya enak berbagai macam pilihan dari bubur sampai nasi ayam balado tahu dan terong baladonya enak sekali sekali untuk kamar yang di pakai adik sya yang city view mall transmart ac nya bocor sudah menelpon housekeeping tapi hanya di cek tidak di beri tampungan atau di perbaiki hanya di cek dan di tinggal jadi sampai kami cekout pun ac masih bocor di karpet hotel tidak ada follow up dari housekeeping nya mohon di perbaiki semoga tidak terjadi di tamu yang lain dan pintu kamar mandinya tidak bisa di tutup karena pintu kayunya mengembang lebih lebar dari daftar pintunya kamar lantai 7,KOMPETITOR,Bintang 3,HoteldafamPekalongan,positive,Kualitas Makanan & Restoran
silfi aprilia,2023,5,hotel rekomendasi di kota pekalongan letaknya yang strategis dari pusat pemerintahan kampus rs tidak di jalur pantura utama dan depan ada mall di sekitar sepanjang jalan hotel ketika sore malam banyak kulineran khas kota ini ditunjang dengan fasilitas lengkap seperti kolam renang yang swasta pusat kebugaran spa ini rekomendasi saya dan keluarga saat berminggu terakhir terimakasih,KOMPETITOR,Bintang 3,HoteldafamPekalongan,positive,Fasilitas Hotel (Kolam/Gym/Spa)
Indra Thamrin,2021,5,hotel strategis di pusat kota pekalongan depannya langsung mall transmart harga sangat terjangkau desain hotel sangat oke sebelum masuk hotel di samping kanan halaman depan lobi terdapat kolam ikan yang menyejukkan parkir di basement cukup memadai kamar hotel sangat nyaman dapat kamar di 819 staf hotel layanan yang sangat baik di sekitar hotel banyak kuliner yang patut dicoba bagi para pelancong dari luar kota wajib coba nasi goreng pekalongan di samping hotel saran pada saat akhir pekan tingkat pendudukan tinggi mungkin bisa dipertimbangkan untuk mengaktifkan 2 lift agar mobilisasi tamu bisa lebih cepat,KOMPETITOR,Bintang 3,HoteldafamPekalongan,positive,Lokasi & Akses Strategis
sahrulmuhamadarif,2025,5,lokasi strategis harga terjangkau sarapan pagi bervariasi pelayanan sangat ramah fasilitas lengkap secara keseluruhan sangat direkomendasikan,KOMPETITOR,Bintang 3,HoteldafamPekalongan,positive,Lokasi & Akses Strategis
Motopacker Indonesia,2021,3,biasa saja ac nya mohon diperhatikan kamar 804 sangat ganggu dan layak diperbaiki interior WC wastafel yang bahan triplek juga sudah rusak lokasi oke dkota dan strategis,KOMPETITOR,Bintang 3,HoteldafamPekalongan,negative,Lokasi & Akses Strategis
Widji Pangastuti,2022,4,kamarnya nyaman lokasi strategis dekat mall tinggal nyebrang tapi proses cek masuk nya lama padahal sudah memesan tirai plastik di kamar mandi agak kotor,KOMPETITOR,Bintang 3,HoteldafamPekalongan,negative,Lokasi & Akses Strategis
SAMCHOON RULY,2024,5,Hampir 1 minggu saya menginap di sini dalam tugas mengawal kesehatan abah luthfi di acara sufi internasional pelayanan nya sangat bagus makanan nya enak enak pegawainya santun,KOMPETITOR,Bintang 3,HoteldafamPekalongan,positive,Pelayanan Staf & Keramahan
Sitiay Isah,2025,5,sangat bermanfaat dan cepat tiba di tujuan,KOMPETITOR,Bintang 3,HoteldafamPekalongan,positive,Harga & Value for Money
Andri Juliansyah,2023,5,lokasi hotel dekat dengan transmart jika mau cari makan jadi lebih mudah tipe kamar masih seperti model jaman dahulu yang masih ada mandi baru,KOMPETITOR,Bintang 3,HoteldafamPekalongan,positive,Lokasi & Akses Strategis
Lia Nur afifah,2022,5,hotelnya bagus bangett nyaman rapih ruangannya nyaman juga bisa layanannya saat buat bermalam dengan keluarga dihotelini dan jangan lupa sedia nf vitamale dikamar biar makin puas lagi asli aman 100 tanpa efek samping bikin tahan lama 2 4 jam panjang besar asli aman terjamin bikin malam dan semakin puas bersama nf vitamale penjual wa 081542238569,KOMPETITOR,Bintang 3,HoteldafamPekalongan,positive,Kebersihan & Kenyamanan Kamar
Danny Christianto,2021,3,saya menginap di kamar deluxe kelebihan lokasi strategis persis depannya layanan transmart oke suasana tenang tidak berisik tidur jadi sangat nyenyak kekurangan desain interior kamar sangat sederhana lemari pakaian kecil banget tidak ada safebox brankas tidak ada minibar kulkas kamar mandi gelap desain kuno sudah pada kusam keramiknya parkir mobil sangat terbatas waktu saya tinggal di sini lift ada 2 tapi yang beroperasi cuma 1 secara keseluruhan masih oke tapi di pekalongan masih ada hotel yang fasilitasnya lebih bagus dari modern tapi harganya lebih murah,KOMPETITOR,Bintang 3,HoteldafamPekalongan,negative,Lokasi & Akses Strategis
ernakurnias,2022,5,hotel rekomendasi banget sih bersih harganya lebih terjangkau dan aksesnya mudah di lingkungan hotelnya juga banyak makanan hehe di dalam hotelnya saat masuk tuh bersih stafnya ramah dan saat sampai kamar bener bener bersih kamar mandinya juga bersih banget makanannya juga enak,KOMPETITOR,Bintang 3,HoteldafamPekalongan,positive,Kebersihan & Kenyamanan Kamar
