User Name,Review Time,Rating,clean_text,Tipe,Kelas,Nama_Hotel,AI_Sentiment,AI_Aspek
acus aril,2025,5,dianjurkan hotel nya kamar bagus resepsionis ramah sarapan enak cuma ruangan agak panas depan hotel banyak tukang makan depan transmart dekat mc d ada kolam renangnya,KOMPETITOR,Bintang 3,HoteldafamPekalongan,positive,Kebersihan & Kenyamanan Kamar
wahono h3,2025,4,lokasi strategis mudah diakses dan dekat dengan layanan transmart sangat baik satpam ramah dan sangat membantu restoran bersih makanan enak kamar bersih namun secara visual ruangan dan kamar terlihat seperti bangunan lama,KOMPETITOR,Bintang 3,HoteldafamPekalongan,positive,Kebersihan & Kenyamanan Kamar
Anis Saadah,2025,1,dinding sudah mengelupas korden kotor kasur sudah kempes tidak menunjukkan kualitas hotel bintang 3 cukup sekali bikin kapok tidak akan kesini lagi tambah dengan harga 400rb satu sabun mandi hanya sabun batang yang biasanya dihotel lain digunakan untuk cuci tangan,KOMPETITOR,Bintang 3,HoteldafamPekalongan,negative,Harga & Value for Money
Altrik Anindita,2025,2,Mohon maaf jika kamar mau di bersihkan Mohon izin terlebih dahulu jika tamu sedang di luar kamar bisa menelepon terlebih dahulu untuk konfirmasi mau di bersihkan atau tidaknya jangan asal masuk kamar tanpa izin karena tamu punya privasi masing2,KOMPETITOR,Bintang 3,HoteldafamPekalongan,neutral,Kebersihan & Kenyamanan Kamar
bernard gerard,2025,4,hotel terbaik pelayanannya makanannya parkirannya sayang kunci hotel tidak bisa terkunci tapi hampir semuanya terbaik,KOMPETITOR,Bintang 3,HoteldafamPekalongan,positive,Kualitas Makanan & Restoran
Rendra Widya Tama,2025,4,Hotel ini cukup terkenal di pekalongan tapi bagi saya setelah menginap di sini agak mengecewakan lantai pertama hotel saat pintu masuk sepertinya aciannya lepas sehingga keramiknya terdengar saat diinjak kalau untuk kamarnya sih standar kedua saat sarapan lebih mengecewakan pelayanannya sudah pesan telur mata sapi dari awal sebelum sarapan sampai selesai sarapan tidak jadi sudah ditanya ke yang mas masak tapi diminta sabar dan saat tanya lagi katanya diambil orang mengecewakan sekali pelayanannya,KOMPETITOR,Bintang 3,HoteldafamPekalongan,negative,Pelayanan Staf & Keramahan
Michael W,2025,4,pertama kali masuk kanar bau rokok padahal pesan kamar yang tidak merokok untung kamar nya WC nya bersih lampu nya remang remang pelayan nya ramah sarapan nya enak,KOMPETITOR,Bintang 3,HoteldafamPekalongan,positive,Kebersihan & Kenyamanan Kamar
Nia,2025,5,order lwt marketing pak ari beliau sangat membantu seluruh staf pelayanannya terbaik terbaik setelah penjualannya pun sangat bagus,KOMPETITOR,Bintang 3,HoteldafamPekalongan,positive,Pelayanan Staf & Keramahan
KOWACHIAKI,2025,3,Saat kedatangan keamanan sangat ramah resepsionis sangat ramah tertata dan manajemen cepat untuk kamar ukuran selaras dengan harga ya tipe hotel lama jadi banyak beberapa yang agak lapuk fasilitas standar kamar mandi cukup bersih sudah berhexos mandi mandi mandi mandi dan udara hangat mudah diatur paling ac saja kami pesan 2 kamar yang terhubung kamar 1 ac dingin sekali sedangkan yang kamar 2 biasa saja dan sarapan juga tidak begitu banyak pilihan tapi ya cukuplah untuk sarapan dari nasi sampai croissant2an ada semua petugas sangat ramah bahkan petugas pemeliharaan saya cuman menyampaikan kendala saat di angkat mereka langsung menyampaikan dan proses bahkan saya belum telepon layananenya lagi,KOMPETITOR,Bintang 3,HoteldafamPekalongan,positive,Kebersihan & Kenyamanan Kamar
UMI SALAMAH,2025,3,Deluxe nya kecil handuknya sudah perlu diganti sudah dari lubang2 aus diujung2 sudah lepek banget bedcovernya sudah ada bbrp yang lubang kecil jadi sekelas bintang 4 kayaknya enggak layaklah perlengkapan toiletnya tidak lengkap tidak ada sikat gigi tidak ada sampo tidak ada kulkas nya,KOMPETITOR,Bintang 3,HoteldafamPekalongan,negative,Kebersihan & Kenyamanan Kamar
Rahmat Albagir,2025,1,Jngan pada mau tinggal di hotel sini memperbaiki mikir 2x dah sebelum aku pergi di sini jika tidak bikin emosi,KOMPETITOR,Bintang 3,HoteldafamPekalongan,negative,Harga & Value for Money
Kistoro Edi,2026,1,pelayanan tidak ramah kamar seperti bangunan lama,KOMPETITOR,Bintang 3,HoteldafamPekalongan,negative,Harga & Value for Money
Yuwono Aja,2025,5,beberapa kali bermalam disini jika ke pekalongan dekat mall dekat makanan luar sekitar tenang jalanan tidak banjir mudah diakses,KOMPETITOR,Bintang 3,HoteldafamPekalongan,positive,Kebersihan & Kenyamanan Kamar
Maria Elvia Marta Kusuma Dewi,2025,2,sudah memesan jauh2 hari non merokok tapi saat dateng blg ada baru merokok tergantung yang dateng duluan baru nemu hotel harus duluan duluan dateng kondisi kamar furnitur sudah pada ngeletek kamar mandi flash toiletnya macet remot tv rusak parah menurut saya ini hotel sudah harus direnovasi sih kecewa,KOMPETITOR,Bintang 3,HoteldafamPekalongan,negative,Kebersihan & Kenyamanan Kamar
Istiso Likhamelia,2025,4,karpetnya bau apek deket kasur malah bau makanan basi baru mendingan setelah ruangan dingin,KOMPETITOR,Bintang 3,HoteldafamPekalongan,negative,Kebersihan & Kenyamanan Kamar
Faqih Koswara,2025,1,1 bentuk fasilitas kamar berbeda antara yang ditawarkan melalui whatsapp dengan kenyataan 2 beberapa bagain kamar sudah lapuk kucing nya interior pun sudah sangat tua dengan pencahayaan yang kurang membuat kamar terasa sedikit marah hal ini didukung dengan beberapa malfungsi di fasilitas kamar seperti telepon yang mati dan tv yang sulit dinyalakan dimatikan sangat terlihat dan terasa tua nya 3 pelayanan mungkin bisa dikatakan cepat namun umpan balik yang diberikan memang kurang ramah mulai dari admin di whatsapp yang berkomunikasi kurang sopan juga ramah petugas2 seperti satpam concierge yang cenderung santai ketika menyambut tamu lantai 4 akses ke koridor kamar tidak menggunakan kartu sehingga siapapun,KOMPETITOR,Bintang 3,HoteldafamPekalongan,negative,Infrastruktur (AC/WiFi/Parkir/Air)
Kaluna Maswara,2025,5,menginap di hotel dafam pekalongan tuh beneran auto betah dari awal masuk udah disambut staf yang ramah cek masuk cepat dan kamar super nyaman yang bikin tinggal makin asik kasur empuk parah tidur nyenyak bangun segar ada kolam renang bisa menyembuhkan sambil olahraga tipis sarapan mantul banyak pilihan dari nasi goreng sampai kue kue di kafe lokasi strategis deket stasiun pusat kota mudah cari makan atau jalan jalan deket transmart harganya masih masuk akal sebanding dengan fasilitasnya memperbaiki akan kembali jika mampir ke pekalongan lagi,KOMPETITOR,Bintang 3,HoteldafamPekalongan,positive,Kebersihan & Kenyamanan Kamar
Kai,2025,3,Salah satu hotel yang bisa dicoba di pekalongan lokasi tidak jauh dari stasiun pekalongan berhadapan dengan transmart tempat parkir luas lobi tidak begitu luas resto juga tidak begitu luas siap perang tempat duduk resto saat sarapan apalagi saat tamu hotel banyak makanan resto biasa saja kamar standar,KOMPETITOR,Bintang 3,HoteldafamPekalongan,positive,Lokasi & Akses Strategis
Agus Jamal,2025,5,Secara keseluruhan bagus dan nyaman cuma kamar yang saya pakai lantai ada yang pergi hrus hati2 untuk anak2,KOMPETITOR,Bintang 3,HoteldafamPekalongan,positive,Kebersihan & Kenyamanan Kamar
Minaylandra ray,2025,2,Kita bikin reservasi berbuka puasa di dafam ternyata jauh dari ekspektasi rasanya spaghettynya sudah basi masih disajikan rasa makanan lainnya biasa saja tidak layak dengan harganya,KOMPETITOR,Bintang 3,HoteldafamPekalongan,negative,Fasilitas Hotel (Kolam/Gym/Spa)
Bogi Pratama,2025,5,lokasi strategis dekat pusat perbelanjaan kamar bersih,KOMPETITOR,Bintang 3,HoteldafamPekalongan,positive,Kebersihan & Kenyamanan Kamar
Dian handisa,2025,5,menginap di sini selama 2 hari saat berlibur di kota pekalongan lokasi strategis depannya transmart pekalongan mencari makan juga tidak sulit karena banyak pedagang kuliner di sekitaran hotel untuk sarapan menu cukup beragam ada nasi megono soto ayam bubur ayam bakery sereal dan buffet menginap di kamar yang ada bak mandi dan kulkas lumayan besar ada juga kolam renang dengan 2 jenis kedalaman yang satu 60 cm dan 120 cm tersedia juga di daerah kolam renang secara keseluruhan oke,KOMPETITOR,Bintang 3,HoteldafamPekalongan,positive,Fasilitas Hotel (Kolam/Gym/Spa)
Rieke Dyah Pitaloka,2025,5,untuk pelayanan f b layanan ny sudh bgus banget saat iftar ramadhan semua mknan dn minumnny sudh enk resepsionisny jg ramah,KOMPETITOR,Bintang 3,HoteldafamPekalongan,positive,Kualitas Makanan & Restoran
Clairehera,2025,5,overall oke kamar nyaman bersih hanya memang furniture penataan agak tua yaa masih ada karpet di lantai kamar tidur dan bagian kepala tempat tidur nya masih kain buat yang tidak kuat debu bisa kurang nyaman karena meskipun sudah dibersihkan masih ada kemungkinan debu lama menempel kebetulan saya ada alergi debu jadi selama semalam dan paginya reaksi alergi timbul tapi itu oke suka bgtt ambience lagu di resto makanannya juga enak tidak ada yang hambar staf tanya juga ramah saat malemnya info rekomendasi juga makan diarahin layanan keunggulan terima kasih dafam pekalongan,KOMPETITOR,Bintang 3,HoteldafamPekalongan,positive,Kebersihan & Kenyamanan Kamar
Taufik Hidayat,2025,1,hotel cukup tua dengan fasilitas yang sudah mulai digunakan seperti bantal sudah kempes handuk sudah sobek2 masih dikasih ke tamu springbed sudah mulai terasa pernya kami dikamar 604 ac sangat berisik dan panas tidak merekomendasikan untuk hotel bintang 4,KOMPETITOR,Bintang 3,HoteldafamPekalongan,negative,Infrastruktur (AC/WiFi/Parkir/Air)
Alfiatun Nisa Maanana,2025,5,lokasi super strategis dekat dengan tol trans jawa stasiun pekalongan sebrang trans mall pekalongan dan banyak kuliner depan hotel yang buka sampai malam super rekomendasi buat hotel di kisaran harga 600rban,KOMPETITOR,Bintang 3,HoteldafamPekalongan,positive,Lokasi & Akses Strategis
Kyra Likeheart,2025,5,Hotel Yang Family Sangat nyaman dan strategis sangat,KOMPETITOR,Bintang 3,HoteldafamPekalongan,positive,Lokasi & Akses Strategis
Natsha Chusna Pratita,2025,1,lol kamar mandinya oldskul harus mandi diatas mandi licin dan berdiri kalau masih muda oke bisa naik mandi coba kalau sudah tua apa tidak kasihan saran renov saja mandi tuh biar tidak nyusahin pertama buka pintu juga lgsg disambut kecoa ew di 604 bantal percumah 4 biji tapi kempes semua,KOMPETITOR,Bintang 3,HoteldafamPekalongan,negative,Kebersihan & Kenyamanan Kamar
-FaNnY-,2025,1,sore tim manajemen hotel dafam izin bertanya apakah nomor telepon hotel dafam sudah berubah berbeda dengan yang ada di informasi direktori google ya karena saya mencoba menghubungi nomor telepon lokal dan nomor telepon handphone yang tertera tapi tidak ada satupun petugas yang mengangkat apakah memang sekarang tidak ada petugas frontliner atau resepsionis yang berjaga atau sudah berganti menjadi online mesin ai semuanya ditunggu updatenya terima kasih,KOMPETITOR,Bintang 3,HoteldafamPekalongan,neutral,Lokasi & Akses Strategis
yulianto muhammad,2025,5,harganya terjangkau dan kamar dansanya nyaman,KOMPETITOR,Bintang 3,HoteldafamPekalongan,positive,Kebersihan & Kenyamanan Kamar
Dede “Dede Ramadhan” Rizki Ramadhan,2025,2,Sebenrnya lumayan cman dateng saat ini saat ini saat puasa untuk sarapanya lama banget karena alacarte kamar jadi lah dengan harga segini kyknya kurang berbaloi,KOMPETITOR,Bintang 3,HoteldafamPekalongan,negative,Harga & Value for Money
Yeti Fatimah,2025,4,Saya beserta anak cucu menginap di hotel dafam pekalongan untuk urusan liburan kamarnya bersih ac dan tv bagus sarapannya layaknya untuk harga yang di tawarkan lokasinya strategis cucu saya nyaman senang kelihatannya,KOMPETITOR,Bintang 3,HoteldafamPekalongan,positive,Kebersihan & Kenyamanan Kamar
Fazrian Noor Romadhon,2025,4,secara keseluruhan menginap di sini menyenangkan kamarnya bersih amenities lengkap menu sarapan oke dan pelayanan juga oke semua standar bintang 3 sayangnya entah ac atau apa yang ada di dalam WC jika lampu di dalam WC dinyalakan suaranya berisik banget WCnya juga sempit untuk ukuran yang ada bak mandi tirai pembatasnya juga sudah kotor hotel lain ini strategis ke mana jika mau belanja tepat di depan hotel ada transmart yang bisa dikunjungi,KOMPETITOR,Bintang 3,HoteldafamPekalongan,positive,Kebersihan & Kenyamanan Kamar
hebo adhi,2025,5,kolam renang terbuka keramiknya menyebabkan luka d kaki anak saya perlu banyak berbenah dengan fasilitas kamar,KOMPETITOR,Bintang 3,HoteldafamPekalongan,neutral,Fasilitas Hotel (Kolam/Gym/Spa)
Rizki Medianto,2025,5,hotel yang nyaman di kota pekalongan lokasinya juga strategis di kota minesnya mungkin cuma jalan akses masuk ke hotel yang dibuat lumayan nanjak sehingga pejalan kaki yang sudah sepuh jika mau keluar masuk hotel harus hati hati dan usaha kemudian parkir basement mobil yang agak sempit selain itu mantap semua pokoknya,KOMPETITOR,Bintang 3,HoteldafamPekalongan,positive,Lokasi & Akses Strategis
Wisnu Prabowo,2025,5,hotel nyaman cocok untuk keluarga dengan lokasi sangat strategis di pusat kota tempat parkir yang luas,KOMPETITOR,Bintang 3,HoteldafamPekalongan,positive,Lokasi & Akses Strategis
S MUDAKIR,2025,5,hotel yang strategis sangat nyaman wangi restoran enak terutama musik nya saya menginap di royal sweet lantai 9 view transmart,KOMPETITOR,Bintang 3,HoteldafamPekalongan,positive,Kebersihan & Kenyamanan Kamar
Hana Asyifa,2025,4,hotelnya lumayan kaman bersih waktu cek masuk juga cepat kamar sudah tersedia sesua permintaan ada kolam renangnya,KOMPETITOR,Bintang 3,HoteldafamPekalongan,positive,Kebersihan & Kenyamanan Kamar
mohammad reza,2025,3,hotel strategis didepan transmart parkir tersedia dibawah kamar bersih ac dingin kolam renang bersih ukuran kecil lift bersih lobi tidak menarik,KOMPETITOR,Bintang 3,HoteldafamPekalongan,positive,Kebersihan & Kenyamanan Kamar
BiyaShaka,2025,4,memesan kamar deluxe dapat kamar mandi pakai bak mandi kamarnya lumayan luas dapet view ke jendela rumah sebelah hotel ini saat sangat depannya transmart tinggal nyebrang saja sampai depan hotel banyak warung makan ada nasi padang juga kolam renangnya relatif kecil tapi layak banget buat mainan bocil kolamnya dilantai 2 atau 3 kalau tidak salah sarapan ada beberapa menu makanan indonesia rasanya lumayan,KOMPETITOR,Bintang 3,HoteldafamPekalongan,positive,Fasilitas Hotel (Kolam/Gym/Spa)
Aulia Alsiko,2025,5,bersih kamar mandi ramah pelayanan kantin reservasi dan petugas lainnya sayang di kamar tidak ada lemari mini untuk taruh pakaian,KOMPETITOR,Bintang 3,HoteldafamPekalongan,positive,Kebersihan & Kenyamanan Kamar
Aldimaz Adams,2025,3,ac kamar tidak dingin berisik banget dan sudah lama model acnya restonya jorok semua piring dan sendok berminyak mungkin hanya di lap tidak di cuci untuk hotel harga 500 ribu tidak rekomen terimakasih semoga membangun,KOMPETITOR,Bintang 3,HoteldafamPekalongan,negative,Kualitas Makanan & Restoran
Gerry Marley,2025,5,bagus cuma ac y agak jadul sarapan lengkap pelayanan ramah ob y percaya saya ketinggalan dompet alhamdulillah aman tidak berubah,KOMPETITOR,Bintang 3,HoteldafamPekalongan,positive,Kualitas Makanan & Restoran
Fauzan Rifqi Nugroho,2025,5,21 Mei 2024 menginap di sini karena ada pemantauan dan evaluasi pekerjaan rekonstruksi jalur pantura interior bersih dan kasurnya empuk namun pada lantai kayunya ada sebagian yang copot dan rawan tersandung menu sarapan variatif namun untuk bakar roti tawar minta ke pelayan karena roti dibakar di pantry rahasia mereka rasa makan lumayan lokasinya sekitar 300 meter dari perempatan ponolawen pekalongan jalur pantura akses keluar masuk sempit dan membutuhkan keandalan mengemudi mobil,KOMPETITOR,Bintang 3,HoteldafamPekalongan,positive,Kebersihan & Kenyamanan Kamar
Ani Maria,2024,5,kamar executive bed tunggal luas untuk berdua dengan bantal empat kamar bersih lengkap kettle hair dryer yang berfungsi baik serta terawat bersih kolam renang gym komplot serta luas pelayanan baik saran untuk ac direhab karena bising suaranya sarapan segi rasa enak segi varian termasuk sudah cukup varian kenyamanan parkir luas petugas selalu siap siaga dan kelebihan hotel ini kawasan kanan kiri ramai toko serta si di depan hotel adalah transmart dan xxi kalau lagi jenuh jalan atau atas film di xxi terima kasih atas menonton pelayanan hotel dafam pekalongan sukses terus ke depannya amin,KOMPETITOR,Bintang 3,HoteldafamPekalongan,positive,Fasilitas Hotel (Kolam/Gym/Spa)
Fitria Dewi Wiharyani,2024,2,layanan resepsionis dan keamanan sangat baik hanya saja kamarnya seperti hotel lama banyak debu di setiap sudutnya kamar mandinya cukup bersih tapi tangan dan tirainya sudah tidak putih keran wastafel dan keran bathub nya sudah karatan kamar mandinya modelnya juga kurang ramah anak dan lansia karena ada undakan2nya untuk harga hotel bintang 4 dengan fasilitas yang seadanya dan sudah lama tidak diperbaiki kemahalan sih tidak layak untuk transit ya lumayan tapi untuk tinggal dengan waktu yang lama tidak direkomendasikan sebelum adanya perbaikan lokasi sudah bagus dekat kota dan depannya transmart yang ada trans studio nya jika diperbaiki,KOMPETITOR,Bintang 3,HoteldafamPekalongan,negative,Kebersihan & Kenyamanan Kamar
Sisca Pamelia,2024,4,kami singgah di pekalongan untuk istirahat semalam tanpa rencana ke bbrp hotel lg penuh karena kelompok akhirnya pergi menunjukkan ke dafam hotel tanya tarif nya kok perbedaan harga untuk kamar standar nya agak lumayan resepsi ksh 650k net nite kami cek via ota hanya 427net kemudian memutuskan untuk pesan lewat ota saja menurut kami seharusnya bisa dikasih harga yang setidaknya sama karena tidak harus komisi ke ota ya tapi ya bayar kebijakan pendapatan manajemen setiap hotel beda2 resepsi nya cantik hanya kurang responsif begitu tamu menghampiri meja baru dia menyapa setelah tamu yang menyapa lebih dulu klo biasa nya resepsi lebih sigap melihat tamu,KOMPETITOR,Bintang 3,HoteldafamPekalongan,negative,Harga & Value for Money
Arini Natasya,2025,1,kamar 614 dan 616 parah kamar mandi kotor pintu kamar mandi tidak bisa ditutup dudukan WC kuning menghubungkan pintu tidak bisa ditutup tembok berjamur sprei kuning pokoknya parah,KOMPETITOR,Bintang 3,HoteldafamPekalongan,negative,Harga & Value for Money
Mutiara Sofiane,2025,5,kesini ada acara barista idplay kolaborasi sama kemenkop ukm secara keseluruhan memuaskan ruangan nyaman staf nya ramah dan sangat kooperatif cuman kurang ada hiasan bunga di meja buat penerima tamu ruangan acara ajasih kalau ada pasti lebih terlihat glamor terimakasih tim dafam,KOMPETITOR,Bintang 3,HoteldafamPekalongan,positive,Kebersihan & Kenyamanan Kamar
Riski Adri Permatasari,2025,5,pelayanan bagus banget resepsionis ramah kamar cukup bersih kamar mandi juga cukup cuma emang jet showernya kenceng banget ya semprotan udara airnya panas nya kurang panas buat isi mandi nya lokasi cukup strategis cari makan bisa tinggal jalan kaki untuk sarapannya mungkin bisa ditambah menu lain dan rasanya bisa ditambah lagi,KOMPETITOR,Bintang 3,HoteldafamPekalongan,positive,Kebersihan & Kenyamanan Kamar
Monica Octavianti,2025,5,kamar nya bagus dingin dan bersih menu sarapan nya enak dan banyak berikutnya jika ada kesempatan akan tinggal di sini lagi,KOMPETITOR,Bintang 3,HoteldafamPekalongan,positive,Kebersihan & Kenyamanan Kamar
Enny Nuraini,2024,4,pesan kamar menghadap transmart bagus sih jadi view nya tidak monoton bisa melihat lalu lalang kendaraan pelayanan resepsionis kurang senyum jadi kurang ramah padahal ganteng2 lho karyawannya wkwkwk mungkin bisa ditingkatkan lg agar full smile hermes ke setiap tamu ada fasilitas kolan renang nya oke buat anak2 senang buruknya tv kabel nya beda tayangan jadi tidak bisa menonton bola vietnam vs indo,KOMPETITOR,Bintang 3,HoteldafamPekalongan,positive,Fasilitas Hotel (Kolam/Gym/Spa)
SBS Channel,2025,5,kamar sih bersih standar hotel bintang 3 layanan juga bagus hanya lokasinya di daerah yang sering terdampak kemacetan bis bisa masuk cuman agak sulit untuk manuver,KOMPETITOR,Bintang 3,HoteldafamPekalongan,positive,Kebersihan & Kenyamanan Kamar
Ina Inawa,2025,5,Pelayanan sangat baik dan ramah lokasi strategis depan transmart kalau sakit banyak yang menjual makanan di tepi jalan sayang ruangannya terutama kamar mandi desainnya tidak ramah untuk lansia,KOMPETITOR,Bintang 3,HoteldafamPekalongan,negative,Kebersihan & Kenyamanan Kamar
Arief Hadi Jeje,2025,5,nyaman dan bersih yang paling asyik berseberangan sama transtudio jadi ngajak anak2 sangat dianjurkan,KOMPETITOR,Bintang 3,HoteldafamPekalongan,positive,Kebersihan & Kenyamanan Kamar
adiel adiel,2025,3,menginap di lt 6 ac gk dingin hari pertama bocor banjir ac nya mlm ny ac d memperbaiki tapi tetap gk dingin untung anak2 masih bisa tidur kamar mandi kalau bole saran bathub ny di hilangin saja soalnya tinggi banget kasian orang tua memperbaiki mandi biasa sama tlg kalo suru ngreview jangan di tunggu donk mentang2 deposit belum mrk mnta secara haluss buat ngisi bintang 5 jadi kt sbg tamu gk bisa jujur review,KOMPETITOR,Bintang 3,HoteldafamPekalongan,negative,Harga & Value for Money
tabita nandika,2025,5,Terimakasih untuk kak ivi petugas fo yang baik dan ramah selama pelayanan ci dn co semoga bisa bertemu di waktu lain saat kunjungan ke pekalongan lagi sedikit catatan untuk kamar mandi mgkin kelewatan pengecekan krna masih ada tisu kotor di area toilet kmrin selebihnya oke,KOMPETITOR,Bintang 3,HoteldafamPekalongan,positive,Pelayanan Staf & Keramahan
Dian Sosro,2024,5,kamarnya gede sarapannya banyak varian dan enak kamar mandinya bersih juga cuman emang penerangan kamarnya tipe yang redup remang remang kayanya kurang cocok kalau mau kerja buka laptop depannya persis ada transmart asik kalau mau belanja kudu coba wedang jahenya saat banget anget dan manisnya,KOMPETITOR,Bintang 3,HoteldafamPekalongan,positive,Kebersihan & Kenyamanan Kamar
Tania Zenitha,2024,4,lokasinya dekat dengan stasiun depannya ada supermarket ke kafe juga dekat kalau malam kanan kiri banyak warung jadi tidak perlu takut kelaparan cek masuk tengah malam karena jadwal kereta jadi tidak sempat foto kamarnya sarapannya banyak macam tapi kue dan pencuci mulut nya perlu ditingkatkan ya citarasanya warna-warni tapi rasanya mirip semua untuk sereal lebih baik dengan susu penuh krim drpd susu rasa cokelat stafnya dan berguna berikutnya kalau ke pekalongan kesini mau coba lagi ramah kolam renangnya,KOMPETITOR,Bintang 3,HoteldafamPekalongan,positive,Lokasi & Akses Strategis
mannissaputri,2025,5,pelayanan dengan sangat baik tempatnya juga sangat memuaskan terimakasih untuk fasilitasnya juga sangat baik dengan mba margareta pelayanan terjamin,KOMPETITOR,Bintang 3,HoteldafamPekalongan,positive,Lokasi & Akses Strategis
Ggyt Fjwhjg,2024,1,Yang paling saya ingat kalau menginap di hotel ini adalah masakannya yang amburadul menu menu makanan bener2 tidak ada yang enak sekali lagi ancur kelas hotel seharusnya memakai koki ini menu ala orang kampung tapi rasa blas tidak ada sedepnya mahal untuk ukuran masakan seperti itu mencoba lagi makanan lain tetap saja tidak enak semuanya tidak ada yang enak ntah apa yang ingin dibanggakan dari hotel ini semoga segera berbenah agar pelanggan tidak kabur,KOMPETITOR,Bintang 3,HoteldafamPekalongan,negative,Kualitas Makanan & Restoran
Nuriko Amri Salam,2024,2,1 wifi kamar sangat leot dan parah khususnya di lantai 8 menonton youtube kualitas 360p kurang lancar pokoknya parah kalau untuk wifi 2 ada petugas kantor depan yang kurang ramah 3 waktu saya sarapan pukul 08:40 wib stok telur sudah habis padahal waktu sarapan sampai pukul 10:00:4 krim tidak disediakan di meja kopi harus minta dulu 5 kamar mandi kurang bersih kesimpulan untuk kualitas hotel bintang 3 menurut saya kurang layaknya itu,KOMPETITOR,Bintang 3,HoteldafamPekalongan,negative,Kebersihan & Kenyamanan Kamar
Rachmat Triandi,2025,5,Saya dalam perjalanan bersama keluarga dari malang ke jakarta pekalongan adalah tempat yang saat ini tidak sedekat semarang dan tidak sejauh tegal lokasi hotel dekat dengan rumah rumah makan dan jajanan jalan juga dekat dengan mal kamar hotel bersih pemandangan baik dari lantai 7 kamar mandi bersih layanan baik parkirnya agak padat tapi masih teratur saya tidak memilih paket dengan sarapan,KOMPETITOR,Bintang 3,HoteldafamPekalongan,positive,Kebersihan & Kenyamanan Kamar
Bojonegoro Local Guide,2025,5,lampu kamar terlalu berkurang mohon di ganti ya kawan,KOMPETITOR,Bintang 3,HoteldafamPekalongan,neutral,Harga & Value for Money
Nurul Aini,2025,5,tempat strategis karna dekat mall untuk cari makan diluar juga dekat bisa jalan kaki pelayanan juga sangat ramah kebersihan untuk kamar jug oke area lobi juga rapi enak dipandang kolam bersih,KOMPETITOR,Bintang 3,HoteldafamPekalongan,positive,Kebersihan & Kenyamanan Kamar
Yoko,2024,4,25 04 23 cek masuk jam menunggu sekitar 20 menit karena kamar msh siap dan jam ada deposit 50rb petugas resepsionis hanya 1 org agak kewalahan menerima tamu yang lumayan banyak kamar bersih udara panas tidak berfungsi dengan baik ac dingin kolam renang perlu diperbaiki kebersihan udara sarapan lumayan enak tapi variasi menuunya tidak terlalu banyak lokasi sangat strategis berhadapan dengan transmart dan sepanjang jalan dpn hotel banyak kulineran jika malam hari,KOMPETITOR,Bintang 3,HoteldafamPekalongan,negative,Kebersihan & Kenyamanan Kamar
Sela Listianingsih22,2025,5,hotel nya nyaman dan kamar nya wangi rapih ada kolam renangnya dan gym nya banyak menu yang disajikan saat sarapan dari makanan tradisional dan telur dan makanan berat pelayanan juga sangat baik dan orang nya ramah ramah dan penuh senyum,KOMPETITOR,Bintang 3,HoteldafamPekalongan,positive,Fasilitas Hotel (Kolam/Gym/Spa)
Ade Restina Putri,2025,1,hotel kotorr banyak bekas serangga tapi tidak di bersihkan hotel peralatannya juga sudah tua serem,KOMPETITOR,Bintang 3,HoteldafamPekalongan,negative,Harga & Value for Money
