User Name,Review Time,Rating,clean_text,Tipe,Kelas,Nama_Hotel,AI_Sentiment,AI_Aspek
Steven Carlo,2025,5,tinggal di Movenpick pusat kota selama empat malam delapan 12 Juni kesan pertama semua orang di sini sangat ramah terutama Ruth di resepsi yang selalu mengingat nama saya dan sangat membantu selama tinggal saya dia membuat tinggal saya layak kamar yang indah indah indah besar layar TV dengan youtube dan netflix ada masalah dengan drainase tapi tim berpikir itu keluar dengan cepat sangat cepat sarapan sangat hebat hashbrowns salmon sushi dan terbaik dari semua roti bakar Perancis tidak bisa mendapatkan cukup dari itu terima kasih rosyid di sarapan alan di sarapan dia,KOMPETITOR,Bintang 5,MovenpickHoteljakartaCityCentre,positive,Pelayanan Staf & Keramahan
Dela,2019,4,sudah tiga kali mengunjungi hotel ini dan tidak pernah kecewa staf ada selama 24 jam mereka membantu dan selalu baik kamarnya besar bahkan jika Anda hanya memesan untuk tipe standar kebersihan luar biasa fasilitas yang bekerja baik suasana di sekitar hotel adalah baik lingkungan masuk koridor juga baik dan ada cukup sofa untuk membuat Anda merasa nyaman sementara menunggu bagian favorit saya adalah sarapan itu memiliki sarapan masuk kota pasti saya pikir mereka harus mempromosikan lebih,KOMPETITOR,Bintang 5,MovenpickHoteljakartaCityCentre,positive,Kebersihan & Kenyamanan Kamar
Jimmy B,2025,5,Kami telah menemukan bahwa kami memiliki beberapa orang yang telah bekerja di rumah kami untuk membuat kami memiliki beberapa hal yang sangat baik untuk Anda untuk pergi ke rumah Anda untuk pergi ke rumah Anda untuk pergi ke rumah Anda untuk pergi ke rumah Anda untuk pergi ke rumah Anda untuk pergi ke rumah Anda untuk pergi ke rumah Anda untuk pergi ke rumah Anda untuk pergi ke rumah Anda untuk pergi ke rumah Anda untuk pergi ke rumah Anda untuk pergi ke rumah Anda untuk pergi ke rumah Anda untuk pergi ke rumah Anda untuk pergi ke rumah Anda untuk pergi ke rumah Anda untuk pergi ke rumah Anda untuk pergi ke rumah Anda untuk pergi ke rumah Anda untuk pergi ke rumah Anda untuk pergi,KOMPETITOR,Bintang 5,MovenpickHoteljakartaCityCentre,neutral,Lokasi & Akses Strategis
Ridzon,2025,5,Dari layanan pelanggan menurut saya bagus sekali,KOMPETITOR,Bintang 5,MovenpickHoteljakartaCityCentre,positive,Harga & Value for Money
Hendra Lesmana,2025,5,tempatnya bersih dan nyaman makanannya enak kopinya mantap ada mesin kopi di kamar espresso juga ada saat sarapan,KOMPETITOR,Bintang 5,MovenpickHoteljakartaCityCentre,positive,Kebersihan & Kenyamanan Kamar
N'Doua Bossard,2025,5,Ayahku dan aku datang ke sini dan kami hanya terkejut betapa sempurna semuanya,KOMPETITOR,Bintang 5,MovenpickHoteljakartaCityCentre,positive,Harga & Value for Money
Harry Susanto,2025,5,hotelnya bagus fasilitasnya juga mewah,KOMPETITOR,Bintang 5,MovenpickHoteljakartaCityCentre,positive,Harga & Value for Money
Ahmad Haetami,2025,5,pelayanannya baik ramah nyaman,KOMPETITOR,Bintang 5,MovenpickHoteljakartaCityCentre,positive,Kebersihan & Kenyamanan Kamar
wahyu,2025,5,ruang pertemuan bagus makanan enak,KOMPETITOR,Bintang 5,MovenpickHoteljakartaCityCentre,positive,Kualitas Makanan & Restoran
Yusup Supriatna,2025,5,fasilitas nyaman lengkap,KOMPETITOR,Bintang 5,MovenpickHoteljakartaCityCentre,positive,Kebersihan & Kenyamanan Kamar
Jordan Sapta Gihon Napitupulu,2025,5,layanan yang baik lokasi yang baik akan kembali lagi,KOMPETITOR,Bintang 5,MovenpickHoteljakartaCityCentre,positive,Harga & Value for Money
shakun realty,2025,1,Hotel baru tapi semua layanan masih tidak terbuka tidak disarankan untuk wisatawan kami telah memesan 6 kamar untuk perayaan kami tetapi kolam renang tidak berfungsi kamar memiliki masalah sampai tengah malam ada beberapa pekerjaan konstruksi terjadi semua kamar beberapa masalah atau lain ac masuk 1 titik plug tidak bekerja masuk lain dan kunci tidak bekerja masuk beberapa secara keseluruhan tidak akan menyarankan untuk wisatawan juga lokasi tidak terlalu baik jauh dari pusat perbelanjaan dan jalan-jalan tinggi,KOMPETITOR,Bintang 5,MovenpickHoteljakartaCityCentre,negative,Fasilitas Hotel (Kolam/Gym/Spa)
Victoria Beckham,2025,5,Tempat yang sangat dianjurkan untuk memiliki waktu yang berkualitas,KOMPETITOR,Bintang 5,MovenpickHoteljakartaCityCentre,positive,Harga & Value for Money
Teguh Iman,2025,5,fasilitas dan pelayanannya sangat baik,KOMPETITOR,Bintang 5,MovenpickHoteljakartaCityCentre,positive,Harga & Value for Money
abdullah effendi,2025,5,Ruang pertemuan nya bagus bersih nyaman serta pelayanan nya sangat bagus untuk hotelnya sendiri terlihat baru di bangun,KOMPETITOR,Bintang 5,MovenpickHoteljakartaCityCentre,positive,Kebersihan & Kenyamanan Kamar
Jenny Ong,2025,5,Ruang yang tenang bagus untuk bekerja,KOMPETITOR,Bintang 5,MovenpickHoteljakartaCityCentre,positive,Kebersihan & Kenyamanan Kamar
Alii jbreall,2025,5,Hotel yang sangat bagus dan ramah,KOMPETITOR,Bintang 5,MovenpickHoteljakartaCityCentre,positive,Pelayanan Staf & Keramahan
Sandi Noviyana,2025,5,kamar nya bersih wangi pelayananan kamar nya bagus staf nya ramah cukup memuaskan menginap dihotel pindah pilih pusat kota jakarta,KOMPETITOR,Bintang 5,MovenpickHoteljakartaCityCentre,positive,Kebersihan & Kenyamanan Kamar
Deni Wahyudianto,2025,5,strategiis banyak kuliner di area hotel dan bersih,KOMPETITOR,Bintang 5,MovenpickHoteljakartaCityCentre,positive,Kualitas Makanan & Restoran
Delita Ayu,2025,5,kamarnya enak bersih masih baru banget kayanya ya hehe makanannya enak banget super nyaman nginep disini hihi,KOMPETITOR,Bintang 5,MovenpickHoteljakartaCityCentre,positive,Kebersihan & Kenyamanan Kamar
Sutrisna Tisna,2025,5,parkir luas tempatnya nyaman,KOMPETITOR,Bintang 5,MovenpickHoteljakartaCityCentre,positive,Kebersihan & Kenyamanan Kamar
Arqinand Arby,2025,5,Hotel baru yang bagus di jakarta kamarnya bersih stafnya ramah dan baik terima kasih untuk seluruh staf mövenpick jakarta besar terima kasih untuk nimas sebagai staf hk,KOMPETITOR,Bintang 5,MovenpickHoteljakartaCityCentre,positive,Kebersihan & Kenyamanan Kamar
Arifien M.,2019,5,Saat mereview ini saya sedang tinggal di sini kamar cukup nyaman pelayanan juga ramah fasilitas kamar juga lengkap wifi oke dan lancar bersih view menarik di lantai tinggi lokasi juga bagus di tengah kota jakarta kolam renang juga luas dan bersih handuk juga bersih saran saja untuk minum udara botol di kamar hanya ada 2 ukuran 330ml mungkin bisa lebih dari jumlah atau ukurannya karena di kamar tidak ada minibar,KOMPETITOR,Bintang 5,MovenpickHoteljakartaCityCentre,positive,Kebersihan & Kenyamanan Kamar
Sandi Yugie,2020,5,Secara pengalaman sangat menyenangkan menginap di hotel ini fasilitasnya sangat lengkap dan sangat bagus untuk kelas bintang 4 kamarnya sangat nyaman dan cukup luas gym dan kolam renangnya baik spa nya sangat bagus pelayanannya loungenya eksekutif juga menyediakan menu variatif dan ternyata ada koktail malamnya juga tempatnya sangat privasi dan cocok untuk bekerja setelah perjalanan bisnis sangat rekomendasi lah untuk penginapan dipusat kota jakarta,KOMPETITOR,Bintang 5,MovenpickHoteljakartaCityCentre,positive,Fasilitas Hotel (Kolam/Gym/Spa)
Kevin Lie,2025,5,Staf yang ramah makanan yang baik LED display adalah superb sistem suara super baik klien saya sangat senang dengan hotel,KOMPETITOR,Bintang 5,MovenpickHoteljakartaCityCentre,positive,Pelayanan Staf & Keramahan
Mario Rio,2025,5,sangat bagus sangat memuaskan pelayanan,KOMPETITOR,Bintang 5,MovenpickHoteljakartaCityCentre,positive,Harga & Value for Money
Muhammad Irzani Nuzal,2025,5,kamar nyaman dan lebar pelayanan mantap kesan unik saat ke lobi n resto ada boneka teddy bear yang lucu lucu,KOMPETITOR,Bintang 5,MovenpickHoteljakartaCityCentre,positive,Kebersihan & Kenyamanan Kamar
Nur Fauziah Amelia,2020,5,Di bulan puasa ini disediakan sahur untuk tamu hotel menuunya variatif dan rasanya enak kamarnya nyaman dan bersih pencahayaan sangat bagus kolam renang pun menawarkan pemandangan yang sangat menarik dekat dengan tempat wisata kota tua di deoan hotel banyak pilihan kuliner yang mak nyus,KOMPETITOR,Bintang 5,MovenpickHoteljakartaCityCentre,positive,Kebersihan & Kenyamanan Kamar
Chiara J,2019,5,hotel alila ini cukup besar dan bagus kamarnya cukup luas dan bersih kamar mandi nya pun bersih pelayanannya sangat baik dan memuaskan kolam renangnya juga besar namun agak ramai makanannya enak dan cukup cepat penyajiannya saat malam hari juga ada film pada tempat berenangnya cukup unik,KOMPETITOR,Bintang 5,MovenpickHoteljakartaCityCentre,positive,Kebersihan & Kenyamanan Kamar
Aulia Rizka,2025,5,hotel kualitas sangat memuaskan,KOMPETITOR,Bintang 5,MovenpickHoteljakartaCityCentre,positive,Harga & Value for Money
koko meoonk,2025,5,semuanya istimewa dilayani dengan profesional,KOMPETITOR,Bintang 5,MovenpickHoteljakartaCityCentre,positive,Harga & Value for Money
Rivan Deka,2025,5,staf hotel bagusnya ramah ramah,KOMPETITOR,Bintang 5,MovenpickHoteljakartaCityCentre,positive,Pelayanan Staf & Keramahan
Aryati Kartika,2025,5,kenyamanan mewah dan nilai besar terima kasih,KOMPETITOR,Bintang 5,MovenpickHoteljakartaCityCentre,positive,Harga & Value for Money
Fortina Jean Prasasti,2025,5,lokasi strategis dan makanannya enak,KOMPETITOR,Bintang 5,MovenpickHoteljakartaCityCentre,positive,Kualitas Makanan & Restoran
Ernie M. Surya,2025,5,layanan makanan kanton yang bagus,KOMPETITOR,Bintang 5,MovenpickHoteljakartaCityCentre,positive,Kualitas Makanan & Restoran
Nanang Tri wibowo,2025,5,Hotel baru kamarnya bersih kamar pembantu kamarnya nya ramah staf nya baik kamar bagus enak di lihat ah mantap,KOMPETITOR,Bintang 5,MovenpickHoteljakartaCityCentre,positive,Kebersihan & Kenyamanan Kamar
Elle Kathryn,2025,5,Aku dan keluargaku sangat senang. Aku tidak bisa merekomendasikan lebih banyak.,KOMPETITOR,Bintang 5,MovenpickHoteljakartaCityCentre,positive,Harga & Value for Money
fajarria larasati (Laras Sgaracita),2019,4,Bus staycation lumayan interior kamar biasa banget buat ukuran hotel plusnya ada bak mandi dan fasilitas yang oke banget terutama tehnya kondisioner harus diminta sarapan standar kolam renang di lantai 6 oke banget buat leyeh2 sepi dan semilir angin nya menenangkan menyenangkan,KOMPETITOR,Bintang 5,MovenpickHoteljakartaCityCentre,positive,Kebersihan & Kenyamanan Kamar
Ilham Guntara,2019,5,hotel dengan kualitas bagus dan cukup mewah yang berada strategis di pusat kota jakarta sangat dekat dengan stasiun juanda sehingga mudah untuk dijangkau menggunakan fasilitas krl yang ditawarkan juga cukup baik dengan pelayanan prima dan ramah makanan dan minuman yang ditawarkan enak dan lezat restoran menyajikan menu yang memuaskan dengan cita rasa dan variasi berbagai rupa,KOMPETITOR,Bintang 5,MovenpickHoteljakartaCityCentre,positive,Kualitas Makanan & Restoran
Takk Shun,2020,5,Hotel dan layanan bangunan besar tua tapi mereka bersih dan Anda tidak menyadari itu tua bahwa banyak staf ramah ukuran kamar hanya ukuran yang baik untuk 2 orang sarapan dan berbagai pilihan dan rasa baik saya ingin kembali masuk masa depan,KOMPETITOR,Bintang 5,MovenpickHoteljakartaCityCentre,positive,Kebersihan & Kenyamanan Kamar
Reresyw,2019,3,menghabiskan malam tinggal masuk hotel ini untuk acara bagus ruang dansa bagus dan bersih lobi nyaman restoran tapi itu menjadi begitu padat pada waktu makan siang kita hampir tidak mendapatkan bersih meja dan kursi saya ingin memiliki pengering rambut masuk kamar saya daripada minibar juga beberapa soket listrik di tempat tidur sarapan harus ditingkatkan,KOMPETITOR,Bintang 5,MovenpickHoteljakartaCityCentre,negative,Kebersihan & Kenyamanan Kamar
Lubab Saifuddin,2025,5,suasana yang baik dengan sarapan yang sangat lezat,KOMPETITOR,Bintang 5,MovenpickHoteljakartaCityCentre,positive,Kualitas Makanan & Restoran
Tekad Matulatan,2018,4,Hotel yang dapat dicapai langsung dari bandara dengan bus tempat nyaman untuk menginap dengan berbagai fasilitas kolam renang tidak menyediakan pakaian renang sehingga Anda bebas berenang memakai celana dalam Anda pemandangan dari kamar Anda jika Anda beruntung Anda dapat melihat monumen nasional obelisik tinggi dengan api emas di atas kamar lain hanya memiliki pemandangan di area perumahan penuh sesak sarapan hanya baik-baik saja tetapi selama tiga hari dan seterusnya Anda akan bosan,KOMPETITOR,Bintang 5,MovenpickHoteljakartaCityCentre,positive,Fasilitas Hotel (Kolam/Gym/Spa)
januar w wibowo,2025,5,kunjungi mövenpick untuk pertemuan ruang pertemuan bersih dan memiliki arsitektur yang baik tempat parkir bagus tapi hanya ada ruang sempit untuk berputar,KOMPETITOR,Bintang 5,MovenpickHoteljakartaCityCentre,positive,Kebersihan & Kenyamanan Kamar
Rahma Sulistya,2020,5,hotel di tengah ibu kota jakarta tapi rasa bali apalagi kolam renang nya oke makanannya juga uenak semua dianjurkan untuk menginap pasangan saat akhir pekan atau bersama keluarga karena ada kamar yang gede banget antara harga dan kenyamanan juga sesuai,KOMPETITOR,Bintang 5,MovenpickHoteljakartaCityCentre,positive,Kebersihan & Kenyamanan Kamar
Damarjoyo,2020,5,kamar yang sangat baik makanan dan layanan aku menghabiskan malam masuk ruang eksekutif direnovasi yang sangat bagus begitu banyak ruang terang dan bersih kamar mandi itu lokasi dekat area kuliner pecenongan Anda dapat berjalan ke daerah sekitar untuk menemukan makanan ramah staf sarapan yang baik dengan keragaman besar makanan indonesia dan barat,KOMPETITOR,Bintang 5,MovenpickHoteljakartaCityCentre,positive,Kebersihan & Kenyamanan Kamar
Abizar Algifari,2025,5,Hotel yang sangat baik dan staf yang ramah,KOMPETITOR,Bintang 5,MovenpickHoteljakartaCityCentre,positive,Pelayanan Staf & Keramahan
Joshua Frost,2025,5,Dekor yang sangat lucu dan makanan layanan cepat adalah lampu yang bagus dan staf yang ramah,KOMPETITOR,Bintang 5,MovenpickHoteljakartaCityCentre,positive,Pelayanan Staf & Keramahan
theressa subali,2020,5,Layanan hotel yang bagus fasilitas gym yang tenang baik dengan sauna di dalam tapi kolam renang cukup kecil Anda dapat rileks tubuh Anda untuk mengambil Bali pijat spa juga yang membutuhkan waktu sekitar 45 menit,KOMPETITOR,Bintang 5,MovenpickHoteljakartaCityCentre,positive,Fasilitas Hotel (Kolam/Gym/Spa)
Azharia Devi,2025,1,dapet pengalaman tidak enak di hotel ini mengklaimnya bintang 5 tapi sikap pegawainya bintang 1 saat datang dan tas masuk x ray petugas keamanan bilang ibu ini tas nya ada pistolnya ya padahal dia bisa melihat pengamat loh sangat tidak enak banget dituduh seperti itu dan tidak ada permintaan maaf 2 resepsionis tidak ramah dan bahasa yang digunakan tidak enak seolah menyalahkan tamu yang datang 3 saya sewa ruang pertemuan setelah istirahat kamar tidak membersihkan saat minta petugasnya untuk membersihkan masnya seolah terpaksa dan mengambil grubuk saat merefill minuman pintu dibanting saat kita lagi bertemu 4 makan siang dan makan malam di resto jg tidak langsung,KOMPETITOR,Bintang 5,MovenpickHoteljakartaCityCentre,negative,Pelayanan Staf & Keramahan
Rio,2025,1,ditanya password wifi ruang pertemuan petugas kekeh banget kalau mesti log masuk sebagai anggota accor jika bukan anggota accor terus gimana seharusnya wifi sudah menjadi bagian dari fasilitas pertemuan dong terlepas anggota atau bukan yang terburuk lagi kami bawa kotakan snack dan kopi dari luar hotel untuk dimakan bersama di ruang pertemuan biaya tambahan 50rb per kotak baru kali ini punya pengalaman paket pertemuan di hotel ada yang seperti ini pasti tidak akan kembali dan tidak akan merekomendasikan orang-orang di sini untuk memiliki pertemuan,KOMPETITOR,Bintang 5,MovenpickHoteljakartaCityCentre,negative,Infrastruktur (AC/WiFi/Parkir/Air)
Chris Simon Sihombing,2025,1,w pagi bawa motor terus kartu uang elektronik w saat tab tahu sudah terdaftar dan kendaraan sudah dalam parkir keamanan datang bukannya bantuin malah suruh w parkir diluar dipinggir jalan kesel banget bukannya bantuin malah kayak ngusir w parkir diluar yang bermasalah mesin parkirnya kenapa w disuruh parkir diluar akhirnya w parkir diluar dipinggir jalan sebrang hotel karena w ada pertemuan pagi biar tidak lama dan laki-laki berdebat saat sudah w parkir diluar w tanya resepsiya terus bantuin karena petugas parkir tidak berdiri di hotel saat sudah bisa w diminta ambil kartu parkir w dan katanya w masuknya tidak perlu,KOMPETITOR,Bintang 5,MovenpickHoteljakartaCityCentre,negative,Lokasi & Akses Strategis
Sari Permata,2025,1,Pengolahan rumah tangga lambat staf resto kurang ramah makanan di resto tidak cepat diresmikan untuk makan malam pesan makan untuk 100 orang tapi yang makan baru 40 orang makanannya sudah habis dan belum diresmikan satu lagi yang cukup penting satpamnya tidak menunggu,KOMPETITOR,Bintang 5,MovenpickHoteljakartaCityCentre,negative,Kualitas Makanan & Restoran
Yogi Yastinanda,2025,1,Tidak profesional sekali resepsionisnya menanyakan harga tarif kamar dengan telepon malah ditinggal tidak dijawab,KOMPETITOR,Bintang 5,MovenpickHoteljakartaCityCentre,negative,Harga & Value for Money
Irwansyah Iwan,2025,1,Terimakasih banyak untuk pelayan yang bernama dian puji lestari atas keramahannya,KOMPETITOR,Bintang 5,MovenpickHoteljakartaCityCentre,positive,Pelayanan Staf & Keramahan
ExChristian,2025,1,hotel ini tidak layak disebut hotel bintang 5 pelayanannya seperti bintang 1,KOMPETITOR,Bintang 5,MovenpickHoteljakartaCityCentre,negative,Harga & Value for Money
Okta Dharmawan,2018,1,terpaksa memberi bintang sebenarnya tidak perlu bintang untuk hotel yang sangat tidak profesional sekelas alila tanyakan pada manajemen apa yang telah mereka lakukan pada alumni smak1 87 untuk reuni yang rencananya akan diadakan pada tanggal 25 November 2017,KOMPETITOR,Bintang 5,MovenpickHoteljakartaCityCentre,negative,Harga & Value for Money
Jimmy Napitupulu Napitupulu,2019,1,pertemuan di lt 7 numpang merokok 5 minta tidak boleh dengan penjelasan yang luar biasa menghina dan merendahkan saya juga ngerti exe lounge itu apa waktu istirahat saya tidak cukup untuk menunggu angkat ke lantai 5,KOMPETITOR,Bintang 5,MovenpickHoteljakartaCityCentre,negative,Fasilitas Hotel (Kolam/Gym/Spa)
Nindyarti,2018,1,hanya ada satu ruangan pertemuan yang bagus seperti di web selebihnya kamar standar mengecewakan bandingkan gambar terlampir kopi dan teh nya tidak self service tapi tidak ada yang berdiri,KOMPETITOR,Bintang 5,MovenpickHoteljakartaCityCentre,negative,Kebersihan & Kenyamanan Kamar
sakura kori,2020,1,Saya kecurian tas berisi laptop dan dompet di restoran di hotel ini jam ini di curi oleh komplotan pelaku yang mengaku mau bertemu teman d restoran komplotan berpakaian rapi keamanan sangat kurang waspada dan siaga 1 saja jika terpaksa tidak pergi dari sini kapok rasanya,KOMPETITOR,Bintang 5,MovenpickHoteljakartaCityCentre,negative,Harga & Value for Money
Maria Go,2019,1,kamar apa kalau lewat agoda diberi yang kurang bagus karena thn ll saya tidak dengan agoda kamar merokok nya bagus ini sft tingkat 21 kamar yang lama lg ada kakao segla,KOMPETITOR,Bintang 5,MovenpickHoteljakartaCityCentre,positive,Harga & Value for Money
jeffri Santoso,2019,1,Buat yang tidak punya skala2 blh tapi kalau dari segi pelayanan lainnya saya sgt tidak puas,KOMPETITOR,Bintang 5,MovenpickHoteljakartaCityCentre,negative,Harga & Value for Money
rey fahrizal,2021,1,Saat datang reservasi ada namun kamar tidak tersedia tanpa konfirmasi sehingga harus mencari pengganti sendiri,KOMPETITOR,Bintang 5,MovenpickHoteljakartaCityCentre,negative,Harga & Value for Money
Harun Alrasyid,2020,1,bangunan lama bau di seluruh bangunan hotel tidak enak makanan kurang variatif dan kurang enak,KOMPETITOR,Bintang 5,MovenpickHoteljakartaCityCentre,negative,Kualitas Makanan & Restoran
Taufik Gunarto,2019,1,tempat parkir kurang nyaman sempit di besment jaringan komunikasi tidak bagus trutama di besment dasar,KOMPETITOR,Bintang 5,MovenpickHoteljakartaCityCentre,negative,Infrastruktur (AC/WiFi/Parkir/Air)
Ronni Hasiholan,2019,1,Saya tidak suka tempat parkirnya,KOMPETITOR,Bintang 5,MovenpickHoteljakartaCityCentre,negative,Infrastruktur (AC/WiFi/Parkir/Air)
Yuli Hasanah,2019,1,Mushola buat umumnya bau,KOMPETITOR,Bintang 5,MovenpickHoteljakartaCityCentre,negative,Harga & Value for Money
maya rosita,2019,1,parkirnya susah karena sempit,KOMPETITOR,Bintang 5,MovenpickHoteljakartaCityCentre,negative,Lokasi & Akses Strategis
apriansyah apri,2020,1,nyaman,KOMPETITOR,Bintang 5,MovenpickHoteljakartaCityCentre,positive,Kebersihan & Kenyamanan Kamar
Sekti Wibowo,2018,1,lewat,KOMPETITOR,Bintang 5,MovenpickHoteljakartaCityCentre,negative,Harga & Value for Money
Mega Chandra,2026,1,Pertama saya memesan kamar untuk menginap saya meminta udara panas saat menukarkan minuman selamat datang di kafe mereka tetapi mereka meminta kami membayar botol udara yang menurut mereka akan dipapanaskan saya tidak mengerti bagaimana pelayanannya bisa seburuk ini tidak masuk akal dan amatir kami adalah anggota accor dan ini bukan pertama kalinya saya menginap di hotel bintang 5 ini adalah pengalaman terburuk,KOMPETITOR,Bintang 5,MovenpickHoteljakartaCityCentre,negative,Infrastruktur (AC/WiFi/Parkir/Air)
Ottis Shelton,2025,1,pergi ke restoran ini untuk menikmati bir sepuasnya dan makan pizza sepuasnya tiga jam yang menyenangkan rasanya enak dan birnya dingin luar biasa di atas adalah ulasan asli saya dan saya tidak yakin apakah la Floriane bistro dimiliki oleh hotel tetapi saya dan istri saya sangat kecewa dengan layanan pelanggannya tentu saja hal ini berpengaruh ketika terjadi kesalahan saya pergi ke la Floriane bistro pada tanggal 31 Oktober untuk merayakan ulang tahun pernikahan ke 27 saya dengan istri saya untuk promo pizza dan bir mereka dan membuat reservasi 4 minggu sebelumnya yang kemudian dikonfirmasi ketika kami tiba menggunakan promo mobil kami diberi tahu bahwa itu tidak,KOMPETITOR,Bintang 5,MovenpickHoteljakartaCityCentre,negative,Kualitas Makanan & Restoran
Styven Styven,2025,1,saya menginap sekarang dan pengalaman terburuk saya dengan layanan accorr tidak ramah sekalipun memiliki 2 orang sebagai keamanan dan penjaga pintu ketika kami tiba tidak ada yang mencoba membantu membuka pintu mobil dan kami membawa semua tas tanpa menawarkan bantuan lebih dari itu ketika kami pergi memeriksa masuk resepsionis meminta saya menunggu selama 15 menit kemudian setelah 25 menit pria di resepsionis meminta saya untuk duduk dengan benar setelah 45 menit tidak ada yang datang untuk menyelesaikan memeriksa masuk kemudian saya pergi untuk menindaklanjuti yang menyuruh saya sejak dengan benar dia mengatakan kamar sudah siap duduk pria karena tidak memantaunya lama kemudian setelah 1 jam koper saya datang ke kamar mereka keluar,KOMPETITOR,Bintang 5,MovenpickHoteljakartaCityCentre,negative,Pelayanan Staf & Keramahan
Cid Kagenou,2025,1,Saya agak kecewa dengan pelayanan selama menginap terutama sekitar waktu makan siang dan makan malam pelayanan terasa cukup lambat dan staf tampak kurang ramah yang membuat saya bertanya apakah mungkin ada masalah internal yang mempengaruhi pengalaman tersebut karena itu saya akhirnya memilih untuk makan malam di luar hotel saya harap manajemen dapat menerima ini sebagai masukan yang baik dan mempertimbangkan untuk meningkatkan kualitas pelayanan,KOMPETITOR,Bintang 5,MovenpickHoteljakartaCityCentre,negative,Kualitas Makanan & Restoran
Mike Giltrow,2025,1,hotelnya indah dan stafnya berusaha sebaik mungkin namun setelah 9 bulan mereka masih mengiklankan lounge eksekutif yang sebenarnya tidak ada mereka menawarkan kedai kopi tenang untuk bekerja dan minuman di restoran untuk menemani bersantai oh tentu saja jika ada tamu kamar platinum atau eksekutif dalam jumlah tertentu seperti saat saya menginap tidak ada penawaran beberapa hari pertama karena tidak cukup banyak tamu istimewa saya mencoba tetapi manajer yang menerima pesanan saya terlalu sibuk memperbarui status facebook nya dan lupa memberikannya ke dapur jadi setelah 30 menit saya menyerah tidak ada rencana untuk membuka lounge lagi karena mereka memanfaatkan ruang tersebut untuk berbagai acara sehingga Anda yang sering memberi yang Anda,KOMPETITOR,Bintang 5,MovenpickHoteljakartaCityCentre,negative,Pelayanan Staf & Keramahan
shakun realty,2025,1,hotel ini baru tapi semua layanan masih belum beroperasi tidak disarankan untuk turis kami telah memesan 6 kamar untuk perayaan kami tetapi kolam renangnya tidak berfungsi kamar kamar bermasalah sampai tengah malam karena ada beberapa pekerjaan konstruksi yang sedang berlangsung semua kamar memiliki beberapa masalah ac di satu stopkontak tidak berfungsi dan kunci di stopkontak lain tidak berfungsi secara keseluruhan hotel ini tidak disarankan untuk turis lokasinya juga tidak terlalu bagus dari mal dan jalan raya lokasinya tepat di tempat ibadah di geng saya pasti bisa menemukan pilihan tempat menginap yang lebih baik,KOMPETITOR,Bintang 5,MovenpickHoteljakartaCityCentre,negative,Fasilitas Hotel (Kolam/Gym/Spa)
Wayne Lim,2020,1,menginap di Sparks luxe pada tanggal 4 8 November 2019 merupakan pengalaman yang kurang menyenangkan saya telah menjadi tamu tetap hotel ini sejak zaman alila untuk perjalanan bisnis ke Jakarta dan sekarang telah berganti ke Sparks luxe yang saya harapkan kualitasnya sama dengan alila silakan lihat komentar saya di bawah ini pelayan tidak membantu membbawakan bagasi kami di lobi utama saat kedatangan dan keberangkatan suhu kamar saya tidak pernah di bawah 24 derajat saya menyesuaikannya hasilnya suhu kamar saya tidak dingin karena panas dari jendela sangat panas dan saya harus menutup 90 tirai untuk mencegah panas langsung masuk ke kamar saya cek keluar pada tanggal,KOMPETITOR,Bintang 5,MovenpickHoteljakartaCityCentre,negative,Pelayanan Staf & Keramahan
