User Name,Review Time,Rating,clean_text,Tipe,Kelas,Nama_Hotel,AI_Sentiment,AI_Aspek
dhonkray gaming,2025,1,padahal cuma mau jemput penumpang saja menunggu juga tidak sampai 5 menit malah di suru muter kluar dllu dan baru kali ini se jakarta keamanan nya priksa mobil sampe ke cup mesin dengan muka sombong nya keamanan nya pada lagu tidak punya sopan santun sama tamu walupun cuma antar jmput penumpang ttep kita harus sling menghargai,KOMPETITOR,Bintang 5,JWMarriotHotelJakarta,negative,Harga & Value for Money
al Fe,2025,1,layanan sangat buruk ancur tidak ada ramah ramahnya dari yang jaga pintu loket parkir meja depan petugas restoran sampai keamanan tidak ramah lokal terlihat sangat berbeda perlakuan antara tamu barat sama lokal memalukan sekelas hotel yang punya nama baik,KOMPETITOR,Bintang 5,JWMarriotHotelJakarta,negative,Kualitas Makanan & Restoran
Meylia Rosani,2025,1,Maaf saya ganti bintangnya karna dijanjikan dikasih hadiah oleh kelompoknya ternyata bohong,KOMPETITOR,Bintang 5,JWMarriotHotelJakarta,negative,Harga & Value for Money
Siti Nurhaliza,2025,1,Halamannya luas bangunannya megah,KOMPETITOR,Bintang 5,JWMarriotHotelJakarta,positive,Harga & Value for Money
Pain,2025,1,Saya merasa sangat kecewa setelah diminta untuk menulis ulasan palsu saya diberi kesan yang salah tentang tempat ini dan sekarang merasa tertipu sebagai pelanggan yang percaya pada kejujuran dan transparansi saya merasa tindakan seperti ini sangat tidak profesional ulasan seharusnya mencerminkan pengalaman nyata bukan sesuatu yang direkayasa sangat menyedihkan ketika kepercayaan disalahgunakan dengan cara ini saya berharap manajemen memperbaiki situasi ini dan lebih menghargai integritas dalam bisnis mereka,KOMPETITOR,Bintang 5,JWMarriotHotelJakarta,negative,Harga & Value for Money
Ahsanal Jaza,2025,1,katanya di suruh kasih ulasan bintang 5 trus bisa 45 ribu tapi tidak di kirim sudah kasih ulasan baik kok,KOMPETITOR,Bintang 5,JWMarriotHotelJakarta,negative,Harga & Value for Money
ran put,2025,1,Barang ilang tidak di pulangin dan di persulit hotel desain jelek kamar juga sudah tua tidak layak buat bintang 5,KOMPETITOR,Bintang 5,JWMarriotHotelJakarta,negative,Harga & Value for Money
Rezza Septiana,2025,1,Keamanan loading dock nya belagu apalagi yang cewe cewe kaga jelas banget gua lagi balas chat penerima paket di loading dock dikira mau foto cakep juga kaga anjg,KOMPETITOR,Bintang 5,JWMarriotHotelJakarta,negative,Harga & Value for Money
Monti msb,2024,1,Satpam nya minus sikap boro boro senyum nyapa tamu mana rasis banget mobil lccc di periksa ampe kap mesin mobil mewah mah boro2 lobi sempit ditutup setengah tidak bisa menunggu istri anak bakal disuruh muterin bunderan mega kuningan dulu,KOMPETITOR,Bintang 5,JWMarriotHotelJakarta,negative,Pelayanan Staf & Keramahan
AT- Taubah,2025,1,Hotel sangat buruk jangan mau nginap disini,KOMPETITOR,Bintang 5,JWMarriotHotelJakarta,negative,Harga & Value for Money
Resa Adilaksana,2025,1,dipikir jalan bapaknya apa berhenti di depannya bentar tidak boleh makanya kalau mau nyaman bangunnya agak kedalam sedikit berhenti di sisi kuningan timur,KOMPETITOR,Bintang 5,JWMarriotHotelJakarta,positive,Harga & Value for Money
Anifta,2025,1,menyayangkan petugas lobi yang mempersulit pengemudi keamanan depan dah banyakjinkan sty 3 menit petugas lobi tidak ngijinin suruh putar putar bundaran kuningan kaku dan tidak fleksibel,KOMPETITOR,Bintang 5,JWMarriotHotelJakarta,negative,Lokasi & Akses Strategis
Mulyadi Mul,2022,1,terima kasih untuk donatur yang sudah memberikan sebagian kebutuhan untuk para yatim janda tua tua serta dhuafa yang ada di yayasan islam al hadi semoga untuk donatur untuk pengurus serta keluarga kita semua senantiasa diberikan kesehatan keselamatan keberkahan serta kesuksesan oleh allah swt aamiin,KOMPETITOR,Bintang 5,JWMarriotHotelJakarta,positive,Pelayanan Staf & Keramahan
Y,2025,1,Tempat parkirnya aneh sekali bisa makan jalur 2 begini,KOMPETITOR,Bintang 5,JWMarriotHotelJakarta,negative,Lokasi & Akses Strategis
Khulfi M. Khalwani,2024,1,tukang pembayaran parkir di bawah sangat tidak ramah karena lupa bawa etol kita disuruh menukar uang dulu karena tidak ada kembalian sebagai pelanggan saya kecewa tidak merekomendasikan hotel ini untuk pertemuan dll,KOMPETITOR,Bintang 5,JWMarriotHotelJakarta,negative,Infrastruktur (AC/WiFi/Parkir/Air)
Riska Ismi,2022,1,Saya baru keluar dari hotel jw marriott pelayanan keamanan nya tidak profesional kaki saya sobek dan berdarah karena keamanan nya buka pintu tidak melihat dan tidak hati hati tolong di arahkan keamanan yang jaga malam ini saya sangat kecewa dengan pelayanan keamanan hotel jw marriott klw tidak di pecat dan saya lihat masih ada keamanan yang jaga malam ini di hotel jw marriott saya akan melaporkan kasus ini ke pihak kepolisian,KOMPETITOR,Bintang 5,JWMarriotHotelJakarta,negative,Harga & Value for Money
Adi Abdullah,2024,1,Tempat gajiiran nya susah banget tidak boleh menunggu di loby walaw cuma 2 menit saja tidak di izinkan harus muter bunderan mega kuningan lagi,KOMPETITOR,Bintang 5,JWMarriotHotelJakarta,negative,Harga & Value for Money
waldi fahmi,2023,1,Hotel sekelas bintang 5 tidak menyediakan parkir untuk membuat bus bahkan berhenti sebentar untuk menjemput tamu yang menyewa di hotel tersebut pun di suruh nyari parkiriran sendiri sangat tidak ramah,KOMPETITOR,Bintang 5,JWMarriotHotelJakarta,negative,Infrastruktur (AC/WiFi/Parkir/Air)
singa putih,2021,1,Saya hanya antar makanan ke lobi di suruh oleh tamu hotel keamanan oke tapi jangan anggap ojek online itu binatang saya tidak parkir tapi hanya antar makana ketemu tamu hotel di lobi malah keamanan user saya kayak binatang jadi pelayanan hotel tidak bagus karena ojek online di anggap kayak binatang,KOMPETITOR,Bintang 5,JWMarriotHotelJakarta,negative,Infrastruktur (AC/WiFi/Parkir/Air)
Roni Salam,2018,1,bagian penjagaan pintu masuk parkir pada hari minggu jam 20:30 kurang ajar saya menginap di hotel ini sudah 2 malam tidak diizinkan masuk parkir karena penuh dengan para tamu undangan dan saya malah di suruh parkir ke gedung sebelah harus bayar tolong di tegur dan tolong prioritaskan tamu yang menginap daripada tamu undangan wedding trims,KOMPETITOR,Bintang 5,JWMarriotHotelJakarta,negative,Pelayanan Staf & Keramahan
Lesy Kontesa,2025,1,staf nya aduh tidak banget tidak ramah pelayanan kurang,KOMPETITOR,Bintang 5,JWMarriotHotelJakarta,negative,Harga & Value for Money
XYZ,2025,1,Satpamnya kurang saja ditanya pintu depan malah nanya mau kemana,KOMPETITOR,Bintang 5,JWMarriotHotelJakarta,negative,Pelayanan Staf & Keramahan
Maeve Miner,2022,1,Beli satu klub tidak ada yang bisa di pakai alasan penuh terus lah hitam keluar tanggal berubah2 penipuan banget biar dapet uang masuk maju,KOMPETITOR,Bintang 5,JWMarriotHotelJakarta,negative,Harga & Value for Money
Ester Y,2019,1,saya tidak menginap di hotel ini kebetulan saya meminta bantuan ke sebuah departemen namun departemen yang saya tuju tak kunjung angkat setelah menghubungi 2x oke saya mencoba minta nomor hp pribadi org tsb dari operator jw marriot tgl 18 juli 2018 jam 15 30 dan cukup etis tidak diberikan lalu saya ingin meninggalkan nomor hp dan mrminta titipkan pesan alasannya maaf bu kami tidak bisa membantu meninggalkan pesan karena tidak tahu nama dan departemen yang dituju dan tidak mengenalinya saya sudah beri nama dan departemen yang dituju tapi operator madi menjawab tidak tahu departemen dan tidak perlu mengenali manajer saya rasa operator Anda,KOMPETITOR,Bintang 5,JWMarriotHotelJakarta,negative,Pelayanan Staf & Keramahan
Renjack Channel,2025,1,pelayanan yang buruk,KOMPETITOR,Bintang 5,JWMarriotHotelJakarta,negative,Harga & Value for Money
Portgas D Ace,2021,1,lobby keamanan depan bagian pengecekan barang tidak bisa kerja apa gimana saya mau kirim paket ke jw marriot keamanan ngomongnya penghuni yang di cari sudah pindah ke ritz carlton tapi nyatanya belum pindah keamanan kaya gitu pecat saja ngerjain orang saja bisanya,KOMPETITOR,Bintang 5,JWMarriotHotelJakarta,negative,Harga & Value for Money
Krisna Arkana,2024,1,Kuritynya tidak sopan tidak ramah pelayanan sangat buruk mengecewakan tolong buat kepala kunci perbaiki agar lebih sopan pada tamu,KOMPETITOR,Bintang 5,JWMarriotHotelJakarta,negative,Pelayanan Staf & Keramahan
adilla dwi putri,2025,1,staf kurang ramah pelayanan yang lama,KOMPETITOR,Bintang 5,JWMarriotHotelJakarta,negative,Pelayanan Staf & Keramahan
aljon ali sagara,2017,1,jw mariott hotel kawasan mega kuningan periksa anjing pelacak pada mobil saya saja ketiga org ini pakai foto2 segala sesuatu buat bukti tugas kayaknya 21 8 16,KOMPETITOR,Bintang 5,JWMarriotHotelJakarta,neutral,Lokasi & Akses Strategis
Moh Ravie,2019,1,keamanan nya masih kaku tegang tidak fleksibel tempat parkir yang tepat di pintu masuk keluarnya klo tidak ada kehidupan bawa mobilnya pasti ke gesek,KOMPETITOR,Bintang 5,JWMarriotHotelJakarta,negative,Lokasi & Akses Strategis
Deni Setiawan,2025,1,Hotel macam macam macam macam ke gini,KOMPETITOR,Bintang 5,JWMarriotHotelJakarta,negative,Harga & Value for Money
ihsanul habib,2025,1,kamar busuk banyak kue nya gk lagi deh nginap disini,KOMPETITOR,Bintang 5,JWMarriotHotelJakarta,negative,Kualitas Makanan & Restoran
farrel agam,2025,1,kebersihan toilet dijaga ada yang bocor tuh,KOMPETITOR,Bintang 5,JWMarriotHotelJakarta,negative,Lokasi & Akses Strategis
Abdul Rafik,2022,1,Hotel yang paling parah jika membuat nitip nitip di hotel bintang 5 dilayanin sampai atas dibantu concierge jika sini tidak dikasih titip ribet setengah mati,KOMPETITOR,Bintang 5,JWMarriotHotelJakarta,negative,Pelayanan Staf & Keramahan
yuswadi Djuhari,2019,1,makananya payah resepsi pernikahan saudara test makanan sama kenyataan saat resepsi tidak sesuai rasanya tidak direkomendasikan,KOMPETITOR,Bintang 5,JWMarriotHotelJakarta,negative,Kualitas Makanan & Restoran
Pariz Tri wahyuno,2025,1,hotel jelek pelayan tidak bagus terimakasih,KOMPETITOR,Bintang 5,JWMarriotHotelJakarta,negative,Harga & Value for Money
reza sy,2025,1,sangat tidak memuaskan,KOMPETITOR,Bintang 5,JWMarriotHotelJakarta,negative,Harga & Value for Money
Tommy Charles,2025,1,enak saja sudah di kasih bintang di blok,KOMPETITOR,Bintang 5,JWMarriotHotelJakarta,negative,Infrastruktur (AC/WiFi/Parkir/Air)
Best Blazer,2019,1,Saya mau pipis di taman parkir malah di teriakin satpam yang terlalu besar dan panjang umur dan jenis kelamin bayi di dalam menjawab pertanyaan nomor di kota bandung kulon bekasi selatan bogor barat cengkareng cilandak barat depok duren sawit jakarta timur jakarta dki jakarta dki jakarta dki jakarta dki jakarta dki jakarta dki jakarta dki jakarta dki jakarta dki jakarta dki jakarta dki jakarta dki jakarta dki jakarta dki jakarta dki jakarta dki jakarta dki jakarta dki,KOMPETITOR,Bintang 5,JWMarriotHotelJakarta,neutral,Lokasi & Akses Strategis
Muhammad Athhar,2025,1,sulit menemukan titik di peta,KOMPETITOR,Bintang 5,JWMarriotHotelJakarta,negative,Harga & Value for Money
Igun Setia,2022,1,4 jam lebih menunggu kamar yang di proses masih belum bisa masuk kamar,KOMPETITOR,Bintang 5,JWMarriotHotelJakarta,negative,Harga & Value for Money
Asep Hambali,2025,1,tidak rekomend,KOMPETITOR,Bintang 5,JWMarriotHotelJakarta,negative,Harga & Value for Money
Yas'a,2021,1,hotel bagus satpamnya tidak ada adab sama saja istana isinya kotoran,KOMPETITOR,Bintang 5,JWMarriotHotelJakarta,negative,Harga & Value for Money
Adi,2026,1,sangat buruk,KOMPETITOR,Bintang 5,JWMarriotHotelJakarta,negative,Harga & Value for Money
AG Lingga,2025,1,kebijakan buka kap mesin yang merusak mobil,KOMPETITOR,Bintang 5,JWMarriotHotelJakarta,neutral,Lokasi & Akses Strategis
Anggun Lestari,2025,1,parkir buat ojol susah sekali,KOMPETITOR,Bintang 5,JWMarriotHotelJakarta,negative,Lokasi & Akses Strategis
165_Gufron Wahyu Akbar,2025,1,Mehong tidak sesuai dengan ranting belian,KOMPETITOR,Bintang 5,JWMarriotHotelJakarta,negative,Harga & Value for Money
Kang Layy,2022,1,apartemen hotel berbintang makanan biasa saja cenderung mahal nya saja,KOMPETITOR,Bintang 5,JWMarriotHotelJakarta,negative,Harga & Value for Money
rizki oph4,2021,1,Tidak ada mobil parkirnya kecuali motor besar diatas 500cc,KOMPETITOR,Bintang 5,JWMarriotHotelJakarta,neutral,Infrastruktur (AC/WiFi/Parkir/Air)
karenina khansa,2025,1,admininnya tidak responsif dan sangat jelek pelayanannya,KOMPETITOR,Bintang 5,JWMarriotHotelJakarta,negative,Harga & Value for Money
Kujanto Hung,2022,1,Sangat bagus pelayanannya jg ramah tamah,KOMPETITOR,Bintang 5,JWMarriotHotelJakarta,positive,Pelayanan Staf & Keramahan
Adithya Hermandes,2020,1,terlalu ketat dan ribet masuknya terutama tuk ojol pengantar makanan,KOMPETITOR,Bintang 5,JWMarriotHotelJakarta,negative,Harga & Value for Money
Ilman Farid,2022,1,menunggu kamar masuk kemajuan setelah cek masuk lebih dari 3 jam,KOMPETITOR,Bintang 5,JWMarriotHotelJakarta,neutral,Harga & Value for Money
Zainal Fajrin,2025,1,hotel gk jelas,KOMPETITOR,Bintang 5,JWMarriotHotelJakarta,negative,Harga & Value for Money
Ari Ardian,2025,1,Parkiran buat ojol nya jauh,KOMPETITOR,Bintang 5,JWMarriotHotelJakarta,negative,Infrastruktur (AC/WiFi/Parkir/Air)
Rizki Muliadin,2025,1,bagus,KOMPETITOR,Bintang 5,JWMarriotHotelJakarta,positive,Harga & Value for Money
Vera Nurpadilah1,2025,1,buruk,KOMPETITOR,Bintang 5,JWMarriotHotelJakarta,negative,Harga & Value for Money
Bang Bay,2025,1,sangat tidak ramah petugas didalamnya,KOMPETITOR,Bintang 5,JWMarriotHotelJakarta,negative,Harga & Value for Money
Ramdan,2025,1,daerah sangat macet parkiran selalu penuh,KOMPETITOR,Bintang 5,JWMarriotHotelJakarta,negative,Infrastruktur (AC/WiFi/Parkir/Air)
Suri anti,2025,1,jelek,KOMPETITOR,Bintang 5,JWMarriotHotelJakarta,negative,Harga & Value for Money
Ragil Sujatmiko,2025,1,Hotel Parkiran jauh dari lobi,KOMPETITOR,Bintang 5,JWMarriotHotelJakarta,positive,Infrastruktur (AC/WiFi/Parkir/Air)
nina agustini,2025,1,Nyesel banget disini sumpah,KOMPETITOR,Bintang 5,JWMarriotHotelJakarta,negative,Harga & Value for Money
syarif0 16,2025,1,lokasi untuk drop makanan,KOMPETITOR,Bintang 5,JWMarriotHotelJakarta,positive,Lokasi & Akses Strategis
Eko Budi Lestanto,2025,1,mengantar makanan agak susah,KOMPETITOR,Bintang 5,JWMarriotHotelJakarta,negative,Harga & Value for Money
riswani 215,2025,1,tidak,KOMPETITOR,Bintang 5,JWMarriotHotelJakarta,positive,Harga & Value for Money
Ahmad Muharya,2025,1,buruk,KOMPETITOR,Bintang 5,JWMarriotHotelJakarta,negative,Harga & Value for Money
Noerman Syah,2022,1,disiplin prokes tapi tetap nyaman dikunjungi,KOMPETITOR,Bintang 5,JWMarriotHotelJakarta,positive,Kebersihan & Kenyamanan Kamar
Au Marley,2025,1,aplikasi kocak,KOMPETITOR,Bintang 5,JWMarriotHotelJakarta,positive,Harga & Value for Money
Aditya Firmansyah,2023,1,sekuriti nya belagu,KOMPETITOR,Bintang 5,JWMarriotHotelJakarta,negative,Harga & Value for Money
Jacky Risman DP,2019,1,Pelayanan dan keamanan melebihi gaya FBI,KOMPETITOR,Bintang 5,JWMarriotHotelJakarta,positive,Harga & Value for Money
Anwar Sadat,2018,1,Tidak bagus,KOMPETITOR,Bintang 5,JWMarriotHotelJakarta,negative,Harga & Value for Money
Anto Rallin,2020,1,Keramahan keamanan buruk tidak ramah dan terkesan dosa,KOMPETITOR,Bintang 5,JWMarriotHotelJakarta,negative,Harga & Value for Money
1. AGIL FAUZI FADLURROHMAN,2025,1,Agoda gajelas,KOMPETITOR,Bintang 5,JWMarriotHotelJakarta,negative,Harga & Value for Money
Karangmangu Kroya,2025,1,mantap,KOMPETITOR,Bintang 5,JWMarriotHotelJakarta,positive,Harga & Value for Money
uban say,2018,1,Saya ingat membencinya,KOMPETITOR,Bintang 5,JWMarriotHotelJakarta,negative,Harga & Value for Money
sulhatta Hata,2015,1,sudah tidak kkantin sosro,KOMPETITOR,Bintang 5,JWMarriotHotelJakarta,negative,Kualitas Makanan & Restoran
Mer_v,2024,1,buruk,KOMPETITOR,Bintang 5,JWMarriotHotelJakarta,negative,Harga & Value for Money
Sakina Utami,2022,1,buruk,KOMPETITOR,Bintang 5,JWMarriotHotelJakarta,negative,Harga & Value for Money
Agus Google,2019,1,bagus,KOMPETITOR,Bintang 5,JWMarriotHotelJakarta,positive,Harga & Value for Money
Muhadi Muhadi,2019,1,terlalu oper,KOMPETITOR,Bintang 5,JWMarriotHotelJakarta,negative,Harga & Value for Money
KIMUJI ID,2022,1,capek,KOMPETITOR,Bintang 5,JWMarriotHotelJakarta,negative,Harga & Value for Money
Rifki Kurniadi,2021,1,koplak keamanan,KOMPETITOR,Bintang 5,JWMarriotHotelJakarta,neutral,Kebersihan & Kenyamanan Kamar
Roji,2026,1,terlalu robet,KOMPETITOR,Bintang 5,JWMarriotHotelJakarta,negative,Harga & Value for Money
Syifa Virgiyanti,2026,1,hotel nya bgus nyaman,KOMPETITOR,Bintang 5,JWMarriotHotelJakarta,positive,Kebersihan & Kenyamanan Kamar
Dadan Supardi,2025,1,mengingat harga layanan penjemputan di pintu keluar bandara sungguh mengecewakan sebaiknya anda memberikan pelatihan yang lebih baik kepada staf anda agar lebih sopan dan santun ini sangat menyesatkan smh,KOMPETITOR,Bintang 5,JWMarriotHotelJakarta,negative,Pelayanan Staf & Keramahan
Haha Haha,2025,1,Sejujurnya saya tidak mengerti bagaimana tempat ini bisa mendapatkan begitu banyak ulasan positif rasanya benar benar palsu dan menyesatkan pengalaman saya sama sekali tidak seperti yang dijelaskan sungguh mengecewakan melihat pujian yang jelas dibuat seperti itu digunakan untuk memikat orang,KOMPETITOR,Bintang 5,JWMarriotHotelJakarta,negative,Infrastruktur (AC/WiFi/Parkir/Air)
YOUNG IN OH,2025,1,Saat ini saya bekerja sebagai perwakilan di Indonesia tempat saya tinggal selama dua setengah tahun saya berpengalaman mengatur akomodasi untuk tamu yang tiba di hotel jw marriott berdasarkan rekomendasi dari perwakilan sebelumnya namun karena ketidaknyamanan yang saya alami hari ini saya tidak akan merekomendasikan hotel jw marriott lagi 1 umumnya tamu saya tiba di hotel sekitar pukul 22:30 atau 2300 karena jadwal penerbangan kebanyakan tamu ingin memeriksa masuk secepat mungkin untuk beristirahat setelah penerbangan panjang staf resepsi hotel ini membuat kami menunggu di lobi selama 20 30 menit tanpa memberikan penjelasan yang memadai dengan alasan bahwa kamar yang dipesan belum siap proses pemeriksaan masuk dan sangat panjang,KOMPETITOR,Bintang 5,JWMarriotHotelJakarta,negative,Lokasi & Akses Strategis
Daniel Benedict,2025,1,mencoba berlayar untuk pertama kalinya hari ini dan sangat kecewa dengan layanannya seperti di setiap hotel kami memasuki ruang parkir bawah tanah mobil kami diperiksa oleh petugas keamanan dan kemudian diizinkan masuk kami bertanya apakah kami lupa mengambil tiket parkir atau hotel memang tidak tersedia karena kami melihat petugas keamanan mencatat plat nomor mobil kami karena merasa itu bukan masalah besar kami memutuskan untuk melanjutkan perjalanan ke hotel setelah selesai malam di sailendra dan bersiap untuk pergi petugas parkir tiket meminta kepada kami kami kami mencoba menjelaskan bahwa kami tidak mendapatkannya dan meminta solusi alih-alih membantu petugas bersikeras bahwa kami mungkin menaruh tiket dan dengan kasar kami meminta untuk menemukannya,KOMPETITOR,Bintang 5,JWMarriotHotelJakarta,negative,Pelayanan Staf & Keramahan
Tim Doyle,2025,1,sungguh mengecewakan anda berharap hotel bintang 5 jw marriott untuk bisa tidur nyenyak satu malam saya di sana untuk beristirahat dan memulihkan diri hancur staf jw marriott tidak mematikan alarm di kamar alarm itu kemudian berbunyi sebelum jam 6 pagi dan berbunyi lagi tak lama setelahnya hal ini mengganggu dan merusak waktu istirahat dan tidur saya dan saya tidak bisa tidur lagi saya menyampaikan kekhawatiran saya saat memeriksa keluar dan hanya mendapatkan komentar stafnya pasti saya mewatkannya saya tahu dan staf Anda merusak tidur saya dan satu malam saya harus beristirahat karena kurangnya perhatian terhadap rincian liburan saya di,KOMPETITOR,Bintang 5,JWMarriotHotelJakarta,negative,Harga & Value for Money
Michael Dajan,2023,1,sangat kecewa saya memesan hotel ini agar bisa tidur dengan nyaman tapi selama saya menginap suara dari ruang pertemuan di lantai yang berbeda sangat keras sampai saya tidak bisa tidur dan sangat lelah bahkan staf hotel juga terkejut mendengar suaranya yang begitu keras dan tidak ada tawaran dari staf hotel untuk memberikan kamar lain ketika pertama kali saya mengeluh setelah mendekati waktu cek keluar mereka menawarkan kamar lain untuk apa pengalaman terburuk yang pernah ada tidak dapat membayangkan bagaimana mungkin hotel bintang 5 tidak dapat melakukan apa-apa untuk tamu mereka,KOMPETITOR,Bintang 5,JWMarriotHotelJakarta,negative,Harga & Value for Money
Harsh Koshti,2023,1,saya menginap di sini selama tiga hari baru ini 1 layanan kamar sangat buruk mereka mengacaukan pesanan salad saya yang sederhana 2 pilihan vegetarian sangat terbatas tidak ada prasmanannya biasa saja jika Anda seorang vegetarian 3 kamar berbau asap rokok saya memilih kamar bebas rokok awalnya mereka mengirim mesin penghisap asap dan pengharum ruangan tetapi hampir tidak berguna hari kedua masalah yang sama terulang akhirnya mereka mengganti kamar yang seharusnya mereka lakukan sebelumnya 4 sarapannya memesan omelet telur tetapi malah diberi daging layanannya benar tidak terkoordinasi dan tidak berstandar bintang lima saya tidak akan merekomendasikan menginap di hotel ini,KOMPETITOR,Bintang 5,JWMarriotHotelJakarta,negative,Kualitas Makanan & Restoran
Hyun Kyung Oh,2023,1,Suami saya membelikan saya voucher satu klub untuk liburan putri saya jadi saya memesan prasmanan dan kamar lalu cek masuk sekitar pukul 14:30 setelah makan siang saya agak kesal tapi mereka bilang kamar belum siap dan mereka hanya perlu mengganti seprai jadi saya meminta mereka menunggu selama 20 menit saya agak kesal tapi saya mengiyakan saja dan menunggu di lobi sangat berisik dan ramai karena ada pernikahan tetapi 40 menit berlalu dan mereka bahkan tidak menelepon saya dan para tamu yang datang setelah mereka memeriksa dan ke kamar mereka saya masuk tiga kali menanyakan tetapi satu jawaban yang saya dapatkan adalah menunggu ya sekitar pukul 15:40 seorang manajer wanita,KOMPETITOR,Bintang 5,JWMarriotHotelJakarta,negative,Kualitas Makanan & Restoran
Yohannes Fandy,2025,1,stafnya tidak bisa menghormati orang yang memakai sandal dan celana pendek terutama staf concierge saya pernah diabaikan saat meminta parkir gratis apakah ini standar marriott bonvoy apakah ini cara Anda melatih staf untuk bersikap kasar kepada orang yang meminta parkir gratis dan menjilati pelanggan yang memakai jas,KOMPETITOR,Bintang 5,JWMarriotHotelJakarta,negative,Pelayanan Staf & Keramahan
Seli oktaviani,2023,1,Pelayanan dari jw marriott sangat buruk tidak mencerminkan tingkat keramahtamahan dan kualitas hotel bintang 5 makan malam dengan seorang teman di lounge pribadi pada tanggal 4 Agustus stok makanan tidak diisi ulang dan pelayanan tidak ramah setelah makan malam saya turun ke bawah dan hendak pulang ada seorang staf hotel di lobi yang menghampiri dan menanyakan kartu identitas saya saat melakukan perjalanan ini adalah pertama kalinya saya datang ke restoran di hotel bintang lima sebagai tamu undangan dan dimintai kartu identitas dengan alasan masalah keamanan koreksi saya jika saya salah karena saya pernah menginap di hotel bintang 5 lainnya di Jakarta dan ketika saya meng,KOMPETITOR,Bintang 5,JWMarriotHotelJakarta,negative,Kualitas Makanan & Restoran
Sumit Lohia,2023,1,pengalaman buruk di akhir masa saya tinggal di hotel untuk karantina wajib sesuai peraturan pemerintah di akhir masa saya dinyatakan positif covid yang merupakan kejutan bagi saya namun demikian saya meminta resepsionis dua kali untuk mengirimkan faktur agar saya bisa membayarnya mereka tidak melakukan apa pun tetapi ketika saya sampai di hotel isolasi tiba tiba semua orang dari hotel mulai menelepon saya untuk membayar jumlahnya saya meyakinkan mereka bahwa saya tidak akan melarikan diri dan membayar jumlahnya mereka sudah memblokir jumlahnya di kartu kredit saya setelah saya tinggal di hotel baru tetapi mereka mulai Anda harus melunasi tagihannya saya jika tidak kami tidak akan tidak akan,KOMPETITOR,Bintang 5,JWMarriotHotelJakarta,negative,Harga & Value for Money
Raja Bonding,2025,1,kepada yth jw marriott jakarta saya menghubungi bagian pembelian untuk menawarkan produk pertanian untuk dukungan sayuran di hotel jw marriott pada tanggal 6 Agustus 2024 pukul 14 32 bisakah anda meminta admin pembelian yang sopan dan ramah admin pembelian jw marriott sangat arogan dan tidak bermartabat,KOMPETITOR,Bintang 5,JWMarriotHotelJakarta,negative,Pelayanan Staf & Keramahan
K.K X.D,2021,1,Tempat ini bagus dalam segala hal kecuali manajemen stafnya bersiaplah untuk menerima layanan bintang 2 di resepsionis mereka terutama saya sudah beberapa kali ke sana tapi tidak tahu mengapa mereka sering mengganti staf resepsionis dan belum lagi sangat tidak profesional kamarnya tua kolam renangnya kecil gymnya bagus makanannya enak dengan anggaran yang sama ritz atau westin lebih disarankan,KOMPETITOR,Bintang 5,JWMarriotHotelJakarta,positive,Fasilitas Hotel (Kolam/Gym/Spa)
Antoine Yssard,2020,1,hotel tua masalah pipa ledeng pancuran bergaya lama bau lembap tidak ada tv pintar tidak ada pembicara tidak ada mesin kopi dan layanan amatir yang buruk di mana mana mana terlalu banyak kepatuhan dengan mengorbankan mendengarkan dan efisiensi sarapan di lounge benar benar berantakan tetapi tampaknya tidak ada yang peduli semua sangat senang dengan diri mereka sendiri kapal tenggelam pasti ada masalah dengan kaptennya kurangnya pelatihan standar yang buruk tidak ada pertanyaan tentang diri sendiri tidak ada kepemimpinan untuk menetapkan apa pun yang tepat puas dengan peringkat dan tingkat hunian dari travel advisor bagus tapi kenyataannya adalah hotel yang sangat biasa saja terlepas dari,KOMPETITOR,Bintang 5,JWMarriotHotelJakarta,negative,Fasilitas Hotel (Kolam/Gym/Spa)
