User Name,Review Time,Rating,clean_text,Tipe,Kelas,Nama_Hotel,AI_Sentiment,AI_Aspek
Bayu Samudra,2025,5,Tidak usah pakai lama langsung saja kesini pelayanan terbaik,KOMPETITOR,Bintang 5,JWMarriotHotelJakarta,positive,Harga & Value for Money
MUSTAVA,2024,5,mantap dan keren lokasi yang strategis hotel ini terletak di pusat kota jakarta dekat dengan banyak tempat wisata pusat perbelanjaan dan tempat makan kamar yang luas dan nyaman kamar kamar kamar di hotel ini dilengkapi dengan fasilitas modern dan memiliki ukuran yang luas sehingga para tamu merasa nyaman selama menginap fasilitas hotel yang lengkap hotel ini memiliki banyak fasilitas seperti kolam renang pusat kebugaran spa restoran dan bar yang memudahkan para tamu untuk bersantai dan menikmati waktu mereka di hotel pelayanan yang ramah dan profesional staf hotel dianggap ramah dan profesional oleh para tamu yang membuat mereka merasa dihargai dan dihormati selama menginap sarapan yang lezat untuk memberikan pujian untuk sarapan yang disalahkan,KOMPETITOR,Bintang 5,JWMarriotHotelJakarta,positive,Fasilitas Hotel (Kolam/Gym/Spa)
Safeena Shivanand,2025,5,Tempat terbaik perhotelan yang luar biasa pilihan makanan yang baik kamar yang nyaman fasilitas yang baik hanya satu masalah kecil sistem flush masuk toilet agak terlalu keras dan sangat sulit untuk digunakan i m tidak yakin tentang semua kamar i m berbicara tentang saya secara keseluruhan itu selalu pengalaman yang hebat di jw marriott jakarta,KOMPETITOR,Bintang 5,JWMarriotHotelJakarta,positive,Kebersihan & Kenyamanan Kamar
Starry Night,2024,5,Sejak saat saya tiba staf sangat ramah dan ramah yang membuat saya merasa seperti di rumah saat sarapan saya cukup beruntung untuk bertemu ibu katherina yang pergi di atas dan di luar untuk menjaga saya dengan baik dan selalu memberikan rekomendasi besar kebaikannya dan perhatian benar-benar luar biasa dan membuat pagi saya bahkan lebih baik makanan di hotel benar-benar lezat dengan berbagai pilihan untuk memilih sebagai vegetarian saya menghargai bahwa ada banyak pilihan untuk saya menikmati dan saya tidak pernah perlu khawatir tentang tidak memiliki cukup untuk makan besar terima kasih kepada koki abishek dan mr,KOMPETITOR,Bintang 5,JWMarriotHotelJakarta,positive,Pelayanan Staf & Keramahan
Leny Indrawati,2025,5,hotel bagus dan baik pelayanannya,KOMPETITOR,Bintang 5,JWMarriotHotelJakarta,positive,Harga & Value for Money
Debbie Martins,2024,5,Kami punya ruang yang luas dan lengkap dengan fasilitas yang direkomendasikan untuk menginap dan akan tinggal lagi saat kembali oya syailendra adalah restoran yang bagus dengan menu makanan timur dan barat yang berbeda cobalah dan Anda akan berakhir dengan perut bahagia,KOMPETITOR,Bintang 5,JWMarriotHotelJakarta,positive,Kualitas Makanan & Restoran
Edbert Wee,2018,4,Hotel terlihat cukup baik dan ruang dansa bagus makan malam buffet untuk pesta itu bagus dan mungkin salah satu yang terbaik saya makan masih ada lebih banyak tempat parkir tersedia ketika saya sampai di sana dan saya 30 menit terlambat jadi saya akan mengatakan bahwa mereka memiliki banyak ruang tersedia yang baik untuk pesta pernikahan,KOMPETITOR,Bintang 5,JWMarriotHotelJakarta,positive,Fasilitas Hotel (Kolam/Gym/Spa)
selfi lailiyah,2025,5,tempat nyaman karyawan ramah sekali,KOMPETITOR,Bintang 5,JWMarriotHotelJakarta,positive,Pelayanan Staf & Keramahan
James Arvanitakis,2020,5,Ini adalah pengalaman yang indah dan mewah dengan semua staf melakukan yang terbaik untuk membuat penginapan kami sempurna kamar-kamar besar nyaman dan makanan yang sangat baik lokasi yang sempurna satu-satunya kelemahan adalah bahwa saya diberikan kamar merokok di lantai merokok tanpa diminta itu terlambat dan saya terlalu lelah untuk kembali dan mengeluh tapi pastikan Anda bertanya masuk mengatakan bahwa Anda hampir tidak bisa mengucapkan terima kasih untuk pengalaman yang indah,KOMPETITOR,Bintang 5,JWMarriotHotelJakarta,positive,Pelayanan Staf & Keramahan
laorae koci,2025,5,mantap bisa direkomendasikan tempat liburan akhir tahun nanti,KOMPETITOR,Bintang 5,JWMarriotHotelJakarta,positive,Harga & Value for Money
Pebruana Fitria sudarni,2025,5,menginap di sini sangat yaman dan pelayanan sangat ramah,KOMPETITOR,Bintang 5,JWMarriotHotelJakarta,positive,Kebersihan & Kenyamanan Kamar
Wiwik Rochmanti,2025,5,Sangat menikmati nyaman dan tenang ada meja biliar dibar restoranannya banyak menuunya bingung klu sarapan,KOMPETITOR,Bintang 5,JWMarriotHotelJakarta,positive,Kualitas Makanan & Restoran
Jems Swingli Bainkabel,2025,5,pelayanannya memuaskan,KOMPETITOR,Bintang 5,JWMarriotHotelJakarta,positive,Harga & Value for Money
Ulfah Windasari,2025,5,mantap puas banget dengan pelayanan fasilitas baru,KOMPETITOR,Bintang 5,JWMarriotHotelJakarta,positive,Harga & Value for Money
Calbee Cracker,2025,4,Hotel dibangun masuk 2001 sehingga desain tanggal namun itu dipelihara cukup baik dan bersih ruang tamu eksekutif memiliki pilihan yang baik sarapan teh tinggi dan koktail dekorasi mereka cny di lobi yang mengesankan setiap staf hotel saya telah bertemu ada semua layanan masuk luar biasa saya menyaksikan seorang tamu hotel jahat memarahi koki di belakang stasiun telur hidup koki menjaga ketenangan dan bahkan meminta maaf saya bertepuk tangan profesionalisme lokasi adalah beberapa menit berjalan kaki ke lotte mall dan tepat di samping satu satrio,KOMPETITOR,Bintang 5,JWMarriotHotelJakarta,positive,Kebersihan & Kenyamanan Kamar
Shaina Gandanegara,2024,5,desain kamar-kamar itu sedikit tua tapi masih bersih hotel gym sangat bagus karena mereka memiliki peralatan lengkap sarapan cukup standar tapi saya benar-benar menyukai daging sapi mereka sempurna tidak terlalu rapih tidak kurang dimasak saya mencoba gym di sini dan itu mengejutkan indah staf di gym adalah sikap yang fantastis besar membantu dan selalu tersedia terlalu buruk saya lupa untuk bertanya namanya tapi dia dididik saya selama sesi latihan saya tolong berikan dia kenaikan gaji saya sarankan memiliki keanggotaan di jw marriot gym sebagai peralatan lengkap dan suasana hanya,KOMPETITOR,Bintang 5,JWMarriotHotelJakarta,positive,Kebersihan & Kenyamanan Kamar
Nabilla TV,2025,5,Lokasinya sangat strategis kamar luas dan bersih pelayanan top sekali 5 makanan sudah tidak perlu diragukan pokoknya,KOMPETITOR,Bintang 5,JWMarriotHotelJakarta,positive,Kebersihan & Kenyamanan Kamar
Leta Natasha,2025,5,pegawai dan satpam ramah view hotel bagus kasur nyaman juga eksekutif lounge nya terbaik,KOMPETITOR,Bintang 5,JWMarriotHotelJakarta,positive,Kebersihan & Kenyamanan Kamar
Muhammad Rizky Darmansyah,2025,5,pengalaman menginap yang baik disini fasitilas oke dan pelayanan yang baik,KOMPETITOR,Bintang 5,JWMarriotHotelJakarta,positive,Pelayanan Staf & Keramahan
Putu Mayang,2022,5,fasilitas hotel baik dan lengkap kamar bersih dan nyaman bisa melihat pemandangan kota lampu pada malam hari kolam renang tidak terlalu besar dan menerapkan protokol kesehatan yaitu dibatasi pengguna kolamnya sebanyak 10 orang saja jadi lebih baik memesan dulu untuk sarapan baik,KOMPETITOR,Bintang 5,JWMarriotHotelJakarta,positive,Kebersihan & Kenyamanan Kamar
Bagus dwi Harsono,2025,5,sangat menyenangkan pelayanan terbaik,KOMPETITOR,Bintang 5,JWMarriotHotelJakarta,positive,Kualitas Makanan & Restoran
Mutia Citra,2025,5,nyaman sarapannya enak mantap,KOMPETITOR,Bintang 5,JWMarriotHotelJakarta,positive,Kebersihan & Kenyamanan Kamar
Sindianggira Rtg,2025,5,mantul bngt nih hotel fasilitas lengkap pokoknya top markotop,KOMPETITOR,Bintang 5,JWMarriotHotelJakarta,positive,Kualitas Makanan & Restoran
Hakas Pebriyanto,2025,5,hotel nya sangat bagus pelayanan nya juga cepat dan ramah sangat dianjurkan deh pokok nya,KOMPETITOR,Bintang 5,JWMarriotHotelJakarta,positive,Pelayanan Staf & Keramahan
Anna Nana,2025,5,sangat puas pelayanan serta makanan yang enak,KOMPETITOR,Bintang 5,JWMarriotHotelJakarta,positive,Kualitas Makanan & Restoran
dilan jalas,2025,5,Tempat yang bagus nyaman,KOMPETITOR,Bintang 5,JWMarriotHotelJakarta,positive,Kebersihan & Kenyamanan Kamar
Mulya Wahyu,2025,5,Hotel termwah berada di tengah pusat kota yang sangat nyaman mulai dari kamar kolam renang dan makanan nya semua yang terbaik apalagi untuk pelayanan nya sukses terus untuk jw mariiott hotel,KOMPETITOR,Bintang 5,JWMarriotHotelJakarta,positive,Fasilitas Hotel (Kolam/Gym/Spa)
Ari Taruna Rizki,2025,5,pelayanannya luar biasa hotelnya juga mewah banget sempat makan siang dsini makannya juga enak dan berbagai jenis dari makanan india seafood sushi dll semuanya telur ada yang mengecewakan,KOMPETITOR,Bintang 5,JWMarriotHotelJakarta,positive,Kualitas Makanan & Restoran
El Safitri,2022,5,kamarnya luas untuk 2 orang banyak tempat penyimpanan kamar mandi juga luas ada mandi mandi di toiletnya ada bidet saat ppkm boleh berenang dibatasi per jam hanya 6 orang jadi sepi sarapan nya juga oke banyak pilihan dan tempatnya enak tidak berkerumun layanan nya juga top banget semuanya ramah dan super membantu overall aku menikmati tinggal di sini v banyak,KOMPETITOR,Bintang 5,JWMarriotHotelJakarta,positive,Kebersihan & Kenyamanan Kamar
Zora Meilina K.,2025,5,Tinggal disini mantab betul pelayanannya memuaskan,KOMPETITOR,Bintang 5,JWMarriotHotelJakarta,positive,Harga & Value for Money
Febriyanda Ardita Putra,2025,5,kamarnya bagus dan pelayanan oke,KOMPETITOR,Bintang 5,JWMarriotHotelJakarta,positive,Kebersihan & Kenyamanan Kamar
Hasan Sobari,2025,5,layanan dan pelayanan sangat memuaskan ruang hotel sangat nyaman serta fasilitas untuk pelanggan terawat sangat balik dan lengkap,KOMPETITOR,Bintang 5,JWMarriotHotelJakarta,positive,Kebersihan & Kenyamanan Kamar
AT- Taubah,2025,1,Hotel sangat buruk jangan mau nginap disini,KOMPETITOR,Bintang 5,JWMarriotHotelJakarta,negative,Harga & Value for Money
Suheri Sanjaya,2025,5,staf hotel ramah kamar nya bagus,KOMPETITOR,Bintang 5,JWMarriotHotelJakarta,positive,Pelayanan Staf & Keramahan
Satrio Lisa,2025,5,rekomendasi lokasi strategis view yang keren pelayanan terbaik sangat memuaskan rekomendasi ingin menginap pilih jw marriot hotel jakarta,KOMPETITOR,Bintang 5,JWMarriotHotelJakarta,positive,Lokasi & Akses Strategis
Khaula Hime,2023,4,hotelnya lumayan bagus ya desain interior terlihat cantik dan mewah sudah lama tidak bertemu disini sejak pandemi saat masuk keruang pertemuan setiap meja disediakan hand sanitizer mini dan tisu antiseptik single pack kualitas wifi sangat bagus disini stabil meskipun kami campuran pertemuan sekaligus ada pertemuan secara virtual namun untuk istirahat kopi sangat minimalis ya hanya ada 2 macam cemilan dan 1 cookie di dalam kotak untuk menu makan siang jauh sangat bagus dari sebelum pandemi sangat sederhana malah kayak menu mirip nasi padang haha tidak ada lagi menu favorit aq kayak sushi noodle station es krim sop buntut zonk deh haha bahkan mini kue yang disediakan juga dikit habis tidak,KOMPETITOR,Bintang 5,JWMarriotHotelJakarta,positive,Kebersihan & Kenyamanan Kamar
Nigin Balakrishnan,2020,5,Saya telah tinggal beberapa kali di hotel ini sejak 2013 dan saya benar-benar menikmati semua menginap saya layanan dan keramahan adalah kelas atas dan konsisten kamar bersih mewah dan luas bahkan setelah beberapa tahun kamar merasa seperti baru satu-satunya hal yang saya marah tentang adalah makanan menyebar di ruang tamu eksekutif itu bisa menjadi lebih baik masuk kasus Anda ingin makan di luar ada beberapa restoran termasuk Indian satu tepat di sebelah hotel,KOMPETITOR,Bintang 5,JWMarriotHotelJakarta,positive,Kebersihan & Kenyamanan Kamar
Riza Jusuf,2022,5,sungguh pengalaman yang menyenangkan sejak dari proses cek masuk yang sangat membantu ramah mencoba memenuhi kebutuhan kami pujian yang tinggi untuk staf cek masuk sayangnya saya lupa nama sampai dengan makan malam sarapan di sailendra seluruh staf komunikatif ramah dan membantu dan memeriksa keluar tentunya rasa makanan yang enak hanya sedikit sayang kebetulan dapat roti mentega puding waffle yang dingin saat sarapan sepertinya tidak cukup memanasi dengan baik pemanas nya sedihnya itu seharusnya menjadi penutup yang indah namun tebayar dengan pelayanan kamar fasilitas yang memuaskan benar2 pendek gerbang yang memuaskan senang melihat sudah mulai kembali penuh pekerjaan mudah2an tetap ketat protokol kesahatan nya,KOMPETITOR,Bintang 5,JWMarriotHotelJakarta,positive,Pelayanan Staf & Keramahan
Aidil Shafwan Sahlan,2025,5,mantap sesuai deskripsi,KOMPETITOR,Bintang 5,JWMarriotHotelJakarta,positive,Harga & Value for Money
shedy riskina,2024,5,Selama tinggal di sini d mulai dari layanan kamar yang ramaah dan bersih dan membuat ke nyamanan d kamar alat yang lengkap rasa untuk makanannya rasa nya enak semua buat saya luar biasa dan cepat tanggap dalam pelayanannya trimakasih,KOMPETITOR,Bintang 5,JWMarriotHotelJakarta,positive,Kebersihan & Kenyamanan Kamar
agung satu,2023,5,nyaman untuk menginap bersama keluarga dan dalam kebutuhan bisnis ballroom nya juga nyaman untuk acara pribadi atau acara bersama pelayan baik dari mulai pintu gerbang pintu masuk dan keseluruhan nya membuat kita nyaman protokol kesehatan berjalan dengan baik dan selalu ingat kan kembali selalu semangat untuk konsumen salam sehat selalu dan selalu sehat,KOMPETITOR,Bintang 5,JWMarriotHotelJakarta,positive,Kebersihan & Kenyamanan Kamar
Maria Enny,2025,5,pengalaman yang luar biasa,KOMPETITOR,Bintang 5,JWMarriotHotelJakarta,positive,Harga & Value for Money
HENPRAST PTR,2025,5,tempatnya nyaman dan pelayanan bagus pekerjaan bagus,KOMPETITOR,Bintang 5,JWMarriotHotelJakarta,positive,Kebersihan & Kenyamanan Kamar
Arjuna Aritonang,2025,5,Serba oke nih hotel akses kemana mana mana mana mudah enak buat jujugan teman teman aku yang bingung memilih tempat menginap saat ke indonesia atau jakarta standar dah internasional jadi tidak perlu kuatir akan menemukan layanan yang jauh dibawah harapan,KOMPETITOR,Bintang 5,JWMarriotHotelJakarta,positive,Lokasi & Akses Strategis
Fandi Rama,2025,5,hotel yang sangat nyaman pelayanannya,KOMPETITOR,Bintang 5,JWMarriotHotelJakarta,positive,Kebersihan & Kenyamanan Kamar
visnu rahman,2025,5,Tempat bagusnya pelayanan nya juga mantaap,KOMPETITOR,Bintang 5,JWMarriotHotelJakarta,positive,Kualitas Makanan & Restoran
Icy Upang,2025,5,enak banget nginep disini petugasnya ramah semuanya,KOMPETITOR,Bintang 5,JWMarriotHotelJakarta,positive,Pelayanan Staf & Keramahan
Febiana,2023,4,sarapan nya enak banget kamar lumayan sayang kolam nya tidak terlalu besar dan resepsi tidak memberikan informasi kepada cust dengan baik kami cek masuk hari minggu dan seharusnya diberikan voucher es krim berdasarkan informasi petugas kolam tapi kami tidak diberikan ketika cek masuk,KOMPETITOR,Bintang 5,JWMarriotHotelJakarta,negative,Fasilitas Hotel (Kolam/Gym/Spa)
Jason Koh,2024,4,Check masuk angin staf super ramah dan membantu seperti dengan daerah pusat kota mengharapkan lalu lintas berat menyukai tempat sarapan dan berbagai makanan yang tersedia lokal pilihan internasional India sebagian besar dari mereka dengan baik dilakukan memiliki pilihan yang baik buah dan campuran lokal yang bagus madu jahe dan minuman kunyit,KOMPETITOR,Bintang 5,JWMarriotHotelJakarta,positive,Pelayanan Staf & Keramahan
Nurman Riyadi Rahman,2023,5,hotel bintang 5 pertama yang saya kunjungi di jakarta kesan pertamanya bagus gedungnya klasik tapi terlihat mewah untuk kamarnya sih bagus dengan pemandangan kota jakarta dari atas kasurnya sangat nyaman buat beristirahat untuk sarapannya sendiri cukup enak ada banyak pilihan menu yang disajikan mulai dari barat hingga makanan indonesia dan baru pertama kali juga saya mencoba makanan india di hotel ini fasilitas yang disediakan ada gym yang cukup banyak pilihan alat buat latihanenya ada juga kolam renang yang sayangnya cukup kecil,KOMPETITOR,Bintang 5,JWMarriotHotelJakarta,positive,Fasilitas Hotel (Kolam/Gym/Spa)
Ibrahim,2025,5,jw marriott hotel jakarta sangat memuaskan dengan fasilitas yang lengkap dan memadai juga nyaman dan sangat puas,KOMPETITOR,Bintang 5,JWMarriotHotelJakarta,positive,Kebersihan & Kenyamanan Kamar
Dita Pritami,2025,5,Resepionisnya ramah ramah Mba Gaby ngebantu banget waktu ruang survei tapi belum bisa menginap segera staycation di jw deh,KOMPETITOR,Bintang 5,JWMarriotHotelJakarta,positive,Pelayanan Staf & Keramahan
dewa krisna,2025,5,mengikuti acara seminar saja tidak menginap,KOMPETITOR,Bintang 5,JWMarriotHotelJakarta,neutral,Harga & Value for Money
indah putrimaya,2025,5,Viewnya fantastis dan sangat indah dan pelayanannya bagus banget,KOMPETITOR,Bintang 5,JWMarriotHotelJakarta,positive,Lokasi & Akses Strategis
Sunil Raj,2024,4,Secara keseluruhan tinggalnya baik itu strategis terletak saya akan perlu menonjolkan tim di ruang tamu yang menjaga pertunjukan berlangsung pada renaldo kemal yunisa ysday mereka memiliki makanan penutup india yang saya minta untuk disimpan dan saya tidak bisa kembali dan ketika saya meminta yang sama hari ini tanpa ragu mereka keluar dari kotak dan memastikan mereka menyiapkan permen segar untuk saya itu semua tentang keramahan mereka memperlakukan Anda dengan senyum besar dan itu sangat menyambut,KOMPETITOR,Bintang 5,JWMarriotHotelJakarta,positive,Pelayanan Staf & Keramahan
Kenan Raysid,2025,5,Sangat senang aku berada di hotel ini,KOMPETITOR,Bintang 5,JWMarriotHotelJakarta,positive,Harga & Value for Money
Muhammad Dudayev Caesar Putra,2025,5,pelayanan nya ramah,KOMPETITOR,Bintang 5,JWMarriotHotelJakarta,positive,Pelayanan Staf & Keramahan
Kelana “Kkkecil” Keluarga Kecil,2020,5,salah satu hotel bisnis terbaik masuk jakarta strategis terletak dan mereka memiliki keamanan terbaik mereka memberikan sentuhan pribadi untuk anggota mereka yang sangat baik untuk menjaga anggota loyalitas kamar begitu besar dengan mandi besar tempat tidur adalah,KOMPETITOR,Bintang 5,JWMarriotHotelJakarta,positive,Kebersihan & Kenyamanan Kamar
kiki fitrianaa,2025,5,kamar dan hotelnya bagus kebersihan luar biasa dan langkah keamanan diterapkan membuat saya sekeluarga merasa aman selama menginap,KOMPETITOR,Bintang 5,JWMarriotHotelJakarta,positive,Kebersihan & Kenyamanan Kamar
stcomputindo rental,2025,5,hotel dengan lokasi yang sangat strategis di wilayah mega kuningan dengan kualitas layanan terbaik bintang 5 kami stcomputindo siap mendukung buat anda yang membutuhkan alat multimedia dan sistemnya,KOMPETITOR,Bintang 5,JWMarriotHotelJakarta,positive,Lokasi & Akses Strategis
Dinda Puspaningtyas,2025,5,Hotel yang indah dengan kamar besar makanan yang luar biasa terutama desain seafood sedikit sekolah tua tapi suasana bagus saya suka staf yang luar biasa tapi kolam renang seperti yang Anda lihat masuk foto ini sangat dekat dengan kantor berikutnya buliding mereka dapat melihat kita berenang jelas dari jendela haha,KOMPETITOR,Bintang 5,JWMarriotHotelJakarta,positive,Fasilitas Hotel (Kolam/Gym/Spa)
Chingu and friends,2021,4,Jl marriott jakarta pasti salah satu hotel terbaik masuk jakarta mereka menyediakan suasana yang baik untuk memastikan bahwa Anda nyaman tinggal masuk hotel staf sangat membantu dan mereka akan selalu menyambut Anda selama pandemi ini mereka,KOMPETITOR,Bintang 5,JWMarriotHotelJakarta,positive,Pelayanan Staf & Keramahan
Mamoi,2024,5,Bukan hanya keindahan bangunan juga konstruksi yayasan yang menunjukkan kepada kita bahwa ini tahan uji waktu kamar tidak pernah membiarkan kita merasa rumah dan milik apa yang bisa kita minta lebih,KOMPETITOR,Bintang 5,JWMarriotHotelJakarta,positive,Harga & Value for Money
Tata Sunarta,2025,5,Tempat bagus dan pelayanan nya,KOMPETITOR,Bintang 5,JWMarriotHotelJakarta,positive,Kualitas Makanan & Restoran
Mohamad Zaenal Abidin,2025,5,lokasinya strategis kamarnya juga enak,KOMPETITOR,Bintang 5,JWMarriotHotelJakarta,positive,Lokasi & Akses Strategis
Miya Kuza,2025,5,lokasi strategis dan tempat baru bagus,KOMPETITOR,Bintang 5,JWMarriotHotelJakarta,positive,Lokasi & Akses Strategis
Madon Kasep,2025,5,mantap tempat nya enak,KOMPETITOR,Bintang 5,JWMarriotHotelJakarta,positive,Kualitas Makanan & Restoran
budiman rakhmatullah,2025,5,pelayanan dan layanan yang sangat memuaskan,KOMPETITOR,Bintang 5,JWMarriotHotelJakarta,positive,Harga & Value for Money
Jerry Toh,2024,5,Sangat merekomendasikan kepada siapa pun yang mencari layanan dan keramahan yang fantastis masuk jakarta terutama manajer hotel mereka isac memberikan saya dan istri pengalaman layanan pelanggan yang luar biasa staf hotel memberikan kami pengalaman di luar harapan kami dan kami sangat terkesan dengan profesionalisme mereka pasti akan mengunjungi lagi masuk di masa depan,KOMPETITOR,Bintang 5,JWMarriotHotelJakarta,positive,Pelayanan Staf & Keramahan
Satria A,2025,5,datang di tempat pertemuan bisnis sedikit tua dan lokasi lobi agak tersembunyi namun oke sangat baik dan membantu staf makanan hebat,KOMPETITOR,Bintang 5,JWMarriotHotelJakarta,positive,Pelayanan Staf & Keramahan
DJ A,2024,3,Air conditioning masuk kamar tidak dingin ya mereka datang untuk memeriksa ketika kami meminta perawatan meninggalkan setelah 20 menit mencari dan tidak pernah kembali kami memiliki tidur malam yang mengerikan karena berkeringat kami begitu lelah kami tidak bisa diganggu,KOMPETITOR,Bintang 5,JWMarriotHotelJakarta,negative,Infrastruktur (AC/WiFi/Parkir/Air)
Ari Wibowo,2025,5,Hotel yang bagus staf yang hebat tetaplah seperti itu,KOMPETITOR,Bintang 5,JWMarriotHotelJakarta,positive,Pelayanan Staf & Keramahan
Azzahra Indah,2025,5,mantap bagus bagus banget,KOMPETITOR,Bintang 5,JWMarriotHotelJakarta,positive,Harga & Value for Money
KORONG BETMEN,2025,5,mantap banget tempatnya juga pelayanannya ramah,KOMPETITOR,Bintang 5,JWMarriotHotelJakarta,positive,Pelayanan Staf & Keramahan
agung_id,2023,5,disini nyaman untuk menginap bersama keluarga dan dalam kebutuhan bisnis ballroom nya juga nyaman untuk acara pribadi atau acara bersama pelayan baik dari mulai pintu gerbang pintu masuk dan keseluruhan nya membuat kita nyaman,KOMPETITOR,Bintang 5,JWMarriotHotelJakarta,positive,Lokasi & Akses Strategis
M Ry,2025,5,menjadi anggota Marriott Bonvoy adalah luar biasa dan saya selalu menghargai upgrade kamar ini bersih dan nyaman dan layanan adalah profesional yang perhatian dan mengundang cinta tinggal di sini sementara i masuk jakarta untuk bisnis,KOMPETITOR,Bintang 5,JWMarriotHotelJakarta,positive,Kebersihan & Kenyamanan Kamar
Yang Xuan Goh,2019,5,Hotel masuk lokasi terpusat dengan akses yang baik ke restoran dan pusat perbelanjaan terdekat hotel itu sendiri sangat baik kamar dilengkapi dengan ukuran yang cukup untuk kamar ganda tunggal dengan baik dipertahankan dan bersih WiFi konektivitas,KOMPETITOR,Bintang 5,JWMarriotHotelJakarta,positive,Kebersihan & Kenyamanan Kamar
Gold Rock Productions,2019,5,luar biasa nilai dan layanan yang sangat baik staf yang terlatih yang sangat sopan bersedia membantu keluar dengan permintaan apapun fasilitas termasuk spa yang luas gym dilengkapi dengan kamar uap dan sauna atap kolam renang dan kebun-kebun sangat murah hati eksekutif,KOMPETITOR,Bintang 5,JWMarriotHotelJakarta,positive,Fasilitas Hotel (Kolam/Gym/Spa)
Mercy Malik,2019,5,Hotel bersih cantik dihias elegan kamar bersih dan bergaya staf ramah tingkat keamanan sangat tinggi makanan baik farden juga cantik,KOMPETITOR,Bintang 5,JWMarriotHotelJakarta,positive,Kebersihan & Kenyamanan Kamar
Natalia Only,2025,1,Parkir sangat sedikit mau valet disuruh ke sana ke sini lempar2 an mulu petugasnya trus akhirnya disuruh ke b2 eh b2 ditutup harus kembali ke b1 dan berujung parkir di satu satrio sangat amat tidak disarankan ke sini bawa mobil gedeg asli ke resto sailor besok hari libur memperbaiki tidak akan kembali lagi ke sini penuh trauma,KOMPETITOR,Bintang 5,JWMarriotHotelJakarta,negative,Lokasi & Akses Strategis
Jum Jum,2025,1,Barusan dapat pesan dari telegram disuruh review hotel ini disuruh ngasih bintang 5 katanya kalau udah direview dikasih komisi eh setelah dikirim malah diblokk wkwkw mohon ditindak lanjuti,KOMPETITOR,Bintang 5,JWMarriotHotelJakarta,negative,Harga & Value for Money
Bastian Imanuel,2025,1,pelayanan di makan malamnya tidak ramah kamar bau pelayanan keamanan tidak ramah sembarang buka pintu mobil sangat kecewa dengan pelayanannya,KOMPETITOR,Bintang 5,JWMarriotHotelJakarta,negative,Kualitas Makanan & Restoran
adam akbar,2025,1,kesan pertama kali saya masuk ke hotel ini sebagai pic kontraktor acara sudah ngebuat saya merasa tidak enak perlakuan keamanan nya tidak sopan dengan muka yang arogan bukan terkesan tegas malah seperti merendahkan ditambah dengan pelayanan yang lelet dan tidak cepat tanggap akses keluar masuk loading dock nya pun hanya 1 itu membuat antrian yang panjang karena jika ada yang mau keluar berarti yang mau masuk nya harus pergi mundur dulu siling nya juga pendek banget yang berarti kita tidak bisa menggunakan truk besar untuk loading di hotel ini jadi kurang efektif ditambah lagi akses ke lift loading dock nya sempit banget dengan ukuran lift untuk loading,KOMPETITOR,Bintang 5,JWMarriotHotelJakarta,negative,Pelayanan Staf & Keramahan
Methodius Zhagoto,2025,1,tanggal 12 april 2025 jam 19 20 00 saya datang ke sana dan bisa merasakan buruknya drive penjaga keamanan depan yang di mana paling depan ada yang lebih berkesan kepada tamu ada penjaga depan namun saya tidak tahu pasti itu keamanan atau cadangan karena seragam ya bukan seragam keamanan bajunya coklat bercorak di saat saya melakukan pengecekan mobil buka bagasi dan cek bagian bawah saya merasa baik saja sih namun pada saat petugas ya minta cup mesin sedikit terkejut sih lah lah buka cup mesin mau cek apa cerita singkat yaudh lah dia mungkin seperti itu namun jangan karena mobil saya ngk terlalu mewah cup mesin gua lu banting sampai penyok,KOMPETITOR,Bintang 5,JWMarriotHotelJakarta,negative,Pelayanan Staf & Keramahan
Raushangga Azazi,2025,1,Saya mau ulang karena tidak sesuai kesepakatan dari pihak blibli tiket reward,KOMPETITOR,Bintang 5,JWMarriotHotelJakarta,neutral,Harga & Value for Money
