User Name,Review Time,Rating,clean_text,Tipe,Kelas,Nama_Hotel,AI_Sentiment,AI_Aspek
EC,2025.0,4,jangan lupa bilang tamu hotel biar tidak bayar karcis di pintu kawasan jatiluhur nya saat nyampe disediain selamat datang minum seger stlh perjalanan jauh nan berliku ada dispenser galon di lorong bawa stok perbekalan jg bagi yang suka ngemil makanan room service buka sampai jam 10 malem rasanya oke harga std hotel dpt kamar yang view bendungan tapi kehalang pohon jadi cm ngintip2 saja pintu belakang hotel ternyata ditutup pdhl kalau dibuka enak banget akses ke rusa total kebersihan kamar oke kecuali keset toilet air kolam renang agak berbusa entah apa itu bukan apa jadi mencoba renang sarapan kurang ya untuk kelas,BUMN,Bintang 4,JatiluhurValley&Resort,positive,Kebersihan & Kenyamanan Kamar
Lia Hikmatul Maula,2025.0,4,hotel lama dengan nuansa villa pemandangannya bagus hijau hening tidak jauh dari waduk jatiluhur disediakan sepeda dengan sewa 100rb bangunan hotel baik namun ada beberapa bagian ada yang bocor seperti ac jet wash wastafel sepertinya hotel kekurangan staf untuk perawatan bangunan sebesar itu sarapan yang disediakan untuk ukuran hotel tidak terlalu banyak tapi enak rasanya tidak cocok dengan hambar indonesia saya sangat suka dengan nasi kuning omelet dan kue soes nasi kuningnya khas nasi kuning tumpeng rasanya gurih dan berbumbu seperti saat ini rasanya omeletnya tidak hambar enak diisi dan potongan tomat bawang bombay sos sos sos,BUMN,Bintang 4,JatiluhurValley&Resort,positive,Kualitas Makanan & Restoran
Via Marlia,2025.0,1,kesan pertama bikin kapok saya sedang dalam perjalanan dinas di purawakarta dan mencari hotel semalam saya bertanya2 untuk meminta informasi menginap resepsionis lambat respon dan tidak menyampaikan informasi dengan jelas namun saya ttp berencana menginap karena saya melihat review dan foto oke nih besok saya tiba diloby dan mengahampiri resepsionis resepsionis tidak ramah dan melayani sambil duduk selama saya berbicara dengannya apakah ini sopnya mungkin ya berbeda dengan hotel atau resor lainnya ketika saya diberi kunci kamar saya tanya kamarnya dan resepsionis mengarahkan saya menuju tangga ke bawah sedang rusak dia tahu jika karena posisi saya datang sendiri dan tidak menawarkan bantuan untuk mengangkat di,BUMN,Bintang 4,JatiluhurValley&Resort,negative,Pelayanan Staf & Keramahan
Meis Ezha,2025.0,3,saya menginap di bungalow bougenville kamar cukup bersih di sudut kamar ada serpihan sampah yang tidak ke sapu lampu depan sempat mati dan staf hotel bilang belum bisa diganti karena tidak ada stok bohlam tapi tidak lama datang untuk ganti tidak disediakan teh gula kopi dikirim garpu ketika diminta staf hotel bilang memang tidak disediakan tapi tidak lama dianter jg udara galon tidak bening kotor tidur kurang nyaman karena jam 3 pagi ada suara seperti ketukan di jendela aluminium berkali-kali ingin melihat keluar tapi gelap akhirnya tidak tidur lg ntah org iseng atau makhluk lain intinya jadi tidak pener nyaman untuk lokasi enak cuma kurang,BUMN,Bintang 4,JatiluhurValley&Resort,negative,Kebersihan & Kenyamanan Kamar
Mia Aslamiyah,2025.0,4,Yang aku suka dari hotel ini adalah pemandangan dan suasana nya dingin dan nyaman banget trus yang aku suka di sini sarapan nya juga enak banget tidak terlalu banyak pilihannya tapi semua makanan yang di sajikan itu enak banget aku suka banget bubur ayam dan bubur sumsum nya semoga bisa di tingkatkan kan lagi fasilitas hotel nya soalnya kemarin saat mau renang lantai nya agak licin,BUMN,Bintang 4,JatiluhurValley&Resort,positive,Kualitas Makanan & Restoran
Galuh Intan,2025.0,3,ac nya bocor kerannya pun bocor pengering rambut rusak dan untuk tangan sepertinya harus diperbaharui untuk kelengkapan fasilitasnya sebenarnya bagus bisa karaoke ada billiard dan kolam renang tapi pada saat mau ke lounge jam setengah 9 malam malah tidak ada orang yang jaga padahal lounge buka sampai jam 10 malam kebangkitan malam2 karena entah kamar sebelah lagi dibersihin atau gimana berisik sangat kebersihan sih oke sebenarnya bagus jika fasilitas dijaga semuanya tapi karena kurangnya petunjuk ada fasilitas apa saja yang bisa utama kemana saja jadinya kurang sempurna liburan di sini,BUMN,Bintang 4,JatiluhurValley&Resort,negative,Kebersihan & Kenyamanan Kamar
indah siswanti,2025.0,5,Ada toilet bocor bau menyakitkan luar biasa berulang2 meskipun sudah membersihkan di kamar pertama 219 kemudian minta pindah kamar langsung di proses ke 118 suka sekali gercep tapi di kamar baru 118 sabun mandi abis hihi mohon di perhatikan dan untuk kamar yang bocor semoga lekas di memperbaiki agar pelanggan yang lain tidak mengalami hal yang sama,BUMN,Bintang 4,JatiluhurValley&Resort,negative,Kebersihan & Kenyamanan Kamar
Mike D&D Corp.,2025.0,4,lingkungan nyaman asri segar layanan sarapan cukup bagus lengkap rasa enak kamar sbnrnya oke luas lega namun perlu dtingkatkn pemeliharaan nya kolam renang sbnrnya jg oke kurang perawatan sj hotel ini mgkin dalam proses pemulihan setelah covid smoga pada kunjungan berikutnya sudah lbih baik,BUMN,Bintang 4,JatiluhurValley&Resort,positive,Kebersihan & Kenyamanan Kamar
Ida Farida Ch,2025.0,3,kamar cukup bersih meskipun saat ini baru masuk ada bau yang kurang nyaman sedikit bau apek lokasinya cukup nyaman untuk jalan jalan pagi di seputan hotel apalagi ada fasilitas buggy car untuk mencapai waduk jatiluhur dan lokasi rekreasi lainnya untuk ke kamar dan ruang makan aksesnya menggunakan tangga lift tidak berfungsi untuk makanan oke lah yang parah itu kolam renang padahal kolamnya luas dan besar dasar kolam terlihat kotor berlumut jadi udara juga kotor kehijauan seharusnya ada pemeliharaan dan pengecekan kualitas kolam dan udara yang benar tempat gym juga kurang terpelihara berdebu sebetulnya ingin kembali ke sini karena dekat,BUMN,Bintang 4,JatiluhurValley&Resort,negative,Kebersihan & Kenyamanan Kamar
Ria Ria Ria,2025.0,4,Aku suka bagaimana gunung-gunung berlapis satu sama lain Aku bertanya-tanya dari mana bau kotor itu datang dari pemandangan dari Bougenville bungalow juga kolam renang yang bagus membutuhkan beberapa pembersihan tho lift tidak bekerja tangga ke restoran bisa lebih baik staf sangat membantu ketika mereka ditanya,BUMN,Bintang 4,JatiluhurValley&Resort,positive,Fasilitas Hotel (Kolam/Gym/Spa)
tya sulis,2025.0,5,untuk hotel nya lebih oke sih apalagi makanan nya enak banget khas banget hotel berbintang musholla dan toilet ada di beberapa tempat cukup memadai namun ada beberapa yang kurang yaitu kamar yang saya tempati di kamar mandi nya bocor entah darimana jadi lantai selalu basah dan jadi aroma nya kurang sedap trus karena dateng nya saat ini hari kerja jd tidak mencoba buffet nya sarapan nya nya ala carte tapi masakan nya enak kok apalagi nasi goreng nya juara siihh masuk syaa allah kesini lagi saat akhir pekan,BUMN,Bintang 4,JatiluhurValley&Resort,positive,Kualitas Makanan & Restoran
Ika Priska,2025.0,5,tempatnya enak bersih nyaman ramah lingkungan pelayanannya bagus sopan dan ramah pokoknya nanti akan kembali lagi ke hotel ini,BUMN,Bintang 4,JatiluhurValley&Resort,positive,Kebersihan & Kenyamanan Kamar
caca,2025.0,4,hotel tersembunyi di kawasan resort waduk jatiluhur purwakarta kurang lebih 7 km dari pintu keluar tol ciganea suasananya menyenangkan karena sepi padahal lagi libur sekolah entah karena kami di hari kerja atau memang hotelnya sepi tapi jadi puas mengeksplorasi semua fasilitas hotel fasilitasnya oke banget anak-anak ramah bisa mengeksplorasi waduh jatiluhur akses gratis untuk tamu hotel sore hari bisa melihat matahari terbenam baguss ada kolam renang dewasa dan anak ada taman bermain yang lengkap dan masih berfungsi sangat baik dingin dan lingkungan sekitar hotel luas bersih makanan enak2 sayangnya saat kami datang tidak sistem buffet makanan berat,BUMN,Bintang 4,JatiluhurValley&Resort,positive,Fasilitas Hotel (Kolam/Gym/Spa)
Bayu Hendrawan,2025.0,3,Watafel map tvnya rusak exos udara kamar mandinya rusak kolam kotor ada daun di dasar kolam tidak dibersihkan hati krna hotel kurang perawatan banyak besi pinggiran kolam yang berkarat,BUMN,Bintang 4,JatiluhurValley&Resort,negative,Fasilitas Hotel (Kolam/Gym/Spa)
Tya,2025.0,4,untuk yang cari suasana tenang dingin saya rasa resor ini bisa menjadi salah satu pilihan lokasi tidak begitu jauh dari tol lingkungan masih memiliki jarak baru dengan waduk jatiluhur cukup dekat bisa ditempuh dengan jalan kaki 15 menit dari hotel bisa sekalian olahraga fasilitas cukup lengkap sarapan banyak variasi dan rasa nya enak untuk resto juga harga nya masih cukup terjangkau tapi karena lokasi yang cukup jauh dari keramaian jadi saya sarankan sebelum masuk siapkan perbekalan untuk gedung memang harus ada perbaikan di beberapa area tapi tidak mengganggu kenyamanan untuk udara panas di kamar mandi kami merasa kurang panas begitu,BUMN,Bintang 4,JatiluhurValley&Resort,positive,Kualitas Makanan & Restoran
Cat Lover,2025.0,4,Aku tidak tahu bagaimana itu adalah daerah pribadi kilometer sebelum kita perlu membayar untuk masuk area hotel terbuka untuk umum dan pemandangan bendungan jauh tersedia tapi bau air yang parah akses langsung bendungan ditolak,BUMN,Bintang 4,JatiluhurValley&Resort,negative,Harga & Value for Money
Derek Jones - D Rex,2025.0,2,Doom adalah bencana pada kedatangan housekeeping datang dan disortir tidak menggunakan kamar jika tidak siap ac head shower bising adalah menjijikkan dan lantai di sekitar hotel semua tergelincir selama hujan sebagai jalan kaki bocor makanan baik-baik saja tapi sangat terbatas minuman tersedia selain jus manis manis,BUMN,Bintang 4,JatiluhurValley&Resort,negative,Infrastruktur (AC/WiFi/Parkir/Air)
Ferdinand Cornelis,2025.0,4,cocok untuk yang mau jauh dari hingar bingar kota rest di pinggir salah satu waduk terbesar di jawa barat,BUMN,Bintang 4,JatiluhurValley&Resort,positive,Lokasi & Akses Strategis
arfi2 drive,2025.0,5,Liburan lebaran setelah 2 hari di kota bandung sebelum pulang ke jakarta ingin menyembuhkan di kawasan yang sejuk dan asri bersama orang tua keluarga inti dan keluarga adik dan kakak pesan 3 kamar kunjungan sebelum nya sekitar 4 tahun lalu cuma kunjungan ke danau nya saja akhirnya kesampaian juga nginap di hotel nya 1 malam kamar deluxe lumayan bagus langsung di depan ada kolam renang resto nya enak2 juga makanan nya menu nya baru lengkap dan saat lagi sarapan rupanya dikumandangkan lagu kebangsaan serempangkan semua berdiri dan menyanyikan indonesia raya dengan khidmat sebuah tradisi unik yang berkaitan dengan peristiwa bersejarah,BUMN,Bintang 4,JatiluhurValley&Resort,positive,Fasilitas Hotel (Kolam/Gym/Spa)
Deebila channel,2025.0,5,hotelnya bagus dan rapih suasananya nyaman udaranya dingin pelayanan nya ramah kamarnya juga bersih ditambah view nya bagus makanan di resto nya juga lumayan enak,BUMN,Bintang 4,JatiluhurValley&Resort,positive,Kebersihan & Kenyamanan Kamar
Muhammad Ezra,2025.0,5,lokasi sangat indah dekat dengan situs budaya walaupun kalau malam memang gelap cocok untuk jalan ketika ada matahari makanan dan layanan cukup bagus yang perlu diperhatikan wifi sangat lemot dan bantal sedikit berbau sebagai kamar deluxe kembar bukan yang view danau,BUMN,Bintang 4,JatiluhurValley&Resort,negative,Lokasi & Akses Strategis
Evalia Nuryana,2025.0,5,datang sebelum jam cek masuk dan dibolehin untuk menunggu di lobi dapat 2 botol air mineral kamarnya kuep karena semua barang berfungsi dan tidak ada yang rusak apalagi mandi air panasnya mantep kalii restoran enak sarapan pagi nya banyak banget pilihannya kolam renang juga oke lah lah desain dari kamar dan semua tempat di hotel ini bagus banget agak agak karena masuk waduknya ragu mahal tadi tapi ternyata itu 1x bayar saja saja saja asal tiket masih disimpan boleh bolak balik tempat di waduknya memang banyak ada dermaga bendungan tempat mancing dll jadi bisa jalan ramah dan membantu pokoknya ini pengalaman hotel yang menyenangkan,BUMN,Bintang 4,JatiluhurValley&Resort,positive,Kebersihan & Kenyamanan Kamar
Stephanus Budi,2025.0,5,kamarnya cukup luas dan bersih fasilitas kolam renang dengan tarif kamar terjangkau pelayanan resepsionis responsif dan cukup cepat lokasi hotel dekat dengan bendungan,BUMN,Bintang 4,JatiluhurValley&Resort,positive,Kebersihan & Kenyamanan Kamar
Muhammad Sabiq,2025.0,5,saya pesan tipe vila bougenville dengan 3 kamar 2 km 1 ruang keluarga tv pulau dapur dan meja makan kamarnya luas dan bersih sudah termasuk ac dan tv di setiap kamar kamar utama ada kamar mandi di dalam kamar mandi luar ada bak mandi baru ruang keluarga luas jadi bisa membuat acara keluarga besar ada kompor listrik kulkas dll ketika datang didepan vila banyak domba2 kemudian soreenya datang monyet2 jadi hiburan buat anak2 sarapannya variatif dan rasa yang enak cuaca dingin dan nyaman karena pohon yang rindang saran jika pergi kesana usahakan sebelum malam karena akses yang kurang terang selebihnya oke banget lokasi hotel dan suasananya tidak,BUMN,Bintang 4,JatiluhurValley&Resort,positive,Kebersihan & Kenyamanan Kamar
Henny Saraswaty,2025.0,1,Sebenernya tempatnya bagus rindang dan nyaman tapi sayangnya pelayanannya kurang memuaskan banget memesan 1 bungalow 3 kamar untuk tgl 27 29 januari 2025 via a saat nyampe ternyata yang di memesan katanya ada masalah dan lgsg dipindahkan ke 2 bungalow dengan masing2 2 kamar ya sudah diterima saja scr mmg akhir pekan panjang agak susah klo jam cari tempat lain tapi ternyata banyak sewa komplen mulai dari ruangan yang kotor saat masuk pipa tempat cuci piring yang macet sampai bikin becek lantai pintu salah satu bungalow yang tidak bisa dikunci sampai kita menunggu jam tukang kunci dateng,BUMN,Bintang 4,JatiluhurValley&Resort,negative,Kebersihan & Kenyamanan Kamar
Matt G,2025.0,3,Hotel terletak di dalam daerah resor daerah itu tenang dan memiliki perasaan alami yang baik semuanya sangat tersebar keluar meskipun dan Anda akan baik harus berjalan banyak atau mendapatkan transportasi atau beberapa jenis hotel tidak akan membiarkan kita memeriksa masuk awal 30 menit meskipun tempat itu hampir kosong fasilitas umum yang tanggal dan pemeliharaan tertinggal kamar 219 besar tetapi tanggal juga tempat tidur memiliki noda tetapi berbau kamar mandi segar sedikit sempit air panas mengambil waktu tetapi tekanan itu baik ac bekerja baik salah satu dari beberapa tempat masuk indonesia yang memiliki pengering rambut tempat tidur nyaman,BUMN,Bintang 4,JatiluhurValley&Resort,negative,Kebersihan & Kenyamanan Kamar
S A,2025.0,4,secara keseluruhan pengalaman yang baik tetapi banyak ruang untuk perbaikan khususnya di depan fasilitas makanan adalah rata-rata dan properti membutuhkan beberapa perhatian mendesak untuk pemeliharaan,BUMN,Bintang 4,JatiluhurValley&Resort,positive,Kualitas Makanan & Restoran
Mo's,2025.0,5,pilihan sempurna untuk liburan pendek atau staycation terutama jika Anda tidak ingin keramaian keramaian Bandung kota anak anak ramah juga hotel tua tetapi baik dipelihara Anda harus mengunjungi mereka istora cafe juga Anda akan melihat pemandangan lembah menakjubkan dan PTA lama dari sana saya terkejut harga kamar kurang dari 350k dan sarapan adalah besar saya sarankan Anda bangun pagi masuk pagi dan memberi diri Anda berjalan-jalan pagi yang baik di sekitar daerah saya pasti akan kembali ke sini,BUMN,Bintang 4,JatiluhurValley&Resort,positive,Harga & Value for Money
ViVi Disini,2025.0,4,lokasinya disekitar bendungan jatiluhur untuk kamar dengan harga segitu mnurutku worth ya kamar lumayan luas ada kulkas kebetulan dapet yang depan kolam jadi enak sih lgsg berenang cuma ac kamar netes kamar mandi ntah knp bau pesing pdhl kita baru datang udara di area mandi itu genang untuk amenities lengkap ya ada pengering rambut juga aku pnjm setrikapun dikasi staf gercep dan ramah kebetulan aku bawa lansia saat itu naik lg masalah dan kebayang ya hrs pakai tangga kasian banget kan lansianya ada sekali sih bisa mengangkat yang diusahakan bisa dipke pihak staff,BUMN,Bintang 4,JatiluhurValley&Resort,positive,Pelayanan Staf & Keramahan
bambang kurniawan,2025.0,4,dll kamari sudah sangat baik hanya mungkin tv nya perlu diganti,BUMN,Bintang 4,JatiluhurValley&Resort,negative,Kebersihan & Kenyamanan Kamar
DS DS,2025.0,4,kelebihan staf ramah sarapan rasa lumayan ac dingin kebersihan lumayan namun ada beberapa bekas noda di kursi dan wastafel kamar mandi bisa menggunakan mobil menuju ke istora cafe n resto waduk jati luhur kekurangan ternyata tidak bisa langsung menuju waduk kamar saat datang bau kaya kayu lapuk jamur yang paling parah tepat dibelakang kamar ada acara berkumpul jam 6:20 pagi menyetel speaker keras keras,BUMN,Bintang 4,JatiluhurValley&Resort,positive,Pelayanan Staf & Keramahan
G Wibisana,2025.0,4,perdana kamar 117 yang perlu diperbaiki lantai kamar mandi elevasi kemiringan kurang baik sehingga udara menggenang kamar mandi penerangan kurang ketersediaan handuk handuk harus diperbaiki jangan lagi inden apalagi tidak disediakan keset kamar mandi ketika malam kekedapan suara kurang banyak suara2 yang mengganggu kasur ranjang sudah tidak rata di satu sisi selebihnya oke,BUMN,Bintang 4,JatiluhurValley&Resort,negative,Kebersihan & Kenyamanan Kamar
J,2025.0,5,kamarnya nyaman lokasinya agak ke dalem dikit handuknya harus diganti yang baru sih,BUMN,Bintang 4,JatiluhurValley&Resort,positive,Kebersihan & Kenyamanan Kamar
Rindu Firdaus,2025.0,1,masjid ditempat wisatanya buruk banget ambil udara wudhu atau kekamar mandi di masjid harus bayar menunggu sama ibu ibu di masjidnya pun tidak ada mukenah atau sarung,BUMN,Bintang 4,JatiluhurValley&Resort,negative,Harga & Value for Money
Suwito,2025.0,4,kamar deluxenya cukup luas fasilitas cukup lengkap kolam renang gym anak-anak zona menu sarapannya macam2 rasa 8 10 okelah sayang bangunannya kurang terawat seperti ada bekas bocor drain ac di plafon kamar di knalpot ventilator toilet pelayanan oke lebih ditingkatkan saja rumah sakitnya,BUMN,Bintang 4,JatiluhurValley&Resort,positive,Fasilitas Hotel (Kolam/Gym/Spa)
Vallosa Rhea pavita,2025.0,2,pergi ke restonya lantai 2 harganya tidak jelas di menu buku tidak sama dengan harga di sistemnya dan kadang ada pajaknya tetepi adek saya beli tidak ada pajaknya awalnya saya bayar 113 0 setelah saya pikir kok totalnya tidak sesuai akhirnya saya minta nota dan ternyata totalnya 101 sekian,BUMN,Bintang 4,JatiluhurValley&Resort,negative,Harga & Value for Money
Rery Purwandari,2025.0,4,untuk kamar ya lumayan walau ada nyamuknya tv yang agak bikin bt karena saluranannya hilang timbul trs sama restonya saat sarapan langsung pilih dimeja kasir untuk satu orang satu pilihan disajikan bersiaran tidak kaya prasmanan seperti hotel2 pilihan lain makanannya jg tidak banyak untuk lokasinya damai dingin tepat banget buat yang cari suasana tenang dan ramah anak untuk anak-anak klub jg taman bermain karyawan nya ramah2,BUMN,Bintang 4,JatiluhurValley&Resort,positive,Kebersihan & Kenyamanan Kamar
Febri Astuti,2025.0,4,kamar sih bagus nyaman dengan fasilitas yang memadai sejauh ini tidak ada masalah di kamar tapi waktu pertama masuk saja botol sabun di kamar mandi tidak ada isinya padahal mau dipakai dan parahnya waktu cek masuk kamar resepsionis bilang kalau sarapan bisa 3 orang karena memakai tempat tidur tambahan tapi saat mau sarapan hanya 2 orang saja yang boleh sarapan 1 nya lagi harus bayar itu pengalaman paling atau bisa dikatakan sangat2 mengecewakan karena merasa ditipu kali lain perbaiki bagian layanannya ya,BUMN,Bintang 4,JatiluhurValley&Resort,negative,Kebersihan & Kenyamanan Kamar
Heri Erdana,2025.0,5,menginap di sini dalam rangka pelatihan tim bangunan dari perusahaan untuk makanannya enak dan tersedia cukup untuk semua tamu kamarnya sendiri bersih tersedia udara hangat untuk mandi dan suasananya cukup tenang selain itu tersedia area gym area hiburan dan kolam renang,BUMN,Bintang 4,JatiluhurValley&Resort,positive,Kebersihan & Kenyamanan Kamar
Tomy Wongso (Milanisti),2025.0,5,Tempat nya bagus dingin dan masih sangat alami sekali bebas debu dan kebisingan cocok buat penyembuhan menenangkan jiwa sejenak,BUMN,Bintang 4,JatiluhurValley&Resort,positive,Kebersihan & Kenyamanan Kamar
Amalia R Hidayat Widyatmoko,2025.0,2,sudah lebih dari tiga kali menginap di hotel ini terakhir menginap pada bulan November 2022 sangat terkesan karena lokasi hotel yang unik di lingkungan yang hijau bangunannya sangat estetis dengan lobi menghadap ke waduk berada di antara rimbunnya orang-orang jati dengan area parkir yang cukup luas lounge yang nyaman tenang serta kamar yang bersih dan fasilitas yang baik,BUMN,Bintang 4,JatiluhurValley&Resort,positive,Kebersihan & Kenyamanan Kamar
Ahmad Rifqi Fauzi,2025.0,5,lokasi cukup jauh dari keramaian berada di kawasan waduk jatiluhur saat menginap kunci kamar rusak perbaikan sangat lama dan perlu menunggu sampai jam 11 malam sangat perlu membekali makanan jika menginap di sini namun sarapan cukup bervariasi,BUMN,Bintang 4,JatiluhurValley&Resort,positive,Lokasi & Akses Strategis
Aslian Ramadhan,2025.0,5,1 300k dapet paket yang mantap banget kamar oke makan malam sarapan voucher kapal dan voucher kolom renang diluar hotel serta ada mobil tempat penampungan untuk keliling dan di jelaskan tempat2nya sama karyawan terima kasih jatiluhur valley resort dan sampai ketemu dilain waktu pasti saya akan datang lagi ke sini sayangnya resepsi ini kadang kurang tanggap saja,BUMN,Bintang 4,JatiluhurValley&Resort,positive,Fasilitas Hotel (Kolam/Gym/Spa)
Mas Prime,2025.0,1,sarapan harus antri telor dadar sampai 1 jam katanya mau diantar tapi tidak diantar yang belakangan order malah dapat duluan harusnya yang masak telor jangan cuma 1 orang bikin mangkel di hati saja merusak liburan,BUMN,Bintang 4,JatiluhurValley&Resort,negative,Kualitas Makanan & Restoran
William Kurniawan,2025.0,3,Untuk kamar baru ada kunci kamar baru selot dari dalam yang rusak untuk penggemar kamar mandi tidak berfungsi sehingga pengap jika mandi udara panas uap nya tidak bisa keluar,BUMN,Bintang 4,JatiluhurValley&Resort,negative,Infrastruktur (AC/WiFi/Parkir/Air)
ade nofita,2025.0,3,layanan makanan bagus standar menu tidak terlalu bervariasi tapi apa yang yang siy yang diharap dari 90rb pax kamar ac dingin banyak noda di kursi dan kasur ekstra tempat tidur warna sprei tidak putih bersih udara kamar mandi sangat kencang hal negatif udara di luar kamar bau mungkin karena dkt danau setiap keluar kamar udaranya menu seperti nya karena bau sampah dari danau saya tinggal di 227 dan 228,BUMN,Bintang 4,JatiluhurValley&Resort,negative,Kualitas Makanan & Restoran
Sri Mulyani,2025.0,4,kamar oke tempat parkir luas namun kebersihan mungkin perlu ditingkatkan staf cukup ramah namun untuk layanan kepada pengunjung masih minim sekali seperti kecepatan respon dan perhatian terhadap kebutuhan tamu lokasi jauh dari keramaian tidak banyak restoran dan tempat makan alternatif menu di hotel juga terbatas tamu dapat menikmati pemandangan cantik waduk jatiluhur,BUMN,Bintang 4,JatiluhurValley&Resort,positive,Pelayanan Staf & Keramahan
Upang Tan,2025.0,5,hotel yang luas lingkungan sekitarnya hijau dan harga terjangkau perlu fokus ke pemeliharaan gedung dan fasilitasnya agar makin bagus seperti kebersihan kolam renang pada saat ini nginap saya diberikan gratis berupa 1 pax buffet bbq malam hari yang agak mengganggu adalah adanya bau yang seperti bau saya punya penasaran sumbernya dari waduk jatiluhur untuk detailnya kalian bisa menonton youtube dan ig kemanapedia ya,BUMN,Bintang 4,JatiluhurValley&Resort,positive,Fasilitas Hotel (Kolam/Gym/Spa)
Digital Concepts,2025.0,5,kamarnya oke tapi ventilator kamar mandi tidak bekerja juga kami berada di sana selama liburan Muhammad Ascension dan sebelum tahun baru cina tempat ini penuh kita harus menunggu selama lebih dari 2 jam untuk makan malam kita karena ada hanya 2 staf berjalan di sekitar melayani hampir seratus tamu staf baik dan bekerja keras tapi manajemen perlu menempatkan lebih banyak pemikiran dalam perencanaan di depan,BUMN,Bintang 4,JatiluhurValley&Resort,negative,Kebersihan & Kenyamanan Kamar
Steven Tan,2025.0,4,tambah 1 dekat dengan wisata jatiluhur hanya 5 menit 2 cukup bersih 3 staf ramah 4 sepi tidak berisik 5 ac dingin udara tidak ad masalah lancar dan tidak kuning wifi kencang 6 ada larangan floaties super besar untuk anak2 utama di kolam renang minus 1 terburuk dan tidak layak sarapan dipenuhi lalat karena ruang terbuka hampir tidak ada yang bisa dimakan karena semua makanan dihinggapi lalat 2 dalam kamar ditemukan hewan seperti kue kecil laron kumbang 3 tangan agak berbau dan kotor 4 gelas2 dalam kamar agak kotor catatan saat kami datang ada kamar yang lain bocor saat hujan yang lain sehingga harus makan siang,BUMN,Bintang 4,JatiluhurValley&Resort,negative,Kebersihan & Kenyamanan Kamar
Mulyadi Mishel,2025.0,3,hotel yang cukup saja untuk hotel bintang 3 agak tidakayangkan antara tim pemeliharaan front office sales kurang sinergi karena saya mendapatkan kamar 201 yang ternyata saluran mandi kepalanya mampet dipindah ke kamar lain acnya agak bocor semoga pihak manajemen bisa segera melakukan perbaikan dan juga kolam renang kecil dapat dipelihara juga tidak hanya kolam renang besar yang diurus pintu kamar mandi alangkah baiknya jika diganti jadi pintu geser dengan bentuk pintu saat ini sangat sulit sekali jika mau akses dulu kloset karena pasti tertutup pintu,BUMN,Bintang 4,JatiluhurValley&Resort,negative,Fasilitas Hotel (Kolam/Gym/Spa)
Afifah Jasmin,2025.0,5,posisi bungalow deket jalan jadi jika keluar mudah suasananya asri karena di depan pemandangan pohon pohon muat parkir mobil dan motor kamar ada 4 km dalam dapurnya bersih lengkap pakai kompornya listrik ada meja makan juga dalam kamar fasilitasnya sudah lengkap dan ac nya dingin halaman belakang cukup luas buat bbq an atau nongkrong nongkrong wifi kenceng tv berfungsi dengan baik staf di hotelnya ramah dan sangat membantu,BUMN,Bintang 4,JatiluhurValley&Resort,positive,Infrastruktur (AC/WiFi/Parkir/Air)
