User Name,Review Time,Rating,clean_text,Tipe,Kelas,Nama_Hotel,AI_Sentiment,AI_Aspek
Karl Karnadi,2025,5,sangat dekat dengan bandara cgk 20 menit atau kurang dengan layanan yang luar biasa nyamuk perlu koneksi kamar Anda dapat meminta apa pun sarapan gratis adalah salah satu yang terbaik saya memiliki campuran antara makanan lokal barat dan indonesia dan permen jika Anda memiliki marriot bonvoy elite tingkat Anda akan mendapatkan lebih banyak lagi dengan selamat datang hadiah buah-buahan permen semua ini telah sangat melampaui harapan saya untuk sebuah hotel bandara,BUMN,Bintang 4,SheratonBandara,positive,Kualitas Makanan & Restoran
Ahmad fauzi,2025,2,Anter jemput tamu parkir di depan hotel masa ia tidak boleh padahal langan an dari kantor bukan grab atau gokar seblm nya tidak ada kata tidak boleh saat jemput tamu keamanan juga tidak sopan baru banget sampai sudah di tegur usir jika ada komplen k gue terhadap tamu w salah masuk keamanan hotel dan pengolah hotel bukan di siap masuk parkiriran buat jemput tamu mlah di suruh parkir jauh dari hotel,BUMN,Bintang 4,SheratonBandara,negative,Infrastruktur (AC/WiFi/Parkir/Air)
Eric Yeo,2025,5,memiliki tinggal di sini sebelum keberangkatan saya hotel baru sekali setelah renovasi klub ruang tamu sedang dalam renovasi sehingga tidak ada gunanya malam koktail gym relatif dasar harapan mereka dapat mencakup lebih kekuatan dan peralatan kardio memiliki pengiriman gratis ke bandara tetapi tidak ke mall mengambil taksi ke pik avenue tidak terlalu jauh kudus untuk tim meninggalkan ipad saya selama sarapan dan pak setuju berhasil mengidentifikasi saya dan menyerahkan kembali kepada saya terima kasih tulus saya kepada mereka,BUMN,Bintang 4,SheratonBandara,positive,Fasilitas Hotel (Kolam/Gym/Spa)
Pig S,2024,4,datang ke hotel ini dari bandara sedikit lebih jauh dari yang terlihat di banyak gelap dan melengkung jalan-jalan jadi senang saya tidak mengemudi itu sedikit aneh bahwa memeriksa masuk setelah tengah malam karena penerbangan tertunda resepsi tuan menyebutkan bahwa dia akan meningkatkan kamar saya mungkin karena keanggotaan bonvoy jadi menit terakhir dia memutuskan untuk membawa saya ke kamar biasa daripada suite upgrade di tingkat atas jadi dia hanya membantu saya w bagasi saya ke tingkat kedua yang adalah tingkat yang sama dengan lobi saya sangat bingung mengapa dia akan membawa peningkatan kemudian,BUMN,Bintang 4,SheratonBandara,negative,Pelayanan Staf & Keramahan
Staycation Info Indonesia,2024,5,Sheraton jakarta soekarno hatta bandara adalah pilihan yang sangat bagus untuk keluarga maupun pribadi yang mencari akomodasi bintang lima dekat bandara hotel nuansa resort ini menawarkan berbagai fasilitas ramah anak seperti kolam renang dan program kegiatan untuk anak anak kamarnya luas dan nyaman beberapa dilengkapi dengan balkon yang menawarkan pemandangan danau lokasi yang dekat dengan bandara soetta memudahkan perjalanan namun tetap memberikan suasana yang tenang dan santai pelayanan staf yang ramah dan profesional menambah nilai positif bagi pengalaman menginap di sini,BUMN,Bintang 4,SheratonBandara,positive,Fasilitas Hotel (Kolam/Gym/Spa)
Maulida Dinar,2024,5,Aku merasa seperti disambut oleh kerabatku sendiri interaksi yang sangat hangat setiap staf kami datang mengingatkan kami tentang kegiatan anak-anak mereka memiliki ketika mereka melihat anak saya dan bahkan berinteraksi dengannya pasti akan kembali terima kasih,BUMN,Bintang 4,SheratonBandara,positive,Pelayanan Staf & Keramahan
syilvani vani,2024,5,best experience banget bisa staycation disini sama keluarga kita tinggal di tipe deluxe terrace lake view dari kamar langsung menghadap ke danau cantik banget kamar dan kamar mandinya super bersih dengan amenities yang super premium juga terus yang paling favorit disini yaitu area kolam renangnya rasa bali cakep banget ditambah lagi banyak kegiatan anak-anak nya yang pasti bikin anak-anak hepi bisa bikin sushi bersama chef kasih ikan dikolam terus anak-anak makan juga bisa melihat pesawat mendarat dari dekeet loh ah hepi banget pokoknya,BUMN,Bintang 4,SheratonBandara,positive,Kebersihan & Kenyamanan Kamar
Liliyana Lili,2025,4,lokasi strategis dekat bandara kamar dapat melihat bagus menghadap kolam renang tapi masalahnya kamar dan kasur agak dan ruangan bau apek,BUMN,Bintang 4,SheratonBandara,positive,Lokasi & Akses Strategis
Marc Bijl,2024,2,sarapan besar makan malam buruk ada lebih dari setengah jam antara hidangan disajikan makan makanan dingin atau solo staf dapur menyedot maaf untuk mengatakan kamar begitu lembab itu bau seperti memasuki gua dan cetakan di langit-langit semuanya terasa lembab pipa hujan berakhir di teras Anda jadi jika hujan terdengar seperti ada air mancur di samping tempat tidur Anda tidur baik tidak mendekati standar savoy kecuali untuk harga,BUMN,Bintang 4,SheratonBandara,negative,Harga & Value for Money
Halim Chandra,2024,5,Salah satu resort bintang 5 terbaik yang berlokasi di bandara soekarno hatta menyediakan free shutte antar jemput suasana kamar yang lebih segar dan baru setelah direnovasi untuk sarapannya sangat bervariatif mulai menu lokal hingga internasional fasilitas yang disediakan juga sangat bagus ada kolam renang gym hingga jogging track pastinya akan kembali kesini lagi terima kasih untuk pelayanannya sheraton jakarta soekarno hatta,BUMN,Bintang 4,SheratonBandara,positive,Fasilitas Hotel (Kolam/Gym/Spa)
Clara Della-Vecchia,2025,5,Tempat menginap yang luar biasa di Hotel Sheraton sangat banyak terima kasih kepada Mr Amar untuk menjaga setiap detail,BUMN,Bintang 4,SheratonBandara,positive,Pelayanan Staf & Keramahan
Yonatan Rendy,2024,5,Apa pengalaman yang indah Aku tinggal di 17 Terima kasih untuk Steven Rizal dan Niken untuk layanan yang hebat mereka selalu tersenyum dan bertindak baik ditingkatkan ke kamar kamar kamar sebagai anggota elit telah tiba terlambat pukul 8 malam tapi masih mendapat makan malam dan minuman manfaat pekerjaan baik Sheraton akan kembali lagi pasti,BUMN,Bintang 4,SheratonBandara,positive,Pelayanan Staf & Keramahan
GM Sunny,2024,5,Itu adalah tinggal yang menyenangkan secara keseluruhan dari pintu masuk semua staf sangat baik tidak ada ruang tamu klub belum tetapi mereka menyediakan minuman dan makanan masuk malam juga tim hubungan tamu mendukung saya dengan semua yang saya butuhkan saya tidak bisa menunggu untuk tinggal saya berikutnya sekali lagi saya menghargai keramahan Anda yang sangat baik,BUMN,Bintang 4,SheratonBandara,positive,Pelayanan Staf & Keramahan
Susan Cameron-Davies,2025,5,Tempat tidur yang nyaman sarapan buffet makanan dari seluruh dunia untuk memilih dari layanan yang hebat kolam renang dan bar,BUMN,Bintang 4,SheratonBandara,positive,Kualitas Makanan & Restoran
Rendhy Ardian,2025,5,pilihan yang baik untuk tempat pertemuan dan layanan staf sangat bagus menu sarapan dan makan siang juga sangat baik,BUMN,Bintang 4,SheratonBandara,positive,Kualitas Makanan & Restoran
Willy,2024,4,Aku hanya tinggal untuk satu malam tapi itu adalah tinggal yang hebat Aku ingin khusus menyebutkan Pak Rizal Afandi dan timnya untuk menyediakan layanan yang luar biasa selama tinggal saya keramahan hangat sambutan dan memperpanjang layanan untuk membuat tinggal saya jauh lebih nyaman sangat dihargai pilihan sarapan yang baik juga,BUMN,Bintang 4,SheratonBandara,positive,Pelayanan Staf & Keramahan
Rizky Kurniawan,2025,5,wah enak banget beda rasa soalnya di sini walau di bungkus bawa pulang tetap gurih mie nya,BUMN,Bintang 4,SheratonBandara,positive,Kualitas Makanan & Restoran
Hevar Rysta,2024,3,Baru mencoba ruang pertemuan nya saja sama cemilan2nya tidak enak sosis solo tapi isinya wortel sayuran tidak ada daging ayamnya kue nya juga pahit arem2 nya tak beraroma dan tapi jalan ke ruang pertemuan nya jauh banget belum lagi soal parkirannya yang bikin bingung karena tidak ada info parkirnya dmn makan siangnya oke lah meskipun tidak luar biasa banget,BUMN,Bintang 4,SheratonBandara,negative,Kualitas Makanan & Restoran
Johnny Tran,2024,5,Baru-baru ini direnovasi dan dibuka kembali masuk Maret kami memiliki tinggal yang luar biasa dengan sarapan buffet sangat lezat kami memeriksa masuk lewat dan ingin tinggal dekat bandara dan memiliki berenang 8pm masuk kolam renang besar yang dipanaskan tidak bisa mendengar pesawat di atas masuk malam atau di siang hari di dalam tempat tidur dan bantal sangat nyaman dan kami tidur tanpa gangguan bangun penuh energi untuk menghancurkan keluar dua jam masuk hotel gym dan pulih setelah itu ke kolam renang setiap staf begitu menyambut perhatian dan selalu tersenyum memberikan tinggal yang berkesan yang pergi,BUMN,Bintang 4,SheratonBandara,positive,Fasilitas Hotel (Kolam/Gym/Spa)
Alyeska Sunarto,2024,5,Kami terdampar masuk hotel ini karena pembatalan penerbangan tapi semua staf sangat ramah sejak awal perjalanan kami di sana dengan Mr Sigit kepala HRD mengambil kami masuk bandara untuk mendengar keluhan kami dan semua staf TH yang menerima kami dan masuk ruang makan mereka semua sangat disambut terima kasih untuk keramahan Anda kami sangat bersyukur untuk memiliki kesempatan tinggal dengan Anda guys,BUMN,Bintang 4,SheratonBandara,positive,Pelayanan Staf & Keramahan
Kyle Dawson,2024,5,Aku memiliki menginap yang fantastis di sini keramahan yang ditunjukkan oleh staf membuat perjalanan bisnis saya nyaman dan lancar makanan luar biasa dan fasilitas bersih dan mewah hotel ini jauh di atas bandara hotel apa pun yang saya telah mengalami saya sangat merekomendasikan tinggal di sini sepuluh sepuluh,BUMN,Bintang 4,SheratonBandara,positive,Pelayanan Staf & Keramahan
Monique Malone,2024,5,Kami memiliki menginap cepat di sini di jalan kami ke Lombok dan kami sangat baik ditangani oleh jovan dan staf di sini terima kasih banyak untuk layanan asli dan perhatian kamar bersih dan nyaman kolam renang tampak sangat bagus rekomendasi,BUMN,Bintang 4,SheratonBandara,positive,Kebersihan & Kenyamanan Kamar
Jay Kim,2024,5,Sebagai anggota Titania saya dapat membuktikan bahwa Ritz Carlton Pacific Place dan Sheraton Airport adalah yang terbaik di antara semua merek Marriott masuk Jakarta saya terutama berterima kasih Talitha dari resepsi untuk pertolongan baik dan pribadi saya juga mengagumi layanan asli dari staf sementara saya sarapan buffet Kudos untuk tim manajemen saya berharap untuk melihat Anda lagi teman-teman segera,BUMN,Bintang 4,SheratonBandara,positive,Pelayanan Staf & Keramahan
Jessica Clarabella,2024,5,Lokasi hotel terpencil dari kota bersemangat yang membuatnya sempurna untuk liburan atau rileks saya bepergian sendiri dan saya menemukan bahwa mereka mengambil perhatian yang baik di ruang publik terlalu baik cocok untuk bekerja saat Anda sedang berlibur kamarnya super bersih saya suka greeneries yang mengelilingi hotel dan alam terdengar terlalu kehangatan staf dari check masuk sampai keberangkatan saya dari hotel adalah level atas itu benar-benar layak,BUMN,Bintang 4,SheratonBandara,positive,Kebersihan & Kenyamanan Kamar
Inge Larisa,2024,5,saya sangat menikmati menginap dan mengadakan pertemuan di sheraton jakarta soekarno hatta bandara dari tanggal 2 4 juli 2024 dari persiapan pertemuan dukungan dari bapak hendrik simanjuntak sangat baik beliau sangat mendukung untuk memenuhi kebutuhan acara saya saya saya diberikan ruangan terbaik mengingat pentingnya acara saya sampai pada saat saya memeriksa masuk sampai dengan cek ruangan pertemuan kantor depan pak agung priambodo rizqi pangestu tim teknis kamar pic juga turut mendukung memastikan kamar dan ruangan saya sesuai dengan kebutuhan saya takjub juga untuk layanan cucienya dan bersih untuk kehidupan saya juga asik serasa di bali yaa oh ya yang saya kira karena dekat banget dengan landasan,BUMN,Bintang 4,SheratonBandara,positive,Pelayanan Staf & Keramahan
Deny Gustian,2024,5,pertama kali menginap di sini nyaman dan puas banget dengan layanan nya vibes nya merasa di bali banget jadi tidak perlu jauh ke bali biasanya kalau tinggalcation view nya gedung kota kalau dsini view nya danau dan pesawat lewat cakep banget wajib banget sih kesini minimal sekali seumur hidup,BUMN,Bintang 4,SheratonBandara,positive,Pelayanan Staf & Keramahan
roy wellyanto,2025,1,seharus nya hotel kayak gini udah ngga layak disebut hotel bintang 5 sejak jalan di lorong hotel nya sudah bau lembab dan benar kamar nya bukan lembab lagi sampai kasur nya pun terasa berair dari lembabnya tidur disini 3 hari bisa paru2 basah dari lembabnya renovasi donk ini parah banget lho bau nya,BUMN,Bintang 4,SheratonBandara,negative,Kebersihan & Kenyamanan Kamar
rizky salsabillaa,2025,5,Hotel bandara nyaman hehe makanan bagus layanan bagus kamar baik,BUMN,Bintang 4,SheratonBandara,positive,Kebersihan & Kenyamanan Kamar
Prema Somasundram,2024,5,Kami memiliki yang paling menyenangkan n istirahat tinggal di hotel dari 11 sampai 12 Juni hotel itu dengan rapi direnovasi n memiliki perasaan kamar resort sangat nyaman sarapan menyebar besar n nikmat n layanan yang sempurna,BUMN,Bintang 4,SheratonBandara,positive,Kebersihan & Kenyamanan Kamar
Desy Irawanti,2025,5,sangat bagus pelayanan nya bagus semua kamar nya terutama staf nya ramah2 terimakasih kepada semua staf pelayan dan koki jhon dan staf zia muhamad tika surya amanda sidiq farel riska semua baik terimakasih,BUMN,Bintang 4,SheratonBandara,positive,Pelayanan Staf & Keramahan
FC 75,2024,4,Hotel yang bagus 10 menit dari bandara jakarta sangat nyaman untuk tinggal lama karena koneksi penerbangan bagus dan bersih hotel dan kamar sangat baik dan membantu staf tidak ada yang menarik masuk daerah,BUMN,Bintang 4,SheratonBandara,negative,Kebersihan & Kenyamanan Kamar
pipim mbap,2024,1,hotel terburuk di jakarta yang pernah saya datangi pelayanan 0 1 disuruh jemput barang stafnya lama datang padahal saya minta bantu angkatin sampai ke lobi 2 kamarnya bau kucing 3 pesan makanan saya minta staf antarin di kamar nanti saya kasih tip dia bilang tidak bisa padahal hotel lain di jakarta bisa itu loh hotelnya tidak ada lift jadi jalan kaki jauh pokoknya vibesnya mirip rumah sakit harus menunggu pasien lain biar saya bisa di layani,BUMN,Bintang 4,SheratonBandara,negative,Kualitas Makanan & Restoran
Aina Mardhiyah02,2024,5,Hotel yang indah dekat bandara makanan yang baik dan kolam renang yang sangat indah pemandangan sangat menakjubkan staf yang ramah juga terima kasih untuk natania untuk rekomendasi yang baik kopi dan hidangan cinta suasana di warung kopi dan kopi itu benar-benar baik sangat rekomendasi hotel,BUMN,Bintang 4,SheratonBandara,positive,Pelayanan Staf & Keramahan
Siti Kuni Taibah Imam Syafii,2024,5,Hotel layanan terbaik bertemu dengan sangat ceria miss cece selama sarapan dan dia sangat membantu dan memenuhi semua kebutuhan saya ingin datang lagi bagian terbaik pernah untuk tinggal masuk hotel ini adalah selama makan semua masalah terjadi mereka langsung ditangani atau diselesaikan itu terima kasih banyak untuk memberikan layanan yang besar hotel terbaik saya tinggal masuk jakarta sejauh ini terima kasih untuk sheraton hotel,BUMN,Bintang 4,SheratonBandara,positive,Pelayanan Staf & Keramahan
Teguh Budiman,2024,5,Aku tinggal di sana sendirian tapi tempat itu membuatku merasa aman dan nyaman kamar dan makanan itu hebat keramahan itu luar biasa terima kasih juga untuk Thania dan Gabrielle yang melayani saya koktail dan es krim dan juga untuk menyambut hangat ps mungkin band hidup akan menghidupkan kembali hal-hal bahkan lebih,BUMN,Bintang 4,SheratonBandara,positive,Pelayanan Staf & Keramahan
Shina Ratna Yunita,2024,5,Tempat yang indah untuk menginap dan mengadakan pertemuan di saya mengatur pertemuan untuk perusahaan saya masuk hotel ini dan tidak hanya suasana yang baik tetapi juga staf sangat membantu dan ramah mereka kooperatif dan cepat respon terima kasih mas rizqi dan mas agung untuk bantuan yang baik untuk pengalaman pertemuan kami,BUMN,Bintang 4,SheratonBandara,positive,Pelayanan Staf & Keramahan
Finkan Danitasari,2024,5,buat acara kantor di hotel sheraton jakarta soekarno hatta bandara dengan tampilan baru setelah renovasi mulai dari koordinasi pertama kali hingga acara selese di dukungan penuh oleh pak hendri mas rizqi pak agung dan tim yang ramah banget sajian kopi istirahat dan makan siang istimewa sukses selalu,BUMN,Bintang 4,SheratonBandara,positive,Pelayanan Staf & Keramahan
Eugene H.,2025,5,Resor yang bagus untuk menjauh dari kota kehidupan restoran di kolam renang adalah sentuhan yang besar,BUMN,Bintang 4,SheratonBandara,positive,Fasilitas Hotel (Kolam/Gym/Spa)
Yong Ting Lim,2024,5,Upgrade gratis ke suite titanium elit anggota untuk tiga malam tinggal di baru dibuka sejak 8 Maret 2024 sheraton jakarta soekarno hatta bandara diperiksa masuk oleh talitha resepsi rekannya yang sabar dan jelas menginformasikan saya melalui semua fasilitas manfaat dan layanan yang ditawarkan oleh hotel elisa atau elsa rekannya lain membawa saya ke suite dan menunjukkan keluar kontrol ruang layanan gym lokasi dll hotel baru tetapi dengan tim sangat seasoned staf perhotelan mencintai konsep resort perkotaan hotel menyediakan layanan ulang tahun per jam ke bandara ckg yang,BUMN,Bintang 4,SheratonBandara,positive,Pelayanan Staf & Keramahan
Tita H,2024,5,Layanan yang luar biasa terasa seperti kita tidak di Jakarta jadi itu menyegarkan penghormatan menyebutkan Mr fikri mrs Cece dan kolam renang pria yang mengambil waktu untuk benar-benar memiliki percakapan dengan kita teruskan pekerjaan yang baik,BUMN,Bintang 4,SheratonBandara,positive,Pelayanan Staf & Keramahan
Sutisno Sutisno,2024,5,makanannya enak enak saya suka tumis bunga pepaya terutama dikamarnya enak juga nyaman bagus saya sudah sering ke sini pelayanan di restoran sangat bagus ramah baik ada pelayan mba cece terimakasih yaa hotel sheraton,BUMN,Bintang 4,SheratonBandara,positive,Kualitas Makanan & Restoran
amelia rachmatunisa,2024,5,pertama kali bisa undan rapat di hotel sheraton bandara lokasinya strategis dekat bandara sehingga beberapa peserta yang datang dari negara2 lain sangat nyaman tidak terjebak kemacetan jakarta kamarnya nyaman makanannya enak pegawainya ramah spesial pagi ini cece yang kerja dibagikan resto sangat membantu dan ramah bingit pokok sheraton bandara oke deh,BUMN,Bintang 4,SheratonBandara,positive,Kebersihan & Kenyamanan Kamar
Yadi Yasin,2024,5,hotel sheraton ini sekarang kembali masuk dalam grup marriot setelah bbrp tahun diambil oleh manajemen akors dulu sejak tahun 1990 akhir dibawah spg starwood preferred guest dengan nama sheraton bandara dari dulu sering menginap disinindr sejak tahun 20an namun berhenti sejak tidak lagi dalam hotel rantai spg yang sekarang marriot sekarang dengan manajemen marriot hotel baru di renovasi total baru selesai sebagian bulan maret 2024 lalu tapi sudah menerima tamu kamar2 dengan desain interior jadul sudah menjadi modern minimalis kolam juga di renovasi dulu pancuran udara dari patung2 dikolam utama sekarang menjadi kura patung,BUMN,Bintang 4,SheratonBandara,negative,Lokasi & Akses Strategis
Andi Anto Nogo channel,2025,4,menjadi msh andalan hotel transit posisinya strategis,BUMN,Bintang 4,SheratonBandara,positive,Lokasi & Akses Strategis
Muhammad Haq,2024,5,sangat dekat dengan bandara jadi sangat nyaman layanan pelanggan yang sangat baik In fact luar biasa sidiq dan hannah pergi keluar dari jalan untuk menjadi tuan rumah yang luar biasa itu sangat baik disimpan dan memiliki pengiriman gratis setiap jam ke bandara makanan sangat baik di restoran,BUMN,Bintang 4,SheratonBandara,positive,Pelayanan Staf & Keramahan
mae -,2025,5,Semua stafnya memberikan layanan yang terbaik dari penjualannya ibu dewi mas rizqi tim pesta mas ahmad mas eric semua pertemuan saya berjalan lancar,BUMN,Bintang 4,SheratonBandara,positive,Pelayanan Staf & Keramahan
Karina Saraswati,2025,5,Hotelnya cantik anak2 senang sekali bisa menginap di sheraton kolam renangnya jadi favorit anak2 kamarnya besar dan bersih sekali,BUMN,Bintang 4,SheratonBandara,positive,Kebersihan & Kenyamanan Kamar
Pearlyn Chew,2024,5,Selalu sangat baik dijaga oleh tim di Sheraton Jakarta layanan bandara dan keramahan adalah tingkat atas Special teriakan keluar untuk Agung Rizky Hendrik dan tim perjamuan untuk selalu berada di bola,BUMN,Bintang 4,SheratonBandara,positive,Pelayanan Staf & Keramahan
Murat Bayraktar,2025,5,sangat baik dan bersih hotel kebugaran tersedia tapi tidak spa,BUMN,Bintang 4,SheratonBandara,positive,Fasilitas Hotel (Kolam/Gym/Spa)
Milla Agus. S,2024,5,Hotel ini menjadi indah lagi setelah renovasi penuh cinta ruang modern luas kolam renang fantastis dan makanan hebat selamat datang kembali Sheraton bandara senang Anda kembali lagi,BUMN,Bintang 4,SheratonBandara,positive,Fasilitas Hotel (Kolam/Gym/Spa)
Alifa Amandha,2024,5,Tempat terbaik untuk pergi untuk liburan belum tapi tidak jauh dari Jakarta tema resor perkotaan membuat tinggal saya lebih nyaman trek jogging dan sarapan begitu baik pasti akan kembali lagi,BUMN,Bintang 4,SheratonBandara,positive,Kualitas Makanan & Restoran
Zia Siddiqui,2025,5,Aku sangat merekomendasikan tinggal di sini itu adalah properti yang indah aman bersih dan staf pergi di atas dan di luar untuk memastikan Anda ditangani Terima kasih kepada staf di Sheraton ini,BUMN,Bintang 4,SheratonBandara,positive,Pelayanan Staf & Keramahan
Alun Evans,2025,5,selalu pilihan yang bagus dan dekat dengan bandara juga hotel telah bertahan dan menjadi makanan pokok selama bertahun-tahun untuk ekspatriat dan penduduk setempat sama,BUMN,Bintang 4,SheratonBandara,positive,Lokasi & Akses Strategis
Radek Bielinski,2025,5,Kamar menginap yang sangat bagus layanan yang sangat bagus dan bersih lebih dari ramah tersenyum dan mendukung restoran yang sangat baik dengan masakan internasional,BUMN,Bintang 4,SheratonBandara,positive,Kebersihan & Kenyamanan Kamar
Mario Agung,2025,5,Hotel yang sangat bagus meskipun itu sedikit tua karena itu baik dipelihara layanan yang baik dari staf juga,BUMN,Bintang 4,SheratonBandara,positive,Pelayanan Staf & Keramahan
alamnoise putra,2024,5,menginap 1 malam dan menyewa ballroom 1 untuk acara intel x garuda bengkel 27 Agustus 2024 saya sangat membantu oleh layanan hotel di bandara sheraton nyaman lokasi ramah layanan makanan lezat dan sangat cocok untuk pertemuan acara serta bantuan dari mr agung masuk bagian perjamuan juga mr kiki dari hotel event koordinator terima kasih atas bantuan Anda selama acara mr agung dan mr kiki terima kasih melihat Anda pada acara lain,BUMN,Bintang 4,SheratonBandara,positive,Kualitas Makanan & Restoran
Andrew Bauer,2024,5,Properti yang indah dengan pemandangan danau pilihan sarapan Indonesia dan barat yang indah tuan rumah tinggal di sini dengan 3 anak kami untuk transit tapi berharap kita bisa beristirahat di sini selama beberapa hari,BUMN,Bintang 4,SheratonBandara,positive,Kualitas Makanan & Restoran
Judith,2024,5,Sheraton yang sekarang bener2 terbaik apalagi di bawah jw marriott kewreen abiez tak perlu mengambil foto dah karena dijamin pada betah buat tinggal kecuali yang tidak terstruktur dan untuk akses ke area pik ii jg sudah ada lebih cepat n tidak memakai macet,BUMN,Bintang 4,SheratonBandara,positive,Lokasi & Akses Strategis
Harry,2024,5,Tempat terbaik untuk melihat pesawat dari dekat lebih tepatnya langsung dari dalam kamar ini adalah hotel tapi seperti resort suasananya terbaik pemandangan di sekitarnya,BUMN,Bintang 4,SheratonBandara,positive,Lokasi & Akses Strategis
Chepy Bennington,2024,5,hotelnya nyaman banget meskipun lokasinya di jakarta tapi suasanannya merasa lagi liburan di bali untuk kamar dan pelayanannya juga oke banget dengan fasilitas hotel yang lengkap banget 0,BUMN,Bintang 4,SheratonBandara,positive,Lokasi & Akses Strategis
Iwan Sujono,2024,5,Saya dari grup pertemuan pii ruangannya cukup bagus pelayanan sangat baik kemudian servis yang luar biasa sama mba cece makanannya cukup bagus saya suka seafood segar hotelnya bagus mewah terimakasih banyak yaa saya sangat puass lain kali saya mau kesini bersama keluargaa,BUMN,Bintang 4,SheratonBandara,positive,Pelayanan Staf & Keramahan
Irfan Randhawa,2024,5,Josslyn resepsi luar biasa dan Richard Bellman AA melakukan pekerjaan yang luar biasa membersihkan tempat ini luar biasa tangan turun makanan terbaik dan fasilitas 6 bintang,BUMN,Bintang 4,SheratonBandara,positive,Kualitas Makanan & Restoran
Putro Dewanto,2025,5,masakan2 di restonya enak terutama nasi gorengnya baru kali ini ada nasi goreng enak di resto hotel semoga konsisten enaknya,BUMN,Bintang 4,SheratonBandara,positive,Kualitas Makanan & Restoran
Lena daniyati,2024,5,terima kasih sheraton cengkareng untuk pelayanannya seluruh tim sangat kooperatif diajak kerjasama tim bank yang dipimpin masagung priambodo jugaa luar biasa terima kasih semua untuk kerjasamanya yaa,BUMN,Bintang 4,SheratonBandara,positive,Pelayanan Staf & Keramahan
sam hudi,2025,5,Bandara Soekarno Hatta untuk transit pesawat berpfariasi 7 an luar negri atau dalam negri,BUMN,Bintang 4,SheratonBandara,neutral,Harga & Value for Money
Pere Manresa Company,2024,5,sebuah surga di sebelah bandara kami tinggal untuk satu hari lulus dan itu adalah hal terbaik yang bisa kami lakukan semua staf terutama Jlo sangat baik dengan kami,BUMN,Bintang 4,SheratonBandara,positive,Pelayanan Staf & Keramahan
bayu endrasasana,2025,5,pertama kali menginap di sini karena ada rencana transit meski datang larut malam petugas resepsionis mas aria klo tidak salah nama cukup ramah dan cekatan bahkan beliau meng upgrade kamar dengan alasan kami anggota marriott bonvoy kamar luas sebagaimana standar marriott bonvoy grup terdapat buah di kamar fasilitas komplit sayang hanya tinggal sekitar 6 jam saja sehingga tidak sempat menggunakan fasilitas yang ada sangat direkomendasikan untuk daerah sekitar bandara soekarno hatta,BUMN,Bintang 4,SheratonBandara,positive,Pelayanan Staf & Keramahan
Paulus Sugiarto,2024,5,merayakan ulang tahun kantor disini layanan makanannya oke banget terima kasih pak agung pak jaelani tim yang sudah banyak membantu kami selama persiapan ketika acara,BUMN,Bintang 4,SheratonBandara,positive,Kualitas Makanan & Restoran
