User Name,Review Time,Rating,clean_text,Tipe,Kelas,Nama_Hotel,AI_Sentiment,AI_Aspek
Waras Agus Purwanto,2021.0,5,tempatnya bagus nyaman resepsiinya ramah dan cantik buat teteh yang berhijab,BUMN,Bintang 4,JatiluhurValley&Resort,positive,Kebersihan & Kenyamanan Kamar
Bambang 84,2025.0,5,Wah keren dong,BUMN,Bintang 4,JatiluhurValley&Resort,positive,Harga & Value for Money
Junaidi Thabri,2025.0,5,tempat yang bagus untuk kegiatan kluarga dan pertemuan,BUMN,Bintang 4,JatiluhurValley&Resort,positive,Harga & Value for Money
Khariestama Perwirajati,2023.0,5,kamar bersih pelayanan ramah timnya baik suasana dan pemandangan bagus,BUMN,Bintang 4,JatiluhurValley&Resort,positive,Kebersihan & Kenyamanan Kamar
Rishang Asmadi,2018.0,5,Tempat yang cocok untuk pertemuan keluarga karena tempatnya besar juga Anda dapat menikmati malam dengan duduk di kafe dengan pemandangan danau,BUMN,Bintang 4,JatiluhurValley&Resort,positive,Lokasi & Akses Strategis
Imma Nur Faida,2021.0,5,kamarnya nyaman bersih kulkas dan pengering rambut nya berfungsi dengan baik,BUMN,Bintang 4,JatiluhurValley&Resort,positive,Kebersihan & Kenyamanan Kamar
Daimal Fadli,2022.0,4,Pemanasan air mati jadi terasa harga berlebihan untuk 545rb kecuali sarapan huft,BUMN,Bintang 4,JatiluhurValley&Resort,negative,Harga & Value for Money
YEDDY TRISMAYADI,2018.0,4,tempat yang nyaman untuk berlibur untuk acara keluarga kantor dll tersedia pondok pondok yang cukup luas dan harga terjangkau,BUMN,Bintang 4,JatiluhurValley&Resort,positive,Harga & Value for Money
irwin nugroho,2021.0,4,sepi mantap buat bersantai kolam renangnya besar tapi kurang bersih,BUMN,Bintang 4,JatiluhurValley&Resort,positive,Harga & Value for Money
URN. Chenel,2020.0,4,nyaman sih cuma buat kolam renang airnya agak keruh,BUMN,Bintang 4,JatiluhurValley&Resort,positive,Fasilitas Hotel (Kolam/Gym/Spa)
Muhammad Jihad,2022.0,3,harga murah internet lambat kebersihan kamar kurang mungkin karena pandemi kamar lama kosong,BUMN,Bintang 4,JatiluhurValley&Resort,negative,Harga & Value for Money
Batara Siregar,2025.0,5,terlihat alami di sekitar fasilitas penuh dalam dan luar jalan sedikit naik tidak ada pasar di sekitar,BUMN,Bintang 4,JatiluhurValley&Resort,positive,Lokasi & Akses Strategis
Roy A,2023.0,4,Bisa istirahat dengan nyaman disini cuman bantal kurang tipis udara kurang panas sedikit,BUMN,Bintang 4,JatiluhurValley&Resort,positive,Kebersihan & Kenyamanan Kamar
andri risyanto,2024.0,5,Secara keseluruhan semuanya hampir sempurna hanya lokasi saja lumayan jauh dari jalan utama,BUMN,Bintang 4,JatiluhurValley&Resort,positive,Lokasi & Akses Strategis
Herwindra,2024.0,3,Nginap di kemuning 2 air kamar mandi keluar nya kecil air mandi jg tidak keluar,BUMN,Bintang 4,JatiluhurValley&Resort,negative,Kebersihan & Kenyamanan Kamar
BINTER TAGOR,2019.0,3,kamar standar kurang terawat kalau kamar deluxe oke karena baru renovasi,BUMN,Bintang 4,JatiluhurValley&Resort,negative,Harga & Value for Money
Iman Santoso,2022.0,5,Hotel di lingkungan waduk jatiluhur suasana masih dingin nyaman banget oke banget buat menyepi,BUMN,Bintang 4,JatiluhurValley&Resort,positive,Lokasi & Akses Strategis
F Friyanto,2022.0,4,hotelnya bagus areanya tenang karena berada di kawasan jatiluhur harga standar hotel,BUMN,Bintang 4,JatiluhurValley&Resort,positive,Lokasi & Akses Strategis
Biocypress sendi dan saraf,2018.0,5,bendungan yang besar dan luas banyak tmpt yang indah untuk selfie bersama teman pacar keluarga,BUMN,Bintang 4,JatiluhurValley&Resort,positive,Harga & Value for Money
Anonymous 22,2020.0,5,Tempat menginap yang cocok sekali karena dekat dengan spot foto yang bagus,BUMN,Bintang 4,JatiluhurValley&Resort,positive,Lokasi & Akses Strategis
erlangga kelana,2023.0,1,Jalanan menuju kesini hancur Sehancur hancurnya parah banget sumpah bikin rusak mobil,BUMN,Bintang 4,JatiluhurValley&Resort,negative,Harga & Value for Money
Fariz Hafizi,2024.0,5,hotelnya nyaman buat staycation singkat bersama keluarga,BUMN,Bintang 4,JatiluhurValley&Resort,positive,Harga & Value for Money
Bagiarto Agus,2023.0,5,nyaman berlibur keluarga harga terjangkau pemandangan memanjakan mata,BUMN,Bintang 4,JatiluhurValley&Resort,positive,Harga & Value for Money
Runni Nurul Inayah,2020.0,5,cukup bagus untuk acara kantor pertemuan kampus yang ingin mengadakan pelatihan sambil menginap,BUMN,Bintang 4,JatiluhurValley&Resort,positive,Harga & Value for Money
Buana Rullah,2023.0,5,sangat bagus dengan pemandangan yang asri terletak di pinggir danau jatiluhur,BUMN,Bintang 4,JatiluhurValley&Resort,positive,Lokasi & Akses Strategis
Muhammad Dilan,2019.0,3,Hotel nya standar cocok untuk wisata keluarga tapi udara nya agak keruh kurang jernih,BUMN,Bintang 4,JatiluhurValley&Resort,positive,Harga & Value for Money
Arip Dwi Kurniawan,2023.0,4,Sangat bagus dengan segala fasilitasnya kolam renang mantap,BUMN,Bintang 4,JatiluhurValley&Resort,positive,Fasilitas Hotel (Kolam/Gym/Spa)
Afriza Ramdan,2022.0,3,udara disekitar cukup panas dan akses jalan yang lumayan jauh dari pusat kota tapi dekat dengan wisata jatiluhur,BUMN,Bintang 4,JatiluhurValley&Resort,positive,Lokasi & Akses Strategis
nizar muzani,2020.0,4,nyaman buat liburan sayang view waduk nya kurang jelas,BUMN,Bintang 4,JatiluhurValley&Resort,positive,Lokasi & Akses Strategis
afif hadiyanto,2025.0,5,Tempat sangat tenang sangat saat untuk melepas lelah,BUMN,Bintang 4,JatiluhurValley&Resort,positive,Kebersihan & Kenyamanan Kamar
Ecep Jiyaul Rojak,2025.0,5,Kamar bersih dan rapi layanan yang baik luas tempat parkir makanan lezat pemandangan indah,BUMN,Bintang 4,JatiluhurValley&Resort,positive,Kebersihan & Kenyamanan Kamar
Hendra Supriatna,2025.0,4,cocok untuk liburan dengan keluarga,BUMN,Bintang 4,JatiluhurValley&Resort,positive,Harga & Value for Money
Sugeng Irijanto,2022.0,4,nyaman bersih pelayanan cepat dan ramah dekat dengan wisata waduk jatiluhur,BUMN,Bintang 4,JatiluhurValley&Resort,positive,Kebersihan & Kenyamanan Kamar
Faradilla Shiami,2019.0,4,Spot foto bendungan dari sini bisa lihat jalan keluar pagi kemuliaan masuk bayar 20k,BUMN,Bintang 4,JatiluhurValley&Resort,positive,Lokasi & Akses Strategis
Daniel Ferdinand (Botyl),2022.0,1,Anjay air panas nya tidak nyala malah pernah tidak bisa berak karna air mati,BUMN,Bintang 4,JatiluhurValley&Resort,negative,Kebersihan & Kenyamanan Kamar
Herfayanti Efa,2023.0,4,Ngawal anak field trip ke plta jatiluhur tidak nginep melipirr ke toilet nya ajaa,BUMN,Bintang 4,JatiluhurValley&Resort,neutral,Kebersihan & Kenyamanan Kamar
Aldo,2024.0,5,tempat baru bersih aman nyaman udaranya bersih dn asri,BUMN,Bintang 4,JatiluhurValley&Resort,positive,Kebersihan & Kenyamanan Kamar
Dwi Putamayanti,2018.0,5,tempat yang sangat indah dan nyaman u menambah wawasan dan rekreasi bersama keluarga,BUMN,Bintang 4,JatiluhurValley&Resort,positive,Lokasi & Akses Strategis
Lingga Patriana,2021.0,5,kamar bersih fasilitas lengkap pelayanan memuaskan terima kasih,BUMN,Bintang 4,JatiluhurValley&Resort,positive,Kebersihan & Kenyamanan Kamar
Lili Yuliadi,2019.0,4,pilihan yang tepat bila berlibur bersama keluarga besar disini pasti tertampung semua serba lega,BUMN,Bintang 4,JatiluhurValley&Resort,positive,Harga & Value for Money
GARTHINDO channel,2022.0,5,enak tempat nya pinggir danau makanan nya enak harga soso begitu tenang dan nyaman,BUMN,Bintang 4,JatiluhurValley&Resort,positive,Kualitas Makanan & Restoran
Kharismaningtyas,2024.0,5,Masih dalam perbaikan tapi bagus sangat bagus,BUMN,Bintang 4,JatiluhurValley&Resort,positive,Harga & Value for Money
Yelly ambar,2022.0,5,hotel dengan harga standar tapi kualitas oke cocok buat liburan keluarga,BUMN,Bintang 4,JatiluhurValley&Resort,positive,Harga & Value for Money
wilda syampar,2019.0,4,kunjungan ke jatiluhur bisa ke pelabuhan biru dan bendungan jati luhur untuk spot foto yang bagus,BUMN,Bintang 4,JatiluhurValley&Resort,positive,Lokasi & Akses Strategis
Adi Firmansyah,2021.0,4,udara dingin suasana tenang jauh dari kebisingan dekat ke tempat wisata waduk jatiluhur,BUMN,Bintang 4,JatiluhurValley&Resort,positive,Kebersihan & Kenyamanan Kamar
Bunda LiYeshSa,2021.0,5,Hotelnya bersih cocok untuk anak2 dan pemandangannya bagus,BUMN,Bintang 4,JatiluhurValley&Resort,positive,Kebersihan & Kenyamanan Kamar
NinG NininG,2022.0,5,Suasananya menyenangkan area luas kamar bersih dan bagus,BUMN,Bintang 4,JatiluhurValley&Resort,positive,Kebersihan & Kenyamanan Kamar
Anda Asgara,2021.0,1,layanan buruk mandi panas tidak bekerja dengan baik kolam renang kotor anak taman bermain rusak kamar berbukit tidak ada saluran TV anak,BUMN,Bintang 4,JatiluhurValley&Resort,negative,Fasilitas Hotel (Kolam/Gym/Spa)
Budy Hermawan,2018.0,4,suasana nyaman di luar kepenatan kota serta sejarah bendungan di tanah legenda jawa barat,BUMN,Bintang 4,JatiluhurValley&Resort,positive,Kebersihan & Kenyamanan Kamar
HRD RUDIYAN,2024.0,5,pelayanan nya ramah tempatnya luas enak nyaman,BUMN,Bintang 4,JatiluhurValley&Resort,positive,Kebersihan & Kenyamanan Kamar
Dan 'S (Dani),2025.0,5,enak tempatnya,BUMN,Bintang 4,JatiluhurValley&Resort,positive,Kualitas Makanan & Restoran
Minarno Legiman,2022.0,5,Lebih ditingkatkan pelayanannya ac kurang dingin tapi pagi dingin koq,BUMN,Bintang 4,JatiluhurValley&Resort,positive,Infrastruktur (AC/WiFi/Parkir/Air)
Myshop martin,2025.0,4,mantap disini tenang dan keren jogging spedahan tersedia bisa sewa,BUMN,Bintang 4,JatiluhurValley&Resort,positive,Pelayanan Staf & Keramahan
dani_ Ztoo,2020.0,5,Nuansa Baru hotel pasanggrahan jatiluhur bermotif bambu sensasi pedesaan dan villa view yang di dapat pegunungan dan waduk jatiluhur,BUMN,Bintang 4,JatiluhurValley&Resort,positive,Lokasi & Akses Strategis
Supyan Sori,2024.0,4,suasana yang asri adem bikin sekeluarga nyaman,BUMN,Bintang 4,JatiluhurValley&Resort,positive,Kebersihan & Kenyamanan Kamar
Dewi Nong,2022.0,5,hotel nya nyaman aman berikutnya balik nginep lg,BUMN,Bintang 4,JatiluhurValley&Resort,positive,Kebersihan & Kenyamanan Kamar
Andri,2022.0,5,tempat bagus bersih nyaman dan pegawai yang ramah,BUMN,Bintang 4,JatiluhurValley&Resort,positive,Pelayanan Staf & Keramahan
Dwi Jayanti,2022.0,5,Staf yang ramah suasana tenang cukup jauh dari kerumunan tempat yang sempurna untuk beristirahat,BUMN,Bintang 4,JatiluhurValley&Resort,positive,Pelayanan Staf & Keramahan
Engelbertus Adjie Pujo W,2023.0,3,kamar tidak bagus air panas tidak mengalir wifi sangat minggu,BUMN,Bintang 4,JatiluhurValley&Resort,negative,Infrastruktur (AC/WiFi/Parkir/Air)
Trenggono Adhi Wibowo,2021.0,5,lokasi bagus banyak tempat di pinggir danau jatiluhur udara segar banyak pohon rindang,BUMN,Bintang 4,JatiluhurValley&Resort,positive,Lokasi & Akses Strategis
andia rachman,2023.0,5,mantap anak saya suka berenang di kolam renang nya,BUMN,Bintang 4,JatiluhurValley&Resort,positive,Lokasi & Akses Strategis
Aris Widiyawan,2017.0,5,ditambah pemandangan waduk dan bendungan jatiluhur yang melegenda ini tempat terbaik untuk menikmati nya,BUMN,Bintang 4,JatiluhurValley&Resort,positive,Lokasi & Akses Strategis
Anwar Rilaz,2022.0,5,kamar tidur nya oke banget bersih pelayanan nya cepat terima kasih,BUMN,Bintang 4,JatiluhurValley&Resort,positive,Kebersihan & Kenyamanan Kamar
Sofia Najwa,2025.0,5,orang lain,BUMN,Bintang 4,JatiluhurValley&Resort,negative,Harga & Value for Money
ika _Steamy bites,2023.0,5,Pelayanan yang ramah bersih dan asri wajib untuk membawa keluarga kalian ke sini,BUMN,Bintang 4,JatiluhurValley&Resort,positive,Kebersihan & Kenyamanan Kamar
Ruli Hamdani,2023.0,5,Jalan menuju ke Valley Resort rusak macet sedang ada perbaikan,BUMN,Bintang 4,JatiluhurValley&Resort,negative,Lokasi & Akses Strategis
Rohendi Boeng,2024.0,5,Hotel jatiluhur valley resort di tingkatkan biar pengunjungnya bertambah banyak,BUMN,Bintang 4,JatiluhurValley&Resort,neutral,Harga & Value for Money
Ahmad Hidayatullah,2025.0,5,kamar layanan dan lokasi sangat sempurna dan cocok untuk pariwisata pendidikan,BUMN,Bintang 4,JatiluhurValley&Resort,positive,Lokasi & Akses Strategis
Emil B,2020.0,4,hotelnya bagus pelayanan bagus jalan letaknya jauh dari pusat kota,BUMN,Bintang 4,JatiluhurValley&Resort,positive,Lokasi & Akses Strategis
Wahyudin Selud,2019.0,4,Tempat yang nyaman cocok lah untuk liburan keluarga mah,BUMN,Bintang 4,JatiluhurValley&Resort,positive,Harga & Value for Money
David DEVAYANA,2025.0,5,Hotel yang sangat bagus di Bendungan Jatiluhur tujuan liburan lainnya,BUMN,Bintang 4,JatiluhurValley&Resort,positive,Harga & Value for Money
Hendri Ramdhani,2022.0,3,Tolong perbaiki tiket masuk ya kadang suka d tembak oleh penjaga kartis ya,BUMN,Bintang 4,JatiluhurValley&Resort,neutral,Harga & Value for Money
Ferdiansyah Deni,2022.0,4,kebersihan nya bagus rasa makanannya enak2 semuanya,BUMN,Bintang 4,JatiluhurValley&Resort,positive,Kualitas Makanan & Restoran
Sita Ismangil,2024.0,4,Sebenarnya lokasi yang bagus di ketinggian dari Purwakarta jadi tidak terlalu panas,BUMN,Bintang 4,JatiluhurValley&Resort,positive,Kebersihan & Kenyamanan Kamar
Fajar Aulia Rakhman,2022.0,5,kamar bagus bersih dan nyaman sangat dianjurkan untuk menginap,BUMN,Bintang 4,JatiluhurValley&Resort,positive,Kebersihan & Kenyamanan Kamar
Bro Deni,2023.0,5,nyaman resort nya sarapan nya juga oke,BUMN,Bintang 4,JatiluhurValley&Resort,positive,Kualitas Makanan & Restoran
Riffan Alfarizie,2022.0,4,Jalan menuju hotel rusak parah tapi hotelnya enak,BUMN,Bintang 4,JatiluhurValley&Resort,positive,Lokasi & Akses Strategis
Putu Suparliana Dewi,2024.0,5,nyaman bersih pelayanan ramah dan sigap,BUMN,Bintang 4,JatiluhurValley&Resort,positive,Pelayanan Staf & Keramahan
imelda adi kristanti,2021.0,5,tempatnya nyaman kamarnya bersih resepsionisnya ramah,BUMN,Bintang 4,JatiluhurValley&Resort,positive,Kebersihan & Kenyamanan Kamar
Muhamad Fauzi,2020.0,3,lumayan bagus tempatnya hening bebas mengemudi bising kendaraan,BUMN,Bintang 4,JatiluhurValley&Resort,positive,Kebersihan & Kenyamanan Kamar
Sartika Handayani,2023.0,4,Semuanya baik-baik saja tapi ada sedikit kurang untuk pelayanan,BUMN,Bintang 4,JatiluhurValley&Resort,negative,Harga & Value for Money
Parlin Yohannes,2018.0,4,kebersihan lumayan peralatan dan kelengkapan dah bayak y rusak,BUMN,Bintang 4,JatiluhurValley&Resort,positive,Harga & Value for Money
Suapri A. Rahman,2022.0,3,lumayan tergantung menu sarapannya terbatas,BUMN,Bintang 4,JatiluhurValley&Resort,positive,Kualitas Makanan & Restoran
A Hakim Nur Musthofa,2024.0,4,tempatnya sangat nyaman jauh dari keramaian,BUMN,Bintang 4,JatiluhurValley&Resort,positive,Harga & Value for Money
Ahmad Bunyamin,2020.0,5,Hotel ini akan dibuka kembali bulan juni berubah manajer di bawah mgm horison hotel,BUMN,Bintang 4,JatiluhurValley&Resort,neutral,Harga & Value for Money
duddy,2022.0,3,Jalanan menuju sini parah rusaknya hotel sudah bagus,BUMN,Bintang 4,JatiluhurValley&Resort,negative,Lokasi & Akses Strategis
Diah R (Desybebeq),2022.0,5,cukup bersih resepsionis ramah dan informatif sunyi dan menenangkan,BUMN,Bintang 4,JatiluhurValley&Resort,positive,Pelayanan Staf & Keramahan
Veyra Wati,2025.0,5,Sangat nyaman pelayanan nya sopan,BUMN,Bintang 4,JatiluhurValley&Resort,positive,Kebersihan & Kenyamanan Kamar
Nayafabira Channel,2018.0,5,penginapan keluarga yang nyaman dan fasilitas taman air yang bagus di jatiluhur,BUMN,Bintang 4,JatiluhurValley&Resort,positive,Kebersihan & Kenyamanan Kamar
agus tyan,2017.0,5,selain suasananya enak banyak pohon dan cocok buat mencari inspirasi,BUMN,Bintang 4,JatiluhurValley&Resort,positive,Lokasi & Akses Strategis
Rendy Apriyandi ST,2021.0,5,sangat bagus rapi dan enak untuk liburan keluarga,BUMN,Bintang 4,JatiluhurValley&Resort,positive,Kebersihan & Kenyamanan Kamar
Mia Mustika,2022.0,3,mandi di kamar mandi udara nya tidak panas,BUMN,Bintang 4,JatiluhurValley&Resort,positive,Kebersihan & Kenyamanan Kamar
My “tripistock.” Tripinesia,2024.0,4,Andaikan tidak ada rel turunan berbahan besi,BUMN,Bintang 4,JatiluhurValley&Resort,neutral,Infrastruktur (AC/WiFi/Parkir/Air)
Lutfi Hidayat,2022.0,5,tempat nya enak cuman jauh dari warung roko,BUMN,Bintang 4,JatiluhurValley&Resort,positive,Kualitas Makanan & Restoran
M Dzulfikar Arifi,2022.0,5,harga terjangkau namun kualitas kamar cukup nyaman,BUMN,Bintang 4,JatiluhurValley&Resort,positive,Kebersihan & Kenyamanan Kamar
Irfa Azizi,2025.0,5,nyaman cocok untuk liburan keluarga,BUMN,Bintang 4,JatiluhurValley&Resort,positive,Harga & Value for Money
Fadly Faiq,2025.0,5,tempatnya nyaman tenang wenaktenandah,BUMN,Bintang 4,JatiluhurValley&Resort,positive,Kebersihan & Kenyamanan Kamar
Langga Pratama,2023.0,4,lokasi yang unik karena berada di kompleks waduk jatiluhur yang terpadu,BUMN,Bintang 4,JatiluhurValley&Resort,positive,Lokasi & Akses Strategis
Hendra Zulhijah,2025.0,5,layanan tempat liburan luar biasa dan akomodasi sangat baik,BUMN,Bintang 4,JatiluhurValley&Resort,positive,Pelayanan Staf & Keramahan
Taufiqur Rachman,2022.0,5,suasana syahdu sayang menu sarapannya kurang,BUMN,Bintang 4,JatiluhurValley&Resort,positive,Kualitas Makanan & Restoran
yusuf bumn,2023.0,5,sejuk kamar bersih dan view nya bagus,BUMN,Bintang 4,JatiluhurValley&Resort,positive,Kebersihan & Kenyamanan Kamar
Muhamad Sodikin,2021.0,5,nyaman desain luar tradisional dalamnya modern,BUMN,Bintang 4,JatiluhurValley&Resort,positive,Kebersihan & Kenyamanan Kamar
Budi Gunawan,2018.0,5,Tempat Wisuda Istriku Kampus Kau Dari Khez Muttaqien Tempat Menunggu Buat Keluarga luas,BUMN,Bintang 4,JatiluhurValley&Resort,neutral,Lokasi & Akses Strategis
Nishkala Wijaya,2025.0,3,hotel dan resort di dekat danau bendungan jatiluhur,BUMN,Bintang 4,JatiluhurValley&Resort,positive,Lokasi & Akses Strategis
duddy dhye,2022.0,3,menu makan kurang kota kamar sih oke,BUMN,Bintang 4,JatiluhurValley&Resort,positive,Kualitas Makanan & Restoran
amin k santoso,2023.0,4,jauh dari Jakarta tapi setelah tinggal masuk resort merasa lebih baik dan segar tenang,BUMN,Bintang 4,JatiluhurValley&Resort,positive,Harga & Value for Money
Ferry Budi,2024.0,5,Tempat yang sejuk dan cukup nyaman kamarnya,BUMN,Bintang 4,JatiluhurValley&Resort,positive,Kebersihan & Kenyamanan Kamar
Ijus Gurawan,2022.0,5,nyaman tenang pokoknya uenak tenan,BUMN,Bintang 4,JatiluhurValley&Resort,positive,Harga & Value for Money
Sonny Faizal (The Football's Lover),2022.0,5,tempatnya tenang bersih dan pegawainya ramah tamah,BUMN,Bintang 4,JatiluhurValley&Resort,positive,Pelayanan Staf & Keramahan
가리 스,2022.0,5,pelayanan yang sangat ramah dan kamar hotel yang juga sangat bagus,BUMN,Bintang 4,JatiluhurValley&Resort,positive,Pelayanan Staf & Keramahan
Bizka Biska,2022.0,5,bagus layanannya kolam renang juga infinity pool,BUMN,Bintang 4,JatiluhurValley&Resort,positive,Fasilitas Hotel (Kolam/Gym/Spa)
Hendro Yuli Purwanto,2025.0,5,Tempat yang luar biasa pagi kemuliaan selalu menjadi momen yang menarik,BUMN,Bintang 4,JatiluhurValley&Resort,positive,Harga & Value for Money
Dede S Ardianti,2024.0,2,sangat di sayangkan tidak ada fo yang menunggu,BUMN,Bintang 4,JatiluhurValley&Resort,positive,Harga & Value for Money
Dwi Adi Basuki,2017.0,3,Hotel biasa agak jadul kamarnya luas,BUMN,Bintang 4,JatiluhurValley&Resort,positive,Harga & Value for Money
Rain Day,2022.0,1,pemasanan traveloka hanya bisa pakai visa cc,BUMN,Bintang 4,JatiluhurValley&Resort,neutral,Harga & Value for Money
Exkuwin Suharyanto,2020.0,5,selain untuk tempat istirahat juga banyak tersedia tempat wisata udara danau,BUMN,Bintang 4,JatiluhurValley&Resort,positive,Infrastruktur (AC/WiFi/Parkir/Air)
Suheri,2023.0,5,pemandangannya bagus bukit2 di samping waduk jatiluhur,BUMN,Bintang 4,JatiluhurValley&Resort,positive,Lokasi & Akses Strategis
yusuf priatna,2020.0,4,kamarnya bersih dekat dengan wisata waduk jatiluhur,BUMN,Bintang 4,JatiluhurValley&Resort,positive,Kebersihan & Kenyamanan Kamar
Tan Tina72,2018.0,4,pemandangannya bagus apalgi menjelang sore romantis,BUMN,Bintang 4,JatiluhurValley&Resort,positive,Lokasi & Akses Strategis
Hari Bedjoy Damono,2019.0,4,lumayan buat mengasingkan diri dari kepenatan kota metropolitan,BUMN,Bintang 4,JatiluhurValley&Resort,positive,Lokasi & Akses Strategis
Imam Sucipto,2022.0,5,nyaman dan lengkap fasilitas kamarnya,BUMN,Bintang 4,JatiluhurValley&Resort,positive,Kebersihan & Kenyamanan Kamar
Alrizqie channel,2021.0,5,nyaman tenang murah tapi g murahan,BUMN,Bintang 4,JatiluhurValley&Resort,positive,Harga & Value for Money
Ghaisani Raqilla,2025.0,5,Alhamdulillah semua masuk bagus semuanya,BUMN,Bintang 4,JatiluhurValley&Resort,positive,Harga & Value for Money
Cory Efritha,2018.0,5,hotel dan resort yang terletak dekat dengan plta waduk jatiluhur di purwakarta,BUMN,Bintang 4,JatiluhurValley&Resort,positive,Lokasi & Akses Strategis
Teuku Darmawan,2021.0,3,untuk hotel view nya bukan danau resortnya ya,BUMN,Bintang 4,JatiluhurValley&Resort,negative,Fasilitas Hotel (Kolam/Gym/Spa)
Hari Janti,2025.0,5,Kamarnya bagus.,BUMN,Bintang 4,JatiluhurValley&Resort,positive,Kebersihan & Kenyamanan Kamar
Perdi Ajah,2023.0,4,tempat nyaman view langsung ke waduk,BUMN,Bintang 4,JatiluhurValley&Resort,positive,Kebersihan & Kenyamanan Kamar
Jaenal Arifin,2025.0,5,Susana nya tenang,BUMN,Bintang 4,JatiluhurValley&Resort,positive,Harga & Value for Money
Agung Adhitia Pratama,2024.0,5,Cukup puas dengan segala fasilitas yang ada,BUMN,Bintang 4,JatiluhurValley&Resort,positive,Harga & Value for Money
Rhesadi Adventure,2022.0,4,Hotel 2 tahun masih terlihat bagus tapi masih perlu perbaikan,BUMN,Bintang 4,JatiluhurValley&Resort,positive,Harga & Value for Money
steve arvianus,2024.0,5,akomodasi yang direkomendasikan untuk berlibur singkat dari ibu kota,BUMN,Bintang 4,JatiluhurValley&Resort,positive,Harga & Value for Money
mehdi bazargan,2022.0,2,Hotel bangunan tua view untuk kamar terkesan tertutup dan gelap,BUMN,Bintang 4,JatiluhurValley&Resort,positive,Harga & Value for Money
HUSEN ASHARIE chanel,2022.0,5,bikin betah mudah bisa liburan ksana lagy,BUMN,Bintang 4,JatiluhurValley&Resort,positive,Harga & Value for Money
Andrie Wisnu,2021.0,5,Hotel harga layak pemandangan danau bersih cuaca bagus,BUMN,Bintang 4,JatiluhurValley&Resort,positive,Harga & Value for Money
jan her,2025.0,5,Berundur buat yang mencari ketenangan,BUMN,Bintang 4,JatiluhurValley&Resort,negative,Harga & Value for Money
Arief Mochamad,2023.0,4,Mau menikmati matahari terbenam di Jatiluhur tinggal di tempat ini saja,BUMN,Bintang 4,JatiluhurValley&Resort,positive,Lokasi & Akses Strategis
Ditya channel,2021.0,5,tempat yang cocok buat menyegarkan untuk keluarga,BUMN,Bintang 4,JatiluhurValley&Resort,positive,Harga & Value for Money
Singgih AS,2023.0,5,Tidak terlalu buruk hanya harhamya agak mahal,BUMN,Bintang 4,JatiluhurValley&Resort,positive,Harga & Value for Money
Ian Ys,2020.0,5,tempatnya nyaman n harganya terjangkau,BUMN,Bintang 4,JatiluhurValley&Resort,positive,Harga & Value for Money
arif Sofyan,2019.0,1,Kalau banyak tau hrga per malm ny brpa ya,BUMN,Bintang 4,JatiluhurValley&Resort,neutral,Harga & Value for Money
Dendi Lazuardi,2025.0,4,tempat nyaman kamar bagus,BUMN,Bintang 4,JatiluhurValley&Resort,positive,Kebersihan & Kenyamanan Kamar
Sigit 70,2022.0,4,akses ke lantai atas kurang begitu baik jadi muter2,BUMN,Bintang 4,JatiluhurValley&Resort,negative,Harga & Value for Money
ibun fattah,2020.0,3,hotel bintang tiga harga bintang 4 fasilitas seadanya,BUMN,Bintang 4,JatiluhurValley&Resort,negative,Harga & Value for Money
Faisal Yunizar Choir,2020.0,4,terlihat bagus sekali dengan pemandangan yang bagus dekat bendungan jatiluhur,BUMN,Bintang 4,JatiluhurValley&Resort,positive,Lokasi & Akses Strategis
Dody Wijaya,2023.0,5,airnya bening ramah pelayanan nya,BUMN,Bintang 4,JatiluhurValley&Resort,positive,Kebersihan & Kenyamanan Kamar
Rahandra Pramono,2022.0,5,tetap terjaga kebersihannya hotel trbaik di jatiluhur,BUMN,Bintang 4,JatiluhurValley&Resort,positive,Kebersihan & Kenyamanan Kamar
azier nobee,2020.0,5,nyaman makanan nya enak,BUMN,Bintang 4,JatiluhurValley&Resort,positive,Kebersihan & Kenyamanan Kamar
Hendrawan Yahya,2020.0,3,sayang di kamar saya banyak nyamuk nya,BUMN,Bintang 4,JatiluhurValley&Resort,negative,Harga & Value for Money
sis moyo,2024.0,5,mantap bersih ramah,BUMN,Bintang 4,JatiluhurValley&Resort,positive,Kebersihan & Kenyamanan Kamar
Asep Sunarya,2024.0,5,mantap adem jauh dari kata bising,BUMN,Bintang 4,JatiluhurValley&Resort,positive,Harga & Value for Money
gie gie,2020.0,4,Bagus buat santai menikmati danau Jatiluhur,BUMN,Bintang 4,JatiluhurValley&Resort,positive,Lokasi & Akses Strategis
Rizka Rizlia (Oiz),2023.0,5,tempatnya nyaman banget stafnya ramah,BUMN,Bintang 4,JatiluhurValley&Resort,positive,Pelayanan Staf & Keramahan
Edi Pramono,2024.0,3,tempatnya semakin enak,BUMN,Bintang 4,JatiluhurValley&Resort,positive,Kualitas Makanan & Restoran
yurji 69,2022.0,4,Anak yang baik bisa berenang,BUMN,Bintang 4,JatiluhurValley&Resort,positive,Harga & Value for Money
Rangga Aryo,2019.0,5,nyaman dan nyaman dengan suasana perbukitan,BUMN,Bintang 4,JatiluhurValley&Resort,positive,Kebersihan & Kenyamanan Kamar
Aries “Bosporus” Nur,2023.0,5,Mantab lah buat liburan keluarga,BUMN,Bintang 4,JatiluhurValley&Resort,positive,Harga & Value for Money
Gre3ce M.L,2024.0,5,Wow baru jg nih di sini keren,BUMN,Bintang 4,JatiluhurValley&Resort,positive,Harga & Value for Money
kamaluddin setiamedika,2018.0,3,Menikmati suasana yang tenang baik untuk beristirahat dan beristirahat,BUMN,Bintang 4,JatiluhurValley&Resort,positive,Harga & Value for Money
Budi Setiawan,2023.0,5,hotel di lingkungan jatiluhur yang penuh pesona alam nan indah,BUMN,Bintang 4,JatiluhurValley&Resort,positive,Lokasi & Akses Strategis
Asonic Print,2023.0,5,tempat penyembuhan yang asyik bersama keluarga,BUMN,Bintang 4,JatiluhurValley&Resort,positive,Harga & Value for Money
Alif Algifari,2019.0,4,Penataan wilayah di pinggir waduknya kurang baik,BUMN,Bintang 4,JatiluhurValley&Resort,negative,Harga & Value for Money
Suwarno Ibnu Mustari,2018.0,3,view bagus fasilitas kamar kurang,BUMN,Bintang 4,JatiluhurValley&Resort,positive,Harga & Value for Money
Didik Kurniawan,2025.0,5,seru,BUMN,Bintang 4,JatiluhurValley&Resort,negative,Kualitas Makanan & Restoran
Dedi Irawan,2021.0,5,View nya bagus bikin betah,BUMN,Bintang 4,JatiluhurValley&Resort,positive,Lokasi & Akses Strategis
