User Name,Review Time,Rating,clean_text,Tipe,Kelas,Nama_Hotel,AI_Sentiment,AI_Aspek
Peter Reinhardt,2025,5,ini adalah pilihan yang sangat baik untuk sebuah hotel bandara kami memesan melalui expedia dan bertukar beberapa pesan untuk mengatur transportasi bandara gratis mereka titik pengambilan adalah berjalan kaki dari kedatangan internasional tetapi seorang sopir tersenyum dengan mudah menemukan kita ketika kita tiba setelah tengah malam staf super ramah dan membantu dan itu sangat baik bahwa tidak ada yang mengharapkan tip sarapan memiliki banyak pilihan enak dan kami memiliki makan malam yang bagus sederhana di sana juga kamar-kamar yang dilengkapi dengan jubah tetapi kecil untuk sebuah hotel dari kelas ini,BUMN,Bintang 4,SheratonBandara,positive,Pelayanan Staf & Keramahan
Wawan Soerachman,2025,5,Layanan yang sempurna dari tim hotel anggota dari manajemen ke layanan kolam renang staf restoran yang bagus terlihat hotel dengan resort perasaan untuk itu pilihan sarapan banyak gratis ulang-alik ke bandara cgk adalah akses tambahan ruang tamu untuk anggota elit titanium baik meskipun gratis bir dan anggur akan menjadi tambahan yang bagus untuk ruang tamu manfaat garis dengan hotel Sheraton lainnya ruang tamu masuk jakarta kami memiliki tinggal yang hebat terima kasih,BUMN,Bintang 4,SheratonBandara,positive,Fasilitas Hotel (Kolam/Gym/Spa)
Veer Bharwani,2025,5,pergi untuk pernikahan di sini dan tinggal 2 malam itu luar biasa benar-benar luas dan memberikan getaran nyaman besar sarapan luar biasa dan kafe masuk lobi memiliki layanan yang besar kamar-kamar itu benar-benar besar bersih dan bagus pasti layak 5 bintang dan saya sangat merekomendasikan untuk siapa pun memeriksa masuk dekat bandara internasional jakarta,BUMN,Bintang 4,SheratonBandara,positive,Kebersihan & Kenyamanan Kamar
Mia Novita sari,2025,5,Saya tinggal di Sheraton Airport pada bulan Juli 15 16 dan memiliki pengalaman yang benar-benar menyenangkan Triana dari tim pemesanan sangat membantu ramah dan responsif saya memesan tinggal untuk kesempatan khusus dan semuanya diatur dengan indah semua staf hotel hangat dan ramah yang membuat saya merasa sangat nyaman sepanjang masa tinggal hotel memiliki suasana yang damai dan menenangkan sempurna untuk siapa pun mencari istirahat yang tenang dan santai layanan benar-benar sangat baik saya tidak menemukan masalah kecil ketika mencoba untuk terhubung ke Netflix di TV pesan muncul meminta saya untuk menghubungi staf hotel namun i,BUMN,Bintang 4,SheratonBandara,positive,Pelayanan Staf & Keramahan
Mohd Yusrizal Izri Bin Mohd Yusoff,2025,5,Aku menghabiskan seminggu di tempat ini dan menemukan suasana yang sangat menyenangkan tim sarapan termasuk caca Nazwa dan Aniza memberikan layanan yang sangat baik untuk makan malam saya memilih untuk lebih restoran dan ingin mengucapkan terima kasih saya untuk simar untuk layanan yang luar biasa hotel ini juga memiliki kebun binatang mini dan kolam renang yang indah,BUMN,Bintang 4,SheratonBandara,positive,Fasilitas Hotel (Kolam/Gym/Spa)
Salsa Mesya,2025,5,Alhamdulillah pengalaman saya di Sheraton Jakarta Soekarno Hatta Airport Hotel benar-benar luar biasa saya memiliki kesenangan untuk dirawat dengan rejuvenating spa pijat oleh terapis yang sangat terampil dan ramah Wiji profesionalisme dan keahliannya jelas masuk setiap stroke dan teknik meninggalkan saya merasa sangat santai dan segar Wiji senyum hangat dan layanan yang penuh perhatian membuat saya merasa nyaman dan saya benar-benar menikmati waktu saya di spa Jazakumullah khairan Wiji untuk perawatan yang luar biasa dedikasi Anda untuk kerajinan Anda benar-benar dihargai insha,BUMN,Bintang 4,SheratonBandara,positive,Pelayanan Staf & Keramahan
Syahrial Lubis,2025,4,kamar cgk adalah luas bersih dan modern dihiasi dan direnovasi area publik hotel termasuk lobi restoran juga telah direnovasi untuk merasa lebih modern hanya koridor yang mengarah ke kamar masih memiliki bahwa 90s merasa hotel awalnya dibuka sebagai sheraton bandara kembali masuk 90 awal 20s meskipun ini adalah sebuah hotel bandara tetapi rasanya seperti tinggal masuk sebuah resor karena desain adalah rendah tinggi dan terdiri dari sekelompok bangunan menghadap danau buatan cinta untuk tinggal di sana lagi jika kita memiliki,BUMN,Bintang 4,SheratonBandara,positive,Kebersihan & Kenyamanan Kamar
Arif Maulana,2025,5,lokasi sangat membantu buat yang baru pendaratan ke cgk mau transit ke bandara lain ada gratis shuttle bus dijemput dari bandara ke hotel kamar bersih nyaman bereakfast menu juga lengkap layanan keseluruhan ramah dan membantu mungkin kedepan ya bisa banyak lagi promo ya buat anggota marriot bonvoi,BUMN,Bintang 4,SheratonBandara,positive,Kebersihan & Kenyamanan Kamar
Noura,2025,2,Kami tiba lebih awal dan meminta cek awal masuk staf mengatakan mereka akan mempersiapkan kamar lain karena kamar kita yang dipesan tidak siap dan meminta kami untuk menunggu di kolam renang kami menunggu untuk waktu yang lama tanpa pembaruan kami berakhir makan di restoran dan hanya ketika staf memanggil resepsi kami menemukan keluar kamar alternatif sudah siap tapi tidak ada yang memberi tahu kami masuk akhir kamar awal hanya satu jam lebih awal dari kita cek sebenarnya masuk kamar memiliki ventilasi yang buruk AC terlalu dingin dan mematikan membuatnya membuat kamar terlalu panas untuk tidur pilihan sarapan rata-rata hal terbaik tentang hotel adalah dekatnya,BUMN,Bintang 4,SheratonBandara,negative,Fasilitas Hotel (Kolam/Gym/Spa)
John Ricardo,2025,5,Saya dan istri saya sengaja berlibur masuk Indonesia dan tinggal di Sheraton Airport Hotel untuk mengambil istirahat singkat untuk mengembalikan energi kami ternyata keluar bahwa Sheraton Airport Hotel luar biasa itu memberikan kenyamanan dan resepsionis sangat ramah fasilitas lengkap dan ternyata keluar ada spa juga dan saya berhenti di Anathaya spa disambut oleh resepsionis spa dan diberikan menu spa saya mengambil 60 menit tradisional perawatan pijat pijat yang sangat cocok untuk tubuh saya yang lelah dan sangat rinci ketika pijat tubuh teknik pijat yang baik dan saya pijat,BUMN,Bintang 4,SheratonBandara,positive,Fasilitas Hotel (Kolam/Gym/Spa)
soroush salmani,2025,5,suka dua hari kami tinggal di hotel ini sarapan adalah tingkat berikutnya dan staf adalah super baik dan profesional khusus terima kasih kepada Kevin yang sangat merawat kami kami suka tinggal kami dan Anda pasti alasan di baliknya sangat merekomendasikan tempat ini jika Anda ingin tempat yang bagus dekat bandara,BUMN,Bintang 4,SheratonBandara,positive,Pelayanan Staf & Keramahan
Leony Kartika,2025,5,Kami dan keluarga kami tinggal satu malam dan itu benar-benar pengalaman yang menyenangkan kami disambut oleh layanan ramah kamar hotel adalah luas dan bersih restoran menawarkan menu lengkap dari Asia ke Barat semua yang segar siap fasilitas pendukung lengkap dan bersih termasuk gym taman bermain sebuah kebun binatang mini dan kolam renang anak sangat memuaskan,BUMN,Bintang 4,SheratonBandara,positive,Kebersihan & Kenyamanan Kamar
Freya Sophia,2025,5,Saya baru-baru ini tinggal di Sheraton Jakarta Soekarno Hatta Airport Hotel dan memiliki pengalaman yang luar biasa fasilitas hotel adalah top-notch terutama Anathaya spa yang menawarkan perawatan pijat yang luar biasa terampil dan membuat saya merasa benar-benar santai area spa bersih tenang dan sangat nyaman restoran hotel juga mengesankan saya dengan makanan lezat dan menu luas pilihan saya sangat menikmati berbagai hidangan yang tersedia secara keseluruhan saya sangat merekomendasikan Sheraton Jakarta Soekarno Hatta Airport Hotel untuk layanan yang sangat baik nyaman dan pengalaman spa fantastis saya akan tinggal,BUMN,Bintang 4,SheratonBandara,positive,Fasilitas Hotel (Kolam/Gym/Spa)
Murad Samaren,2025,4,Saya suka hotel ini namun lokasi tidak baik kecuali untuk bandara dekat kamar bersih rapi staf yang membantu menghormati dan selalu tersenyum khusus terima kasih resepsionis Theo sangat membantu dan membantu saya masuk memahami traveloka pembayaran makanan sarapan adalah menakjubkan tradisional dan internasional makanan ada dengan tinggi sheraton standar ikan di luar dekat air mancur adalah menyenangkan terutama jika Anda memiliki anak-anak namun saya tidak bisa menemukan aktivitas di luar hotel masuk area bahkan warung kopi yang layak tidak di sekitar saya akan pergi ke Jakarta tengah untuk berbagai kegiatan,BUMN,Bintang 4,SheratonBandara,positive,Pelayanan Staf & Keramahan
Kim아영,2025,1,Jangan pernah menggunakan handuk di hotel ini setelah mandi handuk berubah hitam hanya dari mengering tubuh saya itu bau persis seperti mop kotor noda dan tampilan kotor secara keseluruhan membuat jelas bahwa handuk ini telah digunakan untuk membersihkan sebelum diberikan kepada tamu lain disebut handuk bersih bahkan memiliki nyamuk mati terjebak masuk itu benar-benar menjijikkan handuk di sini tidak aman atau higienis jika Anda tinggal di hotel ini membawa handuk Anda sendiri atau Anda akan menyesalinya,BUMN,Bintang 4,SheratonBandara,negative,Kebersihan & Kenyamanan Kamar
Slavko Kocijancic,2025,4,Kami telah memilih hotel ini sejak ada protes masuk Jakarta pusat dan hotel ini dekat bandara jika tidak lokasi tidak bahwa insulasi suara yang baik masuk kamarnya lemah jadi keras karena pesawat masuk jarak berjalan kaki kurang dari 30 menit hanya beberapa restoran tidak matkets kursi di teras tidak fasilitas kamar bersih rata-rata saya tidak akan mengatakan itu 5 bintang hotel kolam renang adalah bagus staf ramah dan pekerjaan dilakukan cukup sarapan baik tapi tidak luar biasa,BUMN,Bintang 4,SheratonBandara,positive,Kebersihan & Kenyamanan Kamar
Yosra Hijazy,2025,3,Kami pikir hotel berada di dalam bandara tapi sebenarnya 15 menit jauhnya sarapan baik dan kamar-kamarnya bagus tapi kamar pertama tidak memiliki balkon atau jendela dan merasa sangat lemes kami membayar ekstra untuk mengganti kamar tapi kamar baru tepat di lorong tanpa privasi tata letak membutuhkan berjalan panjang ke resepsi secara keseluruhan saya tidak menikmati menginap saya dan tidak akan merekomendasikan hotel ini,BUMN,Bintang 4,SheratonBandara,negative,Lokasi & Akses Strategis
Chuleeporn Dechakaisaya,2025,1,Saya menulis untuk mengungkapkan kekecewaan saya tentang tinggal saya baru-baru ini setelah kembali dari penerbangan panjang saya menemukan bahwa mandi saluran masuk kamar saya tidak berfungsi yang menyebabkan banjir air yang signifikan yang bocor ke ruang tidur utama situasi ini sangat mengganggu dan mengharuskan saya untuk meminta perubahan kamar lewat malam meskipun kamar itu segera berubah saya terkejut bahwa tidak ada layanan pemulihan atau bantuan yang ditawarkan untuk mengkompensasi ketidaknyamanan yang signifikan pengalaman membuat apa yang seharusnya menjadi malam yang tenang sangat melelahkan satu,BUMN,Bintang 4,SheratonBandara,negative,Kebersihan & Kenyamanan Kamar
Giorgio Saluto Girsang,2025,3,Kamarnya bagus 5 bintang layanan bagus 5 bintang satu-satunya masalah adalah pada makan malam kedua bagel memiliki mentah lembu lembu lembu potongan yang biasanya Anda tidak akan masuk sandwich itu harus diminum atau lembu mentah lembu lembu lembu lembu lembu lembu lembu lembu lembu lembu lembu lembu lembu lembu lembu lembu lembu lembu lembu lembu lembu lembu lembu lembu lembu lembu lembu lembu lembu lembu lembu lembu lembu lembu lembu lembu lembu lembu lembu lembu lembu lem,BUMN,Bintang 4,SheratonBandara,positive,Kualitas Makanan & Restoran
Amr Al-Kabr,2025,3,kamar besar meskipun terlihat cukup usang dari luar sampah layanan untuk sheraton terutama ketika memesan gratis bandara ulang-alik yang layak tetapi luas menyebar sarapan lebih baik masuk hotel lain masuk jakarta saya pribadi tidak akan pernah tinggal masuk hotel ini karena layanan namun saya berharap bahwa semua dapat ditingkatkan itu dapat dicatat bahwa resepsionis yang menangani bandara transfer pemesanan terlihat sangat sangat kabur ketika saya bertanya tentang pemesanan bandara transfer saya berharap hotel melakukan layanan yang lebih baik untuk tidak mencemari nama sheraton dan perhotelan indonesia,BUMN,Bintang 4,SheratonBandara,negative,Kebersihan & Kenyamanan Kamar
pika cuuu,2025,5,Beberapa hari lalu saya baru berlibur bersama suami dan menginap dihotel sherathon bandara disambut oleh pelayanan yang baik apa lagi resepsionisnya sangat ramah sekali nuansa hotelnya juga nyaman dan tidak lupa selalu mampir ke annathaya spa buat pijat yang bagus ditangani oleh profesional pijat sehingga membuat badan jadi santai kembali sangat saya rekomendasikan temen2 yang menginap disini buat mampir ke pijat nya,BUMN,Bintang 4,SheratonBandara,positive,Pelayanan Staf & Keramahan
Anthony Larkin,2025,5,Kami memiliki malam yang luar biasa di sini pesawat ulang-alik bandara adalah sempurna dan sopirnya sabar dan baik meskipun penerbangan kami sedikit tertunda sarapan adalah luar biasa saya mengambil rekomendasi pelayan kami dan dia benar dengan pilihannya makanan lokal yang lezat terima kasih,BUMN,Bintang 4,SheratonBandara,positive,Pelayanan Staf & Keramahan
iing muttakhiroh,2025,4,Saya percaya ini adalah hotel terbaik dekat bandara cgk jika Anda mencari tempat yang sangat bagus untuk transit Anda tempat ini pasti harus mengunjungi kamar ini sangat luas fasilitas cukup bagus dan layanan yang luar biasa harga sedikit tinggi dibandingkan dengan yang lain tetapi itu layak mereka memiliki tempat tidur yang sangat nyaman fantastis dengan fasilitas yang bagus makanan besar saya pasti merekomendasikan untuk memesan sarapan kami memesan untuk sahoor dan dengan 200k mereka memberi kami lebih dari apa yang kami bayar dan fasilitas ganda apa yang kami sukai paling adalah fleksibilitas cek masuk keluar yang sangat berguna untuk wisatawan lokasi tidak,BUMN,Bintang 4,SheratonBandara,positive,Kualitas Makanan & Restoran
Terry Johns,2025,5,Tempat yang sangat bagus untuk menginap jika Anda memiliki berlayar masuk jakarta hotel bus ke hotel dan kembali ke bandara berjalan setiap jam membawa Anda langsung ke terminal Anda sarapan gaya Indonesia yang bagus,BUMN,Bintang 4,SheratonBandara,positive,Kualitas Makanan & Restoran
Elena Fernández,2025,5,benar-benar sempurna sarapan terbaik yang pernah saya coba kamar itu sempurna gym modern dan bersih gym kolam renang untuk mati dan makanan itu lezat pilihan terbaik dan bahkan lebih nyaman karena itu super dekat dengan bandara itu adalah kemenangan menang dan semua staf yang luar biasa baik dan membantu dan ceri masuk atas spa Anda tidak meninggalkan tanpa bahkan mencoba 60 menit pijat itu adalah wajib tambah Anda dapat menikmati fasilitas bahkan setelah check-out jika Anda memiliki beberapa cree waktu sampai penerbangan Anda,BUMN,Bintang 4,SheratonBandara,positive,Fasilitas Hotel (Kolam/Gym/Spa)
Fong,2025,5,Saya memiliki tinggal yang luar biasa di Sheraton Jakarta Soekarno Hatta bandara dari saat sebelum kedatangan saya tim concierge mencapai keluar untuk mengatur layanan pengambilan gratis memastikan pengalaman yang lancar cek masuk adalah profesional dan efisien dan kamar saya luas dan sempurna staf lounge mengesankan saya dengan profesionalisme mereka dan bahkan menghubungi saya dengan nama keluarga seperti sentuhan pribadi sarapan adalah lezat dan tim pergi di atas dan di luar untuk menyiapkan minuman lokal bir pletok untuk saya saya senang untuk tinggal lagi dan sangat merekomendasikan hotel ini untuk keramahan luar biasa,BUMN,Bintang 4,SheratonBandara,positive,Pelayanan Staf & Keramahan
R Lesmn,2025,4,Jika Anda mencari hotel Bali seperti dekat bandara Jakarta ini adalah untuk pergi kamar besar dan bagus beberapa melihat pesawat saat mereka melewati tapi tidak ada kebisingan di dalam kamar parkir untuk tebak terlalu jauh n mereka tidak menempatkan parkir berhenti blok sementara mereka menempatkan tiang lampu secara santai masuk di tengah tempat parkir ini benar-benar menyebabkan kecelakaan,BUMN,Bintang 4,SheratonBandara,negative,Kebersihan & Kenyamanan Kamar
Reddy Panggabean,2025,5,tinggal di sini dengan keluarga saya sebelum penerbangan kami ke Jepang proses check-in adalah lancar anak perempuan saya memiliki pengalaman yang menyenangkan berjalan-jalan di sekitar hotel sarapan kami waktu menyenangkan putri kami menerima peralatan gambar untuk mendapatkan dia sibuk kami juga menerima kue gratis dari dimas dan tika pujian ini benar-benar membuat hari kami awal yang baik untuk penerbangan panjang kami mudah-mudahan mendapatkan kesempatan lain untuk tinggal di sini lain kali,BUMN,Bintang 4,SheratonBandara,positive,Pelayanan Staf & Keramahan
Cuisine Quest,2025,4,Satu-satunya alasan saya memberikannya empat bintang adalah kurangnya ruang tamu eksekutif yang mereka membuat oleh beberapa termasuk hidangan untuk makan malam jika tidak standar marriott keunggulan tempat tidur nyaman tanah yang sangat indah dengan vegetasi dengan baik dijaga dekat bandara adalah bonus,BUMN,Bintang 4,SheratonBandara,positive,Kualitas Makanan & Restoran
Aaron Bonvin,2025,5,dekat dengan staf bandara sangat baik tiga orang mengambil waktu untuk membantu saya dengan masalah bahwa saya sarapan sangat baik dengan banyak pilihan restoran juga sangat baik dan koktail besar juga kamar nyaman cukup besar dan bersih,BUMN,Bintang 4,SheratonBandara,positive,Kebersihan & Kenyamanan Kamar
Afzal Shaikh,2025,5,Anakku patah kakinya dan manajer Nidy dan timnya merawat kami seperti kita adalah keluarga mereka mengantar kami ke rumah sakit diterjemahkan untuk kita dan tinggal di sisi kami ketika mereka mengatakan mereka merawat Anda mereka benar-benar membuat Anda salah satu dari mereka untuk mengatasinya hal-hal dari sarapan mungkin yang terbaik yang pernah saya masuk hidup saya akan terbang kembali dari hanya untuk tinggal di hotel ini hanya luar biasa,BUMN,Bintang 4,SheratonBandara,positive,Pelayanan Staf & Keramahan
Notyourbusiness,2025,4,kamar besar dan kolam renang nice restoran layanan ulang-alik dari dan ke bandara lokasi tambah besar bijak itu pada dasarnya antara dua landasan masuk di tengah bandara tidak ada toko kenyamanan di dekatnya jadi Anda harus mengandalkan 100 makanan dan minuman dari hotel restoran akan merekomendasikan untuk berhenti hanya,BUMN,Bintang 4,SheratonBandara,positive,Fasilitas Hotel (Kolam/Gym/Spa)
Apriliya eriyani,2025,5,2 kali menginap di sini nyaman banget hotel bersih staf smua ramah makanan enak semua menginap bersama keluarga sangat nyaman anak2 jg nyaman sekali berikutnya kalau k jakarta akan nginap d sini lg,BUMN,Bintang 4,SheratonBandara,positive,Pelayanan Staf & Keramahan
Adrian S. (Xie Zhong Feng),2025,5,Saya menyadari bahwa saya lupa untuk menggunakan kode promosi untuk sarapan gratis tetapi staf resepsi sangat sabar dan memungkinkan saya untuk membuat pemesanan baru menggunakan kode sementara membatalkan salah satu Tania dari lebih kafe juga menunjukkan keramahan yang sangat baik dengan pengetahuan produk yang besar dan layanan cepat memperbaiki masalah yang sangat kecil dengan perawatan yang sangat tinggi sangat dianjurkan untuk tinggal di sini jika Anda mencari hotel dekat bandara desain dan suasana membuat Anda lupa ini terletak masuk jalan sibuk Jakarta berkat kebun yang subur dan danau,BUMN,Bintang 4,SheratonBandara,positive,Pelayanan Staf & Keramahan
MS Madjid,2025,5,hotel dekat bandara soekarno hatta dengan view danau bersih nyaman tenang menu sarapan yang bervariasi serta pelayanan pelayan yang ramah caca,BUMN,Bintang 4,SheratonBandara,positive,Pelayanan Staf & Keramahan
Man Kien,2025,5,Hotel sangat dekat dengan Soekarno Hatta transportasi bandara internasional mudah memiliki ulang tahun juga setiap jam saya memiliki kamar dengan teras balkon dapat berjalan dari kamar ke kolam renang terdekat memiliki taman hewan kecil di belakang dengan kelinci burung beo dan kura-kura pasti kembali ke sini pada perjalanan berikutnya memiliki seluruh hari makan restoran juga dan mocktail sangat sangat enak rasanya sangat sangat bagus,BUMN,Bintang 4,SheratonBandara,positive,Fasilitas Hotel (Kolam/Gym/Spa)
Heidi Stegmayer,2025,5,Saya dan suami sangat menikmati waktu kami di hotel ini ketika masuk antara penerbangan ke dan dari cgk kamar-kamar sangat bersih dan nyaman lokasi dekat bandara sangat nyaman dan kolam renang dan lapangan yang indah tapi apa yang membuat hotel ini istimewa adalah staf setiap anggota staf kami bertemu benar-benar indah dan membantu pembalap ulang-alik meja depan staf pembawa pembersih dan staf di kedua restoran pergi di atas dan di luar untuk membuat kita merasa selamat datang kami menikmati diri kita begitu banyak sehingga kami memesan malam kedua sebelum terbang pulang ke Kanada kami sangat merekomendasikan tinggal,BUMN,Bintang 4,SheratonBandara,positive,Fasilitas Hotel (Kolam/Gym/Spa)
Henry Hsu,2025,5,Hotel yang sangat ramah anak dengan lokasi yang bagus ini dekat dengan pik dan bandara sangat cocok untuk tamu yang bepergian hanya terutama ke Jakarta utara kru layanan dari ruang resepsi dan terutama restoran profesional cepat menanggapi dan ramah saya suka makanan lokal yang mereka layani untuk sarapan saya juga menikmati jus buah segar dipencet kudos untuk tim sheraton,BUMN,Bintang 4,SheratonBandara,positive,Pelayanan Staf & Keramahan
B S,2025,5,Saya mendapat tarif khusus di Sheraton Jakarta bandara untuk ulang tahun pertama tarif termasuk sore teh titanium anggota mendapatkan koktail malam gratis sarapan dan upgrade suite setelah check masuk meja sebelah saya diberi kue ulang tahun Sheraton tapi mereka tidak memberi saya sementara menunggu sore teh untuk disiapkan kamar belum siap saya harus meminta sebelum kue diberikan itu berubah keluar mereka juga bingung tentang paket jadi sore teh mengambil waktu lama untuk menyiapkan hampir satu jam itu sedikit mengecewakan untungnya saya ditingkatkan ke,BUMN,Bintang 4,SheratonBandara,negative,Harga & Value for Money
Teri Boswell,2025,5,Hotel Sheraton ini memberikan pengalaman yang mengejutkan menyenangkan selama dua terpisah satu malam saya tinggal masuk dua minggu terakhir meskipun kedekatan dengan cgk itu sangat tenang bersih luas dan memiliki kolam renang yang indah gym dan restoran yang sangat baik beberapa dari concierge dan staf restoran bahkan mengingat saya ketika saya kembali dua minggu kemudian meskipun saya hanya pernah ada sekali sebelum sarapan buffet menawarkan pilihan barat dan Indonesia dan pengawas restoran mr dev memastikan makanan saya adalah untuk saya suka pengawas aktif keterlibatan dengan tamu menunjukkan harapan yang dihasilkan masuk pengecualian,BUMN,Bintang 4,SheratonBandara,positive,Fasilitas Hotel (Kolam/Gym/Spa)
Brandon Enow,2025,5,Dila dan vivi sangat luar biasa selama waktu saya masuk ke hotel saya tidak memiliki kata-kata untuk mengganggu bagaimana baik dan peduli dan penuh kasih mereka dengan saya dan rekan-rekan saya,BUMN,Bintang 4,SheratonBandara,positive,Pelayanan Staf & Keramahan
Danny Kusnardi,2025,5,kamar bandara ditutup dengan nyaman bersih dan layanan luar biasa mulai dari pengambilan dari bandara sampai check out sarapan benar-benar makanan berbagai makanan Asia Barat dan Indonesia,BUMN,Bintang 4,SheratonBandara,positive,Kebersihan & Kenyamanan Kamar
Mei Hui,2025,5,Aku tinggal hanya beberapa hari di sini semua staf baik kebersihan juga baik Terima kasih untuk Shimar dan vivi untuk menjadi begitu ramah selalu menawarkan bantuan setelah melayani layak rating yang baik,BUMN,Bintang 4,SheratonBandara,positive,Pelayanan Staf & Keramahan
Christina Meisa,2025,5,Sheraton bandara jakarta adalah tempat yang tidak terduga tenang tempat untuk liburan akhir pekan tepat di luar kota meskipun dekat dengan Soekarno Hatta bandara internasional hotel merasa dunia jauh dibungkus masuk hijau tropis dan elegan lembut yang langsung menganggu Bali resor vibes kolam renang adalah fitur yang menonjol dengan lingkungan yang tenang yang mengundang Anda untuk bersantai sepenuhnya apakah Anda sedang mandi atau bersantai dengan buku mudah untuk tergelincir ke dalam mode liburan kamar-kamarnya luas modern dan tenang menawarkan istirahat yang tenang dengan pakaian tidur mewah dan,BUMN,Bintang 4,SheratonBandara,positive,Fasilitas Hotel (Kolam/Gym/Spa)
Nata,2025,5,Kami mengambil keuntungan dari layanan ulang-alik bandara yang sangat baik ditawarkan secara gratis untuk tamu hotel Rohmat perwakilan bandara sangat tepat waktu dan perhatian ulang-alik menunggu kami saat kami keluar dari ruang kedatangan sebagai anggota platinum kami mendapat layanan makan malam gratis serta sarapan hotel s m klub masih dalam renovasi rasa makanan dan kualitas luar biasa kolam renang sangat baik serta kolam renang bar di mana kami mendapatkan beberapa dingin bir lokal tempat tidur sangat nyaman dan berkontribusi secara signifikan kepada kami tidak memiliki jet lag sangat tinggi,BUMN,Bintang 4,SheratonBandara,positive,Fasilitas Hotel (Kolam/Gym/Spa)
Heni Nafisah,2025,5,Beberapa hari yang lalu saya pijat di Anathaya spa dan saya sangat puas sekali dengan layanan di sana dengan terapis yang sangat profesional,BUMN,Bintang 4,SheratonBandara,positive,Fasilitas Hotel (Kolam/Gym/Spa)
Telur Premium,2025,2,petugas parkir di lobi sangat tidak ramah saya menjemput pimpinan disuruh menunggu di lobi sebrang katanya dia ingin membukakan cone parkir saya tunggu tidak dibukakan namun dia kembali dengan nada sindiran membuka cone saja tidak mau sendiri sedangkan dia tadi bilang akan membukakan cone parkir untuk saya,BUMN,Bintang 4,SheratonBandara,negative,Infrastruktur (AC/WiFi/Parkir/Air)
Noryandri@gmail.com muhfabian,2025,5,sebelumnya mohon maaf hanya survey lokasi hotel sheraton bandara untuk anak-anak pkl disana jalur jalan oke meskipun wajar ada macet dikota jakarta untuk hotelnya 5 insyaallah bagus juga pelayanan manajemen nya saya jamin makanya bisa terima anak istimewa seperti anak saya tidak membeda2kan nanti juga kenal nama muh fabian salam kenal anak saya alhamdulillah dapat pengalaman di kelas industri saya sebutkan nama hotelnya 4bulan di hotel swiss 2bulan hotel harris mansion semoga mendapat pengalaman juga di hotel sheraton bandara,BUMN,Bintang 4,SheratonBandara,positive,Lokasi & Akses Strategis
