User Name,Review Time,Rating,clean_text,Tipe,Kelas,Nama_Hotel,AI_Sentiment,AI_Aspek
audy imelda,2025,5,kamar nya super duper nyaman kamar yang ada terasnya cantik banget ambience nya bener2 saat buat liburan dan lokasi nya saat deket bandara,BUMN,Bintang 4,SheratonBandara,positive,Kebersihan & Kenyamanan Kamar
Peter Schiller,2024,5,aman untuk mengatakan bahwa ini mungkin hotel bandara terbaik yang pernah saya kunjungi itu lebih seperti sebuah resor dengan kolam renang yang sangat bagus dan taman staf yang luar biasa,BUMN,Bintang 4,SheratonBandara,positive,Fasilitas Hotel (Kolam/Gym/Spa)
Joel B,2024,5,Hotel bandara yang sangat bagus dan harga yang baik sarapan yang lezat dan beragam menawarkan kolam renang yang cerah besar dan gym gratis setiap jam ulang-alik ke bandara,BUMN,Bintang 4,SheratonBandara,positive,Fasilitas Hotel (Kolam/Gym/Spa)
Veronika Novitha,2024,5,Hotel baru direnovasi dengan layanan terbaik dari staf pemandangan menakjubkan dan dekat dengan bandara terima kasih jocelyn niken dan sovia saya pasti akan kembali lagi segera,BUMN,Bintang 4,SheratonBandara,positive,Pelayanan Staf & Keramahan
Kathrin Rodina,2024,5,Kami tinggal masuk hotel untuk waktu singkat sehari dan malam sebelum penerbangan ke tujuan berikutnya itu sangat nyaman dan menyenangkan tinggal semua adalah pada tingkat tinggi staf ramah dan membantu makanan masuk restoran yang hebat sarapan cukup baik juga kami berenang masuk kolam masuk pagi dan berjalan-jalan masuk taman yang paling kami sukai king bed yang adalah tempat tidur terbaik kami pernah tidur masuk dan mandi kami memiliki pujian dari hotel yang memperpanjang tinggal kami masuk kamar untuk sebuah kami dan bus ulang-alik ke bandara kami akan,BUMN,Bintang 4,SheratonBandara,positive,Pelayanan Staf & Keramahan
Emilien BORDIER,2024,5,Tempat yang bagus untuk menginap dengan anak-anak semuanya sangat baik staf makanan kolam renang kamar gratis ulang-alik kami merekomendasikan 100,BUMN,Bintang 4,SheratonBandara,positive,Fasilitas Hotel (Kolam/Gym/Spa)
Juan Ferdinand,2024,5,Itu adalah pengalaman yang hebat memiliki makan malam pribadi di sana staf seperti pak agung pak ahmad pak rizqi dan manajer operasi juga memberikan kami layanan super yang sangat baik kami sangat senang dan pasti akan kembali ke sheraton bandara jakarta hotel untuk acara berikutnya meskipun saya memiliki pengalaman buruk dengan salah satu dari tim penjualan tapi tidak masalah itu semua dibayar dengan upaya terbaik sheraton bandara tim terima kasih banyak sheraton bandara jakarat hotel menjaga dengan yang sangat baik wokarat,BUMN,Bintang 4,SheratonBandara,positive,Pelayanan Staf & Keramahan
Waldo Klein,2025,5,Layanan tamu yang bagus bahkan dengan cek jam 2 pagi masuk sangat baik dukungan Bellhop layanan layanan ulang-alik ke terminal 3,BUMN,Bintang 4,SheratonBandara,positive,Pelayanan Staf & Keramahan
Lee,2024,5,pengalaman hotel yang luar biasa masuk sheraton saya bisa mengatakan itu adalah layanan terbaik pernah sheraton saya mengalami makanan mereka untuk sesi malam sangat indah terutama jamur sup sialan baik semua orang harus mencobanya,BUMN,Bintang 4,SheratonBandara,positive,Kualitas Makanan & Restoran
Ryko,2025,5,Lokasi yang luar biasa dan fasilitas staf ramah di sekitar dari bandara ulang-alik sampai akhir cek saya keluar untuk keberangkatan,BUMN,Bintang 4,SheratonBandara,positive,Pelayanan Staf & Keramahan
Aprilitania Hayatul Arifa,2024,5,Itu adalah tinggal yang tak terlupakan kamar yang sangat nyaman bersih hotel masuk jakarta staf sangat membantu informatif terutama rahmat pasti akan kembali lagi pasti,BUMN,Bintang 4,SheratonBandara,positive,Kebersihan & Kenyamanan Kamar
Dhita Whardani,2024,5,Secara keseluruhan bahagia menginap di Sheraton Jakarta Airport tempat yang baik layanan yang baik cepat respon makan malam dan sarapan rasa baik dan terima kasih kepada Ms siti untuk waffle untuk sarapan,BUMN,Bintang 4,SheratonBandara,positive,Pelayanan Staf & Keramahan
Stephanie Valencia,2024,5,oke banget layanan nya staf nya membantu ramah makanan oke fasilitas oke nyaman suasananya terima kasih buat layanan nya yang oke banget pak hendrik pak agung pak ahmad pak syaiful dan semua tim sheraton,BUMN,Bintang 4,SheratonBandara,positive,Pelayanan Staf & Keramahan
Dandi Prasetia,2024,5,Tempat yang baik untuk bertemu terutama jika Anda sudah siap untuk penerbangan internasional Anda tidak perlu khawatir tentang potensi kemacetan lalu lintas,BUMN,Bintang 4,SheratonBandara,positive,Lokasi & Akses Strategis
Malte Wigger,2025,4,Lokasi yang sempurna jika Anda perlu tinggal dekat bandara bagus tiga kolam renang satu-satunya hal yang tidak topnotch adalah sarapan,BUMN,Bintang 4,SheratonBandara,positive,Fasilitas Hotel (Kolam/Gym/Spa)
Ana Fitria,2024,5,Bertemu di sini pelayanan nya memuaskan dan petugas nya sangat responsif tempat nyaman makanan enak2 pasti kembali lagi ke sini sih terimakasih mas rizki mas agung dan tim,BUMN,Bintang 4,SheratonBandara,positive,Pelayanan Staf & Keramahan
Kirill Shmelev,2024,5,Aku suka itu indah baru direnovasi kamar segar lilin crispy staff sangat ramah mencari untuk melayani Anda indah kolam renang luar tetaplah,BUMN,Bintang 4,SheratonBandara,positive,Pelayanan Staf & Keramahan
Bellaria Ekaputri,2025,5,Suka banget ama hotelnya serasa bukan jakarta meskipun hotel lama tapi vibesnya ttp nyaman,BUMN,Bintang 4,SheratonBandara,positive,Kebersihan & Kenyamanan Kamar
romianna romianna,2024,5,Saya senang bisa menginap di hotel sheraton soeta makanannya enak dan pelayanan sangat baik dan ramah teruntuk fikri dan angin terima kasih banyak,BUMN,Bintang 4,SheratonBandara,positive,Pelayanan Staf & Keramahan
Dhandhang Jati Kusuma,2025,5,pelepasan bagi paspor dan vaksin polio onh tambah 1446h 2025,BUMN,Bintang 4,SheratonBandara,neutral,Harga & Value for Money
doug hemenway,2024,5,Hotel bandara yang direnovasi dengan baik bukan hotel bandara normal Anda merasa seperti liburan staf yang indah merawat setiap kebutuhan kami sangat dianjurkan,BUMN,Bintang 4,SheratonBandara,positive,Pelayanan Staf & Keramahan
Bob Bawden,2025,5,"Hotel bandara yang sangat bagus, kolam renang yang ramah staf bersih dan pilihan makanan yang baik.",BUMN,Bintang 4,SheratonBandara,positive,Fasilitas Hotel (Kolam/Gym/Spa)
Dave Yao,2025,4,dekat bandara tempat yang baik untuk membebaskan diri untuk sesaat makanan yang baik dan orang lain semua orang sangat baik di sini terutama vivi,BUMN,Bintang 4,SheratonBandara,positive,Lokasi & Akses Strategis
Nadia Amalia,2024,5,Pelayanan nya oke terimakasih sekali untuk pak rizqi dan pak agung sangat tanggap sekali pelayanan nya hotel nya bersih masakannya enak sangat direkomendasikan,BUMN,Bintang 4,SheratonBandara,positive,Kebersihan & Kenyamanan Kamar
M Supikroh,2024,5,Bertemu di Sheraton Airport Soekarno Hatta ini sangat nyaman bersih dan pelayanan nya sangat baik khususnya untuk petugas banquetnya pak agung dan pak kiki sangat ramah,BUMN,Bintang 4,SheratonBandara,positive,Kebersihan & Kenyamanan Kamar
Caesar Sumampouw,2024,5,Oasis besar masuk pinggiran Jakarta itu memiliki getaran Bali pasti di bawah manajemen baru sekarang layanan sangat baik sangat perhatian,BUMN,Bintang 4,SheratonBandara,positive,Lokasi & Akses Strategis
Hengki Rinaldi,2024,5,Hotel ini terlalu bagus semua staf baik untuk melayani saya terutama Mr Yogi dari concierge dia membantu saya untuk reservasi restoran di pik dan juga membantu saya untuk taksi ketika saya check-out dia membantu saya untuk bagasi saya dimasukkan ke dalam mobil,BUMN,Bintang 4,SheratonBandara,positive,Pelayanan Staf & Keramahan
Krisna Septianto,2024,5,bikin event disini puas pelayanannya oke banget dibantu dari awal sampai akhir terima kasih mba dewi mas rizky mas agung dan tim yang mau capek,BUMN,Bintang 4,SheratonBandara,positive,Pelayanan Staf & Keramahan
santo suwito,2025,5,Lorong2nya kurang bersih,BUMN,Bintang 4,SheratonBandara,negative,Infrastruktur (AC/WiFi/Parkir/Air)
Wynne Hestia,2024,5,pengalaman yang hebat 3 bahagia banget bisa punya kesempatan tinggal di sini nice layanan tempat yang baik makanan hebat semoga suatu hari bisa balik lagi,BUMN,Bintang 4,SheratonBandara,positive,Kualitas Makanan & Restoran
maxie temaluru,2024,5,Tempat yang keren untuk bertemu dan tinggal layanan sangat baik jadi puas Terima kasih banyak untuk tim bank Mr Rizki Mr Ahmad dan Mr Andika juga tim penjualan Mr Donny kalian adalah yang terbaik,BUMN,Bintang 4,SheratonBandara,positive,Pelayanan Staf & Keramahan
Jojo,2025,5,masuk melayani pelanggan di lounge merokok,BUMN,Bintang 4,SheratonBandara,neutral,Lokasi & Akses Strategis
Dini Kusuma Wardhani,2025,5,Terima kasih Mba nisa mas rizqi tim bank dan kantor depan tim yang sangat membantu untuk acara kemarin,BUMN,Bintang 4,SheratonBandara,positive,Pelayanan Staf & Keramahan
Cynthia Laurensia,2024,5,memiliki pertemuan bisnis dan tinggal untuk malam di Sheraton Jakarta Soekarno Hatta bandara dan benar-benar puas dengan kamar dan layanan terima kasih Pak Kiki dan Pak Ahmad untuk bantuan besar,BUMN,Bintang 4,SheratonBandara,positive,Kebersihan & Kenyamanan Kamar
Niky Purbawisesa,2024,5,Hotel nya keren abis di renovasi bintang 5 di daerah bandara dengan akses yang strategis serta fasilitas yang sangat lengkap,BUMN,Bintang 4,SheratonBandara,positive,Lokasi & Akses Strategis
Ali Akbar Mutiara,2024,5,Secara keseluruhan bagus tim event management bantu kegiatan kami terima kasih atas bantuannya pak rizqi dan pak agung mudah mudaham bisa bertemu di event2 berikutnya,BUMN,Bintang 4,SheratonBandara,positive,Pelayanan Staf & Keramahan
Kedai TATULITI Galeri Mefstizen,2024,5,tempat menginap ketika mengikuti tahap penjurian calon penerima anugerah upakarti 2024 yang diselenggarakan oleh ditjen ikma kemenperin ri,BUMN,Bintang 4,SheratonBandara,neutral,Fasilitas Hotel (Kolam/Gym/Spa)
Ferdi Ansyah,2024,5,Perjalanan ini sangat baik dan keramahan luar biasa. Aku ingin berterima kasih kepada Rahmad Yusuf di kantor depan yang menunjukkan keramahan sejati melalui pelayanannya.,BUMN,Bintang 4,SheratonBandara,positive,Pelayanan Staf & Keramahan
Homin Lo,2024,2,menunggu hampir 1 jam untuk makanan saya server miskin masuk melayani lupa apa yang kami pesan sangat buruk pengalaman untuk memesan makanan di restoran mereka,BUMN,Bintang 4,SheratonBandara,negative,Pelayanan Staf & Keramahan
Rusdonobanu,2025,5,lokasi terbaik dekat bandara jakarta soekarno hatta,BUMN,Bintang 4,SheratonBandara,positive,Lokasi & Akses Strategis
Anonymous Reviewer,2025,5,Aku sudah mencobanya. Masukkan kopiku.,BUMN,Bintang 4,SheratonBandara,neutral,Harga & Value for Money
Kayellin,2025,5,Aku suka makanan dan layanan di sini,BUMN,Bintang 4,SheratonBandara,positive,Kualitas Makanan & Restoran
Stanley Song Malonda,2024,5,Secara keseluruhan pengalaman yang baik untuk pertemuan Terima kasih banyak Pak Agung dari pesta untuk dukungan,BUMN,Bintang 4,SheratonBandara,positive,Pelayanan Staf & Keramahan
Henry Eko,2025,5,Tempat yang sangat bagus bisa menjadi sangat ramai jika ada acara,BUMN,Bintang 4,SheratonBandara,positive,Harga & Value for Money
Robert Baltus,2024,5,Staf luar biasa kamar luar biasa dan buffet luar biasa dan semua ini dekat dengan bandara terasa seperti sebuah resor,BUMN,Bintang 4,SheratonBandara,positive,Kualitas Makanan & Restoran
Yoyo Sunaryo,2024,5,Tempat nyaman petugas ramah sekali bisa melepaskan penat dan lelah saat selesai perjalanan dari luar negri disini,BUMN,Bintang 4,SheratonBandara,positive,Pelayanan Staf & Keramahan
Farid Hadinugroho,2024,5,Terima kasih team bunquet mas kiki mas agung mas ahmad teamnya mantap makanannya topp enak2,BUMN,Bintang 4,SheratonBandara,positive,Pelayanan Staf & Keramahan
ADI Yustiadi,2025,5,hanya makanannya saja yang rasanya kurang khususnya masakan indonesia,BUMN,Bintang 4,SheratonBandara,negative,Kualitas Makanan & Restoran
imare thanea,2024,5,Recomended banget tidak salah pilih pokoknya nyaman banget makanan enak semuanya terbaik,BUMN,Bintang 4,SheratonBandara,positive,Kualitas Makanan & Restoran
Adhi Pradipta Nandi Wardhana,2025,5,Akan tetap masuk hotel ini lagi lain kali,BUMN,Bintang 4,SheratonBandara,negative,Harga & Value for Money
J adams,2024,5,sangat sopan dan membantu sarapan yang bagus dengan buah lokal tom yum sup,BUMN,Bintang 4,SheratonBandara,positive,Pelayanan Staf & Keramahan
Christian Santesson,2025,5,Sangat menyenangkan. Terima kasih staf Sheraton Jakarta atas pelayanan dan perhatian yang luar biasa.,BUMN,Bintang 4,SheratonBandara,positive,Pelayanan Staf & Keramahan
Hatem Ladjimi,2024,5,staf yang hebat terutama Rahmad concierge pengemudi ulang-alik sangat profesional,BUMN,Bintang 4,SheratonBandara,positive,Pelayanan Staf & Keramahan
Mariam Ezzine,2024,5,Kecantikan staf di check masuk sikap positif koki di restoran adalah kebahagiaan mutlak,BUMN,Bintang 4,SheratonBandara,positive,Pelayanan Staf & Keramahan
Saeed Al-Breiki,2025,5,Saya sangat merekomendasikan untuk orang yang memiliki penerbangan dalam waktu 24 jam,BUMN,Bintang 4,SheratonBandara,positive,Harga & Value for Money
Dimas Rafliansyah,2024,5,hotel nya bagus nyaman bersih staf nya ramah,BUMN,Bintang 4,SheratonBandara,positive,Kebersihan & Kenyamanan Kamar
MUHAMAD FRISA,2025,5,Oke lah cuma area parkir nya lumayan jauh saja,BUMN,Bintang 4,SheratonBandara,positive,Infrastruktur (AC/WiFi/Parkir/Air)
SK lem,2024,4,Hotel baru-baru ini direnovasi layanan yang baik dan perhatian untuk detail oleh semua orang masuk ke hotel,BUMN,Bintang 4,SheratonBandara,positive,Pelayanan Staf & Keramahan
Felix Setiawan,2024,5,Pengalaman liburan yang hebat di sini suka dengan getaran Bali,BUMN,Bintang 4,SheratonBandara,positive,Harga & Value for Money
Jason Beavers,2025,5,area kolam ini adalah sepotong kecil surga,BUMN,Bintang 4,SheratonBandara,positive,Lokasi & Akses Strategis
amos p. ginting suka,2024,4,area parkir terlalu jauh jemput ke lobi dari area parkir harus mutar,BUMN,Bintang 4,SheratonBandara,negative,Infrastruktur (AC/WiFi/Parkir/Air)
Pani Setiawati,2024,5,Aku menikmati 2 malam menginap di hotel ini kamarnya sangat berharga,BUMN,Bintang 4,SheratonBandara,positive,Harga & Value for Money
nayib abdala,2024,5,Sangat bagus untuk selesaikan perjalanan Anda setelah melakukan tempat-tempat yang otentik,BUMN,Bintang 4,SheratonBandara,positive,Harga & Value for Money
Ahmad Zaki,2025,5,kopinya tidak enak sudah kadaluarsa,BUMN,Bintang 4,SheratonBandara,negative,Harga & Value for Money
Alvian Nurhikmah,2024,5,menginap di hotel ini benar benar di manjain sama kuliatas nya,BUMN,Bintang 4,SheratonBandara,positive,Harga & Value for Money
Vina Putri,2025,5,Relax kamar Relax spa,BUMN,Bintang 4,SheratonBandara,positive,Fasilitas Hotel (Kolam/Gym/Spa)
Gerard Moloney,2024,5,kamar yang luas dan nyaman besar layanan ramah,BUMN,Bintang 4,SheratonBandara,positive,Kebersihan & Kenyamanan Kamar
Achmad Faisal,2025,5,bagus banget kaya di bali vibesnya,BUMN,Bintang 4,SheratonBandara,positive,Kualitas Makanan & Restoran
Ikhsan Jauhari,2024,5,sudut kamar dekat jendela masih ada sedikit debu,BUMN,Bintang 4,SheratonBandara,negative,Harga & Value for Money
DM Sumarli,2024,4,salah satu hotel terbaik dekat bandara,BUMN,Bintang 4,SheratonBandara,positive,Lokasi & Akses Strategis
Rebecca Chen,2024,5,pemandangan yang sangat bagus dan kolam renang yang menakjubkan,BUMN,Bintang 4,SheratonBandara,positive,Fasilitas Hotel (Kolam/Gym/Spa)
Harry Gondo,2025,5,hotel bintang 5 dengan fasilitas bintang 5 dekat bandara soekarna hatta,BUMN,Bintang 4,SheratonBandara,positive,Lokasi & Akses Strategis
alexander phoenix,2024,5,tempatnya bagus jangan pernah lupa tempat ini,BUMN,Bintang 4,SheratonBandara,positive,Lokasi & Akses Strategis
Desy Julianty,2025,5,"Oke, oke.",BUMN,Bintang 4,SheratonBandara,neutral,Harga & Value for Money
Owen Manuel,2024,5,Hotelnya bagus hangat dan nyaman,BUMN,Bintang 4,SheratonBandara,positive,Kebersihan & Kenyamanan Kamar
Amilla Agus,2024,5,Setelah renovasi menjadi hebat lagi cinta itu,BUMN,Bintang 4,SheratonBandara,positive,Harga & Value for Money
ncess oh ncess,2025,5,seru tinggal disini sama bocil2,BUMN,Bintang 4,SheratonBandara,negative,Harga & Value for Money
Romi Iskandar,2024,5,Yang ini salah titik peta nya ngaco mohon diperbaiki terima kasih,BUMN,Bintang 4,SheratonBandara,neutral,Harga & Value for Money
Akbar Wisesa,2024,5,makanan yang baik layanan yang bagus secara keseluruhan tempat yang bagus untuk tinggal,BUMN,Bintang 4,SheratonBandara,positive,Kualitas Makanan & Restoran
Ian Anderson,2024,5,staf luar biasa layanan yang sangat baik,BUMN,Bintang 4,SheratonBandara,positive,Pelayanan Staf & Keramahan
jon cox,2025,5,The ultimate joy masuk transfer hotel,BUMN,Bintang 4,SheratonBandara,neutral,Harga & Value for Money
Su Bali,2024,1,pelayanan sangat lambat tidak gercep,BUMN,Bintang 4,SheratonBandara,positive,Harga & Value for Money
Adri Lapotulo,2024,5,Hotel keren dan pelayanannya yang terbaik,BUMN,Bintang 4,SheratonBandara,positive,Pelayanan Staf & Keramahan
Made Surya W.,2025,4,lokasi agak ngunpet,BUMN,Bintang 4,SheratonBandara,positive,Harga & Value for Money
Timmy Pratimi1344,2024,5,Terima kasih mas Saiful dan semua staf Sheraton,BUMN,Bintang 4,SheratonBandara,positive,Pelayanan Staf & Keramahan
Renda Laz,2025,5,mantap,BUMN,Bintang 4,SheratonBandara,positive,Harga & Value for Money
Yanuar Firmansyah,2024,5,pemandangan yang indah dan makanan yang baik,BUMN,Bintang 4,SheratonBandara,positive,Kualitas Makanan & Restoran
Sean Austin,2025,5,Mereka adalah orang-orang yang baik dan memiliki harta yang besar.,BUMN,Bintang 4,SheratonBandara,positive,Harga & Value for Money
Nurhadijanto Djoko Sulistyo,2025,5,Mei 2025,BUMN,Bintang 4,SheratonBandara,positive,Harga & Value for Money
heksa prasetya,2024,5,terbaik,BUMN,Bintang 4,SheratonBandara,positive,Harga & Value for Money
Nauman Mahfooz,2024,5,staf yang sangat baik dan hotel,BUMN,Bintang 4,SheratonBandara,positive,Pelayanan Staf & Keramahan
Crew Berisik,2024,5,berupa,BUMN,Bintang 4,SheratonBandara,positive,Harga & Value for Money
Arfan Naufal,2024,5,lokasi strategis,BUMN,Bintang 4,SheratonBandara,positive,Lokasi & Akses Strategis
Pipi Rudi,2024,5,Pokoke mantap,BUMN,Bintang 4,SheratonBandara,positive,Kualitas Makanan & Restoran
Yuni Uniq,2024,5,sempurna,BUMN,Bintang 4,SheratonBandara,positive,Harga & Value for Money
ipma Y,2025,5,tempat yang bagus,BUMN,Bintang 4,SheratonBandara,positive,Harga & Value for Money
Pipit Sandra,2025,5,layanan yang sangat baik,BUMN,Bintang 4,SheratonBandara,positive,Harga & Value for Money
Firman Abdurahman,2025,5,dianjurkan,BUMN,Bintang 4,SheratonBandara,positive,Harga & Value for Money
Husni Tamrin,2024,5,baik,BUMN,Bintang 4,SheratonBandara,positive,Harga & Value for Money
Mary R,2025,5,indah,BUMN,Bintang 4,SheratonBandara,positive,Harga & Value for Money
Budi,2024,4,transit,BUMN,Bintang 4,SheratonBandara,positive,Lokasi & Akses Strategis
Amira Ulul,2024,1,tidak sopan,BUMN,Bintang 4,SheratonBandara,negative,Harga & Value for Money
Agatha Kristi,2024,5,Tempat yang indah,BUMN,Bintang 4,SheratonBandara,positive,Harga & Value for Money
jinmai zhao,2024,5,nyaman,BUMN,Bintang 4,SheratonBandara,positive,Kebersihan & Kenyamanan Kamar
Darma Wiharto,2025,5,di luar pengalaman,BUMN,Bintang 4,SheratonBandara,negative,Harga & Value for Money
abu sagr,2025,3,Lokasinya dekat bandara parkiranya jahuu banget dan harus muter k jln raya bandara dan masuk lagi k hotel,BUMN,Bintang 4,SheratonBandara,positive,Lokasi & Akses Strategis
Yvonne Sujatta,2025,4,hotel yang sungguh indah kamarnya luas sangat bersih dan perabotannya penuh cita rasa stafnya luar biasa penuh perhatian membantu dan sopan tanpa mengganggu sekalipun namun hotel ini memiliki satu masalah besar dua kamar pertama yang kami tempati berbau jamur begitu parah sehingga saya langsung merasakan gejala kami kemudian dipindahkan ke lantai empat di mana bau jamur dan lumut hanya berasal dari ac kamarnya bersih tanpa noda dan sebagian besar bebas jamur namun bagian lain hotel terutama kamar di lantai dasar memiliki masalah jamur yang signifikan siapa pun yang memiliki masalah kesehatan sebaiknya menghindari menginap di hotel ini jamur disebarkan ke seluruh kamar sistem ac saya,BUMN,Bintang 4,SheratonBandara,positive,Kebersihan & Kenyamanan Kamar
Paul Gebauer,2025,4,hotel besar di sebelah bandara layanan antar jemput tersedia melalui bus antar jemput gratis atau limusin hotel berbayar kamar kamarnya berperabot lengkap dan bersih dan tempat tidurnya sangat nyaman kamar yang menghadap kolam renang sangat tenang restoran menawarkan beragam pilihan hidangan lokal dan internasional stafnya selalu sangat ramah dan membantu,BUMN,Bintang 4,SheratonBandara,positive,Kebersihan & Kenyamanan Kamar
Grazia Gordini,2025,5,Lokasinya sangat strategis hanya 10 menit dari bandara dan mudah diakses melalui layanan antar jemput hotel kami menginap di sini semalam karena penerbangan domestik kami keesokan paginya layanannya sempurna kamar kamarnya luar biasa dilengkapi dengan segala kenyamanan sarapannya berlimpah dengan buah dan jus yang lezat dan anda tidak akan salah memilih hotel ini,BUMN,Bintang 4,SheratonBandara,positive,Lokasi & Akses Strategis
ou s,2025,5,Saya memesan tiket pesawat ke Bali melalui Jakarta tetapi penerbangan saya dibatalkan tak lama setelah pemesanan jadi saya akhirnya menginap di hotel dekat bandara mereka menawarkan bus ulang tahun gratis bus ini melayani rute domestik saya memesan tiket pesawat ke sana tetapi antrean panjang untuk mendapatkan visa setelah kedatangan sangat menyita waktu jadi saya akhirnya naik taksi biru burung harganya hampir 5 0 yen meskipun tampaknya cukup mahal untuk mengambil juga sekitar 3 500 yen jadi mungkin keberangkatan dari bandara cukup mahal atau mungkin karena waktu keberangkatan yang kurang tepat makan malam tersedia di restoran atau bar kolam renang tidak ada lounge sarapan prasmanannya lezat saya menggunakan sh,BUMN,Bintang 4,SheratonBandara,negative,Pelayanan Staf & Keramahan
吴晓晓,2025,1,pengalaman yang sangat buruk sangat bising anda bisa mendengar kereta dorong pembersih rumah orang orang berbicara pintu tertutup berisik dan saya meminta staf untuk memberi saya penyumbat telinga mereka bilang mereka tidak punya waktu pengalaman yang sangat buruk sangat bising anda bisa mendengar kereta dorong pembersih rumah orang berbicara pintu tertutup berisik dan saya meminta staf untuk memberi saya penyumbat telinga mereka bilang mereka tidak punya waktu jika anda ingin istirahat dan tidur yang tenang hotel ini dan pintunya mustahil,BUMN,Bintang 4,SheratonBandara,negative,Kebersihan & Kenyamanan Kamar
mmk I,2025,5,Lokasinya sangat dekat dengan bandara jakarta dan menawarkan layanan antar jemput sehingga nyaman untuk menginap singkat hotelnya mewah dan kamarnya bersih kolam renangnya juga bagus stafnya sangat membantu dan sarapannya lezat,BUMN,Bintang 4,SheratonBandara,positive,Kebersihan & Kenyamanan Kamar
숭숭,2025,5,Saya menginap di sana pada bulan Mei saya sangat sangat puas dengan semuanyaᅲ staf resepsionisnya sangat ramah dan mereka bahkan meng upgrade kamar saya kolam renang bagus bahkan orang yang mengantar saya ke bandara sangat ramah saya ingin kembali lagi,BUMN,Bintang 4,SheratonBandara,positive,Pelayanan Staf & Keramahan
Aitami Hdez,2025,5,tempat yang sempurna jika anda harus menunggu berjam di dekat bandara jakarta kolam renang wi fi spa pusat kebugaran dan layanan mewah sarapannya kelas atas,BUMN,Bintang 4,SheratonBandara,positive,Fasilitas Hotel (Kolam/Gym/Spa)
Zuhal Mertoglu,2025,5,hotelnya luar biasa pak ryo pak nındy dan pak theo sangat membantu mereka sangat ramah dan membantu mereka membuat kami merasa seperti di rumah sendiri terima kasih banyak,BUMN,Bintang 4,SheratonBandara,positive,Pelayanan Staf & Keramahan
SHINJI FUJINO,2025,4,saya menginap di sini karena sedang mencari hotel dekat bandara hotel ini telah direnovasi dengan baik dan bersih makanan di restorannya lezat dan stafnya ramah dan penuh perhatian sehingga membuat pengalaman menginap saya nyaman roti dan camilan tersedia untuk dibeli yang sepertinya merupakan pilihan yang baik untuk dimakan di kamar dan staf Anda mengatakan kepada saya bahwa karena sangat dekat dengan bandara mereka tidak dapat membangunnya di lantai yang lebih tinggi berkat hal ini bangunannya memiliki suasana tropis tempat menginap yang nyaman seperti hotel ada juga bus antar jemput dari bandara yang sangat praktis Anda dapat menggunakan bus antar jemput terlebih dahulu melalui apa yang sup jadi tidak perlu khawatir,BUMN,Bintang 4,SheratonBandara,positive,Kualitas Makanan & Restoran
Y nis,2025,5,saya check masuk sebelum tengah hari dan check keluar pukul 4 pagi karena harus pindah dari terminal domestik t3 ke terminal internasional t3 sebagaimana tercantum di situs web hotel bus antar jemput membutuhkan reservasi terlebih dahulu saya menghubungi pihak hotel dan menerima balasan yang jelas melalui email dan whatsapp mengenai berhenti bus antar jemput bus tersebut ternyata beroperasi sekitar satu jam sekali setelah mendarat saya menerima pesan whatsapp yang tepat waktu sehingga saya dapat dengan mudah menemukan staf untuk menyambut kamar saya telah direnovasi dan sangat nyaman tidak ada bak mandi sayangnya sheraton club sedang dalam renovasi dan tidak tersedia hal ini akan diumumkan di situs,BUMN,Bintang 4,SheratonBandara,positive,Lokasi & Akses Strategis
양쥔,2025,1,kamarnya bau apek dan kamar mandinya bau limbah saya hampir muntah saya tidak akan pernah kembali ke sana lagi bahkan jika mengeluh yang Anda dapatkan hanya maaf rasanya malu membayangkan manajemen hotel seperti itu,BUMN,Bintang 4,SheratonBandara,negative,Kebersihan & Kenyamanan Kamar
Bernhard Berwik,2025,5,menginap di sheraton jakarta sangat menyenangkan kami sangat terkesan dengan kamar yang luas dan nyaman serta layanan yang prima suasananya sangat menyenangkan dan layanannya sesuai dengan harga secara keseluruhan rekomendasi yang luar biasa,BUMN,Bintang 4,SheratonBandara,positive,Kebersihan & Kenyamanan Kamar
