User Name,Review Time,Rating,clean_text,Tipe,Kelas,Nama_Hotel,AI_Sentiment,AI_Aspek
Yunia Devianty,2024.0,2,yang bikin saya masih mo kasih bintang karena kamarnya lumayan nyaman dan luas entah fasilitas lainnya yang pasti hotel susah dihubungi dan jauh darimana mana jadi kalau kesini pastiin makanan yang dibawa sekalian makan berat kami tiba jam 18:30an kondisi hujan deras dan nyasar di peta tidak sesuai titik gk ada yang bisa ditanyain terparah yang plg parah adalah pesan makanan dari jam 1900 katakan agak lama oh oke gkpp saya pikir jam sudah jam 20 00 ditlp lagi katanya 30 menit 20 45 saya telpon katanya 20 menit lagi soalnya lagi rame wel emang ngga dipenuhi dengan terima tamu yah trus tutup pesanan,BUMN,Bintang 4,JatiluhurValley&Resort,negative,Kebersihan & Kenyamanan Kamar
a f,2024.0,3,lantai kamar mandinya staf licin tidak siap saat libur panjang cek masuk jam 14 00 masih disuruh menunggu kamar belum siap,BUMN,Bintang 4,JatiluhurValley&Resort,negative,Kebersihan & Kenyamanan Kamar
Rerey Alfiani Pradipta,2022.0,4,suasana hotel tenang adem kamarnya bersih sayang pada saat saat kesana udara panasnya mati staf nya cukup ramah untuk sarapan rasanya enak cuma menurut saya makanan beratnya kurang bervariasi di dalam hotel ada kolam renang yang kedalamannya paling dalam 1 8 m di hotel ini juga ada deposit awal 100rb rupiah yang dibayarkan tunai saat kita cek masuk,BUMN,Bintang 4,JatiluhurValley&Resort,positive,Kebersihan & Kenyamanan Kamar
egi martin,2023.0,4,cocok untuk liburan bersama keluarga lokasinya nyaman jauh dari keramain kamar cukup bersih dengan harga kamar yang relatif terjangkau padahal letaknya di tempat wisata,BUMN,Bintang 4,JatiluhurValley&Resort,positive,Kebersihan & Kenyamanan Kamar
NurHarRy Steve9eTheReds,2024.0,5,suasana asri dan nyaman kolam renangnya kurang jernih sedikit mungkin saat menginap kebagian belum dibersihin,BUMN,Bintang 4,JatiluhurValley&Resort,positive,Kebersihan & Kenyamanan Kamar
Fariz Sandi,2025.0,1,akses ke kamar bau septiktank bau sampah layanan tidak bagus responnya lama kereta terbatas lokasi oke sarapan cukup oke,BUMN,Bintang 4,JatiluhurValley&Resort,negative,Kualitas Makanan & Restoran
Dekisugi,2017.0,3,view ke bendungan bagus lokasi relatif jauh dari jalan raya cocok buat menyepi tapi hawa panas seperti jakarta tidak sesejuk pemandangannya di hotel dekat graha vidya lumayan bernyamuk entah di bungalow nya makanan tidak istimewa biasa saja,BUMN,Bintang 4,JatiluhurValley&Resort,negative,Lokasi & Akses Strategis
Fany Nanda (Fany_r_n),2023.0,5,hotelnya nyaman kamar bersih air panas siap kolam renang deket dari kamar resepsionis kamar anak keamanan ramah semua dianjurkan hotel ini,BUMN,Bintang 4,JatiluhurValley&Resort,positive,Kebersihan & Kenyamanan Kamar
Krisno D Herwantoko,2022.0,4,nyaman untuk istirahat bsama kelg bersih menu makanan oke enak bisa rekreasi pemandangan waduk dan bukit olga air resto siap kendaraan sendiri,BUMN,Bintang 4,JatiluhurValley&Resort,positive,Kebersihan & Kenyamanan Kamar
rimma lestari sianturi,2021.0,1,pengalaman pertama saya menginap di sini langsung ilfeel pelayanan resepsionis kurang ramah fasilitas hotel tidak sesuai dengan harga yang menurut saya cukup mahal sarapan tidak enak sarapan untuk anak di bawah 2 tahun juga tidak ada wifi gratis selalu turun tolong pihak manajemen agar bisa mereview dan lebih meningkatkan lg pelayanannya,BUMN,Bintang 4,JatiluhurValley&Resort,negative,Harga & Value for Money
Hardi Sigar,2023.0,5,Buat tenang santai buat ngindarin stres ini hotel yang cocok banget jauh dari keramaian hotelnya adem bisa bikin org santai banget,BUMN,Bintang 4,JatiluhurValley&Resort,positive,Lokasi & Akses Strategis
Raffa fauzi Arkhan,2022.0,1,Tidak sesuai ekspektasi sangat mengecewakan pesan kamar di hotel jatiluhur valley tipe danau view saat c i trnyta lokasi nya bukan disitu tapi di istora mmg bnr danau view tapi sangat kecewa dengan keadaan kamar yang kotor bau terkesan memaksakan untuk terjual dengan tidak memikirkan kenyamanan tamu l,BUMN,Bintang 4,JatiluhurValley&Resort,negative,Lokasi & Akses Strategis
dian ekawati,2023.0,5,Hotel yang bagus untuk menginap kamar bersih dan kolam renang berbagai sarapan nilai uang terintegrasi dengan berbagai area untuk menikmati pemandangan indah di sekitar bendungan jatiluhur jalur yang baik untuk berjalan berjalan berjalan atau bersepeda,BUMN,Bintang 4,JatiluhurValley&Resort,positive,Kebersihan & Kenyamanan Kamar
Aditya,2022.0,4,terletak di daerah bendungan jatiluhur hotel 2 lantai yang lumayan bisa dijadikan alternatif untuk liburan bisa dituju melalui tol cipularang keluar di km 84 keluar jatiluhur jalan menuju sana saat itu lumayan rusak berlubang karena banyak truk kontainer yang melalui jalan yang dilalui,BUMN,Bintang 4,JatiluhurValley&Resort,positive,Harga & Value for Money
Andry Chowanda,2024.0,4,Tempatnya cukup bersih dan luas fasilitas juga lumayan namun sedang ada upgrade sehingga beberapa tempat harus hati2 saat berjalan,BUMN,Bintang 4,JatiluhurValley&Resort,positive,Kebersihan & Kenyamanan Kamar
Eko Basuki,2022.0,4,kamar hotel bersih parkiriran oke suasana oke cuman agak jauh jika mau memesan makan online ataupun mencari keluar saran bawa camilan dari luar,BUMN,Bintang 4,JatiluhurValley&Resort,positive,Kebersihan & Kenyamanan Kamar
Fajar Yanuardi,2023.0,1,Pelayanan baru kurang ya masuk hotel handuk tidak tersedia lalu tlp dan minta ke admin tetap saja tidak di antiner pelayanan di restoran baru saja tidak baik kita laper ingin pesan makan bilang nya pasti menunggu lama pelayanan di hotel ini sangat tidak bagus,BUMN,Bintang 4,JatiluhurValley&Resort,negative,Kualitas Makanan & Restoran
Andi Tri Santoso,2024.0,5,lumayan megah di pesisir jatiluhur g percuma dah fasilitas memadai wlopun jauh dri ritel kudu mempersiapkan klo pgn nginep lgi dah stok makanan wlopun ada resto yang namanya kaum urban mah ribet makan di restoran,BUMN,Bintang 4,JatiluhurValley&Resort,positive,Kualitas Makanan & Restoran
erna nuryanti,2024.0,5,Banyak perubahan yang sudah diperbaiki oleh hotel ini dari segi kenyamanan dan fasilitas sarapan nya juga pelayanan yang cocok dengan sebutan bintang 5,BUMN,Bintang 4,JatiluhurValley&Resort,positive,Kualitas Makanan & Restoran
M Arief Nh,2023.0,5,Hotel resort yang sangat baik layanan baik perhotelan akses mudah parkir selama kunjungan terakhir kami lingkungan hijau banyak pohon pemandangan yang baik lingkungan yang tenang serta harga yang adil dekat danau jatiluhur pemandangan indah menuju hotel kolam renang cukup baik tempat yang baik untuk membawa anak-anak Anda ke sini tempat yang bagus jika Anda membawa sepeda dan naik di sekitar lingkungan,BUMN,Bintang 4,JatiluhurValley&Resort,positive,Fasilitas Hotel (Kolam/Gym/Spa)
Irwan H Nuswanto,2019.0,4,sepi bangeud mungkin cocok buat yang mau ngadem bertapa menjauh dari hiruk pikuk kota tempatnya yang tidak terlalu jauh dari pintu tol jatiluhur mungkin bisa jadi pilihan alternatif ketimbang ke bandung yang sudah menjamin pasti macetnya lingkungannya sebagai hijau dan bersih berada dalam kompleks bendungan jatiluhur gw sendiri tidak pernah melihat waduknya tapi tetap melihat punggung atau tembok bendungan satu pemandangan yang jarang,BUMN,Bintang 4,JatiluhurValley&Resort,positive,Lokasi & Akses Strategis
DEWI SEKARWATI,2024.0,5,kamarnya bagus nyaman dan bersih stafnya ramah pasti akan kembali lagi untuk menginap di sini,BUMN,Bintang 4,JatiluhurValley&Resort,positive,Kebersihan & Kenyamanan Kamar
Fransisca Likwan,2023.0,5,Saya baru melihat lihat tapi suasananya dingin pemandangannya pun oke banget semoga suatu saat saya bisa bermalam di sini sukses selalu,BUMN,Bintang 4,JatiluhurValley&Resort,positive,Kebersihan & Kenyamanan Kamar
UgiHebat,2022.0,4,kamar nya nyaman makanan nya enak tapi saat nginep disana kebagian monyet udara panas hampir setiap hari tidak ada malah tetap tidak ada udara seharian,BUMN,Bintang 4,JatiluhurValley&Resort,negative,Kebersihan & Kenyamanan Kamar
Julie Xu,2018.0,1,Aku tinggal masuk kamar standar kondisi sangat buruk untuk 925k di musim tinggi furnitur rusak sangat tua tidak ada air panas lantai kotor tidak dibersihkan untuk sementara waktu debu tidak bisa mencapai kantor depan karena unit telepon mereka rusak menu di restoran hanya beras goreng dan mie goreng dan telur tidak ada yang lain tidak merekomendasikan dan tidak akan kembali untuk tinggal,BUMN,Bintang 4,JatiluhurValley&Resort,negative,Kualitas Makanan & Restoran
Deddy Poerwanto Effendi,2021.0,5,jatiluhur tidak begitu jauh dari jakarta tempatnya sangat menakjubkan dan indah jika Anda seorang pecinta matahari terbenam Anda harus pergi ke jatiluhur akomodasi bagus karena saya seorang pelancong solo sebagian besar saya pergi di sini sendirian kamar hotel begitu bersih dan cukup luas fasilitasnya begitu selesai Anda dapat berenang atau bermain paduan masuk jatiluhur tempat ini sangat tepat untuk melarikan diri dari kota kesibukan jika Anda membutuhkan tempat untuk bersantai atau akhir pekan melarikan diri saya merekomendasikan hotel ini menjaga pekerjaan yang baik,BUMN,Bintang 4,JatiluhurValley&Resort,positive,Kebersihan & Kenyamanan Kamar
Fathiasari Maulida,2019.0,4,murah nyaman bersih seneng nginep disini temoatvyg oke buat liburan kekuarga pelayanan juga crpat dan memuaskan sarapannya ealaupun menuunya tidak banyak tapi rasanya enak,BUMN,Bintang 4,JatiluhurValley&Resort,positive,Kebersihan & Kenyamanan Kamar
Santynah Annisa F,2022.0,5,berkali2 ke jatiluhur baru mencoba menginap di hotelnya memilih disini karena ada kolam renangnya dan harganya masih ramah di kantong kamarnya bersih fasilitas lengkap sarapan lumayan bervariasi,BUMN,Bintang 4,JatiluhurValley&Resort,positive,Kebersihan & Kenyamanan Kamar
Ine Putri,2023.0,5,lokasi nya bagus banget 3 menit sampai ke waduk jatiluhur view nya cantikk suasananya juga keren cocok banget buat yang pengen mini penyembuhan,BUMN,Bintang 4,JatiluhurValley&Resort,positive,Lokasi & Akses Strategis
Hendra Hidayat,2022.0,4,kunjungan pada hari kerja kurang dari tamu ada mencari tempat tidur tunggal tapi resepsi mengatakan tidak tersedia jadi saya upgrade ke kembar atau ratu selama sarapan covid dikirim ke kamar sekitar 7 pagi rasa sangat rata-rata,BUMN,Bintang 4,JatiluhurValley&Resort,negative,Pelayanan Staf & Keramahan
Lacyta ragil_AP1,2025.0,5,bagus kamarnya makanannya tidak terlalu mahal tapi enak enak bgtt puas deh tinggal disini,BUMN,Bintang 4,JatiluhurValley&Resort,positive,Kebersihan & Kenyamanan Kamar
Santi Sari Wijaya,2022.0,5,kamar nya bagus tarif nya oke kolam renang ada 2 anak dan dewasa sarapan nasi kuning nya enak,BUMN,Bintang 4,JatiluhurValley&Resort,positive,Kebersihan & Kenyamanan Kamar
Dini Suminar,2024.0,2,dapat kamar yang kamar mandinya mampet dan bau lubang kamar mandinya air kran klu baru dibuka suka butek di westafelnya,BUMN,Bintang 4,JatiluhurValley&Resort,negative,Harga & Value for Money
Ibo YOLO,2024.0,1,Villa abal2 banyak tai cicak ac panas 1 rusak tidak ad solusi tidak ad remotenya air butek dan kecil alasan rusak level hotel melati,BUMN,Bintang 4,JatiluhurValley&Resort,negative,Infrastruktur (AC/WiFi/Parkir/Air)
Memi Meyhonk,2024.0,5,sedikit kurang sreg sama view di sekitar kolam renang rasanya kurang estetik untuk yang lain oke,BUMN,Bintang 4,JatiluhurValley&Resort,negative,Fasilitas Hotel (Kolam/Gym/Spa)
deva putri suherman,2024.0,5,Hotel jatiluhur valley resort tempatnya enak banget banyak tempat buat foto yang bagus2 buat kalian yang suka foto view yang yang boleh nih datang ke jvr hotel staycation bersama best fam juga tempatnya enak sunyi jauh dari polusi juga best yuk cobain staycation di jvr hotel,BUMN,Bintang 4,JatiluhurValley&Resort,positive,Kebersihan & Kenyamanan Kamar
Irwan Irwanldt,2023.0,1,Tidak ada kolam renang dekat penginapan di kamar mandi jati warna merah muda ada kejadian ditempat pembuangan udara,BUMN,Bintang 4,JatiluhurValley&Resort,neutral,Kebersihan & Kenyamanan Kamar
AKHDAN ARYA SATYA KHALIFA,2020.0,3,pernah berkunjung ke sini beberapa tahun lalu 2 kali sempat masuk dan melihat dapurnya juga berencana ikut bergabung dengan timnya untuk pembukaan terapung restonya walau akhirnya tidak jadi,BUMN,Bintang 4,JatiluhurValley&Resort,positive,Fasilitas Hotel (Kolam/Gym/Spa)
the sleepwalker,2025.0,4,Resor hotel yang sangat tenang,BUMN,Bintang 4,JatiluhurValley&Resort,positive,Harga & Value for Money
Abah askoem,2019.0,5,bagi yang ingin berkunjung ke wahana pariwisata gram tirta jatiluhur disana sudah tersedia berbagai wahana seperti kolam renang jatiluhur air kata resto apung viwdek kapal pesiar bendungan ir djuanda anak taman villa juga bungalaw selain itu suasanaya dingin aman dan nyaman selamat berkunjung,BUMN,Bintang 4,JatiluhurValley&Resort,positive,Fasilitas Hotel (Kolam/Gym/Spa)
hendro sukarso,2022.0,5,Hotel yang sangat nyaman dengan staf yang ramah mereka sangat profesional dan membantu juga Anda akan mendapatkan lebih dari ekspektasi Anda baik mempertahankan kesan hotel dengan protokol covid untuk semua pengunjung surunding begitu banyak pohon sarapan melayani dengan baik lima bintang pasti,BUMN,Bintang 4,JatiluhurValley&Resort,positive,Pelayanan Staf & Keramahan
teddy bear,2024.0,5,Pelayanan bagus kamar lumayan kolam renang luas namun harus bawa makanan ke sana,BUMN,Bintang 4,JatiluhurValley&Resort,positive,Kebersihan & Kenyamanan Kamar
Ayu Lingga,2024.0,5,Jvr adem banget nyaman suasana kekeluargaan bisa jogging n sepedaan seputan resort dingin pengen balik ke sini lagi dengan fam,BUMN,Bintang 4,JatiluhurValley&Resort,positive,Fasilitas Hotel (Kolam/Gym/Spa)
Iwan aliando,2025.0,5,pokok nya mantap,BUMN,Bintang 4,JatiluhurValley&Resort,positive,Harga & Value for Money
Naryana Yana,2025.0,5,tempat bagus untuk nyaman,BUMN,Bintang 4,JatiluhurValley&Resort,positive,Kebersihan & Kenyamanan Kamar
ALvaro.ELvero,2020.0,1,kolam renang nya tidak ditawar serial kesini banyak busa nya apalagi di bagian anak pokoknya enggak banget lah padahal tiap kehotel yang diliat kolam renangnya,BUMN,Bintang 4,JatiluhurValley&Resort,positive,Fasilitas Hotel (Kolam/Gym/Spa)
Siti Moen,2021.0,5,bersih staf ramah tidak perlu tes cepat yang penting menerapkan protokol 3m sarapan diantar ke kamar,BUMN,Bintang 4,JatiluhurValley&Resort,positive,Pelayanan Staf & Keramahan
Muizudin Ahmad,2020.0,4,Kamar nya cukup bersih suasana nya juga bikin tenang kolam renang cukup luas punya beberapa pilihan ruang juga,BUMN,Bintang 4,JatiluhurValley&Resort,positive,Kebersihan & Kenyamanan Kamar
ALB.Putut Raditya,2022.0,5,nyaman jauh dari keramaian deket sama waduk jatiluhur ada kolam berenangnya sarapannya enakk pegawainya ramah,BUMN,Bintang 4,JatiluhurValley&Resort,positive,Pelayanan Staf & Keramahan
Archie Variant,2021.0,1,Berisik orang pada istirahat tidur karyawan malah ketawa ketiwi kalau tempat dan lokasi ya cukup merekomendasikan lah tapi sangat buruk untuk etika karyawan nya khususnya di malam hari,BUMN,Bintang 4,JatiluhurValley&Resort,negative,Harga & Value for Money
Heppy Nurniawan se,2023.0,5,Banyak pohon jati dan pohon kayu lainnya sehingga hijau dan jauh dari keramaian kota sehingga tidak bising kendaraan maupun asap kenal bisa kembali sangat,BUMN,Bintang 4,JatiluhurValley&Resort,positive,Lokasi & Akses Strategis
Diene Arliana,2024.0,4,Tempat ini bagus lokasi bagus kamar bersih dilengkapi dengan toilet staff juga ramah makanan baik n tentu saja harga ramah saku kolam renang bersih ramah anak ada juga taman bermain mini untuk anak-anak,BUMN,Bintang 4,JatiluhurValley&Resort,positive,Kebersihan & Kenyamanan Kamar
Budy Kurniawan,2023.0,4,pergi bukan di akhir pekan udara kolamnya msh dikasi obat blom jernih besoknya masih butek,BUMN,Bintang 4,JatiluhurValley&Resort,negative,Infrastruktur (AC/WiFi/Parkir/Air)
wahyus82 wahyu,2024.0,3,tempat tidak jauh dari ibukota banyak view yang bagus pelayanannya ramah terima kasih s,BUMN,Bintang 4,JatiluhurValley&Resort,positive,Pelayanan Staf & Keramahan
Abdul Wahid,2025.0,5,sangat indah pemandangannya dan tempatnya kamarnya nyaman adem empuk bikin ketagihan,BUMN,Bintang 4,JatiluhurValley&Resort,positive,Kebersihan & Kenyamanan Kamar
David Rayadi,2020.0,4,Hotel yang baru dibuka lagi untuk umum kamar baru hotel bersih lokasi sangat privasi tempat yang tepat untuk akhir pekan melarikan diri dari kesibukan kota,BUMN,Bintang 4,JatiluhurValley&Resort,positive,Kebersihan & Kenyamanan Kamar
Shafa marwah Diba,2024.0,5,keren banget pemandangan nya baguss tempatnya nyaman bersih berikutnya akan kesini lagi,BUMN,Bintang 4,JatiluhurValley&Resort,positive,Kebersihan & Kenyamanan Kamar
Bagus H. Jihad,2020.0,2,kamar kurang bersih demikian juga dengan sprei dan bantalnya area hotel cukup nyaman dengan pemandangan waduk jatiluhur yang luas,BUMN,Bintang 4,JatiluhurValley&Resort,positive,Kebersihan & Kenyamanan Kamar
Anggia Quraningtiaa,2024.0,5,nyaman bgtt cocok buat liburan sama keluarga view nya bagus pelayanan nya top,BUMN,Bintang 4,JatiluhurValley&Resort,positive,Harga & Value for Money
abut Budiman,2025.0,5,nyaman dingin ramah fasilitas oke cocok untuk sekolah kantor,BUMN,Bintang 4,JatiluhurValley&Resort,positive,Kebersihan & Kenyamanan Kamar
Mochamad Febrianto Putra,2024.0,1,Ada TV Gaada Yang Bisa Di tonton Netflix Tidak Bisa Disney Tidak Bisa Perdana Tidak Bisa Tidak puas sama fasilitasnya dikamar cuma rencana plongo,BUMN,Bintang 4,JatiluhurValley&Resort,negative,Kebersihan & Kenyamanan Kamar
Erwan Nurdiyanto Nurdiyanto,2024.0,5,kamar oke resto rekoman untuk yang suka kuliner banyak menu yang bagus bagi yang suka kopi silahkan di coba sendiri mantab,BUMN,Bintang 4,JatiluhurValley&Resort,positive,Kualitas Makanan & Restoran
Daniels Alvanza,2020.0,1,mereka tidak tahu tentang bekerja di hotel dan tidak tahu tentang sistem masuk hotel tidak tidak bersikap tidak sopan dan tidak pernah memberikan senyum sebagai manajer hotel makanan dan minuman manajer makanan dan divisi kamar manajer tidak bisa berbicara bahasa Inggris dengan lancar menulis dan berbicara banyak orang mengatakan hotel bintang tiga itu benar masuk fakta tidak terlihat seperti hotel bintang tiga mereka tidak mampu untuk posisi kondisi hotel ini dan grahavidya hotel buruk restoran sangat panas untuk banyak kecoa dan hal-hal yang sangat penting hotel ini memiliki bed bug tidak membantu tidak keluar pergi orang tidak kooperatif orang dan tidak baik perintah masuk berbicara bahasa inggris dan menulis,BUMN,Bintang 4,JatiluhurValley&Resort,negative,Kualitas Makanan & Restoran
Ridwan Adam,2023.0,4,kamar bersih pelayanan baik rada panas lokasi baru padahal di lobi di kelilingi pohon jati,BUMN,Bintang 4,JatiluhurValley&Resort,positive,Kebersihan & Kenyamanan Kamar
Faridha Rahayu,2022.0,5,tempat yang bagus masuk dalam kawasan pariwisata paling kebersihan ruangan lorong2 saja yang kurang mungkin efek pandemi byk yang di wfh kan,BUMN,Bintang 4,JatiluhurValley&Resort,positive,Kebersihan & Kenyamanan Kamar
Asep Saiful Zuhro,2025.0,5,pelayanan nya,BUMN,Bintang 4,JatiluhurValley&Resort,positive,Harga & Value for Money
Anum P.,2023.0,4,pemandangan wadum jatiluhur nya bagus resto nya oke makanan nya enak kamar hotrl nya bagus hanya variasi makanan sarapan nya saja kurang variasi tapi tempat nya dianjurkan untuk di kunjungi,BUMN,Bintang 4,JatiluhurValley&Resort,positive,Kualitas Makanan & Restoran
Tjuk Utoro,2018.0,4,Tempat yang nyaman untuk akhir pekan suasana tenang dan indah pemandangan oke oke banget tmpat wisata jg oke bget,BUMN,Bintang 4,JatiluhurValley&Resort,positive,Harga & Value for Money
anggy median,2025.0,5,Tempatnya bagus cocok buat liburan keluarga karena dekat dengan bendungan jatiluhur,BUMN,Bintang 4,JatiluhurValley&Resort,positive,Lokasi & Akses Strategis
Hendra Gunawan,2025.0,5,Tempat nyaman buat liburan anak2 senang dan resto nya enak,BUMN,Bintang 4,JatiluhurValley&Resort,positive,Kualitas Makanan & Restoran
Risang Selo,2022.0,5,Kamar lumayan lega fasilitas kolam renang dan tempat utama anak masih perlu ditingkatkan,BUMN,Bintang 4,JatiluhurValley&Resort,positive,Fasilitas Hotel (Kolam/Gym/Spa)
Kiswah Khey 12,2023.0,5,semuanya nyaman kolam renangnya juga enak dekat dengan situ jatiluhur jadi bisa ngadem juga disana,BUMN,Bintang 4,JatiluhurValley&Resort,positive,Lokasi & Akses Strategis
Dini DW,2024.0,5,hotelnya baru direnov jadi masih bagus dan bersih sarapannya jg enak,BUMN,Bintang 4,JatiluhurValley&Resort,positive,Kebersihan & Kenyamanan Kamar
naya nurul'ied,2024.0,5,Saat menginap kolam renang tidak bisa dipakai tapi keseluruhan okelah liburan di sini,BUMN,Bintang 4,JatiluhurValley&Resort,positive,Fasilitas Hotel (Kolam/Gym/Spa)
Isna Nur Fadilla,2022.0,5,hotel ter worth di purwakarta sarapan enak kamar bagus kolam renang oke harga murah cuma akses jalannya saja agak ekstrim,BUMN,Bintang 4,JatiluhurValley&Resort,positive,Fasilitas Hotel (Kolam/Gym/Spa)
Paramitha Rizky Kartikasari,2022.0,5,Tempat yang tenang yang jauh dari keramaian cocok untuk menghilangkan kelelahan dan bosan apalagi di musim pandemi yang jam menjauhi kerumunan tempat ini cocok banget i m bahagia,BUMN,Bintang 4,JatiluhurValley&Resort,positive,Harga & Value for Money
mochamad fadli,2023.0,5,kamar hotelnya bagus dan bersih ada kolam renangnya di sekitarnya banyak pohon,BUMN,Bintang 4,JatiluhurValley&Resort,positive,Kebersihan & Kenyamanan Kamar
Marten,2023.0,3,overall kamarnya sih bagus tapi tidak ada udara panas dan kamar servicenya lama,BUMN,Bintang 4,JatiluhurValley&Resort,negative,Kebersihan & Kenyamanan Kamar
arief firmansyah,2022.0,5,Asri nyaman dingin tapi jarak ke waduk jatiluhur lumayan jauh jika jalan kaki harga sesuai dengan fasilitas,BUMN,Bintang 4,JatiluhurValley&Resort,positive,Harga & Value for Money
Dian Agustina Pratiwi,2023.0,5,enak buat yang suka menyendiri sih yang mau jauh dari keramaian mending kesini harus mempersiapkan cemilan karna jauh banget supermarket,BUMN,Bintang 4,JatiluhurValley&Resort,positive,Lokasi & Akses Strategis
Gitri Siswantini,2018.0,3,seru ada kolam renang lias juga areanya jadi bisa joging sayangnya pernah pesan kamar tapi serem,BUMN,Bintang 4,JatiluhurValley&Resort,positive,Fasilitas Hotel (Kolam/Gym/Spa)
Yudha Victor,2022.0,3,sinyal wifi lemah menu sarapan kurang lengkap tidak ada sosis padahal anak anak saya suka sosis,BUMN,Bintang 4,JatiluhurValley&Resort,negative,Kualitas Makanan & Restoran
Yudi Sutarno,2024.0,5,Sangat nyaman cocok untuk menginap dan bersantai di akhir pekan,BUMN,Bintang 4,JatiluhurValley&Resort,positive,Harga & Value for Money
dhifa tsania,2024.0,4,Udara hangatnya kurang panas dah itu keluar udara kecil kaya udara kencing bayi,BUMN,Bintang 4,JatiluhurValley&Resort,positive,Harga & Value for Money
Rudy Azzurro,2023.0,5,bagus nyaman dan adem tapi saran lebih baik bawa makanan dan perbekalan karena jauh dari tmpt berjualan dll,BUMN,Bintang 4,JatiluhurValley&Resort,positive,Kebersihan & Kenyamanan Kamar
Tatang Suwandi,2024.0,4,tempat menginap yang saat untuk liburan suasana yang tenang asri dekat dengan lokasi objek wisata jatiluhur,BUMN,Bintang 4,JatiluhurValley&Resort,positive,Lokasi & Akses Strategis
BINTANG SUKAMAJU Chanel,2023.0,5,tempatnya nyaman buat beristirahat adem pelayanan memuaskan harga terjangkau,BUMN,Bintang 4,JatiluhurValley&Resort,positive,Harga & Value for Money
Faiz Hakim,2024.0,5,Tempatnya bagus sarapan enak cocok untuk tempat tinggal jika baru berwisata ke jatiluhur,BUMN,Bintang 4,JatiluhurValley&Resort,positive,Kualitas Makanan & Restoran
Diky Chanel,2020.0,4,nyaman buat pertemuan buat nginap saya lom pernah coba lokasi nyaman dan pelayanan bagus,BUMN,Bintang 4,JatiluhurValley&Resort,positive,Pelayanan Staf & Keramahan
Yusuf khairi,2025.0,5,kamar nya bagus dan nyaman bikin enak tidur nya,BUMN,Bintang 4,JatiluhurValley&Resort,positive,Kebersihan & Kenyamanan Kamar
omay tv,2022.0,5,harga murah untuk hotel berbintang ditambah kolam renang nya yang bagus dan bersih,BUMN,Bintang 4,JatiluhurValley&Resort,positive,Fasilitas Hotel (Kolam/Gym/Spa)
lutfia rahma,2022.0,5,hotelnya bersih dan nyaman kamar yang luas suasana nyaman dianjurkan buat istirahat,BUMN,Bintang 4,JatiluhurValley&Resort,positive,Kebersihan & Kenyamanan Kamar
otjim alkasim,2020.0,4,kamar masih baru kunci kamar belum ada tempat parkir cukup kolam renang masih baru,BUMN,Bintang 4,JatiluhurValley&Resort,positive,Fasilitas Hotel (Kolam/Gym/Spa)
dee yant,2024.0,3,masuk di kawasam wisata jatiluhur klo waktu liburannya banyak bisa keliling2 di dalam saja,BUMN,Bintang 4,JatiluhurValley&Resort,positive,Lokasi & Akses Strategis
Andira Hardianto,2023.0,3,ketiadaan lift dan trolley boy cukup merepotkan untuk yang bawa bagasi,BUMN,Bintang 4,JatiluhurValley&Resort,negative,Infrastruktur (AC/WiFi/Parkir/Air)
Iwan Milaners,2025.0,4,Cocok untuk santai di pagi dan sore menikmati matahari terbit dan matahari terbenam,BUMN,Bintang 4,JatiluhurValley&Resort,positive,Lokasi & Akses Strategis
Iwan kurnia setiawan,2019.0,3,lokasi yang bagus dengan pemandangan waduk sayang hawa panas masih terasa menyengat di siang hari,BUMN,Bintang 4,JatiluhurValley&Resort,positive,Lokasi & Akses Strategis
Rita Komara,2019.0,5,Tempat baru bagus kolam nya banyak paling harus ditambah kamar mandi nya trus tempat makannya juga,BUMN,Bintang 4,JatiluhurValley&Resort,positive,Kebersihan & Kenyamanan Kamar
lisda lisda,2019.0,5,Pemandangannya bagus banget disini tadinya hujan tapi setelah itu cuaca mulai terang dan pemandangannya sangat luar biasa,BUMN,Bintang 4,JatiluhurValley&Resort,positive,Infrastruktur (AC/WiFi/Parkir/Air)
Annisa Putri,2021.0,4,sarapan diantar ke kamar minimalis kolam lumutan lain kali saya pergi ke sana mudah2an sudah diperbaiki,BUMN,Bintang 4,JatiluhurValley&Resort,positive,Kualitas Makanan & Restoran
Rachely Noermalia Ichwan,2025.0,5,bagus sih tuk kamar b saja agak mahal,BUMN,Bintang 4,JatiluhurValley&Resort,positive,Harga & Value for Money
Muhammad Faried,2025.0,5,hotel dan lingkungan yang baik,BUMN,Bintang 4,JatiluhurValley&Resort,positive,Lokasi & Akses Strategis
Riotra,2024.0,5,bagus dan asri tempatnya kurang dingin udaranya tidak kaya di puncak,BUMN,Bintang 4,JatiluhurValley&Resort,negative,Kebersihan & Kenyamanan Kamar
