User Name,Review Time,Rating,clean_text,Tipe,Kelas,Nama_Hotel,AI_Sentiment,AI_Aspek
M Dendi R Bakry,2024,5,makanannya sangat enak sesuai informasi dari pekerja pegadaian bahwa sedari dulu hotel ini memiliki keunggulan di rasa makanan tempat tidur sangat nyaman king koil set lengkap air panas mereka dan langsung panas lokasi sangat strategis dan saat malam tidak bising karena membelakangi jalan malioboro,BUMN,Bintang 3,KHASMalioboroHotel (1),positive,Lokasi & Akses Strategis
Rahmad Mudjianto Vlog,2023,5,nice hotel tempat strategis dekat malioboro dekat stasiun dekat benteng vredenburg kamar lega disediakan alat sholat makanan hotel terjangkau sayangnya menu sarapan kurang bervariasi akses mudah dan ada pangkalan bekak didepan hotel lokasi didalam dan tidak berada di jalan utama sehingga lebih tenang dan vibes kampung lebih terasa harga di musim puncak cukup kamar kurang kedap dan tidak fasilitas kolam renang atau tempat bermain mahal anak,BUMN,Bintang 3,KHASMalioboroHotel (1),positive,Lokasi & Akses Strategis
Cahyo Rohmadiyanto,2024,4,hotel yang tenang disisi dalam malioboro cukup dekat dengan pusat perbelanjaan dan jln malioboro hanya sekitar 300 m harga standar kamar lumayan luas dan bersih menu sarapan bervariasi dengan cita rasa yang lumayan enak bubur jakarta cukup menggoda untuk memulai pagi anda sayang lobbynya sempit sedang fasilitas lainnya tlh perwakilan selamat menikmati yogya yang istimewa,BUMN,Bintang 3,KHASMalioboroHotel (1),positive,Kebersihan & Kenyamanan Kamar
Debbie Kristianto,2023,4,lokasi strategis ke malioboro jalan kaki dekat kamar tidak terang ac hari ptama agak panas hari kedua lumayan tidak tersedia pengering rambut dikamar harus antri parkir nge saat saja sukur masih dapet tanpa lembah sukur ada menghubungkan pintu bisa berbagi ac makanan sarapan standar,BUMN,Bintang 3,KHASMalioboroHotel (1),positive,Lokasi & Akses Strategis
giman pranoto,2025,5,hotel nya keren bersih pelayanan memuaskan,BUMN,Bintang 3,KHASMalioboroHotel (1),positive,Kebersihan & Kenyamanan Kamar
m. ltfh,2023,4,Ke sini cm main bentar masuk lobi lalu ke ruang restorinya lobinya lumayan nyaman sih ada 2 set sofa yang bisa digunakan untuk menunggu ada 1 tv juga untuk rame di dkt pintu lobi juga ada 1 set bank di luar untuk duduk tidak perlu khawatir untuk yang memakai kursi roda ada jalan lewat samping khusus untuk kursi roda jika dari ruang restornya sih bersih cm karena ada di restonya pojok selatan agak suram jika datang sendiri ya meskipun di restonya ada pelayannya juga sih saat ini saya sana skitar jam 19 an restonya sepi banget tidak ada orang yang mungkin pelanggan hotel lebih memilih ya di luar sembari jalan2,BUMN,Bintang 3,KHASMalioboroHotel (1),positive,Kebersihan & Kenyamanan Kamar
Jehian Norman Saviero,2021,5,akomodasi nya sesuai dengan permintaan pesanan dapat kamar yang terhubung dengan kamar lain meskipun yang tersisa kamar merokok pelayan dari hotel dengan sigap melakukan pengaturan kamar menjadi kamar non-merokok sehingga proses pemeriksaan masuk sampai tiba di kamar hanya memakan waktu sekitar 15 menit saja proses pemeriksaan masuk membutuhkan hasil tes cepat jadi harap saya mempersiapkan hasil tes nya untuk kondisi pandemi seperti ini kamar selalu dibersihkan setiap harinya saya menginap selama 6 malam di sini untuk masalah internet menurut saya di atas rata rata dalam artian setara dengan internet melalui SIM card jika tidak salah di sini menggunakan h saya entah mengapa koneksinya baik definisi baik di sini adalah,BUMN,Bintang 3,KHASMalioboroHotel (1),positive,Kebersihan & Kenyamanan Kamar
Sri Wiyatiningsih,2023,4,pertama masuk lobi bau wewangian rempah menyegarkan otak untuk orang muslim ada fasilitas mukena jarang hotel mey menyediakan fasilitas ini sayangnya masuk toilet agak kotor wastafel mampet kamar teman di sebelah ac nya bocor jadi sepertinya perlu banyak perbaikan pada waktu kami perlu ruang pertemuan pelayanannya agak lambat bahkan ketika saya telepon resepsiis ada resepsiis yang pagi sudah pukul 05:30 wib tapi dia bilangnya masih 4:30 wib masih mengantongi mungkin tapi bagusnya saya ditanya ada saran dan masukan apa tidak ada kesempatan bagi saya menyampaikan banyak hal ya paling tidak ada niat untuk memperbaiki semoga benar benar diperbaiki,BUMN,Bintang 3,KHASMalioboroHotel (1),negative,Kebersihan & Kenyamanan Kamar
Advokat Trisna hafidz,2025,5,Sarung handphone dan jam tangan saya tertinggal di dalam kamar beberapa minggu kemudian saya kirim ke alamat rumah tangga saya dewasa suwun sanget nggeh sederek manajer dan staf,BUMN,Bintang 3,KHASMalioboroHotel (1),negative,Pelayanan Staf & Keramahan
mia febiano,2023,1,sewa kamar untuk 3 orang dapet dengan harga 940rb permalam sewa 2malam dengan harga sgitu tidak dapet sarapan kondisi kamar sempit setiap klub hotel memang kamar sudah di rapikan tapi buat sarung bantal tidak di ganti ac juga bocor baru kali ini kecewa,BUMN,Bintang 3,KHASMalioboroHotel (1),negative,Kebersihan & Kenyamanan Kamar
Keysa Shaira Anzaki,2023,2,ada beberapa kendala yang saya alami selama menginap di hotel ini 1 saya pesan 2 kamar dengan permintaan kamarnya sebelahan sudah saya tulis di aplikasi dan resepsionisnya pun mengatakan kamarnya sebelahan namun ketika diberi kartu kamarnya nomornya berbeda kamarnya tidak sebelahan 2 ketika saya datang sekitar jam 15:30 salah satu kamar yang akan saya tempati belum siap jadi saya harus menunggu sekitar 30 menit padahal waktu check masuk itu pukul 14.00 yang seharusnya ketika saya datang kamar saya sudah siap untuk ditempati 3 ac di 2 kamar yang saya pesan tidak dingin semoga review saya dibaca oleh pihak hotel sehingga akan lebih baik terima kasih,BUMN,Bintang 3,KHASMalioboroHotel (1),negative,Harga & Value for Money
aree gautama,2022,4,dulu pernah menginap saat masih pesonna setelah rebranding baru ini menginap lagi secara keseluruhan cukup menyenangkan menginap di sini staf membantu ramah ada kolam renang jadi anak2 suka hotelnya bersih kelengkapan kamar sih lengkap ada sikat gigi shower cap dll yang paling disukai keluarga saya selamat minumnya yang selalu siap teh hangat jahe hanya saja waktu sarapan menu itu2 saja bahkan kelengkapan salad seperti mayo tidak ada agak sulit memang untuk tidak membandingkan dengan merek sebelumnya kamarnya juga kecil sekali tapi karena lokasinya okelah untuk tinggal singkat,BUMN,Bintang 3,KHASMalioboroHotel (1),positive,Kebersihan & Kenyamanan Kamar
Khaira Aini iswara,2025,5,tempat nyaman dekat dengan pusat perbelanjaan beringinharjo dekat dengan transportasi umum menjadi pelayanan di resepsionis dan resto sudah baik terus ditingkatkan,BUMN,Bintang 3,KHASMalioboroHotel (1),positive,Kualitas Makanan & Restoran
Farelya Andwiana,2025,5,hotel dengan pelayanan yang sangat memuaskan makanan enak kamar sesuai ballroom berfungsi dengan baik dan nyaman untuk kegiatan pertemuan,BUMN,Bintang 3,KHASMalioboroHotel (1),positive,Kebersihan & Kenyamanan Kamar
Aries Setyo Leksono,2025,5,Pelayanannya 100 oke banget ada keluahan langsung ditanggapi dan teratasi membanggakan sekali ada hotel dengan pelayanannya sebaik dan seramah ini semoga sukses salam dari kamar 215,BUMN,Bintang 3,KHASMalioboroHotel (1),positive,Pelayanan Staf & Keramahan
Yedida Adi,2025,5,Salah satu hotel termurah yang dekat dengan malioboro pelayanan sangat bagus cepat dan ramah untuk keadaan kamar menurut saya kurang nyaman mohon ditambah peredam lagi karena pada malam hari aktivitas di kamar sebelah sangat terdengar jelas tempat parkir juga menurut saya kurang luas,BUMN,Bintang 3,KHASMalioboroHotel (1),positive,Kebersihan & Kenyamanan Kamar
Rafka Aditya,2025,5,kamar luas kasur besar dapat sarapan lumayan enak 100 kembali lagi,BUMN,Bintang 3,KHASMalioboroHotel (1),positive,Kebersihan & Kenyamanan Kamar
lu'lu Marjan,2024,5,lokasi dekat sekali dengan malioboro kamar bersih rapi karyawan ramah ada teh jahe di lobi secara keseluruhan oke sayangnya lantai kamar mandi terlalu licin semoga bisa ditambah karpet lantai agar lebih aman bagi anak dan lansia,BUMN,Bintang 3,KHASMalioboroHotel (1),positive,Kebersihan & Kenyamanan Kamar
Novia Luciana,2025,5,Oke sarapan enak untuk kelas hotel bintang 3 maaf tidak ada foto bangunan,BUMN,Bintang 3,KHASMalioboroHotel (1),positive,Kualitas Makanan & Restoran
Lia Nurul Latifah,2024,4,Ini menilai kamar dari iftar ya bukan kamar tidurnya kamar buat makan ada di aula bukan di restonya jadi terasa seminar gitu makanannya lumayan tapi kemarin ada beberapa yang habis dan tidak di restok ada juga santan yang rasanya agak asam di salah satu menuunya,BUMN,Bintang 3,KHASMalioboroHotel (1),positive,Kualitas Makanan & Restoran
Hernemsih Hernemsih,2025,5,untuk kamar kebersihan nya sudah baik untuk makanan enak semuanya dan bervariasi untuk pelayanan ramah,BUMN,Bintang 3,KHASMalioboroHotel (1),positive,Kebersihan & Kenyamanan Kamar
Alya Nashar,2025,5,lokasi strategis pelayanan baik murah senyum pegawainya cepat respon jika ada masalah di kamar pekerjaan baik kak putri,BUMN,Bintang 3,KHASMalioboroHotel (1),positive,Pelayanan Staf & Keramahan
Triya Anggarika,2023,5,Alhamdulillah saya dapat kamar meskipun kamarnya agak kecil tapi nyaman untuk istirahat tersedia mukena sajadah dan juga al qur an jarang2 hotel lain menyediakan peralatan ibadah umat muslim ini arah kiblat juga jelas tidak perlu bingung2 lagi cari arah kiblat untuk ranjang selimut dan bantal nyaman juga terbukti saya tidurnya nyenyak dan bangun jadi kesiangan jika ingin membuat kopi atau teh tersedia alat dan bahannya jadi bangun tidur bisa langsung ngopi ataupun ngeteh ac nya dingin tidak ada masalah untuk kamar mandi bersih tersedia udara hangat dan dingin lokasi dekat dengan malioboro dan pasar hotel pringharjo tinggal jalan kaki saja saja dah nyampe,BUMN,Bintang 3,KHASMalioboroHotel (1),positive,Kebersihan & Kenyamanan Kamar
noventius geovani edison,2025,4,dekat dari malioboro sekitar 300 meter,BUMN,Bintang 3,KHASMalioboroHotel (1),positive,Harga & Value for Money
Caca Witarsa,2025,5,Sangat nyaman dan letak hotel strategis pelayanan nya sangat baik dan ramah keramahan nya oke sangat senang bisa menginap di hotel ini biasanya,BUMN,Bintang 3,KHASMalioboroHotel (1),positive,Lokasi & Akses Strategis
Rahmina Puspa,2023,5,bagus sekali dekat dengan masjid dekat gereja kantor kodim dan polres keamanan terjamin letak di belakang jl malioboro jadi tidak ribut banyak tempat wisata belanja bisa jalan kaki asal kuat pakai gmap saja makanan rasanya lumayan lah bintang 4 makan n cuci agak mahal kali ya namanya juga hotel tapi di sekitar banyak tempat makan ko kalau pesan yang gratis sarapan variasi nya banyak pokonya kenyang pelayanan baik selalu ramah kamar cukup luas dan bersih fasilitas gratis cuma pencahayaan agak remang sedikit lampupunya cocok buat buat bulan madu murmer atau wisata keluarga,BUMN,Bintang 3,KHASMalioboroHotel (1),positive,Kebersihan & Kenyamanan Kamar
venomonsta,2025,5,harga kompetitif ruangan sangat bersih,BUMN,Bintang 3,KHASMalioboroHotel (1),positive,Kebersihan & Kenyamanan Kamar
Lael Victoria,2021,4,Hotel ini terletak dekat Malioboro jadi cocok untuk orang yang ingin menjelajahi dan pergi berbelanja untuk barang yogyakarta masuk covid 19 kondisi hotel ini menunjukkan bahwa mereka membersihkan kamar dengan disinfektan jadi saya cukup berani untuk tinggal di sini tapi satu hal telah mengganggu saya mandi itu memiliki kaca tapi tidak sepenuhnya ditutupi sehingga lantai selalu basah tapi itu bukan masalah serius kita bisa menghapus itu off layanan juga sangat baik sangat ramah hotel ini berlokasi di dekat Malioboro sehingga sangat cocok untuk wisatawan yang ingin melihat dan berbelanja oleh2 kota yogyakarta dalam situasi,BUMN,Bintang 3,KHASMalioboroHotel (1),positive,Kebersihan & Kenyamanan Kamar
Adi Prakosa,2020,3,kelebihan hotel ini sepertinya hanya dekat dengan menu sarapan malioboro oke saja tidak terlalu istimewa tapi cukup buat saya beberapa masalah menurut saya yang tinggal 2 malam disini 1 kamar samar bau tidak enak sepertinya dari lubang wastafel kamarmandi sudah minta di semprot pewangi tapi masih bau jika kamarmandi dibuka lama 2 hari 1 walaupun sudah dipasang tanda privasi tv sengaja dinyalakan rumah tangga masuk bersih dan kamar tetap saya hanya tinggal sebentar sarapan padahal ada laptop dan barang pribadi yang masih ada dimeja kamar 3 hari 2 walaupun sudah dipasang tanda privasi rumah tangga tetap mencoba masuk karena berkali-kali kartu pintu kamar seperti ada yang tap bunyi saya,BUMN,Bintang 3,KHASMalioboroHotel (1),positive,Kebersihan & Kenyamanan Kamar
Imam sulistyo,2024,3,hotel yang aneh untuk mengambil deposit kamar saja procurnya berbelit2 menunggu di tunggu di tunggu dikirimi surat pernyataan harus melalui transfer sampai malam baru pun tidak ada pemberitahuan yang dikirim mau mengambil uang kita saja koq susah pelayanan membuat adek saya yang menginap di kamar 506 dan 502 kmaren tidak nyaman padahal mreka menginap selama 5 hari mhn manajemen bisa mempertimbangkan hal di atas,BUMN,Bintang 3,KHASMalioboroHotel (1),negative,Harga & Value for Money
febri arianto notonegoro,2025,5,strategis dekat malioboro jalan kaki enggak jauh dekat sama ole ole juga,BUMN,Bintang 3,KHASMalioboroHotel (1),positive,Lokasi & Akses Strategis
meiyana wardani,2025,1,Ini resepsionis hotel nya tidak merespon sya nitip oleh2 buat tamu tapi ketika kamu cari oleh2 itu di resepsionis bilang tidak ada barangnya padahal ada bukti dri pergi makanan nya,BUMN,Bintang 3,KHASMalioboroHotel (1),negative,Harga & Value for Money
Matt Surabaya,2024,5,hotelnya dekat dengan pusat keramaian di yogyakarta kamarnya juga nyaman keramahan disini juga sangat ramah dan bikin betah selalu ramai di hari hari penghujung akhir pekan apalagi libur panjang hari ini adalah hari terakhir kami di sini setelah tiga malam menikmati tidur nyenyak untuk melakukan kegiatan di pagi sampai malam daerah yogyakarta sangat dianjurkan bagi kalian yang sedang mencari tempat bermalam,BUMN,Bintang 3,KHASMalioboroHotel (1),positive,Kebersihan & Kenyamanan Kamar
My Safitri,2023,3,posisi dalam geng bersih nya lumayan layanan minta di kamar membersihkan tpi tidak di membersihkan minta plastik cuci suruh bayar 10rb kamar tidak ada peredam suara aktifitas kamar sebelah terdengar,BUMN,Bintang 3,KHASMalioboroHotel (1),positive,Kebersihan & Kenyamanan Kamar
Jeff Stons,2022,3,Tidak seperti harapan saya ttg hotel ini seperti rating yang ada mulai dari masuk parkir suasana dan kondisi gedung hotel biasa saja dan nampaknya bth didekorasi ulang agar terlihat menu segar makan pagi sgt standar dan rasa masakan masih bisa dikatakan kurang mantap dilidah cenderung rasa baru kacau keramahan pegawai terkesan kurang tulus hanya sbg kewajiban unt senyum fasilitas kamar normal saja,BUMN,Bintang 3,KHASMalioboroHotel (1),negative,Kualitas Makanan & Restoran
Amin Hariono,2024,1,Sabtu 18 Februari 23 cek masuk kamar mewah sehari sebelumnya 17 Februari 23 Pkl 05 30 telepon minta katil ganda yang menerima telepon cowok minta katil ganda saat cek masuk koq katanya katil kembar dan ternyata permintaan kami tidak disampaikan terpaksa menunggu untuk digabungkan katil kembar mjd double tlg diperbaiki komunikasinya sudah lelah mau istirahat harus menunggu lama,BUMN,Bintang 3,KHASMalioboroHotel (1),negative,Harga & Value for Money
RIDHO ARIFUDIN,2025,5,kamar bagus lokasi juga deket dengan wisata lainnya mungkin fasilitas tv perlu disetting ulang,BUMN,Bintang 3,KHASMalioboroHotel (1),positive,Lokasi & Akses Strategis
Syahru Ramadhan,2025,4,pelayanan ramah lokasi dekat sekali dengan jl malioboro sarapannya enak lengkap,BUMN,Bintang 3,KHASMalioboroHotel (1),positive,Kualitas Makanan & Restoran
Shakti Santoso,2022,5,lokasi pesonna hotel malioboro sangat bagus sangat dekat dengan ngejaman mirota batik pusat bakpia pasar pathuk dan ramai mall pelayanan oke kebersihan oke kelengkapan di dalam kamar oke parkir juga oke sayangnya tidak ada kolam renang di hotel sebagus ini jadi jika untuk menginap bawa anak kecil yang demen air utama harus pesan kamar yang ada mandi up nya d secara keseluruhan bagus n dianjurkan sih ini hotel,BUMN,Bintang 3,KHASMalioboroHotel (1),positive,Kebersihan & Kenyamanan Kamar
Arin Ningsih,2024,5,ac sempat bocor begitu komplain langsung dilayani sama teknisinya kebetulan tinggal selama 2 malam pagi sekitar jam 8 rumah menjaga membersihkan kamar dan mengganti perlengkapan kamar mandi pelayanan yang ramah kebersihan kamar,BUMN,Bintang 3,KHASMalioboroHotel (1),positive,Kebersihan & Kenyamanan Kamar
didy P,2021,4,menginap 8 malam sudah 5 hari menginap seperti yang sudah di review rasa masakan dan variasi cemilan yang oke ternyata lama tinggal di hotel ini punya pengalaman yang menyenangkan nice services wifi bagus kemudian dari staf hotel saat sarapan mendapat kopi dari mesin kopi yang rasanya tidak kalah nikmat dengan barista tanpa gula lebih nikmat lagi dicampur susu segar yang tersedia untuk kamar uniknya ada ruang untuk sholat dari lantai kayu sehingga cukup nyaman untuk duduk tidak dingin jika Anda beruntung dilantai yang tinggi dan menghadap ke pemandangan titik nol yogya akan betah menyejukkan,BUMN,Bintang 3,KHASMalioboroHotel (1),positive,Kualitas Makanan & Restoran
Syaiful Anies,2023,3,kamarnya lumayan luas harganya masih masuk di kantong tempatnya nyaman prokes bersih angkat nya cepat naik turun nya tersedia takjil dan sahur bagi yang menjalankan ibadah puasa air panas nya juga tersedia ac kamar nya juga dingin,BUMN,Bintang 3,KHASMalioboroHotel (1),positive,Kebersihan & Kenyamanan Kamar
thalia putri,2024,4,untuk makanan di hotel ini enak dan bervariatif untuk kamar cukup luas tenang dan bersih minus pengering rambut harus pesan dulu secara keseluruhan oke banget,BUMN,Bintang 3,KHASMalioboroHotel (1),positive,Kebersihan & Kenyamanan Kamar
dheahappy pangestu,2024,4,menginap di khas dengan harga yang lumayan tinggi soalnya deket pusat kota sih sudah ke 4 ini saya menginap di hotel khas malioboro di acara kerja pelayanan saya masih cukup bagus ramah dan murah senyum tapi sayang keamanan atas nama sarip atau siapa agak lupa itu sudah naik padahal dulu saya di bantu tengah malam untuk cari makanan yang recomend di jogja,BUMN,Bintang 3,KHASMalioboroHotel (1),positive,Pelayanan Staf & Keramahan
ikhsan mustofa,2025,5,bagus pelayanannya ramah2 supel cekatan untuk sarapan enak dan pilihan banyak dianjurkan kalau yang mau liburan,BUMN,Bintang 3,KHASMalioboroHotel (1),positive,Pelayanan Staf & Keramahan
Parama Wida Nugrahanti,2023,5,Suka banget masuk pertama kali langsung jatuh cinta dengan selamat minumnya juara banget teh sereh lemon disajikan dingin ada stan batik anak anak bisa belajar membatik harga pun terjangkau mbok yang ngajarin batik telaten banget bikin anak ketagihan membatik menu sarapan cukup bervariasi kamar n layanan oke,BUMN,Bintang 3,KHASMalioboroHotel (1),positive,Harga & Value for Money
Mercilessgnome,2023,5,Pelayanannya bagus ramah hotelnya bersih di setiap kamar disediakan alat sholat dan tempat sholat kamar mandi di dalam kamar juga sangat bersih ketika ada mengeluh ditangani dengan cepat ex ac bocor sarapan di hotel ini masakannya enak dan beragam apalagi jamu yang disediakan,BUMN,Bintang 3,KHASMalioboroHotel (1),positive,Kebersihan & Kenyamanan Kamar
Bambang Harianto,2025,5,nyaman dan tenang pelayanan ramah,BUMN,Bintang 3,KHASMalioboroHotel (1),positive,Pelayanan Staf & Keramahan
Ika Rianingsih,2025,4,parkir dan keamanan oke pelayanan sangat ramah menu makan pagi banyak variannya kamar bersih mau ke malioboro sangat dekat dan tinggal jalan kaki,BUMN,Bintang 3,KHASMalioboroHotel (1),positive,Kebersihan & Kenyamanan Kamar
Pratiwi Harditama,2024,5,nyaman sih nginep 1 malam di sini walaupun saat pertama2 air kamar mandi nya panas terus dah di stel ttep saja panas tapi lebih dari semua bagus pelayanan nya staf nya juga ramah2 menu sarapan strand2 saja paling suka menu soto bangkong nya pesen lewat room service porsinya lebih banyak ketimbang makan di area restoran nya mau jalan ke malioboro juga g jauh2 banget semoga bisa menginap di sini lagi bisa bisa kamar yang view nya bisa lihat kedepan hotel,BUMN,Bintang 3,KHASMalioboroHotel (1),positive,Pelayanan Staf & Keramahan
Erviana Hamidi,2024,2,1 handuk sudah tidak layak pakai 2 seprai kotor bau apek 3 bantal slimut bau apek 4 ac bocor 5 mandi tidak nyala 6 flapon sudah digunakan dan jelek 7 kucing tembok pada nglupas 8 cek masuk jam 14.00 baru bisa masuk kamar jam 14.45 padahal sudah konfirmasi kedatangan jam 13.00 via tel 9 jam 11.00 sudah di tel ingatkan untuk co,BUMN,Bintang 3,KHASMalioboroHotel (1),negative,Infrastruktur (AC/WiFi/Parkir/Air)
Eko S,2024,2,Sebelum kesini saya nginap di khas Semarang dan saya kasih bintang 5 buat khas Semarang hotel bersih pelayanan oke banget sarapan nya enak dan variatif banget banget udah ada kolam renang baru rekomended buat anak2 untuk khas di malioboro ini saya kasih bintang 2 saja karena pelayanannya dibawah standar respon petugas di restorannya lambat banget pesan omlet sampai selesai makan tidak datang2 ditanya jawabannya sebentr ya pak hotel relatif tua dengan harga segini masih bisa mendapatkan hotel yang lebih bagus hotel minus kolam terakhir hotel ini tidak ramah buat keluarga yang bawa anak2 5 thn tidak rekomended buat anak2 semoga membantu,BUMN,Bintang 3,KHASMalioboroHotel (1),negative,Fasilitas Hotel (Kolam/Gym/Spa)
Eko Yunanto,2022,5,menginap 2 malam di hotel ini sangat berkesan dengan pelayanan para stafnya yang ramah tampa uang deposit tapi saat kita cek keluar diminta menunggu sebentar untuk memeriksa kamar sampai minuman milik anak tertinggal saja diambilkan oleh petugasnya tempatnya pun cukup stategis jika ada kesempatan akan kembali lagi untuk menginap di sana,BUMN,Bintang 3,KHASMalioboroHotel (1),positive,Pelayanan Staf & Keramahan
Surya Gara,2025,5,lokasi strategis deket banget sama titik nol malioboro sarapannya juga enak pelayan di restonya juga ramah dan cekatan,BUMN,Bintang 3,KHASMalioboroHotel (1),positive,Kualitas Makanan & Restoran
afriano 22,2024,1,Tidak pengering rambut dikamar beberapa hari bermalam disini setiap minta bilangnya sudah habis anjir emangnya 1 hotel cuma punya berapa sih kok tidak pernah ada,BUMN,Bintang 3,KHASMalioboroHotel (1),negative,Kebersihan & Kenyamanan Kamar
Dwi Nur Rohman,2021,5,untuk pesonna hotel malioboro hotelnya keren akses menuju malioboro dan nol km deket banget bisa jalan kalau tidak capek cuma mungkin kalau baru awal di jogja akan bingung sama jalan satu arahnya untuk kamarnya nyaman banget acnya dingin kamar mandinya bersih ada udara panasnya nyala enak buat mandi untuk harga lagi banyak promo bulan juli kemarin jadi nginep deh untuk istri kenceng fonya ramah hotelnya terlihat modern casual saja tapi nyaman ow iya ikuti ig aku yak gengs rohman dwinur,BUMN,Bintang 3,KHASMalioboroHotel (1),positive,Kebersihan & Kenyamanan Kamar
eko vero,2025,5,sarapan nya enak banyak macamnya tempat nyaman pelayanan mb friska dan tim ramah,BUMN,Bintang 3,KHASMalioboroHotel (1),positive,Pelayanan Staf & Keramahan
Local Lens,2023,1,mencoba hotel untuk pertama kalinya langsung pengalaman buruk masuk kamar sudah panas komplain pertama jam 9 malam dicek katanya kurang freon acnya teknisinya menambah eh masih panas saya tunggu sampai jam 12 malam masih panas komplain lagi teknisi datang dicek dalamnya abis itu teknisi hotel ini berpesan saya cek di luarnya selang 2 jam tidak kembali tidak mengkonfirmasi apa pun saya bisa kasus dihotel ini kacau tidak akan kembali ke sini dari fo hingga teknik menutup sengaja mata akan masalah ini saya sungguh sayangkan untuk hotel ini bisa memberikan layanan hancur begini,BUMN,Bintang 3,KHASMalioboroHotel (1),negative,Infrastruktur (AC/WiFi/Parkir/Air)
niken putriyana,2023,5,beruntung banget masih kebagian kamar di hotel ini saat akhir pekan yang padet det det det banget haha kami telat cek masuk tnpa pemberitahuan untung resepsionisnya memahami soalnya memang perjalanan ke jogja macet parah kebagian kamar d lantai 3 pemandangannya uda lumayan cantik masih penasaran sama pemandangan di lantai 8 9 sih insyaallah perjalanan berikutnya untuk rasa masakannya khas jogja banget yaitu cenderung manis bagi saya yang orang semarangan yang cenderung jadi kurang saat tapi oke atas semua sangat bagus sih hotel khas malioboro ini,BUMN,Bintang 3,KHASMalioboroHotel (1),positive,Kualitas Makanan & Restoran
Rika Amelina,2022,5,Lima hari tinggal di pesonna puas dengan pelayanannya setiap hari kamar dibersihin kamar dengan tarif paling murah udah ada kulkas mininya air panas joss ac dingin kasur dan bantal nyaman saluran tv dan wifi lancar banget lokasi strategis banget di belakang jalan malioboro di depan hotel juga ada becak hotel yang siap nemenin muter2 dengan tarif 20 25 rb,BUMN,Bintang 3,KHASMalioboroHotel (1),positive,Kebersihan & Kenyamanan Kamar
Kertati Sumekar,2024,5,kamar biasa saja mininalis letaknya dekat dengan malioboro akses jalan kaki dibelakang ramai swalayan hanya akses masuk hotel jalan sempit dan sangat ramai padat karena melewati jalan jalan jalanok yang luar biasa padat,BUMN,Bintang 3,KHASMalioboroHotel (1),positive,Lokasi & Akses Strategis
Tiny Shen,2023,5,pertama kali menginap di hotel khas malioboro front desk sangat membantu kita komplen ac bocor langsung ditangani saat itu juga mantap lokasi juga deket dengan teras 1 malioboro jalan kaki 5 menit sudah sampai untuk kamar emang sedikit sempit tapi secara keseluruhan oke kebersihan juga oke hanya saja agak tidak kedap suara ya suara orang dari ujung lorong masih terdengar jelas dari kamar teruskan pekerjaan baik Anda,BUMN,Bintang 3,KHASMalioboroHotel (1),positive,Kebersihan & Kenyamanan Kamar
