User Name,Review Time,Rating,clean_text,Tipe,Kelas,Nama_Hotel,AI_Sentiment,AI_Aspek
bayu fajar,2023,4,Pelayanan ramah dan fasilitas lumayan bagus dekat dengan bringharjo dan teras malioboro 1 semoga bisa kesini lagi,BUMN,Bintang 3,KHASMalioboroHotel (1),positive,Lokasi & Akses Strategis
Sari Rochmawati,2018,4,Baru sekali saya mengunjungi hotel ini kesan yang saya peroleh dari hotel ini adalah hotel ini cukup baik nyaman ada mushola di dekat ruang pertemuan,BUMN,Bintang 3,KHASMalioboroHotel (1),positive,Kebersihan & Kenyamanan Kamar
Rth,2018,5,lokasi dekat malioboro suasananya tenang hotel juga bersih ruangan besar dan terdapat perlengkapan sholat lengkap tambah alquran ditiap kamar,BUMN,Bintang 3,KHASMalioboroHotel (1),positive,Kebersihan & Kenyamanan Kamar
EVERY GREEN,2022,4,hotelnya dekat stasiun jogja malioboro sarkem dan titik nol jojga tempatnya bersih pelayanannya bagus,BUMN,Bintang 3,KHASMalioboroHotel (1),positive,Lokasi & Akses Strategis
Sulistyo Rini,2019,4,Saya di sini dalam rangka acara dari pegadaian untuk kamar saya untuk makanan enak untuk istirahat kopi menu saya kopinya yang tidak enak,BUMN,Bintang 3,KHASMalioboroHotel (1),positive,Kualitas Makanan & Restoran
Gieya,2021,5,nyaman bersih dan yang penting ada al qur an dan seperangkat alat sholat semoga berkah,BUMN,Bintang 3,KHASMalioboroHotel (1),positive,Kebersihan & Kenyamanan Kamar
KYOTO HAMASAKI,2022,5,bagus saat waktu nginap lupa tidak di beresin ranjang sama pihak hotel jadi ya mengeluh sedikit,BUMN,Bintang 3,KHASMalioboroHotel (1),negative,Kebersihan & Kenyamanan Kamar
michael ricardo,2025,5,Untuk bintang 3 hotel ini lokasi sangat strategis untuk sarapan luar biasa,BUMN,Bintang 3,KHASMalioboroHotel (1),positive,Lokasi & Akses Strategis
Alacarte,2019,5,Pelayanan resepsionis yang berbeda dari hotel hotel lain membuat hotel ini cocok buat tempat penginapan favoritmu nih,BUMN,Bintang 3,KHASMalioboroHotel (1),positive,Pelayanan Staf & Keramahan
fella sary hardi,2020,4,sedih liat handuknya kaya handuk lama banget aga brodol gitu jenis makanan tidak terlalu banyak dan menurutku kurang enak,BUMN,Bintang 3,KHASMalioboroHotel (1),negative,Kualitas Makanan & Restoran
Wiwik Andika,2023,5,tempat nya bersih pelayanan hanya variasi makanan nya banyak murah dekat dari pusat oleh oleh,BUMN,Bintang 3,KHASMalioboroHotel (1),positive,Kualitas Makanan & Restoran
Askah Raif,2024,5,ac nya agak rusak sedikit jika kesini wajib banget pemandangan nya indah dan berkesan mewah,BUMN,Bintang 3,KHASMalioboroHotel (1),positive,Harga & Value for Money
M. Taufik Ritonga,2022,5,sarapannya enak kamarnya bagus kurangnya tidak ada lemari baju layanannya bagus dekat k malioboro,BUMN,Bintang 3,KHASMalioboroHotel (1),positive,Kebersihan & Kenyamanan Kamar
Boyke S,2021,5,kami sekeluarga menginap di hotel pesona karena menerapkan protokol covid19 juga karyawannya sangat ramah dan sangat dekat dengan malioboro,BUMN,Bintang 3,KHASMalioboroHotel (1),positive,Pelayanan Staf & Keramahan
Lana Unwanah,2024,4,Parkiran luas makanan lumayan enak ruang pertemuan ckp nyaman,BUMN,Bintang 3,KHASMalioboroHotel (1),positive,Kualitas Makanan & Restoran
Wahyu Rizky Andhifani,2025,5,strategis dekat dari malioboro tinggal jalan,BUMN,Bintang 3,KHASMalioboroHotel (1),positive,Lokasi & Akses Strategis
Marwah Berliana,2025,5,makanannya enak dan pelayanan baik terimakasih mas rully,BUMN,Bintang 3,KHASMalioboroHotel (1),positive,Kualitas Makanan & Restoran
L HAKIM,2021,5,Pernah bikin acara di sini ada barang yang ketinggal trus hub mas agung buat cariin ketemu trus dianter sampai ke kantor salut banget,BUMN,Bintang 3,KHASMalioboroHotel (1),positive,Pelayanan Staf & Keramahan
djovie channel,2023,5,Tempat yang nyaman untuk beristirahat dan bisa jg untuk pertemuan karena aula baru cukup luas,BUMN,Bintang 3,KHASMalioboroHotel (1),positive,Lokasi & Akses Strategis
djoko priambodo,2022,5,petugas ramah kekeluargaan tidak kaku tarif resmi murah lingkungan depan korem dan polres parkir luas dekat malioboro dan nyaman buat menikmati hidup,BUMN,Bintang 3,KHASMalioboroHotel (1),positive,Pelayanan Staf & Keramahan
A Kristianto,2017,5,kamar cukup bersih makan pagi banyak pilihan menu daerah daerah tenang dan nyaman dekat dengan pusat malioboro,BUMN,Bintang 3,KHASMalioboroHotel (1),positive,Kebersihan & Kenyamanan Kamar
VadaAv,2019,5,tempatnya nyaman semua yang bisa dimakan buka puasa tapi kue yang tersedia sedikit makanannya enak,BUMN,Bintang 3,KHASMalioboroHotel (1),positive,Kualitas Makanan & Restoran
Sholay Virgo,2022,5,staf nya ramah hotel bersih prokes sangat di terapkan mantap dan di menyediakan alqur an di kamar terima kasih sukses terus,BUMN,Bintang 3,KHASMalioboroHotel (1),positive,Pelayanan Staf & Keramahan
Wahyu Paramma,2021,5,pelayanan ramah pembayaran mudah fasilitas memuaskan otentik dengan nuansa jawa tengah dekat dengan pusat perbelanjaan malioboro dan pusat batik beringharjo yogyakarta,BUMN,Bintang 3,KHASMalioboroHotel (1),positive,Lokasi & Akses Strategis
Tri edi Kurniawanto,2020,4,tempat dekat banget dengan malioboro saat buat yang seneng belanja dan nongkrong2 buat yang ingi nginap pusat jogja dengan anggaran yang minim dianjurkan banget,BUMN,Bintang 3,KHASMalioboroHotel (1),positive,Lokasi & Akses Strategis
Amira,2019,5,hotelnya bersih di setiap kamar ada ruang untuk sholat makanannya lumayan enak,BUMN,Bintang 3,KHASMalioboroHotel (1),positive,Kebersihan & Kenyamanan Kamar
Ana Nurfitriana,2022,3,lumayan lah deket ke malioboro cuma kamarnya gelap udara di kamar mandinya tiba tiba panas setelah beberapa lama dinyalain,BUMN,Bintang 3,KHASMalioboroHotel (1),positive,Lokasi & Akses Strategis
sulis setiani,2020,5,kamar nyaman dan bersih pelayanannya juga baik dekat dengan malioboro juga senang sekali bisa bermalam di sini,BUMN,Bintang 3,KHASMalioboroHotel (1),positive,Kebersihan & Kenyamanan Kamar
Christina Titien,2018,5,tempatnya strategis dalam pusat kota dekat kawasan malioboro dn kraton pelayanannya memuaskan,BUMN,Bintang 3,KHASMalioboroHotel (1),positive,Lokasi & Akses Strategis
Mira Bafagih,2020,5,kamar nya bersih lengkap dah ada mukena sajadah alquran saraapn nya oke,BUMN,Bintang 3,KHASMalioboroHotel (1),positive,Kebersihan & Kenyamanan Kamar
Derry Setiadi Nugraha,2019,3,hotelnya nyaman sih cuman saya ke ganggu sama suara mesin genset yang berisik dari luar,BUMN,Bintang 3,KHASMalioboroHotel (1),negative,Fasilitas Hotel (Kolam/Gym/Spa)
Ummu Hamidan Anna,2020,2,Tidak cocok klo untuk liburan kluarga hanya menyewakan kamar saja tidak ada fasilitas apapun,BUMN,Bintang 3,KHASMalioboroHotel (1),negative,Harga & Value for Money
malang traveling,2020,5,hotel yang merekomendasikan banget bersih nyaman dan pelayanan cepat menu resto juga terbaik deket dengan malioboro,BUMN,Bintang 3,KHASMalioboroHotel (1),positive,Kebersihan & Kenyamanan Kamar
raditya herlambang,2019,3,kamar kurang luas tempat sebenarnya strategis dekat malioboro cm terlalu sepi,BUMN,Bintang 3,KHASMalioboroHotel (1),positive,Lokasi & Akses Strategis
Emi Sudarwati,2019,5,Hotel ini sangat nyaman harganya juga murah meriah tapi pelayanannya bak hotel bintang lima,BUMN,Bintang 3,KHASMalioboroHotel (1),positive,Harga & Value for Money
FIRDAUS Kurniawan 2010,2019,4,bagus dan bersih hanya saja di lantai paling atas berisik suara angkat dan sering mati lampu,BUMN,Bintang 3,KHASMalioboroHotel (1),positive,Kebersihan & Kenyamanan Kamar
Dewi Sardi,2022,5,hotelnya menerapkan protokol kesehatan menginap pun jadi merasa aman dianjurkan,BUMN,Bintang 3,KHASMalioboroHotel (1),positive,Kebersihan & Kenyamanan Kamar
Feri Hendriyas,2020,5,hotel modern nyaman untuk beristirat bersama keluarga selain itu dekat dengan pasar beringharjo tinggal jalan kaki doang bisa sepuasnya main di malioboro,BUMN,Bintang 3,KHASMalioboroHotel (1),positive,Lokasi & Akses Strategis
Nyonya Meneer,2025,5,sarapan nya cukup variatif staf ramah,BUMN,Bintang 3,KHASMalioboroHotel (1),positive,Pelayanan Staf & Keramahan
isda siregar,2024,5,pekerjanya ramah ramah baik itu saat bawa koper menyusuri tangga atau saat sarapan,BUMN,Bintang 3,KHASMalioboroHotel (1),positive,Pelayanan Staf & Keramahan
RUDY THOMAS,2023,5,keamanan sangat ramah cepat tanggap staf hotel jg ramah semua kebersihan oke cocok untuk keluarga dekat ke malioboro,BUMN,Bintang 3,KHASMalioboroHotel (1),positive,Pelayanan Staf & Keramahan
Serba Serbi,2023,4,kamar bersih makanan cukup oke pelayanan kebersihan oke suasana lingkungan juga oke,BUMN,Bintang 3,KHASMalioboroHotel (1),positive,Kebersihan & Kenyamanan Kamar
Linna lee,2018,4,tempatnya kecil tapi cukup nyaman terutama untuk yang ingin berwisata ke malioboro jalan kaki saja sampai,BUMN,Bintang 3,KHASMalioboroHotel (1),positive,Lokasi & Akses Strategis
roemah coklat,2019,5,hotelnya nyaman dan bagus dkat dri pasar beringinharjo cukup jalan2 kaki atau naik becak,BUMN,Bintang 3,KHASMalioboroHotel (1),positive,Lokasi & Akses Strategis
Nu'man Jamil,2020,4,Lokasinya dekat dari malioboro tepatnya dibelakang ramai mall pelayanannya bagus tapi parkir motornya tidak ada atap mungkin perlu perhatian khusus,BUMN,Bintang 3,KHASMalioboroHotel (1),positive,Lokasi & Akses Strategis
Warsino Ino,2022,5,bersih wangi reservasi cepat 300m jalan kaki sudah sampai malioboro parkir luas pelayanan oke bngt,BUMN,Bintang 3,KHASMalioboroHotel (1),positive,Kebersihan & Kenyamanan Kamar
adza attabrizhy,2022,3,untuk teman2 yang wisata sekitaran malioboro nyari hotel khas hotel solusinya tempat strategis nyaman,BUMN,Bintang 3,KHASMalioboroHotel (1),positive,Lokasi & Akses Strategis
Rahayu Endah Pertiwi,2020,5,tempat nya nyaman dan bersih sarapannya juga enak2 kemarin liburan juga dpt hadiah kejutan,BUMN,Bintang 3,KHASMalioboroHotel (1),positive,Kebersihan & Kenyamanan Kamar
Vanny Scarlett,2019,4,parkirannya sangat sempit tidak disediakan sampo di setiap kamar pelayanan cukup baik,BUMN,Bintang 3,KHASMalioboroHotel (1),negative,Kebersihan & Kenyamanan Kamar
Dee Property,2019,4,parkir luas pelayanan memuaskan pegawai ramah tapi sayangnya tidak ada kolam renang,BUMN,Bintang 3,KHASMalioboroHotel (1),positive,Pelayanan Staf & Keramahan
Mona Corry,2022,1,parah sih ini cuma menang deket malioboro doang ac bocor mandi berisik banget tidak lagi kesini kapok,BUMN,Bintang 3,KHASMalioboroHotel (1),negative,Lokasi & Akses Strategis
Aditya N,2019,5,hotel terbaik di kota yogyakarta terletak di tengah kota tepatnya di sekitar malioboro dianjurkan kamarnya sarapannya lumayan mantap dan tarifnya juga kompetitif,BUMN,Bintang 3,KHASMalioboroHotel (1),positive,Kebersihan & Kenyamanan Kamar
Titien Arimsa,2023,4,Tempat yang nyaman strategis adalah makanan utama dari resep keamanan dan makanan utama yang ramah cukup bervariasi unggul di kelas,BUMN,Bintang 3,KHASMalioboroHotel (1),positive,Lokasi & Akses Strategis
Enny Nokawati,2021,4,Lokasinya dr sekali malioboro kondisi keseluruhan bersih makanannya enak dan harga kamar ckp terjangkau,BUMN,Bintang 3,KHASMalioboroHotel (1),positive,Kebersihan & Kenyamanan Kamar
Septi Lestari,2023,4,kamar bersih nyaman pelayanan ramah makanan enak dianjurkan,BUMN,Bintang 3,KHASMalioboroHotel (1),positive,Kebersihan & Kenyamanan Kamar
amri adityas,2019,3,disini cuma mencoba resto nya saja pelayannya yang namanya risikonya servis tamu nya sangat ramah soalnya temen sendiri haha kmrn mau mencoba menu sate taichan tapi salah order haha,BUMN,Bintang 3,KHASMalioboroHotel (1),positive,Pelayanan Staf & Keramahan
griyo jagalan,2020,5,Recommended hotel di sekitar kawasan malioboro hotel bersih dengan konsep halal bisa juga untuk sekedar makan siang atau makan malam sop buntutnya enak,BUMN,Bintang 3,KHASMalioboroHotel (1),positive,Kualitas Makanan & Restoran
Ahda Syamila Maulidiya,2021,5,fasilitas oke sesuai dengan harga pelayanan bagus cocok untuk acara2 makanan enak,BUMN,Bintang 3,KHASMalioboroHotel (1),positive,Harga & Value for Money
Agus Yusono,2018,4,hotel nyaman fasilitas memuaskan pasti aku sekeluarga datang lagi masuk shaa alloh,BUMN,Bintang 3,KHASMalioboroHotel (1),positive,Kebersihan & Kenyamanan Kamar
Muti alam,2019,5,Rekomendasi nginap disini staf ramah makanannya enak lokasi strategis bisa jalan kaki ke malioboro,BUMN,Bintang 3,KHASMalioboroHotel (1),positive,Pelayanan Staf & Keramahan
bunda athan,2023,5,kamar bersih ac dingin pelayanan sejauh ini bagus lah lokasi dekat dengan malioboro,BUMN,Bintang 3,KHASMalioboroHotel (1),positive,Kebersihan & Kenyamanan Kamar
dawud prasetyo,2019,4,hotel yang cukup nyaman n tenang untuk istirahat d tengah kota jogja lokasinya jg dekat malioboro,BUMN,Bintang 3,KHASMalioboroHotel (1),positive,Lokasi & Akses Strategis
tama putra,2020,4,hotel yang nyaman untuk daerah malioboro dengan anggaran yang standar makananya lumayan enak dan lengkap ruang pertemuannya lumayan bagus juga,BUMN,Bintang 3,KHASMalioboroHotel (1),positive,Kualitas Makanan & Restoran
I Wayan Andama Sindhuranu,2020,5,hotel yang nyaman dan pelayanannya luar biasa makananya juga enak meskipun pilihan menu tidak banyak,BUMN,Bintang 3,KHASMalioboroHotel (1),positive,Kualitas Makanan & Restoran
Zainul Octavian,2023,4,suasana nyaman saat pagi komplit dan enak dekat dengan malioboro,BUMN,Bintang 3,KHASMalioboroHotel (1),positive,Kebersihan & Kenyamanan Kamar
Yanti,2019,5,pelayanannya sangat ramah dan membantu hotelnya bagus lahan parkirnya juga luas strategis lokasinya,BUMN,Bintang 3,KHASMalioboroHotel (1),positive,Pelayanan Staf & Keramahan
Aditya Luthfi T,2021,5,enak cukup murah lokasi dr malioboro dapet upgrade gratis ke menu sarapan enak delicacy macam2,BUMN,Bintang 3,KHASMalioboroHotel (1),positive,Harga & Value for Money
Perdinan Nababan,2020,5,Lokasinya strategis dekat dengan pasar beringharjo bersih nyaman parkir bus dan mobil luas,BUMN,Bintang 3,KHASMalioboroHotel (1),positive,Lokasi & Akses Strategis
Sekar Galuh,2022,5,tempatnya nyaman sayangnya suara tetangga terdengar di kamar dan suara udara dari kamar mandi kamar sebelah ya terdengar jg,BUMN,Bintang 3,KHASMalioboroHotel (1),positive,Kebersihan & Kenyamanan Kamar
Stone Bahana,2021,4,parkir cukup luas untuk hotel sedikit di dalam keamanan ramah untuk pengemudi wisata,BUMN,Bintang 3,KHASMalioboroHotel (1),positive,Infrastruktur (AC/WiFi/Parkir/Air)
bambang aja,2021,3,tempatnya lumayan baik bagi yang suka merokok agak susah karena harus diluar hotel,BUMN,Bintang 3,KHASMalioboroHotel (1),positive,Lokasi & Akses Strategis
Derbya Anabella,2019,3,sarapannya enak dan bervariatif makanannya tapi kamarnya mudah masuk suara dari kamar sebelah,BUMN,Bintang 3,KHASMalioboroHotel (1),positive,Kualitas Makanan & Restoran
Archyuda Farchan,2019,5,kamar bersih dan rapih pegawai ramah parkir luas lokasi dekat dengan malioboro,BUMN,Bintang 3,KHASMalioboroHotel (1),positive,Kebersihan & Kenyamanan Kamar
Nafifah Rahmayanti,2024,5,Hotel anggaran bersih layak nyaman lokasi strategis juga mau kemana mana mudah,BUMN,Bintang 3,KHASMalioboroHotel (1),positive,Kebersihan & Kenyamanan Kamar
Sudiyo Bin Darum,2020,4,Cukup representatif parkir cukup luas lobi cukup luas,BUMN,Bintang 3,KHASMalioboroHotel (1),positive,Lokasi & Akses Strategis
Andra Hidayana,2018,5,hotelnya nyaman dekat dengan malioboro jalan kaki cuma 5 menit sudah sampai makanannya juga enak,BUMN,Bintang 3,KHASMalioboroHotel (1),positive,Lokasi & Akses Strategis
Brank Yudi,2021,3,ramah sigap petugasnya dan lumayan hotelnya sayang aksesnya harus mutar muter,BUMN,Bintang 3,KHASMalioboroHotel (1),positive,Pelayanan Staf & Keramahan
Achmad Jamaluddin,2019,3,Tempat strategis tapi sayang kamar kecil dan pembuangan udara di kamar mandi tidak lancar udara menggenang di kamar 212,BUMN,Bintang 3,KHASMalioboroHotel (1),negative,Lokasi & Akses Strategis
MILA SARUCI,2024,5,referensi untuk yang cari penginapan dipusat kota dekat dengan t4 tujuan wisata toko oleh2 t4 nongkrong dll,BUMN,Bintang 3,KHASMalioboroHotel (1),positive,Lokasi & Akses Strategis
Michael Subekti,2019,3,bagus bersih bebas ap rokok hanya pelayanan kurang baik tamu buka pintu masuk sendiri,BUMN,Bintang 3,KHASMalioboroHotel (1),negative,Kebersihan & Kenyamanan Kamar
Umar Sadik,2018,5,luar biasa pelayanan prima mantap rekomended untuk anda yang ingin nginap di kawasan malioboro,BUMN,Bintang 3,KHASMalioboroHotel (1),positive,Lokasi & Akses Strategis
Novita Putri,2019,3,nyaman bgtt d sini jadii pengen lagi ini ada foto pemandangan saat pagi hm enakk nyo,BUMN,Bintang 3,KHASMalioboroHotel (1),positive,Kebersihan & Kenyamanan Kamar
Arif Syarifudin,2021,5,staf sangat ramah dan membantu kamar bersih dan nyaman saluran tv oke terima kasih mbak dina resepsi sangat membantu,BUMN,Bintang 3,KHASMalioboroHotel (1),positive,Kebersihan & Kenyamanan Kamar
Muzariyan tomi,2024,4,kamarnya kelas amaris dan pop hotel menang strategis tempatnya,BUMN,Bintang 3,KHASMalioboroHotel (1),positive,Lokasi & Akses Strategis
Yunita Sari,2025,4,makanan enak beragam tempat juga nyaman buat buku,BUMN,Bintang 3,KHASMalioboroHotel (1),positive,Kebersihan & Kenyamanan Kamar
Saraswati Kirana Putri,2020,5,lokasi sangat dekat dengan malioboro tersedia ruang pertemuan yang nyaman dan hotel ini punya tagline halal,BUMN,Bintang 3,KHASMalioboroHotel (1),positive,Lokasi & Akses Strategis
Sandi permana,2025,5,hotel yang sangat dekat dengan kawasan malioboro yogyakarta saat dengan kantor kepresidenan yogyakarta,BUMN,Bintang 3,KHASMalioboroHotel (1),positive,Lokasi & Akses Strategis
Ign Suwandi,2024,3,kain sprei tidak bersih seperti belum diganti,BUMN,Bintang 3,KHASMalioboroHotel (1),negative,Harga & Value for Money
jemmy haris,2021,5,bersih nyaman stafnya ramah ramah lokasi cukup strategis tengah kota dekat dengan malioboro,BUMN,Bintang 3,KHASMalioboroHotel (1),positive,Kebersihan & Kenyamanan Kamar
Yusmin Sunardi,2019,5,nyaman buat transit menu makannya juga enak dan tempatnya oke banget deket jl malioboro,BUMN,Bintang 3,KHASMalioboroHotel (1),positive,Kualitas Makanan & Restoran
Kartu Cantik Pilihanku,2021,5,Viewnya keren kamarnya sederhana tapi nyaman banget pelayanan ramah dan responsif,BUMN,Bintang 3,KHASMalioboroHotel (1),positive,Kebersihan & Kenyamanan Kamar
MUHAMMAD RIZAL,2019,5,hotelnya nyaman dekat dengan tempat wisata dan kuliner jalan kaki saja sudah sampai malioboro,BUMN,Bintang 3,KHASMalioboroHotel (1),positive,Lokasi & Akses Strategis
pian sopian gunawan,2021,5,harga kompetitif pelayanan kamar ramah bersih dan nyaman dianjurkan banget dahh,BUMN,Bintang 3,KHASMalioboroHotel (1),positive,Kebersihan & Kenyamanan Kamar
Mega Arina,2025,1,kamar lumayan bersih tangan seperti sudah lama tidak diganti baru ac rusak tidak dingin cuma kipas sudah mencoba dibenerin tapi tetap ngga dingin karena konslet jadi listrik kamar sampai padam 2x tv jg kadang salah pesan 2 kamar dan sama minus semua ac ngga dingin,BUMN,Bintang 3,KHASMalioboroHotel (1),negative,Kebersihan & Kenyamanan Kamar
Nofriana Ulfha,2025,1,karena saya tidak jadi berangkat ke jogja tgl 24 oktober 2025 saya mengajukan pembatalan tapi di pihak tolak hotel dengan alasan tidak bisa dibatalkan sudah jelas di situ ada fitur pembatalan mengecewakan saja apalagi lewat aplikasi perjalanan com,BUMN,Bintang 3,KHASMalioboroHotel (1),negative,Infrastruktur (AC/WiFi/Parkir/Air)
Wildan Oktivan fauzan,2025,1,lain kali kalau persiapan buat cek masuk lebih gercep lagi,BUMN,Bintang 3,KHASMalioboroHotel (1),negative,Harga & Value for Money
Humam Nur,2025,1,pelayanan sarapan sangat buruk sudah sering menginap di hotel bintang 3 tapi kali ini pelayanannya parah banget pesan scramble telur setengah jam tidak selesai2 yang antri terakhir malah dikasih duluan sampai kembali 4x nanyain scramble nya tetap belum jadi sarapannya juga tidak lengkap sosis ayam goreng saja bahkan tidak ada nasi goreng sangat rasanya pakai bumbu instan kacau sarapan ini hotel tolong dievaluasi staf yang jaga di bagian telur pada tanggal 18 juli 2024 jam 07,BUMN,Bintang 3,KHASMalioboroHotel (1),negative,Kualitas Makanan & Restoran
Liena Hendra,2025,1,Saya kecewa sama hotel ini keamanan arogan parkir mobil di daerah hotel dilarang di mana kira2tamu hotel boleh parkir jika tidak daerah hotel dengan wajah tidak mengenakan dan sikap yang tak pantas jujur sangat kecewa pelayanan yang buruk keamanan dengan sikap yang sangat buruk dan arogan yang lupa nama ciri2kurus tinggi yang satu agak berisi badan nya 2securty yang g ada sopan santun nya jika tidak boleh parkir di daerah hotel parkir di mn hotel baru tamu,BUMN,Bintang 3,KHASMalioboroHotel (1),negative,Harga & Value for Money
El Marco,2024,1,hotel 3 tpi gayanya kyk 5 saya pesan pergi makanan sudah bayar cuma suruh nitip saja sulit sekali anak saya rewel tidak bisa di tinggal kata drivernya keamanan nya suruh buka jaket ojol baru boleh masuk nitip kalian ini anggep ojol apa kalian merasa lebih mulia dari ojol itu bisa seragam dan cuma nitip saja kok susah coba keamanan nya yang td di depan suruh buka seragam kira mau tidak ada lagi saya tinggal di sini hotel yang lain bnyk dan mudah untuk memesan online mereka menghormati sesama manusia bukan kyk hotel ini anggep sesama manusia kyk anggep binatang,BUMN,Bintang 3,KHASMalioboroHotel (1),negative,Harga & Value for Money
mia febiano,2023,1,sewa kamar untuk 3 orang dapet dengan harga 940rb permalam sewa 2malam dengan harga sgitu tidak dapet sarapan kondisi kamar sempit setiap klub hotel memang kamar sudah di rapikan tapi buat sarung bantal tidak di ganti ac juga bocor baru kali ini kecewa,BUMN,Bintang 3,KHASMalioboroHotel (1),negative,Kebersihan & Kenyamanan Kamar
Amin Hariono,2024,1,Sabtu 18 Februari 23 cek masuk kamar mewah sehari sebelumnya 17 Februari 23 Pkl 05 30 telepon minta katil ganda yang menerima telepon cowok minta katil ganda saat cek masuk koq katanya katil kembar dan ternyata permintaan kami tidak disampaikan terpaksa menunggu untuk digabungkan katil kembar mjd double tlg diperbaiki komunikasinya sudah lelah mau istirahat harus menunggu lama,BUMN,Bintang 3,KHASMalioboroHotel (1),negative,Harga & Value for Money
Local Lens,2023,1,mencoba hotel untuk pertama kalinya langsung pengalaman buruk masuk kamar sudah panas komplain pertama jam 9 malam dicek katanya kurang freon acnya teknisinya menambah eh masih panas saya tunggu sampai jam 12 malam masih panas komplain lagi teknisi datang dicek dalamnya abis itu teknisi hotel ini berpesan saya cek di luarnya selang 2 jam tidak kembali tidak mengkonfirmasi apa pun saya bisa kasus dihotel ini kacau tidak akan kembali ke sini dari fo hingga teknik menutup sengaja mata akan masalah ini saya sungguh sayangkan untuk hotel ini bisa memberikan layanan hancur begini,BUMN,Bintang 3,KHASMalioboroHotel (1),negative,Infrastruktur (AC/WiFi/Parkir/Air)
meiyana wardani,2025,1,Ini resepsionis hotel nya tidak merespon sya nitip oleh2 buat tamu tapi ketika kamu cari oleh2 itu di resepsionis bilang tidak ada barangnya padahal ada bukti dri pergi makanan nya,BUMN,Bintang 3,KHASMalioboroHotel (1),negative,Harga & Value for Money
afriano 22,2024,1,Tidak pengering rambut dikamar beberapa hari bermalam disini setiap minta bilangnya sudah habis anjir emangnya 1 hotel cuma punya berapa sih kok tidak pernah ada,BUMN,Bintang 3,KHASMalioboroHotel (1),negative,Kebersihan & Kenyamanan Kamar
Arthi Cepuri,2023,1,kakak saya menginap beberapa hari di hotel ini dan saya datang untuk ktmu kakak saya pelayanan kantor depan nya saat malam nol saya bertanya jika kamar letaknya dimana cuma di kasih tau sambil tidak berkunjung dan mengerjakan sesuatu tidak memerintahkan saya dia bilang lurus saja ada lift bisa langsung bintang 3 kok kayak gitu yaa saya juga bekerja di hotel dan tidak seperti itu pelayanannya hargai tamu layananenya diperbaiki kamarnya ac tidak dingin puanaas,BUMN,Bintang 3,KHASMalioboroHotel (1),negative,Pelayanan Staf & Keramahan
jaka triyanta,2023,1,saya ci jam 17 15 dan sudah memesan kamar sebelumnya yaitu tidak merokok 1 ranjang besar akan tetapi kamar yang kami bekas tamu yang perokok saya minta pindah ke kamar lain yang tidak merokok dan dilayani dengan sangat sopan oleh staf fda jam 17 45 kami dipindah ke kamar lain dilantai yang sama kamar di perawatan dengan aroma lemon rumput sudah akan tetapi kami mendapat tempat tidur yang terdiri dari dua ranjang yang digabung sangat tidak membuat kami nyaman,BUMN,Bintang 3,KHASMalioboroHotel (1),negative,Pelayanan Staf & Keramahan
Slamet Widodo,2020,1,Tgl 30 kami sekeluarga cek masuk kami dapat parkir di depan hotel tgl 31 tiba2 oleh pihak keamanan kami diminta memindahkan mobil dengan alasan tempat mau digunakan untuk kegiatan akhir tahun tepat pukul 21 malam ternyata tempat yang tadi akan digunakan ternyata ternyata di tempati kendaraan lain lalu kami datangi pihak keamanan ternyata alasannya karena hu jan padahal dari pagi juga sudah gerimis mungkin karena kami plat f bukan ab atau b sehingga di gusur suka2 keamanan atau manajemen atau pihak tertentu yang menginginkan kenyamanan atau karena hal mungkin pihak satpam yang lain yang bisa memberikan penjelasan tapi ini sangat membuat saya tidak nyaman atau mengecewakan tolong pelatihan manajemen pihak yang benar karyawan,BUMN,Bintang 3,KHASMalioboroHotel (1),negative,Infrastruktur (AC/WiFi/Parkir/Air)
Heidar Septian,2023,1,pesan hotel untuk pertama kalinya karena rekomendasi dari teman cuman langsung dapet pengalaman buruk sewa kamar selama 2 hari untuk 4 orang dapet dengan harga 600rb selalu konfirmasi ke cs susah sekali dihubungi nya karena tiba tiba harus mengubah jadwal ada keluarga yang punya nama baru d respon setelah cek masuk lewat tanggal tolong pihak manajemen pelatihan lagi yang benar karyawan ya kami menginap dengan bayar bukan numpang terima kasih,BUMN,Bintang 3,KHASMalioboroHotel (1),negative,Harga & Value for Money
imam tj,2025,1,kamar engap ac tidak dingin terlalu mahal untuk harga 1 juta,BUMN,Bintang 3,KHASMalioboroHotel (1),negative,Harga & Value for Money
Dewi Agnescia24,2023,1,sya hbis cekout dari hotel ini dengan harga permlm 700rb tapi fasilitas tidak sesuai kamar pengap dan bersebu trs yang lebih parah lagi ac tidak dingin sama sekali mw tidur jadi tidak bisa karena kepanasan tlg di perbaiki lagi terimakasih,BUMN,Bintang 3,KHASMalioboroHotel (1),negative,Harga & Value for Money
