User Name,Review Time,Rating,Review Text
Ayu Ariasih,2025-07-01,5,Kamarnya sangat bagus dan nyaman layanan besar dari Amelia Vaskha resepsi terima kasih
Hind Beshr,2025-01-31,5,Hotelnya begitu bersih dan sangat terorganisir hotel baru kahfi agus tris sangat ramah dan semua barangnya sangat menyambut sangat dianjurkan bagi siapa saja yang telah menunda atau membatalkan penerbangan
Pretty Michael,2025-08-31,5,pengalaman menginap di sini sangat memuaskan lokasinya juga mudah ditemukan dari parkir gedung domestik p3 setelah pintu masuk ke arah bandara langsung belok kanan sudah sampai hotelnya mewah bersih dan paling penting staf nya ramah dan aku terbantu sekali dengan stafnya fahmi toyyib dan tria yang membantu dan ramah kamarnya juga lihat memuaskan luas dan bisa pesawat dari kamarnya fasilitas kamarnya juga lengkap dan berfungsi baik lalu hotel ini satu hotel di bandara yang punya kolam renang ada perlengkapan renang anak anak juga seperti larangan pelampung dll lalu ada gym dan ruang pertemuan makanan di restoran rindu rasa nya enak enak juga
amelia fatharani,2025-01-31,5,Ini tempat yang bagus masuk bandara hotelnya nyaman dan stafnya ramah juga sangat membantu
Sandi Sandi,2025-07-01,5,secara keseluruhan pengalaman yang luar biasa staf sangat ramah dan membantu terima kasih Mba Amelia
Windy andhika,2025-05-01,5,Hotel baru dan bersih saya menginap 4 malam disini mbak tria dan mas abdul sangat membantu
Arif Suhada,2025-10-31,5,apa boleh 1 kamar di isi 1 keluarga 6 org
Megah Pertamawati,2025-07-01,5,makanannya enak terimakasih mbak sasya sudah mau bermain dengan cucu saya althea
Bader Alshehri,2025-01-31,5,Hotel yang ramah itu baru dan bagus masalah hanya jika penerbangan masuk terminal 2 Anda harus naik taksi atau menunggu bus Anda harus pergi lebih awal ke penerbangan Anda
Sari Hikmah,2025-12-17,5,hotel terbaik dan nyaman
Tsabit Lefi,2025-05-31,5,hotel baru yang super duper nyaman stafnya juga ramah ramah banget sarapannya enak kamarnya pun juga cukup luas untuk tipe suite sangat cocok untuk kalian yang ada jadwal pesawat pagi ataupun malam bisa menginap di hotel ini
Chocobo •,2025-07-01,5,terhubung ke terminal domestik soetta t3 1f pilihan yang bagus untuk penerbangan berlayar
Laras Wintang Kirana,2025-05-01,5,hotel baru belum banyak tanda kedepannya bisa diberi banyak petunjuk menuju hotel kamar bersih dan luas staf ramah
Inggrid Rheina C,2025-03-03,5,Lokasinya di lantai 1 dalam gedung bandara ada di deket bisa tanya ke petugas layanan pembersihan klo orang luar pada tidak tau
Annisa Dita Setiawan,2025-05-01,5,Grand Anara telah menguasai keseimbangan antara kemewahan dan kenyamanan Aku akan tanpa ragu merekomendasikannya kepada rekan dan teman-teman
Yani Marawali,2025-05-31,5,Cinta staf Anda persahabatan sangat membantu sekali terutama Mba tria baik kembali segera
YURIKO RITSUKI,2025-07-01,5,Sangat menyenangkan menginap di hotel Grand Anara
Ceysya,2025-03-31,5,kamar modern dan nyaman yang bersih sempurna untuk beristirahat atau menginap di malam hari sebelum penerbangan
pipin perhan,2025-03-31,5,bersih wangi baru kamar kamar sangat bagus pelayanan ramah terima kasih rizky atas foto2nya
Joko Patmono,2025-08-31,5,makanannya enak sesuai dengan ratenya
Nawawi Naong,2025-01-31,5,terimakasih atas pelayanan yang ramah dari mba amelia mas agus dan mas abdul sangat nyaman hotelnya
Agus Hidayat,2025-01-31,5,Hotel baru kamar nyaman lobby mewah dan staf sangat ramah dekat dengan gerbang 5 terutama untuk keberangkatan domestik
Ina Adiastrid,2025-01-31,5,Hotel yang bagus dan nyaman Terima kasih untuk Amelia Agus dan Egi
Gigih Perwira,2025-03-03,5,dekat bandara akses mudah layanan juga sangat sopan dan baik salam ke resepsi mereka terutama Amelia
yuditha resgiaty,2025-07-01,5,Pelayanan ramah terima kasih Mba Amelia dan Mas Harbi
Abdul azis Maulana,2025-10-31,5,untuk pelayanannya ramah dan bagus tria
JOKER,2025-07-31,1,Denda perampokan restoran terlalu tinggi
Ralf Pangalila,2025-10-01,2,pelayanan kurang baik
Hfd,2025-07-01,5,Resepsi sangat baik.
Riyo Putra,2025-07-01,5,Amelia dan tria sangat baik layanan teruskan
Marasutan Halomoan Lubis,2025-07-01,5,Hotel besar di terminal 3 rumah tangga dengan kamar luas
asep haruman,2024-12-31,5,Hotel baru kamar nyaman kamar nyaman interiornya bagus dan staf modern membantu saya sangat senang
Mhannad Q.,2025-10-01,5,Pelayanan dan kemurahan hati besar dari Abdul dan Teea
rinna indriyani,2025-03-31,5,Semua staf sangat baik membantu Terima kasih untuk Mba Amelia sebagai front officer untuk keramahan
ABU FARIS,2025-08-31,5,Tempat yang luar biasa. Semuanya bagus.
Susan Wongkar,2025-01-31,5,Staf kamar yang nyaman ramah dan tersenyum terima kasih amel dan agus
Tan Lie Suan,2025-01-31,5,Hotel baru bagus dan nyaman terima kasih Mba amel dan Agus
IMAM RIZKI ARIANTO,2025-03-31,5,pelayanan okee resepsionisnya ramah mb amelia full senyum
Haryo U Kustianto,2025-07-01,5,terima kasih sasya
Marc Meert,2025-12-17,5,hebat
neng & oenank,2025-12-01,1,resepsionis kurang ramah
Kevin Rivelino Matatula,2025-01-31,5,hotel baru yang nyaman tepat di terminal 3 domestik soekarno hatta
Creator Youtube,2025-08-31,1,tidak memuaskan
Peter Bryant Soefian,2025-05-31,2,gym belum beroperasi
Ririn Kusuma,2025-05-01,5,pelayanan memuaskan terima kasih untuk mba amel dan mba tria
annida zalfa _,2025-05-01,5,sangat nyaman hotelnya dan pelayanannya
Salsabila Karimah,2025-05-01,5,Alhamdulillah terimakasih mantap pelayanannya mba amelia dan mba tria
Widi Purnama Sari,2025-03-03,5,layanan dan pelayanannya terbaik terima kasih kak amelia kak agus
iphen phen,2025-01-31,5,Pelayanan ada kamar nya oke
aspi hino samarida,2025-01-31,5,layanan baik dan pelayanan ramah trm ksh mba amelia
M Abizard,2025-07-01,5,Kita di bantu oleh mbak amelia terima kasih
fauziah jasmine,2025-01-31,5,nyaman sekali terima kasih mas abdul sudah bantu kita
SUGENG WARSITO,2025-05-01,5,Pelayanan sangat baik kak amelia sangat ramah
anugerah body jordan,2025-05-01,5,cocok untuk transit atau yang pagi penerbangan pagi
agung maulana,2025-01-31,5,Hotel yang bagus untuk transit dibantu dengan mas abdul
khrisiyana,2025-12-01,5,Tempat bagusnya
Richard van Hillegersberg,2025-10-01,5,suasana dan pelayanan yang baik
Tubagus Ritza bahtiar,2025-12-10,5,keren merasa puas
Sri Yuliastuti,2025-01-31,5,Terimakasih pelayanan mba amelia yang baik cantik
liska syafitry17,2025-07-01,5,"Secara keseluruhan bagus. Terima kasih, Sasha."
Rufikha Eka,2025-01-31,5,Pelayanan okee terima kasih ka Amelia dan kafi
Endah Kristiani,2025-03-03,5,Terima kasih atas kebaikan staf Amelia dan Fahmi
Ruben Willian,2025-03-03,5,Pelayan Amelia dan Agus sangat memuaskan
Cake Daisy,2025-07-31,1,buruk banget
fidhanhm,2025-03-03,5,pelayanannya ramah dengan mba amalia
irwin shah,2025-01-31,5,amel dan agus pelayanan sangat memuaskan
Kurnia 2022,2025-03-31,5,seru
Heru Purwanto,2025-10-31,5,Goks banget
Nada Agil,2025-03-31,5,Sangatt nyamann
isnawati isna,2025-07-31,1,buruk banget
Sianita Tomara,2025-05-01,5,bagus
Tia Blok B,2024-12-31,5,bagus
yuri firmansyah,,5,hotel dengan lokasi yang sangat strategis dan bagus untuk semua mulai dari menu staf layanan sarapan maupun kebersihan kamarnya sangat baik
Beat Waefler,2025-12-30,5,Terima kasih Amelia kami di mana bisa menggunakan kamar di 11: 00 bahkan check inn biasanya hanya di 14: 00 hotel adalah besar jika Anda memiliki beristirahat lama akan tinggal lagi pada perjalanan saya berikutnya
fairuz syifa arifin,2025-12-27,5,Pelayanan yang sangat baik keramahan dari petugas resepsi mba tria mba amel sangat membantu diperbolehkan check masuk awal tanpa kena biaya terima kasih grand anara untuk keramahan anda
akun gagah 77,2025-12-26,5,kamar dan toiletnya bersih dan sangat nyaman saya sangat menikmati menginap di hotel grand anara dan spa nya juga sangat merekomendasikan terapinya bagus saya di pijat langsung
Byanka Rayanfitiari,2025-12-26,5,hotel mewah dengan lokasi yang sangat strategis mudah ditemukan karena langsung dari lobi parkir terminal 3 domestik lantai 3 tepat di samping a w pelayanannya sangat baik kami disambut dengan ramah oleh mba tria dan mba amelia
Ridwan Yusuf,2025-12-26,5,Resepsi bernama tria dan amelia sangat ramah sopan dan pelayanan sangat baik lokasi dekat dengan parkir domestik lantai 1 sangat cocok untuk nginap untuk perjalanan domestik
Natasya Yunita,2025-12-24,5,resepsionisnya ka tria dan amelia orang nya ramah dan cepat pelayanannya kamarnya bagus dan harga sesuai
Ryo,2025-10-01,5,Secara keseluruhan saya sangat puas dengan masa inap saya saya menginap di bandara pada hari keberangkatan dan sehari sebelum kepulangan dan saya berharap bisa menginap di sana pada malam kedua tersebut
S “L’explorateur”,2025-10-01,3,Kami menginap di hotel ini sebentar sebelum mengejar penerbangan kembali ke Paris apakah hotelnya lumayan hanya saja kita bisa mendengar semua yang terjadi di lorong rasanya kurang menyenangkan dibangunkan pukul 6 pagi karena ada
