User Name,Review Time,Rating,Review Text
Michelle Chong,2025-12-03,5,Kami tinggal di sini selama beberapa jam sebelum penerbangan pagi hari pada tanggal 29 November dan memiliki pengalaman yang sangat baik proses check masuk sangat lancar karena resepsionis sangat ramah dan menyambut satu-satunya kamar yang tersedia adalah suite tetapi harga masih terjangkau ketika kami memasuki kamar kami jujur terkejut dengan seberapa luas dan bersih itu memiliki semua fasilitas dan fasilitas yang kami butuhkan yang membuat kami tinggal singkat sangat nyaman staf juga sangat membantu selama check masuk dan checkout mereka bahkan membantu kami memindahkan bagasi kami ke lift yang kami benar-benar menghargai interior
Mr Big Bang,2025-12-01,4,Lokasi hotel yang cemerlang untuk wisatawan bisnis tiba terlambat dan meninggalkan awal hari berikutnya staf resepsi baik dan sopan dan memeriksa masuk cepat sesuatu yang Anda butuhkan setelah perjalanan panjang kamar bersih dan sarapan yang baik dimulai awal wich sangat baik saya pikir pijat yang baik adalah apa yang tubuh saya butuhkan sekarang jadi saya memesan dari mereka spa departemen terapis karin datang ke kamar saya sopan dan profesional pijatnya melakukan keajaiban untuk tubuh yang lelah sehingga malam itu saya tidur seperti bayi dia berbicara bahasa Inggris yang baik sehingga Anda bisa berbicara sedikit selama pengobatan saya sering bepergian ke sini dan tentu saja akan pesanan
GermanTryHarder,2025-12-01,5,memiliki tinggal yang hebat di hotel itu sangat bersih dan nyaman jauh lebih dari yang saya harapkan dari sebuah hotel bandara defensif merekomendasikan untuk tinggal di sini jika Anda tiba terlambat atau terbang awal sarapan benar-benar luar biasa dan staf di resepsi adalah super baik dan ramah terutama amelia orang yang indah dengan jiwa baik
Hayu Paramita,2025-12-24,5,nyaman sekali tinggal di sini kamarnya bersih dan rapi fasilitas lengkap bfastnya enak2 dan menuunya melimpah staf nya ramah2 dan membantu sekali terutama mbak amel yang membantu saat cek masuk dan mbak okti yang melayani saat bfast semoga bisa dipertahankan pelayanan baiknya layanan hebat
Jeremia Febrian,2025-12-26,5,lobby terlihat bersih dan masih baru resepsionis ms amelia dan ms tria sangat sopan dan menangani cek masuk sangat baik lokasi ini di dalam bandara jadi nyaman akan sangat merekomendasikan ini
Marilyne St-Jean,2025-12-01,5,Ini adalah kedua kalinya kami tinggal di hotel ini dan sekali lagi kami tidak kecewa kamarnya luas super nyaman dan sarapan adalah hebat hari ini tria dengan baik menawarkan kami cek awal masuk tanpa biaya tambahan sejak kami tiba sekitar siang hari setelah beberapa jam perjalanan kami sangat bersyukur untuk pelayanan yang sempurna dan ramah
Adam,2025-12-27,5,ini ke tiga kalinya aku menginap di Grand Anara dari segi pelayanan nya sangat baik kamarnya juga bersih dan wangi interior nya mewah dan nyaman saya juga spa dengan mba gendis sangat baik ramah pijatannya merilekskan dan pegal saya juga hilang saya akan menjadi langganan grand anara karena sudah nyaman
Ben Littlechilds,2025-10-31,4,Hotel adalah hotel gaya bisnis khas itu bersih besar mandi nyaman tempat tidur tenang itu sedikit berjalan kaki untuk sampai di sini jika di ujung lain dari terminal dan pastikan untuk tahu ada 2 Anara hotel satu ribu satu biasa termasuk sarapan juga sangat direkomendasikan hanya keluhan sulit untuk memahami format tagihan dengan biaya layanan dan seperti juga kopi masuk kamar akan bagus
Yunisa,2025-12-01,4,hotelnya bagus pelayanannya baik saya pesan kelompok makan malam juga masakannya enak2 kurangnya adalah 1 suara antar ruang tidak kedap suara mungkin karena saya dapat yang bagian menghubungkan kamar jadi ckup mengganggu di malam hari jika ada yang baru datang dan ngobrol 2 tidak ada fasilitas kapas dalam ruangan saya permintaan kapas tapi tidak kunjung datang 3 waktu checkin kelompok pemesanan petugas kurang cekatan dan juga beberapa jenis kamar ada yang salah tidak sesuai permintaan jadi rombongan harus menunggu semoga bisa diperbaiki terimakasih selain itu sudah baik terimakasih
Amine Remmal,2025-12-26,5,Periksa masuk kamar layanan dan lokasi adalah kualitas terbaik kami memesan kamar itu sangat mudah diakses dari bandara terminal 3 terima kasih Grand Anara bandara tim hotel terutama tria layanan menginspirasi kepercayaan diri dan kedamaian untuk menginap yang indah
Vincentius Reinaldi,2025-10-31,5,hotel terbaik di bandara jakarta terletak di terminal 3 domestik jadi jika perlu ke terminal 2 harus lewat skytrain 11 15 menit interior nya mewah dan kamar nya sangat nyaman fasilitas jg lengkap ada gym kolam renang sauna lounge nya jg asik banget sangat nyaman sarapan variasi menu nya standar tapi rasa enak tempatnya nyaman plusnya lagi dengan posisi di terminal 3 naik 1 lantai lgs ke area resto bandara
Felix Marcus,2025-10-31,5,Tempat ini adalah pilihan yang bagus untuk transit stopover aman dan harga yang wajar lokasi sangat strategis hanya 10 menit berjalan kaki ke penerbangan check masuk area kamar-kamar tidak super luas tapi mereka nyaman staf ramah terutama resepsionis Amelia dan pelayan sila serta staf restoran lainnya saran untuk perbaikan adalah untuk menawarkan lebih banyak pilihan vegan
Herlina Zainani,2025-12-01,5,menginap 1 malam untuk memeriksa masuk pagi hari keesokan hari ini kamar bersih luas gk berisik dng view gate 14 15 serta pesawat garuda lalu lalang masakan untuk sarapan enak dibantu dorong trolleynya oleh mas mas staf dari hotel hingga ke counter check masuk alhamdulillah
Margie May,2025-10-01,5,hotelnya tidak mewah tapi bagian kamarnya cukup nyaman bersih dan masih terawat lokasi Nempel bandara t3 domestik jadi bisa tinggal jalan kaki buat buat cek masuk pesawat ataupun sekedar jajan di bandara staf juga membantu semua terima kasih jg mba amelia yang sudah bantu upgrade kamar menghubungkan untuk sarapan tidak banyak variasi tapi lumayan enak yah dijamin kenyang hanya saja kekurangannya internetnya lambat susah benar ingin streaming sinyal hp jg terbatas jadi ganggu yah kalau ada lumayan kebutuhan jika kekurangan satu lagi fasilitas kebugarannya kurang bangett mengecewakan sih kalau mau latihan cuman ada treadmill sepeda statis manual lintas trainer yang semuanya
Jelita Pekerti,2025-10-01,5,semua tuhan sangat nyaman dan pilihan yang tepat untuk menginap sebelum ruang penerbangan panjang layanan bersih ramah sarapan enak2 bervariasi ada indomiee harga pun masih sangat terjangkau karena bangunannya baru ya dan sudah termasuk sarapan terima kasih kak tria amel jika saya tidak salah yang sudah memberikan cek awal masuk pukul 13.30 karena ternyata kamarnya sudah siap teruskan pekerjaan yang baik guys
jiim test-wp,2025-12-01,1,Frontdesk bulan september menginap di newbelin semua november lebih nyebelin lagi yang sudah sering menginap dimana2 bisa merasakan buruknya keramahan di jakarta terburuk di anara domestik internasional hotel mahal tingkat keramahan comberan tidak akan lagi bawa tamu kesini 1 5 juta rupiah untuk apa sarapan nya saja standar bintang 2 lols apa lelucon
Dian Agustina,2025-12-10,5,Lokasinya strategis dan mewah dekat dengan parkir rumah tangga staf hotel mba nashila sangat membantu saat saya batuk lgsg di beri udara hangat untuk minum kondisi lagi batuk fasilitasnya sangat luas dan nyaman baik mempertahankan
Hani Muplihah,2025-12-24,5,pengalaman menginap di sini luar biasa kamar nya nyaman dan yang paling berkesan sarapan buatan koki tri surya juga enak orgnya ramahh terima kasih
Han Roos,2025-12-01,5,Satu malam di hotel grand anara sangat memuaskan kamar bagus dan wangi lobi bagus dan luas sarapan enak dan dibantu langsung dengan mbak okti yang sudah membantu untuk mengambilkan teh kopi dan kue lainnya selebihnya aman dan sangat memuaskan terimakasih mbak okti dan staf lainnya
Radhita Rukmana,2025-12-01,3,Mas t i coba kalau ada tamu bertanya ke mas nya sambut dengan salam senyum sapa sebagai kantor depan bknnya hal mendasar ya itu itu walaupun bukan tamu menginap hanya tanya tempat benar tidak ada disini ada acara itu saat ditanya juteknya masyaallah staf lain bagian depan juga tidak da sapa senyum sama sekali ramahnya sama tamu2 bule nya saja ini masukan ya bukan benci komentar karena hotelnya bagus loby nyaman tempatnya enak strategis banget sayang kalau karyawannya seperti karyawan puskesmas
Zaki Rahman,2025-10-31,5,lokasi sangat strategis berada di dalam terminal 3 domestik dari keberangkatan nomor 5 cukup turun 1 eskalator melewati hotel kapsul kemudian menuju arah parkir namun sebelum sampai di sana arah hotel berada ke arah kiri lihat papa tulisan grand anara lobby dan ruang tunggu luas pelayanan ramah cek masuk cepat kamar cukup bersih ada handuk udara mineral sikat gigi comb ada pengering rambut tidak ada setrika untuk tv menggunakan stb jadi ada 2 makanan jarak jauh dibandingkan luas yang cukup bervariasi namun masih kalah yang tidak besar di terminal 3 internasional untuk salinan mesin tidak ada pembuatan birnya kurangnya di sini
sabbia feyyolla,2025-12-03,5,Saya baru saja mengunjungi Grand Anara Hotel dan saya sangat terkesan melihat kamar-kamar begitu bersih dan nyaman dan resepsionis juga ramah dan baik untuk spa sangat direkomendasikan meskipun tidak ada ruang pijat dan pijat hanya dapat dilakukan masuk kamar hotel tetapi itu puas dan terkejut saya pijat dengan terapis yang sangat berpengalaman dan pijatnya sangat baik dia juga ramah saya lupa namanya tapi saya tidak akan pernah lupa tangannya yang menakjubkan terima kasih
Meysa Zalsabilla,2025-12-03,5,fasilitas baik sarapan di hotel ini secara keseluruhan enak makanannya dan pelayanan yang diberikan sangat luar biasa terutama mba sarah sangat ramah meskipun restoran sedang ramai pelayanan dan fasilitas seperti ini membuat pengalaman saya sangat menyenangkan terimakasih
Billy Jah,2025-12-03,5,nyaman dan praktis untuk menginap kamarnya bersih rapi dan fasilitasnya memadai suasananya tenang cocok untuk perjalanan singkat maupun transit staf ramah dan sigap membantu membuat pengalaman menginap lebih nyaman dan efisien
Seb Clmbt,2025-10-31,3,Tempat masuk terminal 3 sangat nyaman dan ini adalah hotel yang bagus terlihat saya hanya menempatkan 3 bintang karena saya tidak bisa tidur sepanjang malam karena soundproofing adalah buruk anak-anak bising di dekat saya saya mungkin tidak beruntung tapi ada juga bau yang sangat buruk masuk kamar 272 manajemen hotel harus melakukan sesuatu tentang yang khusus terima kasih kepada karyawan mereka sangat baik
Devy Can,2025-08-31,5,nyaman banget tinggal jalan kaki ke gerbang yang ada di bandara karena lokasinnya terhubung lgsg ke area bandara menu di restonya jg yang terbaik lezaat saat di lidah kamarnya luas ada mandi baru disediakan juga komplemen cemilan dan minuman ringan seperti banyak untuk hotel ini sangat banyak kemudahan saat di bandara
Paramitha citra,2025-12-01,5,Saya tidak mampir di sini 1 malam saya bertemu Mba Novita yang baik membantu saya menjelaskan terkait kereta langit karena saya orang awam makanya biasa saja cuma layanan dari Mba Novita bagus kamarnya nyaman lokasi di dalam bandara jadi enak ketika perjalanan lelah menunggu transit
Nando Febri Hariyanto,2025-10-31,5,saya baru saja menginap di Grand Anara Hotel Jakarta dan pengalaman saya sangat memuaskan salah satu hal yang paling berkesan adalah pelayanan dari resepsionis bernama tria sejak pertama datang saya disambut dengan senyum ramah dan sikap profesional yang membuat proses pemeriksaan masuk berjalan cepat dan nyaman tria sangat membantu dalam menjawab semua pertanyaan saya tentang fasilitas hotel dan memberikan rekomendasi tempat makan di sekitar sikapnya yang sopan sabar dan penuh perhatian benar benar mencerminkan pelayanan kelas atas dari Grand Anara hotel terima kasih untuk pengalaman menyenangkan yang saya cinta pasti akan kembali menginap lagi dan semoga bisa bertemu dengan tria lagi di kunjungan pela berikutnya seperti ini yang membuat tamu merasa diharyanan
Syahla Quaneisha,2025-10-01,5,saya menginap di hotel grand anara bandara soekarno hatta dan pengalaman saya sangat menyenangkan lokasi hotel sangat strategis dekat dengan bandara sehingga cocok untuk transit maupun penerbangan pagi kamar bersih nyaman dan fasilitas lengkap untuk istirahat singkat sebelum melanjutkan perjalanan yang paling berkesan adalah pelayanan dari staf khususnya mbak triya di meja depan beliau sangat ramah cekatan dan benar benar membantu sejak proses pemeriksaan masuk hingga memberikan informasi yang saya butuhkan pelayanan seperti ini membuat pengalaman jadi jauh lebih menyenangkan sangat direkomendasikan untuk yang mencari hotel nyaman dengan pelayanan terbaik di sekitar bandara soekarno hatta
Alberta Kumala,2025-12-01,5,Hotel yang bagus dan nyaman lokasi strategis untuk penerbangan domestik sarapan cukup komplit staf ramah hanya sayang ada berisik di kamar saya mungkin suara pompa udara atau sesuatu yang lain saya tidak tahu dan di kamar mandi ada sikat gigi tertinggal milik tamu sebelumnya mungkin layanan pembersihan lupa tapi secara keseluruhan ini adalah hotel yang baik terima kasih
Anti Social,2025-10-01,5,lokasi untuk hotel ini sangat nyaman karena dekat dengan gerbang domestik karena kesalahan suami saya membuat untuk penerbangan internasional memaksa saya untuk memesan hotel bandara lain yang juga bandara hotel dekat gerbang keberangkatan internasional hari sebelumnya sejak pemeriksaan keluar dari hotel pertama sekitar 12 00 saya harus memeriksa masuk awal di Grand Anara bandara untuk menginap berikutnya sebelum penerbangan saya kembali ke rumah masuk pada pagi berikutnya staf resepsionis ria amelia baik dan membiarkan saya untuk meminta awal memeriksa masuk kamar saya bahkan memiliki pemandangan landasan tidak mendapatkan pemandangan landasan dari hotel pertama saya sangat baik merek
Nabila Putri Salsabila,2025-07-31,5,Hotel bandara ini super nyaman terletak tepat di dalam terminal 3 yang membuat menangkap penerbangan pagi kami bebas stres sarapan yang mengejutkan baik dengan berbagai pilihan cara yang bagus untuk memulai hari sebelum terbang desain interior juga melebihi harapan kami untuk sebuah hotel bandara dan kamar bersih nyaman dan nyaman cek masuk dan cek keluar mengambil sedikit lebih lama dari yang diharapkan dan juga butuh waktu untuk bagasi kami untuk dikirim ke kamar tetapi secara keseluruhan itu adalah nyaman dan praktis tinggal yang sempurna untuk malam transit atau penerbangan awal
Hayati Haya,2025-12-01,4,pertama kali menginap di sini biasanya yang anara lama dsini berisik jadi semalaman aku tidak bisa tdr suara dari kamar sebelah dan dari luar kedengerab jls banget dan kalau orang tutup pintu pun keras banget kedengeran baru sarapan tidak sebanyak di anara lama
Melvin Hoyes,2025-08-31,5,hotelnya bagus fasilitasnya lengkap lokasinya strategis tinggal jalan kaki ke terminal 3 domestik stafnya ramah dan baik dibantu bawain koper sampai kamar dan saat cek keluar diambilkan troli bandara dapat gratis awal cek masuk terima kasih mbak amelia
Marcello Massoni,2025-10-01,3,Secara keseluruhan tempat yang baik dan baik untuk menghabiskan malam jika Anda memiliki berhenti lama masuk terminal 3 sayangnya masuk kamar kami 217 kami terus mendengar suara latar belakang yang mengganggu sepanjang malam mirip dengan getaran mesin yang tidak berasal dari AC atau ventilasi kamar mandi knalpot perlu earplugs untuk tidur kasihan sarapan rata-rata
Demen traveling,2025-12-17,4,hotel yang nyaman dekat dengan keberangkatan domestik berada di dalam bandara t3 area domestik kamar cukup luas nyaman bersih dan modern
Nando Febri,2025-10-31,5,Pelayanan di Grand Anara Hotel Jakarta sangat memuaskan terutama dari mbak tria di bagian resepsionis ramah tanggap cepat dan sangat membantu selama proses cek masuk dan selama saya menginap terima kasih atas pelayanannya yang luar biasa
Reza Suryapranata,2025-10-01,5,Anda harus pergi ke sana untuk pergi ke sana untuk pergi ke sana untuk pergi ke sana untuk pergi ke sana untuk pergi ke sana untuk pergi ke sana untuk pergi ke sana untuk pergi ke sana untuk pergi ke sana untuk pergi ke sana untuk pergi ke sana untuk pergi ke sana untuk pergi ke sana untuk pergi ke sana untuk pergi ke sana untuk pergi ke sana untuk pergi ke sana untuk pergi ke sana untuk pergi ke sana untuk pergi ke sana untuk pergi ke sana untuk pergi ke sana untuk pergi ke sana untuk pergi ke sana untuk pergi ke sana untuk pergi ke sana untuk pergi ke sana untuk pergi ke sana untuk pergi ke sana untuk pergi ke sana untuk pergi
Nurul Shafira,2025-10-31,5,pengalaman pertama menginap dihotel grand anara domestik hotelnya sangat strategis dekat dengan counter cek masuk garuda domestik hotelnya bagus kamarnya bersih nyaman dan fasilitasnya lengkap dan dari pelayanan dari staf khususnya mas rizki beliau sangat ramah dan sangat membantu saya
sachril havani,2025-10-31,5,hotel di bandara yang cukup enak dengan fasilitas lengkap mushola untuk istirahat sebentar untuk transit ke penerbangan berikutnya sarapan pagi restoran ini menyajikan menu lokal yang enak rekomendasi
Nareswari ICM,2025-07-01,5,terletak dekat keberangkatan domestik masuk t3 tinggal di sana untuk malam menunggu penerbangan transit kami layanan yang disediakan baik harby menanggapi dan membantu kami banyak merawat tas kami saya setuju dengan pelanggan lain bahwa ruangan membutuhkan soundproofing saya bisa mendengar pengunjung baru memasuki kamar mereka dan berbicara selain bahwa kamar itu bersih dan nyaman
JalanJalanGuys,2025-08-31,5,baru kali pertama mencoba tinggal di hotel bandara yang benar2 letaknya di dalam bandara letaknya di terminal 3 domestik mulai dari lobi kamar fasilitas perhotelan semuanya mantap banget mereka juga jadi satu hotel yang lain yang ada di bandara yang punya kolam renang juga loh secara keseluruhan grand anara cocok banget untuk kalian yang terutama mau transit sebelum penerbangan ataupun yang cape abis penerbangan dan mau nyantai dulu pekerjaan besar grand anara pasti akan kembali untuk tinggal sebelum penerbangan lain
Rado Lawolo,2025-12-01,1,Tidak ada yang salah dengan hotel bersih lokasi terbaik untuk transit layanan staf dan makanan adalah luar biasa tapi memberi Anda satu bintang untuk saat ini sebagai tanda untuk membimbing wisatawan tidak hadir dengan baik dari semua arah T3 area baik dari check masuk area maupun bahkan dari lobi parkir hotel drop off itu mungkin bandara otoritas tanggung jawab tetapi harus cepat memperbaiki dan jika manajemen hotel dapat mengikuti pasti Anda layak untuk 5 bintang saya lokal tetapi mari kita bayangkan untuk wisatawan internasional pertama kali transit ke hotel ini dengan anggota keluarga bayi tua dengan trolly tas berjalan di sekitar meminta untuk menemukan hotel
Ahmad Rifai,2025-12-01,5,hotelnya sangat nyaman dan pelayanan sangat baik pijatnya nya juga sangat bagus pelayanan yang sangat baik dan bikin santai dan sangat amat ramah sekali mba metta dan sangat sabar terimakasih pijatanya mba meta terbaik pijitanyaa
Rdph Queen,2025-12-01,5,Impresi pertama yang sangat baik saya suka bangunan baru interior Grand Anara hotel staf tersenyum kepada tamu makanan juga sangat nikmat indonesia jika saya memiliki kesempatan saya ingin tinggal masuk di sini lagi
Muhammad Irwan,2025-07-31,5,Pengalaman yang indah disambut oleh staf yang paling ramah yang baik ayat masuk bahasa Inggris untuk mereka yang memiliki penerbangan awal silahkan meminta sarapan takeaway jika Anda sudah membayar untuk itu saya mampu menikmati sarapan sebelum naik pesawat saya
Alip FXG,2025-10-01,5,kamar 4 5 luas ranjang besar ada ruang buat taruh bagasi di belakang pintu ada lemari es brankas peralatan mandi lengkap kurang pisau cukur saja cuma yang perlu disayangkan ada beberapa bercak noda di bantal dan sprei untungnya bantal dapat 2 video terlampir dan fo di bawah lemari es juga ada sisa obat sakit kepala yang tidak dibersihkan layanan 5 5 staf ramah hotel juga termasuk lengkap ada gym kamar kolam sauna dan resto untuk makan pagi nya oke banget suasana 5 5 letaknya di lt 1 tepat mau di bawah keberangkatan donestik cari makan mudah suasana di hotel juga bagus untuk istirahat
Ransta G,2025-10-31,5,Aku hanya menemukan hotel ini dari bisnis klien saya Singapore Airlines dan Qatar Airlines jadi aku memesan hotel ini aku telah diberikan pelanggan yang baik telepon vis dan apaapp dari anggota tim nama amelia aku ingin merusak beberapa dan dia hanya memperlakukan saya dengan gairah dan layanan pelanggan yang luar biasa dan membuat saya sangat bahagia untuk itu dan saya akan menggunakan hotel ini untuk jangka panjang terima kasih amelia dan baik dilakukan nenek anara hoyle untuk membuat pelanggan Anda bahagia
ary indra,2025-07-31,4,Saya tahu saya suka banget hotel ini karena strategis dan nyaman untuk menunggu terbang pagi karena lokasinya tapi coba deh sekali kali yang punya hotel tidur di kamar dan memakai tab yang di matikan di meja samping tempat tidur saya pasti kesulitan sekali trus coba sekali kali menonton youtube atau netflix di tv jika saat lagi tidak beruntung bisa ada segera harus memperbarui perangkat lunak jika saat beruntung bisa suara tv saya agak kurengg ya padahal merknya samsung tidak tahu mengapa ini berlaku untuk semua kamar selebihnya sangat oke
alan hizqiel,2025-10-01,5,datang setelah dzuhur alhamdulillah segera bisa cek awal masuk tanpa ada biaya tambahan dibantu oleh staf yang ramah tria hotelnya terletak di terminal 3 gerbang 5 turun ke bawah satu lantai lurus terus di samping aw
A Setiawan,2025-08-31,5,wah pengalaman menginap di Grand Anara hotel dalam terminal 3 soetta keren banget lokasinya emang juara tinggal jalan doang ke pintu sarapannya enak dan pilihannya banyak jadi pagi langsung semangat deh eh hotel bandara ada kolam renang gym sama area luar juga keren banget sumpah buat yang mau santai atau olahraga sebelum terbang saat banget apalagi ada tempat merokok yang mudah dijangkau jadi tidak ribet buat yang merokok kamarnya juga cakep bisa langsung lihat terminal 3 dari jendela jadi jadi seru banget buat penerbangan akan kembali sih ke ini hotel jika ke jkt terus
Mel S,2025-10-31,5,masuk lantai satu di bawah cek masuk counter terminal 3 sisi domestik Anda terus pergi ke ujung jauh melewati hotel kapsul dan koridor yang menghubungkan dan Anda akan melihat w hotel adalah di sebelah kiri dari itu melihat dua gambar terakhir itu sedikit berjalan kaki jika Anda datang dari internasional counter sekitar 10 15 menit tapi sangat nyaman jika Anda perlu memeriksa masuk pagi
Siti Hajar,2025-10-31,5,Gratis semua nya aman sarapan nya sedap semua pilihan makanan mbak okti dan semua staf sangat baik dan mudah didekati bisa diulang lagi ke sini
Ben Farr,2025-07-01,5,Saya tiba di penerbangan internasional ke terminal 3 dan berangkat pagi berikutnya dari terminal 3 Grand Anara hotel sempurna untuk menginap saya saya bahkan tidak perlu meninggalkan terminal 3 gedung memeriksa masuk sangat ramah dan efisien seperti yang saya cek keluar staf semua sangat ramah dan ramah kamar yang sangat baru modern bersih dan nyaman tempat tidur sangat nyaman ada lingkaran k dan banyak toko lain kenyamanan sangat dekat dengan terminal utama hanya berjalan kaki singkat dan Anda memiliki akses ke semua restoran dan fasilitas kafe juga sangat nyaman dan nyaman tempat tinggal lain kali saya transit masuk
Giselle Payne,2025-07-31,5,hotelnya nyaman fasilitas oke staf hotelnya amat amat ramah dan yang paling penting makanannya enak menu sarapan nasi goreng kemarin top banget sampe nambah hehe terbaik chef surya terimakasih pelayanannya akan kembali lagi ke sini karena sangat merekomendasikan
Daz,2025-07-01,2,Kamar kami berada di lantai 2 dekat lift ada suara berteriak yang terus-menerus datang dari motor listrik yang membuat tidur sulit juga kamar memiliki pintu pembagian ke kamar sebelah dan saya bisa mendengar orang berbicara mungkin tinggal di tempat lain lain lain karena kurangnya soundproofing itu adalah malu karena hotel ini bagus dan baru
Benedito Fernandes,2025-12-25,5,Pelayanan sangat luar biasa Mba okti yang ramah dan menemani waktu sarapan dan makan siang di resto nya
ditech injection,2025-12-10,5,Hotel nyaman bersih sarapan pagi enak2 menuunya ada kolam renang gym dianjurkan ada kamar merokok di lobi dan area kolam renang
Wiwit Prasetyono,2025-07-01,4,hotel yang strategis di terminal 3 bandara soeta pengalaman tugas perjalanan melibatkan disabilitas dari daerah yang berbeda dan sangat terbantu karena staf hotel bersedia menjemput sejak keluar sabuk pengantar hingga ke hotel terbantu dengan pak fauzie staf hotel yang selalu berkomunikasi selama penjemputan mitra kami di terminal 1 hingga dibawa ke terminal 3 kondisi kamar cukup luas dan disediakan monitor touch screen sebagai pengganti pesawat telepon dan buku menu layanan sayangnya justru tidak mudah diakses oleh yang memiliki hambatan penglihatan secara umum senang bisa istirahat transit di grand anara
Dave,2025-03-31,5,Hotel ini adalah pilihan ideal untuk wisatawan masuk transit istri saya dan saya menghabiskan malam di sini untuk beristirahat dan pengalaman kami tidak ada yang luar biasa tempat ini sangat bersih dan tenang suasana kamarnya indah dan staf yang luar biasa menyambut teriakan keluar untuk mbak tria dan rekan saya tidak dapat mengingat namanya yang telah sangat ramah dan membantu benar-benar top notch
Darma Saputra,2025-12-10,5,nginep d sini saat pgen umroh kamar cukop luas nyaman resepsionis ramah pegawai lain juga selalu nyapa mkanan enak
Fredy Handoyo,2025-07-31,2,Chef yang masak telurnya ibu jesica tidak niat kerja tidak memperhatikan pesanan pelanggan bayangin saja kami minta telur mata sapi matang 1 saja sampai 2 x salah minta pertama dikasi omlet minta kedua dikasi telur setengah matang itu pun setelah kami selesai makan padahal kami duduk tidak jauh dari tempat dia stanby pak manager hrd tolong di fiter lagi sdm seperti ini fyi keadaan saat itu tidak terlalu banyak maaf saya apa adanya komen terima kasih
