User Name,Review Time,Rating,Review Text
Nanang,2025-05-09,3,Lokasinya dekat dengan bandara sepinggan namun akses jalan menuju hotel kurang lebar banyak mobil warga atau tamu yang parkir di pinggir jalan sehingga membutuhkan kesabaran dan keterampilan untuk bermanuver
Amin Amri,2025-05-09,5,ini adalah tempat favorit dan rekomendasi baru saya tempat yang menyajikan makanan dan kamar yang nyaman dapur 24 7 dengan harga terjangkau dan kebersihan langsung ke kota 8 menit ke bandara jika berjalan mungkin 5 menit dengan tugas tangan dan tentu saja staf tersenyum ramah selalu liburan jangka panjang saya untuk semua tugas di balikpapan
Alicia Rey,2025-01-09,1,hotelnya aneh sekali udaranya tidak bersih lampupunya rusak kolam renang besar yang anda lihat di gambar sebenarnya bukan bagian dari hotel dan anda tidak bisa menggunakannya sarapan prasmanannya enak dan lokasinya strategis dekat bandara minum udara kemasan selalu diisi ulang kami meninggalkan tas di kamar dan meminta anggota keluarga yang akan tinggal lebih lama untuk mengambilnya kami menelepon beberapa jam setelah memeriksa keluar kami menemukan setengah barang dalam tas hilang dan beberapa kemasan robek
P. Hidayaticka,2025-01-09,1,kami memesan tempat tidur tambahan dua bulan sebelum menginap dan bahkan menelepon hotel untuk memastikan ketersediaannya saat check masuk kami menawarkan untuk membayarnya di muka tetapi mereka menyatakan kami dapat membayar saat check masuk dan meyakinkan kami bahwa tempat tidur tambahan akan siap namun ketika kami tiba tempat tidur tambahan tidak tersedia semuanya sedang digunakan mereka tidak dapat menemukan solusi sehingga salah satu anggota keluarga kami harus tidur di lantai menggunakan selimut sebagai kasur selain itu ketika kami memasuki kamar perlengkapan mandi tidak lengkap kami harus menunggu selama satu setengah jam untuk tangan penuh yang tidak datang sekaligus kami juga harus meminta keset kamar mandi dan tisu untuk diisi ulang hotel dan tisu
Kevin Yu,2025-01-09,5,memesan hotel ini lagi setelah perjalanan singkat saya ke Singapura saat itu sudah agak larut pukul 19 00 tiba di balikpapan pak ezza yang ramah dari hotel sudah ada di sana untuk menjemput saya yang mengejutkan saya pak ulum dari resepsionis memberi saya peningkatan ke kamar yang lebih besar kamarnya seperti biasa bagus bersih dan nyaman saya memesan layanan kamar steak tenderloin dan salad caesar luar biasa 9 10 layanan pelanggan yang luar biasa dari empat poin pak ezza dan pak ulum aset yang luar biasa saya sudah memesan lagi untuk menginap di bulan januari
J,2025-01-09,3,suite nya sangat bagus tapi sayangnya sebagian besar kamar lainnya bermasalah dengan kelembapan saya rasa sebagian masalahnya adalah mereka tidak lagi menggunakan ac di area umum seperti lobi atau koridor lobi khususnya sangat panas dan tidak nyaman makanannya buruk sejujurnya pelayanannya lumayan lokasinya agak jauh dari kota tapi dekat dengan bandara
Flourence R,2025-05-09,5,hotel terbaik yang pernah saya kunjungi di balikpapan proses pemesanannya lancar dan stafnya sangat ramah mereka juga membantu saya dengan layanan antar jemput ke bandara karena saya anggota marriot saya pasti akan kembali ke sini jika berkunjung ke balikpapan
Wilvianto Anto,2025-03-09,5,terletak dekat dengan bandara sepinggan sangat nyaman untuk tujuan bisnis kamarnya rapi dan nyaman keramahtamahan yang baik dari staf mereka memiliki beragam sarapan cemara
Felix FD,2024-01-09,4,Ada fasilitas seperti pusat kebugaran yang dilengkapi dengan mesin lari dan bersepeda angkat beban dan banyak lagi area sarapan menawarkan banyak variasi untuk dinikmati bahkan Anda bisa memilih saya instan yang diinginkan dan akan memasaknya sendiri kamarnya secara keseluruhan bagus namun kualitas televisi nya sepertinya kurang memuaskan dibandingkan hotel bintang 4
Alistair Marsland,2025-01-09,1,Satu hal yang baik adalah lokasinya jangan sampai meninggalkan barang secara tidak sengaja staf akan mencurinya dan mengklaim barang barang itu tidak pernah ada di sana mereka mencuri 2 batik dan membuka semua kartu pokémon kami pencahayaannya sangat buruk kabelnya terbuka dan dapat dengan mudah menyebabkan sengatan listrik kolam renang yang digunakan dalam iklan tidak tersedia untuk hotel ini kamar kamarnya tidak kedap suara dan layanan resepsionis meja resepsionisnya buruk
Prisila Putri,2024-01-09,2,mereka menawarkan kamar dengan pemandangan kolam renang yang indah yang bukan milik mereka kolam renang besar itu milik apartemen di daerah yang sama yang tidak dapat diakses oleh tamu hotel kolam renang hotel sangat kecil dan kondisinya buruk udara tidak bersih selain itu staf resepsionis memberikan pelayanan yang buruk mereka langsung menolak permintaan saya untuk minum cangkir bersih untuk minum teh hangat yang mereka sediakan di lobi apa sulitnya menyediakan cangkir mereka juga hanya memiliki 1 petugas saat cek masuk sehingga masukannya panjang kamarnya bagus dan sarapannya juga enak
C Kris (CK),2024-01-09,5,menginap di sini untuk urusan bisnis lokasinya agak aneh karena berada di tengah pemukiman tapi cukup dekat dengan bandara kamarnya bagus dan sangat nyaman pilihan sarapannya sangat memuaskan saya menginap di sini saat musim makan dan mencoba menu buka puasa sepuasnya sangat lezat stafnya juga ramah dan membantu
Stephen Alger,2024-01-09,5,pengalaman menginap yang luar biasa setelah menginap di mercury samarinda sebagai orang barat saya diperlakukan bak bangsawan meskipun jelas bukan dengan upgrade gratis catatan tulisan tangan dan pengalaman yang benar benar benar kelas satu kolam renangnya besar dan indah bahkan ada 2 kolam renang Anda bahkan bisa berjalan kaki ke bandara jika perlu saya tidak mau tetapi mereka juga menyediakan layanan antar jemput gratis sarapan yang termasuk dalam paket adalah yang terbaik yang pernah saya nikmati selama saya di sini saya sangat merekomendasikan hotel ini pelayanan dan senyum dari semua staf sangat mengesankan terasa seperti resor tetapi tepat di sebelah bandara tanpa kebisingan tempat persinggahan yang tepat sebelum menjelaja
Nadzer Turki Sandi Saputra,2024-01-09,5,hotel terbaik di kota kamarnya bagus sangat nyaman tapi agak kecewa dengan resepsionisnya karena saya minta tambahan tangan dan butuh waktu lama untuk menyediakannya karena di kamar cuma ada satu tangan tapi secara keseluruhan oke saya suka sarapannya yang sangat enak dan juga banyak pilihan makanan
Sibyl Tate,2024-01-09,1,benar benar kecewa dengan hotel ini mereka mengacaukan pengaturan kamar untuk kami yang berjumlah 18 orang seharusnya mereka menyediakan kamar kembar tetapi mereka malah memberikan kamar king size setelah berdebat mereka meminta kami membayar ekstra untuk upgrade ke kategori berikutnya barulah mereka akan memberikan kami kamar kembar kami sudah mengajukan permintaan saat memesan sangat tidak bertanggung jawab tangan kamar bau bukan hanya satu kamar tetapi di semua kamar sakelar lampu berantakan beberapa lampu tidak bisa dimatikan kecuali dicabut lampu meja samping tempat tidur juga tidak ada sakelarnya saya harus membuka bohlamnya untuk mematikannya pemandangan ke kolam renang yang besar jangan tertipu kolam renang hotel
Irsyad Razaqi,2025-01-09,5,Satu hotel yang saya kunjungi jika saya berlibur ke balikpapan kecuali anggaran saya terbatas kamarnya nyaman dan bersih tempat tidur raja nya kokoh dan cukup untuk menampung istri putri saya dan saya sarapannya mungkin salah satu yang terbaik di balikpapan ada pusat kebugaran di lantai 10 dan juga kolam renang mini di lantai 5 6 saya lupa satu lainnya kekurangannya adalah akses ke hotel jalannya cukup buruk dan sempit
Fitria Achmadi,2023-01-09,4,agak jauh dari pusat kota tapi paling dekat dengan bandara pelayanannya luar biasa kamarnya sangat luas dan modern yang saya komplain adalah mereka hanya menyediakan satu pancuran tepat di atas kepala biasanya ada berbagai pilihan tapi saya suka sarapannya mereka memiliki banyak pilihan dan bahkan ada warung kecil tempat kami bisa memilih camilan atau kopi sachet secara keseluruhan pengalaman menginap saya di sini lumayan tapi tidak terlalu istimewa untuk harga yang kami bayar
andriaa,2025-01-09,5,sarapan hotel paling memuaskan yang pernah saya rasakan untungnya saya menginap beberapa malam di sini sehingga saya bisa mencicipi hampir semua menu sarapan mereka dan juga mengulang beberapa menu favorit berulang kali setiap pagi kamarnya cukup luas nyaman dan mewah satu hal yang saya tekankan mengapa kamar mandinya agak transparan dengan dinding kaca buram bukan dinding biasa menurut saya itu tidak perlu
saipul rizaldy rachman,2025-07-09,5,Ya hampir semuanya oke lokasi dekat bandara tapi jalan menuju tempatnya agak gelap
Lee CH,2024-01-09,5,Lokasinya dekat di seberang bandara dikelilingi banyak restoran makanan laut yang dapat dicapai sekitar 5 10 menit berkendara dari hotel kamar hotel nyaman dengan tempat tidur dan bantal yang empuk staf hotel sangat ramah dan penuh keramahan sarapan disajikan dengan masakan lokal indonesia dan dipadukan dengan beberapa masakan internasional kopi hainan lokalnya enak yang paling saya sukai satu hal yang membuat kamar kurang sempurna adalah toiletnya lantai toiletnya rata dan udara agak sulit dialirkan meng meng menggenang setiap kali selesai mandi airgenang dan butuh waktu lama untuk mengalirkan hotelnya merenovasi toiletnya sebaiknya
edwin aprizal,2020-01-09,3,Tempat menginap yang nyaman makanannya enak tempat parkirnya luas ac nya bagus tempat tidur bayi gratis kursi bayi di restoran kamarnya bagus dan bersih stafnya ramah dll namun ada beberapa hal yang perlu diperbaiki seperti udara untuk bak mandinya kurang jernih warnanya agak cokelat muda kolam renang terlalu kecil kolam renang yang besar sepertinya bukan untuk hotel tapi untuk apartemen kami tidak bisa menggunakannya tapi hanya bisa melihat dari kamar kami agak menyedihkan
stefano generali,2025-03-09,3,hotel terbaru di balikpapan pada tahun 2019 cukup bagus tapi perlu beberapa perbaikan layanan kami memesan kamar untuk 2 orang tetapi anehnya kami hanya mendapatkan perlengkapan mandi untuk satu orang sikat gigi dll dan hanya satu jubah mandi kamar bersih dan nyaman tetapi kamar mandinya sangat buruk pintunya besar begitu pula pintu mandi jadi tidak mungkin menggunakan toilet atau masuk ke kamar mandi jika pintu kamar mandi terbuka sarapannya sangat enak stafnya dan baik mungkin terkadang agak berlebihan
Mustafa Tepeören,2024-01-09,5,Saya telah menginap di berbagai hotel sepanjang hidup saya tetapi ini adalah hotel bintang 4 terbaik saya merasa seperti berada di hotel bintang 5 orang orangnya ramah dan membantu kamarnya bagus sarapannya sangat lezat makanan di restorannya luar biasa semuanya lebih dari sempurna saya tidak dapat menemukan kata kata yang tepat untuk menggambarkan perasaan saya dan terima kasih khusus kepada ika yang telah membantu saya memilih makanan dan menyampaikan permintaan saya untuk makanan yang tidak terlalu pedas ke dapur
S.R. Nevercry,2022-01-09,4,ini adalah salah satu hotel terbaik di idongne mungkin yang terbaik meskipun tidak sebagus empat poin oleh sheraton di kota kota lain hotel ini adalah yang terbaik di daerah ini stafnya sangat ramah dan selalu bersedia membantu staf resepsionis dan restoran juga sangat membantu dan ramah dan jika saya kembali itu karena mereka tidak ada apa apa-apa di sekitar hotel jadi jika Anda ingin makan Anda harus memesan sesuatu dari hotel atau menelepon ambil semuanya berada dalam radius 5 kilometer kebersihan kamar baik dan buruk dan staf tata graha perlu pelatihan lebih lanjut mereka lupa tangan atau tidak membersihkan dengan benar meskipun begitu ini adalah hotel terbaik di idongne
Sean,2021-01-09,5,Saya menjalani karantina 14 hari di hotel ini dan benar-benar menikmati sebagian besar waktu menginap saya karena saya tidak bisa keluar kamar staf datang setiap hari untuk mengirimkan makanan dan mengambil koki saya makanannya bisa lebih baik tetapi jauh lebih baik daripada hotel lain yang saya tempati di dekatnya yang juga memiliki kamar yang buruk yang terpenting wifi nya bagus 95 sepanjang waktu jika Anda berada di balikpapan dan membutuhkan tempat menginap ini adalah salah satu hotel terbaik di daerah ini
Nicola Dorin,2020-01-09,4,hotel yang sangat baru lokasi yang bagus untuk bandara mereka menyediakan layanan antar jemput gratis kamarnya bagus pintu kamar mandinya tidak tertata dengan baik dan terkadang sulit untuk dimasuki karena anda berada di antara pintu yang terbuka dan bilik pancuran toiletnya tepat di belakang pintu solusi ruang yang lebih tertata akan lebih baik stafnya sangat ramah terkadang terlalu banyak dan mungkin kurang berpengalaman dalam menangani tamu internasional
kelas yuni,2025-07-09,5,hanya 5 menit ke bandara layanan yang sangat baik sarapan yang lezat
Krishna Swamy Bathina,2024-01-09,5,menginap yang menyenangkan di empat poin balikpapan layanan dan bantuannya luar biasa dan saya sangat menikmati akomodasi yang nyaman dan mewah makanannya luar biasa dan area bar testo yang terbuka sungguh fantastis terutama di hari yang dingin dan berangin sangat direkomendasikan
Goutham M C,2025-02-09,5,Tempat yang bagus untuk menghabiskan akhir pekan kami tinggal di sini selama sehari untuk kunjungan bisnis dan menghabiskan waktu di pusat kebugaran dan kolam renang stafnya ramah dan rendah hati
David Jingga,2023-01-09,4,kamar bagus luas dan bersih staf ramah secara keseluruhan hotel yang bagus untuk standar balikpapan tapi saya berharap lebih banyak ketika pertama kali melihat merek sheraton dan marriott beberapa kekecewaan adalah perabotan restoran yang terlihat murahan dan sarapan memiliki pilihan yang baik tetapi masih dapat menemukan sosis yang terlalu matang ayam yang kurang matang mie goreng yang asin kopi dingin dari teko penghangat dll kolam renang yang terlihat dari kamar juga agak menyesatkan kolam renang sebenarnya terlihat seperti kolam renang di lingkungan sekitar
anditha hashim,2023-01-09,1,hotelnya bagus kamarnya nyaman kolam renangnya bangunannya bagus tidak yang lain tapi sejak sebelum kami mulai bermalam sulit berbicara dengan resepsionis sepertinya mereka tidak tahu apa yang mereka lakukan begitu mereka menutup telepon saya bisa Anda bayangkan kantor depan yang buruk
Ryan Pradhana,2020-01-09,4,pertama saya menulis ulasan di sini karena tidak ada tautan otomatis di email saya untuk memberikan ulasan kedua syukurlah ada kelompok marriott di balikpapan saya suka empat poin hotel makanannya sangat lezat tapi tidak ada cappuccino gratis untuk sarapan sementara hotel marriott lainnya selalu memberi kami cappuccino gratis ya setidaknya staf mereka menyatakannya di awal saya mengunjungi hotel ini 1 bulan setelah pembukaan informasi dari staf jadi saya selalu mencium bau debu dan tidak ada pengharum kamar seperti biji kopi parfum di sekitar lobi atau lorong terakhir saya sangat sangat ketika kelompok marriott dibuka di balikpapan dan saya pasti akan
Tassja Prayogo,2024-01-09,3,menginap di sini bersama keluarga atas nama orang tua saya semuanya baik baik saja mulai dari concierge keamanan hingga layanan fnb tetapi resepsionisnya paling buruk dibandingkan yang lain terutama yang bertugas pagi ini 20 Juni 2023 pukul 07:30 saya bepergian sebagai keluarga beranggotakan 4 orang dan kami kesulitan membawa tas keluar dari tempat parkir tetapi tidak ada resepsionis yang melihat atau meminta bantuan saya juga mahasiswa perhotelan dan kami tidak diajari seperti itu
zweiNovia d,2023-01-09,5,tempatnya nyaman tapi jalan masuknya sempit mobil besar agak sulit masuk tapi pelayanannya bagus pilihan menuunya juga beragam cocok untuk berbuka puasa meskipun ada yang masak rasanya kurang enak mungkin karena kokinya sedang berpuasa secara keseluruhan tempatnya bagus
Harriyana,2023-01-09,5,6 Agustus 2022 ini pertama kalinya saya menginap di empat titik saya mendapat kamar 817 dekat kolam renang kamar bersih toilet bersih kasur dan bantal sangat nyaman saya memesan makanan dan rasanya enak ini bagus mungkin kali lain saya akan datang dan menginap di hotel ini
Louis Mahl,2023-01-09,1,Pelayanan di restoran sangat buruk saat check masuk mereka memberi kami kupon gratis untuk jus atau kopi di bar jadi saya memberikan kupon dan meminta jus kemudian wanita itu kembali bersama manajernya dia mulai mengatakan bahwa mereka hanya memiliki jus jeruk jadi saya katakan oke dia anggota saya jus terburuk yang pernah saya lihat udara dengan gula dan rasa jeruk awalnya saya mulai mengeluh dengan baik karena seharusnya jus segar tapi dia memutuskan untuk berpura pura tiba tidak mengerti bahasa inggris kemudian dia tiba tiba mengerti jadi saya pergi ke resepsi mereka meminta maaf dan mengatakan bahwa kupon itu seharusnya jus segar tapi tidak ada yang lain saya tidak pernah menerima jus atau apa pun
anzhari luthfi,2023-01-09,1,kami sedang berbuka puasa di hotel ini makanannya hampir tidak diisi ulang dan butuh waktu lama untuk diisi ulang kualitas makanannya mengecewakan kami kami beranggotakan 30 orang stafnya hanya sedikit mengingat hampir 100 orang berbuka puasa di restoran secara keseluruhan pengalaman ini buruk dan saya tidak akan pernah mencoba makan di restoran ini lagi
Noviandri Lukman Hakim,2023-01-09,4,hotel sheraton empat poin yang bagus lokasinya oke meskipun terletak di jalan kecil tapi dekat dengan bandara sepinggan sarapannya unik dengan banyak pilihan tambah tersedia indomie dan minuman sachet kamarnya luas dengan lingkungan yang nyaman proses cek masuk semuanya oke secara keseluruhan bagus tapi saya tidak bisa memberi bintang 5 karena menginap hanya untuk istirahat sebelum kembali ke jakarta
Georgia,2024-01-09,5,pengalaman pertama menginap di empat poin oleh sheraton balikpapan kami menikmati masa inap yang menyenangkan terutama tempat tidurnya yang nyaman tak diragukan lagi kami sudah beberapa kali menginap di hotel lain di balikpapan tetapi sejauh ini tidak ada yang bisa mengalahkan empat poin apresiasi yang sebesar besarnya kepada seluruh anggota tim f b atas keramahannya terima kasih khusus kepada ika januari dan pak andre atas pelayanannya yang luar biasa pertahankan saya pasti akan kembali lagi
Erik Firman,2021-01-09,4,semuanya sangat bagus saya bahkan memberi 5 bintang di tripadvisor 20 menit yang lalu setelah saya melihat kolam renangnya admin seharusnya menghapus foto kolam renang besar di tengah hotel karena itu bukan kolam renang yang bisa kami gunakan itu bukan properti empat poin kolam renang empat poin hanya untuk anak anak tidak sebesar kolam renang dewasa ini benar benar mengecewakan saya
Sinta Romaeta,2020-01-09,5,sangat dekat dengan bandara kamarnya luas tapi tetap terasa nyaman dan menyenangkan makanannya lezat dan banyak pilihan stafnya sangat ramah mungkin agak terlalu ramah sampai mengganggu
Cibi Saryono,2023-01-09,5,staf yang ramah dan membantu menu sarapan yang beragam waktu cek masuk dan cek keluar yang cepat kolam renang yang luas tempat parkir yang mudah kamar yang luas dan fasilitas yang berkualitas terakhir set tempat tidur yang nyaman terbaik di kota ini
Aldi Aldi,2020-01-09,5,Peluncuran perdana hotel baru pada Juni 2019 jadi semuanya masih segar dan super bersih jadi ini dia layanan 10 10 layanan hebat semua staf sopan dan membantu kamar tempat tidurnya bagus sangat nyaman desain interior kamar mandi yang bagus interior kamar juga bagus tv led besar 2 sofa yang nyaman sarapan cukup variatif yogurt madu mi ayam nasi goreng bubur rasanya enak fasilitas lainnya jus kolam renang jika apartemen ini diluncurkan mereka akan memiliki kolam renang hotel terbesar cmiiw di balikpapan pusat kebugaran 2 treadmill 1 sepeda statis 1 crossfit 1 mesin smith 1 bench press dll bus antar j
Melly Adams,2020-01-09,4,hotel baru di balikpapan semuanya masih segar dan baru lokasi hotel agak sulit ditemukan karena tidak terletak di jalan utama sekitar 200 meter di dalam jalan kecil ada banyak tempat parkir mobil di sini proses cek masuk dan cek keluar sangat cepat saya menyukainya sarapannya enak sekali
Hadziq RM Hadi,2020-01-09,4,Hotel masih baru banyak hal yang belum selesai tapi kamarnya oke tapi kolamnya sangat kecil saya bisa melihat kolam renang besar dari kamar saya tapi sayangnya itu adalah kolam dari apartemen makanannya oke stafnya oke
Syed Firdaus Alsagoff,2020-01-09,5,dekat bandara kamar bersih dan luas ruang khusus merokok di lantai dasar dengan tempat duduk dan bersantai yang nyaman nilai tambah di sini layanan antar jemput gratis ke dan dari bandara ke dan dari kota secara keseluruhan luar biasa
Tisa Yotanti,2023-01-09,5,sangat dekat dengan bandara sepinggan tapi tidak bisa ditempuh dengan berjalan kaki ke pusat kota kamarnya luas dan nyaman sarapannya unik dan beragam
Anggi Restiana Dewi,2023-01-09,5,menginap di empat poin sungguh menyenangkan tapi tidak ada sisi negatifnya bagi saya kamar penginapan dan lokasinya semuanya bagus makanannya lezat dan beragam bahkan pusat kebugarannya pun lengkap saya sangat menyukainya
Gulfstream 650ER,2024-01-09,5,hotelnya bagus sarapannya enak dan layanan makan di kamarnya juga menu di kamarnya bisa ditingkatkan pilihannya terbatas tapi rasanya enak
Dwi Atmi,2021-01-09,4,Hotel baru suasana segar dan muda pengalaman menginap yang menyenangkan tapi sejujurnya menu sarapan bisa ditingkatkan agar lebih bervariasi
elmo rinaldi,2022-01-09,5,positif sangat dekat bandara kamar bersih dan sangat nyaman sarapannya luar biasa layanan antar jemput ke bandara disediakan negatif jalan menuju hotel sempit dan dikelilingi rumah di kompleks
Etty Tjandra,2021-01-09,4,selain lokasinya saya cukup suka hotelnya yah sebagian karena hotelnya baru mangkuk lemari saya juga rusak jadi agak kurang nyaman selebihnya hotelnya cukup bagus
John Walker,2025-01-09,4,semua stafnya luar biasa ramah dan membantu terutama karen tifany amman kepala koki makanannya lezat putra karena kemampuannya mengoperasikan telepon dan yang lainnya
tepong ginting,2024-01-09,2,restoran di sini super sangat lambat steak butuh waktu 45 menit untuk menyiapkan ketika hampir tidak ada orang lain yang makan di restoran dan parahnya lagi stafnya sepertinya tidak melihat ada masalah dengan hal ini
Richard Blackburn,2023-01-09,5,tepat di dekat bandara jadi tempat persinggahan yang bagus makanannya sangat enak musik live di luar bar kamar bersih dan tempat tidurnya nyaman
lee chun seong,2022-01-09,5,Saya suka konsep sarapan di hotel ini hotelnya agak sepi karena pandemi dan itu bagus untuk kami namun akses ke hotel memang perlu ditingkatkan
kuriadi law,2022-01-09,5,hotelnya bagus kamarnya bersih dan pelayanannya juga baik saya suka sarapannya yang banyak menuunya terima kasih khusus kepada andre atas pelayanannya di restoran saat saya sarapan
agus irawan,2025-01-09,5,hotel yang bagus dan nyaman untuk beristirahat sejenak setelah lelah bekerja dekat bandara tapi jauh dari keramaian kota balikpapan
Ary Retmono,2023-01-09,4,semuanya bagus kecuali handuknya agak kusam sampo sabun mandi disediakan dari dispenser yang mencerminkan hotel anggaran
Marco Marques,2025-12-09,5,pelayanan dan akomodasi yang sangat baik
Tedny kyle,2025-02-09,5,bersih pelayanan luar biasa sangat dekat dengan bandara tersedia layanan antar jemput
melisa Ramadhani,2021-01-09,5,kualitas bintang lima untuk keramahannya sarapan prasmanannya juga kaya rasa dan variatif tidak bisa berkata apa lagi hotel ini benar benar membuat menginap saya berkesan saya ingin kembali lagi
Marvin Erilio Firman,2022-01-09,5,wifi kencang makanannya enak tapi pemandangan kolam renangnya bikin kita salah sangka jadinya kayak kolam renang besar tapi ternyata cuma kolam renang dari apartemen
Riando Natanael,2020-01-09,3,pertama kali ke hotel baru ini untuk makan malam rasa makanannya terlalu asin dan kami harus menunggu sekitar 1 jam untuk hidangan utama kami disajikan
Alfons Yoshio Hartanto,2022-01-09,5,kamarnya sangat nyaman stafnya ramah dan sopan makanannya enak pasti akan kembali lagi jika saya mengunjungi balikpapan
Dedsdy Euy,2023-01-09,5,Ini salah satu hotel terbaik di balikpapan pelayanannya super ramah dan makanan yang disajikan selalu menggugah selera
Andri,2024-01-09,5,Yang paling saya suka dari grup hotel berantai ini adalah pelayanannya masalah dalam perhotelan selalu terjadi cara Anda mengatasinya menunjukkan bagaimana Anda berada dalam industri tersebut
Christine Nebel,2020-01-09,5,hotel yang sangat bagus di dekat bandara dengan fasilitas modern bersih dan staf yang sangat ramah sangat direkomendasikan
Ida Bagus Wyasa Putra,2024-01-09,4,kamar yang bagus keramahan yang baik dan lokasi utama karena dekat dengan bandara dan pusat bisnis lainnya
M Kahar A Palinrungi,2024-01-09,5,tempat tidur nyaman selimut tebal banyak variasi makanan dan kurang dari 5 menit dari bandara
Sam. Jupri,2025-12-12,5,bagus
Ghading Julio,2021-01-09,5,Saya pesan kamar di situs web mereka karena promo ternyata saya bisa upgrade kamar stafnya juga ramah dan pelayanannya bagus
poeloe naga,2022-01-09,3,Di seberang bandara sarapannya sangat enak tapi satu masalah lainnya adalah kedap suaranya sangat buruk dan bisa mendengar percakapan tetangga
Arya Prasetya,2021-01-09,2,kurang enak susah banget buat merokok area merokoknya bikin kena angin tidak ditutup
Fenny Karlavita,2025-01-09,4,Tempat menginap yang bagus di balikpapan dan sarapannya lengkap
santika pradhana,2021-01-09,5,hotel yang bagus dan ramah dekat bandara dengan staf yang sangat ramah luar biasa
Sahril Salim,2022-01-09,5,hotel bisnis terkemuka di balikpapan dengan fasilitas yang luar biasa kamar yang luas dan sangat bersih staf yang ramah
Sahril Salim,2022-01-09,4,hotel bintang 4 dengan fasilitas lengkap untuk rapat gerai makanan dan minuman dan hiburan kamar tamunya cukup besar
da nu,2023-01-09,4,kamar yang bagus dan bersih mewah tapi toiletnya tidak terlalu luas
Andre Hartono,2025-07-09,5,layanan terbaik kamar terbaik di kota
SANGEETHAA HANAN,2024-01-09,5,kamarnya bagus luas dan bersih stafnya ramah
Eez zy,2024-01-09,5,hotel kelas atas dengan layanan terbaik baggai surga
Garli Mauhibi Alfarizy,2025-10-09,5,Sejauh ini semuanya berjalan baik
