User Name,Review Time,Rating,Review Text
Thata Dwi Shintowati,2025-08-06,5,menginap di novotel cikini selama 3 malam enak lokasinya strategis bisa kelilingan sekitaran hotel sambil kuliner siang dan malam untuk sarapan di hotelnya makanannya enak2 dan lengkap pilihan dari makanan tradisional asia sampai barat juga ada pelayanannya juga gercep dan ramah2 banget kamar juga bersih dan nyaman
WIDYA RISNA,2025-09-06,5,makanannya enak ruang pertemuannya nyaman pelayannya oke terutama rani
Dika Widika,2025-07-06,5,Bertemu di Novotel Cikini Ruang Rinjani 1 untuk Ruanganya bersih nyaman untuk makanan kopi bteaknya nya sejauh ini enak bervariasi pelayanan nya bagus dan bertanggung jawab untuk mba savana dan mas dexa sangat membantu
Orinz,2025-06-06,5,kamarnya super nyaman dari pemandangan kamar mewah lumayan cakep kalau lihat kedepan bisa melihat kereta lewat jg jika ke bawah sih atap ya sarapannya lengkap crewnya ramah dan membantu cocok buat liburan cari suasana yang segar dan tidak ngebosenin kolam renang lumayan kecil sih mungkin berikutnya bisa diadain anak-anak taman bermain juga ya
Panji Dwijo Sukarno,2025-09-06,5,makanannya enak mantap daging rendang empuk mie gorengnya mantap pelayannya indah
Yugo pramudya m,2025-12-06,5,sarapan dan makan siang nya mantap terima kasih mbak indah dan mbak Elsa
Aura Tasya Amalia,2025-12-09,5,sarapan dan makan siang nya enak pelayanan kak indah baik
rahayu anggraeni,2025-09-06,5,sarapan dan makan siang di novotel jakarta cikini masakan nya enak banyak pilihan menu desert beraneka ragam makanan manis yang menggugah selera masakan india ayam tika enak banget terasa rempahnya lembut dan wangi pelayanan di resto oleh mba indah
Blenk Ivan,2025-11-06,5,pelayanannya ramah sarapannya enak enak coffenya juara mba indah
Novia Riani,2025-07-06,5,Sebagai anggota emas saya merasa sangat dihargai dengan layanan upgrade ke ruang eksekutif kupon tambahan untuk minuman dan refreshment sesi pada 5pm 7pm seorang teman saya memiliki ulang tahun dan mbak rani dan mbak indah memberikan yang terbaik untuk membantu dengan perayaan dan saya benar-benar menghormati dan menghargai mereka untuk itu terima kasih sekali lagi novotel cikini akan merekomendasikan kepada orang lain
George Joseph,2025-08-06,3,airconditioner tidak bisa dikendalikan dan diatur pada sangat dingin safe tidak bisa dikunci steam besi bocor air ke lantai membutuhkan beberapa panggilan ke lobi akhirnya kita harus mengubah kamar sebagai airconditioner tidak bisa diperbaiki masuk restoran layanan lambat ada tampaknya terlalu sedikit orang untuk bekerja dan mereka tampak terlalu sibuk
Candida Putri NS,2025-12-23,5,Sarapan di sini sangat baik dengan keramahan yang baik dari indah tempat yang direkomendasikan untuk tinggal
Muhammad Muslim,2025-12-06,5,sarapan siang nya enak mbak indah mbak elsa pelayanannya bagus
Muhammad Irvan,2025-07-06,4,menu sarapan enak tapi variasinya pilihan hidangan tidak sebanyak beberapa hotel setara yang pernah saya kunjungi fasilitas kamar cukup nyaman saluran tv banyak
Najla Siti Ghaniyyah,2025-09-06,5,layanan sangat baik semuanya ramah terutama mba indah makanannya juga sangat enak
SANTI WONG,2025-12-06,5,sarapannya mantul pelayanannya gercep kakak2x nya ramah kakak destri
novita eka nurjanah,2025-07-06,5,Saya menginap 3 hari kamar nyaman makanan enak enak semua pelayanan terbaik bintang 5 untuk mbak indah ramah senyum
Kevin Pratama,2025-12-23,5,Makan malam di sini nyaman banget apalagi kalau lagi ada acara khusus terima kasih novotel cikini
FATHINAH RANGGAUNI HARDY,2025-06-06,5,pertemuan di novotel sangat nyaman sangat nyaman untuk bertemu pelayanan sales manager mbak desta dewi sangat bagus aku sangat menghargai makan siang buffet di pertukaran makanan sangat memuaskan rasa dan pelayanan baik kapasitas restoran tenang pun besar dan ambiencenya cocok untuk istirahat di tengah pertemuan
Yolanda Adhi Utama,2025-09-06,5,hotel bagus dekat dengan stasiun banyak jajanan enak dan gohyong viral di samping hotel kamar nyaman
Insecure Girl,2025-09-06,5,hotelnya bagus pelayanannya jg tidak kalah bagus kemarin sarapan sama mbak caca ramah sekali
Zahra Princess,2025-06-06,5,pengalaman menyenangkan menginap di sini stafnya super duper ramah kamarnya rapi dan bersih kolam renang bersih anak-anak ramah waktu itu pesan kamar untuk keluarga req tenda2an dikamar tentunya bikin anak2 betah dikamar sarapannya jg enak2 semua secara keseluruhan sangat bagus saya akan segera kembali
Anas Khairunnas,2025-09-06,5,keren pelayanannya terima kasih sarapan dan makan siang nya enak pegawai resto a n indah ramah banget
Gede Wahyu,2025-07-06,5,pertam kali stay di novotel cikini pengalaman yang sangat luar biasa makanan minuman enak semua staf sangat membantu pelayanan yang baik dan di bantu mba yanti tidak menyesal tinggal di novotel sangat nyaman
luvhub23 Kharisvan,2025-07-06,5,hotel nya bagus nyaman fasilitas nya byk cocok banget yang untuk anak liburan ke jovitel cikini byk aktifitas anaknya kolam nya pun bersih dan mba mba mba di bagian aktifitas nya zara silvi annisa ramah dan baik banget sabar sama anak2 saran untuk kamar mandi di kamar 0602 dan setipe nya itu kamar mandi besar sekali akses ke kamar mandi nya ada 2 dari dalam kamar sama dekat pintu masuk dan tidak ada kunci dan kaca tpt WC dan mandi nya transparan saran nya 1 dirubah desain jadi dua kamar mandi 1 WC dan wastafel 1 mandi dan wastafel 2 kaca yang transparan WC
هاشم المهدلي,2025-11-06,5,Sarapan bagus n bagus saya pikir untuk makanan Arab masuk layanan perkalian baik dan Abdul Malik sangat baik dan caca sangat baik
Obet Ester,2025-11-06,5,makanannya enak dan bervariasi pelayanannya juga bagus _mba fani_
Setty Rambani,2025-09-06,5,Pelayanan yang sangat baik untuk layanan nya juga bagus untuk mba caca membantu banget bintang 5 buat mba caca
Citra Aqila7212,2025-10-06,5,Anak-anak saya suka kegiatan anak-anak yang diadakan masuk di sini seperti memutihkan naik seni koki kecil dan bartender kecil dengan instruksi oleh Bu Silmi dan Bu Rara di Novotel Cikini keluarga saya juga dibantu oleh Bu Salsa Bu Adelia Bu Adelia Mr adin Bu Adelia Silmi dan Bu Rara selama liburan masuk di sini mereka ramah membantu kebaikan dan cepat respon Terima kasih atas dukungan dan keramahan Anda
Indra Gunawan,2025-12-06,5,atas semua pelayanan mantap memuaskan pelayanan dari mbak fani cukup baik dan ramah
Nadia Wulandari,2025-12-06,5,makan siang nya enak dan pelayanannya ramah serta informatif dengan kak rara
Alishia Maitsaa,2025-08-06,5,menginap di sini karena ada acara dan makanannya enak serta pelayanan yang ramah dari penjualan kami mba diva serta mba indah dan mba yanti yang membantu kami
Aqsha Mulyadi,2025-09-06,5,Biji sarapan makan makanan indonesia enak banget makanan dan minuman enak pelayanan sangat baik dari kak indah
lutvi chamid,2025-09-06,5,untuk sarapan makanannya makanannya enak bervarian ada asia barat dan kue nya dan layanan yang baik kak rani
Eko Adi Nugroho,2025-12-06,5,makanan enak pelayanan prima terima kasih kak adelia
Samsuri Mohamed,2025-11-06,5,Sarapan disini enak makanan enak pelayanan ramah dan sopan dari mba elsa
Fiska Suhenda,2025-10-06,5,tempat pertemuan nyaman dan makanan nya enak terima kasih novotel cikini dan mba amelia
Kamal Elridha,2025-11-06,5,sangat memuaskan nyaman tidur lelap kantor depan ramah tasya nmanya
Widiana Taufik,2025-12-16,5,Tempa pilihan kalau tugas ke Jakarta nyaman dan bersih pelayanan an caca asik sangat membantu
Agus Triono,2025-12-23,5,Lokasinya strategis makanannya enak terima kasih mbak yanti
Fajar Amirullah,2025-11-06,5,sarapan dan makan siang sangat enak soun goreng enak orek tempe enak pelayanan sangat baik dari kak indah
RIFAALYA ZALFA AYUMIDORI,2025-10-06,5,Pelayanan kamar baik dan mba adel membantu saya untuk mencetak terimakasih banyak novotel cikini saya senang dan puas
Sinta Anggoro Utari,2025-10-06,5,kamar bersih ruang pertemuan oke terima kasih mbak yanti atas keramahannya
Victoria Wong,2026-01-02,5,nyaman tinggal dengan keluarga saya sangat menghargai layanan dan pasti akan kembali
Dessy Kemalaboes,2025-11-06,5,Breakfast dan lunch nya oke pelayanan resto oleh indah okeeh
Siti Sakdiyah,2025-10-06,5,Sarapan pagi ini dibantu sama mbak indah terimakasih atas pelayanan ramah dan bersahabatnya
riska pradana,2025-07-06,5,makanan nya beragam rasanya saat disarankan buat kalau ada perjalanan dinas dan menginap staf hotel mba indah mba elsa ramah dan sangat membantu
Rasti Nandoss,2025-12-06,5,sarapan makanannya sangat enak dan sangat lengkap elvi pelayannya sangat ramah
Kartikata,2025-04-06,5,Dari depan gedung hotelnya tidak tampak terlalu besar setelah masuk lobi untuk ukuran hotel di jakarta pusat dengan lahan sempit ternyata cukup besar juga hotelnya kamarnya nyaman bersih dan bikin betah apalagi pemandangan dari kamarnya suka saat malam bisa lihat stasiun cikini dari kejauhan ramai tapi tidak bisa bising hening tapi tidak sunyi mati pokoknya sesuka itu sama kamarnya belum lagi komplimentari untuk ulang tahunnya nya juara senior itu untuk tim tumbuh hk nya bravo biasanya hotel lain jika ulang tahun dibikin angsa saja saja di kasurnya ini sampai ditebar bunga plastik hehee sukses yang bikin senang saat baru masuk kamar
Selsa Khairunisa,2025-09-06,5,Servisenya sangat baik dan ramah terutama mba indah dan makanannya juga sangat enak terutama pastanya
Fajar Apriandi,2025-12-09,5,sarapan dan makan siang makanan luar biasa Terima kasih banyak untuk mbak indah untuk membantu kami selama sarapan
Ananda Citra Rahmadani,2025-09-06,5,untuk makan siang nya bervariasii resto nya pelayan nya ramah ramahh tidak lupa terima kasih untuk caca dan juga reiga pelayanan nya mantap
Jihan Pratiwi Antuke,2025-11-06,5,pelayanan baik dan makanan bervariasi dan staf enak membantu
Kartika,2025-10-06,5,sarapan nya sejauh ini semua menu gooddunya bervariasi dan enak kamarnya juga nyaman
Jeffri Tuhumury,2025-11-06,5,sarapan dan makan siang pepes ikannya enak dan dessertnya menarik dan enak pelayanan di restoran dengan mba indah
Toni Andriansyah,2025-07-06,5,kesini saat sarapan dan makan siang makanan sangat cukup makanan tidak ngebosenin tempatnya nyaman untuk makan siang staf nya juga ramah murah senyum kak elvi dan kak wayan layanan yang baik
Edy Yulek,2025-07-06,5,lokasi yang strategis dan pelayanan yang ramah serta sangat membantu dari mba yanti makanan enak dan bervariasi banyak pilihan nya
Gabe Gusmi Aprilla,2025-07-06,5,ruangan restoran cukup luas makanan enak spagettinya enak sop ikan enak cuma ada masukan buat kue rangi mohon dibuat lembut kak elvi dan kak raffi ramah
Ayu Laras,2025-10-06,5,sarapan dan makan siang sangat memuaskan makanan enak semua pelayanan baik dri kak indah
Febriani Pramesthi,2025-10-06,5,makanan di resto enak pelayanan baik staf dengan nama elvi ramah dan pelayanan baik
Muhammad indra Khasbiarta,2025-11-06,5,untuk makanan nya enak enak semua dilayani dengan kaka caca yang baikk mantapp
Dewi Farida,2025-12-30,4,disini karena ada rapat lokasi bisa jalan kaki ke stasiun cikini
Siti Afina,2025-07-06,5,kamar luas dan nyaman sarapan variatif dan enak enak rasanya pelayanan gercep dan ramah terutama buat mbak elsa terima kasih banyak
Milka Ayu,2025-08-06,5,pelayanan nya kak silma kak intan ramah banget makanan nya enak banget rekomendasi banget
tony Japung,2025-09-06,5,lokasi strategis dkt dengan tmpt makan yang terkenal dan untuk anak muda yang suka dunia mlm dkt dengan hw ambyar
Diyas Dwiya,2025-09-06,5,makanan nya enak pilihan nya bervariari pelayanan ramah indah
Wulan Handadari,2025-12-06,5,sarapan enak makanan bervariasi pelayanan mba elvi baik
Shelly Marcelina,2025-10-06,5,menginap di sini dengan pelayanan yang baik dan makanan yang sesuai selera kami sbg pengunjung untuk kebersihan dan kerapian kamar
Arry Magneto,2025-09-06,5,Menunggang sekali untuk tempat makan makanannya beragam dan cocok dan pelayanannya sangat baik dan memuaskan mbak fani
Prasetiyono Hari Mukti,2025-07-06,5,hotel yang cukup mudah dijangkau di tengah kota jakarta dengan suasana hotel yang sangat baik pelayanan yang cukup ramah kami membantu mbak indah saat menginap di hotel ini
Yulia Pratiwi,2025-12-16,5,makanan nya enak sangat membantu pramu yanti
Nasser Harrasi,2025-11-06,5,Kamarnya sangat nyaman dan bersih sarapan juga enak dan layanan yang sangat baik terima kasih Abdul dan dian bantu saya selama tinggal saya
Gillar Megantara,2025-05-06,4,saya menginap 1 malam tgl 18 4 2025 2 kamar tambah dikasih awal cek masuk jam 12 00 siang ada minuman selamat datang pengalaman kurang menyenangkan 1 ketika cek masuk tidak ditanyakan apakah membawa kendaraan pribadi atau tidak biasanya karcis parkir akan di stempel atau didaftarkan di sistem sehingga gratis ketika cek keluar akhirnya ketika cek keluar dan scan barcode karcis ada tagihan idr 105rb untungnya petugas parkir menyarankan untuk kembali ke fo dan didaftarkan 2 terkait fnb saya pesan layanan kamar minuman namun yang datang tidak sesuai dengan yang dipesan ketika ditanyakan ke pengantar makanan minumannya habis artinya fnb mengganti pesanan tanpa konfirmasi tetap
Vera Nabila Ariyanti,2025-12-06,5,Tinggal disini menjadi pilihan terbaik mba noni memberikan pelayanan terbaik
Bernata Safitri,2025-11-06,5,Pelayanan nya bagus jujur dan luar biasa nyaman kamar nya
Novan Putra,2025-10-06,5,pelayanan dari hotel sangat baik resto makanannya bervariasi
The Andamars Family,2025-07-06,5,sarapannya smuaa enaak nasi goreng kampung enaak kopinya baik yaa kolam renang bersih tempat gym bersih layanannya memuaskan dengan mba elfi
Andi Ilham,2025-11-06,5,Ac ballroom lumayan dingin dan luas crew baquet stanbay mba ditti dan kak ismail
Fasya,2025-12-06,5,Makan siang sangat enak dan menu bervariasi layanan oleh indah sangat ramah dan sangat membantu
cemerlang cemerlang,2025-10-06,5,hotelnya bersih internet kenceng aman kalau sambil bekerja online terima kasih mbak caca yang ramah
Neng Mol,2025-08-06,5,sangat baik dan ramah2 pelayanan y mbak elvy sangat puas makanya sangat saat d mulut
ABDULAZIZ ALGHAMDI,2025-12-09,5,Hotel yang sangat baik i kober mybroom sangat nyaman dan bersih terima kasih untuk keramahan staf ramah dan terima kasih untuk Anda pembicara bahasa arab Abdulmalik
andri anto,2025-12-06,5,sarapan nya enak makanan enak bervariasi top mntb
Wahid Mulyadi,2025-12-06,5,Breakfest cukup banyak menu dan pelayanan caca dkk oke dan ramah
Irvina Dinda Trisa,2025-08-06,5,anak kegiatan nya seru edukatif main tradisional indo jarang2 hotel yang membuat acara game untuk anak2 dengan konsep tanpa gadget untuk anak2
Zaenal Muttaqin,2025-09-06,5,makanannya warisan dan bervarian rasanya nikmat pelayanan ka rani sangat membantu responsif
Ade Suryana,2025-12-06,5,sangat rekomendasi untuk bisnis dan kluarga dan trimakasih atas bimbingan mas abdul selaku gas relision
trian nur nugroho,2025-09-06,5,untuk makananya bervarian dan enak untuk pelayananya dari kak rani sangat membantu dan ramah
Fathur hadiid,2025-07-06,5,Novotel jakarta cikini ruang terbaik pertemuan bagus sarapan dengan makanan bervarian dan minuman dan untuk makan siang penutup nya enak enak dan pelayanan kak rani sangat membantu terima kasih
Nova Arisandy,2025-10-06,5,Hotel yang bagus dan bagus lokasi adalah strategi staf juga sangat membantu dan baik terima kasih kak silma untuk layanan
Irwan Hardiansyah,2025-06-06,3,Saya tidak tinggal di sini hanya ikut seminar selama 3 hari dan tinggal di hotel lain masukannya lokasi toilet cukup jauh dari ruangan seminar lalu untuk mushola nya lembab dan bau tidak ada ventilasi dan ac mushola nya mati tidak ada kipas sholat nya keringetan
Ahmad Aprianto,2025-07-06,5,makanannya semuanya enak nasi goreng semur tahu juga enak pelayanan di pertukaran makanan layanan baik didri mbak indah dan mas adi
Ekaputri Nugrahani,2025-08-06,5,Tempat yang baik makan siang mie goreng nya enak pelayanan resto mbak indab
Haliman,2025-08-06,5,Saya minum kopi dan susu rendah lemak pelayanan sangat ramah dan baik dari kak indah di restoran dan kak yanti
Info Tour,2025-08-06,5,Pelayanan kamarnya rumah khusus menjaga Miss dea sangat bagus sopan bersih bersih
usep saepuloh,2025-10-06,5,Terimakasih mbak elvi layanan nya baik sangan memuaskan makanan nya enak saat di lidah
Lilik Pudjiastuti,2025-12-06,5,sarapan enak banyak pilihan dan pelayanan ramah dari kak indah
Tivany Nindya,2025-08-06,5,kamar nya luas nyaman banget untuk makanan nyaa enak lengkap juga indah
Rahmania G. S.,2025-06-06,5,Kamarnya bagus rapi dan bersih peralatan toilet bau sarapan luar biasa lengkap menawarkan pilihan baik Indonesia dan Barat layanan ramah dan sangat membantu membuatnya sempurna untuk liburan
Bekam Panggilan,2025-10-06,5,bagus hotelnya bersih nyaman dan estetika cantik keamanan cukup luas panjang dan indah
Maharani Ratna P.,2025-11-06,5,kamar nyaman makanan cocok di lidah tempat pertemuan juga nyaman
Nasrullah 22,2025-12-06,5,sarapan alhamdulillah makanan enak yaa pkokx dianjurkan lah enak
Dany Pristiyan,2025-09-06,5,makanannya enak dan lengkap dengan pelayanan yang ramah terima kasih ka indah dan ka wayan
Talitha Raissa,2025-09-06,5,makanan yang disajikan enak kak fani sebagai pelayan juga ramah
ario wicaksono,2025-10-06,5,makanannya luar biasa enak buat mba caca pelayanannya luar biasa
Roni Saputra,2025-10-06,5,makanan enak dan bervariasi dan pelayanan sangat memuaskan elsa dan indah
Putri Salsabila,2025-09-06,5,fasilitas bagus staf ramah dan sarapan di resto bersama kak caca suasananya menyenangkan
Nuny Sulistiany Idris,2025-12-16,5,makanannya enak dan pelayanan mbak caca bagus dan ramah
Raina Shaki,2025-11-06,5,Sarapan nya enak desert lunch enk mbk elvi layanan yang baik
Royani Oya,2025-09-06,5,makanannya enak pelayanannya bagus ramah dan sopan tambahkan mbk fani
yani mulyani,2025-12-06,5,sarapan makanannya enak pelayanannya ramah an indah
Hina Gul Roy,2025-06-06,5,Sebuah teriakan besar keluar untuk Tanisa diva untuk mengurutkan keluar semua sebelum aku bahkan mencapai semua permintaan telah ditangani terima kasih banyak Diane Nureli untuk sambutan hangat benar-benar menghargai keramahan berharap untuk tinggal di sini
eko cahyanto,2025-07-06,5,makanan nya enak semuanya dan saya mencoba ikan tongkol bakar nya mantap sekali terima kasih mba yanti udah saya di restoran
FP Krishna,2025-08-06,5,perjalanan bisnis saya jadi menyenangkan ditemani kenyamanan novotel terima kasih mbak ais buat pelayanannya
RISTINA Damayanti,2025-12-06,5,enak banget bahagia banget bisa bertemu di sini pelayanan dari caca ramah banget
Anis Munfarida,2025-08-06,5,Layanan yang baik dari staf kantor depan terutama mas baim dan mba salma sangat ramah terima kasih juga buat mba yuniar sangat disambut
Enny M,2025-12-06,5,sarapan sejauh enak kopi enak ka elvi layanan baik
Sephia Devi,2025-07-06,5,Lokasinya strategis dekat dengan stasiun untuk sarapan kopi istirahat enak enak ruangan pertemuannya nyaman dan bersih perjamuan nya mba savan sangat responsif
vivi wangka,2025-06-06,5,tinggal singkat di hotel ini adalah pengalaman luar biasa kamar bersih bagus dan nyaman dan dilengkapi dengan fasilitas lengkap kolam renang luar ruangan tersedia untuk bertaruh untuk berenang Anda juga dapat bersantai masuk lobi sambil memesan kopi atau teh dari kafe
Erika Widyaningsih,2025-12-06,5,ruang pertemuan dan layanan di restoran baik terima kasih mbak noni untuk pelayanan yang baik
Aulia Nadira,2025-05-06,5,Buffet makan siang di pertukaran makanan sangat memuaskan rasa dan pelayanan baik oleh mbak rani kapasitas restoran pun besar dan ambiencenya tenang cocok untuk istirahat di tengah pertemuan
Alfitrania Yunivianti,2025-10-06,5,Tempat yang sangat baik lokasi juga varietas makanan masuk sarapan buffet yang sangat lezat nikmat terima kasih Novotel cikini
Clara Pritania,2025-09-06,5,Tempat tinggal yang baik sangat menyenangkan masuk novotel cikini strategis terletak masuk pusat jakarta bersih layanan ramah dan ruang luas ingin kembali ke sini lagi
subarjo marni,2025-06-06,5,untuk tempat nyaman tenang bersih pelayanan dari mbk indah ramah senyum cantik makanan sangat bervariasi rasa enak minuman banyak variasi segar dan panjangkapi dan jg ada makanan untuk anak2 kue sangat bervariasi dan enak
NIKO CAESAR,2025-07-06,5,nyaman sekali bertemu di novotel cikini selain makanan nya enak tapi pelayanan nya juga sangat ramah dan terima kasih mba yanti
nur hayati,2025-09-06,5,Tempatnya strategis makanannya enak termaksasih untuk mba destri atas bantuannya saat di resto
Blue Diamond,2025-07-06,5,Sejauh ini makanannya enak perhotelan nya bagus terutama mbak elvi dan lokasinya strategis tim banquetnya juga selalu menunggu
program crms,2025-09-06,5,Makanan di sini sangat lezat dan ada banyak variasi dan staf sangat membantu terutama rani dan wayan yang melayani masuk dengan cara yang ramah
Istianto Ari Wibowo,2025-09-06,5,kamarnya bagus bersih makanannya juga enak mantap untuk novotel cikini khususnya kak fani
Abdy Ersiu,2025-10-06,5,makanan enak pelayanan sangat baik ruang pertemuan adem dan nyaman
Vera Melania Harianja,2025-11-06,5,staf ramah kak rani koperatif sarapan enak fasilitas bagus
Martinus Nus,2025-10-06,5,sarapan atas mntab pelayanan sngt bagus dri kak elvi dn kak wayan
Yance Rampa,2025-08-06,5,makanan nya enak lezat pelayanan resto nya juga baik pelayan nya ramah dari indah
prasetya paramita,2025-12-06,5,sarapan nya enak pelayanan tabita sangat bagus
Albertini Maas,2025-07-06,4,menu bervariatif sehingga banyak pilihan makanan dan minuman yang enak ruang pertemuan nyaman dan besar pelayanan bagus dan cepat elvi
Maria Krina,2025-11-06,5,sarapannya banyak variasi enak2 rasanya posisinya juga strategis banget
anggi lmgmt,2025-11-06,5,Mereka bahkan memberikan kue ulang tahun gratis untuk teman saya terima kasih
Yessi Ferdina,2025-08-06,5,Pelayanan nya bagus terutama mbak adelia sangat ramah dan membantu selama menginap
Apri Keren,2025-10-06,5,menu sarapan dan makan siangnya variatif dan enak pelayanannya ramah dan santun
Yunita Salaka,2025-07-06,5,pilihan makanan ada bervariasi ada asia barat dan betawi pelayanannya ramah pelayan di resto ramah terima kasih mba indah dan mba rani
Farhana Zakiah,2025-08-06,5,Pelayanan sangat bagus terima kasih kepada mbak adel dan mbak intan atas bantuannya selama kegiatan di novotel
irawan Budi,2025-08-06,5,bisa senang sarapan di novotel karena makanan nya banyak dan enak pelayanan yang baik dan ramah dari mba yanti terimakasih
Zoraya Rachmi Pratiwi,2025-08-06,4,Salah satu hotel dengan kualitas makanan yang memanjakan lidah favorit di daerah cikini terima kasih mb indah dan mas adi
Niken Vintreswari,2025-07-06,5,Selalu nginep di novo karena sarapannya oke banget servisenya mba elvi memuaskan sekali
anatasya febriany,2025-07-06,5,Sangat merekomendasikan untuk pelayanan dan makanannya enak semua terbaik lah dan di layani dengan mba elvi saat sarapan mba elvi yang sangat ramah
Eyeg Seki,2025-12-06,5,kamarnya nyaman makananya enak pelayanan ramah
MuhammadYoga Nugraha,2025-12-23,5,sarapan enak banget dibuat sama kak indah
Agostinho Alves,2025-09-06,5,sarapan dan makan siang di novotel makanan siang barat dan asia sempurna dan desertnya yang sangat baik pelayanaan di resto ada mba indah
Rina Yulianti,2025-09-06,5,layanan yang super makanan yang bervariasi didampingi dengan nyaman layanan dari mbak silma
Made Devianggi Makarasari,2025-09-06,5,makanan enak kak indah dan pak ryan pelayanannya ramah
Joseph Gabriel,2025-06-06,5,Novotel Jakarta Cikini adalah sebuah hotel bintang empat yang terletak di kawasan Cikini Jakarta pusat sebuah daerah yang dikenal dengan warisan budaya dan kedekatannya dengan berbagai tempat menarik hotel ini menawarkan akomodasi modern
Alfa,2025-01-06,5,Kamarnya nyaman dan ACnya cukup dingin untuk membuat kamarnya sangat nyaman mandi cukup panas untuk melepaskan ketegangan otot sebagai anggota emas
Muthiah Khoirunnisa,2025-09-06,5,sarapan dan makan siang enak pelayanan di resto dari kak indah memuaskan
Harancang Pandih Kahayana,2025-07-06,5,resto reccomen ramah ramah dari depan ampe kamar gym besarin dikit
idrus maulana,2025-06-06,5,menginap 2 malam lokasi sangat strategis kamar cukup luas kebersihan baik stafnya sangat membantu gym alat2nya cukup lengkap dan bersih dan kolam renangnya jg bersih
ahmad faqih,2025-09-06,5,Semua menu makan siang nya oke pelayanan nya juga oke pelayanan dari mba caca juga ramah secara keseluruhan oke
Dewi Nur Hidayah,2025-09-06,5,makanannya sejauh ini layanan yang lezat nya oke banget terima kasih mba indah
Refaldi Putra,2025-11-06,5,sarapan enak makanan penutup makan siang enak mbk elvi layanan Tuhan
Nadiyya Defiani,2025-06-06,5,makanan makanan indonesia baratnya ke makanan penutupnya nya lengkap pelayanannya ramah dari seluruh staf resto khususnya ka indah teruskan pekerjaan baik
عبدالوهاب الرشيدي,2025-10-06,5,Sarapan sangat baik Mr Bayu sangat membantu saya senang t ini di sini dan untuk caca terima kasih banyak ur sangat membantu juga
Grapevine,2025-08-06,5,makanannya enak2 dan banyak pilihan pelayanannya juga ramah terutama mba indah
aban mv,2025-10-06,5,layanan yang baik oleh caca untuk meluncurkan makanannya enak bikin nagihh top novotel cikinii
Fithri Iys,2025-08-06,5,hotelnya nyaman dan bersih pelayanan ramah dsambut oleh mba zara yang baik
nita gustiawar,2025-10-06,5,sarapan dan makan siang bervariasi dari Indonesia ke pelayanan barat bagus tetima kasih
Frit Tagihuma,2025-12-06,5,sarapan nya enak untuk pelayanan nya bagus untuk lokasi nya strategis
pmc star,2025-09-06,5,sarapan dan makan siang makanan enak beragam banyak macamnya pelayanan cepat tanggap
Mega AS,2025-06-06,5,baru pertama kali ke novotel jakarta cikini hotel bintang 4 yang terletak strategis di jantung jakarta tepatnya di jl cikini raya menteng hotel ini sangat strategis dekat dengan taman ismail marzuki metropolitan dan rscm serta jalan
surya lemos,2025-09-06,5,menginap di novotel jakarta cikini sangat nyaman makanan sangat bervariasi mulai dari sarapan makan siang makanan semua baik dan staf membantu penuh kak rani
Farid Riyadussolihin,2025-08-06,5,tempat pertemuan oke dan layanan baik resepsi sangat membantu dan ramah terimakasih mas okki
