User Name,Review Time,Rating,Review Text
Arief Dina,2025-11-06,5,sarapan dan makan siang mantap terima kasih mb indah
Untung Priyono,2025-07-06,3,area parkirnya sangat terbatas apalagi tikungan di area parkir sempit tidak bisa sekali jalan harus maju mundur beberapa kali dan tidak ada petugas yang memandu parkir
sabri hadyanto,2025-05-06,5,sarapannya enak layanan kamarnya bagus bertemu dan nginap di sini memuaskan terima kasih dibantu dari staf hotel mba indah dan mba yanti sukses terus novotel cikini dan pertahankan yang sudah baik terima kasih
Fitria Yunita,2025-10-06,5,Layanan yang bagus dan kamar kak catrine ramah pelayanannya mantap banget
putu paris,2025-12-06,5,tempatnya bersih dan modern serta pelayanannya ramah dengan mbak tabitha
henny dewi Wardah,2025-05-06,4,Bertemu di Novotel Jakarta memberikan kesan menyenangkan dimana pelayanan dari mbak adelia sangat baik ruang pertemuan yang tepat dan makanan yang enak perlu di memperbaiki untuk sistem suara di ruang pertemuan terima kasih
Irma Wati,2025-10-06,5,sarapan sangat enak dan nyaman pelayanan juga bagus dari mbk elvi
Rahmagita Azzahra,2025-02-06,5,pasti akan kembali dengan catatan kecil di akhir review ini
Dony Anggara,2025-10-06,5,makanannya enak enak buahnya komplit apalagi mba indah banget
Dhimas Setiadi,2025-08-06,5,Pasta dan menu buffet nya enak pelayanan oleh mba indah juga sangat membantu
IH GS,2025-10-06,5,staf yang membantu terutama mba caca makanan dan minuman rasanya baik layanan kamar juga nyaman
Jamal M Hasan,2025-07-06,5,makanan sangat enak macam macam makanan baru sangat menarik tempat nya nyaman dan bersih pelayanan dari mba fani sangat ramah terimakasih mba fani
Ali sadikin Sadikin,2025-10-06,5,menu enak layanan bagus petugas y ramah2 seger2 indah
Hendy Nurtanio,2025-08-06,5,kamar nyaman dan bersih sarapan enak pelayanan ramab dan bersahabat terima kasih novotel cikini
Maulidia,2025-09-06,5,sarapan nya enak2 suasana nya bagus pelayanan kakak caca oke
chintia lara yanti,2025-12-06,5,makananya enak pelayanannya mantap noni
Hendra Sutisna,2025-08-06,5,Saya dari pemasok Riandra pangan jaya selalu di arahkan dengan baik oleh tim keamanan saat pengiriman makanan ke novotel jakarta cikini
Munafsin Aziz,2025-12-22,1,Tidak ramah bagi yang bawa motor parkir motor irani seuprit nyempil dempet2an jatah parkir gratis cuma dapet 1 kendaraan per kamar padahal sekamar dua di hotel2 lain bisa kok sekamar 2 kendaraan wifi jelek banget
Cathlin Theophilus,2026-01-01,1,mencoba semua dan baru di sini tidak akan merekomendasikan tidak ada parkir masuk cuaca hujan makanan tidak diisi makanan adalah sederhana dan menyesatkan sushi adalah pahit dan makanan laut tidak segar pengalaman buruk keseluruhan
ratri natarini,2025-01-22,1,diluar expectasi ternyata hotel sekelas novotel memiliki kebijakan dan pelayanan front desk receptionis yang mengecewakan pengalaman saya pada saat akan memeriksa masuk untuk 2 kamar menghubungkan pada hari jumat tgl 3 januari saat itu 1 kamar saya sudah bisa memeriksa masuk sementara untuk kamar menghubungkan yang seharusnya saya mendapatkan kamar tsb pada pukul 14.00 saya baru mendapatkan kamar tsb pada pukul 16.00 yang membuat saya kecewa adalah saat petugas front desk wanita pada saat itu resepsionis mengatakan penghuni kamar sebelumnya adalah anggota accor sehingga saya bisa memeriksa keluar pada pukul 14.00 dan kamar baru akan siap pada pukul 15.00 seolah itu adalah mbak
Aleen,2025-07-22,1,Receptionists kasar mereka membuat saya menunggu hanya untuk bertanya tentang pertanyaan sederhana juga mereka meninggalkan bagasi saya masuk lobi selama 10 jam saya memeriksa masuk awal pukul 11 pagi dan meminta receptionists empat kali sebelum saya pergi untuk menempatkan bagasi kami masuk kamar kami ketika itu siap atau untuk menempatkan masuk kamar bagasi dan mereka berkata oke ketika saya kembali pukul 9 malam bagasi kami masih masuk lobi dan ketika saya memberitahu mereka tentang itu mereka mengatakan itu di sini karena saya pergi sebelum memasuki kamar selama sembilan jam bagasi kami masuk duduk lobi untuk siapa pun untuk mencuri
Aditya,2025-02-22,1,Ngo saya sering sekali kegiatan di sini dan rasanya hampir setiap tahun habis ratusan juta untuk novotel cikini tapi staf fo anda yang ini sangat tidak ramah sejak 2024 sampai sekarang 2025 puncak kekesalan saya pada hari ini 24 Januari 2025 saat saya bertanya ingin mengambil titipan barang dari grabsend saya bertanya baik mbak izinkan saya ingin mengambil paket dari grabs lalu si fo kasar dan tidak ramah ini menjawab yang seperti itu di concierge ya pak bukan di sini dengan nada ketus dan nada nada nada nada yang tinggi novotel harus memiliki perawatan khusus untuk staf staf model mbak ini yang sama sekali tidak ramah
Vidia Chairunnisa,2025-02-22,1,ini adalah hotel pertama yang parkirannya tidak terhubung dengan hotel ada pintunya tapi d tutup jam 8 jadi jika anda tidak beruntung saya bisa d gedung parkir dan ada barang anda yang ketinggalan anda harus jalan dari depan ke belakang dan naik lagi untuk ke parkir mobil anda d gedung dimana2 gedung parkir di buka lah menghubungkan sama hotel ngapain d tutup jam 8 ada jam malamnya gitu ngaco
YC K,2025-01-22,1,Ketika kami tiba beberapa menit setelah 2pm kamar kami tidak siap karena tamu lain meminta cek terlambat keluar Anda memprioritaskan memenuhi permintaan mereka masuk biaya penundaan cek masuk kami disepakati waktu masuk yang saya bayar kami harus menunggu selama 30 menit masuk thr lobi kami sudah memiliki hari yang panjang bepergian dengan bayi 5 bulan dan hanya ingin pergi ke kamar kami tetapi harus menunggu masuk lobi selama 30 menit lagi untuk menambahkan bahwa Anda bahkan tidak menawarkan kami minuman sambutan sementara kami menunggu di lobi saya harus meminta satu
Febi Ahmad Hazairin,2025-01-22,1,Saya mau ada ruang pertemuan paket sama nginep sudah datang langsung ke hotelnya saat tidak ada pemasarannya dikasih kartu nama besok halaman ditelpon tidak diangkat jg tidak nelpon kembali di wa udah nelpon ke hotelnya di depan ke pemasaran kata pemasarannya bukan bagian dia tapi harus ke yang namanya brenda ya yang di kartu nama itu diminta orang lain yang bertanggung jawab atau atasannya brenda jg tidak mau ngasih
Aji Maulana,2025-01-22,1,Aku tinggal selama 2 malam fasilitas dan semuanya sangat topnotch namun selama malam terakhir aku tinggal di sana aku memiliki pengalaman terburuk setelah latihan masuk gym pada 11 malam aku berjalan di seberang kolam untuk kembali ke kamarku seorang pria berbaring di tempat tidur terbenam menatap ponselnya aku pikir dia menggosok kaki berbalik keluar dia menggosok kelamin masuk ketidakpercayaan aku beku dan tidak ada orang lain di sekitar jadi aku hanya berdiri di sana sesaat kemudian aku merasa sakit dan bergegas kembali ke kamarku tidak ada staf dan tidak ada CCTV di sekitar
ernesto valen,2025-01-22,1,reservasi resto untuk makan malam acara seafood yang menu utama hummer tidak bisa untuk 2 pax diminta langsung dateng saja giliran langsung dateng menu hummernya tidak tersedia seperti kecewa tidak dianjurkan
imelda pramita,2025-01-22,1,bangun pukul 1 pagi karena merasa gatal ternyata banyak bed bug di kasur yang saya pakai setelah itu saya terjaga sampai pagi karena bed bug terus muncul di bantal dan selimut kamar cukup luas kamar mandi baik aminities sikat gigi comb berkurung kit tidak tersedia di kamar harus minta dahulu ke resepsionis
Munadi Kilkoda,2025-08-22,1,pelayanannya bagus sarapannya enak
Bintang maha Putra,2025-01-22,1,Jalan sempit macet keamanan ditanya songong mau nge gym gaboleh mau renang harus pakai baju renang ditanya jual tidak malah tidak jawab makanan tidak ada yang enak nyesel nginep disini
AGUNG WISNU Kusuma,2025-01-22,1,hotel tidak jelas sok laris manajemen amburadul saya anggota accor emas pesan kamar tgl 16 Mei 2024 untuk memeriksa masuk tgl 17 Mei 2024 non peak season dengan preferensi kamar merokok sampai hotel tgl 17 Mei 2024 sekitar pukul 13:30 lalu menyelesaikan pembayaran kemudian diminta menunggu kesiapan kamar tapi sampai pukul 14 45 belum diberi kunci kamar terima kasih novotel cikini yang telah dengan luar biasa merusak mood kami novotel cikini hotel laris boleh bebas sesuka hati memperlakukan konsumen nya tidak penting itu anggota accor emas karena novotel cikini sdg laris tidak perlu orang lain datang untuk menginap
Nurwalid Akhri Hidayat,2024-01-22,1,sebenarnya dari segi lokasi enak strategis kamar juga enak luas bersih dan nyaman namun ketika waktu berbuka puasa tiba bah kami yang mengadakan pertemuan penuh board tidak kebagian tempat hampir semua meja dituliskan terdaftar memangnya kami yang mengikuti penuh board tidak terdaftar bahkan saat meja masih kosong terdaftar dan ada yang buka puasa di meja tersebut di usir oleh pegawai hotel sangat mengecewakan sangat
Hendi Sutisna,2025-02-22,1,Tolong perhatikan sinyal hp ditempat parkir sampai tidak ada sama sekali semua provaider dihotel lain saja yang parkirnya sinyal di bawah masih bagus
toto armanto,2025-11-22,1,staf hotel arogan terhadap sopir ojol
Adis Arifin,2025-01-22,1,semakin semakin mengecewakan pelayanan novotel cikini jalanan depannya sempit dan macet belum lagi pelayanan kamarnya buruk sekali mirip hotel kelas ecek ecek tidak disediakan sikat gigi dan mandi matematika udah minta sikat gigi 3x baru 1 jam kemudian dateng mandinya jadi telat banget tidak rekomendasi banget harganya mahal pelayanannya buruk
anton wijaya,2024-01-22,1,sikat gigi harus dengan permintaan sudah mau mandi sikat gigi tidak datang2 besok besok tangan mandi baru tidak ada di kamar apa segitu menariknya alasan lama berberbicara keramahan lingkungan sampai tamu selalu kesulitan mendapatkan tangan bersih untuk mandi setelah pertemuan seharian besok saya permintaan supaya selama selama menginap selalu disediakan sikat gigi baru tapitidak pernah ada selama 5 hari harus minta sikat gigi baru kebijakan yang salah fasilitas lain juga dengan permintaan jangan usah nginap di sini kecuali jika Anda adalah aktivis lingkungan orang normal tentu harus bernyanyi jika harus terus2an mengarahkan hal2 sederhana seperti ini serasa nginap di orang-orang yang kehilangan sampah
Nanda Nanda,2024-01-22,1,Huhuhu pelayanan nya parah pdhl saat checkout aku blg kepala charger ku jatoh dibelakang kasur gabisa mengambil trs aku titip dlu nanti aku ambil saat mau ambil lamaa banget ada jam menunggu masa gaada tmpt buat naro barang yang ketinggalan sih sampe harus nyari housekeep yang benahin dulu sumpah tidak ngerti lagi masa yang direvisi kabur semua gaada orang
Nabillah Rahma,2024-01-22,1,minta kamar non merokok dikasih kamar merokok untuk acara kantor dan malah ngomong daftar minta nama untuk kamar biar tidak terjadi begitu lg seperti halo gue sudah bilang diawal kamarnya non merokok semua jika tidak bisa akomodir seharusnya ada komunikasi diomongin saat sudah lengkap ditambah ada kamar karpetnya basah ada tinjut sih diganti beberapa kamar tapi kecewa saja sama komunikasi dan transparansi hotel ke pelanggan
Arsyad Harmain,2024-01-22,1,ini manajemen beneran tidak sih ngurusin parkir daftar parkir untuk kegiatan beberapa hari sampai depan tetap di minta uang parkir acara berkali2 dan tidak cm sehari 3 4hari lebih kadang sekalinya di catet parkir gratis cuma pakai kertas selembar terus besok disuruh bayar lg alasan mungkin bapak cuma daftar sehari lahh bisa koplak ha mau juga gw berdebat sama tukang parkir lah biar juga dengan alasan mereka yang mau konfirmasi tapi uang gw langsung juga dia embat
Poh Chan Khoo (Lorence Khoo),2025-01-22,1,Anda telah memesan layanan kamar dan menunggu lebih dari satu jam untuk datang sarapan tidak memungkinkan Anda untuk mengambil bahkan satu cangkir kopi kembali ke kamar Anda layanan pelanggan begitu tidak fleksibel kaku dan dasar tidak akan pernah mengulangi ini tinggal
Kontoru Kontoru,2023-01-22,1,Parkiran sangat sempit dari parkiran harus jalan ke lobi saya tanya ke keamanan tidak ada akses buat ke lobi harus jalan kaki turun lewat jalur mobil saya cek masuk nunggunya terlalu lama saya memesan ruang eksekutif jam 15 00 kamar juga masih blom siap kecewa banget sama manajemen novotel tidak mau lg deh tinggal disini sangat tidak dianjurkan
Cepys Shd,2024-01-22,1,klo soal fasilitas kamar msh banyk yang lebih baik tapi pelayanan fasilitas parkir yang sempit yang bikin saya sangat kecewa adalahh keamanan arogan dan berkata kurang sopan mhon agar dirahakan lagi bagaimna caranya melayani tamu saya kapok dan tidak akan saya rekomendasikan ke yang lain 21 06 23 07 25
Ronz zylvest,2023-01-22,1,Pakaian baru yang luar biasa ngga nguatin sudah ditulis Pakaian dimasukkan kamar jika sudah selesai tapi tidak pernah dilakukan dan saat diminta kirim juga lama sekali selain hal tsb hari 1 kaos kaki hilang dan berkas isian pakaian dengan tanda tangan saya diganti entah tulisan siapa dan tanpa kaos kaki setelah protes ternyata ada dan dikirim ke kamar hari 2 celana ketukar dengan milik tamu lain sesudah menunggu beberapa jam ternyata ditemukan dari pengakuan michael spv pakaian ternyata dicampur dan dibedakan dari ciri2 baju yang berwarna konyol jika ada yang memberi peringatan sama pasti tertukar mudah2an hari 3
Wassup Rocker,2024-01-22,1,kamar hotel yang mengerikan sangat berbahaya bagi kesehatan dengan Aqi dari 100 membuat itu bahaya kesehatan ac tidak bekerja dengan baik itu baik sangat dingin atau mati masuk 30 tahun pengalaman ini adalah pengalaman terburuk saya sofa memiliki lubang di dalam ac tidak bekerja dengan baik kamar mandi berbau keras bau busuk yang menyebar masuk seluruh kamar mereka tidak bisa melakukan yang terburuk saya pikir oke tempat tidur besar dan nyaman layanan baik-baik saja saya meminta selimut kedua dan mereka memberikannya kepada saya layanan memiliki standar Anda akan mengharapkan tetapi jika Anda tidak bisa bernapas ke kamar Anda karena terlalu dingin udara tidak disaring semua furnitur
Ricky Martinus,2023-01-22,1,kamar jam 16 00 belum siap mobil dijemur diluar alasan parkir penuh disewa pernikahan padahal anggota accorplus platinum telepon resepsi kamar layanan tamu layanan tidak ada yang angkat sekali sarapan jam 9 lewat makanan gelas piring sudah pada kosong
Areta Idarto,2024-01-22,1,1 resepsionis yang menerima saya ketika memeriksa masuk jst secara santai menyerahkan kunci kamar tanpa bahkan repot-repot untuk menjelaskan kepada saya arah mana saya harus mengambil ke lift tata letak tidak mudah untuk mengetahui karena ramp berada di belakang konter saya membawa bagasi besar karena saya tinggal selama delapan hari dua saya memesan salad ayam madu itu datang masuk 30 menit ayam dingin saya tidak tahu apakah itu seharusnya disajikan dengan cara itu dan di baki porsi saya menemukan lada dan wadah garam ketika saya mengambil salah satu dari mereka itu berisi air tuhan tahu apa jenis air yang
pian boni,2025-11-22,1,keamanan hapiz ramah bagett top deh
adham amer,2023-01-22,1,kamar kotor dan bau saya avery pengalaman buruk dengan keluarga dan hotel menurunkan tingkat kami tinggal dan mengatakan akan mengembalikan kami lain kali kita mengunjungi jakart yang tidak pernah saya kira dan makanan di bawah rata-rata mereka melakukan omelet dan makanan lain masuk same pan fryer tanpa membersihkan itu hygeen dari kamar adalah 0 handuk sangat tua sebagian besar staf tidak berbicara bahasa inggris layanan kamar membutuhkan jam untuk datang ke kamar Anda dan sebagian besar waktu Anda harus mengulangi resepsi pesanan memberi kami petunjuk yang salah tentang satu bada di sebelah mereka tidak merekomendasikan sama sekali
Amyramadhani Sri Maradewi,2020-01-22,1,sangat mengecewakan baru saja kejadian kami booking sehari sebelumnya jam 15 jam 27 pihak pemasaran minta ditransfer untuk biaya kamarnya dan kami segera bayar kami datang jam 16 07 kamar belum siap dan pembayaran belum terkonfirmasi resepsiinya saat dikomplain selalu menjawab dan terkesan hakim sangat tidak sopan dan sangat tidak profesional hati2 bagi pengguna korporat terimakasih
Achmad Izal,2023-01-22,1,keamanan nya kurang baguss tidak punya etika uang hasil keringat orng tidak dibayarkan sampai saat ini yang didapat hanyalah janji dan janji kalau emng tidak mampu membayar omng lahh gausah kebanyakan janji karyawan kaya gitu ko masih saja dipakai yang ada merugikan perusahaan saja
Mayang Alethea,2023-01-22,1,hotel pelayanan tidak ramah apalagi fo nya saya seharusnya cekout tanggal 9 desember tapi pada saat saya mau masuk ternyata kamar saya sudah ter cek keluar dari Tgl 8 desember dan kamar sudah terjual dan terisi dengan pihak lain fo sama skali tidak ada yang minta maaf
sanden 654321,2023-01-22,1,parkir susah trus kalau agak rame makanannya selalu habis sudah 3x makan disini abis terus padahal sudah bayar full variasi masakan juga biasa saja dan rasanya juga standar
Robetino Nurdin,2024-01-22,1,Tempatnya bagus tapi sayangnya toieltnya kotor dan bau tidak sedap saya pernah melihat ada karyawan yang sedang membersihkan toilet dan dia cara membersihkannya detail sekali jika tidk salah sebut namanya syahril saat saya ketempat itu lagi knapa saya tidak pernah melihat karyawan tersebut lagi
Republic Detailer,2025-01-22,1,tolong untuk resepsi yang bernama sasa tolong di kasih belajar untuk beretika malayani tamu tidak jetus hakim
Viera Donelly,2022-01-22,1,1 tidak sangat bagus lokasi 2 kamar mandi sangat kotor di atas wastafel di bawah marbel hitam kotor dusun sudut hitam kotor ubin di sekitar WC kotor seperti poo mash di atasnya air terus-menerus bocor di suatu tempat di bawah toilet banjir seluruh kamar mandi lantai 3 kotor dan bau handuk noda kuning besar di karpet masuk di tengah ruangan minum air masuk mengisi botol kaca memberi saya diare dan perut crump hanya membuat saya mengisi mereka mengisi dengan air keran satu-satunya baik yang saya pikir saya bisa mengatakan adalah staf di resepsi dan
Selva Natalie,2023-01-22,1,kamar menginap tidak menyenangkan adalah sedikit kotor dipesan kamar mewah dengan 1 king size tempat tidur yang mengatakan ada sofa tetapi tidak ada meminta untuk pindah kamar tetapi mereka mengatakan penuh tetapi saya masih dapat menemukan kamar yang tersedia masuk aplikasi perjalanan accor website saluran air masuk mandi tidak bekerja berarti saya harus membukanya dan membawa air ke lubang ac tidak dingin pada semua 16 derajat kipas 3 tetapi tidak merasa dingin seperti biasanya saya tidak bisa tahan dingin udara diminta untuk diperiksa tetapi belum diperbaiki tempat tidur adalah kotor banyak noda diminta untuk berubah tetapi mengambil terlalu lama
Hal Jordan,2022-01-22,1,sarapan disuruh scan barcode pilih menu malem sebelumnya tapi besoknya di jam yang dipilih belum dateng2 sudah ditelpon ke operatornya beberapa kali tapi sama saja tidak dateng2
Dela,2022-01-22,1,Saya memiliki harapan tinggi pada hotel ini tetapi sebagian besar dari mereka tidak memenuhi tetapi itu tidak apa-apa saya tidak merekomendasikan hal-hal hotel ini untuk dianggap kebijakan untuk menggunakan fasilitas hotel benar-benar aneh dan membatasi orang keluarga yang bertujuan untuk memiliki staycation wfh Anda perlu memesan reservasi untuk berenang dan ini oke namun Anda sebagian besar tidak akan memiliki kesempatan untuk berenang mengapa seperti saya memeriksa staf mereka menyebutkan hanya tamu s di satu kamar dapat menggunakan kolam renang pada waktu mereka terdaftar bingung biarkan saya menjelaskan contoh masuk kamar tamu
Indra Pratama,2023-01-22,1,punya pengalaman yang sangat buruk mendapat selimut kotor dan masalah AC AC teknis mencuci filter masuk kamar mandi menyebabkan toilet kotor sampai 23:30 masuk malam masalah tidak diperbaiki
BARASMATI,2025-01-22,1,parkir susah keamanan nya lebay ada orang berdiri di parkiriran suruh pindah di curigai alasan CCTV
santo cool,2021-01-22,1,sombong ngantar makanan d suruh ke depan tidak boleh ke lobi manajemen hotel tidak bermutu mencerminkan sombong dan diskriminasi terhadap kaum bawah mau debat tidak masalah mau sampai mana
Mahyudin Halim,2024-01-22,1,sudah tempat parkirnya sempit sinyal susah gk boleh merokok pula di luar parkiriran padahal ruangan terbuka tidak dianjurkan
Bima Ares.,2021-01-22,1,keamanan tidak sopan tamu berkunjung msh diluar loby parkiran tidak diperkenankan masuk kecuali saya dah di loby baru menanyakan ada keperluan apa tidak direkomendasikan
Muhammad Fiqih,2021-01-22,1,masuk kamar merokok kamar 1226 hotel tidak diizinkan untuk vape karena alarm asap meneriakkan ia sekarang 22 22 dan mekanik datang masuk tanpa sopan sangat mengecewakan tidak akan datang lagi ke hotel ini atau novotel apapun terima kasih banyak idiot hotel tidak peduli apa tidak meminta maaf membutuhkan Anda manajer hotel saya menunjukkan ini pada Anda buruk mengelola hotel saya tinggal masuk banyak rantai accor dan saya tidak akan pernah pergi ke novotel lagi
Stevi Gonzales,2022-01-22,1,layanan jujur tidak bagus banget khusus di tempat makanya aduh lagi makan tiba2 lampu dimatiin tidak sopan banget deh tidak recomend da tmpatnya
Ricky Arya,2025-01-22,1,keamanan nya songong semuanya pada tidak sopan nanya baik baik malah ngotot
Imam ghazali,2025-04-22,1,Tidak bisa menjaga privasi pelanggan terutama tidak ada hp
intan purnama,2024-01-22,1,Tidak banget pelayanannya jutek banget mbak2 yang seragamnya biru namanya latifah masa nanya toilet saja jawabnya ketus banget tolong diperbaiki saya tamu loh disini
Baroqah Anton Sulaiman,2024-01-22,1,Semua baik sampai tahu bahwa pintu ke parkir dibatasi operasionalnya sangat tidak nyaman
Raul Monda,2022-01-22,1,Layanan terburuk yang pernah saya temui membutuhkan waktu hampir satu jam untuk minum O e bir kemudian meskipun bartender menulis pesanan makanan saya dia melayani hanya 80 item yang dipesan jangan tinggal di hotel ini
vivo vit,2025-01-22,1,layanan kurang ribet air putih minim restoran sempit
Budi Susanto,2021-01-22,1,menyesal memesan disini beda 1 hari saja naik nya 2x lipat di masa pandemi masih saja sombong lu punya hotel sumpahin tutup lu
T Co,2023-01-22,1,Saya di lantai 10 sinyal istrinya parah tidak novotel cikini tidak novotel gajahmada sama saja
Badr A,2024-01-22,1,Seluruh hotel panas selama bulan madu kami aku harus pindah ke Hilton masuk malam pertama tiba setelah perjalanan panjang dari Jeddah
Raul Molino,2021-01-22,1,Aku tinggal di hotel ini selama 5 hari masuk tahun 40an ini hari kedua aku makan malamku tiba kemarin jam 7 malam masuk sore tapi sarapanku tiba jam 11 masuk pagi sudah 16 jam tanpa bisa makan tidak sepertinya tidak benar atau diterima bagi aku
tony agustiawan,2022-01-22,1,area parkir yang sangat sempit sekali mobil mudah terserempet ke tembok parkiriran
Deni Prasetyo,2023-01-22,1,Maaf ada oknum yang lain mengatasnamakan ovotel buat nipu orang
Leonardo Alexander,2022-01-22,1,Pelayanannya buruk banget lagi makan lampu dimatiin sampah banget layanan nya
no name,2022-01-22,1,Tolong perhatikan akses dari parkir ke lobi jangan lewat luar yang bau busuk sepitank
catherine margono,2025-01-22,1,Tidak ada yang sulit untuk mengeluh pelanggan
Bambang Wibisono,2023-01-22,1,parkir nya sempit dan susah kurang nyaman parkir nya
Dudi Oktora,2022-01-22,1,parkir susah dan sempit saya kecewa
Zahra Destiara,2022-01-22,1,Parkiran sempit keamanan tidak ramah
stevanus guntur,2024-01-22,1,pelayanan nya parah banget
Enny Amin,2021-01-22,1,ruang bawah tanah parkirnya sangat tidak layak
Joko Heratmo,2024-01-22,1,Tidak mendapatkan sikat gigi
Sasli Sunandar,2021-01-22,1,Taman area sangat kecil terutama sudut masuk taman area
Ado Napoleon,2022-01-22,1,Tidak ada sinyal operator hp manapun
Nicke Surjadi,2024-01-22,1,pelayanan sangat buruk
Diaz,2020-01-22,1,kenapa tidak bisa dihubungi
usman_balaiuji usman_balaiuji,2024-01-22,1,tempat parkir sempit
Joko Gani,2024-01-22,1,macet
Muhammad Taufik,2022-01-22,1,banyak minus nya
arya aska,2023-01-22,1,Kamar yang bagus dan sekitarnya
heesun kim,2025-01-22,1,Tidak ada komentar
Achdan Mubarok,2026-01-15,1,hotel terburuk yang pernah saya temui di jakarta pelayanan resto nya super telat dan makanannya tidak ada rasa alias tidak enak
Fawaz Alharbi,2025-10-22,1,CV hotel bersikeras melakukan cek masuk pada pukul 2 meskipun kamar tersedia
S,2024-01-22,1,sangat mengecewakan saya memilih novotel setelah pengalaman buruk saya baru baru ini di beberapa hotel mercur saya pikir dengan harga 25 lebih mahal kualitasnya tetap sama ternyata tidak anda bayar lebih untuk kehilangan kualitas pertama tama handuk yang disediakan robek dan rusak bau rokok yang menyengat meskipun lantainya bebas asap rokok tapi bau ini langsung tercium begitu keluar lift ac nya sangat buruk saya menurunkannya ke 16 c dan menunggu berjam jam untuk mendapatkan suhu ruangan yang nyaman mungkin sekitar 22 23 c lantainya penuh noda dan kotoran ada jamur laukannya kurang bervariasi dan hidangan atau yang sudah kosong tidak akan diisi ulang kecuali anda mengejar
Abel,2025-08-22,1,Karyawannya suka berdansa menggoda
FIDELIA CHANNEL,2025-08-22,2,untuk yang buat pernikahan kurang berkenan foto di lorong kamar saja di usir jangan nginep di sini ngga akan mendapatkan foto bagus
Tim,2025-03-22,2,pengalaman kami di hotel ini sangat sub standar kamar raja mewah memiliki karpet berwarna dan semua jenis remeh dari tamu sebelumnya masuk tambahan a c tidak akan bekerja di masuk check dan pada lembaran masuk kamar mereka mengumumkan perbaikan pekerjaan di hotel lebar a c sistem masuk sore yang AC tidak akan tersedia untuk beberapa jam masuk ini sendiri adalah ketidaknyamanan besar tetapi manajemen hotel tidak melakukan upaya untuk proaktif menawarkan kompensasi apapun kami memberitahu staf resepsi kekurangan masuk kebersihan dan meminta kebersihan untuk vakum
Henry tan,2025-05-22,2,Tidak banyak untuk makan di sekitar hotel area terutama makanan jalanan lokal yang mungkin tidak begitu umum untuk wisatawan ditemukan noda mencurigakan di tempat tidur sheet besi listrik kotor ditemukan sebelum menggunakan jika tidak kaos saya akan permanen berwarna
