User Name,Review Count,Rating,Review Text
tonny siswanto,14,5,salah satu hotel terbaik di tretes dengan sarana parkir yang memadai hall yang nyaman untuk diskusi dan ngopi dengan rekan kerja ataupun dengan keluarga ada kolam renang dengan view pegunungan dan taman bermain anak anak
Aldi Garibaldi,134,4,hotel jadul yang sudah di refaceing sayang saat datang fasilitas kamar belom ready semua kebetulan dapat kamar di bawah dan ndak ada telepon di kamar jadi agak sulit menghubungi petugas nya untuk dinner nya mohon maaf ndak banget
santi net,1,5,suasananya nyaman dan fasilitasnya sudah sesuai dengan harganya sarapannya oke juga dan cukup beragam cocok untuk gathering kantor
Widhoretno Wirasari,130,4,hotel tua dengan pemandangan menakjubkan kamar luas dengan design old fashioned tapi banyak spot foto cantik dan unik boleh jadi tempat healing alternatif bila ingin menikmati udara pagi yang sejuk dengan rerimbunan pohon dan suara jangkrik
ady el cotrex ady el cotrex,54,4,kamar bersih pelayanan ramah ada live musiknya kolam bersih spot foto banyak
1012 Nathaniel Satria,17,5,mantap tidur disini nyaman pemandangannya keren tempatnya luas banyak spot foto yang baguss
Wawan Kurniawan,32,5,hotel bersih untuk bangunan tua lokasi atraktis pemandangan bagus untuk orang tua yang bermasalah dengan kaki tidak dianjurkan karena banyak tangga medan naik turun
Purwa Ningsih,24,3,hotel yang nyaman pemandangan bagus ada spot foto sayang saat nginap menu breakfast kurang variatif dan menu malam yang disediakan cuma nasi mie goreng
PVUK Klaten,110,5,kami memilih kamar deluxe dilantai 2 dengan kamar yang luas bersih kamar mandi luas bersihh komplit tempat tidur empuk bantal nyamann jumlahnya banyak dengan pemandangan gunung dan kota yang luar biasa pelayanan sangat ramah dan sangat membantu untuk pemandangan hotel ini ini mempunyai pemandangan yang sangat indah dengan kolam renangnya dan tamanya sangat recomemded untuk sarapan maaf agak kurang variasi untuk hotel sekelas inna tretes mngkn kedepan untuk sarapan bisa lebih vatiatif terima kasih
Dwi asmi Narita,44,4,hotelnya di bbrp bagian perlu renovasi kamarnya lumayan bersih n nyaman taman n kolam renangnya juara o iya disini ada yang namanya goa jepang tapi aq tidak explore sampai jauh serem hiy
Rizky Amaliana,489,3,biasa saja kamarnya showernya saat tidak bisa dipake kamar mandi juga kotor tapi outdoornya keren ada semacam area kaya di jepang looks like little kyoto gt
PT.BANUFAZA GEMILANG,3,4,sejuk nyaman bersih bikin betah berlama2 kebetulan saat bulan puasa jadi breakfast nya di ganti makan sahur enak2 masakan nya dan deket ke tempat rekreasi air terjun kakek bodo yang elok
Arief Prihartono,100,4,hotel lama tapi masih terawat bersih cuman wifi agak lemot harga relatif banyak digunakan gathering kantor kolam renang bersih
Tanti Rosalia,888,3,saat masuk hotel lobby cukup besar n bagus tempat parkir juga luas kamarnya agak turun ke bawah melalui anak2 tangga kalau ajak orang tua agak worry kamarnya cukup luas meski terlihat bangunannya agak kuno dengan furniture yang mgk mulai perlu diupgrade tapi pengalaman yang gk menyenangkan justru terjadi di kamar mandi karena kurang hati2 punggung ketatap cukup keras sama batang besi yang cukup nongol dibawah kran air mgk perlu dievaluasi fungsi dan keamanannya dari sisi fasilitas dan pemandangan cukup oke apalagi dengan harga yang cukup low budget kita bisa turun tangga lg untuk sampai ke kolam renang dengan pemandangan ala2 jepang view gunung dll makanan simple a la carte tapi rasanya cukup enak lumayan lah bisa jadi opsi liburan yang nyaman di daerah tretes
Alfia Rachma Firnanda,2,5,bagus sekali tempatnya fasilitasnya juga lengkap makanannya enak enak pelayanannya juga the best parah
Cahyo Purwanto,127,4,hotel yang nyaman sejuk asri nuansa pegunungan yang fresh di lereng gunung tempat yang nyaman buat istirahat bersama keluarga atau gathering bersama rekan ktr arisan keluarga pelayanan yang ramah dan cepat menu yang sesuai selera kita dan enak di lidah membuat betah menginap di inna tretes hotel mantap
Isal Riski,19,5,kesini numpang renang tapi liat sekeliling kmarnya bagus juga viewnya gk bikin kecewa dengan harga segitu
EDDY,84,4,tempat cukup menawan suasana sejuk tenang dan nyaman fasilitas kamar lumayan untuk standar room view bagus menghadap gunung harga room dan makanan cukup sesuai
Desi Afifah,8,5,hotel inna tretes sangat layak untuk dikunjungi sebagai salah satu hotel di kawasan prigen inna tretes memiliki view yang menarik yang tidak kalah dengan hotel lain dari sini kita dapat melihat view gunung penanggungan arjuna welirang dan ringgit selain itu hotel ini juga memiliki berbagai fasilitas seperti swimming pool for adult swimming pool for children restaurant mini bar metting room playground dan masih banyak lagi yang menarik
Yuni Arista Damayanti,2,5,hotel bintang 3 yang bagus banget bersih viewnya kereen makanannya enak puas nginep dsni recommended
Dravonny Carline,18,2,kalu ini saya dan kel besar saya kecewa dng hotel ina tidak ada oemberitahuan bahwa akan ada pembersihan kolam renang padahal saya pesan kamar sudah jauh2 hari dari 1 5 bln yang lalu banyak lalat yang besar2 masuk ke kamar baik pagi sianh juga sore hari malam banyak hewan2 kecil masuk kamar
Mery Kurniasari,9,4,view lumayan bagus tapi akses jalan menuju satu ketmp lain banyak tangga naik turun cukup bikin capek buat yang bw anak kecil ato yang pny masalah persendian kaki
Widya Pamungkas,44,4,hotelnya bagus kolam renang nya oke hampir semua bagus hanya pelayanan untuk resepsionis perlu diperbaiki lebih banyak senyum salam sapa saat itu saya mendapat informasi dari teman saya kalau berenang disana 30rb orang saya kesana 3 orang hari minggu siang kemarin lalu saya menyiapkan uang 100rb dan resepsionisnya bilang 120rb lalu suami saya bertanya harga per orang untuk memastikan karena berbeda dengan informasi yang kami terima tapi kami tidak ada masalah dengan harga karena memang sudah selayaknya untuk hotel yang bagus lalu suami saya bertanya harga untuk menginap disana karena kebetulan suami saya jg ada usaha di bidang pariwisata jawabannya agak lama cenderung enggan menjawab namun kami tetap mendapat jawaban mungkin salah kami jg mendapatkan informasi yang salah dan terlalu bersemangat pergi kesana sehingga tidak menghiraukan penampilan kami tapi untuk pelayanan keamanan penyajian dan kenyamanan semua sudah bagus semoga inna tretes lebih baik lagi dan bisa terus bersinergi
febriyanti sri suwariani,144,4,wah kalau ini mahhg pasti oke punya tempat nya ada litlle kyoto tapi jika makan dengan jumlah banyak banyak org hrs di cek di bill nya karena kmrn saat kami kesana hitungan nya kelebihan sampai 200 rb mungkin untuk management inna tretes bisa di perbaiki pelayanan untuk makanannya
inot toni,1,5,kolam renang nya air nya bersih banget pemandangan bagus banget
Dwi Indrayani,5,5,insyaallah suatu saat nanti bisa kembali karyawan nya rama2 kamar nyaman dan sangat memanjakan mata pemandangan nya yang maasyaallah indah sekali
Widya Rahma,2,5,pelayanan sangat memuaskan proses check masuk cepet banget dan masyaallah dapat free upgrade kamar recepsionist nya super ramah dan komunikatif
aji pras,65,5,mantap pemandanganya hotelnya juga bagus ada kolam renang yang airnya tidak berkaporit karena air langsung dari mata air hawanya sejuk banget kamar juga bersih dan harga murah
Nabilah Arfiati,4,5,fasilitas kolam renang luas ada area untuk bermain anak juga spot foto baguss makanan enak enak
roraaa:p,19,5,view nya bagus banget terus tempat breakfast nya juga bagus bisa sambil lihat gunung makanannya juga enak dan kolam renangnya air nya dingin banget dan kolam renangnya ada yang kedalamannya 4 meter seneng banget dech
Mas Yant,897,4,hotel yang nyaman berada di dataran tinggi tepatnya di tretes prigen fasilitas lengkap baik resepsionis maupun pelayan ramah murah senyum bersih parkir luas untuk masakannya tidak mengecewakan baik untuk nginap maupun pelalatihan sangat rekomeded
Rendi Orisa,52,5,sekarang ada spot baru buat foto ada suatu tempat yang di desain ala jepang di sini kalian juga bisa meminjam baju kimono selain itu uniknya lagi ternyata ada goa jepang di area hotel ini tempatnya di area pojok sendiri di bawah lobby hotel
Yulia liuis melani,79,3,disarankan pesan kamar yang deluxe jadi tidak terlalu kuno kotor karena hotel ini kuno sekali perlu peremajaan karena sayang view udara bagus tapi akomodasi kurang mendukung
Devinsa Adelia,1,5,view nya sangat bagus sekalii tempatnya juga luas dan nyamann banget
Sigit Purnomo,26,5,bagus cuma sayangnya tolong di periksa lg sebelum di serahkan ke customer masih ada sampah di tempat sampah seharusnya harus sudah bersih semua pada saat customer mau check masuk
Puji Anto,57,5,hawa dingin yang selalu memyelimuti di tambah nuansa negara sakura jepang khas dengan ornamennya juga pemandangan indah sekitar hotel dengan beground gunung penanggungan
Didi Adi,115,3,tempatnya sih enak cm sayangnya akses ke kamar naik turun tangga jadi agak susah bagi yang barang bawaannya banyak dan kamar kok g ad ac nya
Sany Nosalina,136,5,tiket masuk kolam renangnya 40rb termasuk nasgor migor pilih salah satu kolam renang dewasanya kedalaman 1 4m yang anak2 jg ada outdoornya didesign seperti di onsen jepang ada goa jepangnya juga yang konon bisa nembus ke air terjun kakek bodo panjang 1km tapi belum ada yang berani msk memang agak seram jg diberi kursi dan cermin di depan pintu goanya di dlmnya goa wkt masuk terasa nyess dingin seperti ada ac nya semakin ke tengah semakin kecil jlnnya n katanya si msh ada kelelawarnya di dlmnya kolam renangnya oke cuma untuk kamar gantinya kok masih sederhana n yang bisa dipakai cuma 5 saja sekian deh
Dino Anggara,27,5,tempat menginap yang keren di suguhkan view pepohonan yang lebat n gunung yang keren arena main anak2 ada n juga kolam renang n spot poto juga banyak
Eliseba Yunior,10,5,pelayanan nyaman kamar nyaman lokasi sangat strategis dan ada kolam renang yang sangat mendukung
NOVIA Afifah,35,2,lumayan laa tmpat nya kamar nya juga bersih yang di sayang kan cuma waktu breakfast qt tidak di sediakan banyak menu tapi hanya brapa menu dan qt di batasi 1orang dengan satu menu makan an tidak seperti hotel lain untuk sarapan pasti prasmanan satu lagi yang buat jengkel air panas di kamar mandi ada jam2 nya jadi kalau mau mandi tidak bisa se enak qt pakai air panas jam brapa pun
CAMELIA Putri,3,2,kolam renangnya menarik untuk buat selfie namun kamarnya kurang nyaman dengan harga segitu pelayananya lama harus nunggu berjam jam untuk menunggu kamar yang dibersihkan
Aqila Agustina,27,5,hotel inna tretes harga 300rb an per mlm sudah dpt view yang sangat indah dengan konsep ala2 jepang cocok buat liburan keluarga ada fasilitas 2 kolam renang untuk dewasa dan anak2 ada persewaan kimono juga kamar bersih lgkp ada wifi meski tanpa ac tetep dingin hawa pegunungan tidak nyesel deh menginap disini
Humaira Madjid,120,4,awesome view buka jendela nampak view yang begitu eksotis juga gemericik air yang ke kolam renang menambah syahdu saat kita bermalam disitu
Dari Suparno,222,4,hotel dengan pemandangan yang indah sanyang saya kesana saat hujan terus kamar saya standart luas hanya bangunan lama jadi ya maklum kalau ada yang rusak2 dikit
IWY,100,5,pelayanan ramah tempat bersih air panas sampai jam 11 dan subuh mulai aktif kembali pemandangan lampu kelap kelip dikota sangat rekomended
Imuz Primus,36,3,kamar diatas baru yang 700 1 lumayan bagus 2 toilet airpanas 3 dobel bed dengan busa yang 4 ac berfungsi baik 5 sayang view pemandangan pegunungan sebagian terhalang atap lobby 6 menu makanan kurang sedap 7 spot foto bagus japan style dan pool cocok bwt selfi 8 staff ramah
Sunar Wan,7,5,kamarnya nyaman view bagus tetapi tolong ditambah lagi colokan listrik untuk charge hp karena colokan nya sangat kurang
Riris,12,5,memuaskan sekali pelayanannya makanannya enak enak semua
maharani novi,2,5,puas banget uda 4x ke sana tidak pernah kecewa anak sya smpe g mw plg nambah 2x nginep
Hury Prikitiew,10,5,worth it sih klo pengen renang disini tidak tau kalau mau menginap biaya nya brp kalau pengen renang cukup bayar 40rb dapat kupon buat tuker makanan view buat foto foto bagus tema jepang tempatnya juga bersih
Ghofinday,447,5,habis nganter coustamer grab dari bangil pernah bermalam 2 hari di hotel inna pada tahun 2013 suasana sejuk dingin dan pemandangan nya indah sekali setahu aku hotel inna tretes ini sering di boking oleh pemerintahan buat acara pertemuan dll
Yudah Oktovia,499,5,meskipun termasuk salah satu hotel lama di daerah tretes tapi tetap terawat dengan baik apalagi banyak spot foto yang bagus staf hotel juga ramah dan sigap menanggapi keluhan dari beberapa hotel lama yang ada di tretes saya rasa inna hotel yang terbaik
Bedjo_ 99,835,4,sesuai harga tarif standar hotel bintang 3 view di kamar tertentu cukup bagus
Arief Sadjo,71,4,"nyaman, bersih, jalan-jalan, sekedar berenang, bisa gede, cukup bayar 40.000, free nasgor ala inna buat selfie juga oke"
rikma rara,17,5,kamarnya bersih rapi dan nyaman pelayannya baikk dan staffnya ramah ramah lokasi nya juga strategis sesuai dengan harga
Fachry Putra,18,4,tempatnya bagus dingin hanya perlu lebih memperhatikan kebersihan serta keindahan taman dan juga daerah sekitar kolam renang dan goa jepang
Wisanggeni Bird,5,5,pelayanan sangat ramah buat bpk security sangat ramah dan the best pelayanannya hotel bersih view bagus harga terjangkau hotel budget terbaik di area tretes menurutku
Majidbae,5,4,tempatnya bagus menarik kolam renangnya juga dalam bisa puas main air disertai udara yang sejuk tiket masuk kolam renang juga terjangkau 40rb dapat makan
Adelia Ramadhan,124,5,nyaman fasilitas lengkap kolam renang air panas suka banget recomended parah cocok juga buat stayvacation liburan keluarga atau bareng teman
Fery DP,27,4,perabot didalam kamar hotel sudah tidak layak pakai tapi terbayar dengan suasana sekitar hotel yang bagus view cakep kolam renang bersih taman lumayan bsgus
Channel Inspirasi Bersama,865,5,pesan kamar deluxe kamarnya luas air panasnya selalu on bangunannya baru viewnya langsung ke gunung dapat makan malam dan breakfast deluxe ada ac nya padahal di sana sudah dingin banget jadi ac nya tidak dinyalakan kamar deluxe dekat dengan restorannya ada kolam renang anak dan dewasa cocok untuk menginap bersama keluarga hotelnya luas
mochamad nur,147,3,sangat di sayangkan kamar deluxe dengan harga sgini masih menggunakan tv tabung semoga bisa di update dari fasilitas biar gag ktinggalan oleh hotel lain
emelly chan,49,5,inna tretes hotel yang berada di wilayah tretes ini bener2 bagus dengan nuansa jepangnya udara yang sejuk membuat pengunjung betah berlama lama disini untuk tiket masuk kolam renang cukup bayar 35rb kamu bisa renang sepuasmu dapat 1x makan loh asik kan
Chamdiyatus Sholichah,255,5,kesini saat lagi ada acra silaturrahmi instansi sekolah udara nya dingin banget konsep hotel ina ini ditambahi semcam nuansa jepang jadi kalian yang suka foto bolehlah foto disini karena prmndngn nya bagus banget
Puput Miyashari,104,5,tempat sejuk kolam renang okay nuansa alam keren ada beberapa gazebo dan tempat santai deket kolam renang so keep your feeling with inna
yayu rahayu julia,53,5,mantap tenan jepang ala jawa timur oke punya dijamin yang mau privat family bisa disini kolom renang pun asli dari sumber mata air pengguningan sejuk tenan dan ada sejarahnya juga
Om Deny,110,4,makanan direstoran uenakk asli uenak minus banyak lalat di restonya view ala2 jepang room rate tidak terlalu mahal 350rb up lebih tepatnya
astri ardan,184,4,udaranya sejuk bersih view nya buagus hanya closetnya rusak harganya sesuai di kantong saran agar dibuatkan water park biar anak2 senang
Suprijatiningsih Ningsih,12,5,tempat yang bagus buat santai dan nyaman bersama keluarga besar karena tempat ini memiliki kamar yang luas dan pemandangan indah suasananya menyenangkan dan pemandangan yang menarik suara gemericik air menambah ketentraman hati tempat ini juga menyediakan kolam renang anak 2 maupun kolam renang lokasinya juga mudah dijangkau makanannya cukup enak dan harga tidak terlalu mahal untuk harga kamar standar dibandingkan dengan fasilitas terhitung murah tempatnya bersih dan rapi room servisnya ramah dan sopan yuk cobain deh datang ke lokasi dan rasakan sensasi nya
Rahmad taufik Wahidin,34,5,hotel lama tapi masih oke kamar luas kebersihan lumayan bersih kolam renang dingin dan air nya segar sekali makanan nya pun rasanya oke dan banyak menu nya
Bunda Wniq,262,5,mudah dicari ada kafenya menu kafe byk pilihan harga terjangkau view keren banget kalau malam hari ramah buat anak2 viewnya keren banget bersih pelayanan ramah
muhammad Fahmi,169,4,"suasananya tenang dan sejuk, interiornya klasik seperti rumah di desa, jadi serasa pulang ke desa minusnya hanya colokan untuk charger atau semacamnya sangat minim"
Rinni Ambarwati,36,5,baguss memuaskan banyak spot untuk foto kamar mandi bersih handuk banyak wangi aku di junior room harga sesuai fasilitas
Kurnia Rubi,27,5,semua pegawai hotel sangat ramah dan sopan kamar rapi dan bersih udara di sekitar hotel sangat sejuk pemandangan pun cukup indah kebetulan kamar bisa mendapat pemandangan sunrise cocok untuk menginap bersama keluarga hotel telah melaksanakan protokol kesehatan dengan baik pemeriksaan suhu tubuh ke setiap tamu hotel
Dwi Wijaya S,4,5,tempatnya bagus menyatu dengan alam pegunungan view bagus lgsung terlihat gunung bersiap untuk naik turun tangga di setiap bangunan di hubungkan dengan anak tangga wajarlah karna memang tempatnya di dataran tinggi kesimpulan petugasnya sopan dan ramah tempat yang oke untuk mengisi wkt berlibur pemandangan alami banget
Prili Widyawati,7,5,bagus gk prnh kcewa cuma kamar yang dkt kola renang dewasa airnya agak eror hehe tapi lebihnya oke lah
Reza Maullana,33,5,ada penambahan kelas kamar deluxe namun tempatnya diatas lobby kasihan kalau liburan sama lansia overall beautiful scenery
Ganda Samudra,1576,4,hotel lama dengan segala pernik2 yang masih terbilang jadul namun masih punya daya magis diantara banyaknya hotel2 baru yang bertebaran disekitar terutama cafe yang menghadap ke arah pegunungan disitulah letak dan momen yang tidak akan pernah kita lupakan apakah itu coba datang saja langsung kesana berikutnya anda akan disambut crew yang sangat ramah
Dhika Vian,10,5,anda bisa menghabiskan waktu liburan disini dengan berenang dan hunting foto yang bagus karena tempat nya bagus bersih service memuaskan recomend banget lah pokok nya
Risxa IU,11,5,ke inna tretes buat renang saja receiptionistnya ramah ambil hrga 35k dpt makan airnya jernih worth it banget
Dafa dafa,20,5,suka lihat pegunungan yang segar bagus kalau dilihat dari area hotel inna saya suka banget tempatnya nyaman untuk refresing menghilangkn penat2 di kota
Dewi Lakshita,36,4,tempat yang nyaman untuk menginap ada kolam renang banyak permainan untuk anak sehingga cocok untuk keluarga jg viewnya jg bagus
Andi Stella patarai,120,4,pemandangan sangat bagus sekali dari hotel tapi sayang kamar atapnya banyak yang rusak dan tidak terawat seperti kamar yang kuno saya suka dari spot pemandangan saja
Kearifan Lokal,86,5,klo dihotel ini tidak perlu ada ac hawanya udah auto sejuk karna berada di wilayah pegunungan suasana sekitar sangat indah diwaktu pagi hari kita bisa melihat sun rise langsung dari dalam kamar kalau malam hari ada pemandangan kerlap kerlip lampu dari kota dibawah jadi keren banget kolam renangnya juga bersih n luar good deh
arif rachman,18,4,tempatnya nyaman buat nyantai tempatnya bersih kolam renangnya jg bersih suasana seperti d pedesaan bener pelayanannya jg ramah
Nyta Narda Wijaya,284,4,hotel bintang 3 yang ada ala ala jepang nya dan view yang bagus dan alami hotel yang sangat luas cocok buat menginap bersama keluarga dan orang yang di sayangi di cintai pelayanan nya lumayan bagus juga tempat bersih dan ada lumayan kuno dan ada goa juga di lantai dasar tapi sayang tidak boleh masuk dan kurang terawat untuk kamar oke deh bersih rapi dan nyaman terima kasih salam sukses
Laily Hamida,39,3,untuk view alam nya tidak diragukan lagi tapi kamar bangunan lama nya mungkin harus di renov lagi khusus nya kamar mandi
Hari Setiyono,19,5,tempat ini pemandanganya sangat bagus siang hari ada gunung penanggungan yang indah dan kalau malam hari bisa melihat gemerlapan lampu kota di sekitarnya
Jacky “Jacky Metro Times” Metro Times,152,5,mantap buat liburan keluarga view indah hawanya coy memgundang untuk mengandung ati2 tu kolam renang not bad tapi air nya dingin banget enak si bath up saja berendem air panas kayak jason prince latuhihin tu buatku just my lovely son happy im happy
Sasa Nana,185,5,hotel bintang 3 jaman jepang yang sangat sejuk dengan pemandangan alam dan gunung yang menawan anak2 dan keluarga sangat betah ada spot foto menarik taman bermain untuk anak dan kolam renang anak dewasa
stefani recha,154,5,hotel bagus terawat bersih pelayanan baik dan yang mau berenang saja tanpa menginap bisa dengan membayar hanya 40 rb kita sudah bisa berenang sepuasnya dan mendapat satu porsi makan per tiketnya kita juga bisa menyewa baju khas jepang yaitu kimono seharga 75 rb juga sepuasnya untuk foto foto di taman taman yang sudah di setting seperti di jepang tapi jam tutup kolam renang dan penyewaan baju jam 5 sore
muhammad zainal arifin,148,5,tempat bagus pemandangan indah harga cukup terjangkau fasilitas lengkap malam hari ada hiburan musik
channel mola85,67,4,bagus enak dan nyaman daerah nya sejuk dengan view window pergunungan asri serta kota yang indah untuk di kunjungi pokoknya recommended deh
queen,2,1,hotelnya jelek dan kotor merasa di tipu karena sudah bayar mahal di rate deluxe tapi kamar yang di dapat jauh banget dibawah standart kran air mati ada kecoa dan tomcat korden sobek2 tidak revomended banget kapok
Alif Ghazali,22,5,tempat yang bagus menghadap gunung sembari menikmati pisang goreng risoles dan wedang uwuh beberapa bangunan baru dan masih terdapat bangunan kayu dari zaman belanda
M。Roespita Tatalede,177,4,hotel dengan view yang bagus dengan kolam dan suasana jepang ny kamar luas dan pelayanan yang ramah hidangan ny jg enak sgt cocok skli untuk klg yang lg berlibur
Mojo yudo,35,5,tempat bersih bagus fasilitas lengkap tersediah kamar dan musollah kecil untuk beribadah juga di beri fasilitas tempat sampah di berbagai penjuru agar pengunjung juga ikut membantu menjaga kebersihan tempat ini anda juga bisa mengabadikan momen disini bagi pengunjung yang suka selfi bisa di buktikan sendiri dan dinilai sendiri dari tempat ini terima kasih dan salam blakrak
ANTON GURITNO,44,5,fasilitas lengkap pemandangan bagus ada kolam renang tempat bermain anak lokasi mudah harga terjangkau
orick ae,141,4,pelayanan bagus untuk hotenya yang kamar 34 cukup luas tapi untuk fan exhaustnya tertutup jadi bau selokan dikamar untuk view foto sangat bagus
Indra Bommers Bommers,4,5,tempatnya hotel sejuk dingin pelayanan hotel oke kamarnya bagus siips deh pokoknya
Fanny Rumengan,444,5,hotelnya bagus pelayanannya sangat baik petugasnya ramah dan membantu dan sangat cocok buat tempat istirahat dan berlibur mantapp
AriyaniKiki Official,9,5,pesen kamar type deluxe kamar nya bersih dan wangi best banget se
S Harto,5,5,layanan bagus dan ramah sarapan pagi boleh dinikmati di kamar sambil ngobrol santai dengan keluarga mksh ya semoga byk pengunjung
hendra kusuma,23,4,kamar model lama banget suasana lumayan bagus tv msh pakai tabung air hangat untuk mandi tidak stabil parkir lumayan luas
rika triwusa,10,1,jorok kbersihan buruk nemu anak ular kecil nempel di bathtubs jadi was bawa anak tidur gk tenang reting bagus tpi gk sepadan dengan fasilitasnya smoga ada pningkatan dalam kebersihan
Ali Ridho,1,2,nunggu kamar lama banget kita dri jam 9 nunggu sampai jam 2 kamar yang superior bangunan lama akhirnya kita nambah uang lagi
Anggar Gaming,1,5,kamar nya sangat bersih dan sangat rapih pemandangan nya sangat bagus
Dyah Wulandari,120,5,cocok buat rekreasi keluarga tapi tidak cocok untuk org yang sudah tua karena harus naik turun tangga hawanya dingin banget kolam renang jg dingin
indra mahdi,50,5,hotel dengan panorama alam gunung penanggungan berdiri sejak tahun 1922 di dalam ada peninggalan goa jepang 1943
ABDUL ROHMAN,34,4,hotel yang cocok untuk bersantai bersama keluarga di akhir pekan memiliki banyak ruang aula yang cocok untuk rapat lingkungan yang nyaman dan sejuk terdapat kolam renang dan area bermain anak
Khoirotul Islahiyah,23,5,hotel ini ada situs bersejarah yakni gua jepang udara di sini sangat sejuk dengan pemandangan yang bagus terdapat kolam renang untuk dewasa dan anak anak
Rudijanto Lumanto,209,3,hotel bagus dng pelayanan prima suasana hotel tenang dan nyaman udara nya jg sejuk kamar hotel nya cukup luas dan buat betah
Dwi Sapaningsih,62,5,dateng hanya untuk renang dengan tiket 45k per orang sudah termasuk makan siang
Saneca Meyca,8,5,pegawai nya super ramah sekali tempat nya juga bersih nyaman dan tenang untuk keluarga cocok juga bawa anak kecil banyak area prmainan
Xplode Tan,1095,1,hotel kuno kursi di beberapa bagian sudah mengelupas kolam renang kecil dan juga servis kurang profesional cuma dikasih bangunan seperti gapura jepang kecil i prefer other hotel thank you
Kenno Unwakoly,1,5,saya menginap dikamar deluxe bagus karna bangunan msh baru bersih jg tempatnya untuk harga oke la karyawan jg ramah2
Tantri,319,4,kamar luas dengan fasilitas wifi viewnya juga keren serba hijau sejuk fasilitas kolam renang sarapan pagi oke juga
Satriyo Bagus W,52,5,tempat yang nyaman untuk staycation ada kolam renang dan ada spot foto ala ala jepang rekomended banget buat kalian
Muhammad ali Wakhid,2,5,puas banget dengan pelayanan disini cuma ada beberapa lah yang perlu sedikit diperbaharui dari ac yang kurang dingin wifi yang sering lemot tapi secara keseluruhan masih puas lah
Didik Nurhakim,43,4,hotel dengan nuansa yang alami banyak wisatawan yang berkunjung ke inna tretes karena kangen dengan airnya yang asli dari pegunungan
