User Name,Review Count,Rating,Review Text
Nia Hendratmono,3,5,istimewa deluxe room 20 21 connecting room cocok bagi keluarga anak 6 24 thn namun kamar ini kurang cocok untuk senior orang tua karena harus menaiki tangga hati2 licin saat hujan dari tsi 2 menuju hotel perlu driving skill karena jalanan yang sempit dan menanjak tapi rasa letih hilang ketika tiba di sini lingkungan dan pemandangan hotel luar biasa indah kamar hotel yang bersih dan terawat harga kamar affordable mudah cari makan di luar hotel anak2 sudah nagih untuk nginep di sini lagi
Zacky Ahmad,33,5,lumayan mantap lho apalagi ini termasuk hotel bintang 3 yang kalau dengan taman safari indonesia 2 prigen lumayan dekat dengan catatan lewat jalan tembus kalau harus keluar lewat jalan utama bypass pandaan lumayan jauh tapi kalau lewat jalan tembus memang agak serem sih kalau yang belum terbiasa dengan jalan pegunungan overall untuk hotel mantep deh layanan juga bagus tapi tidak disarankan untuk maaf orang tua yang sulit jalannya atau disabilitas yang harus pakai kursi roda karena di hotel ini banyak sekali tangga2 yang harus dilewati meskipun ada jalan khusus disamping tangga untuk kursi roda cobain rasakan menginap di hotel yang viewnya bagus ada kolam renang dan taman kecil yang mirip mirip di jepang
Wahyu Maskur,1,5,"Pengen stay lama, udara, view kolam renang bikin pengen stay, apa lagi staff berasa raja"
Nurul Fajri Yulfi,7,5,hotel yang support untuk para ibu menyusui yang sedang berjauhan dengan anaknya contoh rapat kerja dan sejenisnya kamar tersedia kulkas kecil butuh freezer bisa dititipkan via resepsionis terima kasih banyak
Sarah Putri Djunaedi,7,5,kesini dapat kamar yang deluxe kebersihan kerapihan dan fasilitas yang ada dikamar semuanya berfungsi dengan baik tanpa kendala kelengkapan mandi lengkap semuanya dapat kamar nomor 016 buka jendela view nya gunung cocok buat quality time sama suami
Budi Yono (Sandek),21,5,ina tretes sudah beberapa kali saya berkunjung ke hotel risort di tretes ini tempatnya sangat bagus asri pemandanganya ada kolam renangnya mantablah buat menginap atau sekedar makan makan dan menikmati hari libur sambil makan makan dan berenang melihat pemandangan sambil ngopi bersama teman2x clube pelayanannya sangat baik dan ramah2x bahkan sampai petugas parkirnya sangat ramah2x the bastlah nex time kita bikin acara di sini lagi
Firda Dwi A.,292,5,hotel dengan pemandangan yang bagus buka pintu langsung pemandangan gunung arjuna furniture seperti lemari lampu dan lain lain terkesan klasik dan lampau untuk kamar tidur sangat bersih begitupun kamar mandi nya stopkontak cuma satu dikamar satunya di kamar mandi breakfast juga enak dan banyak pilihan disertai pemandangan gunung arjuna tapi lokasi kamar agak menyulitkan jika pengunjung nya lansia karena harus naik turun tangga
Rihke Melisa,70,4,saat weekend kemarin pesan type deluxe room dapat lantai dua dengan view gunung via agoda kamar bagus dan nyaman sayang ac di kamar tersebut trouble kalau bisa segera perbaiki breakfast standart rasa cukup enak
Genug Gupron,29,5,kamar nya bagus kemarin booking kamar yang delux double bed ngajak istri saya yang lagi hamil dan anak saya 4 tahun juga hepi banyak spot foto kolam renang juga ada kolam dewasa dan anak tapi sumpah dingin banget kalau kesini saat liburan mending booking dari minggu sebelumnya cepet habis kamarnyam
Olan Aja,5,5,lokasi nya luas kamar nya bagus pelayanan nya maksimal view nya pagi dan mlm segar sekali
Teguh Prasetya,2,5,recommend banget pokoknya apalagi kolam renangnya airnya dari sumber asli dingin banget
krystian febrian,35,5,kamar superior murah dpt bathtub air panas wifi kencang smartv yang bisa liat yutube kafe ada kolam renang taman kelinci kolam ikan sarapan enak² smua kurang apa coba
Kelik Blora,152,4,mantab agak jauh dikit tapi puas dengan lokasinya kolam renang anak² kolam renang 1 2meter bahkan yang 4 meter pun ada bisa loncat indah tempat selfi nya instagramable pokoknya ada little kyoto ada goa jepang dan lain lain fasilitas kamar baik ada air hangat tidak pakai macet macet
Irwanto Honda,16,5,sangat menyenangkan dan sejuk untuk makanan sangat word it sekali untuk kamarnya juga lumayan nyaman dipadukan dengan pemandangan alam yang sangat indah
Indramukswa,57,5,saya menginap di cottage welirang kamarnya cukup besar sudah dapat dinner breakfast juga keluarga bisa beraktivitas tanpa harus keluar hotel
prita aja,209,3,so sori cuma kasih 3 1 saya datang jam 13 00 tepat u cek masuk tapi hmpr 30 menit saya belum bisa masuk kamar 2 i got the junior suite gelatik tapi kamar nya sangat jadul furniture nya semua dari kayu dengan model lama ada kecoa di kamar mandi bbrp spot ada spider web spray bilas kloset nya jg tidak begitu berfungsi and to be honest it was kind a spookie soalnya waktu itu saya tidur sendirian 3 makan pagi nya so so saja sih 4 tidak semua nya 3 sih kolam renang nya asik anak2 senang main banyak ayunan ato spot2 foto bagus pemandangan nya bagus banget kayaknya yang harus diperbaiki point 2 deh asap
Evi Erliyanti,442,4,kamar bagus pelayanan y biasa saja view lumayan memanjakan mata ada tower yang kurang saat posisinya di view yang paling best bisa liat air terjun dari kejauhan menun breakfast lumayan banyak variasinya namun rasanya kurang saat dilidah saya lokasi yang lumayan sejuk nyaman namun tidak ramah untuk lansia yang sakit kaki hehehe
iEbs,20,5,sangat direkomendasikan bagi yang ingin staycation di daerah trawas prigen dan skitarnya tempatnya tenang nyaman banyak spot2 hiburan buat anak2 pemandangan bagus suasana sejuk
elmirr setiawan,183,3,akses ke hotelnya luar biasa banyak tikungan yaa namanya jg puncak gunung kalau kamar nya bagus bersih luas jg apa lg kamar mandinya untuk parkir mobil kurang luas menurut saya sarapannya b saja kamar hotel yang diatas viemnya langsung menghadap gunung
THESSA STAND,149,5,kalau mau cari hotel di kawasan tretes yang masih terawat bersih dan sudah direnovasi yang tetap bertahan ditengah gempuran covid inna tretes reccomended selain hotel surya dan senyiur yang memang tidak ngefek meski pandemi karena owner nya udah tajir melintir ye untuk hotel bumn yang masih terawat bersih silahkan buktikan sendiri inna garuda tretes untuk hotel lain di tretes yang katakanlah sekelas inna pikir pikir dulu deh semua hampir colapse terdampak pandemi hotelnya tak terawat kotor dan pengelolaan mungkin terkendala karena pengurangan karyawan juga so you gaes better check and ricek inna saja dijamin setiap sudut tak terlewatkan soal kebersihan tetap terjaga dan meski tidak seramai dulu justru menjadikan hotel ini nyaman apalagi di bungalow atas yang langsung berhadapan langsung dengan hutan beh exsotis deh pengalaman yang tidak akan dijumpai di hotel lain buktikan deh stay healthy stay happy
Anindya Y.T.,52,5,pelayanannya cepat dan ramah menerapkan protokol kesehatan toilet lobi sangat bersih tiket ke kolam renang dapat ditukarkan dengan nasi goreng atau mi goreng nasi goreng dan mi gorengnya enak kolam renang bersih pada saat saya berkunjung di hari kamis tempat ini sangat sepi ketika saya berada di gazebo dekat kolam renang saya melihat 2 ekor kera ekor panjang sedang berjalan
Ners Dwi_U,4,5,enak pelayanan bagus tempat juga bersih makanan juga enak
Niniez Maniez,102,5,hotelnya bagus walaupun sudah lama kamarnya luas view bagus tidak ada sandal hotel ya guys jdi bawa sendal jepit sendiri dari rumah spot foto mantep kalau bawa anak2 cocok banget byk gazebo dan ayunannya ada tempat olahraganya juga cuman kamarnya kurang bersih semoga lain kali kebersihan lebih diperhatikan lagi ya
daviano axcellio revania,2,3,kolam renang anak rusak
FAJAR SURYANTO,215,3,hotel lama semntara renovasi bagian depan saya hanya datang berenang disini 40rb org dapat nasi goreng atau mi goreng porsi kecil dengan rasa biasa saja wedang uwuhnya 12 500 rasanya enak kolamnya ada 2 khusus anak2 dan dewasa viewnya bagus ada ayunan perosotan dan mainan lain dan ada spot foto taman seperti di jepang
Devie Lestari,66,5,saya check masuk di junior suite room kamar besar lengkap dengan dining table kamar mandi luas lengkap dengan bathtub air panasnya oke banget namun ada banyak kotoran cicak dibalik tirai jendela kamar saya dinner dan breakfast di hotel dan sangat suka dengan taste makanannya pemandangan dan suasana hotel sangat indah dan tenang banyak spot cantik untuk foto2 recommended banget hotel ini untuk yang ingin berlibur dengan suasana pengunungan staff hotel super ramah
My Arjuna Virendra,273,4,hotel lama yang sudah ada sejak 1960 kamar luas namun masih kuno untuk kamar standar tidak pakai ac untuk sarapan biasanya sabtu minggu buffet atau lagi ramai saja kalau sepi kita dikasih menu restoran tapi tidak mengecewakan karena ada menu sop buntut over all hotel oke hanya saja bangunan kuno sama jalan menuju ke hotel terganggu sama tukang ojek yang menawarkan vila dan wanita pengahangat
Ira Yap,330,4,awal datang buka kamar disambut air yang mengalir dari dalam kamar mandi yang meluap dari saluran air sampe pintu kamar untunglah saat kita minta ganti kamar lsg diganti pelayanan lumayan bagus dan ramah jika ada kendala lsg fast respons menu breakfast nya kurang banyak pilihan view dari depan kamar jg bagus banyak spot foto instagramable worth it lah dengan harga segitu
Edi 910gia,1,5,pemandangan bagus pelayanan ramah menu sarapan variatif kamar bersih wi fi saja kadang susah sinyal
VOC Art,96,5,tempatnya nyaman fasilitas nya okey juga ada kolam renang dan view nya cukup bagus tapi ada beberapa kamar terhalang oleh atap hotel kolam renang varian lengkap untuk anak2 maupun dewasa 4m dan untuk air panas ada jam2 tertentu makanan lumayan enak disini juga ternyata ada goa peninggalan jepang tapi dilarang masuk
Sony Liston,167,5,sangat memuaskan pelayanannya bagus sekali saat makan pagi juga di kasih free mie goreng makananya enak kamar saya ambil yang atas jadi viewnya lumayan keren
nurmalia faisal,3,5,staffnya super ramah dan baik bgtt suasana kekeluargaannya dapat banget tempatnya super nyaman cocok untuk keluarga dan anak2 banyak spot foto cantik2 kamarnya juga besar bagus minimalis slama nginap di sputaran jatim disini yang mnurut saya paling nyaman untuk range harga yang mirip2
kartika hardiyanti,3,5,awalnya ragu nginep dihotel ini tapi setelah datang sangat bagus viewnya sangat nyaman dan tenang selain itu ada fasilitas taman serta kolam renang yang cocok buat bawa anak untuk makanan enk tapi variannya sedikit
sayyef ahmad,107,4,hotel yang menyajikan view pegunungan alami karena berbatasan lngsung dengan jurang gunung buat penikmat suasana sepi damai khas pedesaan dikaki gunung wajib dtang kesini saat habis maghrib anda bisa mersakan sprti kkn di desa penari mnjelang pagi hari kicauan burung liar bersahutan silih berganti serasa di aviary pribadi untuk pengelola sdikit saran untuk kamar mandinya agak bau yang bersumber dari lubang pembuangan air kotor tlong diperhatikan over all is okreekk reek mlah buat saya sangat okreek
angga ade sasmita,181,4,nilai tambah buat tempat ini ada di pemandangan gunung langsung d depan kamar mungkin pemandangan nya lebih bagus di musim hujan fasilitas hotel standart dapat peralatan mandi lengkap 2 2 pemanas air teh kopi air panas mandi mungkin berbeda beda untuk jenis kamar g beda kalau d kamar yang lama ada bathub nya tapi sepertinya kurang terawat ada playground kolam anak dewasa kurang nya agak sulit cari makanan di luar hotel kemana2 jauh kalau jalan kaki bangunan nya agak tua
Vina Else,42,2,lokasinya jelas pasti jauh kamarnya besar tapi kamar mandiny bgtu untuk type kamar saya kmrin itu kamarny bagus tpi cm ada 1
Rosalita Hendaryani,102,4,tempat menyenangkan karna udara sangat sejuk dan pemandangan yang indah kolam renang yang bagus airnya bersih dengan view yang bagus menu² dengan cita rasa enak dan banyak spot foto yang instagramable hanya untuk kebersihan kamar harus ditingkatkan lagi seperti tempat teko air panas kebersihan selimut kebersihan closet mgkn klo ada yang cek keluar diharapkan bisa lebih dicek lagi kebersihannya terima kasih
Wilson Pramono,53,3,suasana sejuk makanan rasa biasa saja variasi tidak banyak pelayanan resepsionis terkesan angkuh pelayan penerima tamu ramah kolam renang dingin dan tersedia kedalaman 4m
Aa Sammy,32,5,pelayanannya sangat bagus view nya luar biasa hawanya juga sejuk setiap pagi disini kita dimanjakan dengan senyum manis dari beberapa karyawati dan juga disambut dengan segelas kopi dengan pemandangan alam begitu indah tak hanya brhenti disitu ketika saya bermalam disana ada beberapa spot foto yang bagus diantaranya itu ada spot foto yang bernuansa jepang sangat menarik dan asyik
Rachmat HE,190,4,tempat menginap yang nyaman area parkir cukup luas tempat tidur ada beberapa pilihan dan cukup luas mandi ada yang menggunakan shower dan bathub ruang makan memiliki pemandangan yang menarik makanan juga beragam dengan rasa yang cukup enak ada kolam renang taman bernuansa jepang juga kontur naik turun untuk jalan pagi
Septhalia Prayogo,142,1,sangat tidak worth it harga seharga hotel bintang 4 tetapi fasilitas sangat buruk pelayanan buruk kamar kotor dan bau kaos kaki pegawai yang mengantarkan tidak ada pemanas air tidak diberi welcome drink tidak ada coffee atau tea breakfast makanan buruk sekali ayam goreng tepung tapi tidak ada ayamnya hanya tepung saja omellete tidak ada beef nya kamar mandi kaca sudah hitam handuk berbau apek sangat sangat tidak memuaskan
elona shane,12,5,kamar bersih kebetulan saya pesan kamar type deluxe menghadap tman pelayanan resepsionis parkir dan semua staf ramah lokasi strategis tidak masuk2 gang suasana sejuk meskipun hotelny naik turun tangga tapi terbayar dengan pemandangan yang bagus untuk sarapanny lumayan dan pelayanan staffny ramah dan tanggap
Tamara Gusti Ebtavanny,10,2,pemandangan sekitar bagus sekali tapi kamarnya sangat mengecewakan luas sih kamarnya tapi barang2nya bathup shower tv lemari tirai dll barang kuno dan terkesan singup karena penerangan yang kurang redup makanan juga trkesan asal jadi saja dengan waktu pelayanan yang lama padahal cukup mahal overall mengecewakan sayang sekali untuk view seindah itu
Sigit Setyawan,48,5,selalu menjadi hotel favorit jika berlibur di daerah tretes 3 hari stay mulai tgl 28 10 20 menikamati long weekend bersama sahabat keluarga besar di kamar welirang nuri gelatik superior pelayanan yang memuaskan bisa fleksibel ramah excellent service untuk memenuhi semua permintaan tamu fasilitas hiburan yang sudah mulai lengkap tetap tapi tetap sesuai dengan protokol kesehatan yang berlaku terima kasih management inna tretes hotel resort kita akan kembali menginap disini lagi di kesempatan berikutnya
RIZAL N. SETIAWAN,362,3,salah satu hotel bintang tiga di tretes hotel ini kalau tidak salah milik bumn kamar yang saya tempati kurang bersih banyak semut di deket closet nampan untuk air minum jg berdebu terkesan tidak dibersihkan hotel ini sebenarnya punya view yang bagus terutama di daerah kolam renang oh iya kolam renangnya cukup bersih dan tidak banyak kaporit mungkin karena dari air sumber kolam renangnya terbagi dalam 3 kedalaman dengan kedalaman plg tinggi 4 m dan ada batas yang jelas jadi memudahkan untuk berenang overall saya rasa hotel ini jika dipoles lagi mgkn bisa lebih baik dari ini
Feronika Amelia,149,5,alhamdulillah saat datang ternyata ada promo langsung dapat upgrade kamar ke deluxe kamarnya luas nyaman dan pemandangannya indah banget satu kamar muat untuk 4 orang 2 dewasa dan 2 anak betul betul recommended hotel inna tretes ini gaees
hendri purba,1,4,nyaman untuk keluarga jangan lupa bawa selimut
Ukhti Novie,251,5,booking lwt aplikasi tr l a dapat kamar duluxe no 11 nosmoking area view gunung dikamar tidak dapat sadal air kdg hangat kdg dingin meski sudah full ke titik merah naik tangga terus ke atas sampek ngosan tempat parkir sepeda motor tidak ada atapnya jadi kalau hujan panas ya disitu waktu nginep weekday jadi tidak ada buffet cuma disuruh pilih menu lumayan enak ya rasa kuah soto rawonnya dapat buah bisa minta telor ceplok jg byk spot foto tempat duduk kalau udara sejuk angin spoyy
Putri Yuli Setiawati,6,3,tempatnya sejuk tenang dan bagus saya suka disini cuma sayangnya untuk sajian makanannya kurang banget bagi sekelas hotel kurang bervariasi dan rasanya lebih ke hambar banget nyesel makan di inna saat ada acara potongan sayurnya gede banget untuk capjay tahu kecap hambar ayam kecap dalamnya mentah rasa hambar banget sayuran gtw namanya hambar nasi goreng hambar cuma berasa make msg saja sangat disayangkan kalau misal sekelas hotel kokinya cuma asal masak
A. Kemal. F,689,5,tempat yang saat buat berlibur dan menghilangkan penat bersama keluarga suasananya sangat asri dan nyaman banyak pilihan type kamar yang ditawarkan pastikan sesuaikan dengan kebutuhan anda harga yang ditawarkan juga sangat bersahaja jadi jangan khawatir pelayanan sangat baik dan bagus petugas ramah dan bersahaja kalau bawa keluarga anda tidak perlu kemana mana lagi cukup bermain dan menjelajah fasilitas yang disediakan hotel ini sudah lebih dari cukup banyak taman yang bisa dijadikan objek ber swa foto kolam renang gazebo serta tempat yang paling iconic yaitu little kyoto kalau saat cuaca terang anda bisa ber swa foto dengan latar belakang gunung penanggungan percis di dalam frame sangat bagus selamat berlibur
didik bahagia (Sahabat Property Syariah),502,4,secara umum relatif nyaman dan enak cocok buat keluarga meskipun ketinggian hanya di 750mdpl tetapi lokasi yang masih asri membuat cuaca di malam hari dingin sayang fasilitas kamar minim tak ada kipas atau ac disaat siang berasa panas dan teko elektrik buat masak air tidak tersedia sehingga kalau butuh air panas harus bolak balik pelayanan oke
Yunita Ayu Wulandari,3,4,pelayanan sangat ramah fasilitas kamar lengkap mulai dari kopi alat mandi dan handuknya pun wangi tapi kulkasnya gaada isinya wkwk kemarin sempat saraoan juga disini makanannya kurang sedap semoga kedepannya bisa lebih baik lagi dan bisa menginap disini lagi bersama keluargaa thxyouu
Annisa Noorv,5,4,cukup nyaman hanya saja ruangan kamar yang kami pilih interiornya masih lama paling terasa di kasur dan pintunya pemandangan oke dan suasananya tenang pelayanan dari seluruh stafnya bagus ramah dan sigap
Deasy Nurmayanti,54,4,hotelnya luas kamar luas bersih staff ramah semua view bagus banget kolam renang bersih ada goa jepang nya juga tapi sayang makannya tidak prasmanan mungkin karena lagi pandemi ya untuk rasa makanan enak lah bisa dinikmati next time semoga bisa nginep ke inna lagi
niken wita,20,5,bagus sekali pemandangannya kamar bersih luas kolam renang bersih
ini rizalar,303,4,kamar luas bersih tv masih tabung dengan saluran indovision lokasi sejuk banyak spot foto kolam renang bagus terlihat gunung arjuno makan malam banyak di sekitar dengan harga terjangkau parkir mobil banyak aman pakai traveloka dapat kamar tanpa pemandangan hiks
Wahid Rosyidi,472,5,hotel ini cukup lumayan bagus luas dn cukup banyak spot areanya mau naik turun ke area satu ke yang lain pintu masuk juga bisa dari arah atas juga bisa dari bawah enak wis hotel ini sebagai tempat menginap maupun untuk pertemuan dalam skala besar
Chandra Kurniawan,1,3,pemandangan dan kolam renang superb mohon ditingkatkan akan kebersihan toilet kualitas internet dan variasi cafenya
- twilight -,268,5,hotel berbintang ini tempatnya memang benar2 mendekati bintang di langit saking tingginya lokasi hotel ini fasilitas lumayan ruang makan bagus ada aula besarnya bisa disekat juga jadi 3 aula kecil view di dalam dan sekitar hotel tidak diragukan lagi buat selpi selpi tapi sayang fasilitas toilet kamar mandi di kamar2 sudah saatnya direnovasi biar lebih nyaman dipakai untuk berkendara menuju ke tempat ini perlu jam terbang cukup karena ada 1 lokasi belokan dan tanjakan lumayan tajam di bawah tidak jauh dari lokasi hotel
Andriyani Rosalia (Rosa),131,3,hotelnya siih keliatan mewah tapi untuk menu makan pagi atau siangnya kurang menarik dessertnya jg sedikit untuk kamarnya kurang nyaman ndak ad pengharum ruangannya n temlat tidurnya mnta 3 kasur malah kasur yang bgian bawah nya jg dijadikan kasur yang ada keras klo untuk segi pelayanannya ramah
Syalwia Indiarti,2,5,saya datang keseni liburan dengan keluarga senang sekali di sini bisa bertemu dengan taman kelinci bisa berenang dan main taman pasir
Ima Rahmawati,100,4,hotel dengan view alam yang bagus udara sejuk kolam renangnya bersih adem banget ada cafe rumah pohonnya sangat bagus buat berfoto
Evansjhen Now,376,5,saya menginap pada hari minggu 8 januari 2023 pesan lewat traveloka pesan standart room twin bed sarapan tetapi setelah masuk kamar kamar nya kurang cocok krna kurang modern kata istri saya hehe lalu ditawari oleh fo untuk upgrade dengan harga 125rb ke type deluxe queen bed dengan interior baru kamar ini bersih interior baru tapi penerangan lampu kurang mnurut saya saya ambil di lantai 2 tanpa teras balkon sedangkan kalau di lantai 1 sudah dengan teras dan kursi depan untuk sarapan buffet menu terbatas tapi rasa nya cocok di lidah saya untuk hotel bintang 3 variasi makanan sedikit mungkin karena jauh dari area perkotaan ya beda dengan hotel bintang 3 di sby malang tapi enak semua makanan nya kolam renang besar dan ada tempat foto² di sekitar kolam di hutan dekat kolam juga masih hutan yang sangat asri masih banyak monyet berkeliaran tapi lucu semua akses ke setiap tempat menggunakan tangga jadi buat orang tua atau yang sudah berumur kasian kalau mau jalan² di sekitar resort ini sekian terima kasih
dinda ardian,17,5,kebetulan saya menginap di tipe deluxe suasananya asri kamarnya sangat luas nyaman dan bersih dengan interior uptodate banget untuk breakfastnya juga enak ditambah staffnya ramah ramah banget thankyou
Finance SDT,2,2,proses cek masuk dan cek keluar cepat dan mudah untuk fasilitas luar seperti taman parkir taman bermain anak kolam renang dan spot foto bagus hanya disayangkan interior didalam kamar mulai dari lantai tempat tidur tv tabung toilet semuanya usang dan tidak layak harus segera di renovasi karna kenyamanan dikamar menurut saya paling penting 70 orang yang menginap dihotel akan berada didalam kamar selebihnya 30 menikmati fasilitas luar semoga kedepannya lebih baik
Memoriika,139,5,beneran suka sekali kesini mah hotelnya has a gorgeous view breakfastnya udah buffet sih waktu kemarin dateng tapi pilihan menunya dikit banget terus banyak spot foto yang instagramable juga jadi pilihan favoritlah kalau nyampenya sore bisa menjelajahi hotelnya untuk foto foto kebetulan kemarin request kamar yang tenang dan viewnya gunung langsung kapan lagi bangun tidur langsung disambut pemandangan gunung yakan oh ya fyi setiap hari sabtu malem alias malming ada live music akustikan
WINNER BADMINTON CLUB,6,5,kamar bersih kolam bersih air d km lancar mantap rekomend pokok nya
Indraloka,330,5,hotel inna tretes saat banget buat liburan bersama keluarga di akhir pekan tidak jauh dari dari surabaya di sekitar hotel inna ada sentra kuliner yang lengkap makanan dan jajanan dari sate kelinci sampe wedang ronde yang harganya murah banget padahal di daerah wisata saya mencoba pesan kamar inna tretes hotel lewat aplikasi online ternyata banyak diskonnya satu lagi pegawainya sekarang ramah ramah mulai dari security sampai room service selalu menyapa para tamu pelayanannya juga sudah mulai baik
Fitriya Hanim,25,5,tempat menginap dengan suasana pegunungan yang indah pelayananya ramah dan tanggap jika beruntung sore hari anda akan ketemu kabut yang bikin suasana tambah syahdu pokoknya betah lama² di hotel ini ig fitriyahanim28
Nyi Ayu SPA,36,2,air panas dinyalakn jam 5 subuh sementara azan jam 0340 kamar anak2 tidak ada kulkasnya mau laundry dibilang msh libur ahari ke dia abis diberesin kamarnya anduk tidak dikasih jadi dua anduj untuk 4 org eh saat sampe jkt ditahih anduknya katanya ilang2 mohon perhatiannya
benediktus dwi satya,57,5,lebih ditingkatkan lagi untuk perawatan cagar budaya goa jepang nya sangat disayangkan terbengkalai saat kelokasi staff dan warga sekitar ramah2 fasilitas lain pada umumnya sudah bagus
Tatik Hardiyanti,49,5,hotel inna tretes menawarkan hunian yang lengkap dengan panorama indah gunung tempat bermain bersama keluarga atau rombongan tempat untuk berbincang minum teh dengan background alam yang hijau kamar yang luas dengan teras mengahadapi taman dan udara yang sejuk memungkinkan untuk tidak menyalakan ac selain itu terdapat spot spot foto yang instagramable dan kolam renang serta arena bermain bagi anak anak kamar mandi masih seperti 6 tahun yang lalu bath up san air panas dingin sarapan paginya juga lengkap dari makanan pokok jawa dan roti dan olahan roti harga dari kamar inna tretes juga terjangkau dan tersedia banyak kamar
Silvima lailatur Rifah,51,4,ambil standart room twin bed dapat kamar yang lama lampu kamar belum otomatis tv juga masih tabung dan hanya channel lokal non ac ada pemanas air ada teras plusnya kamar luas bawa anak2 bisa leluasa amnesties standart
Hana Anggi,34,3,dari harganya pricey yaa yang paling murah masih di harga 350an dan itu bangunan lama toiletnya bangunan lama dan kelihatan kumuh yaa palingan yang bagus view nya saja disana juga ada atm cuman gabisa dipake waktu itu kayaknya sih emang udah lama tidak fungsi jadi tidak guna saja ada atm mending nyari tempat yang lain lah yang lebih worth it
dilla Octavia,6,1,breakfast jm 6 sampe jm 10 saya breakfast jm 8 omelet habis airmineral tidak ada adanya infus water kalau yang tidak suka infus water gimana minta ayam goreng lebih dari 1 tidak diperbolehkan pramusaji nya kurang senyum kita minta telor matasapi tidak diperbolehkan karena hanya melayani omelet pdhl kn sama2 telor nya krna kita gk suka omelet jadi kita minta telor matasapi tolong restonya diperbesar krna kita mau makan harus waitinglist tlg porsi makanan nya ditambah karna masih jm 8 udah habis
